,PageNo,Text
0,page_1,"['GB001, Inc.', 'GB001', 'Protocol GB001-2101', 'Version 5.0, 16 Apr 2020', 'CLINICAL STUDY PROTOCOL', 'Protocol Title:', 'A Phase 2a, Randomized, Double-Blind, Placebo-Controlled, Multi-', 'Center Study to Evaluate the Effect of GB001 in Patients with Chronic', 'Rhinosinusitis with or without Nasal Polyps', 'Protocol Number:', 'GB001-2101', 'Compound Number:', 'GB001', 'Study Phase:', 'Phase 2a', 'Short Title:', 'GB001 in Adult Subjects with Chronic Rhinosinusitis', 'Sponsor Name:', 'GB001, Inc., a wholly owned subsidiary of Gossamer Bio, Inc.', 'Legal Registered', '3013 Science Park Road, Suite 200', 'Address:', 'San Diego, CA 92121, USA', 'Regulatory Agency', 'Identifier Number:', 'EudraCT:', '2019-001682-33', 'Version:', '5.0', 'Approval Date:', '16 April 2020', 'Confidential', 'This document contains proprietary and confidential information of GB001, Inc. Acceptance of', 'this document constitutes agreement by the recipient that no previously unpublished information', 'contained herein will be published or disclosed without the prior written approval of GB001,', 'Inc. The following exceptions may occur under the condition that the party has agreed to keep', 'this information confidential: 1) disclosure of information to the extent necessary to obtain', 'informed consent, 2) disclosure of the document to study personnel under your supervision who', 'need to know the contents for conducting the study, and 3) disclosure of the document to', 'appropriate Institutional Review Boards (IRBs)/Independent Ethics Committees (IEC). The', 'foregoing shall not apply to disclosure required by governmental regulations or laws; however,', 'GB001, Inc. shall be promptly notified of any such disclosure.', '1', 'CONFIDENTIAL']"
1,page_2,"['GB001, Inc.', 'GB001', 'Protocol GB001-2101', 'Version 5.0, 16 Apr 2020', ""SPONSOR'S AUTHORIZED REPRESENTATIVE SIGNATURE PAGE"", 'Gossamer Bio Services, Inc. on behalf of GB001, Inc,', 'a wholly owned subsidiary of Gossamer Bio, Inc.', 'Medical Monitor name and contact information will be provided separately.', '2', 'CONFIDENTIAL']"
2,page_3,"['GB001, Inc.', 'GB001', 'Protocol GB001-2101', 'Version 5.0, 16 Apr 2020', 'INVESTIGATOR AGREEMENT', 'GB001-2101: A Phase 2a, randomized, double-blind, placebo-controlled, multi-center study to', 'evaluate the effect of GB001 in patients with chronic rhinosinusitis with or without nasal polyps', 'I, the undersigned, have read this protocol and agree to conduct this protocol in accordance with', 'ethical principles as outlined in the International Council for Harmonisation of Technical', 'Requirements for Pharmaceuticals for Human Use (ICH) guidelines on Good Clinical Practice,', 'any applicable laws and requirements and any additional conditions mandated by a regulatory', 'authority and/or Institutional Review Board/Independent Ethics Committee (IRB/IEC).', 'I acknowledge that I am responsible for the overall study conduct and I agree to personally', 'conduct or supervise the described clinical study.', 'I', 'agree to ensure that the confidential information contained in this document will not be used for', 'any purpose other than the evaluation or conduct of the clinical investigation without the prior', 'written consent of GB001, Inc.', 'Signature', 'Name of Investigator', 'Date', '3', 'CONFIDENTIAL']"
3,page_4,"['GB001, Inc.', 'GB001', 'Protocol GB001-2101', 'Version 5.0, 16 Apr 2020', 'PROTOCOL AMENDMENT SUMMARY OF CHANGES TABLE', 'DOCUMENT HISTORY', 'Document', 'Date', 'Amendment 5 (v5.0)', '16 Apr 2020', 'Amendment 4 (v4.0)', '18 Feb 2020', 'Amendment 3 (v3.0)', '28 Aug 2019', 'Amendment 2 (v2.1)', '02 May 2019', 'Amendment 1 (v2.0.0)', '05 Apr 2019', 'Original Protocol (v1.0.0)', '24 Jan 2019', 'Amendment 5 (v5.0; 16 Apr 2020)', 'This amendment is considered to be substantial based on the criteria set forth in Article 10(a) of', 'Directive 2001/20/EC of the European Parliament and the Council of the European Union.', 'Overall Rationale for the Amendment:', 'The primary purpose of this amendment is to enhance monitoring of liver parameters during the', 'conduct of the trial and to provide guidance to address a pandemic or other global health', 'emergencies.', 'Section # and Name', 'Description of Change', 'Brief Rationale', 'Section 1.3 Schedule of', 'Addition of Week 5 (Visit 4.25)', 'Week 5 and 6 visits were added', 'Activities;', 'and Week 6 visits (Visit 4.5)', 'to enhance laboratory monitoring', 'Section 1.2 Schema;', 'clinical chemistry panels', 'during the first two months', 'Section 4.1.1 Study Design', 'following IP initiation', 'Section 2.3.1 GB001', 'Updated assessment with recent', 'Updated to clarify risk of liver', 'Benefit/Risk Assessment', 'data', 'injury, critical need for liver', 'monitoring, and low threshold for', 'stopping study drug in cases of', 'suspected liver injury', 'Section 10.6 Appendix 6:', 'Added actions (discontinuation of', 'Clarified discontinuation of IP if', 'Liver Safety - Actions and', 'IP) if labs are not able to be', 'repeat labs could not be obtained', 'Follow-up Assessments', 'confirmed within 48 hours and', 'within 48 hours and re-challenge', 'steps for management of IP re-', 'with investigational product in the', 'challenges', 'case of adverse events of interest', 'Section 10.11 Appendix 11:', 'Added language to address global', 'Clarified that certain adjustments', 'Guidance to Address a', 'health emergencies, eg, COVID-', 'to the protocol may be made in', 'Pandemic or Other Global', '19', 'line with Regulatory Authorities', 'Health Emergencies and', 'Guidance in order to ensure the', 'Potential Impact on the', 'safety of subjects, maintaining', 'Clinical Study', 'compliance with good clinical', 'practice (GCP), and minimizing', '4', 'CONFIDENTIAL']"
4,page_5,"['GB001, Inc.', 'GB001', 'Protocol GB001-2101', 'Version 5.0, 16 Apr 2020', 'Section # and Name', 'Description of Change', 'Brief Rationale', 'the risks to trial integrity during', 'the COVID-19 pandemic', 'Global Change', 'Minor revisions to text', 'Administrative clarifications were', 'incorporated, and typographical', 'errors were corrected', '5', 'CONFIDENTIAL']"
5,page_6,"['GB001, Inc.', 'GB001', 'Protocol GB001-2101', 'Version 5.0, 16 Apr 2020', 'TABLE OF CONTENTS', ""SPONSOR'S AUTHORIZED REPRESENTATIVE SIGNATURE PAGE"", '2', 'INVESTIGATOR AGREEMENT', '3', 'PROTOCOL AMENDMENT SUMMARY OF CHANGES TABLE', '4', '1.', 'PROTOCOL SUMMARY', '11', '1.1.', 'Synopsis', '11', '1.2.', 'Schema', '13', '1.3.', 'Schedule of Activities', '14', '2.', 'INTRODUCTION', '18', '2.1.', 'Study Rationale', '18', '2.2.', 'Background', '18', '2.3.', 'Benefit/Risk Assessment', '19', '2.3.1.', 'GB001 Benefit/Risk Assessment', '19', '2.3.2.', 'Study Design Benefit/Risk Assessment', '20', '3.', 'OBJECTIVES AND ENDPOINTS', '21', '4.', 'STUDY DESIGN', '23', '4.1.', 'Overall Design', '23', '4.1.1.', 'Study Design', '23', '4.1.2.', 'Unscheduled Visit', '24', '4.2.', 'Scientific Rationale for Study Design', '24', '4.2.1.', 'Study Population', '24', '4.2.2.', 'Choice of Control Group', '25', '4.2.3.', 'Efficacy Endpoint Selection', '25', '4.3.', 'Justification for Dose', '25', '4.4.', 'End of Study Definition', '25', '5.', 'STUDY POPULATION', '26', '5.1.', 'Inclusion Criteria', '26', '5.2.', 'Exclusion Criteria', '26', '5.3.', 'Randomization Criteria', '29', '5.4.', 'Screen or Run-In Failures', '30', '6.', 'INVESTIGATIONAL PRODUCT', '30', '6.1.', 'Investigational Product Administered', '30', '6', 'CONFIDENTIAL']"
6,page_7,"['GB001, Inc.', 'GB001', 'Protocol GB001-2101', 'Version 5.0, 16 Apr 2020', '6.2.', 'Preparation/Handling/Storage/Accountability', '31', '6.3.', 'Randomization and Blinding', '31', '6.3.1.', 'Randomization', '31', '6.3.2.', 'Assignment of Investigational Product Bottle Numbers', '31', '6.3.3.', 'Unblinding of an Individual Subject', '31', '6.4.', 'Investigational Product Compliance', '32', '6.5.', 'Concomitant Therapy', '33', '6.5.1.', 'Prohibited and Restricted Medications Prior to the Screening Visit and', 'Throughout the Study', '33', '6.6.', 'Dose Modification', '33', '6.7.', 'Intervention After the End of the Study', '33', '7.', 'DISCONTINUATION OF INVESTIGATIONAL PRODUCT AND', 'SUBJECT DISCONTINUATION/WITHDRAW', '33', '7.1.', 'Discontinuation of Investigational Product', '33', '7.1.1.', 'Pregnancy', '34', '7.1.2.', 'Liver Safety', '34', '7.2.', 'Subject Withdrawal from the Study', '34', '7.3.', 'Lost to Follow-up', '35', '8.', 'STUDY ASSESSMENTS AND PROCEDURES', '35', '8.1.', 'Efficacy Assessments', '37', '8.1.1.', 'SNOT-22', '37', '8.1.2.', 'Computer Tomography (CT)', '38', '8.1.3.', 'Bilateral Endoscopic Nasal Polyp Score', '38', '8.1.4.', 'Disease-specific, Daily Symptom Assessments', '39', '8.1.5.', 'Smell Test: University of Pennsylvania Smell Identification Test (UPSIT)', '39', '8.1.6.', 'CRS Exacerbation', '40', '8.1.7.', 'Visual Analog Scale (VAS)', '40', '8.1.8.', 'Nitric Oxide Measurement', '40', '8.1.9.', 'Other Assessments', '40', '8.2.', 'Safety Assessments', '41', '8.2.1.', 'Physical Examinations', '41', '8.2.2.', 'Vital Signs', '41', '7', 'CONFIDENTIAL']"
7,page_8,"['GB001, Inc.', 'GB001', 'Protocol GB001-2101', 'Version 5.0, 16 Apr 2020', '8.2.3.', 'Electrocardiograms', '41', '8.2.4.', 'Clinical Safety Laboratory Assessments', '41', '8.3.', 'Adverse Events, Serious Adverse Events, and Adverse Events of Interest', '42', '8.3.1.', 'Time Period and Frequency for Collecting AE and SAE Information', '42', '8.3.2.', 'Method of Detecting AEs and SAEs', '42', '8.3.3.', 'Follow-up of AEs and SAEs', '43', '8.3.4.', 'Regulatory Reporting Requirements for SAEs', '43', '8.3.5.', 'Pregnancy', '43', '8.3.6.', 'Death Events', '43', '8.3.7.', 'Disease-Related Events and/or Disease-Related Outcomes Not Qualifying as', 'AEs or SAEs', '43', '8.4.', 'Treatment of Overdose', '44', '8.5.', 'Pharmacokinetics', '44', '8.6.', 'Pharmacodynamics and Biomarkers', '45', '8.6.1.', 'Nasal Biomarker Sample', '45', '8.6.2.', 'Blood Biomarker Analyses', '45', '8.6.3.', 'RNA Transcriptome Research', '45', '8.7.', 'Pharmacogenetics', '46', '9.', 'STATISTICAL CONSIDERATIONS', '46', '9.1.', 'Statistical Hypotheses', '46', '9.2.', 'Sample Size Determination', '46', '9.3.', 'Populations for Analyses', '46', '9.4.', 'Statistical Analyses', '47', '9.4.1.', 'Efficacy Analyses', '47', '9.4.1.1.', 'Primary Efficacy Analysis', '47', '9.4.1.2.', 'Secondary Efficacy Analysis', '47', '9.4.2.', 'Safety Analyses', '48', '9.5.', 'Interim Analyses', '48', '10.', 'APPENDICES', '49', '10.1.', 'Appendix 1: Regulatory, Ethical, and Study Oversight Considerations (site', 'responsibilities)', '49', '8', 'CONFIDENTIAL']"
8,page_9,"['GB001, Inc.', 'GB001', 'Protocol GB001-2101', 'Version 5.0, 16 Apr 2020', '10.1.1.', 'Regulatory and Ethical Considerations', '49', '10.1.2.', 'Informed Consent Process', '49', '10.1.3.', 'Data Protection', '50', '10.1.4.', 'Dissemination of Clinical Study Data', '50', '10.1.5.', 'Data Quality Assurance', '50', '10.1.6.', 'Source Documents', '51', '10.1.7.', 'Study and Site Closure', '51', '10.1.8.', 'Publication Policy', '52', '10.2.', 'Appendix 2: Clinical Laboratory Tests', '53', '10.3.', 'Appendix 3: Adverse Events: Definitions and Procedures for Recording,', 'Evaluating, Follow up, and Reporting', '55', '10.3.1.', 'Definition of AE', '55', '10.3.2.', 'Definition of SAE', '56', '10.3.3.', 'Adverse Events of Interest', '56', '10.3.4.', 'Recording and Follow Up of Adverse Events and Serious Adverse Events', '57', '10.3.5.', 'Reporting of SAEs', '59', '10.4.', 'Appendix 4: Contraceptive Guidance and Collection of Pregnancy', 'Information', '60', '10.5.', 'Appendix 5: Genetics', '64', '10.6.', 'Appendix 6: Liver Safety - Actions and Follow-up Assessments', '65', '10.7.', 'Appendix 7: Visual Analog scale (VAS)', '68', '10.8.', 'Appendix 8: ACQ-5 Questionnaire', '69', '10.9.', 'Appendix 9: SNOT-22 Questionnaire', '72', '10.10.', 'Appendix 10: Prohibited and Restricted Medications and Treatments', '74', '10.11.', 'Appendix 11: Guidance to Address a Pandemic or Other Global Health', 'Emergencies and Potential Impact on the Clinical Study', '79', '10.12.', 'Appendix 12: Abbreviations', '80', '10.13.', 'Appendix 13: Protocol Amendment History', '83', '11.', 'REFERENCES', '91', '9', 'CONFIDENTIAL']"
9,page_10,"['GB001, Inc.', 'GB001', 'Protocol GB001-2101', 'Version 5.0, 16 Apr 2020', 'LIST OF TABLES', 'Table 1:', 'Investigational Product Formulation by Treatment Group', '30', 'Table 2:', 'Endoscopic Nasal Polyp Score', '39', 'Table 3:', 'Protocol-Required Safety Laboratory Assessments', '53', 'Table 4:', 'Liver Safety Laboratory Assessments', '54', 'Table 5:', 'Liver Chemistry Criteria Requiring Additional Monitoring with Possible', 'Interruption of Investigational Product', '65', 'Table 6:', 'Liver Chemistry Criteria Requiring Investigational Product Interruption and', 'Additional Monitoring', '66', 'Table 7:', 'Prohibited Medications and Treatments', '74', 'Table 8:', 'Restricted Medications Associated with an Increased Risk of Liver Injury', '75', 'Table 9:', 'Prohibited Medications Associated with CYP3A4 Induction or Inhibition', '76', 'Table 10: Prohibited Food and Herbal Supplements Associated with CYP3A4', 'Induction or Inhibition', '78', '10', 'CONFIDENTIAL']"
10,page_11,"['GB001, Inc.', 'GB001', 'Protocol GB001-2101', 'Version 5.0, 16 Apr 2020', '1.', 'PROTOCOL SUMMARY', '1.1.', 'Synopsis', 'Protocol Title: A Phase 2a, randomized, double-blind, placebo-controlled, multi-center study to', 'evaluate the effect of GB001 in patients with chronic rhinosinusitis with or without nasal polyps', 'Short Title: GB001 in adult subjects with chronic rhinosinusitis', 'Rationale:', 'GB001 is a highly potent and selective oral prostaglandin D2 receptor (DP2) antagonist. DP2 is', 'expressed on a variety of cells implicated in the allergic process including eosinophils, basophils,', 'and epithelial cells (Kupczyk, 2017; Singh, 2017) as well as Group 2 innate lymphoid cells', '(ILC2) and T Helper cell type 2 (Th2) cells (Kato, 2019). GB001 is being developed as a once-', 'daily oral add-on maintenance treatment for patients with moderate to severe eosinophilic asthma', 'and related diseases.', 'The purpose of this Phase 2a study is to evaluate the efficacy, safety, pharmacokinetics (PK),', 'and pharmacodynamics (PD) of GB001 compared with placebo in patients with chronic', 'rhinosinusitis with or without bilateral nasal polyps (NP).', '11', 'CONFIDENTIAL']"
11,page_12,"['GB001, Inc.', 'GB001', 'Protocol GB001-2101', 'Version 5.0, 16 Apr 2020', 'Objectives and Endpoints:', 'Objectives', 'Endpoints', 'Primary', 'To evaluate the effect of GB001 on', 'Change from baseline to Week 16 in SNOT-22', 'the Sino-Nasal Outcome Test-22', '(SNOT-22)', 'Secondary', 'To evaluate the effect of GB001 on', 'Change from baseline to Week 16 in', 'reducing opacification of the sinuses', 'opacification of sinuses as measured by', 'as measured by CT scan', 'Lund-Mackay score on CT scan', 'To evaluate the effect of GB001 in', 'Change from baseline to Week 16 in NPS', 'the treatment of bilateral NP by', 'Time to first response (> 1 point improvement', 'assessment of the endoscopic nasal', 'from baseline) in NPS', 'polyp score (NPS) in a subset of', 'patients with nasal polyps', 'To evaluate the effect of GB001 in', 'Change from baseline to Week 16 in nasal', 'improving patient reported symptoms', 'congestion (NC)', 'Change from baseline to Week 16 in total', 'symptom score (TSS)', 'To evaluate the effect of GB001 in', 'Change from baseline to Week 16 in UPSIT', 'improving sense of smell (University', 'of Pennsylvania Smell Identification', 'Test, UPSIT)', 'To evaluate the effect of GB001 on', 'Time to first CRS exacerbation, defined', 'chronic rhinosinusitis (CRS)', 'as deterioration of CRS symptoms', 'exacerbation', 'requiring treatment with an antibiotic,', 'an anti-inflammatory drug, or a symptom', 'reliever; an Emergency Department visit;', 'or hospitalization', 'To evaluate the safety and', 'Incidence of treatment-emergent adverse', 'tolerability of GB001 compared with', 'events (TEAEs)', 'placebo', 'Change from baseline in laboratory,', 'electrocardiogram (ECG), and vital signs', 'parameters', '12', 'CONFIDENTIAL']"
12,page_13,"['GB001, Inc.', 'GB001', 'Protocol GB001-2101', 'Version 5.0, 16 Apr 2020', 'Overall Design:', 'This is a Phase 2a, randomized, double-blind, placebo-controlled, multi-center study to evaluate', 'GB001 in patients with chronic rhinosinusitis with or without bilateral nasal polyps (NP).', 'A schematic of the study design is presented in Section 1.2. All subjects will be maintained on', 'a', 'stable background therapy of mometasone furoate nasal spray for the duration of the study.', 'Number of Subjects:', 'This study will randomize approximately 100 subjects, with approximately 50 per treatment', 'group. Approximately 64 subjects will have presence of nasal polyps (chronic rhinosinusitis with', 'nasal polyps [CRSwNP]), and approximately 36 subjects will have absence of bilateral NP', '(chronic rhinosinusitis without nasal polyps [CRSsNP]).', 'Intervention Groups and Duration:', 'Treatment groups:', 'GB001 40 mg once per day (QD)', 'Matching placebo once per day (QD)', 'Total duration for study participation per subject is 24 weeks (includes a Screening visit;', 'followed by up to 4-weeks Run-in period to allow for collection of baseline Diary data;', 'a 16-week Double-Blind, Placebo-Controlled period; and 4-week Follow-up period).', 'Independent Data Monitoring Committee (IDMC): No', '1.2.', 'Schema', 'Run-in', 'Up to 4', 'weeks', 'Double-Blind, Placebo-Controlled Period', 'Follow-up', 'GB001 40 mg', 'n=50', 'Placebo', 'n=50', 'Visit', '1', '2', '2.5', '3', '3.5', '4', '4.25', '4.5', '5', '6', '7', 'Follow-up', 'Week -4', 'o', '1', '2', '3', '4', '5', '6', '8', '12', '16', '20', 'Note: Randomization will be stratified by country, the presence or absence of NP (CRSwNP and CRSsNP), and the', 'presence or absence of comorbid asthma among CRSwNP subjects. The CRSwNP stratum will consist of', 'approximately 64 subjects, and the CRSsNP stratum will consist of approximately 36 subjects.', '13', 'CONFIDENTIAL']"
13,page_14,"['GB001, Inc.', 'GB001', 'Protocol GB001-2101', 'Version 5.0, 16 Apr 2020', '1.3.', 'Schedule of Activities', 'Procedure', 'Notes', 'If', 'If', 'Follow', 'Visit', '1', '2', '2.5', '3', '3.5', '4', '4.25', '4.5', '5', '6', '7', 'needed', 'needed', 'up', 'Every visit window +/- 3 days', '20 or', 'If', 'If', '(except for visit 3 which is +/- 2', 'Week', '-4 to -2', '0', '1', '2', '3', '4', '5', '6', '8', '12', '16', 'as', 'needed', 'needed', 'days); The Screening period', 'needed', 'includes up to a 4 weeks Run-in', 'period', 'Consent form can be obtained', 'Written informed consent', 'X', 'prior to Visit 1.', 'Demography', 'X', 'History of nasal symptoms', 'Medical history', 'X', 'should be documented. See', 'Section 5.1 inclusion criterion 5.', 'Surgical history', 'X', 'Specify type of surgery in source', 'document and eCRF.', 'Specify surgery number, type,', 'Prior treatment history', 'X', 'date.', 'Smoking and alcohol use history', 'X', 'Concomitant medication', 'X', 'X', 'X', 'X', 'X', 'X', 'X', 'X', 'X', 'X', 'Complete physical examination', 'X', 'X', 'X', 'X', 'Visual assessment to determine', 'Assess presence of nasal polyps', 'X', 'presence of nasal polyps by', 'anterior examination.', 'Inclusion/exclusion criteria', 'X', 'Randomization criteria', 'Efficacy', 'Sino-Nasal Outcome Test-22 (SNOT-', 'X', 'X', 'X', 'X', 'X', '22)', '14', 'CONFIDENTIAL']"
14,page_15,"['GB001, Inc.', 'GB001', 'Protocol GB001-2101', 'Version 5.0, 16 Apr 2020', 'Procedure', 'Notes', 'If', 'If', 'Follow', 'Visit', '1', '2', '2.5', '3', '3.5', '4', '4.25', '4.5', '5', '6', '7', 'needed', 'needed', 'up', 'Every visit window +/- 3 days', '20 or', 'If', 'If', '(except for visit 3 which is +/- 2', 'Week', '-4 to -2', '0', '1', '2', '3', '4', '5', '6', '8', '12', '16', 'as', 'needed', 'needed', 'days); The Screening period', 'needed', 'includes up to a 4 weeks Run-in', 'period', '* Only if it occurs after visit 5. If', 'CT scan cannot be completed on', 'X', 'CT scan', '1', 'X', 'X*', 'X*', 'day of visit, it must be completed', 'within 3 calendar days of visit.', '1Prior to 1st dose', 'X', '*Only in subjects with presence', 'Nasal endoscopy', 'X*', 'X*', 'X*', 'X*', 'of NP at screening by anterior', 'examination.', 'Nasal nitric oxide (nNO) and', 'Nitric oxide test', 'X', 'X', 'X', 'fractional exhaled nitric oxide', '(FeNO) will be measured.', 'University of Pennsylvania Smell', 'X', 'X', 'Identification Test (UPSIT)', 'Nasal symptoms assessment (review)', 'X', 'X', 'X', 'See Section 8.1.4', 'Visual Analog Scale (VAS)', 'X', 'X', 'Asthma Control Questionnaire (ACQ-', 'X', 'X', 'Only in subjects with asthma', '5)', '(Section 10.8)', 'CRS exacerbation review', 'X', 'X', 'X', 'X', 'See Section 8.1.6', 'Safety', 'AE/SAE recording (if any)', '*', 'X', 'X', 'X', '*See Section 8.3.2', '12-lead electrocardiogram', 'X', 'X', 'X', 'See Section 8.2.3', 'X*', 'X*', '*Height and weight to also be', 'Vital signs', 'X*', 'X', 'measured', 'Laboratory Testing', 'S = Serum U = Urine. If urine is', 'Pregnancy test (women of child-', 'S', 'U', 'U', 'U', 'U', 'U', 'U', 'U', 'U', 'U', 'bearing potential only)', 'positive, collect serum to', 'confirm.', '15', 'CONFIDENTIAL']"
15,page_16,"['GB001, Inc.', 'GB001', 'Protocol GB001-2101', 'Version 5.0, 16 Apr 2020', 'Procedure', 'Notes', 'If', 'If', 'Follow', 'Visit', '1', '2', '2.5', '3', '3.5', '4', '4.25', '4.5', '5', '6', '7', 'needed', 'needed', 'up', 'Every visit window +/- 3 days', '20 or', 'If', 'If', '(except for visit 3 which is +/- 2', 'Week', '-4 to -2', '0', '1', '2', '3', '4', '5', '6', '8', '12', '16', 'as', 'needed', 'needed', 'days); The Screening period', 'needed', 'includes up to a 4 weeks Run-in', 'period', 'X', 'X', 'Hematology with differential', 'X', 'X', 'X', 'See Appendix 2 (Section 10.2).', 'See Appendix 2 (Section 10.2).', 'Coagulation test (INR only)', '*Includes INR at Visit 2', 'If Hepatitis C test is positive or', 'Hepatitis B surface antigen and', 'X', 'indeterminant, a confirmatory', 'Hepatitis C antibody', 'test will be reflexively performed', 'to confirm the results.', 'See Appendix 2 (Section 10.2),', 'Table 4 and Appendix 6', '(Section 10.6). Includes total bile', 'Clinical chemistry', 'X', 'X', 'X', 'X', 'X', 'X', 'X', 'X', 'X', 'X', 'X', 'X', 'acids at every visit.', 'If ALP > 1xULN, include', 'fractionation of ALP', 'Urinalysis', 'X', 'X', 'X', 'See Appendix 2 (Section 10.2).', 'Nasal mucosal lining fluid sample', 'X', 'X', 'X', 'See Section 8.6.1.', 'Subject to record time of last', 'morning dose taken at home prior', 'to Week 4, 12, and 16 visits. For', 'Week 4, 12, and 16 visits, subject', 'X', 'X', 'X', 'X', 'to bring the dose to clinic to be', 'Pharmacokinetic (PK) sample', 'taken after the PK blood draw.', 'See Section 8.5. At Week 4 visit,', 'an additional PK sample will be', 'taken at approximately 2.5 hours', 'post-dose.', 'Biomarker sample (blood, urine)', 'X', 'X', 'X', 'X', 'See Sections 8.6.2 and 8.6.3.', 'RNA transcriptome research', 'X', 'X', 'X', 'X', 'See Section 8.6.3.', '16', 'CONFIDENTIAL']"
16,page_17,"['GB001, Inc.', 'GB001', 'Protocol GB001-2101', 'Version 5.0, 16 Apr 2020', 'Procedure', 'Notes', 'If', 'If', 'Follow', 'Visit', '1', '2', '2.5', '3', '3.5', '4', '4.25', '4.5', '5', '6', '7', 'needed', 'needed', 'up', 'Every visit window +/- 3 days', '20 or', 'If', 'If', '(except for visit 3 which is +/- 2', 'Week', '-4 to -2', '0', '1', '2', '3', '4', '5', '6', '8', '12', '16', 'as', 'needed', 'needed', 'days); The Screening period', 'needed', 'includes up to a 4 weeks Run-in', 'period', '* If consent provided, sample', 'X', 'can be collected at any visit', 'Pharmacogenetic sample', '*', '*', '*', 'post-randomization or any bio-', 'sample used for this purpose; see', 'Section 8.7.', 'Other Administrative Procedures', 'If subject discontinues IP, but', 'Dispense investigational product (IP)', 'stays on study, do not dispense IP', 'at subsequent visits (Section 7.1).', 'Collect used IP/conduct accountability', 'X', 'Dispense MFNS for use as background', 'X', 'therapy', 'Instruct subjects on Diary use, if all', 'Eligible subjects enter the Run-in', 'screening eligibility criteria are met', 'period and complete morning and', 'evening Diary until Week 20.', 'Review Diary', 'X', 'X', 'X', 'X', 'X', 'X', 'X', 'Complete eCRF', 'X', 'X', 'X', 'X', 'X', 'X', 'X', 'X', 'X', 'X', 'Abbreviations: CRS = chronic rhinosinusitis; CT = computed tomography; eCRF = electronic case report form; EW = early withdrawal;', 'IP =investigational product; MFNS = mometasone furoate nasal spray; RNA = ribonucleic acid.', '17', 'CONFIDENTIAL']"
