,PageNo,Text
56,page_57,"['GB001, Inc.', 'GB001', 'Protocol GB001-2101', 'Version 5.0, 16 Apr 2020', 'discontinuation of IP as defined in Appendix 6 (Section 10.6, Table 6) with the exception of', 'events for which subjects cannot be monitored. Follow-up liver laboratory values (Table 4),', 'Appendix 2 [Section 10.2]) and additional information to characterize the etiology of the event', 'are mandatory and specified in Appendix 6 (Section 10.6, Table 6).', '10.3.4.', 'Recording and Follow Up of Adverse Events and Serious Adverse Events', 'AE and SAE Recording', 'When an AE/SAE occurs, it is the responsibility of the investigator to review all', 'documentation (eg, hospital progress notes, laboratory reports, and diagnostics reports) related', 'to the event.', 'The investigator will then record all relevant AE/SAE/AE of Interest information in the eCRF.', ""It is not acceptable for the investigator to send photocopies of the subject's medical records to"", 'the Sponsor in lieu of completion of the AE/SAE eCRF page.', 'There may be instances when copies of medical records for certain cases are requested by the', 'Sponsor. In this case, all subject identifiers, with the exception of the subject number, will be', 'redacted on the copies of the medical records before submission to the Sponsor.', 'The investigator will attempt to establish a diagnosis of the event based on signs, symptoms,', 'and/or other clinical information. Whenever possible, the diagnosis (not the individual', 'signs/symptoms) will be documented as the AE/SAE.', 'Assessment of Intensity', 'The investigator will assess intensity for each AE and SAE reported during the study and assign it', 'to 1 of the following categories:', 'Mild: An event that is easily tolerated by the subject, causing minimal discomfort and not', 'interfering with everyday activities.', 'Moderate: An event that causes sufficient discomfort and interferes with normal everyday', 'activities.', 'Severe: An event that prevents normal everyday activities. An AE that is assessed as severe', 'should not be confused with a SAE. Severe is a category utilized for rating the intensity of an', 'event; and both AEs and SAEs can be assessed as severe.', ""An event is defined as 'serious' when it meets at least 1 of the predefined outcomes as"", 'described in the definition of an SAE, NOT when it is rated as severe.', '57', 'CONFIDENTIAL']"
57,page_58,"['GB001, Inc.', 'GB001', 'Protocol GB001-2101', 'Version 5.0, 16 Apr 2020', 'Assessment of Causality', 'The investigator is obligated to assess the relationship between IP and each occurrence of each', 'AE/SAE.', '- Related - The AE is known to occur with the IP, there is a reasonable possibility that the', 'IP caused the AE, or there is a temporal relationship between the IP and event. Reasonable', 'possibility means that there is evidence to suggest a causal relationship between the IP and', 'the AE.', '-', 'Not Related - There is not a reasonable possibility that the administration of the IP caused', 'the event, there is no temporal relationship between the IP and event onset, or an alternate', 'etiology has been established.', 'The investigator will use clinical judgment to determine the relationship.', 'Alternative causes, such as underlying disease(s), concomitant therapy, and other risk factors,', 'as well as the temporal relationship of the event to IP administration will be considered and', 'investigated.', ""The investigator will also consult the Investigator's Brochure (IB) and/or Product Information,"", 'for marketed products, in his/her assessment.', 'For each AE/SAE, the investigator must document in the medical notes that he/she has', 'reviewed the AE/SAE and has provided an assessment of causality.', 'There may be situations in which an SAE has occurred, and the investigator has minimal', 'information to include in the initial report to the Sponsor. However, it is very important that', 'the investigator always assess causality for every event before the initial transmission of', 'the SAE data to the Sponsor.', 'The investigator may change his/her opinion of causality in light of follow-up information', 'and send a SAE follow-up report with the updated causality assessment.', 'The causality assessment is one of the criteria used when determining regulatory reporting', 'requirements.', 'Follow-up of AEs and SAEs', 'The investigator is obligated to perform or arrange for the conduct of supplemental', 'measurements and/or evaluations as medically indicated or as requested by the Sponsor to', 'elucidate the nature and/or causality of the AE or SAE as fully as possible. This may include', 'additional laboratory tests or investigations, histopathological examinations, or consultation', 'with other health care professionals.', 'If a subject dies during participation in the study or during a recognized follow-up period, the', 'investigator will provide the Sponsor with a copy of any post-mortem findings including', 'histopathology if available.', 'New or updated information will be recorded in the originally completed eCRF.', 'The investigator will submit any updated SAE data to the Sponsor within 24 hours of receipt of', 'the information.', '58', 'CONFIDENTIAL']"
58,page_59,"['GB001, Inc.', 'GB001', 'Protocol GB001-2101', 'Version 5.0, 16 Apr 2020', '10.3.5.', 'Reporting of SAEs', 'SAE Reporting to the Sponsor via an Electronic Data Collection Tool', 'The mechanism for reporting an SAE to the Sponsor will be the electronic data capture system.', 'If the electronic system is unavailable, then the site will contact the Medical Monitor in order', 'to report the event and submit the paper SAE report form via the contacts below within 24', 'hours.', 'The site will enter the SAE data into the electronic system as soon as it becomes available.', 'After the study is completed at a given site, the electronic data collection tool will be taken off-', 'line to prevent the entry of new data or changes to existing data.', 'If a site receives a report of a new SAE from a study subject or receives updated data on a', 'previously reported SAE after the electronic data collection tool has been taken off-line, then', 'the site can report this information via contact to the Medical Monitor and submitting the paper', 'SAE report form via the contacts below.', 'Contacts for SAE reporting can be found below.', '59', 'CONFIDENTIAL']"
59,page_60,"['GB001, Inc.', 'GB001', 'Protocol GB001-2101', 'Version 5.0, 16 Apr 2020', '10.4.', 'Appendix 4: Contraceptive Guidance and Collection of Pregnancy', 'Information', 'Definitions:', 'Woman of Childbearing Potential (WOCBP)', 'A woman is considered fertile following menarche and until becoming post-menopausal unless', 'permanently sterile (see below).', 'If fertility is unclear (eg, amenorrhea in adolescents or athletes) and a menstrual cycle cannot be', 'confirmed before first dose of IP, additional evaluation should be considered.', 'Women in the following categories are not considered WOCBP', '1. Premenarchal', '2. Premenopausal female with 1 of the following:', 'Documented hysterectomy', 'Documented bilateral salpingectomy', 'Documented bilateral oophorectomy', 'For individuals with permanent infertility due to an alternate medical cause other than the', 'above, (eg, mullerian agenesis, androgen insensitivity), investigator discretion should be', 'applied to determining study entry.', ""Note: Documentation can come from the site personnel's: review of the subject's medical"", 'records, medical examination, or medical history interview.', '3. Postmenopausal female', 'A postmenopausal state is defined as no menses for 12 months without an alternative', 'medical cause.', '- A high follicle stimulating hormone (FSH) level (eg, > 40 IU/L) in the', 'postmenopausal range may be used to confirm a postmenopausal state in women', 'not using hormonal contraception or hormonal replacement therapy (HRT).', 'However, in the absence of 12 months of amenorrhea, confirmation with more', 'than one FSH measurement is required.', 'Females on HRT and whose menopausal status is in doubt will be required to use one', 'of the non-estrogen hormonal highly effective contraception methods if they wish to', 'continue their HRT during the study. Otherwise, they must discontinue HRT to allow', 'confirmation of postmenopausal status before study enrollment.', '60', 'CONFIDENTIAL']"
60,page_61,"['GB001, Inc.', 'GB001', 'Protocol GB001-2101', 'Version 5.0, 16 Apr 2020', 'Contraception Guidance:', 'A female subject is eligible to participate if she is not pregnant or breastfeeding,', 'and at least one of the following conditions applies:', '-', 'Is not a woman of childbearing potential (WOCBP)', 'OR', '-', 'Is a WOCBP and using a contraceptive method that is highly effective', '(with a failure rate of < 1% per year), preferably with low user dependency', '(see table below), at least 1 month prior to Screening, during the intervention', 'period, and for 28 days after the last dose of IP, and agrees not to donate leggs', '(ova, oocytes) for the purpose of reproduction during this period. The investigator', 'should evaluate the effectiveness of the contraceptive method in relationship to', 'the first dose of IP.', '-', 'A WOCBP must have a negative highly sensitive pregnancy test (urine or serum', 'as required by local regulations) within 24 hours before the first dose of IP.', '- If a urine test cannot be confirmed as negative (eg, an ambiguous result), a serum', 'pregnancy test is required. In such cases, the subject must be excluded from', 'participation if the serum pregnancy result is positive.', 'Contraceptive use should be consistent with local regulations regarding the use of contraceptive', 'methods for those participating in clinical studies.', '61', 'CONFIDENTIAL']"
61,page_62,"['GB001, Inc.', 'GB001', 'Protocol GB001-2101', 'Version 5.0, 16 Apr 2020', 'Highly Effective Methods That Have Low User Dependency', 'Implantable progestogen-only hormone contraception associated with inhibition of ovulationb', 'Intrauterine device (IUD)', 'Intrauterine hormone-releasing system (IUS)b', 'Bilateral tubal occlusion', 'Vasectomized partner', '(Vasectomized partner is a highly effective contraceptive method provided that the partner is the', 'sole sexual partner of the woman of childbearing potential and the absence of sperm has been', 'confirmed. If not, an additional highly effective method of contraception should be used.', 'Spermatogenesis cycle is approximately 90 days.)', 'Highly Effective Methods That Are User Dependent', 'Combined (estrogen- and progestogen-containing) hormonal contraception associated with', 'inhibition of ovulation', '- oral', '- intravaginal', '- transdermal', '- injectable', 'Progestogen-only hormone contraception associated with inhibition of ovulationb', '- oral', '- injectable', 'Sexual abstinence', '(Sexual abstinence is considered a highly effective method only if defined as refraining from', 'heterosexual intercourse during the entire period of risk associated with the IP. The reliability of', 'sexual abstinence needs to be evaluated in relation to the duration of the study and the preferred and', 'usual lifestyle of the subject.)', 'a', 'Failure rate of < 1% per year when used consistently and correctly. Typical use failure rates differ from those', 'when used consistently and correctly', 'b', 'If locally required, in accordance with Clinical Trial Facilitation Group (CTFG) guidelines, acceptable', 'contraceptive methods are limited to those which inhibit ovulation as the primary mode of action', 'Note: Periodic abstinence (calendar, symptothermal, post-ovulation methods), withdrawal (coitus interruptus),', 'spermicides only, and lactational amenorrhoea method (LAM) are not acceptable methods of contraception for', 'this study. Male condom and female condom should not be used together (due to risk of failure with friction).', '62', 'CONFIDENTIAL']"
62,page_63,"['GB001, Inc.', 'GB001', 'Protocol GB001-2101', 'Version 5.0, 16 Apr 2020', 'Collection of Pregnancy Information', 'Female Subjects who become pregnant', 'The investigator will collect pregnancy information on any female subject who', 'becomes pregnant while participating in this study. Information will be recorded on', 'the appropriate form and submitted to the sponsor within 24 hours of learning of a', ""subject's pregnancy."", 'The subject will be followed to determine the outcome of the pregnancy. The', 'investigator will collect follow-up information on the subject and the neonate and the', 'information will be forwarded to the sponsor. Generally, follow-up will not be', 'required for longer than 6 to 8 weeks beyond the estimated delivery date. Any', 'termination of pregnancy will be reported, regardless of fetal status (presence or', 'absence of anomalies) or indication for the procedure.', 'While pregnancy itself is not considered to be an AE or SAE, any pregnancy', 'complication or elective termination of a pregnancy will be reported as an AE', 'or', 'SAE. A spontaneous abortion is always considered to be an SAE and will be reported', 'as such. Any post-study pregnancy related SAE considered reasonably related to the', 'study intervention by the investigator will be reported to the sponsor as described in', 'Section 10.3.5. While the investigator is not obligated to actively seek this', 'information in former study subjects, he or she may learn of an SAE through', 'spontaneous reporting.', 'Any female subject who becomes pregnant while participating in the study will', 'discontinue IP or be withdrawn from the study.', '63', 'CONFIDENTIAL']"
63,page_64,"['GB001, Inc.', 'GB001', 'Protocol GB001-2101', 'Version 5.0, 16 Apr 2020', '10.5.', 'Appendix 5: Genetics', 'Use and Analysis of DNA', ""Genetic variation may impact a subject's response to IP, susceptibility to, and severity"", 'and progression of disease. Variable response to IP may be due to genetic', 'determinants that impact drug absorption, distribution, metabolism, and excretion;', 'mechanism of action of the drug; disease etiology; and/or molecular subtype of the', 'disease being treated. Therefore, where local regulations and IRB/IEC allow, a', 'biosample may be collected for DNA analysis from consenting subjects.', 'DNA samples may be used for research related to the relationship between safety,', 'efficacy, and exposure parameters collected in this study, as they related to placebo,', 'GB001, CRS, and related diseases. They may also be used to develop tests/assays', 'including diagnostic tests related to GB001 and DP2 inhibitors and/or atopic disease.', 'Genetic research may consist of the analysis of candidate polymorphisms,', 'prespecified in the statistical analysis plan.', 'The samples may be analyzed as part of a multi-study assessment of genetic factors', 'involved in the response to GB001 of this class to understand study disease or related', 'atopic conditions.', 'The results of genetic analyses may be reported in a separate study summary.', 'The Sponsor will store the samples in a secure storage space with adequate measures', 'to protect confidentiality.', 'The samples will be retained while research on GB001 continues but no longer than', '8 years or other period as per local requirements.', '64', 'CONFIDENTIAL']"
64,page_65,"['GB001, Inc.', 'GB001', 'Protocol GB001-2101', 'Version 5.0, 16 Apr 2020', '10.6.', 'Appendix 6: Liver Safety - Actions and Follow-up Assessments', 'Liver chemistry will be evaluated as specified in the SoA (Section 1.3) and Appendix 2', '(Section 10.2). Parameters will include ALT, AST, GGT, bilirubin, total bile acids, and ALP.', 'For subjects with ALT or AST > 1 X ULN and < 3 X ULN or total bilirubin or direct bilirubin', '> 1 X ULN and 1.5 X ULN, confirm the value within 24 to 48 hours. Contact the Medical', 'Monitor to determine the appropriate liver monitoring schedule (eg, weekly or twice a week).', 'The criteria requiring additional liver monitoring with possible interruption of study intervention', 'are detailed in Table 5.', 'Table 5:', 'Liver Chemistry Criteria Requiring Additional Monitoring with Possible', 'Interruption of Investigational Product', 'Criterion', 'Actions', 'ALT or AST > 3 X ULN and <5 X ULN', 'Notify the Medical Monitor within 24 hours of', 'or total bilirubin or direct bilirubin > 1.5', 'learning of the abnormality to discuss subject safety.', 'X ULN without symptoms believed to be', '""Additional Liver Panel"" in Table 6 may be requested', 'related to liver injury or hypersensitivity,', 'by the Medical Monitor', 'and who can be monitored weekly for 4', 'Confirm values within 24 to 48 hours via repeat labs.', 'weeks', 'If unable to obtain repeat labs within 48 hours,', 'discontinue IP.', 'Decision to continue or interrupt study intervention', 'will be determined by the Investigator and the Medical', 'Monitor', 'Subject must return weekly or more frequently for', 'repeat liver chemistry tests (ALT, AST, GGT, ALP,', 'total bile acids, and bilirubin) until the abnormalities', 'resolve, stabilize, or return to baseline.', 'If at any time the subject meets liver chemistry', 'interruption criteria (as specified in Table 6), then', 'follow the instructions in ""Actions and Follow-up', 'Assessments"" in Table 6 and in consultation with the', 'Medical Monitor initiate relevant assessment', 'procedures.', 'In the case of AEs of interest (Section 10.3.3), potential re-challenge will be restricted to', 'potential DILI cases that have been assessed as unlikely or not related to IP by the HAC and after', 'liver enzymes have returned to baseline levels. When re-challenging with IP, obtain repeat liver', 'chemistries twice weekly in the first 2 weeks and then weekly for 6 weeks after the re-challenge.', 'If there is a rise in liver enzymes > 2 X ULN, the IP should be discontinued permanently.', 'The criteria requiring interruption of IP with additional liver monitoring is detailed in Table 6.', '65', 'CONFIDENTIAL']"
65,page_66,"['GB001, Inc.', 'GB001', 'Protocol GB001-2101', 'Version 5.0, 16 Apr 2020', 'Table 6:', 'Liver Chemistry Criteria Requiring Investigational Product Interruption', 'and Additional Monitoring', 'Liver Chemistry - IP Interruption Criteria', 'ALT/AST (single occurrence)', 'ALT or AST 5 X ULN', 'ALT/AST', 'ALT or AST 3 X ULN persists for 4 weeks', '+ Bilirubin a,b', 'ALT or AST 3 X ULN and bilirubin > 2 X ULN (> 35% direct bilirubin)', '+ INR b', 'ALT or AST 3 X ULN and international normalized ratio (INR) > 1.5, if', 'INR measured', '+ Cannot Monitor', 'ALT or AST 3 X ULN and cannot be monitored weekly for 4 weeks', '+ Symptomatic', 'ALT or AST 3 X ULN associated with symptoms (new or worsening)', 'believed to be related to liver injury or hypersensitivity', 'Actions and Follow-up Assessments', 'Actions', 'Follow-Up Assessments', 'Immediately discontinue IP', 'Additional Liver Panel', 'Report the event to the Medical Monitor within', 'Viral hepatitis serology d', '24 hours', 'Obtain INR and recheck with each liver', 'Complete the liver event eCRF and complete an SAE', 'chemistry assessment until the ALT and/or AST', 'data collection tool if the event also met the criteria', 'values show downward trend', 'for an SAEb', 'Obtain blood sample for pharmacokinetic (PK)', 'Perform liver chemistry follow-up assessments.', 'analysis', 'Monitor the subject until liver chemistry test', 'Serum creatine phosphokinase (CPK)', 'abnormalities resolve, stabilize, or return to baseline', 'and lactate dehydrogenase (LDH)', '(see MONITORING)', 'Fractionate bilirubin, if total bilirubin', 'Do not restart/rechallenge subject with IP unless', '> 2 X ULN', 'Medical Monitor approval is granted', 'Obtain complete blood count with differential to', 'If restart/rechallenge not granted, permanently', 'assess eosinophilia', 'discontinue IP and continue subject in the study for', 'Record the appearance or worsening of clinical', 'any protocol specified follow up assessments', 'symptoms of liver injury, or hypersensitivity, on', 'the adverse event (AE) report form', 'MONITORING:', 'Record use of concomitant medications', '(including acetaminophen, herbal remedies, and', 'Repeat liver chemistry tests (include ALT, AST,', 'other over-the-counter medications) on the', 'GGT, alkaline phosphatase, total bile acids, bilirubin,', 'concomitant medications eCRF', 'and INR) and perform liver event follow-up', 'Record alcohol use on the liver event alcohol', 'assessments within 24 hours', 'intake eCRF', 'Monitor subject twice weekly until liver chemistry', 'Anti-nuclear antibody, anti-smooth muscle', 'test abnormalities resolve, stabilize, or return to', 'antibody, Type 1 anti-liver kidney microsomal', 'baseline', 'antibodies, and quantitative total', 'A specialist or hepatology consultation is', 'immunoglobulin G (IgG) or gamma globulins', 'recommended', 'Serum acetaminophen assay', 'Liver imaging (ultrasound, magnetic resonance,', 'or computerized tomography) and/or liver', 'biopsy to evaluate liver disease', 'a.', 'Serum bilirubin fractionation should be performed if testing is available. If serum bilirubin fractionation is not', 'immediately available, discontinue IP if ALT or AST > 3 X ULN and bilirubin > 2 X ULN. Additionally, if', 'serum bilirubin fractionation testing is unavailable, record the absence/presence of detectable urinary', 'bilirubin on dipstick which is indicative of direct bilirubin elevations suggesting liver injury.', '66', 'CONFIDENTIAL']"
66,page_67,"['GB001, Inc.', 'GB001', 'Protocol GB001-2101', 'Version 5.0, 16 Apr 2020', 'b. All events of ALT or AST 3 X ULN and bilirubin > 2 X ULN (> 35% direct bilirubin) or ALT', ""or AST 3 X ULN and INR > 1.5 may indicate severe liver injury (possible 'Hy's Law') and must be"", 'reported as an SAE (excluding studies of hepatic impairment or cirrhosis). The INR stated threshold value', 'will not apply to subjects receiving anticoagulants. INR is not part of routine laboratory assessments in this', 'study.', 'c.', 'New or worsening symptoms believed to be related to liver injury (such as fatigue, nausea, vomiting, right', 'upper quadrant pain or tenderness, or jaundice) or hypersensitivity (such as fever, rash, or eosinophilia).', 'd.', 'Includes: expanded viral hepatitis serology (Section 10.2 Table 4)', '67', 'CONFIDENTIAL']"
67,page_68,"['GB001, Inc.', 'GB001', 'Protocol GB001-2101', 'Version 5.0, 16 Apr 2020', '10.7.', 'Appendix 7: Visual Analog scale (VAS)', 'To evaluate the total severity, the subject is asked to indicate on a VAS the answer to the', 'question:', 'How troublesome are your symptoms of rhinosinusitis?', '10 cm', 'Not troublesome', 'Worst thinkable troublesome', 'Example, not for use. Not to scale.', '68', 'CONFIDENTIAL']"
68,page_69,"['GB001, Inc.', 'GB001', 'Protocol GB001-2101', 'Version 5.0, 16 Apr 2020', '10.8.', 'Appendix 8: ACQ-5 Questionnaire', 'The ACQ-5 questionnaire is located on the following page.', '69', 'CONFIDENTIAL']"
69,page_70,"['GB001, Inc.', 'GB001', 'Protocol GB001-2101', 'Version 5.0, 16 Apr 2020', 'ASTHMA CONTROL', 'QUESTIONNAIRE (ACQ)', '(SYMPTOMS ONLY)', 'C 2002', 'QOL TECHNOLOGIES LTD.', 'TM', 'For further information:', 'Elizabeth Juniper, MCSP, MSc', 'Professor', '20 Marcuse Fields', 'Bosham, West Sussex', 'PO18 8NA, England', 'This translation has been made possible through', 'Telephone: +44 1243 572124', 'a grant from', 'Translated by Mapi', 'Fax: +44 1243 573680', 'Senior Translator:', 'E-mail: juniper@qoltech.co.uk', 'Web: http://www.qoltech.co.uk', 'C', 'The Asthma Control Questionnaire (ACQ) is copyrighted and all rights are', 'reserved. No part of this questionnaire may be sold, modified or', 'reproduced in any form without the express permission of Elizabeth', 'Juniper on behalf of QOL Technologies Limited', 'DECEMBER 2002', 'ACQ-5 - Canada/English - Mapi.', 'ACQ-5_AU1.0_eng-CAori.do', '70', 'CONFIDENTIAL']"
70,page_71,"['GB001, Inc.', 'GB001', 'Protocol GB001-2101', 'Version 5.0, 16 Apr 2020', 'ASTHMA CONTROL QUESTIONNAIREC', 'PATIENT ID:', '(LANGUAGE VERSION FOR COUNTRY)', 'DATE:', 'Page 1 of 1', 'Please answer questions 1 - 5.', 'Circle the number of the response that best describes how you have been during the past week.', '1.', 'On average, during the past week,', '0', 'Never', 'how often were you woken by your', '1', 'Hardly ever', 'asthma during the night?', '2', 'A few times', '3', 'Several times', '4', 'Many times', '5', 'A great many times', '6', 'Unable to sleep because of asthma', '2.', 'On average, during the past week,', '0', 'No symptoms', 'how bad were your asthma symptoms', '1', 'Very mild symptoms', 'when you woke up in the morning?', '2', 'Mild symptoms', '3', 'Moderate symptoms', '4', 'Quite severe symptoms', '5', 'Severe symptoms', '6', 'Very severe symptoms', '3.', 'In general, during the past week, how', '0', 'Not limited at all', 'limited were you in your activities', '1', 'Very slightly limited', 'because of your asthma?', '2', 'Slightly limited', '3', 'Moderately limited', '4', 'Very limited', '5', 'Extremely limited', '6', 'Totally limited', '4.', 'In general, during the past week, how', '0', 'None', 'much shortness of breath did you', '1', 'A very little', 'experience because of your asthma?', '2', 'A little', '3', 'A moderate amount', '4', 'Quite a lot', '5', 'A great deal', '6', 'A very great deal', '5.', 'In general, during the past week, how', '0', 'Not at all', 'much of the time did you wheeze?', '1', 'Hardly any of the time', '2', 'A little of the time', '3', 'A moderate amount of the time', '4', 'A lot of the time', '5', 'Most of the time', '6', 'All the time', 'ACQ-5 - Canada/English - Mapi.', 'ACQ-5_AU1.0_eng-CAori.doc', '71', 'CONFIDENTIAL']"
71,page_72,"['GB001, Inc.', 'GB001', 'Protocol GB001-2101', 'Version 5.0, 16 Apr 2020', '10.9.', 'Appendix 9: SNOT-22 Questionnaire', 'The SNOT-22 questionnaire is located on the following page.', '72', 'CONFIDENTIAL']"
