,PageNo,Text
97,page_98,"['abbvie', 'Rovalpituzumab Tesirine', 'M16-298 Protocol Amendment 4', 'EudraCT 2016-003503-64', 'Change from baseline in all PRO domains (except physical functioning)', 'measured by EORTC QLQ-C30/LC13 and EQ-5D-5L', 'ORR is defined as the proportion of patients with a best overall response (BOR) of', 'confirmed complete response (CR) or partial response (PR) by CRAC review according to', 'RECIST v1.1.', 'CBR is defined as the proportion of patients with a BOR of CR or PR, or SD by CRAC', 'review according to RECIST v1.1.', 'ORR and CBR in treatment arms will be compared using Cochran-Mantel-Haenszel test', 'stratified by randomization stratification factors. Rates and 95% confidence intervals will', 'be reported for each treatment arm.', 'The duration of overall response for a given subject will be defined as the number of', 'months from the day the criteria are met for confirmed complete response (CR) or partial', 'response (PR) by CRAC (whichever is recorded first) to the date of progressive disease or', 'death, whichever comes first. If a subject is still responding (i.e., has not progressed nor', ""died after CR or PR), then the subject's data will be censored at date of the last"", 'radiographic assessment by CRAC. For subjects who never experienced CR or PR, these', ""subjects' data will not be included in the duration of response analysis. Distribution of the"", 'duration of response will be estimated for each treatment arm using Kaplan-Meier', 'methodology. Median duration of overall response with corresponding 95% CI for each', 'treatment arm will be provided.', '8.1.7', 'Patient Reported Outcomes (PRO)', 'The EORTC QLQ-C30/LC13 13 scoring manual will be used to transform the raw scores', 'into the domain scores (global heath, functional scales, symptom scales/items). Physical', 'functioning scale score in EORTC QLQ-C30 is the key secondary endpoint. Change from', 'baseline of the items and domains of the QLQ-C30/LC13 will be summarized by', 'treatment arm. The EQ-5D-5L manual and the published weights will be used to convert', 'the individual items to the utility scores. Change from baseline of the EQ-5D-5L utility', '98']"
98,page_99,"['abbvie', 'Rovalpituzumab Tesirine', 'M16-298 Protocol Amendment 4', 'EudraCT 2016-003503-64', 'score and VAS will be summarized by treatment arm. The treatment group differences', 'will be evaluated by analyzing the change from baseline using a one-way analysis of', 'variance (ANOVA) model.', '8.1.8', 'Planned Sensitivity and Subgroup Analyses', 'Efficacy analyses for the primary endpoints (PFS per CRAC and OS) will be performed in', 'the per-protocol set.', 'In', 'the', 'DLL3 high and randomized sets, treatment effects for the primary endpoints (PFS per', 'CRAC and OS) will be assessed in the following subgroups:', 'RECIST v1.1 response after completion of first-line platinum-based therapy at', 'screening assessment (SD VS. PR/CR)', 'DLL3 expression (Unknown VS. 0% to < 25% VS. 25% to < 75% VS. 75% or', 'above) for the randomized set only', 'History of CNS metastases (Yes VS. No)', 'For subjects with no history of CNS metastases, PCI VS. No PCI', 'Lactate dehydrogenase (LDH), ULN VS. > ULN', 'Number of metastatic sites, 0 - 1 VS. > 1', 'Age group (age < 40 VS. 40 to < 60 VS. 60 or older)', 'Gender', 'Race', 'ECOG (0 VS. 1)', 'Differences between rovalpituzumab tesirine arm and the placebo arm for time-to-event', 'endpoints will be assessed by an unstratified log-rank test for each subgroup. Hazard', ""ratios of treatment arm over the placebo arm will be calculated by a Cox's model."", '8.1.9', 'Pharmacokinetic and Exposure-Response Analyses', 'Serum concentrations of rovalpituzumab tesirine ADC as well as the incidence and timing', 'of ATA formation will be tabulated and summary statistics will be computed. Serum', '99']"
99,page_100,"['abbvie', 'Rovalpituzumab Tesirine', 'M16-298 Protocol Amendment 4', 'EudraCT 2016-003503-64', 'concentration and ATA data from this study may be combined with data from other', 'studies and analyzed using population pharmacokinetic methodologies.', 'The relationship between pharmacokinetics (e.g., exposure) and clinical trial findings', 'including, but not limited to demographics, efficacy, and/or safety measures may also be', 'explored. Additional analyses will be performed if useful. Results of the population', 'pharmacokinetic and exposure-response analyses will be provided in a separate report.', '8.2', 'Safety Analyses', 'Safety endpoints will be summarized using data from the Safety set. Safety analyses will', 'involve examination of the incidence, severity, and type of treatment-emergen adverse', 'events (TEAEs) reported, changes in vital signs and laboratory test results from baseline', '(the assessment prior to first dose) to specified time points throughout the study, and', 'concomitant medications used. NCI CTCAE version 4.0 will be used in the grading of', 'adverse events and laboratory abnormalities that are reported as adverse events.', '8.2.1', 'Treatment-Emergent Adverse Events (TEAEs)', 'TEAEs reported during the study will be coded using a MedDRA 16 dictionary. Incidence', 'of TEAEs will be summarized by treatment arm and the following:', 'System organ class and preferred term', 'System organ class, preferred term, and severity', 'These summaries will be presented for the following subsets:', 'Serious TEAEs', 'All TEAEs', 'Drug-related TEAEs', 'For tables reporting AEs by severity, if a subject has multiple occurrences of an AE with', 'the same organ class and preferred term, the most severe event will be presented.', '100']"
100,page_101,"['abbvie', 'Rovalpituzumab Tesirine', 'M16-298 Protocol Amendment 4', 'EudraCT 2016-003503-64', '8.2.2', 'Clinical Laboratory Evaluation', 'Laboratory parameters will be summarized by treatment arm at each visit. Each summary', 'will include the values of the laboratory parameters and changes from baseline. Shift', 'tables from baseline will be presented for laboratory values in the chemistry and', 'hematology panels. Parameters will be classified according to the laboratory reference', 'normal ranges. A listing will be provided for out-of-normal range as well as clinically', 'significant abnormal lab values.', '8.2.3', 'Vital Signs', 'Vital signs including pulse, blood pressure, temperature, and body weight will be', 'summarized by treatment arm and time point. For each assessment of vital signs, change', 'from baseline will be summarized by treatment arm.', '8.2.4', 'ECOG Performance Status', 'ECOG performance status will be summarized for each visit by treatment arm. Shifts', 'from baseline to the best and worst post-baseline score may be tabulated.', '8.2.5', 'Electrocardiogram', 'ECG status will be summarized for each scheduled visit by treatment arm. Shifts from', 'baseline may be tabulated.', '8.2.6', 'Concomitant Medications', 'Concomitant medications will be classified according to the anatomical therapeutic', 'chemical (ATC) codes in the World Health Organization Drug (WHODRUG) dictionary.', 'The incidence rate of each coded concomitant medication will be tabulated by treatment', 'arm. The table will be sorted by the incidence use of the entire sample.', '8.3', 'Type I Error Adjustment Procedure for Multiple Testing', 'To meet global regulatory requirements, a multiple testing strategy will be implemented to', 'control the family-wise type I error (alpha) to one-sided 0.025 level for comparisons of', '101']"
101,page_102,"['abbvie', 'Rovalpituzumab Tesirine', 'M16-298 Protocol Amendment 4', 'EudraCT 2016-003503-64', 'rovalpituzumab tesirine arm versus placebo arm with respect to progression-free survival', '(PFS) per CRAC in DLL3 high set, overall survival (OS) in DLL3 high set, PFS per CRAC in', 'randomized set, OS in randomized set, and physical functioning scale score (EORTO', 'QLQ-C30) in randomized set.', 'The following null hypotheses are considered:', 'Two hypotheses in Hoi are Hola and Holb.', 'Ho1a: Rovalpituzumab tesirine arm is not superior to placebo arm in PFS per CRAC in', 'DLL3 high set.', 'Ho1b: Rovalpituzumab tesirine arm is not superior to placebo arm in os in DLL3 high set.', 'H02: Rovalpituzumab tesirine arm is not superior to placebo arm in OS in randomized set.', 'H03: Rovalpituzumab tesirine arm is not superior to placebo arm in PFS per CRAC in', 'randomized set.', 'H04: Rovalpituzumab tesirine arm is not superior to placebo arm in physical functioning', 'scale score (EORTC QLQ-C30) in randomized set.', 'The null hypotheses will be tested in a fixed sequence of {H01a, Holb, H02, H03, and H04} in', 'order. To maintain the family-wise type I error for the study, the null hypotheses in H01', '(Ho1a and H01b) will be first tested with an alpha-split approach. The one-sided alpha of', '0.25% and 2.25% will be assigned for PFS and os hypothesis in H01, respectively. Out of', 'one-sided alpha of 2.25% allocated to OS hypothesis (Hoib), the one-sided alpha of 10-6', 'will be spent for the early look at the OS data for futility analysis. If the hypothesis for', 'PFS in H01 (Ho1a) is rejected the one-sided alpha of 0.25% will be recycled to the OS', 'hypothesis in Hoi (Hoib). Hence, the hypothesis for OS in H01 (Hoib) will be tested either', 'at a one-sided 2.4999% or one-sided 2.2499% level of significance depending on the PFS', 'hypothesis in Ho1a is rejected or not.', '102']"
102,page_103,"['abbvie', 'Rovalpituzumab Tesirine', 'M16-298 Protocol Amendment 4', 'EudraCT 2016-003503-64', 'If either PFS or OS endpoint reaches statistical significance, the study is considered', 'positive. No further tests will be performed if the OS endpoint in DLL3 high population', '(H01b) does not reach statistical significance.', 'The hypothesis in H02 will be tested if the hypothesis in Holb is rejected. If the hypothesis', 'in H02 is rejected, then, either (i) H03 and H04 will be tested sequentially if the PFS', 'endpoint in DLL3 high subjects (Ho1a) is also rejected or (ii) only H04 will be tested if the', 'PFS endpoint in DLL3 high subjects (H01a) is not rejected.', 'Diagram of Hierarchical Testing of Primary and Secondary Endpoints is described in', 'Figure 3.', '103']"
103,page_104,"['abbvie', 'Rovalpituzumab Tesirine', 'M16-298 Protocol Amendment 4', 'EudraCT 2016-003503-64', 'Figure 3.', 'Diagram of Hierarchical Testing of Primary and Secondary', 'Enppoints', 'Test Hola (PFS in DLL: 3High set) at one-sided a = 0.25%', 'If Ho1a not rejected', 'If Holaisrejected', 'Test Holb (OS in DLL3', 'Test Holb (OS in DLL3High', 'set) at one-sided a = 2.2499%', 'set) at one-sided a = 2.4999%', 'If Holb isrejected', 'If Holb is rejected', 'Test Ho2 (OS in Randomized', 'Test Ho2 (OS in Randomized', 'set) at one-sided a = 2.2499%', 'set) at one-sided a = 2.4999%', 'If Ho2 is rejected', 'If Ho2 is rejected', 'Test Ho4 (PF scale in EORTC', 'Test Ho3 (PFS in Randomized', 'QLQ-C30 in Randomized set)', 'set) at one-sided a = 2.4999%', 'at one-sided a = 2.2499%', 'If H03 is rejected', 'Test Ho4 (PF scale in EORTC', 'QLQ-C30 in Randomized set)', 'at one-sided a = 2.2499%', '104']"
104,page_105,"['abbvie', 'Rovalpituzumab Tesirine', 'M16-298 Protocol Amendment 4', 'EudraCT 2016-003503-64', '8.4', 'Determination of Sample Size', 'There are two primary efficacy endpoints for this study: Progression-free survival (PFS)', 'based on the CRAC and overall survival (OS) in DLL3high ED SCLC patients. To', 'maintain the overall 1-sided type I error at a 2.5% for this study, the type I error will be', 'split, assigning 0.25% to progression-free survival and the remaining 2.25% to overall', 'survival. However, the OS endpoint will be tested at a one-sided 2.2499% significance', 'level as a one-sided alpha of 10-6 will be spent for the early look at the OS data for futility', 'analysis.', 'The sample size of the study is primarily determined by the analysis of OS. It is assumed,', 'taking into account the expected patient population for the study, that median overall', 'survival in the placebo and rovalpituzumab tesirine arm will be around 9 months and 13', 'months, respectively. The increase of median os in rovalpituzumab tesirine arm', 'corresponds to a hazard ratio of 0.69, i.e., a reduction in the hazard of death by 31%.', 'With all these assumptions, a total of 319 deaths among subjects with DLL3 high are needed', 'to achieve a 90% power based on a log-rank test at a one-sided significance level of', '0.022499. Assuming a 19-month accrual period and the last enrolled subject followed for', '12 months, at least 480 subjects with DLL3 high are expected to be randomized', '(240 subjects in each arm). A total of 740 subjects regardless of DLL3 expression level', '(including 480 subjects with DLL3high) will enroll in the study, assuming an approximate', 'prevalence of 65% for subjects with DLL3high For one-sided significance level of', '0.022499, it is projected that an observed hazard ratio of 0.799 or less, corresponding to a', '2.3 months or greater improvement in median OS, would result in a statistically', 'significant improvement in the primary analysis of OS.', 'The primary endpoints of OS and PFS in DLL3 high patients will be analyzed at the same', 'time after observing at-least 319 OS event. It is expected at approximately 420 PFS', 'events will be observed at the time of the primary analysis.', 'It is assumed, taking into account the expected patient population for the study, that', 'median progression-free survival for the placebo and rovalpituzumab tesirine arm will be', '105']"
105,page_106,"['abbvie', 'Rovalpituzumab Tesirine', 'M16-298 Protocol Amendment 4', 'EudraCT 2016-003503-64', 'approximately 3 months and 4.5 months, respectively. The increase of median', 'progression-free survival in rovalpituzumab tesirine arm corresponds to a hazard ratio of', '0.667. With all these assumptions, a total of approximately 420 PFS events assessed by', 'the CRAC for the subjects with DLL3high are needed to achieve a 91% power based on a', 'log-rank test at a one-sided significance level of 0.0025. It is projected that an observed', 'hazard ratio of 0.760 or less, corresponding to approximately 1 month or greater', 'improvement in median PFS, would result in a statistically significant improvement in the', 'PFS.', '8.5', 'Futility Analysis', 'A futility analysis will be conducted when approximately 160 deaths in subjects with', 'DLL3high ED SCLC (approximately 50% of the planned deaths) are observed. The trial', 'may be stopped for futility if the estimated Overall Survival Cox HR of Rova-T to', 'Placebo in the DLL3high set at futility analysis exceeds 0.9. The one-sided alpha of 10-6', 'will be spent for the early look at the efficacy data for futility analysis.', 'Unblinded interim data will be analyzed and reviewed by the IDMC. The trial may be', 'considered for early stopping for futility and the Sponsor will be unblinded to the', 'aggregated data by randomized treatment arms if the IDMC makes such a', 'recommendation after consideration of the OS results and other supportive evidence', 'including other relevant efficacy and safety data.', 'Details for the futility analysis will be provided in the IDMC charter.', '8.6', 'Accrual/Study Duration Considerations', 'On average, it is expected that accrual rates are 1, 7, 27, 36, and 42 with DLL3 high subjects', 'per month at study initiation, 3, 6, 9, and 12 month and thereafter, respectively. The total', 'study duration and accrual duration are projected to be 31 months and 19 months with a', '5% rate of loss to follow-up, respectively. A total of 740 subjects regardless of DLL3', 'expression level in tumor are expected to enroll during the accrual period. It is projected', 'that 480 subjects with DLL3 high ED SCLC will have enrolled for the primary analysis by', '106']"
106,page_107,"['abbvie Rovalpituzumab Tesirine', 'M16-298 Protocol Amendment 4', 'EudraCT 2016-003503-64', 'the time approximately 420 PFS events per CRAC and at least 319 OS events should be', 'observed in DLL3 high subjects after approximately 8 - 10 months of follow-up.', '8.7', 'Randomization Methods', 'The randomization numbers of the study will assign subjects in a 1:1 ratio to either', 'receive 0.3 mg/kg rovalpituzumab tesirine or placebo, on Day 1 of each 6-week cycle,', 'omitting every third cycle. Randomization will be stratified by RECIST v1.1 response', 'after completion of first-line platinum-based therapy at screening assessment (SD VS.', 'PR/CR), DLL3 expression (Unknown VS. 0% to < 25% VS. 25% to < 75% VS. 75% or', 'above), history of CNS metastases (Yes VS. No), and for subjects with no history of CNS', 'metastases, PCI VS. no PCI.', '9.0', 'Ethics', '9.1', 'Independent Ethics Committee (IEC) or Institutional Review', 'Board (IRB)', 'Good Clinical Practice (GCP) requires that the clinical protocol, any protocol', ""amendments, the Investigator's Brochure, 14 the informed consent and all other forms of"", 'subject information related to the study (e.g., advertisements used to recruit subjects) and', 'any other necessary documents be reviewed by an IEC/IRB. The IEC/IRB will review the', 'ethical, scientific and medical appropriateness of the study before it is conducted.', 'IEC/IRB approval of the protocol, informed consent and subject information and/or', 'advertising, as relevant, will be obtained prior to the authorization of drug shipment to', 'a', 'study site.', 'Any amendments to the protocol will require IEC/IRB (Competent Authority, if', 'applicable) approval prior to implementation of any changes made to the study design.', 'The investigator will be required to submit, maintain and archive study essential', 'documents according to ICH GCP and all other applicable regulatory requirements.', 'Any serious adverse events that meet the reporting criteria, as dictated by local', 'regulations, will be reported to both responsible Ethics Committees and Regulatory', '107']"
107,page_108,"['abbvie Rovalpituzumab Tesirine', 'M16-298 Protocol Amendment 4', 'EudraCT 2016-003503-64', 'Agencies, as required by local regulations. During the conduct of the study, the', 'investigator should promptly provide written reports (e.g., ICH Expedited Reports, and', 'any additional reports required by local regulations) to the IEC/IRB of any changes that', 'affect the conduct of the study and/or increase the risk to subjects. Written documentation', 'of the submission to the IEC/IRB should also be provided to AbbVie.', '9.2', 'Ethical Conduct of the Study', 'The study will be conducted in accordance with the protocol, International Conference on', 'Harmonization (ICH) guidelines17,18 applicable regulations and guidelines governing', 'clinical study conduct and the ethical principles that have their origin in the Declaration of', 'Helsinki. Responsibilities of the clinical investigator are specified in Appendix A.', '9.3', 'Subject Information and Consent', 'The investigator or his/her representative will explain the nature of the study to the', 'subject, and answer all questions regarding this study. Prior to any study-related', 'screening procedures being performed on the subject, the informed consent statement will', 'be reviewed and signed and dated by the subject, the person who administered the', 'informed consent, and any other signatories according to local requirements. A copy of', 'the informed consent form will be given to the subject and the original will be placed in', ""the subject's medical record. An entry must also be made in the subject's dated source"", 'documents to confirm that informed consent was obtained prior to any study-related', 'procedures and that the subject received a signed copy.', 'Information regarding incentives for subjects and information regarding provisions for', 'treating and/or compensating subjects who are harmed as a consequence of participation', 'in the study can be found in the informed consent form.', 'Tumor material obtained by biopsy procedure at the time of disease progression (for', 'exploratory research) is optional and will only be performed if the subject has voluntarily', 'signed and dated an optional tumor material biopsy procedure informed consent, approved', 'by an IEC/IRB, after the nature of the testing has been explained and the subject has had', '108']"
108,page_109,"['abbvie', 'Rovalpituzumab Tesirine', 'M16-298 Protocol Amendment 4', 'EudraCT 2016-003503-64', 'an opportunity to ask questions. If the subject does not consent to the optional informed', ""consent, it will not impact the subject's participation in the study."", 'In the event a subject withdraws consent to participate from the study, stored biomarker', 'and tumor specimen for exploratory research will continue to be used for research and', 'analysis. In the event that a subject would like to withdraw consent for research using', 'these samples, the subject may request that their samples be withdrawn. Once Abb Vie', 'receives the request, remaining biomarker and tumor specimen for exploratory research', 'will be destroyed. If the subject changes his/her consent, and the samples have already', 'been tested, those results will still remain as part of the overall research data.', '9.3.1', 'Informed Consent Form and Explanatory Material', 'In Japan, the principal investigator will prepare the consent form and explanatory material', ""required to obtain subject's consent to participate in the study with the cooperation of the"", 'sponsor and will revise these documents as required. The prepared or revised consent', 'forms and explanatory material will be submitted to the sponsor. Approval of the IRB', 'will be obtained prior to use in the study.', '9.3.2', 'Revision of the Consent Form and Explanatory Material', ""In Japan, when important new information related to the subject's consent becomes"", 'available, the principal investigator will revise the consent form and explanatory material', 'based on the information without delay and will obtain the approval of the IRB prior to', 'use in the study. The investigator will provide the information, without delay, to each', 'subject already participating in the study, and will confirm the intention of each subject to', 'continue the study or not. The investigator shall also provide a further explanation using', 'the revised form and explanatory material and shall obtain written consent from each', 'subject of their own free will to continue participating in the study.', '109']"
109,page_110,"['abbvie', 'Rovalpituzumab Tesirine', 'M16-298 Protocol Amendment 4', 'EudraCT 2016-003503-64', '10.0', 'Source Documents and Case Report Form', 'Completion', '10.1', 'Source Documents', 'Source documents are defined as original documents, data and records. This may include', ""hospital records, clinical and office charts, laboratory data/information, subjects' diaries or"", 'evaluation checklists, pharmacy dispensing and other records, recorded data from', 'automated instruments, microfiches, photographic negatives, microfilm or magnetic', 'media, and/or x-rays Data collected during this study must be recorded on the', 'appropriate source documents. The Investigator Awareness Date of SAE should be noted', 'in the source.', 'The investigator(s)/institution(s) will permit study-related monitoring, audits, IEC/IRB', 'review, and regulatory inspection(s), providing direct access to source data documents.', '10.2', 'Case Report Forms', 'Case report forms (CRF) must be completed for each subject screened/enrolled in this', 'study. These forms will be used to transmit information collected during the study to', 'AbbVie and regulatory authorities, as applicable. The CRF data for this study are being', 'collected with an electronic data capture (EDC) system called RaveR provided by the', 'technology vendor Medidata Solutions Incorporated, NY, USA. The EDC system and the', 'study-specific electronic case report forms (eCRFs) will comply with Title 21 CFR', 'Part 11. The documentation related to the validation of the EDC system is available', 'through the vendor, Medidata, while the validation of the study-specific eCRFs will be', 'conducted by AbbVie and will be maintained in the Trial Master File at AbbVie.', 'The investigator will document subject data in his/her own subject files. These subject', 'files will serve as source data for the study. All eCRF data required by this protocol will', 'be recorded by investigative site personnel in the EDC system. All data entered into the', 'eCRF will be supported by source documentation.', '110']"
