,PageNo,Text
49,page_50,"['abbvie', 'Rovalpituzumab Tesirine', 'M16-298 Protocol Amendment 4', 'EudraCT 2016-003503-64', 'respective anatomic areas may be used if performed consistently throughout the study for', 'each individual subject and only under the circumstances described in Appendix G. Scans', 'of the chest and abdomen must be obtained; scans of the neck and pelvis must also be', 'obtained if there is documented or suspected involvement in these regions. Screening', 'radiographic assessment must include brain MRI/CT. Diagnostic/baseline pre-first-line', 'scans through screening scans will be reviewed by the investigator to determine disease', 'response status per RECIST v1.1 for eligibility and stratification. On study disease', 'response will be determined by the Investigator at each assessment according to', 'RECIST v1.1 (Appendix G, Response Evaluation Criteria for Solid Tumors', '(RECIST) V 1.1)12 and independently reviewed by Central Radiographic Assessment', 'Committee (described below). Disease/Response Assessment may be performed within', '7 days prior to the Day 1 visit.', 'Effusion (pleural, pericardial, etc.) assessments will be performed by a radiologist at each', 'on-study radiographic assessment and any new findings communicated to the Investigator', 'prior to the next dose of blinded investigational product. Effusions should contribute to', 'disease status assessment per RECIST V 1.1 only if confirmed malignant by cytology or', 'otherwise clearly disease-related; if disease progression is suspected solely based on the', 'appearance of new or increase of existing effusions, confirmation of malignant nature of', 'such effusions is strongly recommended due to known adverse event profile of', 'rovalpituzumab tesirine. If collected, effusion fluid must be tested for cytology if disease', 'progression due to appearance/worsening of effusion is suspected.', 'Isolated CNS-only progression will not require removal of the subject from therapy.', 'Refer to Section 5.2.3.2.1, Allowed Concomitant Therapy for details associated with CNS', 'only progression.', 'The EOT assessment may be omitted if the previous assessment was performed within the', 'preceding 6 weeks.', 'Scheduled tumor assessments should not be affected by delays in therapy and/or drug', 'holidays. Subjects will continue to be monitored by the same diagnostic method', '50']"
50,page_51,"['abbvie Rovalpituzumab Tesirine', 'M16-298 Protocol Amendment 4', 'EudraCT 2016-003503-64', 'throughout the study every 6 weeks after randomization, unless evidence of tumor', 'progression warrants otherwise. In some cases, mandatory dose delays due to toxicity', 'will lead to a gap between tumor assessment and dosing. In cases where this gap exceeds', '1 week, the TAMD should be contacted for guidance.', 'Subjects who discontinue treatment for reasons other than radiographic disease', 'progression will continue to be followed every 6 weeks from randomization to determine', 'the extent of tumor burden, until disease progression occurs.', 'MRI/CT of the Brain', 'MRI of the brain will be performed at protocol-specified time points as outlined in', 'Appendix C, Study Activities. Brain MRI may be substituted by CT with intravenous', 'contrast at the discretion of the Investigator. MRI/CT of the brain is required at screening', 'and when clinically indicated (e.g., if CNS progression is suspected) thereafter.', 'Central Radiographic Assessment Committee (CRAC)', 'In addition to being reviewed by the investigator and/or site staff, radiological scans will', 'be assessed by a Central Radiographic Assessment Committee (CRAC), as outlined in the', 'Appendix C, Study Activities. Sites will collect the appropriate scans and ship by courier', ""or submit electronically to the central facility at each subject's disease assessment. If, in"", 'addition to protocol-specified disease assessment modalities other modalities were used to', 'assess disease (e.g., FDG-PET, X-ray), imaging should also be transferred to the central', 'facility.', 'The EOT assessment may be omitted if the previous assessment was performed within the', 'preceding 6 weeks.', 'Subject treatment management will be based on review by the local investigator and/or', 'site staff. The investigator should treat according to clinical judgment and the CRAC will', 'make the definitive decision on tumor response or progression in regards to the PFS', 'endpoint.', '51']"
51,page_52,"['abbvie Rovalpituzumab Tesirine', 'M16-298 Protocol Amendment 4', 'EudraCT 2016-003503-64', 'Randomization and Subject Number Assignment', 'An Interactive Response Technology system (IRT) will be utilized to register subjects.', 'Subjects who complete all Screening procedures and meet the eligibility criteria will', 'proceed to randomization. Refer to Section 5.5.3 for details associated with subject', 'assignment to treatment arms.', 'Health Resource Utilization', 'Health Resource Utilization will be documented at each clinic visit per Appendix C,', 'Study Activities. Information regarding hospitalizations, emergency room visits, and', 'physician office visits will be collected since the last study visit.', 'Patient Reported Outcomes (PRO)', 'Health-related quality of life and symptom assessments will be performed per', 'Appendix C, Study Assessments using the EORTC QLQ-C30, the EORTC QLQ-LC13,', 'and the European Quality of Life-5 Dimensions (EQ-5D-5L). The European Organization', 'for Research and Treatment of Cancer Quality of Life Questionnaire', '(EORTC QLQ-C30) 13 is used as general cancer-specific instrument. The', 'EORTC QLQ-C30 has 30 items and 5 functional domain scales: Physical, Role,', 'Emotional, Social, and Cognitive; two items evaluate global quality of life. The EORTC', 'QLQ-C30 core questionnaire can be supplemented by the additional lung module EORTC', 'QLQ-LC13, resulting in a 43-item disease and cancer site-specific quality of life and', 'symptom questionnaire. The EORTC QLQ-LC13 module items evaluate symptoms such', 'as cough, haemoptysis, shortness of breath, sore mouth or tongue, dysphagia, tingling', 'hands or feet, hair loss, and pain. The EuroQol 5 Dimensions 5 Level (EQ-5D-5L) is a', 'generic preference instrument that has been validated in numerous populations. The', 'EQ-5D-5L is composed of 5 questions and a visual analog scale (VAS) assessing overall', 'health that can be converted into a single health status or ""utility"" score for use in an', ""economic evaluation to adjust life-years gained by the subject's health-related quality of"", 'life.', '52']"
52,page_53,"['abbvie', 'Rovalpituzumab Tesirine', 'M16-298 Protocol Amendment 4', 'EudraCT 2016-003503-64', 'Fluid Retention Questionnaire (Including Subject Daily Weight)', 'Throughout the treatment period as outlined in the Appendix C, Study Activities, subjects', 'will be asked about the development of any new or worsening peripheral edema or', 'dyspnea (Appendix I, Fluid Retention Questionnaire). The assessments on Days 8, 15,', '29, and 36 may take place by phone, with the site contacting the subject and reviewing the', 'questionnaire.', 'Starting on Day 1 through the EOT visit, subjects will maintain a diary of daily weights', '(captured on the Fluid Retention Questionnaire). Subjects should be instructed to use a', 'consistent device throughout the study. The site will advise subjects to contact the site in', 'cases where sudden weight gain (5% or greater) is observed for possible assessment in the', 'clinic.', 'Non-Treatment Cycle Visit', 'In order to establish 12 weeks of non-treatment after two dosing cycles, every third cycle', 'of treatment should be omitted and a clinic visit conducted, as outlined in Appendix C,', 'Study Activities. The visit should be performed after the Disease Response/Assessment', 'has been conducted and reviewed by the Investigator. The subject should continue to', 'complete the Fluid Retention Questionnaire, including conducting daily weight', 'assessments, and the site should contact the subject weekly during this 42 day non-', 'treatment cycle to review the questionnaire and assess for any adverse events or changes', 'in concomitant medications. The following cycle of treatment may be resumed', '42 days 3d if the subject has not met any reason for study treatment discontinuation as', 'outlined in Section 5.4.', 'End of Treatment (EOT) Visit', 'The visit at which an investigator identifies disease progression or a subject meets other', 'criteria for study treatment discontinuation will be considered the End of Treatment Visit.', 'The EOT procedures should be done within 7 days of documented decision to discontinue', 'treatment and prior to subjects beginning any new anti-cancer therapy if possible. The', '53']"
53,page_54,"['abbvie', 'Rovalpituzumab Tesirine', 'M16-298 Protocol Amendment 4', 'EudraCT 2016-003503-64', 'EOT visit is the last visit during the treatment phase before subjects begin the Post', 'Treatment Follow Up and/or Survival Follow Up phase. The reason(s) for the', 'discontinuation from study treatment will be recorded and assessments will be performed', 'per Appendix C, Study Activities.', 'Disease/Response Assessment, CT/MRI of the brain (if applicable), and submission of', 'scans to the CRAC, may be omitted if performed within the last 6 weeks.', 'Post-Treatment Follow Up', 'For all subjects who discontinue study treatment for reasons other than disease', 'progression, the first follow-up visit will occur at 6 weeks (= 1 week) after the last', 'Disease Response/Assessment, then every 6 weeks (= 1 week) until disease progression or', 'initiation of new anti-cancer therapy, whichever occurs first. Refer to Appendix C, Study', 'Activities for details of required assessments.', 'At disease progression, an optional collection of fresh tumor material may be conducted', '(Section 5.3.1.2, Collection and Handling of Biomarker and Optional Exploratory', 'Research has details regarding Tumor Material at Time of Disease Progression).', 'Survival Follow Up (OS)', 'After disease progression or if subjects stop treatment and decline further study', 'radiographic assessments prior to the endpoint of disease progression, subjects will be', 'followed for subsequent anti-cancer therapies (dates and responses), as well as survival', 'status, every 6 weeks* (= 1 week) until the endpoint of death, the subject becomes lost to', 'follow-up or withdraws consent, or termination of the study by AbbVie, whichever occurs', 'first (*or as requested by AbbVie to support data analysis). If the subject withdraws from', 'study follow-up, the study staff may use a public information source (such as county', 'records) to obtain information about survival status only, as appropriate per local', 'regulations. Refer to Appendix C, Study Activities for details of required assessments.', '54']"
54,page_55,"['abbvie', 'Rovalpituzumab Tesirine', 'M16-298 Protocol Amendment 4', 'EudraCT 2016-003503-64', '5.3.1.2', 'Collection and Handling of Biomarker and Optional', 'Exploratory Research Samples', 'Biomarker Samples', 'Blood, tumor material, and serosal fluid will be collected as noted in Appendix C, Study', 'Activities and may be utilized to evaluate known and/or novel markers (nucleic acids,', 'peptides/proteins and/or metabolites) of disease status, related conditions or to evaluate', 'the association with pharmacokinetics, safety or efficacy. Samples will also be utilized', 'for the development of Companion Diagnostics in conjunction with rovalpituzumab', 'tesirine clinical development. The biomarker rationale is discussed in the Biomarker', 'Research Variables Section (Section 5.3.6).', 'All biomarker samples should be labeled and shipped as outlined in the study-specific', 'laboratory manual.', 'AbbVie (or people or companies working with AbbVie) will store the samples in a secure', 'storage space with adequate measures to protect confidentiality. The samples may be', 'retained while research on rovalpituzumab tesirine (or drugs of this class) or this disease', 'and related conditions continues, but for no longer than 20 years after study completion,', 'or per local requirement.', 'Tumor Material at Screening', 'For all subjects, tumor material representative of the qualifying malignancy must be', 'submitted to a central laboratory for determination of DLL3 expression. An archived', 'tumor specimen or fresh tumor material (obtained via on-study biopsy procedure if', 'archival tumor specimen is unavailable) may be used for DLL3 expression evaluation by', 'methods such as but not necessarily limited to immunohistochemistry (IHC). Additional', 'analyses, such as routine hematoxylin and eosin for morphology, IHC for confirmation of', 'diagnosis (e.g., for synaptophysin, chromogranin-A, or CD56), or scoring of immune', 'infiltrates (e.g., IHC for CD3+, CD4+, CD8+, and Foxp3+ cells) may be performed.', '55']"
55,page_56,"['abbvie', 'Rovalpituzumab Tesirine', 'M16-298 Protocol Amendment 4', 'EudraCT 2016-003503-64', 'Material may also be utilized for exploratory biomarkers research of drug sensitivity,', 'resistance, or disease biology.', 'Blood (Plasma) for Inflammatory Markers and Circulating Tumor DNA (ctDNA)', 'At the indicated times noted in Appendix C, Study Activities, blood will be collected,', 'processed to plasma for testing of inflammatory markers including erythrocyte', 'sedimentation rate (ESR), C-reactive protein (CRP), antinuclear antibodies (ANA),', 'rheumatoid factor (RF), and ctDNA. On Day 1 (-3 day window is permitted) of each', 'cycle, the collection will be pre-infusion. A sample will also be collected at the EOT or at', 'the time of disease progression.', 'Blood (Serum) for Tumor and Soluble Markers', 'At the indicated times noted in Appendix C, Study Activities, blood will be collected,', 'processed as serum for possible testing of tumor-specific biomarkers that may reflect', 'disease burden such as but not necessarily limited to neuron-specific enolase (NSE) and', 'biomarkers that may be related to the pharmacodynamics effects of rovalpituzumab', 'tesirine such as but not necessarily limited to soluble DLL3, circulating chemokines, or', 'cytokines such as vascular endothelial growth factor (VEGF), epidermal growth factor', '(EGF), interleukin (IL)-6, or IL-8. Other biomarkers based on emerging science may also', 'be assessed. On Day 1 (-3 day window is permitted) of each cycle, the collection will be', 'pre-infusion. A sample will also be collected at the EOT or at the time of disease', 'progression.', 'Blood for Circulating Tumor Cells', 'At the indicated times noted in Appendix C, Study Activities, blood samples will be', 'collected for assessment and characterization of circulating tumor cells (CTCs) as a', 'possible reflection of disease burden and DLL3 expression to study association with', 'efficacy. Whole blood sample will be collected for CTC analysis at pre-dose on Cycle 1', 'Day 1 (-3 days window is permitted) and EOT only at specific sites based on feasibility.', '56']"
56,page_57,"['abbvie', 'Rovalpituzumab Tesirine', 'M16-298 Protocol Amendment 4', 'EudraCT 2016-003503-64', 'Serosal Fluid', 'Any pericardial, pleural, and/or ascitic fluid collected as part of routine care (e.g., as part', 'of a therapeutic thoracentesis, pericardiocentesis, or paracentesis) will be procured for', 'possible PK, pharmacodynamic, and/or biomarker testing. See the laboratory manual for', 'additional details.', 'Pharmacogenetic Samples', 'A whole blood sample for DNA isolation will be collected on Cycle 1 Day 1 (pre-', 'infusion) and End of Treatment Visit from each subject. Pharmacogenetic collection', 'should occur unless precluded by local or national regulations or policies.', 'Samples will be shipped frozen to AbbVie or a designated laboratory for DNA extraction', 'and long-term storage. Instructions for the preparation and shipment of the', 'pharmacogenetic exploratory research samples will be provided in a laboratory manual.', 'Optional Exploratory Research Samples', 'Subjects will have the option to provide samples for exploratory research. Subjects may', 'still participate in the main study even if they decide not to participate in this optional', 'exploratory research.', 'AbbVie (or people or companies working with AbbVie) will store the exploratory', 'research samples in a secure storage space with adequate measures to protect', 'confidentiality. The samples will be retained while research on rovalpituzumab tesirine', '(or drugs of this class) or this disease and related conditions continues, but for no longer', 'than 20 years after study completion. The procedure for obtaining and documenting', 'informed consent for exploratory research samples is discussed in Section 9.3.', 'Tumor Material at the Time of Disease Progression', 'An optional tumor material collection by biopsy procedure may be obtained at the time of', 'disease progression, from subjects who consent to undergo biopsy procedure to better', '57']"
57,page_58,"['abbvie', 'Rovalpituzumab Tesirine', 'M16-298 Protocol Amendment 4', 'EudraCT 2016-003503-64', 'understand mechanisms of resistance and expression of DLL3. Other nucleic acid or', 'protein based biomarkers related to the response to rovalpituzumab tesirine and SCLC', 'biology may be assessed.', 'Samples will be shipped to AbbVie or a designated laboratory for long-term storage.', 'Instructions for the preparation and shipment of the biomarker exploratory research', 'samples will be provided in a laboratory manual.', '5.3.2', 'Drug Concentration Measurements', '5.3.2.1', 'Collection of Samples for Analysis', 'Approximately 6 mL of blood will be collected by venipuncture for pharmacokinetic', '(PK), Anti-therapeutic antibody (ATA), and neutralizing antibodies (nAb) testing as', 'indicated in Appendix C, Study Activities. Two samples will be collected at each', 'treatment cycle. The pre-infusion sample will be collected prior to dosing on Day 1', '(-3 days window is allowed) and the second sample will be collected within 60 minutes', 'post-infusion. Only one collection will be required at the Non-Treatment Cycle visit and', 'EOT visit. Blood will be processed to serum and three aliquots generated, each', 'containing approximately 0.8 mL of serum.', 'The date and time of each sample collected will be recorded to the nearest minute.', '5.3.2.2', 'Handling/Processing of Samples', 'Specific instructions for collection of blood/serum samples and subsequent preparation', 'and storage of the samples for the assays will be provided by the central laboratory,', 'AbbVie, or its designee.', '5.3.2.3', 'Disposition of Samples', 'The frozen serum samples for the rovalpituzumab tesirine ADC, rovalpituzumab tesirine', 'ADC ATA, and neutralizing antibodies (nAb) assays will be packed in dry ice sufficient', 'to last during transportation and shipped from the study site to the central laboratory.', '58']"
58,page_59,"['abbvie Rovalpituzumab Tesirine', 'M16-298 Protocol Amendment 4', 'EudraCT 2016-003503-64', 'An inventory of the included samples will accompany the package and an electronic copy', 'of the manifests (including subject number, study day, the time of sample collection and', 'barcode) will be sent to the contact person at gprd_lupet@abbvie.com.', '5.3.2.4', 'Measurement Methods', 'Serum concentrations of rovalpituzumab tesirine ADC and relative titers of', 'rovalpituzumab tesirine ADC ATA will be determined using validated methods. Any', 'additional related analytes may be analyzed using non-validated methods. Serum samples', 'collected for the PK, ATA and nAb analysis may be used for future assay development or', 'validation activities. Rovalpituzumab tesirine ADC nAb samples upon request may be', 'used for the analysis of neutralizing anti-drug antibodies in a validated assay.', '5.3.3', 'Efficacy Variables', '5.3.3.1', 'Definition of Disease Progression', 'Disease progression will be defined as radiographic progression of disease by RECIST', 'version 1.1. Refer to Appendix G, Response Evaluation Criteria for Solid Tumors', '(RECIST) version 1.1 for Tumor Response. 12 Effusions (pleural, pericardial, etc.) will', 'contribute to disease response assessment only if confirmed malignant by cytology or', 'otherwise clearly disease-related; if disease progression is suspected solely based on the', 'appearance of new or increase of existing effusions, confirmation of malignant nature of', 'such effusions is strongly recommended prior to making the decision on treatment', 'discontinuation due to known adverse event profile of rovalpituzumab tesirine. If', 'collected, effusion fluid must be tested centrally and/or locally for cytology if disease', 'progression due to appearance/worsening of effusion is suspected.', '5.3.3.2', 'Primary Variables', 'The primary endpoints are progression-free survival (PFS) determined by a Central', 'Radiographic Assessment Committee (CRAC) per RECIST V. 1.1 and overall survival', '(OS) in DLL3high population.', '59']"
59,page_60,"['abbvie', 'Rovalpituzumab Tesirine', 'M16-298 Protocol Amendment 4', 'EudraCT 2016-003503-64', '5.3.3.3', 'Secondary Variables', 'The secondary variables are progression-free survival (PFS) determined by a Central', 'Radiographic Assessment Committee (CRAC) per RECIST V. 1.1 and overall survival', '(OS) in randomized set population. Change in patient reported outcome (PRO) with', 'physical functioning as measured by European Organization for Research and Treatment', 'of Cancer (EORTC) Quality of Life Questionnaire (QLQ-C30) in randomized set', 'population is also a secondary endpoint in this study.', '5.3.3.4', 'Exploratory Variables', 'The exploratory variables are progression-free survival (PFS) based on investigator', 'assessment, objective response rate (ORR) per the CRAC and investigator assessment,', 'respectively, clinical benefit rate (CBR) per the CRAC and investigator assessment,', 'respectively, and the duration of response (DOR) per the CRAC and investigator', 'assessment, respectively. Response assessment will be based on RECIST v1.1. Changes', 'in patient reported outcomes (PROs) as measured by EQ-5D-5L and all other PRO', 'domains (except for physical functioning) as measured by European Organization for', 'Research and Treatment of Cancer (EORTC) Quality of Life Questionnaire (QLQ-C30)', 'and Lung Cancer Module (QLQ-LC13) are also exploratory endpoints in this study.', '5.3.4', 'Safety Variables', 'AbbVie will assess adverse events, laboratory data, ECGs and vital signs throughout the', 'study. Adverse events intensity and laboratory evaluation changes will be assessed by', 'utilizing NCI CTCAE Version 4.0. 11', 'During the conduct of the study, the AbbVie medical and safety team will be monitoring', 'blinded, subject laboratory results and serious adverse event data as they are reported.', 'Safety endpoints will be summarized using data from the Safety set. Safety analyses will', 'involve examination of the incidence, severity, and type of treatment-emergent adverse', 'events (TEAEs) reported, changes in vital signs and laboratory test results from baseline', '(the assessment prior to first dose) to specified time points throughout the study.', '60']"
60,page_61,"['abbvie', 'Rovalpituzumab Tesirine', 'M16-298 Protocol Amendment 4', 'EudraCT 2016-003503-64', '5.3.5', 'Pharmacokinetic Variables', 'Serum concentrations of rovalpituzumab tesirine ADC as well as the timing and incidence', 'of ATAs will be tabulated and summarized.', '5.3.6', 'Biomarker and/or Optional Exploratory Research Variables', 'Biomarker Research Variables', 'Blood, serosal fluid, and tumor material samples will be collected to conduct analyses to', 'investigate biomarkers. The types of biomarkers to be analyzed may include, but are not', 'limited to, nucleic acids, proteins, lipids or metabolites.', 'Tumor specimen and CTCs will be tested for DLL3 expression and analyses will be', 'performed to correlate the expression levels to rovalpituzumab tesirine response.', 'Enumeration of CTCs, soluble DLL3 in plasma, or markers that are related to the disease', 'or to drug response will be measured at baseline and post-treatment. The information', 'learned from analyzing these samples may be used to investigate factors influencing', 'response to treatment, pharmacodynamics, PK, safety, scientific questions related to', 'SCLC, and/or in the development of new therapies and diagnostic tests. The results of', 'biomarker testing may not be included with the study summary.', 'Whole blood for pharmacogenetic analysis may include but not be limited to DLL3,', 'ASCL1, or NEUROD1.', 'Exploratory Research Variables', 'Optional samples may be collected to conduct exploratory investigations into known and', 'novel biomarkers. The types of biomarkers to be analyzed may include, but are not', 'limited to, nucleic acids, proteins, lipids or metabolites. The samples may be analyzed as', ""part of a multi-study assessment of factors influencing the subjects' response to the"", 'blinded investigational product (or drugs of the same or similar class) or the development', ""and progression of the subjects' disease or related conditions. The samples may also be"", '61']"
