,PageNo,Text
35,page_36,"['determine if there are significant differences between eligible participants who enroll and those who do not. If', 'an eligible patient refuses to participate in the study, research staff member will ask the patient about the', 'reason for declining study participation and record it on the patient Screening Form. Patients who decline but', 'meet eligibility criteria will continue usual clinical care in the VAPSHCS Pain Clinic for interventional spine', 'procedures, including LRFA, as they would normally do.', 'Understanding the reasons why Veteran patients are not interested in study participation is an essential step', 'towards making the research process acceptable to Veterans in the future. Patients who decline will be asked', 'verbally whether they would be willing to answer up to 6 questions about why they are not interested in study', 'participation. We will inform patients that any answers they provide will be recorded without reference to any', 'identifying information about them, so there would be no way to discern by looking at this information from', 'what patient the information came from. Thus, this type of answering questions is different than what would be', 'in a research study, and we will assure the patient that answering these questions does not constitute', ""participation in the study. We provide the script for these questions as Attachment QQ ('Questions to Non-"", ""participants')"", 'Study participants will be compensated for their time spent completing the research procedures for this study,', 'which include the time spent in the Informed Consent process, and completing the study assessments (in', 'person or telephone questionnaires). They are not compensated for the lumbar procedures (LRFA or simulated', 'LRFA with targeted steroid injections) or CBT (AcTIVE-CBT or TBSCE) they receive during the 3 months of', 'main study follow-up, since these are usual clinical care processes appropriate for LRFA-eligible individuals', 'with chronic low back pain. Compensation will be made by checks mailed to participants. Payments will', 'happen after the study visits on the day of randomization, the 3-month follow-up, and again at the end of the', 'optional period of more extended follow-up after 3-months, unless participants express that they would wish', 'instead to be paid monthly. Compensation will be by check, which will usually be mailed to participants within', '4-8 weeks after completing each component. However, due to possible delays, participants will be told it could', 'be up to 4 months after completing each component that they will receive payment. Compensation is as', 'follows:', 'VISIT 1: Information session, informed consent, and pre-assessment ($ 35)', 'VISIT 2: The ""baseline\' study assessment, which involves completing questionnaires ($ 25)', 'VISIT 3: A questionnaire completed by telephone ($ 10)', 'VISIT 4: A questionnaire completed by telephone ($ 10)', 'VISIT 5: A questionnaire completed by telephone ($ 25)', 'Additional compensation for completing all 3 sets of telephone assessments ($ 15)', ""An interim survey' questionnaire that may be offered in the event that a participant elects a major"", 'change to the interventional spine treatment or behavioral treatment regimen prior to the expected', 'earliest point of unblinding at the 3-month follow-up ($ 10)', 'Optional study visits', 'VISITS 6-14: If participant decides to continue participation in this study after Visit 5, these are study', 'visits that will take place over the telephone ($ 10 for each monthly telephone questionnaire). We will', 'clarify that optional study visits will not take place after the formal end of the study, so some participants', 'recruited late during the study will have fewer ""optional"" study visits that they can complete.', 'In sum, participants may be reimbursed up to $120 for completing all study assessments processes over', '3 months. In addition, participants may be reimbursed up to a maximum of $30-90 for optional study', ""assessments between months 4 and 12 and an additional $10 if an interim survey' is completed."", '5.3 Informed Consent Procedures', 'VA Puget Sound IRB Protocol Template - Version 1.0: 04/2018', 'Page 36 of 55', 'VA Puget Sound IRB Approved', '03/12/2020']"
36,page_37,"['A Waiver of Informed Consent was obtained to cover screening/recruitment procedures. Informed consent', 'for study participation is as described below.', 'A. Informed Consent:', 'We will obtain written consent from potential study participants following the final screening, after', 'completion of the 2nd set of MBBs.', 'During Informed Consent, potential RCT participants will:', 'i. Receive basic information concerning the overall study goals, which involve simultaneous', 'randomization to 2 types of active treatment: procedural treatments that target the lumbar', 'facet joints, and behavioral treatments based on principles of CBT for chronic pain.', 'ii. Receive detailed information concerning the study procedures;', 'iii. Have the opportunity to consider all available options for treatment of pain;', 'iv. Receive adequate time to raise questions and voice concerns;', 'V. Be questioned to assure that they understand all information provided;', 'vi. Provide written voluntary consent to participate in continued screening processes.', 'B. Detailed Description of Informed Consent:', ""In the section below, all uses of the word 'patients' prior to completion and signing of the informed"", 'consent form (ICF) refers to potential candidates for study participation beyond the Informed Consent.', 'Please see the Informed Consent documents themselves.', 'Patients will be informed during the consenting process that if they are determined to be fully eligible', 'for the study and choose to participate, they will be randomized to LRFA or a simulated LRFA', 'procedure including targeted steroid injections to the facet nerves, and to two types of telehealth-', 'administered behavioral treatments for pain (one brief, one extended). All treatments (both the', 'procedural treatments and behavioral treatments) are ""active"" treatments expected to improve pain', 'and/or pain-related functional limitations, and all are standard of care treatments in the US.', 'Because in routine clinical practice our experience has been that patients receiving invasive lumbar', 'pain procedures such as LRFA and lumbar steroid injections are often unclear of some specifics of', 'these procedures and their risks, our informed consent document differs from typical', 'recommendations in that it enumerates the specific physical risks of these procedures, even though', 'these involve the same risks as performed in routine clinical care. We have chosen this route to', ""ensure that participants are fully informed. However, if the IRB reviewers' have further questions or"", 'recommend that these risks of usual care practices are omitted, we will be happy to provide further', 'information and/or revise accordingly.', 'Study staff will describe that radiofrequency ablation (LRFA) is a widely used therapy for relieving low', 'back pain, but that there remains debate about its effectiveness, whether other less invasive', 'procedures may be equivalent (such as steroid injections) and whether long-term negative sequelae', 'from LRFA can involve the joints, adjacent muscles or intervertebral discs. Patients will be informed', 'that there is some possibility that at least some of the pain-relieving effect of LRFA may not be due to', 'the nerve destruction itself, but due to the local anesthesia used, the direct mechanical effect of the', 'needles/electrodes on the tissues in the back, nonspecific effects, or other things that we do not know', 'yet. Patients will also receive a description of the targeted steroid injections that will be administered', 'as part of the simulated LRFA control procedure, and how these procedures may have therapeutic', 'effects, without possible long-term negative sequelae from nerve destruction (as in LRFA) involved', 'joints, or adjacent muscles or intervertebral discs. Patients will also be informed that there is also', 'VA Puget Sound IRB Protocol Template - Version 1.0: 04/2018', 'Page 37 of 55', 'VA Puget Sound IRB Approved', '03/12/2020']"
37,page_38,"['uncertainty about the true effectiveness of targeted steroid injections, similar to the situation with LRFA', 'effectiveness. The risks of the LRFA procedure will be discussed, including that it entails applying heat', 'to a nerve that supplies the facet joint (which destroys the nerve at least temporarily) and applying', 'anesthetic around the nerve to the facet joint. Risks will be noted, including infection, bleeding, nerve', 'damage, pain at the injection site, allergic reaction, and worsening of back pain. The risks of the', 'simulated LRFA control procedure with targeted steroid injections will also be discussed, which', 'generally involve the same possible risks as LRFA, but with a lower expected frequency of such risks', 'since the nerves are not destroyed. Patients will be informed that, if they meet all inclusion criteria and', 'are ultimately randomized, they will have a 50% chance (1:1 randomization) that they will not receive', 'LRFA initially, but will receive simulated LRFA with targeted steroid injections instead. Potential risks', 'of enrolling in the trial and being randomized to the control procedure will be discussed, including the', 'possibility that they may continue to experience back pain. Potential benefits of enrolling in the trial', 'and being randomized to the control procedure will be discussed, including the possibility that the', 'patient may have back pain improvement and avoid the need for LRFA, surgery or other interventions', 'for pain and that closer follow-up than usual will be given.', 'Study staff will also describe to potential participants that many behavioral treatments for CLBP are', ""available, and some (such as CBT) have evidence of effectiveness. However, we don't know what"", 'components of CBT-related treatments create these positive effects. We will explain moreover that', 'CBT, even video-based CBT such as the AcTIVE-CBT intervention, consumes substantial Veteran', 'time which may not result in any effects beyond those of the initial education, the provision of written', 'materials, and the formal structure needed for a patient-directed graded, progressive, education and', 'self-management program. Therefore, this study involves comparing two programs of CBT which are', 'delivered by telehealth methods, intended to make it easier for Veterans to access CBT, without the', 'burdens of travel and transportation to repeated face-to-face appointments. One program is an', '""extended CBT\' program, which involves a program requiring more appointments and video-based', 'sessions with a psychologist (ACTIVE-CBT). The other program is a ""brief CBT\' program, which', 'involves a single telephone-based session with a psychologist, and a structured program for education', 'and for the patient to apply the concepts of CBT independently and at their own pace, using formal', 'written materials, with subsequent check-ins by the psychologist as needed (TBSCE). Patients will be', 'informed that, if they meet all inclusion criteria and are ultimately randomized, they will also have a', '50% chance (1:1 randomization) of receiving one of these 2 treatments. The extended CBT treatment', '(AcTIVE-CBT) will involve eight 1-hour video sessions with a psychologist and the provision of', 'educational materials; and the brief CBT treatment (TBSCE) will involve one 1-hour telephone session', 'with a psychologist and the provision of educational materials, with one follow-up phone call by the', 'psychologists approximately 1-2 months after the 1st session of TBSCE, and focused troubleshooting', 'with any problems that might arise. Both treatments will involve the patient needing to wear a Fitbit', 'activity tracker daily for 3 months. However, the AcTIVE-CBT treatment will involve specific therapy-', 'related interactions surrounding the Fitbit unit. Participants in the AcTIVE-CBT group will be given a', '""pledge\' form which indicates their intent to try to upload their information to the Fitbit website regularly', 'and consult their Fitbit regularly during the study, to the extent that they are able (Attachment O -', ""Pledge Visit 2 Extended). Participants in the TBSCE group will be given a 'pledge' form which"", 'indicates their intent to try to upload their information to the Fitbit website regularly, but will not include', 'prompts for participants to consult their Fitbit during the study, and will ask them not to spend time', 'reviewing their information on the Fitbit website or using the Group or Friend functions, to the extent', 'that they are able, during the first 3 months of the study (Attachment N - Pledge Visit 2 Brief). At the', 'conclusion of the study, unless participants elect not to do so, participants will be provided with an', 'official report containing their study data, including their activity tracker data. Participants may keep the', 'Fitbit unit/s that they use during the study, after study conclusion, irrespective of their group', 'assignment.', 'VA Puget Sound IRB Protocol Template - Version 1.0: 04/2018', 'Page 38 of 55', 'VA Puget Sound IRB Approved', '03/12/2020']"
38,page_39,"['In addition, patient consent will include that the study will follow participants for 3 months and collect', 'information on back specific functional status, pain, Fitbit data, health-related quality of life, and other', 'study measures. Potential participants will consent either to data collection for 3 months only, or to', 'also include an ongoing data collection on a monthly basis after the 3-month assessment, for up to', '9', 'additional months, or until the funding period ends (whichever date comes first). Participants may', 'change their mind about the duration of time they wish to participate in data collection at any time', 'during the study.', 'Potential participants will be informed that, if they choose to participate in the study, they will remain', 'blinded to which study interventional procedure they received (LRFA VS. simulated LRFA) until 3', 'months. Pledge forms will ask participants to not actively seek out to find answers for which procedural', 'group they are in. At 3 months they will have the opportunity to become unblinded if they wish, and', 'make any usual health care decisions related to CLBP that they wish at that time, with or without the', 'input of their treating physician. This might include having LRFA, irrespective of whether they had', 'already received LRFA or simulated LRFA as part of this study. They will also be informed that if they', 'wish to become unblinded at any time during the study (to seek treatment off protocol for example) or', 'discontinue enrollment in the trial, they can do so. Potential participants will also be told that at 3', 'months they can be informed about which of the 2 behavioral interventions (AcTIVE-CBT and TBSCE)', ""constituted the official study 'control'. At 3 months they will have the opportunity to become unblinded"", 'to this information if they wish, and make any usual health care decisions related to CLBP that they', 'wish at that time, with or without the input of their treating physician. This might include other', 'behavioral treatments including conventional in-person CBT, typical video-based telehealth as offered', 'by the VAPSHCS TREWI program, or others, irrespective of whether they received the AcTIVE-CBT', 'or TBSCE treatment as part of this study. They will also be informed that if they wish to become', 'unblinded at any time (and to pursue usual care outside of the study protocol) or discontinue', 'enrollment in the trial, they will be allowed to do so at their discretion.', 'The consent process will occur at a time deemed mutually feasible for the Veteran patient and staff', 'member and coordinated on a case-by-case basis. The consent process will take place in a private', 'location (e.g., a medical exam room or private conference room). In most instances, this will take place', 'in the Building 100 Room 7C-130A (in the Pain Clinic clinical area). However, if Room 7C-130A is', 'occupied, this will take place in another unoccupied patient room in the Pain Clinic clinical area, or in', 'Room 7C-14.', 'A research staff member (see Study Staff Form) will review each section of the IRB-approved ICF,', 'inviting discussion to ensure comprehension. Potential participants will be asked to repeat back', 'understanding of this material as necessary. Individuals will not be permitted to participate if there is', 'any question as to whether a person is able to provide informed consent. Study staff will be trained to', 'ensure competency to discuss informed consent and strategies to ensure there is no coercion.', 'Potential participants will be provided with as much time as needed to review the ICF and ask the', 'research staff member questions about the ICF, their rights as human participants, and participation in', 'the study. Potential participants will be fully informed of all risks and benefits prior to giving their written', 'informed consent and prior to enrollment in the study. To minimize the possibility of coercion or undue', 'influence prospective subjects will be informed that their decision regarding involvement will in no way', 'influence their clinical care and they will be asked if they need some time to consider their involvement', 'before providing consent. All study personnel will have completed the necessary human subjects', 'protections training per VA policy. Informed consent will be conducted in English. Prospective subjects', 'will be asked if they are able to understand English and whether they feel comfortable speaking it.', 'If during the course of this contact the potential participant has questions that cannot be addressed by', 'research staff, one of the study investigators or the research manager (depending on the nature of the', 'VA Puget Sound IRB Protocol Template - Version 1.0: 04/2018', 'Page 39 of 55', 'VA Puget Sound IRB Approved', '03/12/2020']"
39,page_40,"['questions) will follow up with the potential participant to answer the questions. Potential participants', 'may take time to think about participating and render a decision in a subsequent visit.', 'Research staff will also review a HIPAA authorization form with the potential participant that permits', 'research staff to review CPRS encounters to extract data collected during treatment. The potential', 'participant will then be asked to sign and date the ICF. Research staff will also date and sign the ICF.', 'All participants will be offered a copy of the signed ICF for their personal records. A note of enrollment', 'will be made in CPRS.', 'Research staff will file original copies of both the consent and HIPAA forms in the Seattle ERIC offices,', 'kept separate from data collected during screening and subsequent data collected during participation', 'in the study. Research staff will provide participants with staff contact information after the consent', 'process. Participants will also be provided the VAPSHCS research brochure.', '5.4 Inclusion/Exclusion Criteria', 'Table 4: Study Inclusion/Exclusion Criteria and Justification', 'Initial Screening Criteria (pre-screening)', 'Inclusion Criteria', 'Exclusion Criteria', 'Rationale/ Indications for', 'Exclusion Criteria', 'Chronic low back pain of duration 3 months,', 'defined by: ""How long has back pain has', 'been an ongoing problem for you. Response', 'Clinical suspicion that the current low back pain', 'Primarily due to', 'of ""> 3 months"" defines CLBP.63', 'symptoms have a significant and sustained', 'appropriateness for the', 'component that is attributed to lumbar spine-', 'LRFA intervention VS.', 'Low back pain intensity numerical rating scale', 'related syndromes including lumbosacral radicular', 'simulated LRFA', '(NRS) 4 (must be 4 or higher)', 'syndrome (radiculopathy), symptomatic lumbar', 'spinal stenosis (neurogenic claudication), with', 'confirmatory imaging findings, spinal instability', ""requiring surgery, or other 'red flag' conditions"", '(infection/ malignancy/fracture)', 'Has failed at 1st line rehabilitative treatments,', 'Pregnant females, prisoners, or the cognitively', 'Primarily due to', 'including physical therapy, yoga, tai chi,', 'impaired (see also below)', 'appropriateness for the', 'chiropractic or osteopathic manipulation,', 'LRFA intervention vs.', 'and/or massage.', 'simulated LRFA', 'Patient is considered as a candidate for', 'Prior lumbar RFA', 'Primarily due to', 'unilateral or bilateral LRFA at 2-4 spinal levels', 'appropriateness for the', '(between L1 and S1)', 'LRFA intervention vs.', 'Prior lumbar spine surgery involving the levels', 'simulated LRFA', ""'Positive responses' to 1st set of lumbar"", 'where LRFA is to be performed, within the past 2', 'MBBs, including 1) >50% pain improvement', 'VA Puget Sound IRB Protocol Template - Version 1.0: 04/2018', 'Page 40 of 55', 'VA Puget Sound IRB Approved', '03/12/2020']"
40,page_41,"['of typical low back pain, and 2) onset of', 'years', 'typical lumbar back pain relief within 30 mins', 'and relief lasting at least 30 mins after the', 'Lumbar fusion or instrumentation involving the', 'onset of initial pain relief', 'levels where LRFA is to be performed', 'Depending on the distribution of recruited', 'Onset of the current low back pain symptoms prior', ""participants' MBB responses (50-79% vs."", 'to a aminectomy/discectomy/foraminotomy', '80%) after the initial period of recruitment,', 'involving the levels where LRFA is to be', 'we may restrict study participation in the', 'performed, or within 2 years of a prior', 'participant selection phase in order to', 'aminectomy/discectomy/foraminotomy involving', 'oversample participants who have >80% relief', 'the levels where LRFA is to be performed', 'with MBBs.', 'Must have access to a computer, tablet, or', 'Prior CBT for chronic pain (a full course focused', 'Primarily due to', 'smartphone with internet access at home or', 'on pain, >4 sessions)', 'appropriateness for the', 'at work (not via a public resource such as the', 'AcTIVE-CBT VS. TBSCE', 'public library)', 'Must be able to read English, provide', 'informed consent and complete the', 'assessment instruments accurately', 'Primary psychotic or major thought disorder', 'Primarily due to', '(lifetime), any active suicidal/homicidal ideation', 'appropriateness for the', '(past 6 months), unstable or severe', 'AcTIVE-CBT VS. TBSCE', 'psychiatric/behavioral conditions (e.g. delirium,', 'mania, psychosis)', 'Hospitalization for psychiatric reasons involving', 'Primarily due to', 'psychosis other than suicidal ideation, homicidal', 'appropriateness for the', 'ideation, and/or PTSD, in the past 5 years', 'AcTIVE-CBT vs. TBSCE', 'Cognitive limitations that would prevent', 'Primarily due to', 'participation in AcTIVE-CBT or the control', 'appropriateness for the', 'behavioral intervention (score of 5/10 or less on', 'AcTIVE-CBT vs. TBSCE', 'the Short Portable Mental Status Questionnaire)', 'Severe medical comorbidities posing major', 'Primarily due to general', 'functional limitations in ambulation and function or', 'study participation', 'medical prognosis, including vascular, pulmonary', 'or coronary artery disease, metastatic cancer.', 'Primarily due to general', 'Exclude patients with MD-diagnosed fibromyalgia', 'study participation', 'or chronic widespread pain', 'Final Screening Criteria', 'Must meet all of the above Initial Screening', 'Must continue to meet all of the above Initial', 'Inclusion Criteria', 'Screening Exclusion Criteria', ""'Positive responses' to 2st set of lumbar"", 'MBBs, including 1) >50% pain improvement', 'VA Puget Sound IRB Protocol Template - Version 1.0: 04/2018', 'Page 41 of 55', 'VA Puget Sound IRB Approved', '03/12/2020']"
