,PageNo,Text
30,page_31,"['iv.', 'Research staff will describe the study, answer any questions, and elicit information to complete', 'the Initial Screening assessment (see Table 4 for inclusion/exclusion criteria) and collect basic', 'demographic data only. Those patients who are interested in participation and meet study', 'criteria will be followed to determine continued eligibility as per study criteria over time.', 'Potential participants will be informed that they will also be re-contacted by phone within 2-5', 'days after the day when the 1st set of MBBs was completed, and that at a later time (when', 'and/or after they return for their next routine clinical appointment for their 2nd set of MBBs) they', 'will be reassessed to complete final screening. This includes the outcome of the 2nd set of', 'MBBs that would normally be offered as part of clinical care to patients who have positive', 'responses to a 1st set of MBBs. As part of usual care processes post-MBBs in the VAPSHCS', 'Pain Clinic, patients complete a written pain diary to record low back pain intensity using a 0 to', '10 NRS for up to 2 days after the procedure. As part of usual care, patients post-MBBs also', 'receive a follow-up phone call from a nurse coordinator within 1 week of their MBBs (and', 'usually within several days). In addition to phone contacts with potential participants, research', 'staff will refer to this clinical information as needed to ascertain if ""positive\' MBB responses', 'have occurred.', 'V.', 'If a potential participant who is approached after the 1st set of MBBs does not wish to speak to', 'research staff or cannot do so at the time of their clinical appointment, we will offer those', 'individuals a phone call to continue providing information about the study, determine eligibility,', 'and obtain information about positive responses to the 1st set of MBBs. Those who are unsure', 'about providing permission to speak to research staff by telephone will be provided written', 'information about the study, and asked to contact research study staff if they are interested in', 'the study, ideally within 2-5 days of their 1st set of MBBs.', 'vi.', 'If research staff is unable to make contact with a potentially eligible patient on the day when the', '1st set of MBBs is completed, contacts will be made by telephone as mentioned above, by staff', 'within 2-5 days of the 1st set of MBBs. In those cases, research staff will inquire retrospectively', 'about responses to MBBs in the initial hours and days after the 1st set of MBBs. Research staff', 'will refer to clinical information from pain diaries and the nurse coordinator follow-up phone call', ""as needed to ascertain if 'positive' MBB responses occurred and to identify individuals with"", 'non-concordant responses to MBBs (for example, pain lasting >24 hours after a 1st set of', 'MBBs using lidocaine). Individuals with non-concordant responses to MBBs will not be eligible', 'for participation.', 'vii.', 'Participants who decline study participation at any stage in Screening (Initial or Final) may be', 'asked whether they would answer questions (up to 6 questions) about their reasons for non-', 'participation. Such questions would be recorded in a non-identifiable format, without links to', 'any patient identifiers of any kind.', 'viii.', ""Depending on the distribution of recruited participants' MBB responses (50-79% VS. 80%)"", 'after the initial period of recruitment, we may restrict study participation in the participant', 'selection phase in order to oversample participants who have >80% relief with MBBs (which', 'would affect both the Initial and Final Screening criteria for potential participants).', 'ix.', 'If a potential participant is identified after their MBBs have already been completed, or not', 'approached at the usual time of an initial or final screening for another reason, we will send the', 'participant an approach letter (Attachment ZZZ - Approach Letter) and a FAQ document with', 'information about the study (Attachment ZZZ2 - Approach Letter FAQ). These documents will', 'prompt the Veteran to contact research study staff if they wish to hear more information about', 'the study, or if he/she is not interested in the study. If we do not hear back from Veterans who', 'are mailed the approach letter and FAQ within 4 business days, we will make attempts to', 'contact the Veteran by telephone until a contact is made, leaving voicemail messages as', 'needed.', 'VA Puget Sound IRB Protocol Template - Version 1.0: 04/2018', 'Page 31 of 55', 'VA Puget Sound IRB Approved', '03/12/2020']"
31,page_32,"['B.', 'Final Screening (Visit 1): The final screening process takes place after the potential RCT', 'participant has undergone the 2nd set of MBBs.', 'i.', 'Initial Screening Criteria will be repeated, as per Table 4.', 'ii.', 'Eligible participants will be offered Informed Consent. They will be informed that they will be', 'likely trial participants, unless subsequent selection criteria render them ineligible in the run-in', 'period between the time of Informed Consent, and the day of their LRFA or simulated LRFA', 'procedure when they will be randomized. Further details regarding Informed Consent are', 'provided below.', 'iii.', 'If participants decide to participate in the study and complete Informed Consent, in most cases,', 'participants will be scheduled for a future date for their lumbar procedure (LRFA procedure or', 'simulated control procedure) at the time of their 2nd set of MBBs, generally within 1-3 weeks, as', 'per usual clinical practice and using usual clinical processes for scheduling. Research staff will', 'coordinate with clinical staff about scheduling specifics as needed in order to facilitate this and', 'make these transitions smooth for the participant. If for an individual participant, their physician', 'elects to not schedule a future procedure date until a later time, research staff will monitor', 'clinical processes and plan around the future procedure date at the time it is decided upon.', 'iv.', 'After the time when the future lumbar procedure date is decided upon, patients will be', 'scheduled for their 1st assessment with a rehabilitation psychologist for AcTIVE-CBT or TBSCE', 'control, which will generally begin within 1-3 weeks of the LRFA procedure. Such scheduling', 'will also be done through usual clinical processes for scheduling. Research staff will coordinate', 'with clinical staff about scheduling specifics as needed in order to facilitate that this is done', 'smoothly.', 'V.', 'Participants will be provided with a Fitbit Zip unit and instructed on how to use the unit. We will', 'assign subjects a login name (e.g., FitbitSel165, FitbitSel672, etc.) and a password for the', 'Fitbit website, and guide the participant through processes for using the website so they can', 'become familiarized with how it works. We will create a Gmail account for the participant, which', 'matches the Fitbit login name, to be used for the duration of this study. Fitbit will use the email', ""address provided to send system-generated weekly updates about the subject's activity levels."", 'The Fitbit account will use the participants login name rather than their actual name. The Fitbit', 'website displays the following data to each user: the number, intensity, and timing of steps', 'taken per day, distance covered, and calories burned. We will request participants not to make', 'edits to their Fitbit accounts during their participation in the study, but to contact research staff', 'who will make such changes for them. An example of this might be if a participant forgets their', 'password information or wishes to change their password; if this happens, the participant', 'would call research staff to change to a new password. We will ask the participants to set up', 'their Fitbit profile so that others cannot view their personal information for the 3-month main', 'period of data collection. During the initial set-up we will verify that the Privacy Settings on each', ""participant's Fitbit profile are set so that no one other than the subject can view their personal"", ""information (age, height, weight, etc.). Participants will be instructed on how to upload ('sync')"", 'their Fitbit data regularly (ideally, every other day, but at least once every 7 days).', 'vi.', 'After instructing subjects on how to use the Fitbit, we will mask the Fitbit display screen by', 'turning it around in its case, and we will ask subjects to wear the Fitbit with the display screen', 'covered for the duration of the run-in period. This will allow us to establish how many steps', 'they typically take when not receiving feedback from the Fitbit device or website (i.e., their', 'baseline). Data from the first 7-day period during the run-in period where the Fitbit is used on at', 'least 3 out of 7 days, for at least 6 hours during waking hours on each of those 3 days, will', 'constitute the baseline assessment for step counts. During the run-in period, we will ask', 'participants to try to use the website as little as possible or to only use the Fitbit website when', 'syncing the Fitbit, and to try to not view their Fitbit data on the website. On the day of', 'randomization, we will ask subjects to reveal their display screen by turning their Fitbit around', 'VA Puget Sound IRB Protocol Template - Version 1.0: 04/2018', 'Page 32 of 55', 'VA Puget Sound IRB Approved', '03/12/2020']"
32,page_33,"['in its case.', 'vii.', 'Participants will be given a study participation pledge form (Attachment M - Pledge Run-In).', 'The pledge describes the study rules and procedures and states that the subject will do his/her', 'best to follow them. It will remind participants about frequent syncing, maintain the masking,', 'and limiting use of the Fitbit website as possible. Participants will have a chance to read the', 'pledge and ask questions, and confirm verbally that they understand the pledge and agree to', 'its content. Participants can keep the pledge form.', 'viii.', 'We will also provide participants with the option to meet with designated research staff at', 'VAPSHCS Seattle campus at any time during the first 3 months after randomization that they', 'wish, to review Fitbit related questions, syncing practices, and/or get a refresher demonstration', 'on how to use their devices and the Fitbit website.', 'ix.', 'As part of routine clinical practice in the Pain Clinic, in order to determine longer-term response', 'to MBBs, and assess for non-concordant responses, participants are provided with a pain diary', 'and asked to record NRS rating for typical low back pain intensity as done during the initial', 'screening.', 'X.', 'Research staff will call the patient by telephone 2-5 days after the 2nd set of MBBs. At this time,', 'they will review ratings of low back pain intensity since the 2nd set of MBBs, referring to the', 'clinical pain diary as needed. This information will be used to identify individuals with non-', 'concordant responses to MBBs (for example, pain lasting >36 hours after a 2nd set of MBBs', 'with bupivacaine).', 'xi.', 'If a potential participant is identified after their MBBs have already been completed, or not', 'approached at the usual time of an initial or final screening for another reason, we will send', 'the participant an approach letter (Attachment ZZZ - Approach Letter) and a FAQ document', 'with information about the study (Attachment ZZZ2 - Approach Letter FAQ). These', 'documents will prompt the Veteran to contact research study staff if they wish to hear more', 'information about the study, or if he/she is not interested in the study. If we do not hear back', 'from Veterans who are mailed the approach letter and FAQ within 4 business days, we will', 'make attempts to contact the Veteran by telephone until a contact is made, leaving voicemail', 'messages as needed. In instances where potential participants are identified via approach', 'letters in this manner, baseline study assessments can be completed as needed in in person', 'in coordination with clinical appointments or by telephone, or during in-person research', 'assessments.', 'C. Run-in period of Fitbit Use (between Visit 1 and Visit 2)', 'The purpose of the run-in period is 1) to identify those participants who are able to use the Fitbit a', 'minimum amount which we consider to be ""Fitbit-compliant\', so that this variable can be adjusted for', 'analytically and 2) exclude participants who fail Final Screening criteria or who are determined to', 'be highly unlikely to be able to participate in study procedures (i.e. those who cannot be contacted', 'by phone or in-person at least one time during the run-in period, indicating that they would not be', 'able to complete subsequent telephone questionnaires). During the run-in period, research staff will', 'be available to receive phone calls or visits from the participants so as to help them with any Fitbit', 'related questions they have, or their ability to sync their data. Once it seems that a participant is', 'able to use the Fitbit and sync it (which in many cases may be immediately after Visit 1), the', 'research staff will begin a ""test period"" of 7 days. The earliest possible start of a test period would', 'be the day after the randomization. If a participant has not synced their Fitbit by day 3 or 4 of the', 'test period, they will receive a telephone call from research staff to offer help and answer questions,', 'and to remind the participant to sync the Fitbit. On days 5, 6, or 7, participants will receive up to one', 'telephone contact/reminder and/or voicemail message left, in order to remind the participant to sync', 'their Fitbit by the end of the 7th day after the start of the test period. If a life issue or barrier presents', 'that interferes with ability to use the Fitbit unit, or the participant encounters a technological hurdle', 'VA Puget Sound IRB Protocol Template - Version 1.0: 04/2018', 'Page 33 of 55', 'VA Puget Sound IRB Approved', '03/12/2020']"
33,page_34,"['of some type (such as device failure) the test period may be restarted at any time, and the process', 'repeated. In addition, the test period can be extended as needed due to holidays or absences', '(either for the participant or research staff) on an ad hoc basis. However, if a full test period elapses', 'without the participant syncing their Fitbit, this would constitute a failure of the run-in period.', 'i.', 'Research staff will monitor the frequency of participant Fitbit use, and whether they are able to', 'periodically upload their data. Participants who do not use their Fitbit, or do not upload data at', 'least once during the run-in period, will receive reminder phone calls.', 'ii.', 'Research staff will make telephone contacts as needed with participants to help participants', 'learn how to use their Fitbits.', 'iii.', 'Participants who do wear their Fitbit unit on at least 3 of 7 days during the test period, for 6', ""hours at least each day during the participant's regular waking hours will be classified as being"", '""Fitbit-complaint\'. Participants who do NOT wear their Fitbit unit on at least 3 of 7 days during', ""the test period, for 6 hours at least each day during the participant's regular waking hours will"", 'be classified as ""non-Fitbit compliant\'.', 'iv.', 'Participants who cannot be contacted at least once during the run-in period will be considered', 'to have failed the run-period. They will be excluded from study participation and will not be', 'randomized.', 'D.', 'Reassessment of study criteria on the day of randomization (Visit 2):', 'i.', 'Initial Screening Criteria will be repeated, as per Table 4 (but not including MBBs). Individuals who', 'no longer meet screening criteria will not be randomized and will not be followed further as part of', 'the study.', 'ii.', 'Randomization will take place as described further below.', 'iii.', 'The lumbar procedure (LRFA or simulated LRFA) will be performed as per the processes described', 'below.', 'iv.', 'Subjects will be given a 2nd study participation pledge form. This version of the pledge form will', 'include the items listed on the 1st pledge form, without information pertinent to the run-in period, but', ""will also include additional details that are specific to each participant's CBT allocation (AcTIVE-"", 'CBT VS. TBSCE). Specifically, the AcTIVE-CBT pledge form will encourage the participant to use', 'their Fitbit, and try to gradually increase their daily walking while in the study (Attachment O -', 'Pledge Visit 2 Extended). As previously, subjects will have a chance to read the pledge and ask', 'questions, and confirm verbally that they understand the pledge and agree to its content. The', 'participant can keep the pledge form. TBSCE participants will also read a pledge form (Attachment', 'N - Pledge Visit 2 Brief), which is the same as (Attachment O - Pledge Visit 2 Extended), except it', 'does not specifically encourage active Fitbit engagement, and recommends against using the Fitbit', 'Group or Friend functions.', 'V.', 'At the time the 2nd study pledge form is provided by a research staff member, the staff member will', 'will ask the ""Post-procedure questions"". These involve 1-4 questions, which inquire about the', ""participant's immediate impression of whether they received LRFA, or simulated LRFA."", 'E.', 'Approach Letters.', 'i.', 'In certain situations, potential participants for SELECT may not be captured by the pre-screening', 'and screening processes as described above. Therefore, they may be identified at some point after', 'their 1st set of MBBs have been completed, but when they no longer have an upcoming clinical', 'appointment scheduled when it is possible to approach them in person about the study. In some', 'cases, this may occur between their 2nd set of MBBs and the time of their lumbar RFA procedure. For', 'Veterans who meet this criteria and are identified during the screening process, we will follow the', 'steps below.', 'ii.', 'If potential Veteran participants are identified as above, the PI will send an encrypted email to the', 'treating interventional spine provider for the potential participant, and/or contact by telephone. The', 'VA Puget Sound IRB Protocol Template - Version 1.0: 04/2018', 'Page 34 of 55', 'VA Puget Sound IRB Approved', '03/12/2020']"
34,page_35,"['interventional spine provider will 1) decide whether the Veteran appears to meet criteria for the study,', 'and 2) approves research staff contacting the patient. Either the interventional spine provider will', 'complete the Interventional Provider Checklist, or the PI will complete based on information from the', 'interventional spine provider and/or the medical record.', 'iii.', 'If the Veteran is a potential participant and approved by the interventional spine provider, research', 'staff will mail an approach letter.', 'iv. If we do not receive an inquiry from a potential participant within 7 days after the letter was sent,', 'research staff will begin attempts to contact the potential participant. We will leave voicemail', 'messages as needed. If the Veteran is reached, research staff will talk to them at that time or arrange', 'another time to do so, over the phone, or in person. That discussion can be scheduled around the', 'time of an upcoming appointment at the Seattle campus, if convenient for Veteran.', 'V.', 'At the time arranged to talk, research staff will provide Veteran with basic information as you would', 'at the initial contact (Visit 0). If a Veteran is not interested and wants to stop talking, staff will end the', 'call. If a Veteran is interested, research staff would proceed with the screening checklist as typically', 'done during a Visit 0.', 'vi. If Veteran passes the screening checklist, we would mail him/her the same info he/she would', 'normally get at a Visit 0 (a What to Expect form [approach letter version] and a blank consent)', 'vii. If Veteran passes the screening checklist, research staff would try to arrange an in-person Visit 1 in', 'order to complete study procedures and informed consent. Visit 1 would need to happen at least 2', 'days before the time when their LRFA is scheduled. Ideally this would be scheduled to coincide with', 'another clinical visits or time when he/she is already coming to the medical center. We will inform', 'Veterans that the Visit 1 would be for research, and that there is no ""travel compensation"" for this visit.', 'However, there is study-related compensation for completing Visit 1, including informed consent, as', 'well as for our other study assessments. Visit 1 would otherwise take place exactly as described', ""above, including distribution of Fitbits, and a 'run-in period' after visit 1. The run-in requirement for"", 'Fitbit use can be waived for Veterans recruited via Approach Letter, if there is insufficient time', 'between Visit 1 and Visit 2 for Fitbit wear and syncing.', 'F.', 'COVID-19 Pre-Screening Measures', 'i.', 'SELECT staff will specifically inquire with the Pain Clinic physician treating a patient about whether', 'the patient has active symptoms of fever, cough, or shortness of breath, and/or is potentially at-risk for', 'COVID-19, prior to interactions with a participant/potentia participant. SELECT staff will not engage in', 'face-to-face interactions with participants/potential participants if they are thought to have any of these', 'symptoms or historical features by the Pain Clinic treating physician. In those cases, we may conduct', 'screening by phone (for participants in the study) or via our existing ""approach letter\' pathway (for', 'potential participants- which includes screening by phone). We will apply these procedures until there', 'is further specific guidance from R&D about what to do in response to contacts potentially involving', 'those at-risk for COVID-19, or until such screening is no longer needed.', 'ii.', 'SELECT staff will only approach patients if they feel comfortable doing so. Until COVID-19', 'screening at VA Puget Sound is lifted, or until further guidance from R&D regarding patient contact,', 'the Study Coordinator will serve as a back-up for all in-person contact visits, and will conduct in-person', 'contact visits in lieu of any staff who wish to refrain from patient contact during this time. SELECT staff', 'will reach out to the Study Coordinator directly if they wish to refrain from in-person contact.', 'Patients who Decline:', 'We will enter data for all patients screened into the study database and assign a screening ID. The system will', 'assign a screening ID for all screened patients, including those who are ineligible or eligible and refused to', 'enroll. Research staff will collect basic demographic information using the demographic information form from', 'all patients who are deemed eligible to participate yet decline to participate. These data will be collected to', 'VA Puget Sound IRB Protocol Template - Version 1.0: 04/2018', 'Page 35 of 55', 'VA Puget Sound IRB Approved', '03/12/2020']"
