,PageNo,Text
17,page_18,"['Alliance A191402CD', 'Regulatory Submission Portal:', 'Regulatory Tab', 'Regulatory Submission Portal', 'When applicable, original documents should be mailed to:', 'Institutions with patients waiting that are unable to use the Portal should alert the CTSU', 'Regulatory Office immediately at', 'in order to receive further instruction and', 'support.', ""4.2.4 Checking Your Site's Registration Status"", ""You can verify your site registration status on the members' section of the CTSU website."", 'Go to', ""and log in to the members' area using your CTEP-IAM"", 'username and password', 'Click on the Regulatory tab', 'Click on the Site Registration tab', 'Enter your 5-character CTEP Institution Code and click on Go', 'Note: The status given only reflects compliance with IRB documentation and institutional', 'compliance with protocol-specific requirements outlined by the Lead Network. It does not reflect', 'compliance with protocol requirements for individuals participating on the protocol or the', ""enrolling investigator's status with the NCI or their affiliated networks."", '4.2.5 Limited access information', 'Institutions that are interested in participating in this study must first contact the Study Chair,', 'Jon Tilburt', 'to review study requirements and procedures and to identify', 'who will be responsible for the study at their respective institution. See Section 13.1.', '4.3', 'Patient Registration Requirements', 'Informed consent: the patient must be aware of the neoplastic nature of his/her disease and', 'willingly consent after being informed of the procedure to be followed, the experimental nature', 'of the interventions being tested, alternatives, potential benefits, side-effects, risks, and', 'discomforts. Current human subjects protection committee approval of this protocol and a', 'consent form is required prior to patient consent and registration.', 'Patient completed booklets: Patient questionnaire booklets are to be ordered prior to the', 'registration of any patients. Patient completed booklets can be ordered by downloading and', 'completing the booklet order form (located under the supplemental documents section of the', 'A191402CD website) and faxing the form to Attn: Operational Support Clerk at', 'Samples of the booklets are found in Appendices I and II, which are to be used for reference and', 'IRB submission only. They are not to be used for patient completion.', '18', 'Version Date: 11/30/2018', 'Update #06']"
18,page_19,"['Alliance A191402CD', 'Institutional randomization: Institutions will be randomized to one of four intervention arms:', '1) During- and pre-consultation decision aids', '2)', 'Pre-consultation decision aid only', '3) During-consultation decision aid only', '4) Usual care', 'The Alliance Statistics and Data Center will randomize institutions once an institution is', 'interested and eligible to participate. All men enrolled at a site will receive the intervention to', 'which the treating institution is randomized.', 'Specifically, the lead study statistician will randomly assign the initial participating institutions', 'to one of the arms before the study is activated. The randomization will be stratified by center', 'type (i.e. which minority group, if any, the center is ""targeting""); so that if for example, there', 'were four initial centers which specialized in Native American/Native Alaskan men, each would', 'be assigned to one of the four arms by randomly selecting one of the four repeatedly without', 'replacement, each time assigning that center to one of the remaining arms. This will be done', 'separately for all center types. For all of these centers, the lead statistician will obtain CTEP', 'Institutional IDs (as well as IDs for affiliates, if any, that may be participating), and will then', 'provide the Alliance randomization center with the initial set of CTEP IDs for each treatment', 'arm.', 'Thus, when a patient enrolls at one of the initial participating institutions, the CTEP ID of the', 'center can be checked against the initial randomization list, which will determine which', 'treatment that patient gets (and all patients at that center). In addition, the lead statistician will', 'create a random sequence of arm assignments for additional institutions of each type that join', 'after the study begins, so that whenever a new center joins the study, an arm will already have', 'been determined for that center.', '4.4', 'Patient Registration/Randomization Procedures', 'Patient enrollment will be facilitated using the Oncology Patient Enrollment Network (OPEN).', 'OPEN is a web-based registration system available on a 24/7 basis. To access OPEN, the site user', 'must have an active CTEP-IAM account (check at', ') and a', ""'Registrar' role on either the LPO or participating organization roster. Registrars must hold a"", 'minimum of an AP registration type.', 'All site staff will use OPEN to enroll patients to this study. It is integrated with the CTSU Enterprise', 'System for regulatory and roster data and, upon enrollment, initializes the patient in the Rave', 'database. OPEN can be accessed at', 'or from the OPEN tab on the CTSU', ""members' side of the website at"", 'To assign an IVR or NPIVR as the treating,', 'crediting, consenting, drug shipment (IVR only), or investigator receiving a transfer in OPEN, the', ""IVR or NPIVR must list on their Form FDA 1572 in RCR the IRB number used on the site's IRB"", 'approval.', 'Prior to accessing OPEN, site staff should verify the following:', 'All eligibility criteria have been met within the protocol stated timeframes.', 'All patients have signed an appropriate consent form and HIPAA authorization form (if', 'applicable).', 'Note: The OPEN system will provide the site with a printable confirmation of registration and', 'treatment information. Please print this confirmation for your records.', ""Further instructional information is provided on the OPEN tab of the CTSU members' side of the"", 'CTSU website at', 'For any additional questions', 'contact the CTSU Help Desk at', '19', 'Version Date: 11/30/2018', 'Update #06']"
19,page_20,"['Alliance A191402CD', '4.5', 'Stratification and Treatment Assignments', 'While not formal stratification factors, randomization will be set up so that sites will the particular', 'capacities to oversample minority populations will be distributed between the arms, as illustrated in', 'the diagram below.', 'AI/AN', 'AI/AN', 'Sites with capacity', 'ARM 1', 'AI/AN', 'Prostate Choice &', 'to over-sample', 'AA', 'American Indian/', 'Knowing Your Options', 'AI/AN', 'Other', 'Alaska Native', 'AI/AN', 'Al/AN', 'ARM 2', 'AA', 'AA', 'Prostate Choice', 'Sites with capacity', 'AA', 'Other', 'Site', 'to over-sample', 'African American', 'AA', 'Randomization', 'AI/AN', 'AA', 'ARM 3', 'AA', 'Knowing Your Options', 'Other', 'Other', 'Other', 'Al/AN', 'Other', 'ARM 4', 'Other', 'AA', 'Usual Care', 'Other', 'Other', 'Grouping Factors/Treatment assignments:', 'Arm 1:', 'Pre -and During Consultation Decision Aids', 'Arm 2:', 'Pre-Consultation Decision Aid only', 'Arm 3:', 'During Consultation Decision Aid only', 'Arm 4:', 'Usual Care', '20', 'Version Date: 11/30/2018', 'Update #06']"
20,page_21,"['Alliance A191402CD', '5.0', 'STUDY CALENDAR', 'Laboratory and clinical parameters during treatment are to be followed using individual institutional', 'guidelines and the best clinical judgment of the responsible physician. It is expected that patients on this', 'study will be cared for by physicians experienced in the treatment and supportive care of patients on this', 'trial.', 'Pre-Study Testing Intervals', 'To be completed 28 DAYS before registration: History and physical.', 'To be completed V 90 DAYS before registration: PSA', 'To be completed V 4 MONTHS before registration: Prostate Biopsy', '12 months after', 'Prior to', 'Registration', 'Baseline*', 'baseline*', 'Test and Observations', 'History and Physical', 'X', 'Height', 'X', 'Weight', 'X', 'Prostate biopsy', 'X', 'Chart Review', 'X(1)', 'Labs and Staging', 'PSA', 'X', 'QOL Instruments', 'Baseline Questionnaire', 'X(2)', 'One-year Questionnaire', 'X(3)', '*', 'To be administered following the surgical consultation', '+/- 6 weeks', '1', ""At 12 months site staff will review the patient's chart from the 6-month point to the 12-month time-point,"", 'collecting treatment information and any pertinent events.', '2', 'Includes the Prostate Cancer Treatment Questionnaire and the Decisional Conflict Scale. See Section 10.0', 'and Appendix I.', '3', 'Includes Expanded Prostate Cancer Index Composite (EPIC-26) and the Decisional Regret Scale. See', 'Section 10.0 and Appendix II. To be completed by the patient during a clinic visit. If no clinic visit is', 'scheduled +/- 6 weeks from the 12-month time-point, study staff should mail the 12-month questionnaire', 'with a self-addressed stamped envelope to the patient for him to complete at home and return by mail (see', 'Section 8.3.1).', '21', 'Version Date: 11/30/2018', 'Update #06']"
21,page_22,"['Alliance A191402CD', '6.0', 'DATA AND SPECIMEN SUBMISSION', '6.1', 'Data Collection and Submission', 'Data collection for this study will be done exclusively through the Medidata Rave clinical data', 'management system. Access to the trial in Rave is granted through the iMedidata application to all', 'persons with the appropriate roles assigned in Regulatory Support System (RSS). To access Rave', 'via iMedidata, the site user must have an active CTEP-IAM account (check at', 'and the appropriate Rave role (Rave CRA, Read-Only, Site', 'Investigator) on either the LPO or participating organization roster at the enrolling site.', 'Upon initial site registration approval for the study in RSS, all persons with Rave roles assigned on', 'the appropriate roster will be sent a study invitation e-mail from iMedidata. To accept the invitation,', 'site users must log into the Select Login', 'using their CTEP-', 'IAM user name and password, and click on the ""accept"" link in the upper right-corner of the', 'iMedidata page. Please note, site users will not be able to access the study in Rave until all required', 'Medidata and study specific trainings are completed. Trainings will be in the form of electronic', 'learnings (eLearnings), and can be accessed by clicking on the link in the upper right pane of the', 'iMedidata screen.', 'Users who have not previously activated their iMedidata/Rave account at the time of initial site', 'registration approval for the study in RSS will also receive a separate invitation from iMedidata to', 'activate their account. Account activation instructions are located on the CTSU website, Rave tab', 'under the Rave resource materials (Medidata Account Activation and Study Invitation Acceptance).', ""Additional information on iMedidata/Rave is available on the CTSU members' website under the"", 'Rave tab at', 'or by contacting the CTSU Help Desk at', 'or by e-', 'mail at', 'A Schedule of Forms is available on the Alliance study webpage, within the Case Report Forms', 'section.', 'Patient-completed questionnaire booklets for this study are to be ordered prior to the registration of', 'any patients (see Section 4.4). Samples of questionnaire booklets are available in Appendices I and', 'II for reference and IRB submission only. They are not to be used for patient completion. Booklets', 'must be given to patients to complete and patients should be instructed to return the booklets to site', 'staff either in person or by mail and site staff will enter patient and caregiver responses into Rave.', '22', 'Version Date: 11/30/2018', 'Update #06']"
22,page_23,"['Alliance A191402CD', '7.0', 'STUDY IMPLEMENTATION', '7.1', 'Identification of participating institutions', 'It is expected that a majority of participating institutions will be identified prior to the activation of', 'this study. However, recruitment of additional institutions will continue following activation of the', 'study. Interested sites should contact the study chair, Dr. Tilburt to discuss the criteria listed in', 'Section 13.1.', '7.2', 'Site training', 'Before enrolling patients, each site randomized to one of three intervention arms must determine', 'their desired mode of delivery for the decision aids (either by desktop computer or tablet). Sites that', 'opt for tablet delivery of the decision aid will receive a tablet from the investigative team: Either by', 'shipment or by hand delivery, depending on whether or not a member of the study team travels to', 'the participating institution to provide personnel training.', 'Site personnel will be trained on the process of data collection and delivery of the intervention prior', 'to the enrollment of any patients. This training will be provided either by video/telephone', 'conferencing or by on-site training. consist of either video training and telephone conferencing or', 'on-site training. The content of the training will consist of co-developing or adapting site-specific', 'standard operating procedures (SOPs) that accommodate local site environments while maintaining', 'fidelity to the particular study arm to which sites have been randomized. Training will be provided', 'by a member of the study team from Mayo Clinic.', '7.3', 'Site scheduling and clinic space requirements', 'Scheduling: Sites will need to determine the time needed to complete registration, pre-consultation', 'decision aid interaction (for applicable study arms), and post-consultation questionnaire completion.', 'Study coordinators will need to schedule patients to be present at the study site for sufficient time to', 'complete pre- and post-consultation study items. Alternatively, sites must identify processes for pre-', 'and post-consultation study requirements to be completed in very close proximity (1 business or less)', 'to the visit.', 'Space requirements: Sites will need to identify and reserve an adequately private area near or', 'adjacent to the patient waiting area. This space will be used to obtain patient consent for participation,', 'obtain HIPA authorization, and interact with the pre-consultation decision aid (for applicable study', 'arms), and completion of the post-visit questionnaire.', 'Pre-consultation decision aid requirements: For study arms with the pre-consultation decision aid,', 'this adjacent space must contain a computer terminal with internet access, or have wireless access', 'provided to the room so that a tablet may be used.', 'During-consultation decision aid requirements: For study arms that will use the during-', 'consultation decision aid, sites will need to ensure that exam rooms are provisioned with wireless', 'internet access or contain a computer terminal with internet access. Either of these is needed in order', 'for the physician to deliver the during-consultation decision aid.', ""Physician notification process: Sites should establish a local process for informing the participant's"", 'physician that the participant has completed pre-requisite study registration and intervention (where', 'applicable). The physician will then be alerted to follow the during-consultation study procedures', 'specific to his/her study site.', '23', 'Version Date: 11/30/2018', 'Update #06']"
23,page_24,"['Alliance A191402CD', '8.0', 'INTERVENTION', 'While it is expected that registration will occur on the same day as the initial surgical consultation, the', 'intervention (surgical consult visit) must occur within 14 days following registration. Registration may', 'occur after the surgical consult visit and patient completion of the Baseline Questionnaire, but must be', 'completed no later than the same day as the consultation.', 'Participating sites will be randomized to Pre- plus During-Consultation decision aids, Pre-consultation', 'decision aid only, during-consultation only decision aid, or usual care arms.', 'Arm A', 'Pre- and During Consultation', 'Decision Aids¹ 2', 'Arm B', 'Pre-Consultation²', 'Decision Aid Only', 'Arm C', 'During Consultation¹', 'Decision Aid Only', 'Arm D', 'Usual Care', '1', '""Prostate Choice""', '2', '""Knowing Your Options""', '8.1', 'Patient identification, scheduling, and consent', 'Sites should implement standard procedures for identifying eligible patients for this study. Patient', 'eligibility will be determined locally by a combination of chart review and patient self-report.', 'Clinical variables about the patients care germane to eligibility will be ascertained by site staff. Site', 'staff must confirm with the patient that this is not a second opinion, and that this is the first face-to-', 'face visit with the doctor to discuss treatment options. It is not required that patients know their', 'diagnosis before the study is introduced to them.', 'Prospective patients who are informed about a new diagnosis of prostate cancer will be scheduled to', 'receive a follow-up consultation with a physician to discuss treatment options. The scheduled', 'prostate cancer consultation must be the first consultation after diagnosis (i.e. not a second-opinion', 'or a consultation following previous discussions of treatment options). Physicians may consider', 'referring patients to the study team for recruitment upon receipt of positive PCa biopsy results from', 'the lab if the cancer diagnosis has already been disclosed by telephone or email.', 'It is critical that the site coordinator identify when this visit is scheduled, and plan to make contact', ""(or arrange for the patient's physician to make contact) with the prospective participant before their"", 'scheduled consultation and inform them about the study. Participating institutions should implement', 'a procedure for alerting the study coordinator when an eligible patient has been scheduled for the', 'initial consultation. Institutional study coordinators will document all contact with all potentially', 'eligible participants and indicate interest/non interest or ""not approached.""', 'If the prospective participant expresses interest in the study, the study coordinator should instruct the', 'patient to arrive at their consultation appointment early enough (as determined by site-specific', 'standard operating procedures) to complete all study-related activities. Patient consent may be', 'obtained at any time up to and including the day of the consultation, but must be completed prior to', 'any study-related activities. In addition, for sites randomized to the pre-consultation decision aid,', 'time should be allowed for sufficient and unhurried patient interaction with the pre-consultation', 'decision aid. All participants should also be informed that they will need to remain after the', 'appointment to complete a short questionnaire (Baseline Questionnaire, see Appendix I).', '24', 'Version Date: 11/30/2018', 'Update #06']"
24,page_25,"['Alliance A191402CD', '8.2', 'Procedures for intervention on the day of the prostate cancer consult', '8.2.1 Patient arrival', 'Following the completion of the consent and registration procedures, the study coordinator will', 'greet and engage participant and escort them to a private area preferably near the waiting area.', '8.2.2 Arms A and B only: Patient interaction with the pre-consultation decision aid', 'The study coordinator will lead the participant to a designated computer terminal or will provide', 'a tablet with which the participant, in collaboration with a partner, if desired, may interact with', 'the pre-consultation decision aid. Staff will be available for any technical issues that may arise.', '8.2.3 Physician notification', 'The physician or appropriate clinical staff (e.g., physician assistant) will be notified when a', 'participant has arrived and, if at an institution randomized to Arm A or B, that the patient has', 'spent time with pre-consultation decision aid. The physician will thereby know to follow the', 'study protocol.', '8.2.4 Consultation', 'Arm A: The physician or appropriate clinical staff (e.g., physician assistant) will incorporate', 'the during-consultation decision aid in his/her conversation with the patient about treatment', 'choice. In addition, the physician or appropriate clinical staff will engage the patient regarding', 'any questions by the patient about the pre-consultation decision aid. Site staff will record the', 'time that the patient spends with the pre-consultation decision aid.', 'Arm B: Usual care, and the physician or appropriate clinical staff will engage the patient', 'regarding any questions by the patient regarding the pre-consultation decision aid. Site staff will', 'record the time that the patient spends with the pre-consultation decision aid.', 'Arm C: The physician or appropriate clinical staff will incorporate the during-consultation', 'decision aid into his/her conversation with the patient about treatment choice.', 'Arm D: Usual care.', 'All Arms: At the end of the consultation, the physician will remind the patient that the study', 'coordinator has post-visit (baseline) questionnaires for the patient to complete. The study', 'coordinator will also assess the time for the consultation, which will be recorded in a separate', 'field on the data collection forms. This will be defined as the time from when the physician', ""enters the consultation room to when physician's consultative activities end (i.e., when the"", 'physician leaves the room OR when the patient is handed off to the CRA to complete post-', 'consultation forms).', '8.2.5 Baseline Questionnaire', 'After consultation with the physician, the study coordinator will escort the patient to a private', 'area preferably near to the patient waiting area, and provide the Baseline Questionnaire for the', 'patient to complete before leaving.', '25', 'Version Date: 11/30/2018', 'Update #06']"
25,page_26,"['Alliance A191402CD', '8.3', '12-month follow up', ""Follow up to ascertain the patient's overall and disease specific quality of life and prostate cancer"", ""treatment regret will be conducted by site coordinators 12 months (+/- 6 weeks) after the patient's"", 'consultation.', '8.3.1 Twelve-month follow-up questionnaire', 'If the patient has a scheduled follow-up visit within this window, he should be asked to complete', 'the 12-month Follow-up Questionnaire during this visit. If no visit is scheduled, site staff will', 'mail the Follow-up Questionnaire with a self-addressed stamped envelope to the patient for him', 'to complete at home and return to the clinic by mail. If the questionnaire is not returned by mail', 'within 4 days, the study coordinator will call the patient (up to 5 attempts) to remind him to', 'complete and mail the questionnaire or he or she will offer the patient the opportunity to', 'complete the questionnaire over the phone.', '8.3.2 Twelve-month follow-up chart review', 'At this time site staff will also conduct retrospective chart review to ascertain treatment', 'utilization and complete the follow-up form. Treatment utilization will be categorized by the', 'type of treatment the patient had (surgery vs. radiation vs. active surveillance).', '9.0', 'ADVERSE Events', 'We do not anticipate any additional adverse events related to participation in this study beyond usual care.', 'If patients experience any emotional discomfort when completing the questionnaires, they may choose', 'not to complete them and/or speak with the site staff. Patients experiencing any physical or psychological', 'complications related to their standard of care treatment should discuss this with their treating physician.', '10.0', 'MEASURES', '10.1', 'Prostate Cancer Treatment Questionnaire (knowledge measure)', '""The Prostate Cancer Treatment Questionnaire"" is a 12-item instrument measuring respondent', 'knowledge of key information deemed by clinicians to be critical for patients to successfully', 'deliberate about preference of treatment for prostate cancer.', 'The questionnaire will be administered once, immediately after the consultation (post-consultation)', 'and should take no more than 5-6 minutes to complete.""', '10.2', 'Decisional Conflict Scale (DCS)', ""The decisional conflict scale was developed and validated by O'Connor72 as an instrument intended"", 'to ""elicit 1) health-care consumers\' uncertainty in making a health-related decision; 2) the factors', 'contributing to the uncertainty; and 3) health-care consumers\' perceived effective decision making"".', 'The low literacy version of this questionnaire will be used, and it contains 10 items answered on a 3', 'point scale (i.e., ""yes,"" ""unsure,"" ""no"") and may be adapted to specific health-care decision scenarios.', 'Example questions include agreement with the following statements: ""Did you know which options', 'were available to you?"" ""Did you know the benefit of each option?"" ""Did you feel sure about what', 'to choose?""', 'The questionnaire will be administered once, immediately after the consultation (post-consultation).', 'It is estimated that it will take participants approximately 5-7 minutes to complete this questionnaire.', '26', 'Version Date: 11/30/2018', 'Update #06']"
