,PageNo,Text57,page_57,"Allian ce A221701 58 NCI version date 8/14/2020 Update #03 19. Kottschade LA, Sloan JA, Mazurczak MA, et al: The use of vitamin E for the prevention of chemotherapy -induced peripheral neuropathy: results of a randomized phase III clinical trial. Support Care Cancer 19:1769 -77, 2011 20. Moraska AR, Sood A, Dakhil SR, et al: Phase III, randomized, double -blind, placebo - controlled study of long -acting methylphenidate for cancer -related fatigue: North Central Cancer Treatment Group NCCTG -N05C7 trial. J Clin Oncol 28:3673 -9, 2010 21. Basch E, Reeve BB, Mitchel l SA, et al: Development of the National Cancer Institute's patient -reported outcomes version of the common terminology criteria for adverse events (PRO -CTCAE). J Natl Cancer Inst 106, 2014 22. Bennett AV, Dueck AC, Mitchell SA, et al: Mode equivalence an d acceptability of tablet computer -, interactive voice response system -, and paper -based administration of the U.S. National Cancer Institute's Patient -Reported Outcomes version of the Common Terminology Criteria for Adverse Events (PRO -CTCAE). Health Qual Life Outcomes 14:24, 2016 23. Dueck AC, Mendoza TR, Mitchell SA, et al: Validity and Reliability of the US National Cancer Institute's Patient -Reported Outcomes Version of the Common Terminology Criteria for Adverse Events (PRO -CTCAE). JAMA Oncol 1:1051 -9, 2015 24. Kluetz PG, Chingos DT, Basch EM, et al: Patient -Reported Outcomes in Cancer Clinical Trials: Measuring Symptomatic Adverse Events With the National Cancer Institute's Patient -Reported Outcomes Version of the Common Terminology Criteria for Adv erse Events (PRO -CTCAE). Am Soc Clin Oncol Educ Book 35:67 -73, 2016 25. Brown P, Clark MM, Atherton P, et al: Will improvement in quality of life (QOL) impact fatigue in patients receiving radiation therapy for advanced cancer? Am J Clin Oncol 29:52 -8, 20 06 26. Shahi V, Lapid MI, Kung S, et al: Do age and quality of life of patients with cancer influence quality of life of the caregiver? J Geriatr Oncol 5:331 -6, 2014 27. Singh JA, Locke DE, Satele D, et al: Normative data and clinically significant effec t sizes for single -item numerical linear analogue self -assessment (LASA) scales. J Clin Oncol 32:e17619, 2014 28. Rummans TA, Clark MM, Sloan JA, et al: Impacting quality of life for patients with advanced cancer with a structured multidisciplinary interv ention: a randomized controlled trial. J Clin Oncol 24:635 -42, 2006 29. Sloan, J. A., & Dueck, A. (2004). Issues for statisticians in conducting analyses and translating results for quality of life end points in clinical trials. J Biopharm Stat, 14(1), 73 -96. doi:10.1081/BIP -120028507 30. Atherton et al. J Pain Symptom Manage. 2015 Oct;50(4):470 -9.e9 31. Sloan et al. Randomized comparison of four tools measuring overall quality of life in patients with advanced cancer. JCO 1998. 32. Sloan et al Relationship between deficits in overall quality of life and non -small -cell lung cancer survival, JCO 2012 33. List et al. The Performance Status Scale for Head and Neck Cancer Patients and the Functional Assessment of Cancer Therapy -Head and Neck Scale. A study of utility and validity. Cancer. 1996 34. Bell ML, King MT, Fairclough DL. Bias in area under the curve for longitudinal clinical trials with missing patient reported outcome data: summary measures versus summary statistics. SAGE Open . Jun 2014 ;4(2):1 -12. doi :10.1177/2158244014534858 35. Revicki DA, Cella D, Hays RD, Sloan JA, Lenderking WR, Aaronson NK. Responsiveness and minimal important differences for patient reported outcomes - art. no. 70. Health & Quality of Life Outcomes 2006 Sep 27; 4:70. 36. Sloan JA . Assessing the Minimally Clinically Significant Difference: Scientific Considerations, Challenges and Solutions. Journal of Chronic Obstructive Pulmonary Disease 2005; 2: 57 -62"
58,page_58,"Allian ce A221701 59 NCI version date 8/14/2020 Update #03 37. Revicki, D., Hays, R. D., Cella, D., & Sloan, J. (2008). Recommended methods for determining responsiveness and minimally important differences fo r patient -reported outcomes. J Clin Epidemiol, 61(2), 102 -109. doi:10.1016/j.jclinepi.2007.03.012 38. Clinical significance of patient -reported questionnaire data: another step toward consensus. Sloan , Jeff A.Cella, David, Hays, Ron D. et al. Journal of Clinical Epidemiology , Volume 58 , Issue 12 , 1217 – 1219, 2005) 39. Freidlin B, McShane LM, Polley MY, et al: Randomized phase II trial designs with biomarkers. J Clin Oncol 30:3304 -9, 2012 40. Xiao L, Lavori PW, Wilson SR, et al: Comparison of dynamic block randomization and minimization in randomized trials: a simulation study. Clin Trials 8:59 -69, 2011 41. Pamela J Atherton, Kelli N Burger, Levi D Pederson, Suneetha Kaggal, Jeff A Sloan. Patient -reported outcomes questionnaire c ompliance in Cancer Cooperative Group Trials (Alliance N0992). Clinical Trials, Vol 13, Issue 6, pp. 612 – 620. June 30, 2016 .https://doi.org/10.1177/1740774516655101) 42. Jefrey L. Huntington, BS, Amylou Dueck, PhD. Handling Missing Data. Current Proble ms in Cancer, November –December, 2005Vo lume 29, Issue 6, Pages 317–325 43. Jeff A. Sloan PhD, Amylou C. Dueck PhD, Pennifer A. Erickson PhD, Harry Guess MD, PhD, Dennis A. Revicki PhD, Nancy C. Santanello MD, MS and the Mayo/FDA Patient -Reported Outcomes C onsensus Meeting Group. Analysis and Interpretation of Results Based on Patient -Reported Outcomes. Value in Health Volume 10, Issue Supplement s2, pages S106 –S115, November/December 2007 DOI: 10.1111/j.1524 -4733.2007.00273 44. Cros J, Moati E, Raffenne J, Hentic O, Svrcek M, de Mestier L, Sbidian E, Guedj N, Bedossa P, Paradis V, Sauvanet A, Panis Y, Ruszniewski P, Couvelard A, Hammel P. Gly388Arg FGFR4 Polymorphism Is Not Predictive of Everolimus Efficacy in Well -Differentiated Digestive Neuroe ndocrine Tumors. Neuroendocrinology. 2016;103(5):495 -9. doi: 10.1159/000440724. Epub 2015 Sep 4 45. Serra S, Zheng L, Hassan M, Phan AT, Woodhouse LJ, Yao JC, Ezzat S, Asa SL. The FGFR4 -G388R single -nucleotide polymorphism alters pancreatic neuroendocrine tumor progression and response to mTOR inhibition therapy. Cancer Res. 2012 Nov 15;72(22):5683 -91. doi: 10.1158/0008 - 5472.CAN -12-2102. Epub 2012 Sep 17. PubMed PMID: 22986737 46. Pouché L, Stojanova J, Marquet P, Picard N. New challenges and promises in solid organ transplantation pharmacogenetics: the genetic variability of proteins involved in the pharmacodynamics of immunosuppressive drugs. Pharmacogenomics.;17(3):277 -96. doi: 10.2217/pgs.15.169. Epub 2016 Jan 22. Review. PubMed PMID: 26799749. 47. Pascual T, ApellÃ¡niz -Ruiz M, Pernaut C, C ueto-Felgueroso C, Villalba P,Ã lvarez C, Manso L, Inglada -PÃ©rez L, Robledo M, RodrÃ guez-Antona C, Ciruelos E. Polymorphisms associated with everolimus pharmacokinetics, toxicity and survival in metastatic breast can cer. PLoS One. 2017 Jul 20;12(7):e0180192. doi:10.1371/journal.pone.0180192. eCollection 2017. PubMed PMID: 28727815; PubMed Central PMCID: PMC5519037. 48. Jiang J, Fridley BL, Feng Q, Abo RP, Brisbin A, Batzler A, Jenkins G, Long PA, Wang L. Genome -wide association study for biomarker identification of Rapamycin and Everolimus using a lymphoblastoid cell line system. Front Genet.2013 Aug 30;4:166. doi: 10.3389/fgene.2013.00166. eCollection 2013. PubMed PMID: 240 09623; PubMed Central PMCID: PMC3757297. 49. Koepp DM, Schaefer LK, Ye X, Keyomarsi K, Chu C, Harper JW, Elledge SJ. Phosphorylation -dependent ubiquitination of cyclin E by the SCFFbw7 ubiquitin ligase. Science. 2001 Oct 5;294(5540):173 -7. Epub 2001 Aug 30 . PubMed PMID: 11533444. 50. Fujii Y, Yada M, Nishiyama M, Kamura T, Takahashi H, Tsunematsu R, Susaki E, Nakagawa T, Matsumoto A, Nakayama KI. Fbxw7 contributes to tumor suppression by targeting multiple proteins for ubiquitin -dependent degradation. Cancer Sci. 2006 Aug;97(8):729 -36. PubMed PMID: 16863506"
59,page_59,"Allian ce A221701 60 NCI version date 8/14/2020 Update #03 51. Zhou Z, He C, Wang J. Regulation mechanism of Fbxw7 -related signalingPathways (Review). Oncol Rep. 2015 Nov;34(5):2215 -24. doi: 10.3892/or.2015.4227. Epub 2015 Aug 26. Review. PubMed PMID: 26324296 52. Welcker M, Clurman BE. FBW7 ubiquitin ligase: a tumour suppressor at the crossroads of cell divisio n, growth and differentiation. Nat Rev Cancer. 2008 Feb;8(2):83 -93. Review. PubMed PMID: 18094723. 53. Siu, K. T., Rosner, M. R., & Minella, A. C. (2012). An integrated view of cyclin E function and regulation. Cell Cycle , 11(1), 57 –64. http://doi.org/10. 4161/cc.11.1.18775. 57 –64. PMC . Web. 23 Oct. 2017. 54. Davis RJ, Welcker M, Clurman BE. Tumor suppression by the Fbw7 ubiquitin ligase: mechanisms and opportunities. Cancer Cell. 2014 Oct 13;26(4):455 -64. doi: 10.1016/j.ccell.2014.09.013. Review. PubMed PMID: 25314076; PubMed Central PMCID:PMC4227608. 55. Glorioso N, Herrera VL, Didishvili T, Argiolas G, Troffa C, Bulla P, Bulla E, Ruiz - Opazo N. DEspR T/CATAAAA -box promoter variant decreases DEspR transcription and is associated with increased BP in Sardinian males. Physiol Genomics. 2011 Nov 7;43(21):1219 -25. doi: 10.1152/physiolgenomics.00012.2011. Epub 2011 Aug 23. PubMed PMID: 21862670; PubMed Central PMCID: PMC3217322 56. Wight JE, Nguyen VH, Medina MT, Patt erson C, DurÃ³n RM, Molina Y, Lin YC,MartÃ - nez-JuÃ¡rez IE, Ochoa A, Jara -Prado A, Tanaka M, Bai D, Aftab S, Bailey JN, Delgado -Escueta AV. Chromosome loci vary by juvenile myoclonic epilepsy subsyndromes: linkage and haplotype analysis applied to epilepsy and EEG 3.5-6.0Â Hz polyspike waves. Mol Genet Genomic Med. 2016 Jan 23;4(2):197 -210. doi:10.1002/mgg3.195. eCollection 2016 Mar. PubMed PMID: 27066514; PubMed Central PMCID: PMC4799870. 57. J.A. Sloan, D. Vargas -Chanes, C.C. Kamath, D.J. Sargent, P.J. N ovotny, P. Atherton, C. Allmer, B.L.Fridley, M.H. Frost, C.L. LoprinziDetecting worms, ducks and elephants: a simple approach for defining clinically relevant effects in quality -of-life measures J Cancer Integr Med, 1 (2003), pp. 41 - 47 58. Lim SM, Park HS, Kim S, Kim S, Ali SM, Greenbowe JR, Yang IS, Kwon NJ, Lee JL, Ryu MH, Ahn JH, Lee J, Lee MG, Kim HS, Kim H, Kim HR, Moon YW, Chung HC, Kim JH, Kang YK, Cho BC. Next -generation sequencing reveals somatic mutations that confer exceptional response to everol imus. Oncotarget. 2016 Mar 1;7(9):10547 -56. doi: 10.18632/oncotarget.7234.PMID:26859683 59. Shipkova M, Hesselink DA, Holt DW, Billaud EM, van Gelder T, Kunicki PK, et al. Therapeutic Drug Monitoring of Everolimus: A Consensus Report. Therapeutic drug mon itoring. 2016;38(2):143 –69. Epub 2016/03/18. pmid:26982492 60. Tszyrsznic, W., Borowiec, A., Pawlowska, E., Jazwiec, R., Zochowska, D., Bartlomiejczyk, I ., Dadlez, M. (2013). Two rapid ultra-performance liquid chromatography/tandem mass spectrometry (UPLC/MS/MS) methods with common sample pretreatment for therapeutic drug monitoring of immunosuppressants compared to immunoassay. Journal of Chromatography B, 928, 9 -15. doi:https://doi.org/10.1016/j.jchrom b.2013.03.014 61. Foote RL, Loprinzi CL, Frank AR, et al: Randomized trial of a chlorhexidine mouthwash for alleviation of radiation -induced mucositis. J Clin Oncol 12:2630 -3, 1994 62. Leenstra JL, Miller RC, Qin R, et al: Doxepin rinse versus placebo in the treatment of acute oral mucositis pain in patients receiving head and neck radiotherapy with or without chemotherapy: a phase III, randomized, double -blind trial (NCCTG -N09C6 [Alliance]). J Clin Oncol 32:1571 -7, 2014 63. Loprinzi CL, Cianflone SG, Dose AM, et al: A controlled evaluation of an allopurinol mouthwash as prophylaxis against 5 -fluorouracil -induced stomatitis. Cancer 65:1879 -82, 1990 64. Loprinzi CL, Ghosh C, Camoriano J, et al: Phase III controlled evaluation of sucralfate to alleviate stomatitis in patients receiving fluorouracil -based chemotherapy. J Clin Oncol 15:1235 -8, 1997 65. Mahood DJ, Dose AM, Loprinzi CL, et al: Inhibition of fluorouracil -induced stomatitis by oral cryotherapy. J Clin Oncol 9:449 -52, 1991"
60,page_60,"Allian ce A221701 61 NCI version date 8/14/2020 Update #03 66. Okuno SH, Foote RL, Loprinzi CL, et al: A randomized trial of a nonabsorbable antibiotic lozenge given to alleviate radiation -induced mucositis. Cancer 79:2193 -9, 1997 67. Okuno SH, Foote RL, Olmscheid MA, et al: Evaluation of an oral capsaicin lozenge fo r preventing radiation -induced mucositis. J Cancer Integrative Med 2:179 -83, 2004 68. Okuno SH, Woodhouse CO, Loprinzi CL, et al: Phase III controlled evaluation of glutamine for decreasing stomatitis in patients receiving fluorouracil (5 -FU)-based chemot herapy. Am J Clin Oncol 22:258 -61, 1999 69. Rocke LK, Loprinzi CL, Lee JK, et al: A randomized clinical trial of two different durations of oral cryotherapy for prevention of 5 -fluorouracil -related stomatitis. Cancer 72:2234 -8, 1993 70 Pocock SJ, Simon R . Sequential Treatment Assignment with Balancing for Prognostic Factors in the Controlled Clinical Trial. Biometrics 31(1):103 -115, 1975 Mar"
61,page_61,"Allian ce A221701 62 NCI version date 8/14/2020 Update #03 16.0 MODEL CONSENT FORM Study Title for Participants: Testing the use of dexamethasone mouthwash to prevent or treat painful mouth sores in patients being treated with everolimus Official Study Title for Internet Search on http://www.ClinicalTrials.gov : Protocol Alliance A221701, “ Phase III placebo -controlled trial to evaluate dexamethasone use for everolimus -induced oral stomatitis: prevention versus early treatment approaches : MIST (My Individualized Stomatitis Treatment) ”, (NCT 03839940 ) Overview and Key Information What am I being ask ed to do? We are asking you to take part in a research st udy. We do research studies to try to answer questions about how to prevent, diagnose, and treat diseases like cancer ; to reduce side effects from cancer and cancer treatment and to improve the quality of life of cancer patients. We are asking you to take part in this study because you have been diagnosed with cancer and you will be receiving a drug called e verolim us as part of your usual care . It is known that this drug can cause painful mouth sores, which can interfere with activities of daily li ving, including eating and drinking. Patients who are not in this study are usually treated for these sores with rinses (or mouthwashes) containing different drugs such as lidocaine to numb the pain . Previous small studies have shown that dexamethasone can help with treating mouth sores. This study is being done to see if dexamethasone can help prevent getting the mouth sores . T aking part in this study is your choice. You can choose to take part or you can choose not to take part in this study. You a lso can change your mind at any time. Whatever choice you make, you will not lose access to your medical care or give up any legal rights or benefits. This document has important information to help you make your choice. Take time to read it. Talk to yo ur doctor, family, or friends about the risks and benefits of taking part in the study. It’s important that you have as much information as you need and that all your questions are answered. See the “Where can I get more information?” section for resourc es for more clinical trials and general cancer information. This study is conducted by the Alliance for Clinical Trials in Oncology, a national clinical research group supported by the National Cancer Institute (NCI) . The Alliance is made up of cancer doctors, health professiona ls, patient advocates and laboratory researchers, whose goal is"
62,page_62,"Allian ce A221701 63 NCI version date 8/14/2020 Update #03 to develop better treatments for cancer, to prevent cancer, to reduce side effects from cancer, and to improve the quality of life of cancer patients. Why i s this study being done? This study is being done to answer the following question: Can we lower the chance of getting painful mouth sores by treating you with a dexamethasone mouthwash at the start of your cancer treatment ? We are doing this study to f ind out if this approach is better or worse than the usual approach for preventing painful mouth sores . The usual approach is defi ned as care most people get for painful mouth sores. What is the usual approach to preventing painful mouth sores? The usual approach is to wait until mouth sores develop before they are treated with medications that have been approved by the Food and Drug Administration (FDA). What are my choices if I decide not to take part in this study? • You may choose to have the usual approach described above. • You may choose to take part in a different research study, if one is available. • You may choose to not get treated. What will happen if I decide to take part in this study? If you decide to take part in this study, you will either get dexamethasone mouthwash for up to eight weeks, or you will get placebo for up to eight weeks, or until you develop mouth pain at which time you will be asked to fill a prescription to start a dexamethasone mouthwash. During the eight week study period, your doctor will watch you for side effects."
63,page_63,"Allian ce A221701 64 NCI version date 8/14/2020 Update #03 What are the risks and benefits of taking part in this study? There are both risks and benefits to taking part in this study. It is important for you to think carefully about these as you make your decision. Risks We want to make sure you know about a few key risks right now. We give you more information in the “What risks can I expect from taking part in this st udy?” section. If you choose to take part in this study, there is a risk that the mouth pain will be worse than it would have been otherwise. There is also a risk that you could have side effects from the dexamethasone mouthwash . These side effects may be worse and may be different than you would get with the usual approach for treating mouth sores. Some of the most common side effects that the study doctors know about are: • Increased blood sugars • Insomnia • Change in energy level • Stomach Upset There may be some risks that the study doctors do not yet know about. Benefits There is evidence that dexamethasone mouthwash is effective in treating mouth sores, so taking it before mouth sores start may help pre vent you from developing mouth pain. It is not possible to know if the mouthwash will prevent your mouth sores as compared to the usual approach. This study will help the study doctors learn things that will help other people in the future . If I decide to take part in this stud y, can I stop later? Yes, you can decide to stop taking part in the study at any time. If you decide to stop, let your study doctor know as soon as possible. If you stop, you can decide if you want to keep letting the study doctor know how you are doin g. Your study doctor will tell you about new information or changes in the study that may affect your health or your willingness to continue in the study."
64,page_64,"Allian ce A221701 65 NCI version date 8/14/2020 Update #03 Are there other reasons why I might stop being in the study? Yes. The study doctor may take you off the study if: • Your health changes and the study is no longer in your best interest. • New information becomes available and the study is no longer in your best interest. • You do not follow the study rules. • For women: You become pregnant while on the study. • The study is stopped by the Institutional Review Board (IRB), Food and Drug Administration (FDA), or study spon sor (NCI) . The study sponsor is the organization who oversees the study. It is important that you understand the information in the in formed consent before making your decision. Please read, or have someone read to you, the rest of this document. If there is anything you don’t understand, be sure to ask your study doctor or nurse. What is the purpose of this study? You have cancer and will be receiving everolimus , which may cause painful mouth sores. The purpose of this study is to test whethe r a mouthwash made with a drug called dexamethasone can prevent or reduce the pain caused by mouth sores resulting from everol imus treatment. The effects of a dexamethasone mouthwash will be compared to a placebo. A placebo is a liquid that looks like the study drug but contains no medication. Dexamethasone has already been approved by the Food and Drug Administration (FDA) to treat other disorders. The dexamethasone used in this study is considered investigational, which means it has not been approved by the FDA for the use described in this study. There will be about 279 people taking part in this study. What are the study groups? This study has 2 study groups. You will not be told which group you are in. • Group 1 If you are in this group, you will get dexamethasone mouthwash, which you will swish about 2 teaspoons for two minutes in your mouth and spit, four times per day, for eight weeks. You should take nothing by mouth for thirty minutes before each mouthwash and at least an hour after each mouthwash . However, you may take nystatin for treatment of thrush (a fungal infection of the mouth ). You will also be asked to c omplete a daily pain log and weekly questionnaire s. It should take about one minute to complete the daily log and about five minutes to complete the weekly questionnaire. There will be abou t 140 people in this group."
65,page_65,
66,page_66,"Allian ce A221701 67 NCI version date 8/14/2020 Update #03 What exams, tests, and procedures are involved in this study? Before you begin the study, your doctor will review the results of your exams, tes ts, and procedures. This helps your doctor decide if it is safe for you to take part in the study. If you join the study, you will have more exams, tests, and procedures to closely monitor your safety and health. Most of these are included in the usual care you would get even if you were not in a study. As part of this study, a nurse will call you every week to remind you to complete your forms, check on your condition, to follow the effects of study treatment, including managing side effects. Some exams, tests, and procedures are a necessary part of the research study, but would not be included in usual care. Listed below are procedures that will be done for research purposes only. If you speak English , and choose to take part in this study, you w ill be asked to fill forms with questions about mouth pain and sores, sleep, fatigue and your general quality of life . Researchers will use this information to learn more about how cancer treatment affects people. Since these forms are being used for research, the responses you provide will not be shared with your study doctor. If you have any serious health issues or other concerns, please talk with your doctor or nurse right away. You will be asked to fill out forms , • before you start treatment • every day wh ile you are using the mouthwash you will be asked about your mouth pain • every week while you are using the mouthwash and after 8 weeks of using the mout hwash you will be asked questions about mouth sores, sleep, fatigue, an d your general quality of life. • You will also receive weekly phone call reminders from your nurse to use your mouthwash and complete the forms . The nurse will ask you some additional questions about your mouthwash use, your everolimus use, and about the ty pes of food you are eating, as well. The daily pain log will take less than a minute to complete and the weekly forms will take about five minutes to complete. Each phone call will take about five minutes. You don’t have to answer any question that mak es you feel uncomfortable. What risks can I expect from taking part in this study? General Risks If you choose to take part in this study, there is a risk that the study approach may not be as good as the usual approach at preventing or treating your painful mouth sores. You also may have the following discomforts: • Spend more time in the hospital or doctor’s office."
