,PageNo,Text13,page_13,"- PROSPER - Prediction and Outcome Study on PTSD and Personality disorders - Version 8, 22 June 2020 14 of 59 Clarke et al., 2008, Roberts et al., 2017, Kredlow et al., 2017). However, it may be more efficient to add a PD treatment at the same time. PTSD patients with (even mild) BPD symptoms were less likely to achieve good end -state functioning posttreatment (Feeny et al., 2002, Hembree et al., 2004) and dropped out twice as likely as PTSD patients without PD symptoms when receiving PTSD treatment alone (Zayfert et al., 2005). Worse end - stat e functioning may lead to a higher relapse rate, which is over 20% in anxiety disorders (Penninx et al., 2011). This might be so because emotion dysregulation, interpersonal malfunctioning, attachment or other personality problems are not sufficiently deal t with in PTSD treatments. Psychotherapy is the most effective treatment for all personality disorders (Leichsenring & Leibing, 2003). In BPD the strongest evidence exists for dialectical behaviour therapy (DBT) with moderate to large effect sizes for affective instability (SMD -1.07 [95% CI -1.61 - - 0.52]; n = 59) and anger (SMD -0.83 [95% CI -1.43 - -0.22]; n = 46, 2 RCTs), and moderate effect sizes in terms of impulsivity (SMD -0.61; 95% CI -1.14 to -0.09, n = 59), para -suicidality / self -harm (SMD -0.54, 95% CI 0.92 to -0.16; n = 110, 3 RCTs) and general mental health (SMD 0.65 [95% CI 0.07 - 1.24]; n = 74, 2 RCTs) (Stoffers et al., 2012). For comparisons between different comprehensive psychotherapies in BPD, statistically significant superiority was demonstrated for DBT over client -centered therapy (Kliem et al., 2010), and schema -focused therapy (SFT) over transference -focused therapy (GiesenBloo et al., 2006). In CPD (avoidant, dependent, obsessive compulsive PD), no effect differences are foun d between different theoretical references, such as SFT and psychodynamic therapy (Svartberg et al., 2004). DBT and SFT both have their roots in cognitive behavioral therapy and working mechanisms are based on improving emotion regulation, consisting of st rategies aimed at modulating and adjusting unpleasant emotional experiences (John & Gross, 2004; Pedersen et al., 2014). Although DBT and SFT are both improve emotion regulation skills, there are major differences in the explanatory models and techniques u sed in both methods (Fassbinder et al., 2016): DBT directly focuses on the acquisition of emotion regulation skills (mindfulness, distress tolerance, emotion regulation, interpersonal effectiveness) and patients are encouraged to train these skills on a re gular basis; SFT focuses primarily on the avoidance of emotions and dysfunctional meta -cognitive schemas about the meaning of emotions by working with limited re -parenting, empathic confrontation and experiential techniques like chair"
14,page_14,"- PROSPER - Prediction and Outcome Study on PTSD and Personality disorders - Version 8, 22 June 2020 15 of 59 dialogs. As add -on to SFT, ImRs can be used specifically to focus on traumatic experiences (see above). For PTSD with comorbid (B)PD an integrated DBT -PTSD -treatment is investigated in 3 RCTs (Steil et al., 2011, Bohus et al., 2013, Harned et al., 2014). The first study show ed moderate to large effect sizes of DBT -PTSD compared to waiting list, in terms of overall BPD severity (SMD -0.74 [95%CI -1.47 - -0.01]), depression (SMD -1.06 [95% CI -1.84 - -0.29]), and anxiety (SMD -0.96 [95% CI -1.72 - -0.20]) (Steil et al., 2011). The second study indicated that DBT -PTSD resulted in a greater mean change than waiting list on PTSD symptoms (CAPS 33.16 vs. 2.08), but not on BPD symptoms (Bohus et al., 2013). Integrated DBT - PTSD -treatment was also compared to DBT -alone, and led to larg er and more stable improvements in PTSD symptoms, doubled remission rate (80% vs. 40%), and decreased suicide rates (2.4 times less likely) and self -injury (1.5 times less likely), with moderate to large effect sizes for dissociation, trauma -related guilt cognitions, shame, anxiety, depression, and global functioning in completers (Harned et al., 2014). However, integrated PTSD -PD treatment is not yet directly compared to PTSD treatment alone. In summary, there is growing motivation in clinicians to offer PTSD treatments to PTSD with comorbid disorders, because these treatments are highly effective, relatively short, and there is some evidence that with PTSD treatment, comorbid PD symptoms might resolve as well. However, it may be more efficient to add a P D treatment at the same time. Evidence -based treatments for personality disorders (PD), such as dialectical behaviour treatment (DBT) for BPD, and schema -focused treatment (SFT) for CPD are well established. These treatments are more intensive (twice a wee k for at least one year) than PTSD treatments. There is some evidence that integrated PTSD -PD treatment works twice as good as PD treatment alone, but integrated PTSDPD treatment is not yet directly compared to PTSD treatment alone. This study will address this knowledge gap. Hypotheses A: We hypothesize that in PTSD with comorbid PD it is more effective to provide integrated PTSD -PD-treatment compared to PTSD treatment alone, primarily in terms of response rate in PTSD symptoms. Secondarily, we hypothes ize that PD symptoms, disability and quality of life will improve and cost -effectiveness will be better with integrated treatment."
15,page_15,"- PROSPER - Prediction and Outcome Study on PTSD and Personality disorders - Version 8, 22 June 2020 16 of 59 A1. In patients with PTSD with BPD, integrated DBT -EMDR treatment results in a higher response rate than EMDR -only; A2. In patients with PTSD and CPD, integrated SFT - ImRs treatment results in a higher response rate than ImRs -only. Part B: Predictors of PTSD treatment As yet, we cannot predict PTSD treatment outcome to individual patients. Certain candidate psychologic al predictors of treatment response are identified, at least on a group level. It was found that men with PTSD show worse treatment response than women (Tarrier et al., 2000, Karatzias et al., 2007). Younger age is associated with higher dropout (Rizvi et al., 2009). Type of trauma and severity of depressive symptoms were not found to be predictive of treatment response (Minnen van et al., 2002, Ehlers et al., 2005, Ford & Kidd 1998, Rizvi et al., 2009, Forbes et al., 2002, Ronconi et al., 2015). Cogniti ve candidate predictors of PTSD treatment outcome are: educational level/ intelligence (Ehlers et al., 2005, Rizvi et al., 2009), working memory (Nijdam et al., 2015, Wild et al., 2008) and cognitive control of emotions, i.e. emotion regulation. Emotion regulation problems and an extern locus of control are associated with worse response to PTSD treatment (Cloitre et al., 2004, Arntz et al., 2007, Bardeen et al., 2013, Böttche 2016), including high suicide risk (Tarrier et al., 2000) and alcohol intake (For bes et al., 2002). Borderline personality symptoms (affective instability and impulsivity) are related to worse end -state functioning (Feeny et al., 2002, Hembree et al., 2004, Barnicot et al., 2011) and higher drop -out from PTSD treatment (Zayfert et al., 2005, McDonagh et al., 2005), but not if symptoms are relatively mild (Clarke et al., 2008, Walter et al., 2012, Thornback et al., 2014). Affective factors found to be candidate predictors are related to hyper -arousal (anger/irritability, sleep problem s/intrusions) or hypo -arousal (avoidance/numbing, dissociation), both key symptoms of PTSD. PTSD treatment is thought to be effective only when the patient’s affective state is within a window of tolerance: arousal enough to be able to work with the trauma tic material but not too much overwhelmed by emotions (hyper -arousal) or disconnected from it (hypo -arousal). Severity of PTSD – if measured with a clinical interview – is associated with worse treatment response (Karatzias et al., 2007, Taylor et al., 200 3). Higher anger scores are related to worse response and higher"
16,page_16,"- PROSPER - Prediction and Outcome Study on PTSD and Personality disorders - Version 8, 22 June 2020 17 of 59 dropout (Forbes et al., 2003, Rizvi et al., 2009, Lloyd et al., 2014). Severity of dissociative symptoms is associated with worse response to PTSD -treatment (Ford & Kidd 1998, Lanius et al., 2010, Resick et al., 2012, Cloitre et al., 2010, 2012, Wolf et al., 2016, Bae et al., 2016), although this might not be true for mild dissociative symptoms (Hagenaars et al., 2010; Minnen van et al., 2016). Severe dissociation is however not predictive f or worse treatment outcome in integrated PTSD -PD treatment (Zlotnick et al., 1997, Chard et al., 2005, Dorrepaal et al., 2012, Cloitre et al., 2012, Kleindienst et al., 2016). In addition, relational variables, such as quality of the therapeutic allianc e (Cloitre et al., 2004, Barnicot et al., 2011), credibility of the therapy (Taylor et al., 2003, Alfonsson et al., 2016), attachment problems (Forbes et al., 2010), and especially a lack of social support are predictive of PTSD treatment response (Brewin et al., 2000; Yehuda et al., 2015). Only few studies focused on neurobiological predict ors of treatment response. It is assumed that PSTD treatments mainly rely on extinction and memory re -consolidation processes (Careaga et al., 2016). Extinction, in short, is the attenuation or disappearance of a previously learned response when that response is not reinforced. The amygdala and ventral anterior cingulate cortex (ACC) are associated with extinction processes and there is evidence that these neurobiolog ical correlates normalize with treatment (Thomaes et al., 2014). Non -responders of TF -CBT showed greater amygdala and greater right ventral ACC activation in response to masked fearful faces before treatment compared to responders (Bryant et al., 2008a, Di ckie et al., 2011, Schmidt et al., 2013, Rooij et al., 2016). A smaller ventral ACC volume and a smaller hippocampus volume were associated with poorer treatment response to TF -CBT (Bryant et al., 2008b, Rooij et al., 2015a). During viewing of negative pic ture before treatment, both decreased (Bryant et al., 2008a) as well as increased activity in the dorsal ACC – a region associated with emotion regulation - was found to be predictive of PTSD treatment response (Rooij et al., 2016), and this inconsistency of findings might point to heterogeneity in PTSD populations. In addition, non -responders showed an increased demand on the executive frontostriatal network during a response inhibition task (Falconer et al., 2013, Rooij et al., 2016) and increased left inferior parietal lobe activation, a region associated with attention processes (Rooij et al., 2015b). In research into BPD response inhibition tasks are also used as a paradigm (see Van Zuthphen et al., 2015 for a review), but not yet for predicting treatme nt outcome."
17,page_17,"- PROSPER - Prediction and Outcome Study on PTSD and Personality disorders - Version 8, 22 June 2020 18 of 59 Recently, research criteria and neurobiological models are set to prioritize factors to study and use them in a personalized precision psychiatry (RDoc -criteria of the National Institute of Mental Health, NIMH https://www.nimh.nih.gov/research -priorities/rdoc/; Heuvel et al., 2016, Williams 2016). These models are close to the above -mentioned psychological candidate predictors of treatment outcome: 1) cognitive factors or ‘cognitive’ brain networks, 2) affective factors related to the ‘limbic’ brain networks, and 3) relational factors related to the ‘positive affect’ and social processing brain networks (see figure 1 below). Using these models will help to build a more dimensional instead of categorical psychiatric model that will be better app licable to treatment choice (Williams 2016). Preliminary evidence exists on neurohormonal and associated (epi)genetic predictors of treatment outcome. A serotonin transporter gene promoter -region polymorphism (the LL 5HTTLPR genotype) was associated with greater responsiveness of PTSD to pharmacotherapy, while the S allele was associated with treatment non -response (Schmidt et al., 2013). Lower brain derived neurotrophic factor (BDNF) levels predicted a greater response to pharmacotherapy in PTSD (Schmidt et al., 2013). It is not clear yet if these factors might predict psychotherapy outcome as well. Cortisol levels and FKBP -5 predicted PTSD susceptibility and might be useful as a treatment outcome marker too (Schmidt et al., 2013, Galatzer -Levy et al., 20 17). The same holds for oxytocin and the oxytocin receptor (OXTR) gene (Bandelow et al., 2016; 2017) Unfortunately, all those candidate predictors are found on a group comparison level only, and in few studies with small and heterogeneous groups of patie nts. Therefore, they are not yet applicable on an individual level for treatment choice. Single predictors have not shown a large explaining variance, in depressed or anxiety patients, while combining clinical with MRI data increased explained variance sig nificantly (Serra -Blasco et al., 2016; Månsson et al., 2015; Ball et al., 2014; Doehrmann et al., 2013), using machine -learning models. Machine learning prediction models have also been made for pediatric obsessive - compulsive disorder (Lenhard et al., 2017 ) and in depressed patients that received electroconvulsive therapy (Redlich and al., 2016). We will explore if candidate predictors of PTSD treatment outcome can be used in a machine -learning model to predict treatment outcome on an individual basis."
18,page_18,"- PROSPER - Prediction and Outcome Study on PTSD and Personality disorders - Version 8, 22 June 2020 19 of 59 Hypotheses B: We hypothesize that non -response to PTSD -treatment and to integrated PTSD -PD treatment, can be individually predicted by a machine -learning model with: B1. Psychological factors: Cognitive factors (educational level/IQ, working memory, emotion regulation), Affective factors (hyper -arousal: anger, sleep; hyper -arousal: dissociation), and Relational factors (therapeutic alliance, attachment, social support). B2. Neurobiological factors: Neural factors (volumes ACC and hippocampus, activity and connectivity of salience and negative affect network and ventral and cognitive control network)), and Hormonal/ epigenetic factors (5 -HTTLPR, BDNF, cortisol/FKBP5methylation, oxytocin/OXTR). 2. OBJECTIVES The primary objectives of this study are : A. To investigate if in adult patients with PTSD and comorbid PD it is more effective to provide integrated PTSD -PD treatment compared to PTSD treatment alone in terms of response rate in PTSD symptoms: A1. In patients with PTSD with BPD, integrated DBT -EMDR treatment results in a higher effect size and higher response rate than EMDR -only."
19,page_19,"- PROSPER - Prediction and Outcome Study on PTSD and Personality disorders - Version 8, 22 June 2020 20 of 59 A2. In patients with PTSD and CPD, integrated SFT - ImRs treatment results in a higher effect size and higher response rate than ImRs -only. B. To investigate individually prediction by a machine -learning model of PTSD treatment outcome in adult patients with comorbid PTSD and personality disorders (profiling), in order to improve treatment indication leading to more precise (personalized) and efficient treatments, with can didate predictors: B1. Psychological factors: cognitive (educational level/IQ, working memory, emotion regulation), affective (hyper -arousal: anger, sleep; hyper -arousal: dissociation), and relational factors (therapeutic alliance, attachment, social sup port). B2. Neurobiological factors: Neural factors (smaller ACC and hippocampus volume, increased right amygdala and ventral ACC activity and de/increased dorsal ACC activity), and Hormonal/ epigenetic factors (5 -HTTLPR, BDNF, cortisol/FKBP5 - methylation, oxytocin/OXTR). 3. STUDY DESIGN The design of this study consists of two – connected - RCTs comparing PTSD -treatment to integrated PTSD -PD treatment in patients with PTSD and comorbid PD in a specialized treatment setting (figure 2): A1. EMDR ve rsus integrated DBT -EMDR, and A2. ImRs versus integrated SFT - ImRs. Assessment points are: baseline (T0), after 3 months (T1), after trauma treatment has finished, around 6 months (T2), 3 months after T2 (T3), after 12 months (T4) and at 18 months (foll ow-up, FU). PTSD treatments specifically address the troubling memories of the traumatic event and the personal meaning of the event and consist of 12 to 18 sessions in maximum 6 months, and are: - EMDR (Eye Movement Desensitization and Reprocessing) EMDR was developed in 1987 by Shapiro (De Jongh & Ten Broeke, 1998). In EMDR the therapist induces a bilateral stimulation once the client has focused the attention on a disturbing image or memory related to the traumatic experience. The bilateral stimulatio n is induced by the movement of the therapist’s fingers in front of the patients face from"
20,page_20,"- PROSPER - Prediction and Outcome Study on PTSD and Personality disorders - Version 8, 22 June 2020 21 of 59 the left to the right with the instruction for the client to follow this movement of the hand with the eyes. Attention is drawn to what traumatic memory and the dysf unctional thoughts about it are currently doing with the patient and not to what the patient was thinking during the traumatic experience. - ImRs (Imagination and Rescripting Therapy) (Arntz et al., 2007, Raabe et al., 2015). In ImRs, the patient imagines the (onset of a) traumatic experience and subsequently changes the original course of events by imagining different interventions and outcomes, thereby allowing for the change of original schematic representations and cognitions (Hackmann et al., 2011). I mRs implies changing the traumatic imagery in fantasy, to produce a more favourable outcome (without denying the trauma), imagining having control over the situation and being able to act according to one’s needs, to express one’s feelings and action tende ncies. ImRs was hypothesized to alleviate PTSD symptoms as well as change trauma -related beliefs and schemas (e.g. powerlessness, victimization, and inherent badness). It is suggested that ImRs might be more effective in patients with emotions and cognitio ns like anger, irrational guilt, shame disgust and/or self -contempt (Arntz et al., 2007). Integrated PTSD -PD treatment consist of a PTSD treatment interwoven in a PD treatment that takes at least twice sessions per week, for the duration of one year: - DBT (Dialectical Behavior Treatment), a manualized outpatient cognitive –behavioral treatment with two components: (a) weekly individual therapy and (b) weekly group skills training. Individual sessions focus on a hierarchy of target behaviors, which the patient tracks on a daily basis with diary cards. Behavioral analyses of the pattern and chain of thoughts, emotions, and events take place routinely to help the patient identify triggers and alternative strategies for coping. Change strategies such as proble m solving and reinforcement techniques are used in combination with acceptance and validation of the patient’s experience. Group skills’ training is used to help patients develop less self-destructive and more adaptive means of coping with intolerable affe cts. These skills include awareness of emotions and reactions, interpersonal effectiveness, emotion regulation, and distress tolerance. Skills are then integrated into the individual treatment in problem situations, e.g. suicidal urges (Linehan, 1993). - SFT (schema focused treatment) is a form of psychotherapy integrating cognitive therapy, behavior therapy, object relations, and gestalt therapy into one unified,"
21,page_21,"- PROSPER - Prediction and Outcome Study on PTSD and Personality disorders - Version 8, 22 June 2020 22 of 59 systematic approach to treatment. The focus in SFT is on changing maladaptive schemes that pati ents develop early in life and thereby improve emotion regulation skills. Change is achieved through a range of behavioral, cognitive, and experiential techniques that focus on (1) the therapeutic relationship, (2) daily life outside therapy (also through homework assignments), and (3) past (traumatic) experiences (Young et al., 2003). Psychomotor therapy (PMT) is part of the SFT treatment protocol. In the Sinai Centrum, 2 “Zorgpaden” will be implemented in Fall2017: “Zorgpad 1” with EMDR or ImRs (3 -6 months) and Zorgpad 2” with EMDR -DBT or ImRs - SFT (9 -12 months). Therapists need to be “adherent -to-the model”, which will be ascertained by regular supervision with audiovisual recordings based on the different theoretical psychotherapeutic principles and therapies are delivered by protocol. At this moment, there is no clear scientific evidence and criteria are not explicitly defined for the one or the other treatment, except that patients with PTSD without comorbid PD have to be indicated for “Zorgpad” 1. Use of co -intervention: Patients may continue taking medication for PTSD throughout the study. Patients who started with new medication for PTSD within 1 month prior to the initial screening will be excluded from participation. No other psychological or new pharmacological therapy is allowed during treatment. Medication use is monitored during the study. Escape medication/treatment: Participants might start taking medication or another form of treatment/therapy in case of acute crisis during the study. The use of these medications or crisis intervention during the study as co -intervention will not lead to exclusion from the study, but will be monitored, documented, and reported. Further treatment: After completion of the EMDR or ImRs a first follow -up assessment will be completed and the therapist will see the patient for an evaluation. If more treatment is acutely needed, a clinical evaluation is done and the indication staff will decide what treatment to offer to the patient. The kind, intensity and f requency of this further treatment will be monitored, documented and reported. All patients in Zorgpad 1 are allowed to start SFT or DBT after T4 (i.e. 6 months after completing Zorgpad 1)."
22,page_22,"- PROSPER - Prediction and Outcome Study on PTSD and Personality disorders - Version 8, 22 June 2020 23 of 59 Months 0 3 6 9 12 B aseline assessment: Q & I ( PCL - 5 /CAPS - 5 + SCID - 5 - PD screener) T0: Further assessments fo r included patients: Predictors + Biomarkers + MR I PTSD + BPD Condition 1: EMDR Condition 2: Integrated DBT - EMDR FU: PCL - 5 PTSD + CPD Condition 1: ImRs Condition 2: Integrated SFT - ImRs T1: PCL - 5 T2: PCL - 5 /CAPS - 5 + Biomarkers + MRI T3: PCL - 5 T4: PCL - 5 /CAPS - 5 AND SCID - 5 - PD"
23,page_23,"- PROSPER - Prediction and Outcome Study on PTSD and Personality disorders - Version 8, 22 June 2020 24 of 59 18"
24,page_24,"- PROSPER - Prediction and Outcome Study on PTSD and Personality disorders - Version 8, 22 June 2020 25 of 59 Figure 2. Flow chart for two connected randomized controlled trials (RCTs) for patients with PTSD and borderline personality disorders (BPD) resp. with PTSD and cluster C personality disorde rs (CPD) 4. STUDY POPULATION 4.1 Population The study population consists of all patients between 18 -65 years old, referred to the SC with comorbid PTSD and PD, who are willing to participate in the study (informed consent); N = 252 patients (see 4.4), of which sub -group of 80 patients (N = 40 Condition 1 + 40 Condition 2) will participate in the MRI study (before and after treatment). For baseline MRI comparison, extra 40 healthy controls, matched on age, gender and educational level, will be rec ruited also for the MRI study via advertisements in local newspapers and through hersenonderzoek.nl. In total, 292 persons will be included in this study. A pilot episode will be introduced (September – December 2017) to test the feasibility of the s tudy and inclusion rate. Feasibility is enhanced by the opportunity to build on the established expertise of the academic research group in Arkin – Research and VUmc in conducting effect studies, longitudinal and neurobiological studies. 4.2 Inclusion c riteria In order to be eligible for study participation as a patient, he/she has to be at T0: - Diagnosed with PTSD (309.81) , and - Diagnosed with a personality disorder (301.81 borderline, 301.4 obsessive -compulsive, 301.6 dependent, 301.82 avoidant), or at least the number of required symptoms minus 1 for at least one of those PDs (i.e. four symptoms for borderline, three symptoms for obsessive -compulsive, four symptoms for dependent, three symptoms for avoidant) . To be eligible for the study, both patie nts and healthy controls have to: - Be aged between 18 and 65 years - Give written informed consent - Speak / understand Dutch sufficiently"
