,PageNo,Text25,page_25,"E7116 Form/Template 90702637 Rev/Ver AJ Confidential AXIOSTM WON Drainage IDE Study, 92153943, Rev/Ver I Page 25 of 60 5. WONs that require dual modality interventions (endoscopic and percutaneous) from the beginning (i.e. deep paracolic space involvement that is inaccessible through the central drainage access) 6. Prior surgical, interventional radiology or endoscopic procedures for the treatment of the WON 7. Abnormal coagulation: • INR > 1.5 and not correctable • presence of a bleeding disorder • platelets < 50,000/mm 3 8. Intervening gastric varices or unavoidable blood vessels within the access tract (visible using endoscopy or endoscopic ultrasound) 9. WON that poorly approximates the GI lumen (≥1cm away) 10. Pericolic gutter necrosis 11. Pelvic necrosis 12. Prior true anaphylactic reaction to contrast agents, nitinol (nickel titanium), silicone or any other materials contacting the patient 13. Female of childbearing potential with a positive pregnancy test prior to the procedure or intends to become pregnant during the study 14. Currently participating in another investigational drug or device study that has not completed the primary endpoint or that clinically interferes with the endpoints of this study 5.3 Point of Enrollment A subject is considered “enrolled” after signing the study- specific Info rmed Consent Form (ICF). Subjects who sign the ICF but subsequently do not meet one or more of the selection criteria will be considered screen failures and excluded from the study. 5.4 Withdrawal All subjects enrolled in the clinical study (including those withdrawn from the clinical study or lost to follow-up) shall be accounted for and documented. If a subject withdraws from the clinical investigation, the reason(s) shall be reported. If such withdrawal is due to problems related to investigational device safety or performance, the investigator shall ask for the subject’s permission to follow his/her status/condition outside of the clinical study. Reasons for withdrawal include physician discretion, subject choice to withdraw consent, loss to follow-up and death. While study withdrawal is discouraged, subject s may withdraw from the study at any time, with or without reason, and with out prejudice to further treatment. All applicable case report forms up to the point of subject withdrawal must be completed. Additional data may no longer be collected after the point at which a subject has been withdrawn from the study or withdraws his/her consent, for whatever reason. All open"
26,page_26,"E7116 Form/Template 90702637 Rev/Ver AJ Confidential AXIOSTM WON Drainage IDE Study, 92153943, Rev/Ver I Page 26 of 60 adverse events should be closed or include resolution status. Data collected up to the point of subject withdrawa l may be used. Withdrawn subjects will not be replaced. Subjects who withdraw from the study with the study stent in place will be followed per standard of care at the local institution. 5.5 Subject Status and Classification Enrolled Cohort A subject will be considered enrolled when the ICF is signed. Intent- to-treat Cohort The intent- to-treat (ITT) cohort is defined as all subjects who signed the ICF, were evaluated for inclusion/exclusion criteria, and in whom the endoscopic procedure was initiated. Treated Cohort The treated cohort is defined as all ITT subjects who have an AXIOSTM stent implanted for the purpose of WON drainage. Subjects in th e trated cohort will be counted towards the enrollment ceiling and this cohort will be considered the primary analysis cohort. Per Protocol Cohort The per -protocol cohort is defined as all treated subjects for whom an AXIOSTM stent was implanted for the purpose of WON drainage and met all eligibility criteria. 5.6 End of Study Action Plan Subjects will have the study test device, the AXIOSTM Stent, implanted temporarily for up to 60 days. A subject will be considered lost to follow-up if the subject remains unresponsive to communication after three documented attempts by study staff. However, for those subjects who remain unresponsive to communication while the stent remains in place, additional attempts will be made to request the subject’s return for study stent removal. These additional attempts may include increased telephone and written communications and contact with the subject’s primary care physician (if this communication is consented to in the Informed Consent Form)."
27,page_27,"E7116 Form/Template 90702637 Rev/Ver AJ Confidential AXIOSTM WON Drainage IDE Study, 92153943, Rev/Ver I Page 27 of 60 6 Study Methods 6.1 Data Collection Procedure/ Assessment Screening / Pre-Op Visit Stent Placement Procedure WON Resolution Assessment Visit (7 (+/- 3 days) /14 (+/- 5 days) for inpatients/outpa tients) Reintervention/ Necrosectomy Visit (when needed ) Stent Removal Visit (14 -60 days from stent placement) 7 Day Post Stent Removal Visit (+/- 3 days) WON Recurrence Assessment Visit/End of Study (6 months (+/- 14 days) from stent removal) Informed Consent X Eligibility Criteria X Demographics X Etiology of AP X Onset of AP X Severity of AP X WON related symptoms X X X Imaging+++ X+ X X** X** Organ Failure X X X Quality of Life ( SF-12) X* X X Laboratory Tests X X++ X** X** X** Current Medication X X*** X*** X*** X*** X*** X*** Stent Placement X Lavaging of WON and/or placement of Nasocystic Drain X** Stent Lumen Patency X X X Necrosectomy X** Percutaneous or Additional Endoscopic Drainage X** X** Stent Removal X Adverse Event Assessment X X X X X X Device Event Assessment X X X X X = Required * = If the SF -12 is not done due to the condition of the patient, this will not be considered a protocol deviation"
28,page_28,"E7116 Form/Template 90702637 Rev/Ver AJ Confidential AXIOSTM WON Drainage IDE Study, 92153943, Rev/Ver I Page 28 of 60 ** = As needed per standard of care *** = Documentation of any changes in medication since previous visit + = Imaging should be done within 2 weeks of the initial drainage procedure ++ = Labs need to be repeated at this visit ONLY IF they were colletect more than 3 days before the stent placement procedure. +++ = Imaging may include CT with contrast (unless contraindicated), MRI, EUS Study Candidate Screening No study- specific testing will be conducted until after the subject has signed an ICF. A Screen Failure/Enrolled Log will be maintained in the Electronic Data Capture ( EDC ) system by the center to document select information about candidates who signed consent. 6.2 Informed Consent Written Informed Consent must be obtained for all subject s who are potential study candidates. Subject s will be asked to sign the ICF before any study -specific tests or procedures are performed. The ICF is study -specific and must be approved by the study IRB/EC and Competent Authority (CA), as applicable. Study personnel should explain that even if a subject agrees to participate in the study and signs the ICF, the EUS procedure may demonstrate that the subject is not a suitable candidate for the study. 6.3 Visit Schedule Screening / Pre- op Visit – Office/Hospital Visit: • Informed Consent • Demographics • Etiology of AP • Onset date of AP • WON related symptoms • CT Scan or MRI (identification of percentage of necrosis and confirmation of absence of pseudoaneurysms inside WON) • Organ failur e assessment (Marshal scoring system) • Severity of AP • Labs • Quality of Life ( SF-12) Note: If the SF-12 is not done due to the condition of the patient, this will not be considered a protocol deviation • Current medication Stent Placement Procedure – Office/Hospital Visit • AXIOSTM stent placement Note: Physicians will select the site of the AXIOSTM stent placement under endoscopic guidance and choose an access location that is free from necrotic debris and intervening blood vessels, where the wall between the GI tract and fluid collection is 10mm or less,"
29,page_29,"E7116 Form/Template 90702637 Rev/Ver AJ Confidential AXIOSTM WON Drainage IDE Study, 92153943, Rev/Ver I Page 29 of 60 and where it is possible to place the AXIOSTM stent in a position such that the inner flange (inside WON) has enough space to expand. • Lavaging of WON under endoscopic visualization and/or placement of nasocystic drain, or a single, 7fr double pigtail plastic stent (Boston Scientific 7Fr Advanix TM Biliary Stent ) through the AXIOSTM stent at the discretion of investigator • Stent lumen patency assessment • Adverse event assessment/device event assessment • Current medication • Labs (as needed) Note: Labs need to be repeated at this visit ONLY IF they were collected more than 3 days before the stent placement procedure. Multiple Interventions During Index Procedure: Once stent is placed into the WON, dilation of the AXIOSTM stent is allowed to expand the stent if needed. Dilation can be performed to the maximal diameter of the AXIOSTM stent. A single, 7 fr double pigtail plastic stent (Boston Scientific 7Fr AdvanixTM Biliary Stent) may be placed through the AXIOSTM stent at the discretion of the investigator. Access to the WON with a forward viewing diagnostic or therapeutic upper gastroscope is allowed up to 20 minutes (from time of endoscopic access of the WON) to break -up large chunks of necrosis and lavage collection at the discrection of the physician. WON Resolution Assessment - 7 days (+/ - 3 days) for inpatients and 14 (+/ - 5 days) days for outpatients (needed until radiographic decrease of WON size to ≤ 3cm) – Office/Hospital Visit: • Cross sectional imaging (CT or MRI) to assess reduction in WON size. If reduction in size is deemed insufficient, necrosectomy will be initiated • Documentation of clinical improvement defined as improvement of principal WON-related symptoms • Necrosectomy (as needed) • Adverse event assessm ent/device event assessment • Organ failure assessment (Marshal scoring system) • Current medication • Labs (as needed) Reintervention/Necrosectomy Visit s when needed during AXIOSTM stent indwell – Office/ Hospital Visit: • Necrosectomy initiated if WON reduction in size is deemed insufficient during WON Resolution Assessment Visit. Duration of each necrosectomy session is limited to 60 minutes • Percutaneous drainage or additional endoscopic drainage may be needed if reduction in WON size is insufficient or in case s of continued WON related symptoms such as infection/sepsis despite necrosectomy. Choice of stent (AXIOS TM or plastic double pigtail"
30,page_30,"E7116 Form/Template 90702637 Rev/Ver AJ Confidential AXIOSTM WON Drainage IDE Study, 92153943, Rev/Ver I Page 30 of 60 stent(s)) for repeat endoscopic drainage procedures will be left to the discretion of the investigator. The double pigtail plastic stent(s) or new AXIOS TM stent may be placed through the tract established by the original AXIOSTM stent or in a separate location. • Stent lumen patency assessment • Imaging (as applicable) • Labs (as needed) • Adverse event assessment/device event assessment • Current medication Stent Removal Visit - between 14 days and 60 days (+/- 7 days) of stent placement – Office/Hospital Visit • Stent lumen patency assessment • Stent removal after evidence of clinical and radiographic (via CT or MRI) resolution of WON Note: Removal of stent by 60 days is required if WON not resolved. Patients with unsuccessful or incomplete WON resolution by 60 days will proceed to standard of care treatment outside of this protocol after removal of the AXIOS TM stent; however, the patient outcome will continue to be followed. Alternative interventions may include surgery, endoscopic drainage with double pigtail plastic stents, percutaneous catheter drainage and necrosectomy (video-assisted retroperitoneal debridement (VARD), or endoscopic transluminal debridement, or open necrosectomy). • Adverse event assessment/device event assessment • Organ failure assessment (Marshal scoring system) • Quality of Life ( SF-12) • Current medication 7 Day (+/-3 days) Post Stent Removal Visit – (Office or phone call): • Adverse Event assessment • Current medication WON Recurrence Assessment Visit/End of Study – at 6 Months (+/ - 14 days) from stent removal: • Recurrence assessment (presence of clinical symptoms and further d iagnosis per standard of care (e.g. labs and imaging) • Adverse Events assessment • Quality of Life (SF -12) • Current medication 6.4 Study Completion Subject s will be followed for 6 months after stent removal ."
31,page_31,"E7116 Form/Template 90702637 Rev/Ver AJ Confidential AXIOSTM WON Drainage IDE Study, 92153943, Rev/Ver I Page 31 of 60 Additional visits may be conducted at the Investigator’s discretion in accordance with Adverse Event or Device Event data collection. A subject will be considered lost to follow- up if the subject remains unresponsive to communication after three documented attempts by study staff. 6.5 Source Documents The Investigator/institution guarantees direct access to original source documents, including imaging documentation, by BSC personnel, their designees, and appropriate regulatory authorities. In the event that the original medical records cannot be obtained for a patient that is seen by a non -study physician at a non-study institution, photocopies of the original source documents must be made available for review. 7 Statistical Considerations 7.1 Effectiveness Endpoint Primary Effectiveness Endpoint: The primary effectiveness endpoint for this study is the resolution of WON with endoscopic drainage defined as radiographic decrease of WON size to ≤ 3cm evaluated by CT scan or MRI Primary Effectiveness Endpoint Assessment: Note: Success will be based on the number of WONs resolved, not on the number of AXIOSTM Stents required to achieve resolution. • If it is determined that the fluid collection is actually two separate collections, and each collection is drained via an AXIOSTM stent, then each collection will be assessed individually via the drainage success criteria of ≤3 cm. • If it is determined that the fluid collection is a single collection but the drainage is inadequate via a single AXIOS TM stent, then the success of the AXIOSTM drainage will be assessed as follows: o If a second AXIOSTM stent is used at a new drainage site/original drainage site and the entire fluid collection is drained to meet the success criteria of ≤3cm then the collection will be considered to be a single collection drainage success. o If a second AXIOSTM stent is used at a new drainage site and the entire fluid collection does not drain adequately to meet the drainage success criteria of ≤3c m then the fluid drainage of the collection will be considered to be a single drainage failure. o If a plastic stent is used at a new drainage site and the entire fluid collection drains to meet the drainage success criteria of ≤3cm then the fluid drainage will be considered indeterminate."
32,page_32,"E7116 Form/Template 90702637 Rev/Ver AJ Confidential AXIOSTM WON Drainage IDE Study, 92153943, Rev/Ver I Page 32 of 60 o If a single, 7fr plastic stent is used at the same drainage site, through the AXIOSTM stent, and the entire fluid collection drains to meet the drainage success criteria of ≤3cm then the fluid drainage will be considered a single collection drainage success. o If a plastic stent is used at a new drainage site and the entire fluid collection does not drain to meet the drainage success criteria of ≤3c m then the fluid drainage will be considered a single drainage failure. Hypothes is: As in th e original IDE, #G130264, there is no formal statistical hypothesis for this study. The proportion of AXIOS patients with reduction of WON size to ≤ 3cm within 60 days from AXIOS TM stent placement in the original IDE is 76.7% (23/30) [95% CI (57.7%, 90.0% )] patients. Given that the WONs in the proposed IDE will have an estimated necrotic material content above 30%, namely larger than in IDE #G130264, a slightly lower success rate of 70% is expected in this study. This success rate is within the range of reported WON resolution rates in several recent publications [2 -8] representing 448 patients for which a random effects meta -analysis yields a mid -point WON resolution rate of 67.0% [95% CI (60.0%, 73.4%)] for WON drainage with plastic stents (Table 7.1) , an es tablished WON drainage method as described in the ASGE guidelines on treatment of pancreatic fluid collections [9]. Table 7.1 Plastic Stent WON Resolution Rates from Recent Publications Study % Resolution (x/N) 95% Confidence Interval Bapaye (2017 ) 73.8% (45/61) (60.9%, 84.2%) Gardner et al (2009) 68.9% (31/45) (53.4%, 81.8%) Papachristou (2007) 52.8% (28/53) (38.6%, 66.7%) Schmidt (2015) 61.7% (50/81) (50.3%, 72.3%) Smoczynski (2015) 75.9% (85/112) (66.9%, 83.5%) Abu Dayyeh (2017) 75.0% (27/36) (57.8%, 87.9%) Varadarajulu (2011) 60.0% (36/60) (46.5%, 72.4%) Random -Effects Meta -Analysis 67.0% (60.0%, 73.4%) Statistical Methods: The primary effectiveness endpoint will be summarized as the proportion of patients who have r esolution of WON with endoscopic drainage defined as radiographic decrease of WON size to ≤ 3cm evaluated by CT scan or MRI out of all patients who have an A XIOSTM stent successfully implanted. A Clopper- Pearson exact 95% confidence interval will also be calculated. 7.2 Safety Endpoint Primary Safety Endpoint:"
33,page_33,"E7116 Form/Template 90702637 Rev/Ver AJ Confidential AXIOSTM WON Drainage IDE Study, 92153943, Rev/Ver I Page 33 of 60 The Primary Safety Endpoint is AXIOSTM stent related or WON drainage procedure related serious adverse events . Primary Safety Endpoint Assessment: If it is determined that the patient has an infection, then the primary safety success of the AXIOSTM device or the drainage procedure will be assessed as follows: • If the patient presents with an infected collection a t the initial drainage procedure, the infection will be classified as a localized infection and will not be considered a stent related or WON drainage related serious adverse event • If the pat ient presents with a sterile collection at the initial drainage p rocedure and post- procedurally develops an infected collection, the infection will be classified as a localized infection and will not be considered a stent related or WON drainage related serious adverse event as this is a known consequence of any endoscopic drainage procedure, where the access route to the collection is through a non- sterile GI lumen and is not a function of a particular stent or device (Note: If the stent is occluded at the onset of infection, then the infection will be attributed to th e device. If the stent remains unobstructed at the time of infection, then the infection will not be attributed to the device.) • If the patient presents with a sterile collection at the initial drainage procedure an d then post-procedurally develops a wide -spread infection in the form of sepsis or blood stream infection, then the infection will be classified as systemic and will be considered a stent related or WON drainage related serious adverse event only if the AXIOS stent was clearly and visually o ccluded by solid necrosis at the time of repeat endoscopy. This determination will be made by the operating physician at the time of endoscopy Hypothesis: As in the original IDE, #G130264, there is no formal statistical hypothesis for this study. The proportion of AXIOS patients with AXIOS TM stent related or WON drainage procedure related serious adverse events in the original IDE is 10.0% (3/30) [95% CI (2 .1%, 26.5%)] patients. A similar rate of AXIOSTM stent related or WON drainage procedure related serious adverse events is expected in this study . This event rate is within the range of reported stent related or WON drainage procedure related serious adverse event rates in several recent publications [3 -5, 10] representing 306 patients for which a random effects meta- analysis yields a mid -point related SAE rate of 16.7% [95% CI (10.1%, 26.3%)] for WON drainage with plastic stents (see Table 7.2 and Table 7.3 (categorized events from Table 7.2)), an established WON drainage method as described in the ASGE guidelines on treatment of pancreatic fluid collections [9]."
34,page_34,"E7116 Form/Template 90702637 Rev/Ver AJ Confidential AXIOSTM WON Drainage IDE Study, 92153943, Rev/Ver I Page 34 of 60 Table 7.2 Plastic Stent -related or WON Drainage- procedure related Serious Adverse Events Rates from Recent Publications [3-5, 10] Study % Related SAEs (x/N) 95% Confidence Interval Papachristou (2007) 20.8% ( 11/53 ) (10.8%, 34.1%) Schmidt (2015) 12.3% ( 10/81 ) (6.1%, 21.5%) Smoczynski (2015) 25.9% ( 29/112 ) (18.1%, 35.0%) Varadarajulu (2011) 8.3% ( 5/60) (2.8% , 18.4%) Random -Effect Meta -Analysis 16.7% (10.1%, 26.3%) Table 7.3 Categorized Plastic Stent -related or WON Drainage- procedure related Serious Adverse Events Rates from Recent Publications [3-5, 10] SAE % (x/N) Bleeding 11.1% (34/306) Perforation 2.6% (8/306 ) [5 GI; 2 Collections; 1 Undefined ] Pneumoperitoneum 1.3% (4/306) Sepsis 0.7% (2/306)* Stent migration 1.0% (3/306) Multiple organ failure 1.0% (3/306) Other - loss of access to the collection (due to hypertension) 0.3% (1/306) *Note: 1 pat ient with septic shock also had multiple organ failure (death) Statistical Methods: The primary safety endpoint will be summarized as the proportion of patients who have AXIOSTM stent related or WON drainage procedure related serious adverse events out o f all patients who have an AXIOS stent successfully implanted. A Clopper- Pearson exact 95% confidence interval will also be calculated. 7.3 Sample Size and Success Crit eria The WON resolution rates and related SAE rates reported in the above provided study references are similar to those reported for WON drainage using plastic stents in a recent systematic review and meta- analysis comparing plastic stents to metal stents, inc luding lumen -apposing metal stents (LAMS) for the management of WONs [28] . Appendix I in Section 21 provides a few key points from this systematic review. Although reported effectiveness and saf ety event rates from different sources appear similar, 95% confidence intervals are fairly wide, mostly due to small sample sizes and heterogeneity in WONs and in detailed procedural WON drainage steps. Therefore we chose to increase the sample size of th e present study to be slightly larger than in the original IDE study #G130264, which was 30 patients."
35,page_35,"E7116 Form/Template 90702637 Rev/Ver AJ Confidential AXIOSTM WON Drainage IDE Study, 92153943, Rev/Ver I Page 35 of 60 We will conduct the present study in 40 patients. Effectiveness Endpoint Success Criteri a An o bserved rate of 67% or higher for t he proportion of AXIOS patients with reduction of WON size to ≤ 3cm within 60 days from AXIOSTM stent placement is required for success . This rate is the same as the point estimate of the random -effect meta -analysis of WON resolution rates provided in Table 7.1. Note that in the recent systematic review and meta-analysis [28] (Appendix I in Section 21) WON resolution rates were higher and number of procedures required to reach WON resolution were lower when using LAMS compared to plastic stents for WON drainage. Thus the proposed success criteria for effectiveness seems reasonable. Safety Endpoint Success Criteri a An observed rate of 17.5% or lower for the proportion of AXIOS patients with AXIOSTM stent related or WON drainage procedure related serious adverse events is requi red for success . This rate is similar to the point esti mate of the random -effect meta- analysis of AXIOS stent related or WON drainage related serious adverse events provided in Table 7.2. Note that in the recent systematic review and meta -analysis [28] (Appendix I in Section 21) the complication rates that showed statistically significant differences between plastic stents and LAMS for drainage of WONs were bleeding and stent occlusion, both in favor of LAMS. These findings are particularly important given that (a) bleeding is the most common ly reported serious adverse event, and (b) stent occlusion almost always requires reintervention. It should also be noted that of the plastic stent WON drainage references provided above, even the one reporting th e highest complication rates, namely Smoczynski et al [5] conclude that the benefits outweigh the risks: “ In a large group of selected patients with symptomatic walled -off necrosis, endoscopic drainage enables high success rate with acceptable complication rate and low procedure- related mortality .” Thus the proposed success criteri a for safety seems reasonable and acceptable. 7.4 General Statistical Methods Control of Systematic Error/Bias: All subjects who have met the inclusion/exclusion criteria and have signed the ICF will be eligible for enrollment in the study. Visual and/or electronic data review will be performed to identify possible data discrepancies. Manual and/or automatic queries will be created in the EDC system and will be issued to the site for appropriate response. Site staff will be responsible for resolving all queries in the database. Number of Subjects per Investigative Site: There will be no limit to the number of subjects enrolled at each investigative site. Data Analysis:"
