,PageNo,Text58,page_58,"Talazoparib C3441006 (MDV3800 -06) Protocol Amendment 4, 15 Nov 2018 PFIZER CONFIDENTIAL Page 59Table 8. Talazoparib Dose Modifications Due to Adverse Events Toxicity Managem ent of Adverse Events [ 1] Nonhematologic laboratory grade ≥3events, except abnormal liver tests[1]Hold talazoparib as follows: For clinically significant Grade 3laboratory abnormalities hold talazoparib until the laboratory abnormality resolves to Grade 2 (to baseline grade for creatinine increases ). Resume talazoparib at the same dose or reduce by 1 dose level per Figure 3. If Grade 3 laboratory ab norm ality recurs, hold talazoparib until the laboratory abnormality resolves to Grade  2 (to baseline grade for creatinine increases). Reduce talazoparib one dose level per Figure 3. For Grade 4laboratory abnormalities, hold talazoparib. Resume talazoparib when the laboratory abnormal ity resolves to Grade ≤2(to baseline grade for creatinine increases) at a 1 dose level reduction per Figure 3.Talazoparib must be discontinued if a Grade 4 adverse event recurs after treatment resumes. Implem ent supportive care per local guidelines. Contact sponsor to discuss potential dose modification. Talazoparib must be permanently discontin ued for unresolved Grade 3toxicity lasting longer than 14 day sor for Grade 4toxicity lasting longer than 3 days . Treatment may be resumed at a 1 dose level reduction if clear clinical benefit is observed, after discussion with the sponsor . Grade ≥3 abnormal liver testsSubjects who develop abnormal liver tests ( AST, ALT, total bilirubin [TBili]), signs or symptoms consistent with hepatitis during study treatment may meet the criteria for temporarily withholding or permanently discontinuing s tudy drug talazoparib. Criteria for Temporary Withholding of Study Drug in Association with Liver Test Abnorm alities if any of the follow ing occur: Subjects who develop AST or ALT >5 x ULN (without TBili >2 x ULN) ;OR Subjects with baseline total bilir ubin <1.5 x ULN who subsequently present with >3 x ULN ;OR Subjects with baseline total bilirubin >1.5 x ULN and <3 x ULN (eg, Gilberts) who subsequently present with bilirubin >5 x ULN . If abnormalities resolve to baseline values within 2 w eeks, there are no signs of drug induced liver injury (DILI), and none of the permanent discontinuation criteria are met, then upon discussion with the Sponsor, the investigator may re-challenge at a reduced dose level. Criteria for Permanent Discontinuation of Stu dy Drug in Association with Liver Test Abnormalities if any of the following occur: Refer to Section 8.4.2 for potential DILI cases ; Subjects with AST/ALT >5 × ULN that persists for more tha n 7days (AST/ALT >8 × ULN for subjects with hepatic involvement) ; Subjects with AST/ALT >20 × ULN that persists for longer than 3 days. Subjects with Tbili >3 × ULN that persists for longer than 7 days (>5 × ULN for subjects with Gilbert’s disease)."
59,page_59,"Talazoparib C3441006 (MDV3800 -06) Protocol Amendment 4, 15 Nov 2018 PFIZER CONFIDENTIAL Page 60Table 8. Talazoparib Dose Modifications Due to Adverse Events Toxicity Managem ent of Adverse Events [ 1] Nonlaboratory grade ≥3events[1]Hold talazoparib as follows: For clinically significant grade 3 adverse events, hold talazoparib until the adverse event resolves to grade ≤1or baseline. Resume talazoparib at the same dose or reduce by 1 dose level per Figure 3. For clinically significant grade 4 adverse events, hold talazoparib until the adverse event resolves to g rade ≤1or baseline. Resume talazoparib at a 1 dose level reduction per Figure 3. Implem ent supportive care per local guidelines. Contact sponsor to discuss potential dose modification. Talazoparib must be permanently discontinued for unresolved grade 3 toxicity lasting longer than 4 weeks or for grade 4 toxicity lasting l onger than 1 week. Treatment may be resumed at a 1 dose level reduction if clear clinical benefit is observed, after discussion with the sponsor . Talazoparib must be discontinued if a grade 4 adverse event recurs after treatment resumes. 1. Talazopari b dose re- escalation may be allowed after the reduced dose is tolerated without recurrence of toxicities, and after discussion w ith the s ponsor .AML, acute myeloid leukemia; ANC, absolute neutrophil count; MDS, myelodysplastic syndrome. The dose of tal azoparib may be reduced incr ementally as shown in Figure 3: Figure 3.Talazoparib Dose Reduction for Toxicity 0.75 mg/dayModerate renal impairment0.5 mg/day 0.25 mg/dayNormal/mild renal impairment1 mg/day 0.75 mg/day 0.5 mg/day 0.25 mg/day Dose re -escalation: Dose re -escalation may be allowed after toxicities resolv e, the reduced dose has been tolerated, and after discussion with the sponsor . 5.7. Treatment Compliance Accountability for the study drug capsules will be performed to document compliance with the dosing regimens. Patients will be asked to bring all used and unused study drug bottles to study visits for personnel to perform drug accountability prior to dispensing additional study drug. Study site personnel must make reasonable efforts to obtain used and unused study drug bottles from patients who do not rout inely return them at study site visits. Unreturned capsules will be considered to have been taken. 5.8.Investigational Product Storage The investigator or an approved representative, eg, pharmacist, will ensure that all talazoparib is stored in a secured area with controlled access under required storage conditions and in accordance with applicable regulatory requirements."
60,page_60,"Talazoparib C3441006 (MDV3800 -06) Protocol Amendment 4, 15 Nov 2018 PFIZER CONFIDENTIAL Page 61Investigational products should be stored in their original containers and in accordance with the label s. Any storage conditions stated in the talazoparib Investigator’s Brochure will be superseded by the storage conditions stated on the label. Site sy stems must be capable of measuring and documenting (for example, via a log), at a minimum, daily minimum and maximum temperatures for all site storage locations (as applicable, including frozen, refrigerated, and/or room- temperature products). This should be captured from the time of investigational product receipt throughout the study . Even for continuous- monitoring sy stems, a log or site pro cedure that ensures active evaluation for excursions should be available. The intent is to ensure that the minimum and maximum temperature is checked each business day to confirm that no excursion occurred since the last evaluation and to provide the site with the capability to store or view the minimum/maximum temperature for all non- working day s upon return to normal operations. The operation of the temperature monitoring device and storage unit (for example, refrigerator), as applicable, shoul d be regu larly inspected to ensure they are maintained in working order. Any excursions from the product label storage conditions should be reported to Pfizer upon discovery . The site should actively pursue options for returning the product to the storage conditio ns described in the labeling, as soon as possible. Deviations from the storage requirements, including any actions taken, must be documented and reported to Pfizer. Once an excursion is identified, the investigational product must be quarantined and not used until Pfizer provides permission to use the investigational product. It will not be considered a protocol deviation if Pfizer approves the use of the investigational product after the temperature excursion. Use of the investigational product prior t o Pfizer approval will be considered a protocol deviation. Specific details regarding information the site should report for each excursion will be provided to the site. Receipt of materials, door opening and closing, and other routine handling operations where the products are briefl y out of the temperature range described in the labeling are not considered excursions. Site staff will instruct patients on the proper storage requirements for take home investigational products. Refer to the Investigational Product Manual for additional guidance on storage conditions and actions to be taken when conditions are outside of the prespecified range. 5.9.Investigational Product Accountability The investigator site must maintain adequate records documenting the receip t, use, loss, or other disposition of the investigational product supplies. All investigational products will be accounted for using a drug accountabilit y form/record."
61,page_61,"Talazoparib C3441006 (MDV3800 -06) Protocol Amendment 4, 15 Nov 2018 PFIZER CONFIDENTIAL Page 62All bottles of study drug must be returned to the investigator by the patient at every visit and at the end -of-treatment visit. Patients who do not return bottles at the end -of-treatment visit will be reminded to bring them at their next visit. 5.9.1. Destruction of Investigational Product Supplies The sponsor or designee will provide guidance on the destruction of unused investigational product (eg, at the site). If destruction is authorized to take place at the investigator site, the investigator must ensure that the materials are destroy ed in compliance with applicable environmental regulation s, institutional policy , and any special instructions provided by Pfizer, and all destruction must be adequatel y documented. 5.10. Concomitant Treatment(s) Concomitant medications will be assessed at all clinic visits. All concomitant medications, including ove r-the-counter and prescription medications, must be recorded on the appropriate case report form. If the use of an y medication during the stud y is due to an adverse event, the adverse event must be recorded on the adverse event case report form and in the patient’s source documents. All prior cancer treatments, other medications taken within 28days before day 1, and any medications prescribed for chronic or intermittent use during the study or dose adjustments of these medications must be recorded on the case report form and in the patient’s source documents. Required and prohibited medications are described in Table 9. Supportive medications may be provided proph ylactically or therapeutically per investigator di scretion. Concomitant use of steroids as hormonal treatment for prostate cancer is not allowed. Intranasal, inhaled, or topical corticosteroids are allowed. Palliative l ow dose treatment with corticosteroids (10 mg or less of prednisone or equivalent/day) to reduce pain and inflammation although allowed, if no alternative therap y is available , isdiscouraged ; investigators are to document in the case report form ( CRF )the reason why steroids were given. Higher doses of steroids should be avoided unless no other therapies are available. Deviation from these guidelines should occur onl y if absolutel y necessary for the well -being of the patien t, and the sponsor is to be notified to determine whether continued treatment with study drug is permitted. Study drug must be permanently discontinued upon initiation of a prohibited antineoplastic or investigational therap y. Patients who discontinue treatment due to initiation of such therap y will complete safety follow -up per Sectio n 6.5and will have long -term follow -up per Section 6.6. Patients will use analgesic logs (Appendix 5) to document their use of any and all analgesics for prostate cance r pain beginning 7 days before a scheduled visit (or scheduled contact during the post-treatment follow -up periods). Analgesics include but are not limited to opioids, and nonopioid analgesics, which include acetaminophen, aspirin, nonsteroidal anti-inflammatory drugs ( NSAIDs ), such as ibuprofen andketorolac, and selective cyclooxy genase ty pe 2 (COX -2) inhibitors, such as celecoxib androfecoxib."
62,page_62,"Talazoparib C3441006 (MDV3800 -06) Protocol Amendment 4, 15 Nov 2018 PFIZER CONFIDENTIAL Page 63Table 9.Instructions for Use of Concomitant Therapies Use Category Medication or Treatm ent Comment on Use Required Ongoing androgen deprivation therapy with a GnRH agonist/antagonist or bilateral orchiectomy (medical or surgical castration) .For the duratio n of the study . Prohibited Prior PARP inhibitor, cyclophosphamide, or mitoxantrone ever in the past; also, prior platinum within the 6 months prior to screening or if there was ever prior disease progression on platinum .Prior to screening and through saf ety follow -up. Any s ystemic ( eg, chemotherapeutic, horm onal, biologic, radionuclide) antine oplastic therapy, a nd other investigational agents.Within 4 weeks before day 1through safety follow -up. Radiation therapy . Within 3 weeks (within 2 weeks, if s ingle fraction) before day 1. P-gp inhibitors (refer to Section 5.11).For the duration of the study . Used w ith cautionTransporter inhibitors (refer to Section 5.11).For the duration of the study . GnRH, gonadotropin -releasing hormone; PARP, poly(ADP -ribose) polymerase. 5.11. Potential Interactions Between the Test Product and Concomitant Medication Strong P- gp inhibitors that result in ≥2- fold increase in the exposure of an in vivo probe P -gp substrate according to the University of Washington Drug -Drug Interaction database ( https://www.druginteractioninfo.org/) areprohibited: amiodarone, carvedilol, clarithromycin, cobicistat, darunavi r, dronedarone, erythromy cin, indinavir, itraconazole, ketoconazole, lapatinib, lopinavir, propafenone, quinidine, ranolazine, ritonavir, saquinavir, telaprevir, tipranavir, verapamil and valspodar . Caution and monitoring for potential increased adverse re actions should be used upon concomitant use of the following transporter inhibitors with talazoparib: atorvastatin, azithromy cin, conivaptan, curcumin, cy closporine, diltiazem, diosmin, eliglustat, elacridar [GF120918], eltrombopag, felodipine, flibanserin, fluvoxamine, piperine, quercetin a nd schisandra chinensis extract. The list of strong P -gp inhibitors and transporter inhibitors to be used with caution will be updated annuall y and reflected in the Investigator’s Brochure . 5.12. Rescue/Salvage Medication New treatments for prostate cancer prior to the determination of radiographic progression by the independent blinded reviewers are strongl y discouraged."
63,page_63,"Talazoparib C3441006 (MDV3800-06) Protocol Amendment 4, 15 Nov 2018 PFIZER CONFIDENTIAL Page 646. STUDY PROCEDURES Study enrollment and procedures are summarized in the following subsections. The study periods will include prescreening (optional), screening, treatment, safety follow-up, and long-term follow-up. The timing of all study procedures is provided in the schedules of activities ( Table 1 , Table 2 , Table 3 , Table 4 ). The interactive response system user manual contains the information needed for registering patient status (eg, assigning screening numbers, indicating screen failure, and end of treatment). 6.1. Prescreening (optional) Certain procedures or activities may be performed during a prescreening period defined as any time before a prospective study participant signs an informed consent form to be formally screened for study enrollment. These include a biopsy procedure to obtain de novotumor tissue or the retrieval of archived tumor tissue for evaluation of a DNA damage repair deficiency as assessed using the FoundationOne CDx™ (Foundation Medicine) gene mutation panel. A separate prescreening consent form must be signed if de novo or archival tissue and blood sample will be obtained and analyzed before the patient signs consent for the protocol screening period. In addition, after the prescreening consent is signed, previously obtained (ie, historic) testing results from analysis of tumor tissue using the FoundationOne CDx™test may be submitted. Test results obtained using the FoundationOne CDx™ test identifying DNA repair deficiencies likely to sensitize to PARP inhibition may be considered for eligibility with sponsor approval. If sufficient residual DNA is available at Foundation Medicine, this could be used to confirm a patient’s eligibility for enrollment. Note that if eligibility for enrollment is established based either on historical results or residual DNA testing, available archival or de novo tumor tissue also should be submitted prior to Day 1. Study site personnel must document the informed consent process for tissue and blood sampling in the patient’s clinical record. After obtaining signed informed consent, study site personnel will access the interactive response system to assign a screening identification (ID) number for each potential study participant. In addition, the demographic data case report form (CRF), the Prior Anti-Cancer Therapies CRF and the Medical History- Prostate Cancer CRF should be completed at pre-screening if pre-screening is performed. For subjects for whom new tissue or blood sampling needs to be obtained and as applicable, AEs and/or research related injuries are to be reported as per Section 8.4.5 . Prescreening procedures are listed in the schedule of activities in Table 1 . 6.2. Screening Period The screening period will be from day -28 through day-1 for most procedures ( Table 2 ). For the purposes of this study, there will be no day 0. CCI"
64,page_64,"Talazoparib C3441006 (MDV3800-06) Protocol Amendment 4, 15 Nov 2018 PFIZER CONFIDENTIAL Page 656.2.1. Informed Consent Study site personnel must explain to potential study participants all aspects of the study, including all scheduled visits and activities. Study site personnel must obtain signed and dated informed consent before any study-specific procedures are conducted unless the procedures are part of routine standard of care, and must document the informed consent process in the patient’s source documents. 6.2.2. Screening Identification Numbers After obtaining signed informed consent, study site personnel will access the interactive response system to assign a screening ID number (if not obtained previously during prescreening) for each potential study participant. For patients who provide informed consent and subsequently do not meet eligibility criteria or withdraw consent, study site personnel will document the screen failure or consent withdrawal in the patient’s source documents. The documentation will include demographics(which may have been assessed at pre-screening), and medical history for prostate cancer, prior treatment(s) for prostate cancer, the reason for screen failure, the eligibility criteria reviewed, and procedures performed and, as applicable, any AE/SAE that occurs during the active collection period (refer to Section 8.1.4 ) until the patient is determined to be a screen failure. 6.2.3. Screening Procedures Screening procedures are listed in the schedule of activities in Table 2 . All procedures must be completed within 28 days before day 1 except as noted. Scans obtained within 42 days before day 1 as part of standard of care may be used for the screening radiographic assessment. De novo or archival tumor tissue for analysis of DNA damage repair deficiencies is required for enrollment (if not collected at prescreening) as assessed using the FoundationOne CDx™(Foundation Medicine) gene mutation panel. In addition, previously obtained (ie, historic) testing results from analysis of tumor tissue using the FoundationOne CDx™ test may be submitted with sponsor approval. Should a patient qualify based either on prior results or DNA available at Foundation Medicine, available de novo or archival tumor tissue should be submitted prior to Day 1 to support planned concordance analysis The investigator will assess the eligibility of each patient. All screening procedure results and relevant medical history must be available before eligibility can be determined. All inclusion criteria must be met and none of the exclusion criteria may apply. CCI"
65,page_65,"Talazoparib C3441006 (MDV3800-06) Protocol Amendment 4, 15 Nov 2018 PFIZER CONFIDENTIAL Page 66After a patient is screened and the investigator determines the patient is eligible, study site personnel will complete an Enrollment Authorization Form and fax or email it to the sponsor or designee to approve the enrollment in writing. Eligibility will be determined as per the amendment approved at the site at the time the Enrollment Authorization Form is reviewed. No eligibility waivers will be granted . 6.3. Treatment Period 6.3.1. Treatment Period Visit Windows All treatment period visits have a visit window of ±3 days (ie, 3 days before or after the given day), except the day 1 visit (start of study treatment). The window for imaging assessments is ±7 days. Study drug supplies must be taken into account when scheduling visits. Procedures for a given visit may be split across the window to allow for drug resupply and completion of study procedures. 6.3.2. Treatment Period Procedures Specified study procedures will be performed at each clinic visit according to the schedule of activities ( Table 3 ). •All patients will have clinic visits every 2 weeks for the first 8 weeks (through week 9), then every 4 weeks through week 25, and every 12 weeks thereafter. •Day 1 is the day of the first dose of study drug treatment (talazoparib). Questionnaires should be completed •Safety assessment labs will be done by the central laboratory per schedule of assessment. In addition, every effort should be taken to send unscheduled samples to the central laboratory to monitor resolution of AE/SAE. Pretreatment serum chemistry and hematology laboratory tests may be performed at the local laboratory within 3 days before the scheduled times (every 2 weeks through week 9, then every 4 weeks through week 25, and every 8 weeks thereafter). The investigator must review the laboratory results before dosing. Regardless of whether local laboratory testing is obtained for serum chemistry and hematology values, blood samples must be sent to the central laboratory for evaluation. Results from local laboratory assessments will be entered in the appropriate CRF.CCI CCI"
66,page_66,"Talazoparib C3441006 (MDV3800 -06) Protocol Amendment 4, 15 Nov 2018 PFIZER CONFIDENTIAL Page 67Radiographic assessments will be obtained and submitted for independent central revie w (Section 7.1.2 ). Patients will document their pain s ymptoms and their use of an y and all analgesics for prostate cancer pain b y completing both the pain log and an analgesic l og during each of the 7 consecutive day s preceding a scheduled visit after Day 1. Any diagnosis of m yelodysplastic s yndrome (MDS) or AML will be reported as an SAE ( Section 8.2.3 ). If requested, provide tissue samples and other supporting data used to enable diagnosis for review b y blinded independent reviewers. Study visits and study drug treatment will continue until criteria for permanent study discontinuation are met ( Section 6.4). PSA progression or CTC count increases alone should not lead to study drug discontinuation. 6.3.3. Unscheduled Visit Procedures Unscheduled visits/assessments may be perform ed any time to assess or follow up adverse events, to perform scans, or at the request of the patient or investigator or sponsor , or to account for an y insufficient, inadequate, or mis sed sample or assessments . The date and reason for the unscheduled visit must be recorded in the source documentation. A review of adverse events and changes to concomitant medications or treatments (including herbal therapies) occurring since the previous visit should be performed at unscheduled visits. If an unscheduled vi sit is necessary to assess toxicity or for suspected disease progression, diagnostic tests may be performed based on investigator assessment as appropriate. Imaging may be performed if appropriate for patients who are sy mptomatic or for whom radiographic progression or response is being determined. All radiographic assessments obtained (including unscheduled ones) will need to be submitted for independent central review .Unscheduled visits andvisit procedures are listed in Table 3. Other study procedures may be performed as clinicall y appropriate. 6.4.Permanent Treatment Discontinuation Treatmen t discontinuation is defined as permanent cessation of study drug treatment administration. After permanent discontinuati on, safet y follow- up will occur per Section 6.5, unless the patient withdraws consent for further follow-up. Temporary treatment interruption (eg, due to an adverse event) is n ot considered permanent discontinuation. The primary reason s for which patients permanently discontinue study treatment are listed in Table 10."
