,PageNo,Text46,page_46,"Version 10.0 Protocol Number: GBR 830-204 Date: 05-May-2020 Ichnos Sciences CONFIDENTIAL Page 46 of 103 screened to randomize 156 eligible subjects in a 1:1 ratio to either ISB 830 or Placebo, therefore approximately 468 subjects are planned to be randomized in this study. T he randomization will be stratified by disease severity (moderate or severe, as assessed by IGA) , geographic region (North America vs European Union), and subjects consenting to rich PK sampling (Yes/No). The actual number of subjects randomized in Groups 5 and 6 may be different than initially planned due to the impact of the SARS-CoV-2/COVID -19 pandemic (see Section 8.3.4). 7.2. Treatment Assignment Study participation begins (ie, the subject is enrolled in the study) once written informed consent is obtained (see Section 18.3 for details). Once informed consent is obtained at Screening , the subject will be assigned a subject screening number using the interactive voice response system /interactive web response sys tem (IVRS/IWRS), and the screening evaluations may begin to assess study eligibility (inclusion/exclusion) criteria. The subject screening number will be used to identify the subject during the screening process. A subject who fails screening (ie, do es not meet eligibility criteria) will be given a new screening number if he/she is re- screened for the study . The subject’s original screening number will not be re-assigned to another subject. Subjects who meet all eligibility criteria will be randomized on Day 1 using the IVRS/IWRS system and allocated a randomization number prior to receiving the first dose of study drug. Randomized s ubjects will be stratified by the IVRS/IWRS based on disease severity, geographic region , and subjects consenting to rich PK sampling (Yes/No) to ensure balance of treatment groups within each stratum. For the open -label treatment phase, the first dose will be administered 2 weeks after the last dose in the blinded treatment phase to maintain the dosing regimen. Subjects in Groups 1-4 will receive and subjects in Groups 5- 6 will receive SC doses of ISB 830 q2w until study completion, discontinuation or withdrawal. Randomized subjects who terminate their study participation for any reason, regardless of whether study drug has been taken or not, will retain their randomization number. To allow subjects access to the open -label treatment phase of the study, subjects who have completed the GBR 830-204 study prior to implementation of the open-label protocol amendment or who are in the follow- up phase of the study at the time of implementation of the open- label protocol amendment, may be eligible to participate in the open -label treatment phase of this study. These subjects will be assigned a new screening number. Subjects who have completed the study prior to implementation of the open- label protocol amendment must undergo a modified Screening visit (as per Table 2 ), and if eligibility criteria are met (with the exception of inclusion criteria 5, 6, 7, 8, 9, 10 and exclusion criteri a 1 and 5), will undergo study assessments as per Table 3. This includes a complete washout of any concomitant medications and therapies received (as per Table 5 ) prior to starting the open- label treatment phase of the study. Subjects who are in the follow-up period of GBR 830- 204 at the time the open -label protocol amendment is implemented, must complete their follow -up period and then must unde rgo a modified Screening visit (as per Table 2), and if eligibility criteria are met (with the exception of"
47,page_47,"Version 10.0 Protocol Number: GBR 830-204 Date: 05-May-2020 Ichnos Sciences CONFIDENTIAL Page 47 of 103 inclusion criteria 5, 6, 7, 8, 9, 10 and exclusion criteria 1and 5), will undergo study assessments as per Table 3. This includes a complete washout of any concomitant medications and therapies received (as per Table 5) prior to starting the open- label treatment phase of the study. 7.3. Dose Adjustment Criteria No dose modifications for a subject are allowed in the blinded treatment phase. See Section 8.3.1 for criteria regarding temporary discontinuation of study drug. 7.4. Criteria for Study Termination The Sponsor reserves the right to discontinue the study for medical reasons or any other reason at any time. If the study is prematurely terminated or suspended, the Sponsor will promptly inform the Investigators/Institutions and regulatory authorities of the termination or suspension and the reason(s) for the termination or suspension. The Institutional Review Board (IRB)/independent Ethics Committee (IEC) will also be informed promptly and provided the reason(s) for the termination or suspension by the Sponsor or by the Investigator/Institution, as specified by the applicable regulatory requirement(s). The Investigator reserves the right to discontinue his/her participation in the study should his/her judgment so dictate. If the Investigator terminates or suspends his/her participation in the study without prior agreement of the Sponsor, the Investigator should inform the Institution where applicable, and the Investigator/Institution should promptly inform the Sponsor and the IRB/IEC and provide the Sponsor and the IRB/IEC with a detailed written explanation of the termination or suspension. Study records must be retained as noted above. 7.5. End of the Study The end of the study (study completion) is defined as the date of the last protocol- specified visit/assessment (including telephone contact) for the last subject in the study. Materials or supplies provided by the Sponsor may be returned to the Sponsor or designee upon study completion, as directed by the site monitor. The Investigator will notify the IRB/IEC when the study has been completed. 8. SELECTION AND WITHDR AWAL OF SUBJECTS 8.1. Subject Inclusion Criteria 1. Provide written informed consent and any locally required authorization prior to any protocol-related procedures, including screening evaluations. 2. Willing and able to comply with all aspects of the protocol. 3. Male or female ≥18 years at the time of screening. 4. Physician diagnosis of AD for > 1 year; diagnosis of AD as defined by the American Academy of Dermatology Consensus Criteria ( Eichenfeld et al, 2014). 5. AD involvement of ≥10% body surface area (BSA) at screening and baseline."
48,page_48,"Version 10.0 Protocol Number: GBR 830-204 Date: 05-May-2020 Ichnos Sciences CONFIDENTIAL Page 48 of 103 6. EASI score of ≥12 at screening or ≥16 at baseline. 7. IGA score of ≥3 at screening and baseline (on the 0 to 4 IGA scale, in which 3 is moderate and 4 is severe). 8. Baseline Pru ritus Numerical Rating Scale (NRS) score for maximum itch intensity ≥3 over the previous 24 hours. A minimum of 3 days of diary completion is required in the week prior to randomization. 9. Documented/reported recent history (within 6 months before the screening visit) of inadequate response to treatment with topical medications (topical corticosteroids or crisaborole or topical calcineurin inhibitors) or subjects for whom topical treatments are otherwise medically inadvisable (eg, because of important side effects or safety risks as defined in the protocol). Documents may include medical records, physician to healthcare provider communication (with date and time of communication and physician signature) or pharmacy records (with clearly listed dates of dispensation). A course of marketed systemic immunosuppressants (eg, prednisone, cyclosporine, methotrexate) for AD in the 6 months prior to screening assumes failure of topicals and is accept able in place of topical failure. 10. Have applied a stable dose of topical emollient (moisturizer) twice daily for at least the 7 consecutive days immediately before the baseline visit (with the exception of prohibited moisturizers containing additives liste d in Exclusion Criteria #5). 11. Must agree to the following requirements during the study: a. If female and of childbearing potential, she must have a negative serum pregnancy test result within 7 days prior to first dosing and a negative urine pregnancy test predose on Day 1 . She must be willing to use a highly effective form of contraception ( ICH E8 Guideline, 1997; ICH M3[R2] Guidance, 2009; FDA M3[R2] Guidance, 2010 ) for the duration of the study and for at least 3 months after the last dose of study medication. Methods like periodic abstinence, post ovulation procedures and withdrawal are not considered adequate. Each woman will be considered to have childbearing potential unless she has been surgically sterilized by hysterectomy or bilateral tubal ligation/salpingectomy or has been post-menopausal for at least 2 years. For postmenopausal women only, follicle stimulating hormone (FSH) testing will be performed at screening to confirm non -childbearing potential (FSH ≥40 IU/L). b. If male with a partner of childbearing potential, he must be willing to use condoms in combination with a second effective method of contraception during the study. Each man will be considered as potent unless surgically sterilized (with appropriate post vasectomy documentation of the absence of sperm in the ejaculate). Male subjects must continue to use contraception for 180 days following administration of the study drug. c. Male subjects should agree not to donate sperm during the study and for 180 days following administration of the study drug. 8.2. Subject Exclusion Criteria 1. Prior treatment with ISB 830."
49,page_49,"Version 10.0 Protocol Number: GBR 830-204 Date: 05-May-2020 Ichnos Sciences CONFIDENTIAL Page 49 of 103 2. Employee of the clinical study site or any other individuals involved with the conduct of the study, or immediate family members of such individuals. 3. Concurrent enrollment in another investigational clinical study. 4. Treatment with any of the following before baseline: a. Investigational biological agent within 8 weeks of baseline or 5 half- lives, whichever is longer. b. Investigational drugs, eg, phosphodiesterase type 4 (PDE4) inhibitors, Janus kinase (JAK) inhibitors, within 4 weeks of baseline. c. Phototherapy for AD within 4 weeks of baseline. d. Marketed drugs, including systemic corticosteroids, immunosuppressive/immunomodulatory drugs including but not limited to cyclosporine, mycophenolate mofetil, interferon -gamma (IFN -γ), PDE4 inhibitors, JAK inhibitors, azathio prine or methotrexate, within 4 weeks of baseline. e. Topical medications, including corticosteroids, tacrolimus, and/or pimecrolimus and crisaborole within 1 week of baseline. f. Regular use (>2 visits/week) of a tanning booth/parlor within 4 weeks of basel ine. g. Biologics, depending on the type of biologic such as cell-depleting agents including but not limited to rituximab: within 6 months of baseline, or until lymphocyte and CD19+ lymphocyte count returns to normal, whichever is longer. h. Biologics including infliximab, adalimumab, golimumab, certolizumab pegol, abatacept, etanercept, anakinra, dupilumab: within 12 weeks of baseline, or 5 half-lives, whichever is longer. i. Other biologics: within 5 half-lives (if known). 5. Initiation of treatment of AD with prescription moisturizers or moisturizers containing additives such as ceramide, hyaluronic acid, urea, or filaggrin degradation products during the screening period (subjects may continue using stable doses of such moisturizers if initiated before the screening visit). 6. Planned or anticipated use of any prohibited medications and procedures during study treatment as defined in the study protocol. 7. Subjects who are immunocompromised (congenital or acquired), or who have ha d a recent (within 3 months prior to baseline) or current serious systemic infection (including infectious mononucleosis-like illness or herpes zoster). 8. Treatment with a live (attenuated) vaccine within 12 weeks before the baseline visit. 9. Subjects who have evidence of active or latent tuberculosis (TB) as documented in their medical history, or test positive at screening . For indeterminate cases an informed decision will be made between the P rincipal Investigator and Medical Monitor. 10. Active chronic or a cute infection requiring treatment with systemic antibiotics, antivirals, antiparasitics, antiprotozoals, or antifungals within 2 weeks before the baseline visit, or superficial skin infections within 1 week before the baseline visit. N OTE: subjects may be rescreened after infection resolves. 11. Presence of skin comorbidities that may interfere with study assessments, in the opinion of the Investigator, including subjects with psoriasis."
50,page_50,"Version 10.0 Protocol Number: GBR 830-204 Date: 05-May-2020 Ichnos Sciences CONFIDENTIAL Page 50 of 103 12. Poorly controlled asthma as assessed by the Asthma Control Questionnair e [ACQ -5] based on International ERS/ATS guidelines. 13. Any condition at baseline which is part of the criteria for discontinuation of study drug as defined in the study protocol. 14. Subjects who are known to be seropositive for human immunodeficiency virus (H IV) or who test positive at screening. 15. History of a positive result for Hepatitis B surface antigen (HBsAg), antibody to Hepatitis B core antigen (anti -HBcAg), or antibody to Hepatitis C virus (anti- HCV) or presence of these findings at screening . 16. History of alcohol or drug abuse within 2 years of the screening visit. 17. Subjects with a history of non-malignant lymphoproliferative disorders, or a history of malignancy within 5 years before baseline (except completely treated in situ cervical carcinoma or non- metastatic squamous or basal cell carcinoma of the skin). 18. In the opinion of the Investigator, subjects with any other medical or psychological condition as well as laboratory values, which are significantly different from normal reference ranges and/ or judged to be clinically significant; and/or any condition that would interfere with evaluation of the study drug or interpretation of subject safety or study results , including conditions that are inadequately understood at the time of screening . 19. Subjects with a history of substance abuse or dependence that in the opinion of the Investigator, is considered to interfere with the subject’s participation in the study. 20. Planned or anticipated major surgical procedure during the subject’s participation in this study. 21. Women who are pregnant or breast feeding. 22. Known hypersensitivity to monoclonal antibodies or any of the excipients of the study drug. 8.3. Subject Withdrawal Criteria A subject may voluntarily discontinue study participation at any time after giv ing informed consent and before the completion of the last visit of the study. Subjects may also be withdrawn from study drug treatment at the discretion of the Investigator or Sponsor for safety, noncompliance, or administrative reasons. The reasons for subject withdrawal will be recorded and may include, but are not limited to: 1. Withdrawal of consent by the subject to continue in the study. If consent is withdrawn, the subject will not receive any further investigational product (IP) or further study observation. Note that the subject may need to undergo additional tests or tapering of treatment to withdraw safely. 2. Development of a serious or intolerable adverse event ( AE) that necessitates discontinuation at the discretion of the Investigator includi ng but not limited to:"
51,page_51,"Version 10.0 Protocol Number: GBR 830-204 Date: 05-May-2020 Ichnos Sciences CONFIDENTIAL Page 51 of 103 • Anaphylactic reaction or other severe systemic reaction to study drug injection (see Section 13.2.1.4). • Diagnosis of a malign ancy (new or relapse) during study, excluding carcinoma in situ of the cervix, or squamous or basal cell carcinoma of the skin. • Any infection that is opportunistic, such as active TB and other infections whose nature or course may suggest an immuno-compro mised status. • An infection that requires parenteral treatment with antibiotic, antifungal, antiviral, anti-parasitic, or anti -protozoal agents or requires oral treatment with such agents for longer than 2 weeks. 3. Severe laboratory abnormalities: • Serum creatinine > 1.5 mg/dL (equivalent to Système International (SI) unit of >114.39 μmol/L). • Alanine aminotransferase (ALT) and/or aspartate aminotransferase (AST) values >3x upper limit of normal (ULN) with total bilirubin >2x ULN (unless elevated bilirubin is related to confirmed Gilbert’s Syndrome). • Absolute neutrophil count ≤ 500/μL (equivalent to SI unit of ≤ 0.5x10 9/L) or absolute lymphocyte count ≤ 600/μL (equivalent to SI unit of ≤0.6x109/L) or platelet count ≤50,000/μL (equivalent to SI unit of ≤ 50x109/L) or any abnormal evaluations which in the opinion of the Investigator are clinically significant. Confirmed AST and/or ALT >5x ULN (for more than 2 weeks). 4. At the discretion of the Investigator, when he/she believes continued participation is not in the best interest of the subject. 5. At the discretion of the Investigator, when the subject does not adhere to the study procedures. 6. A positive pregnancy test. 7. A female partner of a male study subject becomes pregnant. 8. A protocol deviation that, in the opinion of the Sponsor and Investigator, warrants discontinuation from the study. A subject who is withdrawn from blinded or open- label study drug treatment will be asked to complete all procedures scheduled for the EOT visits at time of withdrawal (Week 16, or W eek 54, respectively). The subject should continue to the follow-up period for a phone call 4 weeks and 8 weeks after the EOT visit and a final follow up visit 12 weeks after the EOT visit, unless the subject withdraws consent or is lost to follow-up. 8.3.1. Temporary Discontinuation of Study Drug 1. Rescue treatment for AD (drug or phototherapy or both) given based on the opinion of the Investigator; subjects who require rescue therapy will be considered as treatment failures. Subjects who receive topical medication as rescue treatment will continue study drug treatment. Subjects who receive rescue treatment with systemic corticosteroids or"
52,page_52,"Version 10.0 Protocol Number: GBR 830-204 Date: 05-May-2020 Ichnos Sciences CONFIDENTIAL Page 52 of 103 non-steroidal systemic immunosuppressive drugs (cyclosporine, methotrexate, mycophenolate mofetil, azathioprine, etc.) or biologics ( eg, dupilumab) will be immediately discontinued from study drug treatment but will continue with all other study assessments as per Table 2 . Administration of ISB 830 may be resumed after the appropriate washout period, ( as per Table 5) following discussion, and upon obtaining written approval from the Sponsor’s medical monitor. 2. Subjects must be temporarily discontinued from study drug dosing in the event of: • Grade 3 neutrophil count (<1000- 500/μL, per the National Institutes of Health/National Cancer Institute (NIH/NCI) -Common Terminology Criteria for Adverse Events (CTCAE) v4.03 ( CTCAE v4.03, 2010). • Grade 2 platelet count ( <7.5 – 5.0 X 104/μL, per NIH/NCI -CTCAE). • Fever (>100.4°F or >38°C), suspected infection, or infection requiring oral antibiotics. If temporarily discontinued from study drug dosing, a subject may resume dosing when the abnormal values are within normal reference ranges. The decision to discontinue dosing a subject due to an AE will be made on the basis of clinical severity and relatedness to the study drug. It is recommended that the Investigator consult with the Sponsor’s medical monitor before removing the subject from the study. 8.3.2. Lost to F ollow- up A subject will be considered lost- to-follow-up only if no contact has been established by the time the study is completed such that there is insufficient information to determine the subject’s status . Subjects refusing to return to the site or to continue participation in the study when contacted , should be documented as “withdrawal of consent” rather than “lost to follow-up.” Investigators should document attempts to re- establish contact with missing subjects throughout the study period. If contact with a missing subject is re -established, the subject should not be considered lost- to-follow-up and any evaluations should resume according to the protocol (ie, the subject should continue to the next scheduled visit relative to their Day 1 visit). 8.3.3. Permanent Discontinuation of Study Drug A subject w ho is permanently discontinued from further receipt of study drug, regardless of the reason (withdrawal of consent, due to an AE, other reason ), will be identified as having permanently discontinued treatment. A subject who is permanently discontinued from receiving study drug during the blinded or open- label treatment phases will be asked to complete all procedures scheduled for the EOT visits (Week 16, or Week 54, respectively ). A subject who is withdrawn from study drug treatment should continue to the follow-up period, unless the subject withdraws consent, is lost to follow-up, or is enrolled in another clinical study. 8.3.4. Enrollment of Additional Subjects Special considerations have been added to the protocol based on the issues arising from the SARS -CoV- 2/COVID -19 pandemic. During the blinded dosing period for Part 2 (ie, prior to"
53,page_53,"Version 10.0 Protocol Number: GBR 830-204 Date: 05-May-2020 Ichnos Sciences CONFIDENTIAL Page 53 of 103 completion of the Week 16 visit), any randomized subject who terminates study participation or who misses 2 or more consecutive doses of study drug (even if continuing with study participation) or miss es any part of the primary endpoint assessm ents at Week 16 , as a result of pandemic- related reasons , may not be counted against the total number of subjects targeted (N=156 for Part 2 of the study ). For each of these cases, a new subject may be screened and randomized, to allow an evaluable number of subjects for the Week 16 primary endpoint. T he new subjects in screening will receive new subject numbers and new treatment assignment s as per the current randomization schedule in the protocol. Additional subjects will only be added in response to the number of subjects who meet the above criteria, as a result of pandemic- related issues . Randomized subjects who discontinue study participatio n or miss consecutive doses or the Week 16 primary endpoint assessments for non- pandemic related reasons, or who have study drug or study visit issues after completing their Week 16 visit, will not trigger the screening of additional subjects . 9. TREATMENT OF SUBJECTS 9.1. Description of Study Drug The following study drugs will be supplied by Ichnos Sciences SA for the study: Table 4: Study Drugs"
54,page_54,Version 10.0 Protocol Number: GBR 830-204 Date: 05-May-2020 Ichnos Sciences CONFIDENTIAL Page 54 of 103 9.2. Concomitant Medications and Therapy 9.2.1. Prior Medications The following medications and therapies listed in Table 5 are excluded for the designated length of time prior to Baseline (Day 1 ) and prior to Week 16 (Day 113) for those subjects who completed the study and re-enter only the open- label treatment phase of the study .
