,PageNo,Text66,page_66,"Protocol ALXN 1210- aHUS -312 Alexion Pharmaceuticals , Inc. Amendment 6 (Global) 16 Jul 2019 Page 66 of 96 CONFIDENTIAL 11.3. Vital Sig ns Vital sign measurements will be taken after the patient has been resting for at least 5 minutes, and will include systolic and diastolic BP (millimeters of mercury [mmHg]), pulse oximetry, heart rate (beats/minute), respiratory rate (breaths/minute), an d temperature (degrees Celsius [°C] or degrees Fahrenheit [°F]). 11.4. Laboratory Assessments Samples for serum pregnancy, hematology, chemistry, coagulation, and urinalysis will be performed at the times specified in the Schedule of Assessments ( Section 7.3). Specific laboratory assessments are provided in Appendix E . Samples for laboratory assessments will be collected before each study drug administration. An alternative blood sampling schedule for infants, for whom less blood volume should be collected, must be used as detailed in the Study Operations Manual. For Cohort 1, samples collect ed at Screening may be tested at either a local or central laboratory. If a local laboratory is used to define eligibility, additional samples will be collected during the Screening Period for LDH, platelet count, hemoglobin and serum creatinine and tested at the central laboratory. All analyses in this study will be based on results from the central laboratory (unless the result is missing [see Section 15.12.1]) . If Cohort 1 patients are found not to satisfy the eligibility criteria for serum creatinine (Inclusion Criterion 2c) based on central laboratory results, they must not be enrolled into the study; if the subject has received the first dose of ALXN1210 , the patient must be withdrawn from the study, and may be replaced. For Cohort 1 patients, laboratory results for Exclusion Criterion number 1 and/or Exclusion Criterion number 2 may not be ava ilable prior to first dose. Later results for Exclusion Criterion number 1 and/or Exclusion Criterion number 2 could lead to discontinuation and replacement of the patient (please refer to Section 8.3 for potential discontinuation and replacement details). For Cohort 2, samples collected at Screening must be tested at a central laboratory; however, historical test results via chart review should be utilized for Inclusion Criterion 3 and Exclusion Criteria 1, 2, 3, and 24. Please refer to the Laboratory Manual for time windows for collection and detailed instructions for collecting, processing, storing, and shipping blood samples for safety assessments. Laboratory reports will be made available to the Investigators in a timely manner for clinical management of patients. It is anticipated that some laboratory values may be outside the normal value range due to the underlying disease. The Investigator s should use their medical judgment when assessing the clinical significance of these values. Clinical significance is defined as any variation in laboratory measurements that has medical relevance and which results in a change in medical care. If clinically significant laboratory changes from baseline value are noted, the changes will be documented as AEs on the AE eCRF. The Investigator will also assess the relationship to study treatment for all clinically significant out- of-range values ( Section 15.9.3). The Investigator will continue to monitor the patient through additional laboratory assessments until (1) values have returned to the normal range or baseline level, or (2) in the judgment of the Investigator, values that are outside the normal range are not related to the administration of study drug or other protocol- specific procedures."
67,page_67,"Protocol ALXN 1210- aHUS -312 Alexion Pharmaceuticals , Inc. Amendment 6 (Global) 16 Jul 2019 Page 67 of 96 CONFIDENTIAL 11.4.1. Pregnancy Screen For females of childbearing potential, a serum or urine pregnancy test (ie, beta-human chorionic gonadotropin [β -hCG]) will be performed according to the Schedule of Assessments (Section 7.3). 11.4.2. Hematology Blood samples will be analyzed for the hematology parameters listed in Appendix E . 11.4.3. Serum Chemistry Blood samples will be analyzed for the serum chemistry parameters listed in Appendix E . Indirect bilirubin is calculated from total and direct bilirubin values; therefore, indirect bilirubin results will not be available if direct bilirubin is below the limit of quantification. Chemistry assessments will be performed at the time points specified in the Schedule of Assessments ( Section 7.3). The eGFR will be calculated for all visits at which serum chemistries are collected using the Schwartz formula. 11.4.4. Coagulation Blood samples will be analyzed for the coagulation parameters listed in Appendix E . 11.4.5. Urinalysis and Urine Chemistry Urine samples will be analyzed for the parameters listed in Appendix E . A microscopic examination of urine samples will be performed if the results of the macroscopic analysis are abnormal. Urine samples will also be analyzed to measure proteins and creatinine in order to calculate the urine t otal protein:creatinine ratio. 11.5. Electrocardiograms For each patient, single 12- lead digital ECGs will be collected according to the Schedule of Assessments ( Section 7.3). Patients must be supine for approximately 5 to 10 minutes before ECG collection and remain supine but awake during ECG collection. The Investigator or designee will be responsible for reviewing the ECG to assess whether the ECG is within normal limits and to determine the clinical significance of the results. These assessments will be indicated on the CRF. For any clinically significant abnormal ECG results, the Investigator must contact the Medical Monitor to discuss the patient’s continued eligibility to participate in this protocol. 11.6. Immunogenicity Blood samples will be collected to test for presence and titer of ADAs to ALXN1210 in serum prior to study drug administration as indicated in t he Schedule of Assessments ( Section 7.3). Further characterization of antibody responses may be conducted as appropriate, including binding and neutr alizing antibodies, to PK/PD, safety, and activity of ALXN1210."
68,page_68,"Protocol ALXN 1210- aHUS -312 Alexion Pharmaceuticals , Inc. Amendment 6 (Global) 16 Jul 2019 Page 68 of 96 CONFIDENTIAL Please refer to the Laboratory Manual for time windows for collection and detailed instructions for collecting, processing, storing, and shipping blood samples for immunogenicity analysis. 11.7. Adverse Event Management An AE is any untoward medical occurrence in a patient administered a pharmaceutical product and which does not necessarily have a causal relationship with this treatment. An AE can therefore be any unfavorable or unintended sign (eg, an abnormal laboratory finding), symptom, or disease temporally associated with the use of a medicinal product, whether or not considered related to the medicinal product. Situations in which an untoward medical occurrence did not occur (eg, hospitalization for elective surgery if planned before the start of the study, admissions for social reasons or convenience), and anticipated day -to-day fluctuations of pre- existing disease(s) or condition(s) present or detected at the start of the study that do not w orsen are not AEs. Lack of drug effect is not an AE in clinical studies, because the purpose of the clinical study is to establish drug effect. A medication error (including intentional misuse, abuse, and overdose of the product) or use other than what is defined in the protocol is not considered an AE unless there is an untoward medical occurrence as a result of a medication error. Cases of pregnancy that occur during maternal or paternal exposure to investigational product are to be reported within 24 hours of Investigator/site awareness . Data on fetal outcome and breastfeeding will be collected for regulatory reporting and safety evaluation. Adverse events should be recorded from the time of signed consent. An AE reported after informed consent but before study drug administration will be considered a pretreatment AE. Alexion has reporting standards for AEs that are to be followed as described in Section 11.7.6 regardless of applicable regulatory requirements that may be less stringent. 11.7.1. Targeted Adverse Events The following events are important identified risks in this study: • Meningococcal infections 11.7.2. Severity Assessment The severity of AEs will be graded using Common Terminology Criteria for Adverse Events (CTCAE ) version 4.03 or higher. A grading (severity) scale is provided for each AE term. Each CTCAE term is a Lowest Level Term ( LLT) per the Medical Dictionary for Regulatory Activ ities (MedDRA ®). Each LLT will be coded to a MedDRA preferred term (PT) . Grade refers to the severity of the AE. The CTCAE assigns a grade of 1 through 5, with unique clinical descriptions of severity for each AE ( Table 8)."
69,page_69,"Protocol ALXN 1210- aHUS -312 Alexion Pharmaceuticals , Inc. Amendment 6 (Global) 16 Jul 2019 Page 69 of 96 CONFIDENTIAL Table 8: Adverse Event Severity Grading Scale Grade Description Grade 1 Mild; asymptomatic or mild symptoms; clinical or diagnostic observations only; intervention not indicated Grade 2 Moderate; minimal, local or noninvasive intervention indicated; limiting age -appropriate instrumental activities of daily living (ADL )a Grade 3 Severe or medically significant, but not immediately life-threatening; hospitalization or prolongation of hospitalization indicated; disabling; limiting self -care ADLb Grade 4 Life-threatening consequences; urgent intervention indicated. Grade 5 Death related to AE. Abbreviations: ADL = activities of daily living; AE = adverse event a Instrumental ADL refers to preparing meals, shopping for groceries or clothes, using the telephone, managing money, etc. b Self-care ADL refers to bathing, dressing and undressing, feeding self, using the toilet, taking medications, and not bedridden. Any change in the severity of an AE should be documented based on specific guidelines in the eCRF Completion Guidelines. Severity and seriousness must be differentiated: severity describes the intensity of an AE, while the term seriousness refers to an AE that has met specific criteria for a SAE as described in Section 11.7.4. 11.7.3. Causality Assessment An Investigator must provide a causality assessment (Unrelated, Unlikely, Possible, Probable, or Definite) fo r all AEs (both serious and nonserious) based upon the Investigator’s medical judgment and the observed sym ptoms associated with the event (Table 9). This assessment must be recorded on the eCRF and any additional forms as appropriate. Table 9: Causality Assessment Descriptio ns Assessment Description Not Related/Unrelated Suggests that there is no causal association between the investigational product and the reported event. Unlikely Related Suggests that the clinical picture is highly consistent with a cause other than the investigational product but attribution cannot be made with absolute certainty and a relationship between the investigational product and AE cannot be excluded with complete confidence. Possibly Related Suggests that treatment with the investigational pro duct may have caused or contributed to the AE (ie, the event follows a reasonable temporal sequence from the time of drug administration and/or follows a known response pattern to the investigational product, but could also have been produced by other fact ors). Probably Related Suggests that a reasonable temporal sequence of the event with the investigational product administration exists and the likely causal association of the event with the investigational product. This will be based upon the known pharmacological action of the investigational product, known or previously reported adverse reactions to the investigational product or class of drugs, or judgment based on the Investigator ’s clinical experience. Definitely Related Temporal relationship to the investigational produc t, other conditions (concurrent illness, concurrent medication reaction, or progression/expression of disease state) do not appear to explain event, corresponds with the known pharmaceutical profile, improvement on discontinuation, reappearance on rechalle nge."
70,page_70,"Protocol ALXN 1210- aHUS -312 Alexion Pharmaceuticals , Inc. Amendment 6 (Global) 16 Jul 2019 Page 70 of 96 CONFIDENTIAL 11.7.4. Serious Adverse Events An SAE is any untoward medical occurrence that: • Results in death • Is life -threatening (ie, patient was at risk of death at the time of the event) • Requires inpatient hospitalization or prolongation of existing hospitalization • Results in persistent or significant disability/incapacity • Is a congenital anomaly/birth defect Important medical events that may not result in death, be immediately life -threatening, or require hospitalization , may be considered a serious adverse event when, based upon appropriate medical judgment, they may jeopardize the patient or may require intervention to prevent one of the outcomes listed above. The expectedness of an SAE will be determined by Alexion, based on the current version of the IB. Information pertaining to the collection and reporting of SAEs is provided in Section 11.7.6. 11.7.5. Suspected Unexpected Serious Adverse Reactions Suspec ted unexpected serious adverse reactions (SUSARs) are serious events that are not listed in the IB and that the Investigator identifies as related to investigational product or procedure. United States Title 21 Code of Federal Regulations (CFR) 312.32 and European Union Clinical Trial Directive 2001/20/EC and the associated detailed guidances or national regulatory requirements in participating countries require the reporting of SUSARs. Alexion has procedures that will be followed for the recording and expe dited reporting of SUSARs that are consistent with global regulations and the associated detailed guidances. Suspected unexpected serious adverse reactions will be reported to the national competent authority and IRBs /IECs where applicable. 11.7.6. Collection and Reporting of Adverse Events 11.7.6.1. All Adverse Events All AEs (serious and nonserious) will be collected from the signing of the informed consent form (ICF) until 8 weeks ( 56 days ) after the last dose of study drug. For patients who discontinue study drug, but remain in the study, AE data collection will continue at subsequent visits per the Schedule of Assessments, until the patient’s last visit. For patients who terminate early from the study, an ET visit will be conducted as soon as possible, and a Follow-up Phone C all will be performed 8 weeks ( 56 days) ± 5 days following the patient’s last dose of the study drug. All AEs must be recorded on the eCRF upon the Investigator or his/her staff becoming aware of their occurrence. Investigators will be instructed to report the SAE including their assessment (eg, severity, seriousness, and potential relatedness to study drug) to Alexion Global Pharmacovigilance (GPV) within 24 hours of first awareness of the event via the Safety Gateway ."
71,page_71,"Protocol ALXN 1210- aHUS -312 Alexion Pharmaceuticals , Inc. Amendment 6 (Global) 16 Jul 2019 Page 71 of 96 CONFIDENTIAL If a patient’s treatment is discontinued as a result of an AE, study site personnel must clearly capture the circumstances and data leading to any such dose interruption or discontinuation of treatment in the AE and Exposure pages of the eCRF. 11.7.6.2. Serious Adverse Events All SAEs will be recorded regardless of the Investigator ’s assessment of causality. No time limit exists on reporting SAEs that are thought to be causally related to the study drug. Inve stigators are at liberty to report S AEs irrespective of causality at any time. For all SAEs, the Investigator must provide the following: • Appropriate and requested follow- up information in the time frame detailed below • Causality of the SAE(s) • Treatment of /intervention for the SAE(s) • Outcome of the SAE(s) • Supporting medical records and laboratory/diagnostic information All SAEs must be reported to Alexion GPV within 24 hours of the Investigator or site staff awareness. These timelines for reporting SAE information to the sponsor need to be followed for the initial SAE report and for all follow -up SAE information . The Investigator or designee must record the SAE data in the eCRF and verify the accuracy of the information with corresponding source documents . The SAE report should be submitted electronically via the Safety Gateway . In the event that either the electronic data capture ( EDC) or the Safety Gateway is unavailable at the site(s) , the SAE must be reported on paper. Facsimile transmission or emai l may be used in the event of electronic submission failure. Email: Facsimile: (NOTE: A local facsimile number will be provided for non- US sites) When further information becomes available, the eCRF should be updated with the new information and an updated SAE report should be submitted to Alexion GPV via Safety Gateway . If applicable, additional information such as relevant medical records should be submitted to Alexion GPV via the email address or fax number noted above. All paper forms and follow-up information submitted to the sponsor outside of the Safety Gateway (eg, discharge summary) should be kept in the appropriate section of the study file. 11.7.7. Sponsor Reporting Requirements Alexion GPV or its legal representative is responsible for notifying the relevant regulatory authorities of SAEs meeting the reporting criteria. This protocol will use the current IB as the Reference Safety Document. The expectedness and reporting criteria of an SAE will be determined by the sponsor from the Reference Safety Document. PPD PPD"
72,page_72,"Protocol ALXN 1210- aHUS -312 Alexion Pharmaceuticals , Inc. Amendment 6 (Global) 16 Jul 2019 Page 72 of 96 CONFIDENTIAL 11.7.8. Investigator Reporting Requirements The Investigator must fulfill all local regulatory obligations required for the study Investigators. It is the PI’s responsibility to notify the IRB /IEC of all SAEs that occur at his or her site , as required per IRB/IEC SOPs . Investigators will also be notified of all SUSAR events that occur during the clinical study. Each site is responsible for notifying its IRB/IEC of these additional SAEs as per IRB/IEC S OPs. 11.8. Exposure During Pregnancy and Breastfeeding Pregnancy data will be collected during this study for all patients and female spouse/partner of male patients. Exposure during pregnancy (also referred to as exposure in utero) can be the result of either maternal exposure or transmission of drug product via semen following paternal exposure. For all Alexion products, both in development or postapproval, exposure during pregnancy must be recorded and the pregnancy followed until the outcome of the pregnancy is known (ie, spontaneous miscarriage, elective termination, normal birth, or congenital abnormality), even if the patient discontinues study drug or withdraws from the study. If a female patient or a patient’s female partner becomes pregnant during the conduct of this study, the Investigator must submit the “Pregnancy Reporting and Outcome/Breastfeeding” form to Alexion GPV via fax or email ( Section 11.7.6.2). When the outcome of the pregnancy becomes known, the form should be updated and submitted to Alexion GPV. If additional follow-up is required, the Investigator will be requested to provide the information. Exposure of an infant to an Alexion product during breastfeeding must also be reported (via the “Pregnancy Reporting and Outcome Form/Breastfeeding”) and any AEs experienced by the infant must be reported to Alexion Global Pharmacovigilance or designee via e mail or facsimile (Section 11.7.6). Pregnancy in itself is not regarded as an AE unless there is a suspicion that the investigational product may have interfered with the effectiveness of a contraceptive medication. However, complications of pregnancy and abnormal outcomes of pregnancy are AEs and may meet the criteria for an SAE (eg, ectopic pregnancy, spontaneous abortion, intrauterine fetal demise, neonatal death, or congenital anomaly). Elective abortions without complications should not be reported as AEs. 11.9. Safety Monitoring The Alexion medical monitor, G PV physician, or both will monitor safety data throughout the course of the study. Alexion will review all information pertaining to the SAEs within the time frames mandated by company procedures. The Alexion medical monitor will, as appropriate, consult with the GPV safety physician, to review trends in safety data."
73,page_73,"Protocol ALXN 1210- aHUS -312 Alexion Pharmaceuticals , Inc. Amendment 6 (Global) 16 Jul 2019 Page 73 of 96 CONFIDENTIAL 12. PHARMACOKINETICS AND PHARMACODYNAMICS ASSESSMENTS Blood samples for determination of serum drug concentrations and PD assessments will be collected before and after administration of study drug at the time points indicated in the Schedule of Assessments ( Section 7.3). The actual date and time ( 24-hour clock time) of each sampling will be recorded. The number of PK samples obtained for any given patient will not exceed the currently planned number of time points. End of infusion blood samples for PK and PD assessment should be collected from the arm opposite to the arm used for infusing drug. Please refer to the Laboratory Study Manual for details on samp le collection, including blood volume requirements. Assessments for PK/PD are as follows: 1. Changes in serum ALXN1210 concentration over time 2. Changes in serum free C5 concentration s 3. Changes in serum free C5 and serum ALXN1210 concentration in patients who discontinue treatment in the Extension Period, but remain in the study"
74,page_74,"Protocol ALXN 1210- aHUS -312 Alexion Pharmaceuticals , Inc. Amendment 6 (Global) 16 Jul 2019 Page 74 of 96 CONFIDENTIAL 13. EXPLORATORY ASSESSME NTS 13.1. Biomarker Assessments Exploratory biomarker analyses may be performed to evaluate changes from baseline in biomarkers which may include, but are not limited to, markers of complement dysregulation (eg, Factor Ba), vascular inflammation (eg, sTNFR1), endothelial activation/damage (eg, sVCAM -1, thrombomodulin), coagulation (eg, D- dimer ), and renal injury (eg, c ystatin C). Additional analysis may include evaluation of ALXN1210 excretion in urine, cRBC hemolysis, total C5, and autoantibodies to complement proteins (eg, anti- factor H). Please refer to the Laboratory Study Manual for details on sample collection, including blood volume requirements. Biomarker samples may be analyzed after study completion. 13.2. Genetics For patients who sign an additional optional consent, a whole blood sample for exploratory genetics can be drawn anytime during the study. Exploratory genetics may be performed to investigate genetic variants in genes known to be associated with aHUS, as well as to identify novel variants associated with aHUS, complement dysregulation, or metabolism or efficacy of ALXN1210 . A patient (or legal guardian) may decline from providing a sample for exploratory genetics and still participate in the study . Please refer to the Laboratory Study Manual for details on sample collection, including blood volume requirements. 13.3. Extra -renal Signs or Symptoms of aHUS The Invest igator will evaluate extra -renal signs or symptoms of aHUS using clinical laboratory measurements (eg, troponin I, amylase, and lipase), vital signs (eg, heart rate, respiratory rate, pulse oximetry), and an organ system review."
