,PageNo,Text17,page_17,"Protocol CHR#15 -17825 Phase I – Study drug(s) Page 17 of 61 Version date: 27 January 2019 family in their imminent grieving process. Spontaneous feedback from several subjects in the recent NYU psilocybin- assisted psychotherapy trial for existential distress in cancer patients included the request to be introduced to the other study subjects [19] , apparently to share, proc ess and integrate their experiences in a setting of mutual aid and understanding. Subjects from recent MDMA -assisted psychotherapy trials for PTSD have also spontaneously made this request, leading the study sponsors to create a web forum for the patients to be in touch with each other after completing the trials [129] . It appears to be helpful to patients treated with psychedelic -assisted psychotherapy to spend time with peers in their attempt to integrate the “peak” experiences, the phenomenology of which can be rather uncanny and perhaps difficult for psychedelic -naïve family or friends to comprehend [130] . Conducting non- drug psychotherapy sessions in groups may shed light on possible key mechanisms of psilocybin- assisted psychotherapy for ex istential distress. Whereas therapeutic alliance is thought to be the most important mediator of clinical outcomes in individual psychotherapy, group cohesion is widely recognized as the analogous mechanism in group psychotherapy [131, 132] . Examining the change of group cohesion pre - and post -psilocybin with validated self -report [133] and observer -rated instruments [134] will provide a novel and standardized means of observing how psilocybin drug sessions may affect the interpersonal functioning of distressed palliative care patients. A significant limitation of group therapy clinical trials is that large sample sizes are required to demonstrate efficacy because of the likely interdependence of outcomes of members of the same group [135] . For this reason, qualitative (e.g. Interpretive Phenomenological Analysis) and/or sequential (e.g. the Hill Interaction Matrix) measures of psychotherapeutic process are often used to make inductive inferences about clinical change from group therapy over time [136] . Process is understood as the conglomeration of intrapersonal functions, interpersonal dynamics and group environment that leads to therapeutic change [137] . To improve the evidence base for group psychotherapy, the American Group Psychotherapy Association (AGPA) has developed clinical practice guidelines [138] and a standard set of measures and tools for creating and managing psychotherapy groups for clinical practice and r esearch [139] . In developing the protocol for this proposed study, we have drawn not only from the literatures on psilocybin- assisted psychotherapy and palliative care, but also from these AGPA clinical and research guidelines, as well as on the consultation of local group psychotherapy experts [140] . Rationale for Dosing Regimen Griffiths et al [141] have characterized the dose- response relationship of oral psilocybin in healthy volunteers. They found that when considering the odds of attaining a complete mystical experience versus having a temporary anxiety reaction during the drug experience (lasting on the order of minutes), the optimal dose likely falls between 0.29 mg/kg and 0.43mg/kg [141] . This dose range has been successfully used in studies of psilocybin- assisted psychotherapy for existential distress in cancer patients [19, 20] , severe alcohol use disorder [111] and tobacco use disorder [112] . The current study will employ a dose of 0.3mg/kg po in the first group, and if this is well tolerated will then escalate to 0.36mg/kg po in subsequent groups. The dosing of the psychotherapy —10 sessions occurring at a frequency of 1- 2 times per week —was chosen on the basis of comparison with similar group psychotherapies for existential distress in palliative care patients. The group psychotherapy with the best evidence- base for treating exist ential distress in palliative care patients, Meaning -Centered Group Psychotherapy, employs 8 sessions [142] . The group psychotherapy with the best evidence- based for treating complicated grief has 16 weekly sessions [143] . Our protocol uses a modif ied course of Brief Supportive- Expressive Group Therapy, which was designed and tested as a 12 - week course of treatment [76]. Empirical data suggest that group therapies lasting at least 12 sessions are shown to have greater correlations between group cohesion and clinical outcomes"
18,page_18,"Protocol CHR#15 -17825 Phase I – Study drug(s) Page 18 of 61 Version date: 27 January 2019 [132] . We hypothesize that psilocybin will cat alyze group cohesion in a shorter period of time, thus making 12 -16 weeks of group therapy unnecessary for detecting comparable results with regards to cohesion and clinical outcomes. Rationale for Supportive- Expressive Group Therapy While prior trials of psilocybin -assisted psychotherapy for existential distress in palliative care patients have followed a standard drug administration safety protocol, they have not used manualized psychotherapies in the non- drug therapy sessions; our study will be the firs t to do this, which should enhance generalizability of the results. The format and content of SEGT are appropriately flexible for incorporating individual psilocybin sessions during the course of therapy, and including psychoeducation on psilocybin in the preparatory sessions. The focus of SEGT on expressing emotions and enhancing communication with caregivers is expected to be helpful in integrating psilocybin experiences [121] . Psilocy bin has been shown to enhance access to positive emotional memories [144] and to increase the personality trait of openness [107] , and this should support SEGT’s aim of increasing awareness of one’s emotions and openness to new experiences. Because the primary aim of this pilot trial is to assess safety and feasibility of this modality —and assessing efficacy is a secondary aim —no control group of traditional SEGT will be included in the study. For the rationale on why psilocybin monotherapy (without an adjunctive psychotherapy) will not be offered as control condition, see above. 1.4 Study Hypotheses Primary 1. The study will recruit, consent and enroll 18 subjects (in 3 groups of 6 members) over 18 months; these subjects will complete all treatment and evaluation sessions and they will experience no treatment -emergent serious adverse events. Secondary 1. The difference in pre - and post -treatment mean scores of demoralization, complicated grief, depression, PTSD, shame, anxiety, quality of life, functional social support, post - traumatic growth, openness to experience, attachment security, mindfulness, global clinical impressions and ART medication adherence will trend toward significant improvement. These improvements will be sustained at 3- month follow -up. 2. The difference in pre - and post -psilocybin rates of change of group cohesion and group process will tr end toward significant improvement. 3. Qualitative analyses of subject behavior and caregiver/important other reports will lead to greater understanding of the interpersonal mechanisms of action of psilocybin- assisted psychotherapy."
19,page_19,"Protocol CHR#15 -17825 Phase I – Study drug(s) Page 19 of 61 Version date: 27 January 2019 2 Objectives of the Study 2.1 Objectives 2.1.1 Primary Objective • To demonstrate the safety and feasibility of Psilocybin- Assisted Supportive- Expressive Group Psychotherapy (PA -SEGT) for demoralization in long- term AIDS survivors (LTAS). 2.1.2 Exploratory Objectives • To explore the preliminary efficacy of PA -SEGT for improving demoralization, complicated grief, depression, PTSD, shame, anxiety, post -traumatic growth, quality of life, functional social support, openness to experience, attachment security , social connect ion, nature relatedness and ART medication adherence in LTAS. • To explore quantitatively and qualitatively the mechanisms (e.g. group cohesion) through which PA -SEGT addresses demoralization and other mental health outcomes in LTAS. 2.2 Endpoints 2.2.1 Primary Endpoi nts • Safety will be defined based on the rate of adverse reactions (defined by the NIH Division of AIDS Table of Grading of Severity of Adult and Pediatric Adverse Events V2.0) (see Section 5 below). The safety of acute drug effects will be assessed by moni toring vital signs for tachycardia (HR>100bpm), bradycardia (HR<60bpm), hypertension (SBP>140mmHg or DBP>90mmHg) and hypotension (SBP<100mmHg or DBP<60mmHg). Drug -induced mental status changes will be assessed using the Adverse Event Medication Session Rat ing Form during drug sessions, pre and post measures with the Montreal Cognitive Assessment, and the Persisting Effects Questionnaire —Spirituality at study follow up. Suicidality will be assessed with the Columbia Suicide Severity Rating Scale. Follow -up safety data will be gathered for 3 months. • Feasibility will partially be assessed in terms of the rates of patient recruitment and retention. Feedback on acceptability will also be gathered from subjects and caregivers/important others using the Client Sati sfaction Scale. Patients and caregivers will also be invited to provide feedback during a focus group and patients will be invited to participate in individual interviews after the intervention. A SEGT Topic Grid will be used to evaluate video recordings o f group therapy sessions in order to assess therapist adherence to the PA -SEGT model. 2.2.2 Exploratory Endpoints Preliminary efficacy will be assessed with the primary clinical outcome measures: • Change in demoralization will be defined as the difference in pre- treatment, post - treatment, and 3 -month follow -up scores of the Demoralization Scale -II. • Change in complicated grief will be defined by the difference in pre -treatment, post - treatment, and 3 -month follow -up mean scores of the Inventory of Complicated Grief. Preliminary efficacy will also be explored with the following secondary endpoints (See Section 5 for details on individual measures):"
20,page_20,"Protocol CHR#15 -17825 Phase I – Study drug(s) Page 20 of 61 Version date: 27 January 2019 • Change in ART medication adherence will be defined as the difference in pre- treatment, post-treatment, and 3- month follow -up mean scores of the ART Medication Adherence Scale. • Change in depression will be defined by the difference in pre -treatment, post - treatment, and 3 -month follow -up mean scores of the Center for Epidemiologic Studies Depress ion Scale —Revised. • Change in subject quality of life will be defined by the difference in pre -treatment, post - treatment, and 3 -month follow -up mean scores of the McGill Quality of Life Questionnaire —Revised. • Change in desire for hastened death will be def ined as the difference in pre- treatment, post-treatment, and 3- month follow -up mean scores of Schedule of Attitudes towards Hastened Death. • Change in anxiety will be defined as the difference in pre -treatment, post -treatment, and 3-month follow -up mean scores of the State -Trait Anxiety Inventory. • Change in social support will be defined as the difference in pre -treatment, post - treatment, and 3 -month follow -up mean scores of the Duke/UNC Functional Social Support Questionnaire- 5. • Post-traumatic growth due to the intervention will be defined by post -treatment and 3 - month follow -up mean scores of Post -Traumatic Growth Inventory —Short Form. • Change in PTSD symptoms will be defined as the difference in pre -treatment, post- treatment, and 3 -month follow -up mean scores of the PTSD Checklist -5. • Change in global clinical status will be defined as the difference in pre- treatment and post- treatment mean scores of the Clinical Global Impressions Scale completed by a clinical rater. • Change in openness to experience will be defined as the difference in pre- treatment, post-treatment, and 3- month follow -up mean scores of the International Personality Item Pool—Openness to Experience- 20 scale. • Change in mindfulness will be defined as the difference in pre -treatment, post -treatment, and 3- month follow -up mean scores of subscales of the Multidimensional Assessment of Interoceptive Awareness. • Change in social connectedness will be defined by the difference in pre- treatment, post - treatment, and 3 -month follow -up mean scores of the Social Connectedness Scale— Revised . • Change in Nature Relatedness will be defined by the difference in pre- treatment, post - treatment, and 3- month follow -up mean scores of the Nature Relatedness Scale, Short Form Vers ion. • Change in alcohol and drug use will be defined by different in the baseline and 3- month follow -up AUDIT and DUDIT scores Psychotherapeutic process and mechanisms will be explored with the following endpoints: • Change in group cohesion will be defined as the difference in rate of Group Questionnaire score change pre - and post-psilocybin."
21,page_21,"Protocol CHR#15 -17825 Phase I – Study drug(s) Page 21 of 61 Version date: 27 January 2019 • Change in group process will be assessed as the difference in rate of progression of the Hill Interaction Matrix score pre - and post-psilocybin. • Change in group process will be assessed as the change in the Individual Group Member Interpersonal Process Scale over time. • Expectancy effects will be estimated based on the pre -psilocybin total score of the Credibility/Expectancy Questionnaire. • Subjective experience of a psilocybin treatment session will be evaluated with the Mystical Experience Questionnaire—30 and the Challenging Experience Questionnaire. • Change in attachment security will be defined as the difference in pre -treatment, post - treatment, and 3 -month follow -up mean scores of the Experiences in Close Relationships scale—Modified 16. • Qualitative analysis of therapy session video footage, semi -structured patient interviews, focus groups and process notes written by study staff. • Change in inclusion of other in self will be defined by the difference in pre- treatment, post -treatment, and 3 -month follow -up results of the Inclusion of Other in Self measure."
22,page_22,"Protocol CHR#15 -17825 Phase I – Study drug(s) Page 22 of 61 Version date: 27 January 2019 3 Study Design 3.1 Characteristics This is a Phase I open- label pilot mixed -methods study of the safety and feasibility of an 8-week group psychotherapy intervention that includes one individual drug session with oral synthetic psilocybin. This intervention is designed to treat demoralization in LTAS. Groups of 6 subjects will be run in sequence. Safety data will be gathered before, during, immediately after, and for 3 months after the intervention. Subjects will complete self -report measures and semi -structured interviews related to acceptability and subjective experience. Exploratory analyses will be conducted of clinical outcomes. Exploratory analyses will also include quantitative and qualitative assessments of psychotherapeutic process mechanisms. 3.2 Number of Subjects We estimate that a total of 72 patients will be consented and screened in- person for the study in order to enroll 6 therapy groups of 6 members each. Patients who have been assigned to a group will be replaced only if they drop out prior to the first group therapy session. (See Section 8.2.1 Sample Size and Power Estimate.) 3.3 Eligibility Criteria Patients must have baseline evaluations performed prior to the first group therapy session and must satisfy all inclusion and exclusion criteria. In addition, the patient must be thoroughly informed about all aspects of the study, including the study visit schedule and required evaluations and all regulatory requirements for informed consent. The written informed consent must be obtained from the patient prior to enrollment. The following criteria apply to all patients enrolled onto the study unless otherwi se specified. 3.3.1 Inclusion Criteria 1. HIV-positive persons (laboratory -confirmed) ≥50 years old who are able to understand a written informed consent document and who are willing to sign it. 2. Participant -reported diagnos is of HIV or AIDS prior to the clinical av ailability of protease inhibitors (mid -1996).1 3. Moderate- to-severe demoralization, determined by a score of 8 or higher on the Demoralization Scale- II [27]. 3.3.2 Exclusion Criteria 1. Life expectancy <6 months ( determined by the patient’s non -study PMD) 2. Current pregnancy, or the intention of becoming pregnant within 3 months of enrollment 3. Being of childbearing potential, and refraining from dual -method contraception 4. Poor functional status (Palliative Perf ormance Scale- v2 <60%). 5. Major c ognitive impairment (Montreal Cognitive Assessment <23). 6. The regular use of psychotropic medications within 2 weeks of s tudy participation, including antidepressants (such as serotonin- reuptake inhibitors, tricyclic antidepressants and monoamine oxidase inhibitors),2 antipsychotics, and mood 1 This includes participants who at a later timepoint had laboratory -confirmed HIV but prior to mid- 1996 had refused or not accessed testing, yet they believed themselves to be HIV+ and by clinical reasoning were likely to have seroconverted by this timepoi nt. 2 Individuals taking antidepressants will be presented with the option of tapering off, and remaining off, of their medication for the duration of the study, if their prescribing physician agrees with this course of treatment."
23,page_23,"Protocol CHR#15 -17825 Phase I – Study drug(s) Page 23 of 61 Version date: 27 January 2019 stabilizers . Low dose ( ≤50mg) TCAs prescribed for neuropathic pain are not considered psychotropic ; participants are prohibited from using these medications during the study, but do not need to demonstrate a period of psychiatric stability for 2 weeks prior to enrollment. Patients will be asked to refrain from consuming alcohol, prescription analgesics , PRN anxiolytics and PRN stimulants the day before and of a psilocybin session. 7. History of a psychotic disorder or Bipolar disorder I or II (determined by SCID -5). 8. Family history of primary psychotic disorder or primary bipolar disorder (first or second degree relative). 9. Current, severe Major Depressive Episode (These individuals wil l be referred to standard -of-care treatment in the community). 10. History of active suicidal ideation with intent in the last 3 months (Suicidal ideation score > 3 and Reason for ideation >1 on C -SSRS); or a history of suicide attempt in the last 2 years with Actual lethality/Medical damage >0 or Potential lethality >0 (on C-SSRS). 11. Narc issistic personality disorder, moderate- to-severe (determined by SCID -5-PD). 12. History of Hallucinogen Use Disorder (Moderate or Severe) or Hallucinogen Persisting Perception Disorder (determined by SCID -5). 13. History of a seizure disorder in adulthood . 14. CNS metastases or symptomatic CNS infection. 15. Clinically significant cardiovascular disease (CAD, CHF, arrhythmia); or baseline QT/QTc>5 00msec ; or baseline QT/QTc 451- 500msec with repeat QT/QTc >500msec . 16. Uncontrolled hypertension (SBP>139mmHG or DBP>89mmHG if over 65 years old) or tachycardia (average HR>90bpm if over 65 years old) averaged over at least two measurements. 17. Supplemental oxygen requirement. 18. Poorly controlled diabetes mellitus (e.g., history of an episode of hypoglycemia or hospitalization for hyperglycemia on the current diabetes regimen). 19. Inadequate hepatic function (Total bilirubin >2mg/dL, OR AST >6 upper institutional upper limit of normal, OR AST >6 upper institutional upper limit of normal), as determined by most recent laboratory tests. 20. Inadequate renal function as determined by eGFR < 30 mL/min/1.73 m2 (based on the MDRD equation ) or CrCl < 30 mL/min ( based on the C -G equation). 21. Concomitant dosing of psilocybin with known UGT1A10 and UGT1A9 inhibitors (e.g., diclofenac and probenecid) will be avoided. There is no exclusion criterion based on the use of medications or substances that are inhibitors or inducers of CYP450 enzymes. 22. The use of efavirenz (a.k.a, Sustiva or Atripla). 23. If deemed by clinical judgment of the study investigators to be unsafe for undergoing the intervention and/or inappropriate for participating in a therapy group. 3.4 Duration of Therapy In the absence of treatment delays due to adverse events, treatment may continue for 8 weeks or until: • Inter-current illness that prevents further administration of treatment • Unacceptable adverse event(s) • Patients decides to withdraw from the study • Significant patient non- compliance with protocol • General or specific changes in the patients’ condition render the patient unacceptable for further treatment in the judgment of the investigator. 3.5 Duration of Follow Up Patients will be followed for 3 m onths after completion of treatment or removal from study, or"
24,page_24,"Protocol CHR#15 -17825 Phase I – Study drug(s) Page 24 of 61 Version date: 27 January 2019 until death, whichever occurs first. Patients removed from study for unacceptable treatment related adverse event(s) will be followed until resolution or stabilization of all treatment related adverse events. 3.6 Randomization Procedures Patients will not be randomized; this is an open -label pilot trial with one treatment arm. 3.7 Study Timeline 3.7.1 Primary Completion The study will reach primary completion 36 months from the time the study opens to accrual. 3.7.2 Study Completion The study will reach study completion 48 months from the time the study opens to accrual."
25,page_25,"Protocol CHR#15 -17825 Phase I – Study drug(s) Page 25 of 61 Version date: 27 January 2019 4 Study Drugs 4.1 Description, Supply and Storage of Investigational Drugs 4.1.1 Investigational Drug: Psilocybin Psilocybin is available as a powder that can be encapsulated for oral administration. Classification Psilocybin is an indoleamine psychedelic and is one of the “classic psychedelics.” It has a chemical structure similar to that of the neurotransmitter serotonin. Mechanism of Acti on Psilocybin is an agonist of serotonin 5HT2A, 2C and 1A receptors [92, 102] . Metabolism After ingestion, psilocybin is rapidly dephosphorylated to psilocin, which is metabolized via oxidation and glucuronidation in the small intestine and the liver, and subsequently excreted renally [91, 94, 95] . Contraindications Current safety standards for experimental psilocybin administration [24, 145] include providing a comfortable environment, the presence of supportive and non- directive therapists or research staff, and strict exclusion criteria. Beyond this basic principle, psiloc ybin should generally not be administered to individuals with a personal or family history of psychosis or bipolar disease, or individuals who are acutely suicidal. It should also not be administered to individuals with severe cardiovascular disease. Co- administration with medications associated with the serotonin syndrome [146] should be avoided. There have been no rigorous studies of the effects of psilocybin on pregnancy. We are aware of only one published care report from a research study in which a woman consum ed pure psilocy bin about every 2 weeks throughout her pregnancy to no apparent detriment to the child, who was followed for 1 year postnatally [120] . It is recommended that women who are pregnant avoid using psilocybin. Non -clinical and clinical data describing the effects of oral psilocybin on lactation, sperm, and teratogenicity are not available . Availability Psilocybin is a Schedule I compound, and so requires a DEA Schedule I license to handle. For the purposes of this study, psilocybin is available from the laboratory of Dr. Roland Griffiths at Johns Hopkins University (IND#133202) and from Usona Institute (Madison, WI) . Storage and handling Psilocybin is stored at 15 -30°C. Each subject’s dose will be, to the nearest milligram, as close as possible to that indicated by their actual bodyweight (e.g., 0.30mg/kg or 0.36mg/kg), with a maximum dose not to exceed that calculated for a BMI of 35 at that participant’s height . The psilocybin will be provided to UCSF in powder form, and t he UCSF Investigational Drug Service of the UCSF Department of Pharmacy Services will encapsulate the drug. The study drug will be stored in a secure vault in the Investigational Drug Service in the Inpatient Pharmacy in Moffitt -Long Hospital (505 Parnassus Ave, San Francisco). Side Effects Psilocybin is known to be physiologically safe at the doses proposed for this study, and is not addictive [92, 103] . Safe administration is dependent on using a supportive and structured administration protocol [24]. Psilocybin is known to possibly c ause the following transient side effects: Anxiety, thought disorder, nausea, emesis, increase or decrease in heart rate, increase or"
