,PageNo,Text107,page_107,"2017N326521_02 CONFIDENTIA L 207966 108Plasma concentrations of both L A drugs may be measurable for more than one year following IM injections. Any interruption in I M dosing should be discussed with the Medical Monitor. Investigators should ensure that the participant initiates alternative highly active ART to minimize the risk of developing resistance as concentrat ions of CAB and RPV decline over time. IM dosing is expected to occur during the week in which the participant’s projected visit falls (as according to the date of the first injection). The first injections for participants from ATLAS on CAB LA + RPV L A Q4W will occur at Day 1. The first injections for participants transitioning from oral SOC are administered at Week 4b (can be performed as soon as lab results from Week 4a become available and should be performed where possible within 2 weeks of visit 4a) , and the second inj ections are given at Week 8. Between the Week 4a and 4b visits, participants must continue daily treatment with oral CAB and RPV tablets. Since the first injection visit (Day 1 or 4b) will determine the future injection visit schedulefor participants, planning for the first injection visit date (within allowed visit windows) should take into consideration the availability of theparticipants to adhere to future visit windows (planned vacations, business trips, etc .). CAB LA + RPV LA d osingfor participants transitioning from SOC treatment is as follows: All injections should be planned as single injections per drug. 6.9.1.1. IM injections every 4 weeks (Q4W): Week 4b only -CAB LA 600 mg + RPV LA 900 mg, each given as 1 X 3 mL IM injection Week8 and Q4W thereafter - CAB LA 400 mg IM + RPV L A 600 mg IM every 4 weeks for 100 weeks, each given as 1 X 2 mL IM injection At Week 4b, participants transitioning from SOC will return to the clinic, take the last dose of oral CAB 30 mg + RPV 25 mg, and receive the first CAB LA 600 mg + RPV LA 900 mg injections (within 2 hours of the final oral dose of CAB + RPV). The first injection visit with I M CAB LA + RPV LA at Week 4b can be performed once central lab results are available and safet y parameters are r eviewed from the Week 4a visit. The second and third IM injections with CAB LA 400 mg and RPV LA 600 mg will be performed at Week 8 and Week 12. There will be a -7 day dosing window for the second and third IM injections such that the second injection o ccurs within the window of Week 7 and Week 8 but no later than Week 8 and the third injection occurs within the window of Week 11 and Week 12 but no later than Week 12. Subsequent injections with CAB LA 400 mg and RPV L A 600 mg will occur every 4 weeks ( 7 days) thereafter. In addition, starting after the Week 16 injection, efforts should be made to limit time between injection visits to a maximum of 5 weeks. The Medical Monitor must be contacted if the length of time between injections exceeds or is pro jected to exceed 5 weeks. 2019N406358_00"
108,page_108,"2017N326521_02 CONFIDENTIA L 207966 1096.9.1.2. IM injections every 8 weeks (Q8W): Week 4b –CAB LA 600 mg + RPV LA 900 mg IM, each given as 1 X 3 mL IM injection Week 8 - CAB LA 600 mg + RPV LA 900 mg IM, each given as 1 X 3 mL IM injection Week 16 and Q8W thereafter -CAB LA 600 mg + RPV L A 900 mg IM, every 8 weeks for 100 weeks, each given as 1 X 3 mL IM injection At Week 4b, subjects will return to the clinic, take the last dose of their oral (CAB 30 mg + RPV25 mg), and receive the first CAB LA (600 mg) + RPV LA (900 mg) injections (within 2 hours of the final oral dose of CAB + RPV). The first injection visit with I M CAB LA + RPV LA at Week 4b can be performed once central lab results are available and safety parameters are reviewed from the Week 4a visit. The second loa ding injection will be administered at Week 8 (CAB LA 600 mg + RPV LA 900mg, with subsequent injections (CAB LA 600 mg + RPV LA 900 mg) occurring every 8 weeks thereafter. The dosing window for the second injection allows administration between Week 7 an d Week 8, but preferabl y not later than Week 8. After Week 16, a dosing window ( 7 days) for injections is allowed, but not preferred. Starting at the Week 16 injection, the interval between injection visits should be limited to a maximum of 9 weeks. I f the length of time between injections exceeds, or is projected to exceed 9 weeks, the Medical Monitor must be contacted to discuss individual subject case management Participants transitioning from ATLAS and currently receiving CAB LA + RPV LA Q4W Patient transitioning from the ATLAS study and on CAB LA + RPV LA Q4W treatment will be randomized at Day 1 to either continue Q4W administration or transition to Q8W administration of CAB LA + RPV LA. The first injection visit for the ATLAS-2Mstudy can be performed once the final central lab results from the ATLAS study are available and safety parameters have been reviewed . For participants who received three or more Q4W CAB LA + RPV LA injections within ATLAS, the transition from ATL AS to ATLAS-2MDay 1 dosing must occur 4 weeks ( 7 days) from the final injections received in ATLAS. For those who received less than three Q4W injections within ATLAS, this transition to ATLAS-2MDay 1 injections must occur within 4 weeks (-7 days) from the final ATLAS injection s Dosing for participants transitioning from CAB LA + RPV L A Q4W in ATL AS is as follows: 6.9.1.3. IM injections every 4 weeks (Q4W) (Q4W from ATL AS Q4W): Starting at Day 1, all injections will continue with the maintenance dose of CAB LA 400mg and RPV LA 600 mg ad ministered every 4 weeks ( 7 days). In addition, efforts should be made to limit time between injection visits to a maximum of 5 weeks. The 2019N406358_00"
109,page_109,"2017N326521_02 CONFIDENTIA L 207966 110Medical Monitor must be contacted if the length of time between injections exceeds or is projected to exceed 5 wee ks. 6.9.1.4. IM injections every 8 weeks (Q8W) (Q8W from ATL AS Q4W): Participants transitioning from ATLAS and receiving CAB LA + RPV LA Q8W will initiate dosing at the Day 1 visit: Day 1-CAB LA 600 mg + RPV L A 900 mg IM, each given as 1 X 3 mL IM injection Week 8and Q8W thereafter -CAB LA 600 mg + RPV L A 900 mg IM, each given as 1 X 3 mL IM injection The second injection will be administered at Week 8 (CAB LA 600 mg + RPV L A 900mg, with subsequent injections (CAB LA 600 mg + RPV LA 900 mg) every 8 weeks thereafter. The dosing window for the second injection allows administration between Week 7 and Week 8, but preferabl y not later than Week 8. After Week 16, a dosing window ( 7 days) for injections is allowed, but not preferred. Starting at the Week 16 injection, the interval between injection visits should be limited to a maximum of 9 weeks. If the length of time between injections exceeds, or is projected to exceed 9 weeks, the Medical Monitor must be contacted to discuss individual subject case management. Any request for the visit/dosing to occur outside of the allowed window must be discussed and agreed with the Medical Monitor prior to dosing. In the event of a late dose, a revised dosing schedule for subsequent dosing may be required and will be communica ted to the site staff at the time of approval for continued dosing. Temporary switch to oral dosing of CAB and/or RPV may be an option based on individual participant circumstance as described in Section 6.8. See the SPM for scheduling guidance and further information and examples. Note: All decisions regarding dose interruption/ resumption must be discussed with the Medical Monitor in advance. 6.9.2. Oral Dosing The Week 4a Visit during the Oral Lead -in Phase for part icipants transitioning from SOC isexpected to occur 4 weeks ( 3 days) afterto the Day 1 Baseline visit. However, the number of tablets dispensed should be considered when scheduling the next visit. Any interruption in therapy (scheduling conflicts, life circumstances, etc.) during an y oral dosing period that is greater than 7 consecutive days must be discussed with the Medical Monitor prior to resumption of therap y. The Medical Monitor must be contacted upon site staff becoming aware of resumption in th erapy, if therap y was resumed without prior approval. Visits for participants in LTFU are expected to occur as projected according to the last injection. 2019N406358_00"
110,page_110,"2017N326521_02 CONFIDENTIA L 207966 1116.10. Discontinuation of Study Treatment Participants unable to manage drug toxicity or tolerate investiga tional product (I P, either formulations of CAB or RPV) must have I P discontinued. Any participant receiving at least one dose of CAB LA and /or RPV LA who discontinue I P / Withdraw will initiate treatment with HAART enter the LTFUPhase for 52 weeks of follow up (see Section 4.2.4). 6.11. Treatment of Study Treatment Overdose For participants receiving Oral CAB, an y tablet intake exceeding a total daily dose of 30 mg will be considered an overdose. For participant s receiving oral RPV, any dose exceeding a total daily dose of 25 mg will be considered an overdose. For CAB LA and RPV LA, an y single dose in excess of the studied doses will be considered an overdose. Should IM maladministration, specificall y overdose or inadvertent IV dosing, be suspected at an y time, the participant will stay onsite for approximately 2-3 hours post dose for safet y monitoring and an ECG will be performed at 2 hours post dose. The Medical Monitor will be notified in the event of a suspe cted maladministration. In the event of suspected maladministration, additional PK samples will be drawn at 2hours post dosing for evaluation of CAB and RPV concentrations. For the purposes of this study , an overdose is not an AE (refer to Section 11.6.1) unless it is accompanied b y a clinical manifestation associated with the overdose. If the clinical manifestation presents with serious criteria, the event is a SAE (see Section 11.6.2). If an overdose occurs and is associated with an adverse event requiring action, all study medications must be temporaril y discontinued until the adverse event resolves. The Investigator should use clinical judgement in treating overdose, as ViiV Healthcare is unable to recommend specific treatment. In the event of an overdose the investigator or treating phy sician should: 1.Contact the Medical Monitor immediately 2.Closely monitor the participant for adverse events (AEs)/serious adverse events (SAEs) and laboratory abnormalities until the I P can no longer be detected systemically (at least 5 days for oral CAB and oral RPV, and 52 weeks for CAB LA and RPV L A 3.Obtain a plasma sample for pharmacokinetic (PK) anal ysis if possible within 2 day s from the date of the last dose of study treatment if requested by the Medical Monitor (determined on a case -by-case basis). 4.Document the quantit y of the excess dose as well as the duration of the overdosing in the CRF. 2019N406358_00"
111,page_111,"2017N326521_02 CONFIDENTIA L 207966 112Decisions regarding dose interrupti ons or modifications will be made by the investigator in consultation with the Medical Monitor based on the clinical evaluation of the participant. 6.12. Treatment after the End of the Study The investigator is responsible for ensuring that consideration has bee n given to the post - study care of the participant’s medical condition, whether or not GSK is providing specific post -study treatment. Participants wh o have successfull y completed 100 weeks of treatment will continue to have access to both CAB LA and RPV L A in the Extension Phase until study treatment is either locally approved and commerciall y available, the participant no longer derives clinical benefit, the participant meets a protocol -defined reason for discontinuation or until development of either CAB LA or RPV LA is terminated. 6.13. Concomitant Medications and Non -Drug Therapies Participants must be advised to notify their Investigator of an y current or proposed concomitant medication, whether prescribed or over- the-counter, because of the potential for interactions between such treatments and the study medications. Concomitant medications (prescription and non -prescription) will be permitted during the course of the study at the investigator’s discretion (except for prohibited medications described in Section 6.13.2) and should be administered onl y as medically necessary during the stud y. All concomitant medication, blood products, and vaccines taken during the study will be recorded in the eCRF. The minimum r equirement is that the drug name, route, and the dates of administration are to be recorded. Any medication or vaccine (including over -the-counter or prescription medicines, vitamins, and/or herbal supplements) that the participant is receiving at the tim e of enrollment or receives during the stud y must be recorded along with: reason for use dates of administration including start and end dates dosage information including dose and frequency The Medical Monitor should be contacted if there are an y questions regarding concomitant or prior therapy . 6.13.1. Permitted Medications and Non -Drug Therapies Chemoprophy laxis for HIV-associated conditions is encouraged, if appropriate, at the discretion of the participant and their ph ysician. All concomitant medications, b lood products, and vaccines taken during the study will be recorded in the eCRF with dates of administration. Because non- HIV vaccines may cause a temporary increase in the level of plasma HIV -1 RNA, it is recommended that a vaccine, if necessary , be given during or immediately after a scheduled visit after all laboratory tests have been drawn. This approach will 2019N406358_00"
112,page_112,"2017N326521_02 CONFIDENTIA L 207966 113minimize the risk of non- specific increases in the level of plasma HIV -1 RNA at the next scheduled assessment. Other IM injectables (with excepti ons below) are permitted but must be administered away from the site of IP administration (should be spaced 2 cm or more away from site of IP injection). Antacid and H2 Antagonist Use: Since co-administration of oral CAB and RPV is required in this study , the most restrictive dosing requirements must be taken into consideration. CAB oral administration only : Antacid products containing divalent cations (e.g., aluminium, calcium and magnesium) must be taken at least 2 hours before or at least 4 hours after CAB. Concurrent administration of multivitamins is acceptable. RPV oral administration only: Antacid products must be taken at least 2 hours before or at least 4 hours after RPV. H2-Receptor antagonists (e.g. cimetidine, famotidine, nizatidine, ranitidine) may cause significant decreases in RPV plasma concentrations. H2-receptor antagonists should only be administered at least 12 hours before or at least 4 hours after RPV. RPV should not be co- administered with proton pump inhibitors, such as esomepraz ole, lansoprazole, omeprazole, pantoprazole, rabeprazole. RPV: Administration of clarithrom ycin, erythromycin and telithromy cin is not recommended with RPV due to possible increase in plasma concentration of RPV due to CYP3A enzy me inhibition. Where possible, alternatives such as azithromycin should be considered. Please refer to the local rilpivirine prescribing information for guidance regarding other drugs that are prohibited, should be used with caution, require dose adjustment, or increased clinicalmonitoring if taken with rilpivirine. Drugs with a known risk ofTorsade des Pointes (TdP) should be used with caution when on rilpivirine (see SPM for list of drugs associated with TdP). 6.13.2. Prohibited Medications and Non -Drug Therapies The following concomi tant medications or therapies are not permitted at any time during the study: HIV immunotherapeutic vaccines are not permitted at an y time during the study. Other experimental agents, antiretroviral drugs not otherwise specified in the protocol, cy totoxicchemotherap y, or radiation therap y may not be administered (see Exclusion Criteria #35 -36, Section 5.2). Systemically administered immunomodulators (such as interleukin and interferon agents) are prohibited (a list of examples is provided in the SPM). This includes topical agents with substantial sy stemic exposure and sy stemic effects. Use of topical imiquimod is permitted. 2019N406358_00"
113,page_113,"2017N326521_02 CONFIDENTIA L 207966 114Acetaminophen (paracetamol) cannot be used in patients with acute viral hepatitis ( James, 2009). Chronic use of s ystemic (oral or parenteral) glucocorticoids must be avoided due totheir immunosuppressive effect; however, short treatment courses with oral prednisone/ prednisolone/methylprednisolone (e .g. adjunctive treatment of Pneumocy stis pneumonia with ≤ 21 days of tapering prednisone) are allowed. A single dose of sy stemic dexamethasone is permitted (more than a single dose in a treatment course may cause significant decrease in RPV plasma concent ration and is prohibited). Topical, inhaled or intranasal use of glucocorti coids will be allowed. Hepatitis C infection therapy is prohibited during the Maintenance Phase before the Week 48 primary endpoint, and interferon -based HCV therap y or use of anydrugs that have a potential for adverse drug:drug interactions with study treatment is prohibited throughout the entire study . For information on concurrent therapies and interactions suspected to be relevant to other antiretroviral therap y in the regime n, please consult the local prescribing information. 6.13.2.1. Concurrent with CA B and/or RPV For participants receiving either formulation of CAB and/or RPV, the following medications could significantly decrease the levels of CAB and/or RPV due to enzy me induction and therefore must not be administered concurrently : Carbamazepine Oxcarbazepine Phenobarbital Phenytoin Rifabutin Rifampicin / Rifampin Rifapentine St. John’s wort ( Hypericum perforatum ) Concurrent with CAB CAB is a potent inhibitor of OAT1 and OAT3 tr ansport in vitro, however, no clinically significant interaction risk is expected for most drugs that are substrates of these transporters. Monitoring may be required for drugs with a narrow therapeutic index and dependent on OAT1 and OAT3 transport (e.g. methotrexate) with concomitant CAB administration. Refer to the current I nvestigator’s Brochure ( Section4.3.6.1 and Section 6.4) for additional information. Concurrent with RPV In addition, participants must discontinue the following (or change to an a llowable alternative) while receiving treatment with oral RPV: proton pump inhibitors, such as esomeprazole, lansoprazole, omeprazole, pantoprazole, rabeprazole; 2019N406358_00"
114,page_114,"2017N326521_02 CONFIDENTIA L 207966 115systemic dexamethasone (more than a single dose) If the participant cannot discontinue use or change to an allowable alternative while receiving treatment with RPV, the participant should not be randomized into the study . 6.13.2.2. Concurrent with either CA B LA or RPV LA In addition, for participants receiving CAB LA and RPV L A, use of anticoagulation agentsfor greater than 14 day s is prohibited, with the exception of the use of anticoagulation for deep vein thrombosis (DVT)prophylaxis (e.g., postoperative DVT prophylaxis) or the use of low dose acet ylsalicylic acid (≤325mg). Systemic anticoagulation (including proph ylaxis doses) on the day of an IM injection should be avoided. Note: Any prohibited medications that decrease cabotegravir or rilpivirine concentrations should be discontinued for a minimum of four weeks or a minimum of three half -lives (whichever is longer) prior to the first dose and any other prohibited medications should be discontinued for a minimum of two weeks or a minimum of three half -lives (whichever is longer) prior to the first dose. 6.13.2.3. Prohibited Medications for Participants Receiving HAART during the Long-Term Follo w-Up Phase For participants taking HA ARTduring the Long- Term Follow -Up Phase , refer to local prescribing information for details regarding concurrent therapies. 7. STUDY A SSESSMENTS A ND PROCEDURES Protocol waivers or exemption s are not allowed with the exception of immediate safety concerns. Therefore, adherence to the stud y design requirements, including those specified in the Time and Events Table, are essential and required for stud y conduct. This section lists the procedure s and parameters of each planned study assessment. The exact timing of each assessment is listed in the Time and Events Table (Section 7.1). The following points must be noted: If assessments are scheduled for the same nominal time, THEN the assessments should occur in the following order: 1. 12-lead ECG 2.vital signs 3.blood draws Note: The timing of the assessments should allow the blood draw to occur at the exact nominal time. The timing and number of planned stu dy assessments, including safet y, pharmacokinetic, pharmacody namic/biomarker assessments may be altered during the course of the study based on newl y available data (e.g., to obtain data 2019N406358_00"
115,page_115,"2017N326521_02 CONFIDENTIA L 207966 116closer to the time of peak plasma concentrations) to ensure appropria te monitoring. The IRB/IEC will be informed of any safety issues that require alteration of the safety monitoring scheme or amendment of the Informed Consent Form. 7.1. Time and Events Table Note: While some assessments included in the Time and Events Table are conducted less frequently following the primary endpoint (Week 48), IM injections for participants during the Extension Phase will continue to be administered Q4W or Q8W based on original study randomization assignment. All patients will be randomized at Day 1 to initiate either Q4 weekl y or Q8 weekl y administration of I M CAB LA + RPV LA. Only participants randomized from oral SOC treatment will participate in the Day 1 to Week 4 Oral CAB + Oral RPV lead -in treatment. 2019N406358_00"
116,page_116,2017N326521_02 CONFIDENTIA L 207966 1177.1.1. Time and Events Table for CA B LA+ RPV LA Q4 Weekly Administration Procedure Screening Visit aMaintenance Phase Extension Phase Withdrawal Assesssmentsy Long-Term Follow-up zDay 1WeekWeek 4A (Oral Lead- in ONLY)b Week 4B 8 12 16 20 24 28 32 36 40 44 48 52 Q4W 56-92 Q8W 56-92 96 100Q4W After Wee k 100Q8W After Week 96 Written informed consentX Eligibility Verification (Inclusion/E xclusion Criteria)X XcXc Randomization X Demography X Medical HistorydX Cardiovascular risk assessmentdXX Medication History/ Prior ART historyX Syphilis serology + Reflex Rapid Plasma Reagin (RPR)XX 2019N406358_00
117,page_117,"2017N326521_02 CONFIDENTIA L 207966 118Procedure Screening Visit aMaintenance Phase Extension Phase Withdrawal Assesssmentsy Long-Term Follow-up zDay 1WeekWeek 4A (Oral Lead- in ONLY)b Week 4B 8 12 16 20 24 28 32 36 40 44 48 52 Q4W 56-92 Q8W 56-92 96 100Q4W After Wee k 100Q8W After Week 96 Symptom Directed Physical Exam and Medical AssessmenteXXXXXXXXXXXXXXXXXXXXXXXX Weight, Height and BMIfX X X X Vital Signs: BP, HR, Temperature)gXX X X X 12-lead ECG h (triplicate at Day 1 pre-dose)XX X X X CDC HIV-1 stageXX HIV Associated ConditionsXXXXXXXXXXXXXXXXXXXXXXX AEs, SAEs, Concomitant MedicationsiXXXXXXXXXXXXXXXXXXXXXXXX 2019N406358_00"
118,page_118,2017N326521_02 CONFIDENTIA L 207966 119Procedure Screening Visit aMaintenance Phase Extension Phase Withdrawal Assesssmentsy Long-Term Follow-up zDay 1WeekWeek 4A (Oral Lead- in ONLY)b Week 4B 8 12 16 20 24 28 32 36 40 44 48 52 Q4W 56-92 Q8W 56-92 96 100Q4W After Wee k 100Q8W After Week 96 ISR Assessment for IM injectionsX XXXXXXXXXXXXXXXXXXX X X Columbia Suicide Severity Rating Scale (eC-SSRS)jX X X X X X X X X XX X Clinical chemistry and HematologyX X X X X X X X X X XXX X X X Pregnancy TestingkS U S U S U S U S U S US U S S USSSU S S S HIV-1 RNA and sample for storage (S)lX X X X X X X X X X S XXS X X X CD4+ cell countX X X X X X X X X XX XX X CD8+ cell countX X X X X UrinalysismXX X X X X 2019N406358_00
119,page_119,"2017N326521_02 CONFIDENTIA L 207966 120Procedure Screening Visit aMaintenance Phase Extension Phase Withdrawal Assesssmentsy Long-Term Follow-up zDay 1WeekWeek 4A (Oral Lead- in ONLY)b Week 4B 8 12 16 20 24 28 32 36 40 44 48 52 Q4W 56-92 Q8W 56-92 96 100Q4W After Wee k 100Q8W After Week 96 Fasting Lab Assessment : Glucose, Cholesterol (Total, HDL and LDL) and TriglyceridesnX X X Xo Hepatitis B (HBsAg), Anti-HBc, and Anti- HBsAG, Hepatitis C (anti-HCV Ab)X PT/PTT/INR XX PBMCspX X X X Genetics sampleq X PK samplingr (S)=Storage onlyXXSXSXSXSXSXSSSXS X S 2019N406358_00"
120,page_120,2017N326521_02 CONFIDENTIA L 207966 121Procedure Screening Visit aMaintenance Phase Extension Phase Withdrawal Assesssmentsy Long-Term Follow-up zDay 1WeekWeek 4A (Oral Lead- in ONLY)b Week 4B 8 12 16 20 24 28 32 36 40 44 48 52 Q4W 56-92 Q8W 56-92 96 100Q4W After Wee k 100Q8W After Week 96 Oral CAB and Oral RPV Dispensatio nsXX IP accountability (Pill Counts )sXX IM treatment administratio n when transitioning from SOCtX X X X X X X X XXXXXXXXXX X IM treatment administration when transitioning from CAB + RPV LA Q4WX XX X X X X X X XXXXXXXXXX X Patient Rep orted Outcom esu HAT-QoL (short-form)X X X X HIV TSQs X X X X HIV TSQcvX X ACCEPTX X X X 2019N406358_00
