,PageNo,Text78,page_78,"Emicizumab F. Hoffmann -La Roche Ltd 78/Protocol BO39182, Version 3 5.3.5.3 Adverse Events That Are Secondary to Other Events In general, adverse events that are secondary to other events (e.g., cascade events or clinical sequelae) should be identified by their primary cause, with the exception of severe or serious secondary events. A medically significant secondary adverse event that is separated in time from the initiating event should be recorded as an independent event on the Adverse Event eCRF. For example: • If vomiting results in mild dehydration with no additional treatment in a healthy adult, only vomiting should be reported on the eCRF. • If vomiting results in severe dehydration, both events should be reported separately on the eCRF. • If a severe gastrointestinal hemorrhage leads to renal failure, both events should be reported separately on the eCRF. • If dizziness leads to a fall and consequent fracture, all three events should be reported separately on the eCRF. • If neutropenia is accompanied by an infection, both events should be reported separately on the eCRF. All adverse events should be recorded separately on the Adverse Event eCRF if it is unclear as to whether the events are associated. 5.3.5.4 Persistent or Recurrent Adverse Events A persistent adverse event is one that extends continuously, without resolution, between patient evaluation timepoints. Such events should only be recorded once on the Adverse Event eCRF. The initial severity (intensity or grade) of the event will be recorded at the time the event is first reported. If a persistent adverse event becomes more severe, the most extreme severity should also be recorded on the Adverse Event eCRF. If the event becomes serious, it should be reported to the Sponsor immediately (i.e., no more than 24 hours after learning that the event became serious; see Section 5.4.2 for reporting instructions). The Adverse Event eCRF should be updated by changing the event from ""non-serious"" to ""serious,"" providing the date that the event became serious, and completing all data fields related to serious adverse events. A recurrent adverse event is one that resolves between patient evaluation timepoints and subsequently recurs. Each recurrence of an adverse event should be recorded as a separate event on the Adverse Event eCRF. 5.3.5.5 Abnormal Laboratory Values Not every laboratory abnormality qualifies as an adverse event. A laboratory test result must be reported as an adverse event if it meets any of the following criteria: • Is accompanied by clinical symptoms • Results in a change in study treatment (e.g., dosage modification, treatment interruption, or treatment discontinuation)"
79,page_79,"Emicizumab F. Hoffmann -La Roche Ltd 79/Protocol BO39182, Version 3 • Results in a medical intervention (e.g., potassium supplementation for hypokalemia) or a change in concomitant therapy • Is clinically significant in the investigator’s judgment It is the investigator’s responsibility to review all laboratory findings. Medical and scientific judgment should be exercised in deciding whether an i solated laboratory abnormality should be classified as an adverse event. If a clinically significant laboratory abnormality is a sign of a disease or syndrome (e.g., alkaline phosphatase and bilirubin 5 × ULN associated with cholestasis), only the diagnosis (i.e., cholestasis) should be recorded on the Adverse Event eCRF. If a clinically significant laboratory abnormality is not a sign of a disease or syndrome, the abnormality itself should be recorded on the Adverse Event eCRF, along with a descriptor indicating whether the test result is above or below the normal range (e.g., ""elevated potassium,"" as opposed to ""abnormal potassium""). If the laboratory abnormality can be characterized by a precise clinical term per standard definitions, the clinical term should be recorded as the adverse event. For example, an elevated serum potassium level of 7.0 mEq/L should be recorded as ""hyperkalemia."" Observations of the same clinically significant laboratory abnormality from visit to visit should only be recorded once on the Adverse Event eCRF (see Section 5.3.5.4 for details on recording persistent adverse events). 5.3.5.6 Abnormal Vital Sign Values Not every vital sign abnormality qualifies as an adverse event. A vital sign result must be reported as an adverse event if it meets any of the following criteria: • Is accompanied by clinical symptoms • Results in a change in study treatment (e.g., dosage modification, tr eatment interruption, or treatment discontinuation) • Results in a medical intervention or a change in concomitant therapy • Is clinically significant in the investigator’s judgment It is the investigator’s responsibility to review all vital sign findings. Medical and scientific judgment should be exercised in deciding whether an isolated vital sign abnormality should be classified as an adverse event. If a clinically significant vital sign abnormality is a sign of a disease or syndrome (e.g., high blood pressure), only the diagnosis (i.e., hypertension) should be recorded on the Adverse Event eCRF. Observations of the same clinically significant vital sign abnormality from visit to visit should only be recorded once on the Adverse Event eCRF (see Section 5.3.5.4 for details on recording persistent adverse events)."
80,page_80,"Emicizumab F. Hoffmann -La Roche Ltd 80/Protocol BO39182, Version 3 5.3.5.7 Abnormal Liver Function Tests The finding of an elevated ALT or AST ( > 3 × baseline value) in combination with either an elevated total bilirubin ( > 2 × ULN) or clinical jaundice in the absence of cholestasis or other causes of hyperbilirubinemia is considered to be an indicator of severe liver injury (as defined by Hy's law). Therefore, investigators must report as an adverse event of special interest the occurrence of either of the following: • Treatment-emergent ALT or AST > 3 × baseline value in combination with total bilirubin > 2 × ULN (of which ≥ 35% is direct bilirubi n) • Treatment-emergent ALT or AST > 3 × baseline value in combination with clinical jaundice in the absence of cholestasis or other cause of hyperbilirubinemia The most appropriate diagnosis or (if a diagnosis cannot be established) the abnormal laborator y values should be recorded on the Adverse Event eCRF (see Section 5.3.5.2) and reported to the Sponsor immediately (i.e., no more than 24 hours after learning of the event), either as a serious adverse event or an adverse event of special interest (see Section 5.4.2). 5.3.5.8 Deaths All deaths that occur during the protocol -specified adverse event reporting period (see Section 5.3.1), regardless of relationship to study drug, must be recorded on the Adverse Event eCRF and immediately reported to the Sponsor (see Section 5.4.2). This includes death attributed to progression of hemophilia A. Death should be considered an outcome and not a distinct event. The event or condition that caused or contributed to the fatal outcome should be recorded as the single medical concept on the Adverse Event eCRF. Generally, only one such event should be reported. If the cause of death is unknown and cannot be ascertained at the time of reporting, ""unexplained death"" should be recorded on the Adverse Event eCRF. If the cause of death later becomes available (e.g., after autopsy), ""unexplained death"" should be replaced by the established cause of death. The term ""sudden death"" should not be used unless combined with the presumed cause of death (e.g., ""sudden cardiac death""). If the death is attributed to progression of hemophilia A, ""hemophilia A progression"" should be recorded on the Adverse Event eCRF. 5.3.5.9 Preexisting Medical Conditions A preexisting medical condition is one that is present at the screening visit for this study. Such conditions should be recorded on the General Medical History and Baseline Conditions eCRF."
81,page_81,"Emicizumab F. Hoffmann -La Roche Ltd 81/Protocol BO39182, Version 3 A preexisting medical condition should be recorded as an adverse event only if the frequency, severity, or character of the condition worsens during the study. When recording such events on the Adverse Event eCRF, it is important to convey the concept that the preexisting condition has changed by including applicable descriptors (e.g., ""more frequent headaches""). 5.3.5.10 Lack of Efficacy or Worsening of Hemophilic Bleeds At any time during the study an unexpected worsening of hemophilia-related bleeding, as judged by the investigator, should be recorded as an adverse event; for example, increased severity (e.g., increased number of coagulation factor doses required to stop bleeds compared with before study entry) or frequency of bleeds. Hemophilia worsening should be documented as an adverse event on the Adverse Event eCRF, conveying that the underlying condition has changed by including applicable descriptors (e.g., ""increased clinical severity of hemophilia""). A clinically significant bleed (i.e., intracranial, retroperitoneal) does not by itself constitute loss of efficacy, unless it is associated with features indicating worsening of the underlying hemophilia phenotype. Events that are clearly consistent with the expected pattern of the underlying disease should not be recorded as adverse events. These data will be reflected in efficacy assessment data only. 5.3.5.11 Hospitalization or Prolonged Hospitalization Any adverse event that results in hospitalization (i.e., in-patient admission to a hospital) or prolonged hospitalization should be documented and reported as a serious adverse event (per the definition of serious adverse event in Section 5.2.2), except as outlined below. An event that leads to hospitalization under the following circumstances should not be reported as an adverse event or a serious adverse event: • Hospitalization for respite care • Planned hospitalization required by the protocol (e.g., for study drug administration or insertion of access device for study drug administration) • Hospitalization for a preexisting condition, provided that all of the following criteria are met: The hospitalization was planned prior to the study or was scheduled during the study when elective surgery became necessary because of the expected normal progression of the disease The patient has not experienced an adverse event An event that leads to hospitalization under the following circumstances is not considered to be a serious adverse event, but should be reported as an adverse event instead: • Hospitalization that was necessary because of patient requirement for outpatient care outside of normal outpatient clinic operating hours"
82,page_82,"Emicizumab F. Hoffmann -La Roche Ltd 82/Protocol BO39182, Version 3 5.3.5.12 Adverse Events Associated with an Overdose or Error in Drug Administration An overdose is the accidental or intentional use of a drug in an amount higher than the dose being studied. An overdose or incorrect administration of study treatment is not itself an adverse event, but it may result in an adverse event. All adverse events associated with an overdose or incorrect administration of study drug should be recorded on the Adverse Event eCRF. If the associated adverse event fulfills seriousness criteria, the event should be reported to the Sponsor immediately (i.e., no more than 24 hours after learning of the event; see Section 5.4.2). No safety data related to overdosing or drug administration error of emicizumab are available, as no such instances have been observed to date. To minimize the risk of errors associated with future home administration of emicizumab, data related to medication errors with observed patient/caregivers administration of emicizumab at the site by the investigator and/or clinical staff will be recorded and corrected at the time of occurrence. 5.3.5.13 Patient-Reported Outcome Data Adverse event reports will not be derived from PRO data by the Sponsor, and safety analyses will not be performed using PRO data. However, if any PRO responses suggestive of a possible adverse event are identified during site review of the PRO data, the investigator will determine whether the criteria for an adverse event have been met and, if so, will report the event on the Adverse Event eCRF. 5.4 IMMEDIATE REPORTING REQUIREMENTS FROM INVESTIGATOR TO SPONSOR Certain events require immediate reporting to allow the Sponsor to take appropriate measures to address potential new risks in a clinical study. The investigator must report such events to the Sponsor immediately; under no circumstances should reporting take place more than 24 hours after the investigator learns of the event. The following is a list of events that the investigator must report to the Sponsor within 24 hours after learning of the event, regardless of relationship to study drug: • Serious adverse events (see Section 5.4.2 for further details) • Adverse events of special interest (see Section 5.4.2 for further details) • Pregnancies (see Section 5.4.3 for further details) The investigator must report new significant follow-up information for these events to the Sponsor immediately (i.e., no more than 24 hours after becoming aware of the information). New significant information includes the following: • New signs or symptoms or a change in the diagnosis • Significant new diagnostic test results • Change in causality based on new information"
83,page_83,"Emicizumab F. Hoffmann -La Roche Ltd 83/Protocol BO39182, Version 3 • Change in the event’s outcome, including recovery • Additional narrative information on the clinical course of the event Investigators must also comply with local requirements for reporting serious adver se events to the local health authority and Institutional Review Board (IRB)/Ethics Committee (EC). 5.4.1 Emergency Medical Contacts Medical Monitor Contact Information for all sites Medical Monitor , Ph.D. Telephone No.: Mobile Telephone No.: Roche M edi cal Responsible: , M.D. Telephone No.: Mobile Telephone No.: To ensure t he s afety of study patients, an Emergency Medical Call Center Help Desk will access the Roche Medi cal Emergency List, escalate emergency medical calls, provide medical translation service (if necessary), connect the investigator with a Roche Medical Responsible (listed above and/or on the Roche Medical Emergency List), and track all calls. The Emergency Medical Call Center Help Desk will be available 24 hours per day, 7 days per week. Toll -free numbers for the Help Desk, as well as Medical Monitor and Medical Responsible contact information, will be distributed to all investigators. 5.4.2 Reporting Requirements for Serious Adverse Events and Adverse Events of Special Interest 5.4.2.1 Events That Occur prior to Study Drug Initiation After informed consent has been obtained but prior to initiation of study drug, only serious adverse events caused by a protocol -mandated intervention should be reported. The Serious Adverse Event/Adverse Event of Special Interest Reporting Form provided to investigators should be completed and submitted to the Sponsor or its designee immediately (i.e., no more than 24 hours after learning of the event), either by faxing or by scanning and e-mailing the form with use of the fax number or e-mail address provided to investigators. 5.4.2.2 Events That Occur after Study Drug Initiation After initiation of study drug, serious adverse events and adverse events of special interest will be reported until 24 weeks after the last dose of study drug. Investigators should record all case details that can be gathered immediately (i.e., within 24 hours after learning of the event) on the Adverse Event eCRF and submit the report via the electronic data capture (EDC) system. A report will be generated and sent to Roche Safety Risk Management by the EDC system."
84,page_84,"Emicizumab F. Hoffmann -La Roche Ltd 84/Protocol BO39182, Version 3 In the event that the EDC system is unavailable, the Serious Adverse Event/Adverse Event of Special Interest Reporting Form provided to investigators should be completed and submitted to the Sponsor or its designee immediately (i.e., no more than 24 hours after learning of the event), either by faxing or by scanning and e-mailing the form with use of the fax number or e-mail address provided to investigators. Once the EDC system is available, all information will need to be entered and submitted via the EDC system. Instructions for reporting post-study adverse events are provided in Section 5.6. 5.4.3 Reporting Requirements for Pregnancies 5.4.3.1 Pregnancies in Female Patients Female patients of childbearing potential will be instructed to immediately inform the investigator if they become pregnant during the study or within 24 weeks after the last dose of study drug. A Clinical Trial Pregnancy Reporting Form should be completed and submitted to the Sponsor or its designee immediately (i.e., no more than 24 hours after learning of the pregnancy), either by faxing or by scanning and e-mailing the form with use of the fax number or e-mail address provided to investigators. Pregnancy should not be recorded on the Adverse Event eCRF. The investigator should discontinue study drug and counsel the patient, discussing the risks of the pregnancy and the possible effects on the fetus. Monitoring of the patient should continue until conclusion of the pregnancy. Any serious adverse events associated with the pregnancy (e.g., an event in the fetus, an event in the mother during or after the pregnancy, or a congenital anomaly/birth defect in the child) should be reported on the Adverse Event eCRF. In addition, the investigator will submit a Clinical Trial Pregnancy Reporting Form when updated information on the course and outcome of the pregnancy becomes available. 5.4.3.2 Pregnancies in Female Partners of Male Patients Although embryo-fetal development studies are not available, condom use will not be required in male patients enrolled in the study because the margin between the minimal anticipated biological effect level (MABEL) plasma concentration (7 ng/mL) and the estimated maternal C max (at both 1.5 and 3 mg/kg QW dosing regimens) is greater than 10-fold ( Banholzer et al. 2012). At this time, very little emicizumab is thought to tr ansfer into semen, and there are no known reproductive risks to female partners of male patients treated with emicizumab, so contraception use by male patients is not required for participation in the study. Therefore, no proactive collection of pregnancy information for female partners of male patients treated with emicizumab will be required. 5.4.3.3 Abortions Any abortion should be classified as a serious adverse event (as the Sponsor considers abortions to be medically significant), recorded on the Adverse Event eCRF, and reported to the Sponsor immediately (i.e., no more than 24 hours after learning of the event; see Section 5.4.2)."
85,page_85,"Emicizumab F. Hoffmann -La Roche Ltd 85/Protocol BO39182, Version 3 5.4.3.4 Congenital Anomalies/Birth Defects Any congenital anomaly/birth defect in a child born to a female patient exposed to study drug should be classified as a serious adverse event, recorded on the Adverse Event eCRF, and reported to the Sponsor immediately (i.e., no more than 24 hours after learning of the event; see Section 5.4.2). 5.5 FOLLOW -UP OF PATIENTS AFTER ADVERSE EVENTS 5.5.1 Investigator Follow -Up The investigator should follow each adverse event until the event has resolved to baseline grade or better, the event is assessed as stable by the investigator, the patient is lost to follow -up, or the patient withdraws consent. Every effort should be made to follow all serious adverse events considered to be related to study drug or study -related procedures until a final outcome can be reported. During the study period, resolution of adverse events (with dates) should be documented on the Adverse Event eCRF and in the patient’s medical record to facilitate source data verification. All pregnancies reported during the study should be followed until pregnancy outcome. 5.5.2 Sponsor Follow -Up For serious adverse events, adverse events of special interest, and pregnancies, the Sponsor or a designee may follow up by telephone, fax, electronic mail, and/or a monitoring visit to obtain additional case details and outcome information (e.g., from hospital discharge summaries, consultant reports, autopsy reports) in order to perform an independent medical assessment of the reported case. 5.6 ADVERSE EVENTS THAT OCCUR AFTER THE ADVERSE EVENT REPORTING PERIOD The Sponsor should be notified if the investigator becomes aware of any serious adverse event that occurs after the end of the adverse event reporting period (defined as 24 weeks after the last dose of study drug or rollover to an extension study), if the event is believed to be related to prior study drug treatment. These events should be reported through use of the Adverse Event eCRF. However, if the EDC system is not available, the investigator should report these events directly to the Sponsor or its designee, either by faxing or by scanning and e-mailing the Serious Adverse Event/Adverse Event of Special Interest Reporting Form with use of the fax number or e-mail address provided to investigators."
86,page_86,"Emicizumab F. Hoffmann -La Roche Ltd 86/Protocol BO39182, Version 3 5.7 EXPEDITED REPORTING TO HEALTH AUTHORITIES, INVESTIGATORS, INSTITUTIONAL REVIEW BOARDS, AND ETHICS COMMITTEES The Sponsor will promptly evaluate all serious adverse events (see Section 5.2.2) and adverse events of special interest (see Section 5.2.3) against cumulative product experience to identify and expeditiously communicate possible new safety findings to investigators, IRBs, ECs, and applicable health authorities based on applicable legislation. To determine reporting requirements for single adverse event cases, the Sponsor will assess the expectedness of these events using the following reference document: • RO5534262 (Emicizumab) Investigator's Brochure The Sponsor will compare the severity of each event and the cumulative event frequency reported for the study with the severity and frequency reported in the applicable reference document. Reporting requirements will also be based on the investigator's assessment of causality and seriousness, with allowance for upgrading by the Sponsor as needed. 6. STATISTICAL CONSIDERATIONS AND ANALYSIS PLAN No formal hypothesis testing is planned for this study. All analyses will be descriptive. The 6 run-in patients will be analyzed separately from the expansion cohort. 6.1 DETERMINATION OF SAMPLE SIZE The sample size of 6 patients for the PK run-in cohort is considered appropriate to assess pharmacokinetics and safety to allow for an informed decision to open the subsequent expansion cohort with 40 additional patients. The overall sample size of 40 patients in the expansion cohort is based primarily on clinical considerations taking into account the limited number of patients with hemophilia A. A sample size of 40 patients is expected to provide statistically robust point estimates with meaningfully narrow confidence intervals. 6.2 SUMMARIES OF CONDUCT OF STUDY The number of patients who enroll, discontinue, or complete the study will be summarized. Reasons for premature study withdrawal will be listed and summarized. Enrollment and major protocol deviations will be listed and evaluated for their potential effects on the interpretation of study results."
87,page_87,"Emicizumab F. Hoffmann -La Roche Ltd 87/Protocol BO39182, Version 3 6.3 SUMMARIES OF DEMOGRAPHIC AND BASELINE CHARACTERISTICS Demographic and baseline characteristics (including age, sex, etc.) will be summarized using means, standard deviations, medians, and ranges for continuous variables and proportions for categorical variables, as appropriate. 6.4 EFFICACY ANALYSES The efficacy objective is to evaluate the clinical effect of 6 mg/kg emicizumab Q4W based on the number of bleeds over time. 6.4.1 Efficacy Endpoints The key efficacy objective is to characterize the efficacy of 6 mg/kg emicizumab Q4W based on the number of bleeds over time for patients in the expansion cohort. The analyses will be performed using a negative binomial regression model, which accounts for different follow-up times, with the patient’s number of bleeds as a function of the time that each patient stays in the study included as an offset in the model. The number of bleeds will be also annualized (Annualized Bleeding RateABR) for each patient using the following formula: In case the negative binomial model does not converge the above formula will be used as the sole method of analysis. The clinical effect of prophylactic emicizumab on the number of bleeds, joint bleeds, target joint bleeds, spontaneous bleeds and all bleeds (i.e., those treated and untreated with coagulation factors) over time will be evaluated (see Section 2.2.1). The number of bleeds, sites of bleeds, and types of bleeds will be summarized for all patients and listed for each patient individually. Several exploratory analyses will be conducted to characterize the type, location, duration, frequency, and pattern of bleeds. For continuous endpoints, descriptive statistics will be calculated and categorical endpoints will be characterized through frequency tables. The primary final analysis will be performed 24 weeks after the last enrolled patient started treatment or has withdrawn prematurely, whichever occurs first. A detailed description of the statistical methods that will be used for the efficacy analyses will be provided in the Statistical Analysis Plan."
