,PageNo,Text78,page_78,"Talazoparib C3441006 (MDV3800 -06) Protocol Amendment 4, 15 Nov 2018 PFIZER CONFIDENTIAL Page 798.ADVERSE EVENT REPORT ING 8.1.Requirements The table below summarizes the requirements for recording safet y events on the CRF and for reporting safety events on the Clinical Trial (CT) Serious Adverse Event (SAE) Report Form to Pfizer Sa fety. These requirements are delineated for 3 types of events: (1) SAEs; (2) non-serious adverse events (AEs); and (3) exposure to the investigational product under study during pregnancy or breastfeeding, and occupational exposure. Safety Event Recorded on the CRF Reported on the CT SAE Report Form to Pfizer Safety Within 24Hours of Awareness SAE All All Non-serious AE All None Exposure to the investigational product under study during pregnancy or breastfeeding, and occupational exposureAll (regard less of whether associated with an AE), except occupational exposureExposure during pregnancy, exposure via breastfeeding, occupational exposure (regardless of whether associated with an AE) All observed or volunteered events regardless of treatment group or suspected causal relationship to the investigational product(s) w ill be reported as described in the following paragraphs. Events listed in the table above that require reporting to Pfizer Safet y on the CT SAE Report Form within 24 hours of awareness of the event by the investigator are to be reported regardless of whether the event is determined by the investigator to be related to an investigational product under study . Inparticular, if the SAE is fatal or life -threatening, notification to Pfizer S afety must be made immediately , irrespective of the extent of available event information. This time frame also applies to additional new (follow -up) information on previously forwar ded reports. I n the rare situation that the investigator does not become immediately aware of the occurrence of an event, the investigator must report the event within 24 hours after learning of it and document the time of his/her first awareness of the event. For each event, the investigator must pursue and obtain adequate in formation both to determine the outcome and to assess whether it meets the criteria for classification as an SAE (see the Serious Adverse Events section below). In addition, the investigator may be requested b y Pfizer Safety to obtain specific follow -up information in an expedited fashion. This information is more detailed than that recorded on the CRF . In general, this will include a description of the event in sufficient detail to allow for a complete medical a ssessment of the case and independent determination of possible causalit y. An y information relevant to the event, such as concomitant medications and illnesses, must be provided. I n the case of a patient death, a summary of available autopsy findings mus t be submitted as soon as possible to Pfizer Safety . An y pertinent additional information must be reported on the CT SAE Report Form; additional source documents (eg, medical records, CRF, laboratory data) are to be sent to Pfizer Safet y ONLY upon request ."
79,page_79,"Talazoparib C3441006 (MDV3800 -06) Protocol Amendment 4, 15 Nov 2018 PFIZER CONFIDENTIAL Page 80As part of ongoing safet y reviews conducted b y the sponsor, an y non -serious AE that is determined b y the sponsor to be serious will be reported by the sponsor as an SAE. To assist in the determination of case seriousness, further information may be requested from the investigator to provide clarity and understanding of the event in the context of the clinical study . 8.1.1. Additional Details On Recording Adverse Events on the CRF All events detailed in the table above will be recorded on the AE page(s) of the C RF. I t should be noted that the CT SAE Report Form for reporting of SAE information is not the same as the AE page of the CRF. When the same data are collected, the forms must be completed in a consistent manner. AEs should be recorded using concise med ical terminology and the same AE term should be used on both the CRF and the CT SAE Report Form for reporting of SAE information. 8.1.2. Eliciting Adverse Event Information The investigator is to record on the CRF all directly observed AEs and all AEs spontaneous ly reported b y the stud y patient/legally acceptable representative. In addition, each stud y patient/legall y acceptable representative will be questioned about the occurrence of AEs in a non-leading manner. 8.1.3. Withdrawal From the Study Due to Adverse Events ( see also the Permanent Treatment Discontinuation Section) Withdrawal due to AEs should be distinguished from withdrawal due to other causes, according to the definition of AE noted below, and recorded on the CRF. When a patient withdraws from the study or treatment because of an SAE, t he SAE must be recorded on the CRF and reported, as appropriate, on the CT SAE Report Form, in accordance with the Requirements section above . 8.1.4. Time Period for Collecting AE/SAE Information The time period for actively eliciting and collecting AEs and SAEs (“active collection period”) for each patient begins from the time the patient provides informed consent, which is obtained before the patien t’s participation in the study (ie,before undergoing an y study -related procedure and/or receiving investigational product), through and including a minimum of 28 calendar days after the last administration of the investigational product . A different repor ting period applies only to pa tients who sign the molecular prescreening consent as described in Section 8.4.5 . For patients who are screen failures, the active collection perio d ends when screen failure status is determined."
80,page_80,"Talazoparib C3441006 (MDV3800 -06) Protocol Amendment 4, 15 Nov 2018 PFIZER CONFIDENTIAL Page 818.1.4.1. Reporting SAEs to Pfizer Safety All SAEs occurring in a patient during the active collection period are reported to Pfizer Safet y on the CT SAE Report Form as of signing of the main informed consent document (ICD)at screening . SAEs occurring in a patient after the active collection period has ended are reported to Pfizer Safety if the investigator becomes awar e of them; at a minimum, all SAEs that the investigator believes have at least a reasonable possibil ity of being related to investigational product must be reported to Pfizer Safety .All SAEs of my elodysplastic s yndrome (MDS) or acute m yeloid leukemia (AML) are to be reported to Pfizer Safety irrespective of investigator’s opinion of causality or time o f diagnosis . Follow up by the investigator continues throughout and after the active collection period and until the event or its sequelae resolve or stabilize at a level acceptable to the investigator, and Pfizer concurs with that assessment. If a patient begins a new anticancer therapy , SAEs occurring during the above -indicated active collection period must still be reported to Pfizer Safety irrespective of any intervening treatment. 8.1.4.2. Recording Non -serious AEs and SAEs on the CRF During the active collecti on period, both non -serious AEs and SAEs are recorded on the CRF. Follow -up by the investigator may be required until the event or its sequelae resolve or stabilize at a level acceptable to the investigator, and Pfizer concurs with that assessment. If a pa tient begins a new anticancer therapy , the recording period for non-serious AEs ends at the time the new treatment is started; however, SAEs must continue to be recorded on the CRF during the above -indicated active collection period. 8.1.5. Causality Assessment The investigator’s assessment of causalit y must be provided for all AEs (serious and non-serious); the investigator must record the causal relationship on the CRF, and report such an assessment in accordance with the SAE reporting requirements, if applicabl e. An investigator’s causalit y assessment is the determination of whether there exists a reasonable possibility that the investigational product caused or contributed to an AE; generall y the facts (evidence) or arguments to suggest a causal relationship s hould be provided. If the investigator does not know whether or not the investigational product caused the event, then the event will be handled as “related to investigational product” for reporting purposes, as defined b y the sponsor. If the investigato r's causality assessment is “unknown but not related” to investigational product, this should be clearl y documented on study records."
81,page_81,"Talazoparib C3441006 (MDV3800 -06) Protocol Amendment 4, 15 Nov 2018 PFIZER CONFIDENTIAL Page 82In addition, if the investigator determines that an SAE is associated with study procedures, the investigator must record this causal relationship in the source documents and CRF, and report such an assessment in the dedicated section of the CT SAE Report Form and in accordance with the SAE reporting requirements. 8.1.6. Sponsor’s Reporting Requirements to Regulatory Authorities AEreporting, including suspected unexpected serious adverse reactions, will be carried out in accordance with applicable local regulations. 8.2.Definitions 8.2.1. Adverse Events An AE is an y untoward medical occurrence in a study patient administered a product or medi cal device; the event need not necessaril y have a causal relationship with the treatment or usage. Examples of AEs include, but are not limited to: Abnormal test findings; Clinically significant signs and sy mptoms; Changes in ph ysical examination findings; Hypersensitivity ; Drug abuse; Drug dependency . Additionally , AEs may include signs and s ymptoms resulting from: Drug overdose; Drug withdrawal; Drug misuse; Drug interactions; Extravasation; Exposure during p regnancy (EDP); Exposure via breastfeeding; Medication error; Occupational exposure."
82,page_82,"Talazoparib C3441006 (MDV3800 -06) Protocol Amendment 4, 15 Nov 2018 PFIZER CONFIDENTIAL Page 83Worsening of signs and symptoms of the malignancy under study should be recorded as AEs in the appropriate section of the CRF. Disease progression assessed b y measurement of malignant lesions on radiographs or other methods should not be reported as AEs. 8.2.2. Abnormal Test Findings Abnormal objective test findings should be recorded as AEs when an y of the following conditions are met: Test result is associated with accompan ying symptoms; and/or Test result requires addit ional diagnostic testing or medical/surgical intervention; and/or Test result leads to a change in stud y dosing (outside of an y protocol -specified dose adjustments) or discontinuation from the study , significant additional concomitant drug treatment, or ot her therapy ; and/or Test result is considered to be an AE b y the investigator or sponsor. Merel y repeating an abnormal test, in the absence of an y of the above conditions, does not constitute an AE. An y abnormal test result that is determined to be an err or does not require recording as an AE. 8.2.3. Serious Adverse Events A serious adverse event is any untoward medical occurrence at any dose that: Results in death; Is life -threatening (immediate risk of death); Requires inpatient hospitalization or prolongation of existing hospitalization; Results in persistent or significant disability /incapacity (substantial disruption of the ability to conduct normal life functions); Results in congenital anomaly /birth defect. Or that is considered to be: An important medical event. Medical and scientific judgment is exercised in determining whether an event is an important medical event. An important medical event may not be immediately life-threatening and/or result in death or hospitalization. However, if it is determined that the event may jeopardize the patient or may require intervention to prevent one of the other AE outcomes, the important medical event should be reported as serious."
83,page_83,"Talazoparib C3441006 (MDV3800 -06) Protocol Amendment 4, 15 Nov 2018 PFIZER CONFIDENTIAL Page 84Examples of such events are intensive treatment in an emergency room or at home for allergic bronchospasm; blood dy scrasias or convulsions that do not result in hospitalization; or development of drug dependency or drug abuse. Progression of the malignancy under stud y (including signs and s ymptoms of progression) should not be reported as a n SAE unless the outcome is fatal within the active collection period. Hospitalization due to signs and s ymptoms only of disease progression should not be reported as an SAE. If the malignancy has a fatal outcome during the study or within the active col lection period, then the event leading to death must be recorded as an AE on the CRF, and as an SAE with Common Terminology Criteria for Adverse Events (CTCAE, version 4.03) Grade 5 (see the Severit y Assessment section). 8.2.4. Hospitalization Hospitalization is defined as an y initial admission (even less than 24 hours) in a hospital or equivalent healthcare facility , or any prolongation of an existing admission. Admission also includes transfer within the hospital to an acute/intensive care unit (eg, from the psy chiatric wing to a medical floor, medical floor to a coronary care unit, or neurological floor to a tuberculosis unit). An emergency room visit does not necessarily constitute a hospitalization; however, the event leading to the emergency room visit is assessed for medical importance. Hospitalization does not include the following: Rehabilitation facilities; Hospice facilities; Respite care (eg, caregiver relief); Skilled nursing facilities; Nursing homes; Same -day surgeries (as outpatient/same -day/ambulatory procedures). Hospitalization or prolongation of hospitalization in the absence of a precipitating clinical AE is not in itself an SAE. Examples include: Admission for treatment of a preexisting condition not associated with the development of a new AE or with a worsening of the preexisting condition (eg, for workup of a persistent pretreatment laboratory abnormality ); Social admission (eg, patient has no place to sleep); Administrative admission (eg, for yearly physical examination);"
84,page_84,"Talazoparib C3441006 (MDV3800 -06) Protocol Amendment 4, 15 Nov 2018 PFIZER CONFIDENTIAL Page 85Protocol -specified admission during a stud y (eg, for a procedure required by the stud y protocol); Optional admission not associated with a precipitating clinical AE (eg, for elective cosmetic surgery ); Hospitalization for observati on without a medical AE; Preplanned treatments or surgical procedures. These should be noted in the baseline documentation for the entire protocol and/or for the individual patient; Admission exclusively for the administration of blood products. Diagnosti c and therapeutic noninvasive and invasive procedures, such as surgery , should not be reported as SAEs. However, the medical condition for which the procedure was performed should be reported if it meets the definition of an SAE. For example, an acute appendicitis that begins during the reporting period should be reported if the SAE requirements are met, and the resulting appendectomy should be recorded as treatment of the AE. 8.3.Severity Assessment The investigator will use the following definitions of seve rity in accordance with the current CTCAE version (4.03) to describe the maximum intensity of the adverse event. GRADE Clinical Description of Severit y 1 MILD adverse event 2 MODERATE adverse event 3 SEVERE adverse event 4 LIFE -THREATENING consequence s; urgent intervention indicated 5 DEATH RELATED TO adverse event Note the distinction between the severit y and the seriousness of an AE. A severe event is not necessarily an SAE. For example, a headache may be severe (interferes significantly with the patient's usual function) but would not be classified as serious unless it met one of the criteria for SAEs, listed above."
85,page_85,"Talazoparib C3441006 (MDV3800 -06) Protocol Amendment 4, 15 Nov 2018 PFIZER CONFIDENTIAL Page 868.4.Special Situations 8.4.1. Protocol -Specified Serious Adverse Events There are no protocol -specified SAEs in this study . All SAEs will be reported to Pfizer Safety by the investigator as described in previous sections, and will be handled as SAEs in the safet y database. 8.4.2. Potential Cases of Dr ug-Induced Liver Injury Humans exposed to a drug who show no sign of liver injury (as determined by elevations in transaminases) are termed “tolerators,” while those who show transient liver injury , but adapt are termed “adaptors.” In some patients, transaminase elevations are a harbinger of a more serious potential outcome. These patients fail to adapt and therefore are ""susceptible"" to progressive and serious liver injury , commonly referred to as drug -induced liver injury (DILI). Patients who experience a transaminase elevation above 3 times the upper limit of normal ( ×ULN) should be monitored more f requently to determine if they are an “adaptor” or are “susceptible.” In the majority of DILI cases, elevations in aspartate aminotransferase (AST) and/or alanine aminotransferase (ALT) precede total bilirubin (TBili) elevations (>2 × ULN) b y several days or weeks. The increase in TBili ty picall y occurs while AST/ALT is/are still elevated above 3 × ULN ( ie,AST/AL T and TBili values will be elevated within the same lab sample). In rare instances, b y the time TBili elevations are detected, AST/ALT values mi ght have decreased. This occurrence is still regarded as a potential DILI. Therefore, abnormal elevations in either AST OR ALT in addition to TBili that meet the criteria outlined below are considered potential DILI (assessed per Hy ’s law criteria) cases and should alway s be considered important medical events, even before all other possible causes of liver injury have been e xcluded. The threshold of laborator y abnormalities for a potential DILI case depends on the patient’s individual baseline values and underl ying conditions. Patients who present with the following laboratory abnormalities should be evaluated further as potential DILI (Hy ’s law) cases to def initivel y determine the etiology of the abnormal laboratory values: Patients with AST/AL T and TBi libaseline values within the normal range who subsequently present with AST OR ALT values >3 × ULN AND a TBili value >2× ULN with no evidence of hemol ysis and an alkaline phosphatase value <2×ULN or not available; For patients with baseline AST OR ALT ORTBili values above the ULN, the following threshold values are used in the definition mentioned above, as needed, depending on which values are above the ULN at baseline: Preexisting AST or ALT baseline values above the normal range: AST or ALT values > 2 times the baseline values AND >3 × ULN; or >8 ×ULN (whichever is smaller);"
86,page_86,"Talazoparib C3441006 (MDV3800 -06) Protocol Amendment 4, 15 Nov 2018 PFIZER CONFIDENTIAL Page 87Preexisting values of TBili above the normal range: TBili level increased from baseline value b y an amount of at least 1 × ULN orif the value reaches >3× ULN (whichever is sma ller). Rises in AST/AL T and TBili separated b y more than a few weeks should be assessed individually based on clinical judgment; any case where uncertainty remains as to whether it represents a potential Hy’s law case should be reviewed with the sponsor. The patient should return to the investigator site and be evaluated as soon as possible, preferably within 48 hours from awareness of the abnormal results. This evaluation should include laboratory tests, detailed history , and physical assessment. In add ition to repeating measurements of AST and AL T and TBili, laboratory tests should include albumin, creatine kinase (CK), direct and indirect bilirubin, gamma -glutam yl transferase (GGT), prothrombin time (PT)/international normalized ratio (INR), total bile acids, alkaline phosphatase and acetaminophen drug and/or protein adduct levels. Consideration should also be given to drawing a separate tube of clotted blood and an anticoagulated tube of blood for further testing, as needed, for further contemporaneou s analyses at the time of the recognized initial abnormalities to determine etiology . A detailed history , including relevant information, such as review of ethanol, acetaminophen (either b y itself or as a coformulated product in prescription or over -the-counter medications) , recreational drug, supplement (herbal) use and consumption, family history , sexual history , travel history , history of contact with a jaundiced person, surgery , blood transfusion, history of liver or allergic disease, and potential occupational exposure to chemicals, should be collected. Further testing for acute hepatitis A, B, C, D, and E infection and liver imaging (eg, biliary tract) may be warranted. All cases demonstrated on repeat testing as meeting the laboratory criteria of A ST/AL T and TBili elevation defined above should be considered potential DILI (Hy ’s law) cases if no other reason for the LFT abnormalities has yet been found. Such potential DILI (Hy’s law) cases are to be reported as SAEs, irrespective of availability of all the results of the investigations performed to determine etiology of the LFT abnormalities. A potential DILI (Hy ’s law) case becomes a confirmed case onl y after all results of reasonable investigations have been received and have excluded an alternat ive etiology . 8.4.3. Exposure to the Investigational Product During Pregnancy or Breastfeeding, and Occupational Exposure Although this study will be conducted exclusively in male patients, it is theoreticall y possible for female partners to be exposed to study drug during pregnancy . Exposure to the investigational product under study during pregnancy or breastfeeding and occupational exposure are reportable to Pfizer Safety within 24 hours of investigator awareness."
87,page_87,"Talazoparib C3441006 (MDV3800 -06) Protocol Amendment 4, 15 Nov 2018 PFIZER CONFIDENTIAL Page 888.4.3.1. Exposure During Pregnancy For both unapproved/ unlicensed products and for marketed products, an exposure during pregnancy (EDP) occurs if: A female becomes, or is found to be, pregnant either while receiving or having been exposed (eg, because of treatment or environmental exposure) to the investigati onal product; or the female becomes or is found to be pregnant after discontinuing and/or being exposed to the investigational product; An example of environmental exposure would be a case involving direct contact with a Pfizer product in a pregnant woman (eg, a nurse reports that she is pregnant and has been exposed to chemotherapeutic products); A male has been exposed (eg, because of treatment or environmental exposure) to the investigational product prior to or around the time of conception and/or is ex posed during his partner’s pregnancy ; If a patient or patient’s partner becomes or is found to be pregnant during the patient’s treatment with the investigational product, the investigator must report this information to Pfizer Safety on the CT SAE Report Form and an EDP supplemental form, regardless of whether an SAE has occurred. In addition, the investigator must submit information regarding environmental exposure to a Pfizer product in a pregnant woman (eg, a patient reports that she is pregnant and ha s been exposed to a cytotoxic product by inhalation or spillage) to Pfizer Safet y using the EDP supplemental form. This must be done irrespective of whether an AE has occurred and within 24 hours of awareness of the exposure. The information submitted should include the anticipated date of delivery (see below for information related to termination of pregnancy). Follow -up is conducted to obtain general information on the pregnancy and its outcome for all EDP reports with an unknown outcome. The investiga tor will follow the pregnancy until completion (or until pregnancy termination) and notify Pfizer Safet y of the outcome as a follow -up to the initial EDP supplemental form. In the case of a live birth, the structural integrit y of the neonate can be assess ed at the time of birth. In the event of a termination, the reason(s) for termination should be specified and, if clinically possible, the structural integrit y of the terminated fetus should be assessed by gross visual inspection (unless pre-procedure tes t findings are conclusive for a congenital anomal y and the findings are reported). If the outcome of the pregnancy meets the criteria for an SAE (ie, ectopic pregnancy , spontaneous abortion, intrauterine fetal demise, neonatal death, or congenital anomal y [in a live-born bab y, a terminated fetus, an intrauterine fetal demise, or a neonatal death]), the investigator should follow the procedures for reporting SAEs."
