,PageNo,Text23,page_23,"Connect -Home: Testing the Efficacy of Transitional Care of Patients and Caregivers during Transitions from Skilled Nursing Facilities to Home Version 2.0 Protocol 13 July 2020 Connect -Home Protocol v 2.0 13Jul2020 23 virtually (using an iPad) about participating in the st udy. The study team will also mail reminder letters to patients and caregivers one week before 30 and 60 -day data collection calls The study team will also continuously monitor retention throughout the study. If retention falls below the anticipated rat e, study personnel will further emphasize data collection in recruitment and will send additional written reminders to participants."
24,page_24,"Connect -Home: Testing the Efficacy of Transitional Care of Patients and Caregivers during Transitions from Skilled Nursing Facilities to Home Version 2.0 Protocol 13 July 2020 Connect -Home Protocol v 2.0 13Jul2020 24 6 STUDY INTERVENTION 6.1 STUDY INTERVENTI ON(S) ADMINISTRATION 6.1.1 STUDY INTERVEN TION DESCRIPTION The Connect -Home int ervention will introduce new organizational structure to support staff delivery of transitional care processes for seriously ill patients being discharged from the SNF to home.27 New elements of organization structure in the Connect -Home intervention inclu de: • The ""Transition Plan of Care Template"" EHR tool, to be installed in the SNF EHR system prior to randomization. It contains domains that SNF staff and home visit RNs use to record and deliver the two - step Connect -Home intervention.27 • The ""Connect -Home Toolkit"", a bound workbook that contains a description of the EHR template and other EHR tools, the two -step Connect -Home intervention protocol, checklists and cue sheets, and the intervention schedule.27 • Site leadership training, where the Investigator t rains 1- 5 SNF project leaders on the Connect -Home protocol and study procedures. • Executive sponsor and QI nurse monthly calls during intervention phase • Monthly accountability calls with QI nurses and individual facilities to maintain accountability to prot ocol • Staff Training, where the Investigator will train social workers, nurses, rehabilitation therapists, and the Connect -Home Activation RN on patient and caregiver key care needs, protocols for using the two -step intervention to address patient's key car e needs, using the ""Transition Plan of Care Template"" EHR tool, advance care planning, and integrating SNF -based and home -based care.27 The train ing will also include American G eriatrics Society recommendations for self -care at home in the context of the COVID -19 pandemic (when applicable) . • Focused training for the Connect -Home Activation RN, where the Investigator will train the Connect - Home activation RN on strategies for implementing transition plans of care, home safety screening, responding to medical needs, and handing off care to home health nurses. After these elements of organizational structure are in place, the SNF staff will use the Connect -Home intervention care processes to deliver the 2 -step transitional care intervention.27 Further details are provided in Table 1. • In Step 1, SNF nurses, reha bilitation therapists, and social workers will develop a Transition Plan of Care and prepare the patient and caregiver to manage the patient's serious illness and functional needs at home. Staff also will use American G eriatrics Society recommendations for self- care at home in the context of the COVID -19 pandemic (when applicable) ."
25,page_25,"Connect -Home: Testing the Efficacy of Transitional Care of Patients and Caregivers during Transitions from Skilled Nursing Facilities to Home Version 2.0 Protocol 13 July 2020 Connect -Home Protocol v 2.0 13Jul2020 25 • In Step 2, the Connect -Home Activation RN (employed in the collaborating home health agency) will visit the patient and caregiver at home within 24 hours of discharge; the nurse will work with them to activate the Transition Plan of Care at home. Nurses also will use American geriatrics Society recommendations for self- care at home in the context of the COVID -19 pandemic (when applicable) . Table 1 . Connect -Home: Transitional Care Processes (Time estimates based on 20 day SNF stay) Process Patient/Caregiver Services and Supports Day Step 1. Transitional care in the SNF27 Set goals for home -based care (45 minutes ) Consulting with the patient/caregiver, SNF staff use the EHR template to describe goals in the patient’s Transition Plan of Care, targeting 6 key care needs ( home safety and level of assistance, advance care plann ing, symptom management, medication reconciliation, function and activity and coordination of follow -up medical care ). Staff will use American G eriatrics Society recommendations for self- care at home in the context of the COVID -19 pandemic (when applicable ). • Nurses create goals for planned treatments at home, and responses to emerging symptoms or other health changes at home • Rehabilitation therapists create goals for mobility, transfers and self- care at home. • Social worker creates goals for caregiver suppor t, follow -up care & discharge disposition. 2 - 17 Meet to plan the patient’s transition to home -based care (30 minutes) In dialogue with the patient/caregiver, the treating nurse, social worker and therapists will develop a plan for home -based care, targeting 6 key care needs (home safety and level of assistance, advance care planning, symptom management, medication reconciliation, function and activity, and coordinator of care). • Nurses focus on medications, elements of advance care planning and symp tom management. • All staff help the patient and caregiver describe their needs for continuing medical, supportive and rehabilitative care at home. • Social worker reviews participation in Connect -Home, including the Transition Plan of Care and the Connect -Hom e Activation RN Visit. 5 - 10"
26,page_26,"Connect -Home: Testing the Efficacy of Transitional Care of Patients and Caregivers during Transitions from Skilled Nursing Facilities to Home Version 2.0 Protocol 13 July 2020 Connect -Home Protocol v 2.0 13Jul2020 26 Prepare the patient and caregiver for home -based care (2.5 hours) 1. Teach skills and plans for home -based care, targeting 6 key care needs (home safety and level of assistance, advance care planning, symptom management, medication reconciliation, function and activity, and coordinator of care). Staff will use American G eriatrics Society recommendations for self- care at home in the context of the COVID -19 pandemic (when applicable) . • Nurses teach symptom management (e.g., pain), clarify advance care planning preferences, and reconcile medication orders • Rehabilitation Therapists teach skills for function, safety and continuing rehabilitation at home. • Social worker schedules and explains appoi ntments, home- based care & cost 2. Initiate hand -off to home -based care (over the last 1 -2 days before discharge) • SNF staff send medical records and copies of any advance care planning documents to the patient’s physician and the Connect -Home Activation RN • Nurses : 1) reconcile medications, 2) provide supplies and medications, and 3) re-teach the written Transition Plan of Care and medication list. • Social Worker coordinates the hand -off of care to the Connect -Home Activation Nurse. 6 - 20 Step 2. Transitional care in the patient’s home Implement the Transition Plan of Care at home (2 hours) Connect -Home Activation Nurse visits the patient and caregiver at home to: • Reconcile medications on the discharge medication list and in the home, • Reviews TPOC and adds materials for patient care as needed • Help family implement new care routines, addressing 6 key care needs (home safety and level of assistance, advance care planning, symptom management, medication reconciliation, function and activity, and coordinator of care). • Conduct a brief home safety & falls prevention screen, and • Coordinate care and communicate the plan of care to follow -up clinicians and home health care nurses, and others as applicable. Nurses will use American Geriatrics Society recommendations for self- care at home in the context of the COVID -19 pandemic (when applicable) . 21"
27,page_27,"Connect -Home: Testing the Efficacy of Transitional Care of Patients and Caregivers during Transitions from Skilled Nursing Facilities to Home Version 2.0 Protocol 13 July 2020 Connect -Home Protocol v 2.0 13Jul2020 27 6.2 MEASURES TO MINI MIZE BIAS: RANDOMIZA TION AND BLINDING Randomization Randomization will be conducted for all 6 sites simultaneo usly by a study statistician blinded to SNF identity. The randomized allocation sequence of the SNF will determine the beginning and end dates for three phases of patient and caregiver enrollment: (1) standard of care, (2) the pre -implementation phase when staff are trained and neither patients nor caregivers are enrolled, and (3) the implementation phase when newly enrolled patients and their caregivers receive the Connect- Home intervention. Blinding Professional data collectors from the Carolina Survey Research Lab (CSRL) will collect data from patients and caregivers at 7, 30, and 60 days post -discharge. These data collectors will be blinded to both the study hypothesis and to treatment group assignment. 6.3 STUDY INTERVENTI ON COMPLIAN CE The NIH Behavior Change Consortium’s “Treatment Fidelity Protocols” will be used to ensure fidelity to the intervention.46 Fidelity will be assessed in five domains as described below. Design: The researchers will use standardized tools (e.g., Connect- Home Toolkit, the EHR template and staff training protocols) to deliver the intervention. Training: T o prevent contamination between SNFs during the intervention phase, the researcher will train staff in individual SNFs and Connect -Home Activation RNs i n individual home health care offices. A detailed training protocol will be used, specifying the researcher roles, content, participants, and time required for training activities. Delivery: A researcher will observe staff training activities on a random schedule to assess fidelity of the trainer to the staff training protocols. The research team will develop plans to address deviations from the training protocol. A Training Contact Database will be used, in which researchers will record staff participation in training activities. Staff members will be assigned identification numbers for tracking participation. Receipt of Treatment: Researchers will administer post -tests to all participating staff after the staff training session; additional one -to-one r e-training will be provided as needed for those who score"
28,page_28,"Connect -Home: Testing the Efficacy of Transitional Care of Patients and Caregivers during Transitions from Skilled Nursing Facilities to Home Version 2.0 Protocol 13 July 2020 Connect -Home Protocol v 2.0 13Jul2020 28 <100%. Researchers will also use return demonstration of home visit procedures with Connect -Home Activation RNs, followed by re -training as needed until nurses demonstrate a high level of ability. Enactment of Skills: The study team will audit medical records for intervention patients to assess fidelity to the study protocol. Protocol elements to be assessed will include the following: a) completing the Transition Plan of Care; b) convening care p lan meetings; c) reviewing advance directives in the SNF; d) scheduling follow -up medical appointments; e) transmitting records to follow -up clinicians; g) completing home visits within 24 hours after dis -charge; h) reconciling medications in the patient’s home; i) completing the home safety evaluation; and j) communicating patient status to the on -coming home health nurse. As part of enactment monitoring, the Connect -Home Activation RN will keep a log describing medication discrepancies and the patients re ferred for a rehabilitation therapy after discharge home. Further, the researcher will host at least one 30 -minute monthly meeting, during the intervention phase in each SNF, to relay feedback and discuss findings from fidelity monitoring with SNF staff an d the Connect -Home Activation RN. Finally, a researcher will observe 10% of staff as they deliver Connect -Home and, using a standard checklist, the researcher will provide feedback about enactment of the Connect -Home protocols. If in-person observations ar e not possible (owing to risk mitigation related to COVID -19), we will monitor enactment fidelity via Zoom -based observations of care plan meetings and/ or day of discharge teaching sessions. SNFs failing to achieve 70% of operationalized fidelity steps will undergo re -training."
29,page_29,"Connect -Home: Testing the Efficacy of Transitional Care of Patients and Caregivers during Transitions from Skilled Nursing Facilities to Home Version 2.0 Protocol 13 July 2020 Connect -Home Protocol v 2.0 13Jul2020 29 7 STUDY INTERVENTION DISCONTINUATION AND PARTICIPANT DISCONTINUATION/WITH DRAWAL 7.1 DISCONTINUATION OF STUDY INTERVENTIO N The study will adhere to the following stopping rules: 1. The intervention is associated with adverse effects that significantly impact the risk -benefit ratio 2. Study recruitment or retention becomes futile 3. Any new information becomes available during the trial that necessitates stopping the trial 4. Other situations occur that might warrant stopping the trial 7.2 PARTICIPANT DISC ONTINUATION/WITHDRAW AL FROM THE STUDY Subjects have the right to discontinue their participation in the Connect -Home study for any reason without penalty. The Investigator also may discontinue subjects from the study if he feels as if it is in the best interest of the subject, or if the subject is noncompliant. Due to the inclusion criteria requiring patient and caregiver participation, if either the patient or the caregiver withdraws or is discontinued from the study, the other subj ect will automatically be withdrawn. The study team will cease data collection for an individual as soon as the subject withdraws from the study. The study team will retain data collected while the subject was participating in the Connect -Home trial. If a patient enrolled in the study does not transfer from the SNF to home (i.e., they die in the SNF or are transferred from the SNF to the hospital or to long -term care), their data will not be analyzed, and the patient and the caregiver will be withdrawn . If a patient is discharged from the SNF to home, and then dies prior to all data being collected, the data that was collected prior to the subject's death will be retained and included in analysis. If a patient has a reported death after discharge, o nly the data collected prior to the date of death will be used for data collection. If a patient is discharged from the SNF to home, and then has a hospitalization and/or re -admission to a SNF; the patient will be withdrawn from the study by research tea m as they are now non -compliant for data collection. The data that was collected prior to the event will be retained and included in analysis."
30,page_30,"Connect -Home: Testing the Efficacy of Transitional Care of Patients and Caregivers during Transitions from Skilled Nursing Facilities to Home Version 2.0 Protocol 13 July 2020 Connect -Home Protocol v 2.0 13Jul2020 30 7.3 LOST TO FOLLOW -UP After patient discharge from the SNF, study subjects will be considered lost to fol low-up if 3 data collection phone calls have been made to the subject with no response."
31,page_31,"Connect -Home: Testing the Efficacy of Transitional Care of Patients and Caregivers during Transitions from Skilled Nursing Facilities to Home Version 2.0 Protocol 13 July 2020 Connect -Home Protocol v 2.0 13Jul2020 31 8 STUDY ASSESSMENTS AND PROCEDURES 8.1 EFFICACY ASSESSM ENTS The procedures and assessments described in this section will be performed at the time point(s) described in the schedule of activities schedule in section 1.3. All variables will be measured with chart reviews and/or interview -questionnaires with patients and caregivers. Data collection will be identical for intervention and control periods. Care Transitions Measure -15 (CTM -15)33 Self-reported preparedness for discharge will be assessed using the CTM -15. It includes 15 questions on a 4-point scale, with a summary score ranging from 0 -100. Higher scores are associated with less acute care use after discharge. This measure will be assessed at 7 days post -discharge, through telephone interview with the patient (or with the patient's legally authorized representative, responding to survey questions as the patient's proxy in cases of patients wit h cognitive impairment). Preparedness for Caregiving Scale (PCS)35 Self-reported preparedness for caregiving will be assessed using the PCS. It includes 8 questions on a 5 - point Likert scale (0 -4), with a range of 0 -32. Higher scores are associated with less anxiety. This measure will be assessed at 7 days post -discharge, through telephone interview with the caregiver. McGill Quality of Life Questionnaire - Revised (MQoL -R)37 Quality of life across disease trajectories is measured using the MQo L-R. It includes 16 items on a 0 -10 point Likert scale. This measure will be assessed at 30 and 60 days post discharge, through telephone interview with the patient (or with the patient's legally authorized representative, responding to survey questions as the patient's proxy in cases of patients with cognitive impairment)."
32,page_32,"Connect -Home: Testing the Efficacy of Transitional Care of Patients and Caregivers during Transitions from Skilled Nursing Facilities to Home Version 2.0 Protocol 13 July 2020 Connect -Home Protocol v 2.0 13Jul2020 32 Life Space Assessment38 Patient function is measured using the Life Space Assessment. It includes 5 Likert scales that correspond to a hierarchy of levels of mobility (each scored 0 -4). Weights are the product of the ""Life- space Level"" (range 1 -5) and the ""independence"" score (ran ge 1 -2). Score ranges from 1 -120, and lower scores are associated with falls and hospitalization. This measure will be assessed at 30 and 60 days post discharge, through telephone interview with the patient (or with the patient's legally authorized representative, responding to survey questions as the patient's proxy in cases of patients with cognitive impairment). Zarit Caregiver Burden Scale41,42 Caregiver burden is measured using the Zarit Caregiver Burden Scale. It includes 12 items on a 5 -point scale. Scores range 0 -48, and higher scores are associated with depression and social isolation. This measure will be assessed at 30 and 60 days post -discharge, through telephone interview with the caregiver. Distress Thermometer28 Caregiver dist ress is measured using the Distress Thermometer. It includes 1 item on an 11 point scale. Scores range 0 -10, with scores >4 associated with poor coping and depression. This measure will be assessed at 30 and 60 days post -discharge, through telephone int erview with the caregiver. Number of Patient Falls with Injury and Without Injury This assessment is self -reported by the patient; falls are defined as an ""unintentional change in position resulting in a resident coming to rest on the ground or lower l evel."" This measure will be assessed at 30 and 60 days post discharge, through telephone interview with the patient (or with the patient's legally authorized representative, responding to survey questions as the patient's proxy in cases of patients with cognitive impairment). MD Visit This assessment is self -reported by the patient; it is asked in a yes/no question format. This measure will be assessed at 30 and 60 days post discharge, through telephone interview with the patient (or with the patient’s legally authorized representative, responding to survey questions as the patient’s proxy in cases of patients with cognitive impairment)."
33,page_33,"Connect -Home: Testing the Efficacy of Transitional Care of Patients and Caregivers during Transitions from Skilled Nursing Facilities to Home Version 2.0 Protocol 13 July 2020 Connect -Home Protocol v 2.0 13Jul2020 33 Hospice Enrollment This assessment is self -reported by the patient; it is asked in a yes/no question format. This measure will be assessed at 30 and 60 days post discharge, through telephone interview with the patient (or with the patient's legally authorized representative, respondi ng to survey questions as the patient's proxy in cases of patients with cognitive impairment). Home Health Care Use This assessment is reported by the nurses and rehabilitation therapists of the patient, as a count of the number of days in home health care. This measure will be assessed at 30 and 60 days post discharge, through telephone interview with the nurses or rehabilitation therapists. Hospital Readmissions This assessment is self -reported by the patient; it is a count of hospital readmissi ons, either acute or observational stays after SNF discharge. This measure will be assessed at 30 and 60 days post discharge, through telephone interview with the patient (or with the patient's legally authorized representative, responding to survey ques tions as the patient's proxy in cases of patients with cognitive impairment). Emergency Department Use This assessment is self -reported by the patient; it is a count of emergency department visits without a hospital stay after SNF discharge. This measure will be assessed at 30 and 60 days post discharge, through telephone interview with the patient (or with the patient's legally authorized representative, responding to survey questions as the patient's proxy in cases of patients with cognitive impairment). Death Report by Caregiver This assessment is self -reported by the caregiver regarding patient death after SNF discharge. This measure will be assessed at 30 and 60 days post discharge, through telephone interview with the caregiver."
34,page_34,"Connect -Home: Testing the Efficacy of Transitional Care of Patients and Caregivers during Transitions from Skilled Nursing Facilities to Home Version 2.0 Protocol 13 July 2020 Connect -Home Protocol v 2.0 13Jul2020 34 Co-variate assessments will be collected in -person and from the medical record. For some caregivers, co-variate data can be collected by phone. Co -variate data are as follows: • Patient Data collected in person: o Study of Osteopathic Fractures Index 109, measuring frailty of the patient o ENRICHD Social Support Inventory 110, measuring social support of the patient • Patient data collected with SNF chart abstraction: o Demographics o Health insurance status o Medical Information o Depression (Minimum Data Set section D) 94 o Function (Minimum Data Set section GG) 94 o Cognitive status (Minimum Data Set section C) 94, 111 o SNF care (i.e., SNF length of stay, urgent or acute treatment while in the SNF) o Discharge destination o Charlson Comorbidity Index scores 112 (calculated usi ng the problem list in the medical record) o Yes or No that the SNF admission date was before the mandated pause in research activities (related to the COVID -19 pandemic) o History of COVID -19 diagnosis and treatment in the index hospitalization and/or in the SNF • Caregiver data collected in -person or by phone: o Demographics o Relationship to patient o Employment o Count of days per week providing patient care o History of COVID -19 diagnosis and treatment"
35,page_35,"Connect -Home: Testing the Efficacy of Transitional Care of Patients and Caregivers during Transitions from Skilled Nursing Facilities to Home Version 2.0 Protocol 13 July 2020 Connect -Home Protocol v 2.0 13Jul2020 35 8.2 ADVERSE EVENTS AND SERIOUS ADVERSE EVENTS 8.2.1 DEFINITION OF ADVERSE EVENTS (AE) Any untoward or unfavorable medical occurrence in a human subject, including any abnormal sign (for example, abnormal physical exam or laboratory finding), symptom, or disease, temporall y associated with the subject's participation in the research, whether or not considered related to the subject's participation in the research. Adverse events encompass both physical and psychological harms. 8.2.2 DEFINITION OF SERIOUS ADVERSE EVEN TS (SAE ) An adverse event is serious when the outcome for the subject is: • Death; • Life- threatening (place the subject at immediate risk of death from the event as it occurred); • Inpatient hospitalization or prolongation of existing hospitalization; • Persistent or significant disability/incapacity; • congenital anomaly/birth defect; or when the event does not fit the other outcomes but, based upon appropriate medical judgement, may jeopardize the subject's health and may require medical or surgical inter vention to prevent one of the other outcomes. 8.2.3 CLASSIFICATION OF AN ADVERSE EVENT There will be no classification of adverse events for this minimal- risk study. 8.2.3.1 SEVERITY OF EVENT The severity of all AEs will be characterized as ""mild, moderate, or severe"" according to the following definitions: Mild An event that does not have an impact on the patient Moderate An event that causes the patient some minor inconvenience Severe Potentially Life -Threatening Death An event that causes substantial disruption to the patient's well -being. An event that places the subject at immediate risk of death An event resulting in death"
