,PageNo,Text
0,page_0,"C O N F I D E N T I A L –F O I A E x em p t i o n s A p p l y i n U . S . 1 S t a t u s : A p p r o v e d , D a t e : 0 1 M a y 2 0 2 0 J a n s s e n R e s e a r c h & D e v e l o pm e n t * C l i n i c a l P r o t o c o l CO V I D -1 9 A p p e n d i x P r o t o c o l T i t l e A P h a s e 3 , M u l t i c e n t e r , R a n d om i z e d , D o u b l e - b l i n d , P l a c e b o -c o n t r o l l e d S t u d y E v a l u a t i n g t h e E f f i c a c y a n d S a f e t y o f G u s e l k um a b A dm i n i s t e r e d S u b c u t a n e o u s l y i n S u b j e c t s w i t h A c t i v e P s o r i a t i c A r t h r i t i s D i s c o v e r 2 P r o t o c o l C N TO 1 9 5 9 P S A 3 0 0 2 ; P h a s e 3 C N TO 1 9 5 9 ( g u s e l k um a b ) *J a n s s e n R e s e a r c h & D e v e l o pm e n t i s a g l o b a l o r g a n i z a t i o n t h a t o p e r a t e s t h r o u g h d i f f e r e n t l e g a l e n t i t i e s i n v a r i o u s c o u n t r i e s . T h e r e f o r e , t h e l e g a l e n t i t y a c t i n g a s t h e s p o n s o r f o r J a n s s e n R e s e a r c h & D e v e l o pm e n t s t u d i e s m a y v a r y , s u c h a s , b u t n o t l im i t e d t o J a n s s e n B i o t e c h , I n c . ; J a n s s e n P r o d u c t s , L P ; J a n s s e n B i o l o g i c s , B V ; J a n s s e n -C i l a g I n t e r n a t i o n a l N V ; J a n s s e n , I n c ; J a n s s e n P h a rm a c e u t i c a N V ; J a n s s e n S c i e n c e s I r e l a n d U C ; J a n s s e n B i o p h a rm a I n c . ;o r J a n s s e n R e s e a r c h & D e v e l o pm e n t , L L C . T h e t e rm “ s p o n s o r ” i s u s e d t h r o u g h o u t t h e p r o t o c o l t o r e p r e s e n t t h e s e v a r i o u s l e g a l e n t i t i e s ; t h e s p o n s o r i s i d e n t i f i e d o n t h e C o n t a c t I n f o rm a t i o n p a g e t h a t a c c om p a n i e s t h e p r o t o c o l . Un i t e d S t a t e s ( U S ) s i t e s o f t h i s s t u d y w i l l b e c o n d u c t e d u n d e r U S F o o d & D r u g A dm i n i s t r a t i o n In v e s t i g a t i o n a l N e w D r u g ( I N D ) r e g u l a t i o n s ( 2 1 C F R P a r t 3 1 2 ) . ] S t a t u s : A p p r o v e d D a t e : 0 1 M a y 2 0 2 0 P r e p a r e d b y : J a n s s e n R e s e a r c h & D e v e l o pm e n t , L L C E DM S n um b e r : E DM S -R I M - 4 6 7 3 0 v e r s i o n 1 . 0 TH I S A P P E N D I X A P P L I E S TO A L L C U R R E N T A P P RO V E D V E R S IO N S O F P RO TO CO L C N TO 1 9 5 9 P S A 3 0 0 2 G C P C om p l i a n c e : T h i s s t u d y w i l l b e c o n d u c t e d i n c om p l i a n c e w i t h G o o d C l i n i c a l P r a c t i c e , a n d a p p l i c a b l e r e g u l a t o r y r e q u i r em e n t s . C o n f i d e n t i a l i t y S t a t em e n t N C T 0 3 1 5 8 2 8 5 T h e i n f o rm a t i o n p r o v i d e d h e r e i n c o n t a i n s C om p a n y t r a d e s e c r e t s , c omm e r c i a l o r f i n a n c i a l i n f o rm a t i o n t h a t t h e C om p a n y c u s t om a r i l y h o l d s c l o s e a n d t r e a t s a s c o n f i d e n t i a l . T h e i n f o rm a t i o n i s b e i n g p r o v i d e d u n d e r t h e a s s u r a n c e t h a t t h e r e c i p i e n t w i l l m a i n t a i n t h e c o n f i d e n t i a l i t y o f t h e i n f o rm a t i o n u n d e r a p p l i c a b l e s t a t u t e s , r e g u l a t i o n s , r u l e s , p r o t e c t i v e o r d e r s o r o t h e r w i s e ."
1,page_1,"C O V I D -1 9 A p p e n d i x C N T O 1 9 5 9 ( g u s e l k um a b ) C l i n i c a l P r o t o c o l C N T O 1 9 5 9 P S A 3 0 0 2 C O N F I D E N T I A L –F O I A E x em p t i o n s A p p l y i n U . S . 2 S t a t u s : A p p r o v e d , D a t e : 0 1 M a y 2 0 2 0 CO V I D -1 9 AP P E N D I X G U I D A N C E O N S T U D Y CO N D U C T D U R I NG T H E CO V I D -1 9 P A N D EM I C I t i s r e c o g n i z e d t h a t t h e C o r o n a v i r u s D i s e a s e 2 0 1 9 ( C O V I D -1 9 ) p a n d em i c m a y h a v e a n im p a c t o n t h e c o n d u c t o f t h i s c l i n i c a l s t u d y d u e t o , f o r e x am p l e , s e l f -i s o l a t i o n / q u a r a n t i n e b y s u b j e c t s a n d s t u d y -s i t e p e r s o n n e l ; t r a v e l r e s t r i c t i o n s / l im i t e d a c c e s s t o p u b l i c p l a c e s , i n c l u d i n g h o s p i t a l s ; s t u d y s i t e p e r s o n n e l b e i n g r e a s s i g n e d t o c r i t i c a l t a s k s . I n a l i g nm e n t w i t h r e c e n t h e a l t h a u t h o r i t y g u i d a n c e , t h e s p o n s o r i s p r o v i d i n g o p t i o n s f o r s t u d y - r e l a t e d s u b j e c t m a n a g em e n t i n t h e e v e n t o f d i s r u p t i o n t o t h e c o n d u c t o f t h e s t u d y . T h i s g u i d a n c e d o e s n o t s u p e r s e d e a n y l o c a l o r g o v e r nm e n t g u i d e l i n e s o r r e q u i r em e n t s o r t h e c l i n i c a l j u d g em e n t o f t h e i n v e s t i g a t o r t o p r o t e c t t h e h e a l t h a n d w e l l -b e i n g o f s u b j e c t s a n d s i t e s t a f f . I f , a t a n y t im e , a s u b j e c t ’ s s a f e t y i s c o n s i d e r e d t o b e a t u n a c c e p t a b l e r i s k , s t u d y a g e n t w i l l b e d i s c o n t i n u e d , a n d s t u d y f o l l o w - u p w i l l b e c o n d u c t e d . S c h e d u l e d v i s i t s t h a t c a n n o t b e c o n d u c t e d i n p e r s o n a t t h e s t u d y s i t e w i l l b e p e r f o rm e d t o t h e e x t e n t p o s s i b l e r em o t e l y / v i r t u a l l y o r d e l a y e d u n t i l s u c h t im e t h a t o n - s i t e v i s i t s c a n b e r e s um e d . A t e a c h c o n t a c t , s u b j e c t s w i l l b e i n t e r v i e w e d t o c o l l e c t s a f e t y d a t a . K e y e f f i c a c y e n d p o i n t a s s e s sm e n t s s h o u l d b e p e r f o rm e d i f r e q u i r e d a n d a s f e a s i b l e . S u b j e c t s w i l l a l s o b e q u e s t i o n e d r e g a r d i n g g e n e r a l h e a l t h s t a t u s t o f u l f i l l a n y p h y s i c a l e x am i n a t i o n r e q u i r em e n t . E v e r y e f f o r t s h o u l d b e m a d e t o a d h e r e t o p r o t o c o l - s p e c i f i e d a s s e s sm e n t s f o r s u b j e c t s o n s t u d y a g e n t , i n c l u d i n g f o l l o w u p . M o d i f i c a t i o n s t o p r o t o c o l -r e q u i r e d a s s e s sm e n t s m a y b e p e rm i t t e d v i a C O V I D - 1 9 A p p e n d i x a f t e r c o n s u l t a t i o n b e t w e e n t h e s u b j e c t a n d i n v e s t i g a t o r , a n d w i t h t h e a g r e em e n t o f t h e s p o n s o r ( s e e b e l o w ) . T h e s p o n s o r w i l l c o n t i n u e t o m o n i t o r t h e c o n d u c t a n d p r o g r e s s o f t h e c l i n i c a l s t u d y , a n d a n y c h a n g e s w i l l b e c omm u n i c a t e d t o th e s i t e s a n d t o t h e h e a l t h a u t h o r i t i e s a c c o r d i n g t o l o c a l g u i d a n c e . I f a s u b j e c t h a s t e s t e d p o s i t i v e f o r C O V I D -1 9 , t h e i n v e s t i g a t o r s h o u l d c o n t a c t t h e s p o n s o r ’ s r e s p o n s i b l e m e d i c a l o f f i c e r t o d i s c u s s p l a n s f o r s t u d y a g e n t a n d f o l l o w -u p . M o d i f i c a t i o n s m a d e t o t h e s t u d y c o n d u c t a s a r e s u l t o f t h e C O V I D - 1 9 p a n d em i c s h o u l d b e s umm a r i z e d i n t h e c l i n i c a l s t u d y r e p o r t ."
2,page_2,"C O V I D -1 9 A p p e n d i x C N T O 1 9 5 9 ( g u s e l k um a b ) C l i n i c a l P r o t o c o l C N T O 1 9 5 9 P S A 3 0 0 2 C O N F I D E N T I A L –F O I A E x em p t i o n s A p p l y i n U . S . 3 S t a t u s : A p p r o v e d , D a t e : 0 1 M a y 2 0 2 0 A D D I T IO N A L E L EM E N T S , WH E R E A P P L I C A B L E : C e r t a i n p r o t o c o l -m a n d a t e d v i s i t s t o t h e s t u d y s i t e m a y n o t b e p o s s i b l e d u r i n g t h e C O V I D -1 9 o u t b r e a k . T h e r e f o r e , t em p o r a r y m e a s u r e s m a y b e im p l em e n t e d i f c o n s i d e r e d a p p r o p r i a t e b y t h e s p o n s o r a n d i n v e s t i g a t o r t o m a i n t a i n c o n t i n u i t y o f s u b j e c t c a r e a n d s t u d y i n t e g r i t y . C e r t a i n m e a s u r e s , s u c h a s t h o s e l i s t e d b e l o w , m a y b e n e c e s s a r y a n d s h o u l d b e i n s t i t u t e d i n a c c o r d a n c e w i t h a p p l i c a b l e ( i n c l u d i n g l o c a l ) l a w s , r e g u l a t i o n s , g u i d e l i n e s , a n d p r o c e d u r e s : or em o t e ( e g , b y p h o n e / t e l em e d i c i n e ) o r i n -p e r s o n , o f f -s i t e (e g , i n -h om e ) i n t e r a c t i o n s b e t w e e n s i t e s t a f f ( o r d e s i g n e e s ) a n d s u b j e c t s f o r s t u d y p r o c e d u r e s e . g . t h o s e r e l a t e d t o s a f e t y m o n i t o r i n g / e f f i c a c y e v a l u a t i o n / s t u d y a g e n t s t o r a g e a n d a dm i n i s t r a t i o n ( i n c l u d i n g t r a i n i n g w h e r e p e r t i n e n t ) op r o c u r em e n t o f s t u d y a g e n t b y s u b j e c t s ( o r d e s i g n e e ) o r s h i pm e n t o f s t u d y a g e n t f r om t h e s t u d y s i t e d i r e c t l y t o s u b j e c t s f o r a t h om e a dm i n i s t r a t i o n ( i n c l u d i n g t h e p o t e n t i a l f o r s e l f - a dm i n i s t r a t i o n o f s t u d y a g e n t ) ol a b o r a t o r y a s s e s sm e n t s u s i n g a s u i t a b l y a c c r e d i t e d l o c a l l a b o r a t o r y ; f o r s e l e c t e d m e a s u r e s ( e g ,u r i n e p r e g n a n c y ) , h om e t e s t i n g m a y b e em p l o y e d oo t h e r p r o c e d u r e s , e g , im a g i n g , m a y b e c o n d u c t e d a t a n a p p r o p r i a t e f a c i l i t y M i s s e d a s s e s sm e n t s / v i s i t s w i l l b e c a p t u r e d i n t h e c l i n i c a l t r i a l m a n a g em e n t s y s t em f o r p r o t o c o l d e v i a t i o n s . D i s c o n t i n u a t i o n s o f s t u d y a g e n t s a n d w i t h d r a w a l f r om t h e s t u d y s h o u l d b e d o c um e n t e d w i t h t h e p r e f i x “ C O V I D - 1 9 - r e l a t e d ” i n t h e c a s e r e p o r t f o rm ( C R F ) . oo t h e r r e l e v a n t s t u d y d a t a e l em e n t s im p a c t e d b y t h e p a n d em i c s h o u l d a l s o b e d o c um e n t e d / l a b e l e d a s “ C O V I D - 1 9 - r e l a t e d ” i n C R F s a n d / o r o t h e r s t u d y s y s t em s , a s d i r e c t e d b y d e t a i l e d sp o n s o r g u i d a n c e . T h e s e m a y i n c l u d e m i s s e d / d e l a y e d / m o d i f i e d s t u d y v i s i t s / a s s e s sm e n t s / d o s i n g , a n d i n s t a n c e s w h e r e t em p o r a r y m e a s u r e s s u c h a s t h o s e a b o v e a r e im p l em e n t e d . T h e sp o n s o r w i l l e v a l u a t e t h e t o t a l i t y o f im p a c t o f C O V I D - 1 9 o n c o l l e c t i o n o f k e y s t u d y d a t a a n d a d d i t i o n a l d a t a a n a l y s e s w i l l b e o u t l i n e d i n s t u d y S A P ( s ) . P r e c a u t i o n : f o r t h o s e w h o m a y c a r r y a h i g h e r r i s k f o r s e v e r e C O V I D -1 9 i l l n e s s ( e g ,t h o s e a g e d o v e r 6 5 y e a r s ) , f o l l o w g u i d a n c e f r om l o c a l h e a l t h a u t h o r i t i e s w h e n w e i g h i n g t h e p o t e n t i a l b e n e f i t s a n d r i s k s d u r i n g p a r t i c i p a t i o n i n t h e s t u d y ."
3,page_3,"C O V I D -1 9 A p p e n d i x C N T O 1 9 5 9 ( g u s e l k um a b ) C l i n i c a l P r o t o c o l C N T O 1 9 5 9 P S A 3 0 0 2 C O N F I D E N T I A L –F O I A E x em p t i o n s A p p l y i n U . S . 4 S t a t u s : A p p r o v e d , D a t e : 0 1 M a y 2 0 2 0 I N V E S T IG A TO R AG R E EM E N T"
4,page_4,"1 S t a t u s : A p p r o v e d , D a t e : 2 3 J a n u a r y 2 0 1 8 J a n s s e n R e s e a r c h & D e v e l o pm e n t * C l i n i c a l P r o t o c o l A P h a s e 3 , M u l t i c e n t e r , R a n d om i z e d , D o u b l e - b l i n d , P l a c e b o -c o n t r o l l e d S t u d y E v a l u a t i n g t h e E f f i c a c y a n d S a f e t y o f G u s e l k um a b A dm i n i s t e r e d S u b c u t a n e o u s l y i n S u b j e c t s w i t h A c t i v e P s o r i a t i c A r t h r i t i s D i s c o v e r 2 P r o t o c o l C N TO 1 9 5 9 P S A 3 0 0 2 ; P h a s e 3 AM E N DM E N T 1 C N TO 1 9 5 9 (g u s e l k um a b ) *J a n s s e n R e s e a r c h & D e v e l o pm e n t i s a g l o b a l o r g a n i z a t i o n t h a t o p e r a t e s t h r o u g h d i f f e r e n t l e g a l e n t i t i e s i n v a r i o u s c o u n t r i e s . T h e r e f o r e , t h e l e g a l e n t i t y a c t i n g a s t h e Sp o n s o r f o r J a n s s e n R e s e a r c h & D e v e l o pm e n t s t u d i e s m a y v a r y , s u c h a s , b u t n o t l im i t e d t o J a n s s e n B i o t e c h , I n c . ; J a n s s e n P r o d u c t s , L P ; J a n s s e n B i o l o g i c s , B V ; J a n s s e n -C i l a g I n t e r n a t i o n a l N V ; J a n s s e n , I n c ; J a n s s e n S c i e n c e s I r e l a n d U C ; o r J a n s s e n R e s e a r c h & D e v e l o pm e n t , L L C . T h e t e rm “ S p o n s o r ” i s u s e d t h r o u g h o u t t h e p r o t o c o l t o r e p r e s e n t t h e s e v a r i o u s l e g a l e n t i t i e s ; t h e S p o n s o r i s i d e n t i f i e d o n t h e C o n t a c t I n f o rm a t i o n p a g e t h a t a c c om p a n i e s t h e p r o t o c o l . T h i s s t u d y w i l l b e c o n d u c t e d u n d e r U S F o o d & D r u g A dm i n i s t r a t i o n I N D r e g u l a t i o n s ( 2 1 C F R P a r t 3 1 2 ) E u d r a C T N UM B E R : 2 0 1 6 - 0 0 1 2 2 4 - 6 3 S t a t u s : A p p r o v e d D a t e : 2 3 J a n u a r y 2 0 1 8 P r e p a r e d b y : J a n s s e n R e s e a r c h & D e v e l o pm e n t , L L C E DM S n um b e r :E DM S -E R I - 1 2 5 1 3 2 8 4 2 : 3 . 0 G C P C om p l i a n c e : T h i s s t u d y w i l l b e c o n d u c t e d i n c om p l i a n c e w i t h G o o d C l i n i c a l P r a c t i c e , a n d a p p l i c a b l e r e g u l a t o r y r e q u i r em e n t s . C o n f i d e n t i a l i t y S t a t em e n t N C T 0 3 1 5 8 2 8 5 T h e i n f o rm a t i o n i n t h i s d o c um e n t c o n t a i n s t r a d e s e c r e t s a n d c omm e r c i a l i n f o rm a t i o n t h a t a r e p r i v i l e g e d o r c o n f i d e n t i a l a n d m a y n o t b e d i s c l o s e d u n l e s s s u c h d i s c l o s u r e i s r e q u i r e d b y a p p l i c a b l e l a w o r r e g u l a t i o n s . I n a n y e v e n t , p e r s o n s t o w h om t h e i n f o rm a t i o n i s d i s c l o s e d m u s t b e i n f o rm e d t h a t t h e i n f o rm a t i o n i s p r i v i l e g e d o r c o n f i d e n t i a l a n d m a y n o t b e f u r t h e r d i s c l o s e d b y t h em . T h e s e r e s t r i c t i o n s o n d i s c l o s u r e w i l l a p p l y e q u a l l y t o a l l f u t u r e i n f o rm a t i o n s u p p l i e d t o y o u t h a t i s i n d i c a t e d a s p r i v i l e g e d o r c o n f i d e n t i a l ."
