,PageNo,Text37,page_37,"Protocol VX16- 661-114 Version 3.1 US Page 38 of 56 Vertex Pharmaceuticals Incorporated If a subject or the female partner of a male subject becomes pregnant while participating in the study, study drug will be permanently discontinued immediately. The investigator will notify Vertex GPS within 24 hours of the site’s knowledge of the subject’s (or partner’s) pregnancy using the Pregnancy Information Collection Form. The subject or partne r will be followed until the end of the pregnancy and the infant will b e followed for 1 year after the birth, provided informed consent is obtained. A separate ICF will be provided to explain these follow-up activities. Pregnancy itself does not constitute an AE. Pulse Oximetry 11.4.5 Pulse oximetry is a noninvasive measure of oxygen delivery to the tissues and has been correlated with clinical status and lung function. Arterial oxygen saturation by pulse oximetry will be measured at visits noted in Table 3-1 and Table 3-2 and will be assessed following at least a 5-minute rest (seated or supine). Pulse oximetry will be collected before study drug dosing at all visits. Liver Function Test Parameters 11.4.6 Liver Functi on Testing Liver function testing must be performed as noted in Table 3-2 while subjects are receiving study drug treatment and at the ETT visit when indicated. These blood sampl es should be processed and shipped immediately per the Laboratory Manual. Subjects with new treatm ent-emergent ALT or AST elevations of >3 × ULN and clinical symptoms must be followed closely, including repeat confirmatory testing performed by the central laboratory within 48 to 72 hours of the initial finding and subsequent close monitoring of ALT and AST levels, as clinically indicated. In addition, if ALT or AST is >5 × ULN, repeat follow-up levels must be obtained within 7 ± 2 days. If a subject cannot return to t he site for liver function testing, a local laboratory may be used. Elevations in LFTs at the local laboratory must be reported immediately to the medical monitor, and the subject must have the tests repeated and sent to the central laboratory as soon as possible (ideally within 48 to 72 hours). Study Drug Interruption Study drug administration must be interrupted immediately (prior to confirmatory testing), and the medical monitor must be notified, if any of the following criteria is met and confirmed with repeat testing:  ALT or AST >8 × ULN  ALT or AST >5 × ULN for more than 2 weeks  ALT or AST >3 × ULN in association with total bilirubin >2 × ULN and/or clinical jaundice A thorough investigation of potential causes should be conducted, and the subject should be followed closely f or clinical progression. If no convincing alternative etiology (e.g., acetaminophen use, viral hepatitis, or alcohol ingestion) for the elevated tests is identified, regardless of whether the levels have im proved, study drug treatment must be permanently discontinued if repeat testing within 48 to 72 hours confirms the initial elevation. Subjects in whom treatment is discontinued for elevated liver tests should have them monitored closely until levels normalize or return to baseline."
38,page_38,"Protocol VX16- 661-114 Version 3.1 US Page 39 of 56 Vertex Pharmaceuticals Incorporated Resumption of Study Drug If an alternative, reversible cause of liver test elevation(s) has been identified, study drug may be resumed once the levels return to baseline or are ≤2 × ULN, whichever is higher. Approval of the medical monitor is required before resumption of study drug. Upon resumption of study drug, levels should be assessed weekly for 4 weeks. If a protocol-defined elevation occurs within 4 weeks of rechallenge with study drug (with confirmation of the initial elevation by repeat testing within 48 to 72 hours), then the study drug treatment must be permanently discontinued, regardless of the presumed etiology. Ophthalmologic Examination 11.4.7 Subjects <18 years of age who did not have an ophthalmological examination prior to starting Orkambi will undergo an ophthalmologic examination if they have not had an ophthalmologic examination within 6 months before the Screening Period. The examination must be performed by a licensed ophthalmologist or optometrist at screening and includes  measurement of best corrected distance visual acuity of each eye  pharmacologically dilated examination of the lens with a slit lamp The screening ophthalmologic examination must be completed before randomization. Subjects who have documentation of bilateral lens removal do not need the ophthalmologic examination. Additional ophthalmologic examinations may be conducted at the discretion of the investigator. The medical monitor should be notified of any abnormal findings from additional ophthalmologic examinations. Spirometry 11.4.8 Postdose spirometry assessment will be performed 2 hours (± 30 minutes ) and 4 hours (± 30 minutes ) after dosing on Day 1; these assessments will be performed in addition to the predose spirometry assessment. If the Day 1 predose spirometry is performed postbronchodilator, the subject should withhold any further bronchodilator use until completion of the 4-hour postdose spirometry assessment on that day. 12 STATISTICAL AND ANALYTICAL PLANS This section presents a summary of the planned analyses for this protocol. Statistical analysis details will be provided in the statistical analysis plan (SAP) which will be finalized before the clinical data lock for the study and treatment unblinding. 12.1 Sample Size Consideration Sample size calculation is based on the key secondary endpoint of absolute change in ppFEV 1 to the average of the Day 28 and Day 56 measurements. A Bayesian approach will be used to assess the treatment effect on the change in ppFEV 1. The study will be considered successful if the posterior probability that the treatment difference between TEZ/IVA and placebo is greater than 0 is at least 80%, using a noninformative prior distribution. Assuming a 3.0 percentage points mean treatment difference between TEZ/IVA and placebo and a standard deviation (SD) of 6 .0 percentage points, with 4 2 TEZ/IVA subjects and 42 placebo subjects, the Bayesian power to achieve the posterior probability criterion is at least"
39,page_39,"Protocol VX16- 661-114 Version 3.1 US Page 40 of 56 Vertex Pharmaceuticals Incorporated 90% (92.6%). After adjusting for an assumed dropout rate of 5 % a total sample size of 90 subjects is needed. 12.2 Analysis Sets Assignment of subjects to analysis sets will be done before the clinical data lock for the study. The All Subjects Set is defined as all subjects who have been randomized or have received at least 1 dose of study drug. This analysis set will be used in subject listings and disposition summary table, unless otherwise specified. The Full Analysis Set (FAS) is defined as all randomized subjects who have received at least 1 dose of study drug. The FAS will be used in efficacy analyses in which subjects will be analyzed according to their randomized treatment group. The Safety Set is defined as all subjects who received at least 1 dose of study drug. The Safety Set is to be used for all safety and tolerability analyses, in which subjects will be analyzed according to the treatment they received. 12.3 Statistical Analysis The primary objective of this study is to evaluate the respiratory safety of TEZ/IVA through Day 56 in subjects with CF homozygous for F508del and who discontinued treatment with Orkambi due to respiratory symptoms considered related to treatment. This section presents a summary of the planned statistical analyses of safety, efficacy, and tolerability. The Vertex Biometrics department or a designated CRO will analyze the data derived from this study. SAS® Version 9.2 or higher will be used to generate all statistical outputs (tables, figures, listings, and data sets). Statistical analysis and presentation details will be provided in the SAP for the study. General Considerations 12.3.1 All individual subject data for all randomized subjects exposed to study drug will be presented in data listings. Continuous variables will be summarized using the following descriptive summary statistics: the number of subjects (n), mean, SD, median, minimum value, and maximum value. The precision of the measurement for each continuous variable will be specified in the SAP. Categorical variables will be summarized using counts and percentages. Percentages will be presented to 1 decimal place."
40,page_40,"Protocol VX16- 661-114 Version 3.1 US Page 41 of 56 Vertex Pharmaceuticals Incorporated Baseline value , unless otherwise specified, will be defined as the most recent non-missing measurement (scheduled or unscheduled) collected before the initial administration of study drug. Change (absolute change) from baseline will be calculated as post-baseline value - baseline value. Relative change from baseline will be calculated as (post-baseline value - baseline value)/baseline value. The treatment-emergent (TE) period will include the time from the first dose to the Safety Follow-up Contact or 28 days after the last dose of the study drug for subjects who do not have a Safety Follow-up Contact. Background Characteristics 12.3.2 Subject disposition, demographic and baseline characteristics, prior and concomitant medications, study drug exposure and compliance, and other background characteristics will be summarized. Additionally, all subject data will be presented in subject data listings. All summaries will be based on the FAS unless otherwise specified in the SAP for the study. No statistical hypothesis testing will be performed. 12.3.2.1 Subject Disposition The number and percentage of subjects in the following categories will be summarized as appropriate:  All Subjects Set  Randomized  Dosed (Safety Set)  Randomized, dosed, and carry the intended CFTR mutation (see SAP Appendix 1) (FAS)  Completed study drug treatment  Prematurely discontinued the study during the Treatment Period and the reasons for discontinuation  Completed study/Safety Follow-up Contact  Prematurely discontinued the study and the reasons for discontinuation 12.3.2.2 Demographics, Medical History, and Baseline Characteristics Demographics, medical history, and baseline characteristics will be summarized. The following demographics and baseline characteristics will be summarized by dose group for the FAS: sex, race, ethnicity, age, weight, height, region, baseline ppFEV 1, and baseline score of CFQ-R respiratory domain."
41,page_41,"Protocol VX16- 661-114 Version 3.1 US Page 42 of 56 Vertex Pharmaceuticals Incorporated 12.3.2.3 Prior and Concomitant Medications Medications used in this study will be coded by using the World Health Organization-Drug Dictionary Enhanced and categorized as the following:  Prior medication: any medication that started before initial dosing of study drug, regardless of when it ended  Concomitant medication: medication continued or newly received at or after initial dosing of study drug through the end of the TE Period  Post-treatment medication: medication continued or newly received beyond the TE Period A given medication can be classified as a prior medication, a concomitant medication, or a post-treatment medication; both prior and concomitant; both concomitant and post-treatment; or prior, concomitant, and post-treatment. If a medication has a missing or partial missing start/end date or time and cannot be determined whether it was taken before initial dosing, concomitantly, or beyond the TE Period, it will be considered as prior, concomitant, and post-treatment. Prior medications and concomitant medications will be summarized descriptively based on the FAS. Post-treatment medications will be listed for each subject. 12.3.2.4 Study Drug Exposure and Compliance Exposure to study drug (i.e., duration of treatment) will be summarized for the FAS in terms of duration of treatment a subject received (in days), defined as the last day minus the first day of study drug plus 1. Dosing compliance will be summarized for the FAS and is calculated as the actual number of dosing occasions at which study drug was taken (including when administered at study visits), as a percentage of the planned number of dosing occasions. Duration of treatment and dosing compliance will be summarized by means of descriptive summary statistics. Safety Analysis 12.3.3 Respiratory safety of TEZ/IVA is the primary objective of this study and will be assessed in terms of AE incidence, including but not limited to the following:  Chest discomfort  Dyspnea (shortness of breath)  Respiration abnormal (chest tightness)  Asthma  Bronchial hyperreactivity  Bronchospasm  Wheezing All safety analyses will be based on the TE Period for subjects in the Safety Set. The overall safety profile of study drug will be assessed in terms of the following safety endpoints:"
42,page_42,"Protocol VX16- 661-114 Version 3.1 US Page 43 of 56 Vertex Pharmaceuticals Incorporated  Incidence of treatment-emergent AEs, SAEs, and discontinuations due to AEs  Clinical laboratory values  Vital signs  Pulse oximetry All safety data will also be presented in individual subject data listings. 12.3.3.1 Adverse Events AEs will be coded according to MedDRA. The number and percentage of subjects experiencing an AE will be summarized by the MedDRA system o rgan class and preferred term, as well as by dose group. AEs will be classified as pretreatment or treatment-emergent. Pretreatment AEs are defined as AEs that were reported or worsened after signing the ICF up to the start of study drug dosing. Treatment-emergent AEs are defined as AEs that were reported or worsened on or after the start of study drug dosing through the Safety Follow-up Contact. Only TEAEs will be summarized in tables. All summaries of TEAEs will be presented by the severity of the AE and relationship to the study drug. Some rules that will apply to the summarization of AEs are (1) a subject with multiple occurrences of the same AE or a continuing AE will only be counted once; (2) only the maximum severity level will be presented in the severity summary; and (3) only the worst relationship level will be presented in the relationship summary. AEs leading to death, SAEs, dose interruption, and permanent discontinuation will be listed separately. All AEs through the Safety Follow-up Contact will be listed in an individual subject data listing, including pretreatment AEs. 12.3.3.2 Clinical Laboratory Assessments For the laboratory measurements, the raw values and change from baseline values of the continuous hematology, coagulation, and chemistry results will be summarized in SI units at each scheduled time point. The number and percentage of subjects with at least 1 assessment meeting threshold criteria during the Treatment Period will be summarized. The threshold criteria will be provided in the SAP. A listing containing individual subject hematology, coagulation, and chemistry values outside the reference ranges will be provided. This listing will include data from scheduled and unscheduled time points. Results of urinalysis and pregnancy tests will be provided in data listings only. 12.3.3.3 Vital Signs For the on-treatment vital signs measurements, the raw values and change from baseline values will be summarized by treatment group at each scheduled time point during the TE Period: systolic and diastolic blood pressure (mm Hg), HR (beats per minute), and respiratory rate (breaths per minute). Additional vital sign analyses will be described in the SAP, if applicable."
43,page_43,"Protocol VX16- 661-114 Version 3.1 US Page 44 of 56 Vertex Pharmaceuticals Incorporated 12.3.3.4 Physical Examination Physical examination findings will be presented as a data listing only. 12.3.3.5 Pulse Oximetry For the treatment-emergent pulse oximetry measurements, a summary of raw values and change from baseline values will be provided by treatment groups at each scheduled time point during the TE Period for the percent of oxygen saturation by pulse oximetry. In addition, the mean value at each visit will be plotted by treatment groups for the percent of oxygen saturation. 12.3.3.6 Postdose Spirometry For the 2-hour and 4-hour postdose measurements on Day 1, a summary of raw values for percent predicted FEV 1 will be provided by treatment at each time point. The absolute change from the Day 1 predose value of percent predicted FEV 1 will be summarized by treatment at each time point. In addition, the number and percentage of subjects with percent predicted FEV 1 decline of ≥10, ≥15, and ≥20 percentage points in the absolute change from the Day 1 predose value, and the number and percentage of subjects with percent predicted FEV 1 decline of ≥10, ≥15, and ≥20% in the relative change from Day 1 will be summarized by treatment and by assessment time. Efficacy Analysis 12.3.4 12.3.4.1 Analysis of Key Efficacy Variables The actual posterior/conditional probability will be calculated for the probability of a greater than zero (>0) treatment effect difference in mean ppFEV 1 change between TEZ/IVA and placebo is greater than or equal to 80%, based on the observed data of the efficacy endpoint on the absolute change from baseline in ppFEV 1 to the average of the Day 28 and Day 56 measurements. This will serve as the primary efficacy analysis outcome. Additionally, the key efficacy endpoint of the absolute change from baseline in ppFEV1 to the average of the Day 28 and Day 56 measurements will be analyzed using a mixed-effects model for repeated measures (MMRM) with ppF EV 1 at each time point as the outcome variable. The MMRM model will include the absolute change from baseline in pp FEV 1 at each visit as the dependent variable; treatment, visit, and treatment- by-visit interaction as fixed effects; and subject as a random effect, with adjustment for sex (male versus female), age group at the Screening Visit (<18 versus ≥18 years old), and ppFEV 1 severity determined during the Screening (or baseline) Period (<40% versus ≥40% predicted). The estimated treatment effect within TEZ/IVA and placebo arm, as well as the estimated treatment difference between TEZ/IVA and placebo arm will be provided based on the MMRM model along with 95% CI. These results will serve as additional efficacy outcomes, which is in addition to the primary actual posterior/conditional probability outcome. Furthermore, treatment effect and treatment difference at each post-baseline visit, obtained from the model, will also be provided."
44,page_44,"Protocol VX16- 661-114 Version 3.1 US Page 45 of 56 Vertex Pharmaceuticals Incorporated 12.3.4.2 Analysis of Secondary Efficacy Variables  Relative change in ppFEV 1 from baseline to the average of the Day 28 and Day 56 measurements: Analysis of this variable will be similar to the key efficacy analysis using an MMRM model but without calculation of the posterior/conditional probability based on this variable.  Absolute change in the CFQ-R respiratory domain score from baseline to the average of the Day 28 and Day 56 measurements: Analysis of this domain will be similar to the key efficacy using an MMRM model but without calculation of the posterior/conditional probability based on this variable, with the addition of the CFQ-R respiratory domain score at baseline as a covariate. Tolerability Analysis 12.3.5 A tolerability analysis will be based on the Safety Set for a standard summary of study drug discontinuation rate. Rate will be reported as descriptive statistics in counts and percentages, separately by the TEZ/IVA arm and the placebo arm. No statistical hypothesis testing will be performed. An additional summary of the tolerability outcome including but not limited to study/study drug discontinuation rate by reasons, by AE of special interest, and by time to discontinuation will also be reported. 12.3.5.2 IDMC Analysis An IDMC will be formed for this study before study initiation. The IDMC’s objectives and operational details will be defined in a separate document (IDMC Charter), which will be finalized before the first subject is screened in the study. The IDMC will conduct regular planned safety reviews of study data as outlined in the IDMC Charter."
45,page_45,"Protocol VX16- 661-114 Version 3.1 US Page 46 of 56 Vertex Pharmaceuticals Incorporated 13 PROCEDURAL, ETHICAL, REGULATORY, AND ADMINISTRATIVE CONSIDERATIONS 13.1 Adverse Event and Serious Adverse Event Documentation, Severity Grading, and Reporting Adverse Events 13.1.1 13.1.1.1 Definition of an Adverse Event An AE is defined as any untoward medical occurrence in a subject during the study; the event does not necessarily have a causal relationship with the treatment. This includes any newly occurring event or worsening of a pre-existing condition (e.g., increase in its severity or frequency) after the ICF is signed. An AE is considered serious if it meets the definition in Section 13.1.2.1 . 13.1.1.2 Clinically Significant Assessments Study assessments including laboratory tests, PEs, pulse oximetry, and vital signs will be assessed and those deemed to have clinically-significant worsening from baseline will be documented as an AE. When possible, a clinical diagnosis for the study assessment will be provided, rather than the abnormal test result alone (e.g., hepatitis). In the absence of a diagnosis, the abnormal study assessment i tself will be listed as the AE (e.g., elevated ALT). An abnormal study assessment is con sidered clinically significant if the subject has 1 or more of the following:  Concomitant signs or symptoms related to the abnormal study assessment  Further diagnostic testing or medical/surgical intervention  A change in the dose of study drug or discontinuation from the study Repeat testing to determine whether the result is abnormal, in the absence of any of the above criteria, does not necessarily meet clinically significant criteria. The determination of whether the study assessment results are clinically significant will be made by the investigator. A laboratory value that is Grade 4 will not automatically be an SAE. A Grade 4 laboratory value will be an SAE if t he subjec t’s clinical status indicates a life -threatening AE. 13.1.1.3 Documentation of Adverse Events All AEs will be collected from the time ICF and assent (where applicable) is signed until the following time points:  For subjects who do not enroll: until time of screen failure or withdrawal of consent  For enrolled subjects who complete the study and for subjects who prematurely discontinue study drug and have a Safety Follow-up Contact: through the Safety Follow-up Contact  For enrolled subjects who prematurely discontinue study drug (including for withdrawal of consent) and do not have Safety Follow-up Contact, the earliest of: o 28 days after the last dose of study drug, or"
46,page_46,"Protocol VX16- 661-114 Version 3.1 US Page 47 of 56 Vertex Pharmaceuticals Incorporated o the ETT Visit, if that visit is 3 weeks or later following the last dose of study drug (see Section 9.1.4 ) All subjects will be queried, using nonleading questions, about the occurrence of AEs at each study visit. When possible, a constellation of signs and/or symptoms will be identified as 1 overall event or diagnosis. All AEs for enrolled subjects will be recorded in the CRF and source document. AEs for subjects who are screened but not subsequently enrolled in the study will be recorded only in the subject's source documents. The following data will be documented for each AE:  Description of the event  Classification of “serious” or “nonserious”  Date of first occurrence and date of resolution (if applicable)  Severity  Causal relationship to study drug(s)  Action taken  Outcome  Concomitant medication or other treatment given 13.1.1.4 Adverse Event Severity The investigator will determine and record the severity of all serious and nonserious AEs. The guidance available at the following website will be consulted: Common Terminology Criteria for Adverse Events (CTCAE), Version 4.0, Cancer Therapy Evaluation Program, http://ctep.cancer.gov/protocolDevelopment/electronic_applications/ctc.htm. AEs of CTCAE Gr ades 4 and 5 will be documented as “life -threatening.” In considering the severity of an AE in a pediatric subject, the investiga tor will consider that reference ranges for pediatric clinical laboratory parameters may differ from those given in the CTCAE. The severity of an AE that does not appear in the CTCAE will be determined according to the definitions in Table 13-1. Table 13-1 Grading of AE Severity Classification Definition Mild (Grade 1) Mild level of discomfort and does not interfere with regular activities Moderate (Grade 2) Moderate level of discomfort and significantly interferes with regular activities Severe (Grade 3) Significant level of discomfort and prevents regular activities Life-threatening (Grade 4) Any adverse drug event that places the subject, in the view of the investigator, at immediate risk of death 13.1.1.5 Adverse Event Causality Every effort will be made by the investigator to assess the relationship of the AE, if any, to the study drug(s). Causality will be classified using the categories presented in Table 13-2."
