,PageNo,Text84,page_84,"Version 10.0 Protocol Number: GBR 830-204 Date: 05-May-2020 Ichnos Sciences CONFIDENTIAL Page 84 of 103 Pharmacokinetics Endpoints: • Cmax, tmax, AUC 0-tau, AUC from time 0 to the last measurable concentration (AUC 0-t), and other related parameters will b e estimated using data from the rich PK group from the blinded treatment phase. C trough values will be estimated using data from both rich and sparse PK groups from the blinded treatment phase. 15.3.3. Exploratory Endpoints Samples for exploratory biomarker endpoints will be collected when and where biomarker sample kits are available. Exploratory biomarker endpoints are: • Messenger RNA (mRNA) expression of immune and barrier measures in skin biopsies at baseline, end of Week 8, and end of Week 16. • Biomar ker analysis in ISB 830 responder and non-responder populations, to evaluate the relationship of biomarkers with clinical efficacy measures . • Assays on plasma, serum, viably frozen peripheral blood mononuclear cells (vfPBMCs) and/or cell subsets/derivatives. Exploratory efficacy endpoints are: • Proportion of subjects with both IGA 0 or 1 (on a 5-point scale) and an IGA reduction from baseline of ≥2 points through Week 54. • Proportion of subjects with EASI- 75 (≥75% improvement from baseline) through Week 54. • Proportion of subjects who achieve an EASI 50 (≥50% improvement from baseline) through Week 54. • Change in the EQ-5D through Week 16. • Change in Juniper ACQ-5 from baseline through Week 16. • Change in the SNOT-22 from baseline through Week 16. • To assess qualitative changes in Photographs of skin lesions taken at time points specified in the SoA ( Table 2 and Table 3 ). 15.4. Subject Disposition Data on subject disposition (number of subjects enrolled, number of drop-outs, and reasons for drop-out), demographics (gender, age, height), and other baseline chara cteristics will be summarized. The safety, tolerability, PK, and other data from the study will be listed and summarized descriptively by treatment. The number (percentage) of subjects who were screened for the study (enrolled subjects, ie, those who signed informed consent) and reasons for screen failure will be described."
85,page_85,"Version 10.0 Protocol Number: GBR 830-204 Date: 05-May-2020 Ichnos Sciences CONFIDENTIAL Page 85 of 103 15.5. Demographic and Other Baseline Characteristics Demographics and other baseline characteristics will be summarized by treatment group for the FAS. Descriptive statistics will include n umber of subjects, mean, SD, minimum, median and maximum for continuous variables, and frequency and percentage for categorical variables. Continuous demographic and baseline variables include age, height and body weight, and BMI; categorical variables in clude gender, race, and ethnicity. 15.6. Efficacy Analyses The primary efficacy analysis will be the percentage change from baseline in EASI score, and the secondary efficacy analysis will be the IGA and EASI 75 (subjects achieving 75% reduction from baseline in EASI score). T he IGA is an assessment instrument used in clinical studies to rate the severity of AD globally, based on a 5 -point scale ranging from 0 (clear) to 4 (severe). The EASI and IGA scores will be assessed at time points described in the Schedule of Assessments. The primary efficacy analyses will be conducted for all subjects in the FAS using the treatment arm as assigned . In addition, the efficacy analyses for the primary endpoint and secondary endpoints (IGA, EASI -75) will be conducted usin g the PPS. For both Part 1 and Part 2 of the study, the primary endpoint (percentage change from baseline in EASI score at Week 16) will be analyzed using a MMRM model. The model will adjust for study treatment, baseline, randomization stratification factors, visit as well as baseline -by-visit and treatment -by-visit interactions. The continuous secondary endpoints will be analyzed using the MMRM model as performed for the primary endpoint. The Cochran -Mantel -Haenszel test adjusted by randomization strata (region, disease severity) will be used to analyze the categorical secondary endpoints. To test the robustness of the MMRM model for the primary endpoint, sensitivity analyses using tipping point approach will be conducted. In addition, the primary endpoint will be analyzed using the complete dataset (subjects who complete the week 16 and had EASI measurement). For Part 2 of the study, Group 5 ( loading q2w maintenance) will be compared to the corresponding placebo arm (Group 6) using the same statistical method s used in the analysis of the first part of the study. To assess the robustness of the results in the Part 2 of the study, the analyses on primary endpoint and secondary endpoints (IGA, EASI-75) will also be conducted excluding subjects who withdraw from the study or miss 2 or more consecutive doses prior to Week 16 or miss any part of the primary endpoint assessments at Week 16 due to the pandemic. Parts 1 and 2 are two independent parts of the study protocol and will therefore be analyzed separately. That is, upon completion of the double-blind period of Part 1, the database will be partially locked . The data will be analyzed and the t opline results (TLR) determined. Similar activities will take place upon the completion of the double-blind period of Part 2. The efficacy results from these 2 parts of the study will be kept separate. H owever, the safety results will be presented side -by-side."
86,page_86,"Version 10.0 Protocol Number: GBR 830-204 Date: 05-May-2020 Ichnos Sciences CONFIDENTIAL Page 86 of 103 Details of efficacy, safety and PK analyses will be specified in the GBR 830 -204 Statistical Analysis Plan ( SAP) and included in the Clinical Study Report ( CSR). Population pharmacokinetic and exposure-response modeling will be described in a Modeling Plan and data will be published in a separate report. Biomarker analyses will not be part of the CSR and will be described separately. Detailed statistical methods, including methods for the handling of missing data for analyzing the secondary and exploratory endpoints a will be described in the SAP. 15.7. Pharmacokinetic, Pharmacodynamic (Biomarker ), and Immunogenicity Analyses 15.7.1. Pharmacokinetic Analyses The PKAS will be used for the PK analyses. The PK parameters will be derived for individual subject by non-compartmental analysis using appropriate validated software. P harmacokinetic parameters (C max, tmax, AUC 0-tau, AUC 0-t, and other related parameters) will be estimated based on data from the rich PK group from the blinded treatment phase. Estimates of C trough will be derived using the data from both rich PK group and sparse PK group from the blinded treatment phase. The PK parameters will be summarized in tabular and graphic form. Details of the PK analysis will be specified in the SAP. The serum concentration data from both rich and sparse PK group may be used for the population PK and exposure-response analysis and will be reported separately . 15.7.2. Immunogenicity Analyses The number and percent incidence of positive and negative ADA status of subjects by treatment, and time points will be provided. Titers and neutralizing potent ial of confirmed positive samples will be reported. Details will be provided in the SAP. 15.7.3. Pharmacodynamic ( Biomarker) Analyses Summary statistics will be provided for PD biomarkers. Biomarker analyses will not be part of the CSR and will be described separately. 15.8. Safety Analyses All safety analyses will be performed on the SA S population, according to the actual treatment received . Adverse events will be summarized by system organ class and preferred term. Subjects will be counted only once for each preferred term, system organ class, and by the highest severity of an event. Laboratory evaluations will be summarized with descriptive statistics at each visit, and change from baseline summarized for each post -baseline visit. Laboratory measurements wi ll also be summarized based on the number and percentage of subjects above or below a pre- specified threshold for each test. Details will be presented in the SAP."
87,page_87,"Version 10.0 Protocol Number: GBR 830-204 Date: 05-May-2020 Ichnos Sciences CONFIDENTIAL Page 87 of 103 15.8.1. Extent of Exposure The duration of exposure to study drug will be summarized separately by respective treatment group for SAS subjects. 15.8.2. Adverse Events Adverse events (AEs) will be coded using the Medical Dictionary for Regulatory Activities (MedDRA). The number and percentage of AEs, SAEs, AEs leading to discontinuation, and AEs related to inve stigational product will be summarized by system organ class, preferred term and treatment group. Subjects will be counted only once for each preferred term, system organ class, and by the highest severity of an event. The number and percentage of AEs by severity will also be summarized. All AEs will be displayed in listings. 15.8.3. Laboratory Values For quantitative laboratory measurements descriptive statistics will be used to summarize results and change from baseline by treatment group and time point. Shifts in laboratory tests relative to reference ranges from baseline to the worst post- baseline value during treatment will also be tabulated. All laboratory data will be displayed in listings. 15.8.4. Vital Signs Descriptive statistics will be used to summarize vital sign results and changes from baseline by treatment group and time. Values of potential c linical significance will be tabulated. All vital signs data will be displayed in listings. Shift tables will present changes from baseline (categorized as normal; abnormal, not clinically significant; and abnormal, clinically significant) to end of treat ment. 15.8.5. Electrocardiograms The absolute values and the change from baseline for ECG parameters will be summarized. An outlier analysis of ECG results will be conducted. All ECG variables will be presented by visit. Descriptive statistics for ECG parameters and changes from baseline will be presented by treatment group. Shift tables will present changes from baseline in ECG interpretation (categorized as normal; abnormal, not clinically significant; and abnormal, clinically significant) to end of treatment. 15.8.6. Physical Examination Descriptive statistics will be used to summarize findings of potential clinical significance and will be listed. 15.9. Interim Analysis No interim analyses are planned for this study."
88,page_88,"Version 10.0 Protocol Number: GBR 830-204 Date: 05-May-2020 Ichnos Sciences CONFIDENTIAL Page 88 of 103 15.10. Data Safety Monitoring Board This study will institute a data safety monitoring board (DSMB) which will function independently of all other individuals associated with the conduct of this clinical trial, including the site investigators participating in the study. The DSMB will be constituted prior to the randomization of the first subject. The DSMB will monitor subject safety by formally reviewing accumulated safety data by treatment group at least twice during the study, but may require additional review as per DSMB charter . This includes but does not limit the role of the DSMB to evaluate these data and to provide recommendations to the sponsor to continue or modify the follow-up phase of the study as outlined in the DSMB charter. It is expected that the DSMB will consist at a minimum of 2 physicians with appropriate disease area qualifications and 1 statistician. There will be a meeting with the DSMB describing their roles and responsibilities and discussing potential data format and process issues prior to the finalization of DSMB charter. 16. DIRECT ACCESS TO SOURCE DATA/DOCUMENTS 16.1. Study Monitoring Before an investigational site can enter a subject into the study, a representative of the Sponsor will visit the investigational study site to: • Determine the adequacy of the facil ities • Discuss with the Investigator and other personnel their responsibilities with regard to protocol adherence, and the responsibilities of the Sponsor or its representatives. This will be documented in a Clinical Study Agreement between the Sponsor and the Investigator. During the study, a monitor from the Sponsor or representative will have regular contacts with the investigational site, for the following: • Provide information and support to the Investigator • Confirm that facilities remain acceptable • Confirm that the investigational team is adhering to the protocol, that data are being accurately recorded in the eCRF, and that IP accountability checks are being performed • Perform source data verification. This includes a comparison of the data in the eCRFs with the subject’s medical records at the hospital or practice, and other records relevant to the study. This will require direct access to all original records for each subject (eg, clinic charts). • Record and report any protocol deviations not previously sent to the Sponsor. • Confirm AEs and SAEs have been properly documented on e CRFs and confirm any SAEs have been forwarded to the Sponsor and those SAEs that met criteria for reporting have been forwarded to the IRB."
89,page_89,"Version 10.0 Protocol Number: GBR 830-204 Date: 05-May-2020 Ichnos Sciences CONFIDENTIAL Page 89 of 103 The monitor will be available between visits if the I nvestigator or other staff needs information or advice. 16.2. Audits and Inspections Authorized representatives of the Sponsor, a regulatory authority, an IEC or an IRB may visit the site to perform audits or inspections, including source data verification. The Investigator should contact the Sponsor immediately if contacted by a regulatory agency about an inspection. 16.2.1. Inspection An inspection is defined as the act of a regulatory authority of conducting an official review of documents, facilities, records and any other resources that are deemed by the authorities to be related to the clinical study and that may be located at the site of the study, or at the Sponsor’s and/or CRO facilities or any other establishments deemed appropriate by the r egulatory authorities. 16.2.2. Audit An audit is a systematic and independent review of study- related activities and documents to determine whether study -related activities were conducted and the data were accurately recorded and analyzed according to the protocol, standard operating procedures, Good Clinical Practice (GCP), and the appropriate requirements. In conducting this study, the Investigator accepts that the Sponsor, IRB/IEC or regulatory body may, at any time by appointment, conduct an audit of the study site. 16.3. Institutional Review Board /Independent Ethics Committee The Investigator must obtain IRB /IEC approval for the clinic al study. Initial IRB /IEC approval, and all materials approved by the IRB /IEC for this study including the subject consent form and recruitment materials must be maintained by the Investigator and made available for inspection. 17. QUALITY CONTROL AND QUALITY A SSURANCE To ensure compliance with GCP and all applicable regulatory requirements, the Sponsor may conduct a quality assurance audit. Please see Section 16.2 for more details regarding the audit process. 18. ETHICS 18.1. Ethics Review The final study protocol, including the final version of the ICF, must be approved or given a favorable opinion in writing by an IRB or IEC as appropriate. The Investigator must submit written approval to the Sponsor before he or she can enroll any subject into the study. The Investigator is responsible for informing the IRB or IEC of any amendment to the protocol in accordance with local requirements. In addition, the IRB or IEC must approve all advertising"
90,page_90,"Version 10.0 Protocol Number: GBR 830-204 Date: 05-May-2020 Ichnos Sciences CONFIDENTIAL Page 90 of 103 used to recruit subjects for the study , as well as any materials (eg diaries, questionnaires) to be given to subjects. The protocol must be re-approved by the IRB or IEC upon receipt of amendments and annually, as local re gulations require. The Investigator is also responsible for providing the IRB or IEC with reports of any reportable serious adverse drug reactions from any other study conducted with the IP. The Sponsor will provide this information to the Investigator. Progress reports and notifications of serious adverse drug reactions will be provided to the IRB or IEC according to local regulations and guidelines. 18.2. Ethical Conduct of the Study The study will be performed in accordance with ethical principles that have their origin in the Declaration of Helsinki and are consistent with International Council for Harmonisation (ICH)/GCP guidelines , applicable regulatory requirements and the Sponsor’s policy on Bioethics. 18.3. Written Informed Consent The Investigator will ensure that the subject is given full and adequate oral and written information about the nature, purpose, possible risk and benefit of the study. Subjects must also be notified that they are free to discontinue from the study at any time. The subject should be given the opportunity to ask questions and allowed time to consider the information provided. The Investigator is responsible for obtaining informed consent from each subject/legally acceptable representative (LAR) participating in the study . All pertinent aspects of the study must be explained to the subject/LAR before he or she signs the informed consent. The subject’s signed and dated informed consent must be obtained before conducting any study procedures. Informed consent must be obtained from the subject/LAR before any activity or treatment is undertaken which is not part of routine care. This includes, but is not limited to, the performance of diagnostic or therapeutic screening procedures and the administration of the first dose of the study medication . Each subject must be informed that participation in the study is voluntary, that he/she may withdraw from the study at any time, and that withdrawal of consent will not affect his/her subsequent medical treatment or relationship with the treating physician. This informed consent should be given by means of a standard written statement, written in nontechnical language. The subject/LAR should understand the statement before signing and dating it and will be given a copy of the signed document. The Investigator(s) must maintain the original, signed ICF. A copy of the signed ICF must be given to the subject. 19. DATA HANDLING AND RE CORD KEEPING 19.1. Data Collection Clinical data will be entered by authorized site personnel into a 21 CFR Part 11 compliant electronic data capture system. All clinical data relating to the study will be recorded on the"
91,page_91,"Version 10.0 Protocol Number: GBR 830-204 Date: 05-May-2020 Ichnos Sciences CONFIDENTIAL Page 91 of 103 eCRF unless transmitted to the Sponsor or designee ele ctronically (eg, central laboratory data) . The Investigator must maintain source documents that support the information entered in the eCRF . Study monitors will perform ongoing source data verification to ensure that data entered into the eCRF by authorized site personnel are consistent with the source documents. The Investigator is responsible for confirming data entries are complete and accurate by physically or electronically signing the eCRF. The Sponsor or designee is responsible for the data manag ement of the study, including quality- check of the data. 19.2. Inspection of Records The Sponsor will be allowed to conduct site visits to the investigation facilities for the purpose of monitoring any aspect of the study. The Investigator agrees to allow the monitor to inspect the drug storage area, study drug stocks, drug accountability records, subject charts and study source documents, and other records relative to study conduct. 19.3. Retention of Records The Investigator must maintain all documentation relating to the study for a period of 2 years after the last marketing application approval, or if not approved 2 years following the discontinuance of the test article for investigation. If it becomes necessary for the Sponsor or the Regulatory Authority to revie w any documentation relating to the study, the Investigator must permit access to such records. 19.4. Financing and Insurance The Sponsor will provide clinical study insurance for any subjects participating in the study in accordance with all applicable laws and regulations. 20. PUBLICATION POLICY The Sponsor recognizes and supports the publication and dissemination of scientific information as a means of furthering knowledge. The general strategy regarding publication of the study (what, when, where, etc.) will be mutually agreed upon by the Investigator and Sponsor. However, in order to protect its commercial interests, the Sponsor reserves the right to manage the publication of all study results. The Investigator agrees that oral and written communication to third parties of any procedures or results from the study is subject to prior written consent of the Sponsor. Presentation material and/or manuscript(s) for publication will be reviewed by Sponsor prior to submission for publication. This review will be completed within 30 days of receiving presentation material and 60 days of receiving the manuscript from the Investigator. Alterations in the material will only be made in agreement between the Investigator and the Sponsor. In the event of inconsistency between the above and the study contract, the terms of the study contract would prevail to the extent of such inconsistency."
92,page_92,"Version 10.0 Protocol Number: GBR 830-204 Date: 05-May-2020 Ichnos Sciences CONFIDENTIAL Page 92 of 103 21. LIST OF REFERENCES 1. Basra MK, Fenech R, Gatt RM, Salek MS, Finlay AY. The Dermatology Life Quality Index 1994-2007: a comprehensive review of validation data and clinical results. Br J Dermatol 2008;159(5):997-1035. 2. Charman CR, Venn AJ, Williams HC. The patient- oriented eczema measure: development and initial validation of a new tool for measuring atopic eczema severity from the patients' perspective. Arch Dermatol 2004;140(12):1513-9. 3. Common Terminology Criteria f or Adverse Events (CTCAE) Version 4.03. Pulishded June 14, 2010. 4. Croft, M. Control of immunity by the TNFR-related molecule OX40 (CD134). Annu Rev Immunol 2010;28:57-78. 5. Deckers IA, McLean S, Linssen S, Mommers M, van Schaych CP, Sheikh A. Investigatin g International Time Trends in the Incidence and Prevalence of Atopic Eczema 1990 –2010: A Systematic Review of Epidemiological Studies 2012. PLoS ONE 7(7): e39803. https://doi.org/10.1371/journal.pone.0039803 6. Eckert L, Gupta S, Amand C, Gadkari, A, Mahajan P, Gelfand J. Impact of atopic dermatitis on health -related quality of life and productivity in adults in the United States: An analysis using the National Health and Wellness Survey. J Am Acad Dermatol 2017;77:274-9. 7. Eckert L, Gupta S, Amand C, Gadkari, A, Mahajan P, Gelfand J. The burden of atopic dermatitis in US adults: Health care resource utilization data from the 2013 National Health and Wellness Survey. J Am Acad Dermatol 2018, 78(1):54-61. 8. Eichenfield LF, Tom WL, Chamlin SL, Feldman SR, Hanifin JM, Simpson EL, et al. Guidelines of care for the management of atopic dermatitis: Part 1. Diagnosis and assessment of atopic dermatitis. J Am Acad Dermatol 2014;70(2):338-51. 9. Finlay AY, Khan GK. Dermatology Life Quality Index (DLQI) --a simple practical measure for routine clinical use. Clin Exp Dermatol 1994;19(3):210-6. 10. FDA Guidance for Industry M3(R2). Nonclinical safety studies for the conduct of human clinical trials and marketing authorization for pharmaceuticals, Rev 1, Jan 2010. Available at: https://www.fda.gov/downloads/drugs/guidances/ucm073246.pdf. 11. Hanifin JM, Thurston M, Omoto M, Cherill R, Tofte SJ, Graeber M. The eczema area and severity index (EASI): assessment of reliability in atopic dermatitis. EASI Evaluator Group. Exp Dermatol 2001;10(1):11-8. 12. Herrmann C. International experiences with the hospital anxiety and depression scale- a review of validation data and clinical results. J Psychosom Res 1997;42(1):17-41. 13. International Conference on Harmonisation (ICH) of Technical R equirements for Registration of Pharmaceuticals for Human Use. ICH harmonized tripartite guideline: general considerations for clinical trials, E8. CPMP/ICH/291/95, Jul 1997. Available at: http://www.ich.org/fileadmin/Public_Web_Site/ICH_Products/Guidelines/Efficacy/E8/Step4/E8_Guideline.pdf"
