,PageNo,Text152,page_152,"2017N326521_02 CONFIDENTIA L 207966 153Participants, who have stopped abacavir for an y reason, and particularl y due to possible adverse reactions or illness, must be advised to contact their doctor before restarting EPZICOM / KIVEXA as more se vere symptoms may recur within hours and may include life -threatening hy potension and death. Each participant should be reminded to read the Package Leaflet included in the EPZICOM / KIVEXA pack. They should be reminded of the importance of removing the A lert Card included in the pack, and keeping it with them at all times. 7.4.5.12.2. Reporting of Hypersensitivity Reactions If a clinically suspected case of HSR to ABC meets one of the International Conference on Harmonization (ICH E2A, 1994 definitions of seriousness listed in Section 11.6.2 then, in addition to reporting the case as an SAE, the ABC HSR eCRF should also be completed within one week of the onset of the h ypersensitivity reaction. Clinically suspected cases of HSR to ABC that do not meet criteria as an SAE can be recorded as an AE. 7.4.5.13. Rash Without A BC HSR Sy mptoms Including serious skin reactions such as Stevens- Johnson Syndrome, Toxic Epidermal Necrolysis, Erythema Multifo rme or rash with significant liver dysfunction. Participants should be instructed to contact the Investigator as soon as possible if they develop a rash on study . Participants who develop rash of an y grade should be evaluated for the possibility of an ABCHSR or a serious skin reaction such as Stevens -Johnson sy ndrome (SJS), Toxic Epidermal Necrol ysis (TEN) or Ery thema Multiforme. SJS, TEN, and Ery thema Multiforme have been reported very rarely in patients taking ABC -containing products. These patients generally do not have the cluster of additional sy mptoms (e.g., gastrointestinal and respiratory ) that characterize the ABC HSR, but they do have features ty pical of these serious skin reactions. If a serious skin reaction develops, ABC (and / or all othe r concurrent medication(s) suspected in the Investigators causalit y assessment) should be discontinued, and the participant should not be re- challenged with an y ABC-containing medicinal product (i.e., ZIAGEN, TRIZIVIR, EPZICOM, or KIVEXA). As many products other than abacavir also cause rash and/or serious skin reactions, all other medicinal products that the participant is receiving should also be reviewed and discontinued as appropriate. The following guidance is provided for clinical management of partic ipants who experience rash alone in the absence of accompany ing diagnosis of ABC HSR, sy stemic or allergic s ymptoms or signs of mucosal or target lesions. CAB is an analogue of DTG and mild to moderate rash is an expected adverse reaction for DTG-containing ART. Episodes generally occur within the first ten weeks of 2019N406358_00"
153,page_153,"2017N326521_02 CONFIDENTIA L 207966 154treatment, rarel y require interruptions or discontinuations of therap y and tend to resolve within two to three weeks. No instances of serious skin reaction, including Stevens-Johnson sy ndrome (SJS), toxic epidermal necrol ysis (TEN) and ery thema multiforme, have been reported for DTG in clinical trials. For further characterization of HSR and rash observed with DTG -containing ART, please see the current version of the IB [GlaxoSmithKline Docume nt Number RH2009/00003/06]. Rash is an adverse drug reaction (ADR) for RPV. I n clinical trials, most rashes emerged during the first 4 weeks of treatment, were transient, and usually mild (Grade 1) to moderate (Gr ade 2). There were no Grade 4 rashes and none were serious. Treatment- related Grade 3 rash was reported in 0.1% of participants in the RPV group. Treatment - related rash led to permanent discontinuation in 0.1% of participants in the RPV group. No cases of erythema multiforme, SJS or TEN have been reported during clinical development of RPV. Participants with an isolated Grade 1 rash may continue study drug at the Investigator’s discretion. The participant should be advised to contact the Investigator i mmediately if there is an y worsening of the rash, if an y systemic signs or s ymptoms appear, or if mucosal involvement develops. Participants may continue study drug for an isolated Grade 2 rash. However, study drug (and all other concurrent medication(s) suspected in the I nvestigators c ausality assessment) should be permanently discontinued for any Grade ≥2 rash that is associated with an increase in ALT. The participant should be advised to contact the phy sician immediately if rash fails to resolve (after more than two weeks), if there is any worsening of the rash, if an y systemic signs or allergic s ymptoms develop, or if mucosal involvement develops. Participants should permanently discontinue study drug [and all other concurrent medication(s) suspected in the I nvestigators causality assessment] for an isolated Grade 3 or 4 rash, except where the etiology of the rash has been definitivel y diagnosed as NOT attributable to study drug (see below), and the participant should be withdrawn from the study. Participants should be treated as cl inically appropriate and followed until resolution of the AE. Every effort should be made to collect as much information as possible about the evolution of the event and an y relationship with potentially related medical events (e.g., viral infection) or s tart of concomitant medication. The rash and an y associated sy mptoms should be reported as adverse events and appropriate toxicity ratings should be used to grade the events (based on DAIDS toxicity gradings –see Section 11.2, Appendix 2). However, if the etiology of the rash has been definitively diagnosed as being unrelated to study drug and due to a specific medical event or a concomitant infection or a concomitant no n-study medication, routine management should be performed and documentation of the diagnosis provided. In this situation, the study drug should be continued. 2019N406358_00"
154,page_154,"2017N326521_02 CONFIDENTIA L 207966 155Participants in the Follow-Up Phase who are receiving ABC as part of their regimen should be evaluated for the possibility of a clinically suspected ABC HSR and managed appropriatel y as outlined in the local prescribing information for ABC. Any rash that is possibly related to study drug, and is present between Day 1 and The Week 4b visit for partic ipants in the Oral Lead -in Phase , must be discussed with the Medical Monitor prior to initiation of CAB LA or RPV LA. Any participant receiving at least one dose of CAB L A and /or RPV LA who discontinue IP / Withdraw will initiate treatment with HAART and enter the LTFUPhase for 52 weeks of follow-up. 7.4.6. Suicidal Risk Monitoring Participants with HIV infection may occasionally present with s ymptoms of depression and/or suicidal ideation or behavior. In addition, there have been some reports of depression, suicidal ideation and behavior (particularly in participants with a pre -existing history of depression or psy chiatric illness) in some patients being treated with I NIs. Additionally , depression and anxiety has been reported in some participants being treate d with RPV. Therefore, it is appropriate to monitor and closel y observe participants prospectivel y before and during treatment for suicidal ideation and/or behavior, or an y other unusual changes in behavior. It is recommended that the Investigator consid er mental health consultation or referral for participants who experience signs of suicidal ideation or behavior. Participants presenting with new onset/treatment emergent depression should be advised to contact the investigator immediately if symptoms of severe acute depression (including suicidal ideation/attempts) develop, because medical intervention and discontinuation of the study medication may be required. Assessment of treatment -emergent suicidalit y will be monitored during this study using the electronic version of the Columbia Suicide -Severity Rating Scale (eC- SSRS). The definitions of behavioural suicidal events used in this scale are based on those used in the Columbia Suicide History Form [ Posner, 2007]. Questions are asked on suicidal behavior, suicidal ideation, and intensity of ideation. Screening visit questions will be in relation to lifetime experiences and current experiences (within the past 2 months) and all subsequent questioning in relation to the last assessment. The eC -SSRS is to be administered as a patient completed questionnaire specified in the Time and Events Table (Section7.1). The eC -SSRS will be conducted electronicall y by telephone or b y computer/tablet connected to the internet. Additionally , the investigator will collect information using the Possible Suicidality - Related AE (PSRAE) eCRF form in addition to the Adverse Event (non -serious or Serious Adverse Events) eCRF form on an y participant that experiences a possible suicidality -related adverse event while participating in this study . This may include, but is not limited to, an event that involves suicidal ideation, a preparatory act toward imminent suicidal behavior, a suicide attem pt, or a completed suicide. The investigator will exercise his or her medical and scientific judgment in deciding whether an event is possibly suicide-related. PSRAE forms should be completed and reported to ViiV/GSK 2019N406358_00"
155,page_155,"2017N326521_02 CONFIDENTIA L 207966 156within one week of the investigator d iagnosing a possible suicidality -related adverse event. All sites should have a plan in place for managing possible risks for suicide related events. 7.4.7. Pregnancy 7.4.7.1. Pregnancy testing Women of childbearing potential must have a negative pregnancy testat Screening, and at Baseline (Day 1). Pregnancy testing will also be conducted as per the Time and Events Table (Section 7.1) and at any time during the trial when pregnancy is suspected. Additionally , the Medical Mon itor may request that a urine pregnancy test be performed in the event of a treatment interruption greater than 7 day s. 7.4.7.2. Time Period for Collecting Pregnancy Information Pregnancy information will be collected from Day 1 until the last follow -up assessment. This includes the entiret y of the LTFUPhase. Female participants that have received at least one dose of CAB LA or RPV LA and do not enter the LTFUPhase should use an acceptable method of contraception ( see the SPM for a listing of examples of acceptab le hormonal contraception) until at least 52 weeks after the last dose of study drug. If a participant becomes pregnant within 52 weeks of the last dose of study drug the participant should notify the study site. 7.4.7.3. Action to be Taken if Pregnancy Occurs Anyindividual who becomes pregnant (intrauterine) while participating in this study must be withdrawn from the study and must immediately discontinue study drug. Participants who have received at least one dose of CAB LA and/or RPV LA should discontinue fur ther dosing and continue oral HAART in the LTFUPhase (see Section 4.2.4above), after discussion with the Medical Monitor. Any pregnancy that occurs during stud y participation must be reported using a clinica l trial pregnancy form. To ensure participant safety, if a pregnancy is reported then the investigator should inform GSK within 24 hours of learning of the pregnancy and should follow the procedures outlined in Appendix 7. Participants who have received at least one IM injection of CAB LA and RPV L A and become pregnant during the study will have additional PK samples collections to monitor CAB LA and RPV LA exposure throughout the pregnancy and at the time of delivery. Additionally , there will be an optional umbilical cord blood collection at time of delivery and/or breast milk after delivery , requiring additional parental informed consent. Cord blood and breast milk samples would be used to better understand the level of PK exposure to the neonate, if any . The pregnancy must be followed up to determine outcome (including premature termination) and status of mother and child(ren). Pregnancy complications and elective 2019N406358_00"
156,page_156,"2017N326521_02 CONFIDENTIA L 207966 157terminations for medical reasons must be repor ted as an AE or SAE. Spontaneous abortions must be reported as SAEs. Any SAE occurring in association with a pregnancy brought to the investigator’s attention after the participant has completed the study and considered by the investigator as possibly related to the study treatment, must be promptly reported to ViiV/GSK. GSK’s central safet y department will also forward this information to the Antiretroviral Pregnancy Registry. The international registry is jointly sponsored by manufacturers or licensees of ARV products. Additional information and a list of participating manufacturers/licensees are available from http://apregistry .com/index.htm. 7.4.8. Physical Exams Physical exams should be conducted as part of normal routine clinical care . Abnormalities noted during an y exam must be recorded in the eCRF (e.g., in the current medical conditions or AE logs). A complete ph ysical examination will include, at a minimum, assessment of the Cardiovascular, Respiratory , Gastrointestinal, and Neurological sy stems. Height and weight will also be measured and recorded as per the Time and Events Table in Section 7.1above. A brief ph ysical examination will include, at a minimum assessments of the skin, lungs, cardiovascular s ystem, and abdomen (liver and spleen). The site of IM injection administration should be assessed at every visit for signs of an y possible reaction. See Section 7.4.5.10for additional information. Investigators should pay special attention to clinical signs related to previous serious illnesses. 7.4.9. Vital Signs Vital signs will be measured in semi -supine position after 5 minutes rest and will include temperature, sy stolic and diastolic blood pressure and pulse rate. These will be recorded as per the Time and Events Table in Section 7.1. 7.4.10. Electrocardiogram (ECG) A 12-lead ECG will be performed in a semi- supine position. On Day 1, (Baseline), ECGs should be performed in triplicate prior to first dose. At Day 1and Week 48 of the Maintenance Phase, a 2 hour post dose ECG will be performed for participants receiving CAB LA + RPV LA with an allowable window of 30 minutes. An ECG machine that automatically calculates the heart rate and measures PR, QRS, QT, and QTc intervals is preferred, and these calculated numbers can be used for reporting purposes. Otherwise, an appropriatel y qualified ECG reader must interpret the results. The same interpreter should assess all ECGs for each participant. Regardless, each ECG should be reviewed by a qualified ECG reader. The qualified ECG reader will make the non -calculated ECG interpretations. Refer to the Time and Events Table for collection timepoints (Section 2019N406358_00"
157,page_157,"2017N326521_02 CONFIDENTIA L 207966 1587.1). Refer to Section 5.5.2for [QTc] withdrawal criteria and additional [QTc] readings that may be necessary 7.5. Pharmacokinetics Plasma samples for determination of CAB and RPV concentration swill be collected throughout the Maintenance and Extension Phases of the study . Additional samples will be collected for storage during the LTFUPhase (blood and plasma). Samples (blood and plasma) for determination of RPV concentrations will be protect ed from light at all times, from sampling collection through anal ysis. 7.5.1. PK Sample Collection Blood samples for evaluation of CAB (2mL each) and RPV (2 mL each) plasma PK concentrations will be collected from all participants as described in Table 10. For participants transitioning from oral SOC, at Week 4b PK samples should be collected within the window of 20 -28 hours after the last oral dose of CAB + RPV was taken the day prior to the clinic visit. Participants w ill take their final dose of oral CAB + RPV in the clinic at Week 4b after the pre -dose PK sample. These participants will be expected to complete a PK dosing diary card noting the date and time of the last three oral doses of IP prior to the scheduled cl inicvisits at Week 4b. The information from the diary card and the actual date and time of the PK samples will be recorded in the eCRF. Additionally , dosing information on the clinic day , including dosing and the actual date and time of the PK samples, must be recorded on the eCRF . Plasmaconcentrations will be summarized and used to evaluate potential exposure - response relationships. The timing of PK samples may be altered and/or PK samples may be obtained at additional time points to ensure thorough PK monitoring. 2019N406358_00"
158,page_158,"2017N326521_02 CONFIDENTIA L 207966 159Table 10CAB and RPV Plasma Pharmacokinetic Sample Schedule Group Analyte s Sample Times Relative to Dose Participants receiving CAB LA + RPV LA Q4W injectionsCAB and RPV Pre-Dose: Weeks 4b, 8, 16, 24, 32, 40, 48, and 96 A PK sample will be taken at Withdrawal. PK samples for storage only: Pre-dose: Week 12, 20, 28, 36, 44, 52, 56, 60, 64, 68, 72, 76, 80, 84, 88, 92, 100 Long -term follow -up Period (off -drug; storage sample) Months 3, 6, 9, and 12 Participants rece iving CAB LA + RPV LA Q8W injectionsCAB and RPV Pre-Dose :Day 1 *,Weeks 4b* *, 8, 16, 24, 32, 40, 48, and 96 1 Week Post Dose: Week 9 and Week 41 A PK sample will be taken at Withdrawal PK samples for storage only: Pre-dose: Weeks 56, 64, 72, 80, 88, 10 0 LTFU Period (off -drug; storage sample) Months 3, 6, 9, and 12 *Day 1 sample required only for those transitioning from ATLAS on Q4W injections. **Week 4b sample required only for participants transitioning from oral SOC and requiring oral CAB + RPV Lead -in PK window collection: Allscheduled PK samples should be collected on the Day of the corresponding visit. Pre -dose samples will be taken prior to performing dosing within the clinic. Pre-dose sample col lection at Week 4b ( for participants transitio ning from the current ART arm) should be collected 20 to 28 hours after the last oral dose of CAB and RPV was taken. If a participant withdraw sfrom the study a PK sample should be collected as earl y as practically possible (i.e.,at withdrawal visit or on t he day the withdrawal decision was made). Additional details concerning handling of PK samples, labeling and shipping directions will be supplied in the central laboratory manual. Samples for determination of RPV will be protected from light until analysed. 2019N406358_00"
159,page_159,"2017N326521_02 CONFIDENTIA L 207966 1607.5.2. Rationale of PK Sampling Strategy Blood sampling for CAB and RPV concentrations will be performed during the Maintenance Phase of the study to evaluate PK in HIV infected participants. The proposed PK visits and sampling scheme at each visit presente d in Section 7.1 is based on consideration of available PK data to support interim and final PK and PK/Pharmacod ynamic (PD) anal ysis planned in this study . 7.5.3. Sample A nalysis 7.5.3.1. CAB Sample A nalysis Plasma CAB anal ysiswill be performed under the control of PTS -DMPK, GlaxoSmithKline, the details of which will be included in the Study Reference Manual (SRM).Concentrations of CAB will be determined in plasma samples using the currently approved bioanalytical methodology. Raw data will be archived at the bioanalytical site (detailed in the SRM). Once the plasma has been anal yzed for CAB any remaining plasma may be analyzed for other compound -related metabolites and the results reported under a separate GSK PTS - DMPK, GSK protocol. No human DNA anal ysis will be performed on these samples. 7.5.3.2. RPV Sample A nalysis Plasma RPV analy sis will be performed under the control of Janssen R&D. Concentrations of RPV will be determined in plasma samples using the currentl y approved bioanal ytical methodology . Raw data will be archived at the bioanaly tical site. Once the plasma has been anal yzed for RPV any remaining plasma may be used by the sponsor for further exploratory work on pharmacokinetics, metabolites, plasma protein binding, prote in analysis, and biochemistry . No human DNA analy sis will be performed on these samples. 7.6. Genetics Information regarding genetic research is included in Appendix 5: Genetic Research. 7.7. Viral Genoty ping and Phenoty ping Whole venous blood samples will be obtained from each participant to provide PBMCs and plasma for storage samples according to the Time and Events Table (see Section 7.1) for potential viral genot ypic and phenot ypic analyses. Details concerning the handling, labeling and shipping of these samples will be supplied separately . Genotypic and phenotypic anal yses may be carried out by Monogram Biosciences using, but not limited to, their Standard PhenoSense and GenoSu re testing methods for protease (PRO), reverse transcriptase (RT), and integrase assays. 2019N406358_00"
160,page_160,"2017N326521_02 CONFIDENTIA L 207966 1617.7.1. HIV-1 Polymerase Viral Genoty ping and Phenotyping Participants meeting confirmed virologic failure will have plasma samples tested for HIV-1 PRO and RT genoty pe and phenotype and HIV -1 integrase genot ype and phenotype from samples collected at the time of meeting suspected virologic failure; these results will be reported to the investigator as soon as available to provide guidance for election of an alternative regimen . 7.7.2. HIV-1 Exploratory Analysis Additional analy ses for HIV -1 resistance may , for example, be carried out on peripheral blood mononuclear cell (PBMC) samples collected at Baseline and/or on stored blood samples from other relevant time points. These analy sesmay include but are not limited to additional viral genotyping and/or phenotyping, as well as other virologic evaluations such as linkage and minority species anal yses, low level HIV -1RNA quantitation and measurement of viral replicative capacity . HIV-1 PRO and RT genot ype andphenotype and HIV-1 integrase genoty pe and phenot ype will also be determined on the last on - treatment isolates from participants who have HIV- 1 RNA 200 c/mL regardless of confirmatory HIV-1 RNA. 7.8. Value Evidence and Outcomes Health outcomes assessments will be conducted according to the Time and Events Table (Section 7.1). Assessments are recommended to be administered with a paper instrument at the beginning of the visit prior to collecti on of blood for anal ysis and other scheduled assessments . The “Preference” questionnaire will assess whether patients prefer the CAB L A + RPV LA injectable treatment or the daily oral ARV regimen, and assess preference for the CAB LA + RPV LA Q8W regimen or CAB LA + RPV L A Q4W regimen. The “Preference” questionnaire will include 3 questions evaluating preference of HIV treatment and the attributes supporting this preference. The HIV Treatment Satisfaction Questionnaire (HIVTSQ) [ Woodcock , 2001 and Woodcock , 2006] was developed to evaluate treatments for HIV and patient satisfaction. The original HIVTSQ included 10 items and underwent two stages of ps ychometric validation ( Woodcock , 2001, Woodcock , 2006). Recently, the HIVTSQ was adapted to include injectable treatment for HIV following a qualitative study with HIV patients in five European countr ies. The adaptation of the HIVTSQ included two additional items related to the mode of administration (i.e., long acting intramuscular injection) . These are: 2019N406358_00 CCI - This section contained Clinical Outcome Assessment data collection questionnaires or indices, which are protected by third party copyright laws and therefore have been excluded."
