,PageNo,Text26,page_26,"Boehringer Ingelheim 18 Nov 2019 BI Trial No.: 1399-0003 c23936559-02 Clinical Trial Protocol Page 27of 79 Proprietary confidential information © 2019 Boehringer I ngelheim I nternational GmbH or one or more of its affiliated companies 001-MCS -40-106- RD-03(15.0)/Saved on:30.Nov 2017A log of all patients enrolled into the trial (i.e. who have signed informed consent) will be maintained in the Investigator Site File ( ISF)irrespective of whether they have been treated with investigational drug or not. If a patient is enrolled in error (does not meet all inclusion criteria or meets one or more exclusion criteria on the day of enrolment), the sponsor should be contacted immediately . 3.3.1 Main diagnosis for trial entry Adult and adolescent (12 to 17 y ears of age) patients diagnosed with CF and who comply with eligibility requirements may qualify for participation in this trial. Please refer to Section 8.3.1 (Source Documents) for the documentation requirements pertaining to the in -and exclusion criteria. 3.3.2 Inclusion criteria 1.Male or female patients, 12 y ears of age or older atscreening ; 2.Documented diagnosis of cy stic fibrosis including: positive sweat chloride ≥ 60 mEq/L , by pilocarpine iontophoresis OR genot ype with 2 identifiable mutations consistent with cy stic fibrosis ac companied by one or more clinical features with cy stic fibrosis phenoty pe; 3.Patients able to perform acceptable spirometric manoeuvres according to American Thoracic Society (ATS) standards; 4.FEV 1≥ 40%and ≤ 90% of predicted* values at screening and predose at Visit 2 ; 5.Women of childbearing potential (WOCBP)1must be willing and able to use highl y effective methods of birth control per ICH M3 (R2) that result in a failure rate of less than 1% per year when used consistently and correctly . A list of contrace ption methods meeting these criteria is provided in the patient (or patient’s legal guardian) information; 6.Signed and dated written informed consent and assent in accordance with ICH Harmonized Guideline for Good Clinical Practice (GCP) and local legislation prior to admission in the trial. *Global L ung Initiative (GLI) lung function reference equations [R15-0845 ]. 3.3.3 Exclusion criteria 1.Evidence of acute upper or lower respiratory tract infection within 4 weeks prior to randomisation based on investigator’s judgement; 2.Pulmonary exacerbation requiring use of i.v./oral/inhaled antibiotics or oral corticosteroids within 4 weeks prior to randomisation; 1A wo man is considered of childbearing potential (WOCBP) , i.e. fertile, following menarche and until becoming post- menopausal unless permanently sterile. Permanent sterilisation methods include hysterectomy, bilateral salpingectomy and bilateral oophorectomy. Tubal ligation is NOT a method of permanent sterilisation. A postmenopausal state is defined as no menses for 12 months without an alternative medical cause."
27,page_27,"Boehringer Ingelheim 18 Nov 2019 BI Trial No.: 1399-0003 c23936559-02 Clinical Trial Protocol Page 28of 79 Proprietary confidential information © 2019 Boehringer I ngelheim I nternational GmbH or one or more of its affiliated companies 001-MCS -40-106- RD-03(15.0)/Saved on:30.Nov 20173. Patients with h istory of Acute Tubular Necrosis (ATN) ; 4.Any documented active or suspected malignancy or history of malignancy within 5 y ears prior to screening, except appropriatel y treated basal cell carcinoma of the skin or in situ carcinoma of uterine cervix ; 5.Patients unable to inhale trial drug in an appropriate manner from the Respimat®inhaler based on investigator’s judgement; 6.Patients who have started a new chronic medication for CF within 4 weeks of randomisation; 7.Patients who have previously received a lung transplant or patients who are currentl y on a waiting list to receive a lung transplant; 8.Patients with a significant history of allergy /hypersensitivity (including medication allergy ) which is deemed relevant to the trial as judged b y the investigator or with a known hy persensitivity to trial d rug or its components . “Significance ” in this context refers to an y increased risk of hypersensitivity reaction to trial medication; 9.Any clinically significant laboratory abnormalities at screening as judged by the investigator, or an y of the following: Potassium > upper limit of normal (ULN) in non -haemolysed blood Abnormal renal function defined as estimated Glomerular Filtration Rate ( eGFR ) < 60ml/min/1.73m² Abnormal liver function, defined by serum level of either alanine transaminase (ALT), aspartate transaminase (AST) or total bilirubin ≥ 3 x upper limit of normal (ULN) 10.Clinically significant disease or medical condition other than CF or CF -related conditions that, in the opinion of the investigator, would compromise the safet y of the patien t or the data quality . This includes significant haematological, hepatic, renal, cardiovascular and neurologic disease. Patients with diabetes may participate if their disease is under good control prior to screening; 11.Patients not expected to comply with t he protocol requirements or not expected to complete the trial as scheduled; 12. Previous randomisation in this trial ; 13.Currently enrolled in another investigational device or drug trial, or less than 30 day s or six half -lives (whichever is greater) since endin g another investigational device or drug trial(s), or receiving other investigational treatment(s); 14.Chronic alcohol or drug abuse or an y condition that, in the investigator’s opinion, makes them an unreliable trial patient or unlikely to complete the trial ; 15.Women who are pregnant, nursing, or who plan to beco me pregnant while in the trial . 3.3.4 Withdrawal of patient s from treatment or assessments Patients may discontinue trial treatment or withdraw consent totrial participation as a whole (“withdrawal of consent”) ;please see sections 3.3.4.1 a nd 3.3.4.2 below. Every effort should be made to keep thepatients in the trial. Measures to control the withdrawal rate include c areful patientselection, appropriate explanation of the trial requirements and procedures prior to trial enrolment ,as well as the explanation of the consequences of withdrawal."
28,page_28,"Boehringer Ingelheim 18 Nov 2019 BI Trial No.: 1399-0003 c23936559-02 Clinical Trial Protocol Page 29of 79 Proprietary confidential information © 2019 Boehringer I ngelheim I nternational GmbH or one or more of its affiliated companies 001-MCS -40-106- RD-03(15.0)/Saved on:30.Nov 2017The decision to discontinue trial treatment or withdraw consent totrialparticipation andthe reason must be documented in the patient files and CRF. If the reason for discontinuation is death, this should be reported on the SAE form as well, regardless of causal relationship. 3.3.4.1 Discontinuation of trial treatment An individual patient will di scontinue trial treatment if: The patient wants to discontinue trialtreatment , without the need to justify the decision. The patient has repeatedly shown to be non -compliant with important trialprocedures and, in the opinion of both, the investigator and sponsor representative, is not willing or able to adhere to the trial requirements in the future. The patient can no longer receive trial treatment for medical reasons ( such as surgery , adverse events, other diseases, or pregnancy ). If a patient becomes pregnant during the trial, the trial medications will need to be stopped and patient will be followed up until birth or otherwise termination of pregnancy . The data of the patien t will be collected and reported in the clinical trial report until patient last visit and that any events thereafter will be reported in the BI Pharmacovigilance database. Please refer to Section 5.2.6.2.3 for detailed infor mation on event reporting in case of pregnancy. The patient has a confirmed level of serum potassium of > ULN in non -haemoly sed blood. Each result of elevated serum potassiu mlevel > ULN should be confirmed , either by a second measurement or by presence of clinical symptoms. At least one measurement should be performed b y central laborator y. If second measurement is required and if blood sampling for central laboratory cannot be done in a reasonable timeframe according to investigator´s judgement , confirmation of serum potassium level can be evaluated by local laboratory . An individual patient may be considered to be withdrawn from trial treatment if: The patient is not consistently taking a concomitant chronic CF medication. Changes in concomit ant treatment required due to medicall y valid reasons will be permitted as judged by the investigator. The patient experiences more than one acute upper or lower respiratory tract infect ion or pulmonary exacerbation. In this case, a documented discussion should take place between investigator and sponsor to determine how to proceed. The patient has repeatedly shown to be non -compliant with trial medication intake (below 80% or above 120%). Given the patient ’s agreement, the patient will undergo the procedures for earl y treatment discontinuation and follow up as outlined in the Flow Chart (FC) and Section 6.2.3 . For all patient s the reason for withdrawal from trial treatment (e.g. advers e events) must be recorded in the CRF . These data will be included in the trialdatabase and reported. 3.3.4.2 W ithdrawal of consent totrial participation Patient smay withdraw their consent to trial participation at an y time without the need to justify the decision."
29,page_29,"Boehringer Ingelheim 18 Nov 2019 BI Trial No.: 1399-0003 c23936559-02 Clinical Trial Protocol Page 30of 79 Proprietary confidential information © 2019 Boehringer I ngelheim I nternational GmbH or one or more of its affiliated companies 001-MCS -40-106- RD-03(15.0)/Saved on:30.Nov 2017If a patient wants to withdraw consent, the investigator should be involved in the discussion with the patient and explain the difference between trial treatment discontinuation and withdrawal of consent totrial participation . 3.3.4.3 Discontinuation of the trial by the s ponsor Boehringer Ingelheim reserves the right to discontinue the trialoverall or at a particular trial site at any time for the following reasons: 1. Failure to meet expected enrolment goals overal l or at a particular trialsite. 2.Emergence of an y efficacy /safet y information invalidating the earlier positive benefit - risk-assessment that could significantl y affect the continuation of the trial. 3.Violation of GCP, the trial protocol , or the contract impairing the a ppropriate conduct of the trial. Furthermore, based on the interim analysis to be conducted on the first 28 patients included , the trial may be stopped as defined in Section 3.1 and Section 7.4. The investigator / the trialsite will be reimbursed for reasonable expenses incurred in case of trialtermination (except in case of the third reason)."
30,page_30,Boehringer Ingelheim 18 Nov 2019 BI Trial No.: 1399-0003 c23936559-02 Clinical Trial Protocol Page 31of 79 Proprietary confidential information © 2019 Boehringer I ngelheim I nternational GmbH or one or more of its affiliated companies 001-MCS -40-106- RD-03(15.0)/Saved on:30.Nov 20174. TREATMENTS 4.1 I NVESTIGATIONAL TREAT MENTS The trialmedication will be provided b y BI. Chronic CF medications arenot considered as part of the clinical trial supplies and therefore will not be provided by BI. 4.1.1 Identity of the Investigational Medicinal Products The characteristics of the test products are as shown below. Table 4.1.1:1 Test product 1 Substance: BI 1265162 Pharmaceutical formulation: Inhalation solution Source: Boehringer Ingelheim Pharma GmbH & Co. KG Unit strength: 10µg per actuation Posology : 2 inhalations twice a day Method and route of administration: Oral inhalation via Respimat®inhaler Table 4.1.1:2 Test product 2 Substance: BI 1265162 Pharmaceutical formulation: Inhalation solution Source: Boehringer Ingelheim Pharma GmbH & Co. KG Unit strength: 25µg per actuation Posology : 2 inhalations twice a day Method and route of administration: Oral inhalation via Respimat®inhaler
31,page_31,Boehringer Ingelheim 18 Nov 2019 BI Trial No.: 1399-0003 c23936559-02 Clinical Trial Protocol Page 32of 79 Proprietary confidential information © 2019 Boehringer I ngelheim I nternational GmbH or one or more of its affiliated companies 001-MCS -40-106- RD-03(15.0)/Saved on:30.Nov 2017Table 4.1.1:3 Test product 3 Substance: BI 1265162 Pharmaceutical formulation: Inhalation solution Source: Boehringer Ingelheim Pharma GmbH & Co. KG Unit strength: 50µg per actuation Posology : 2 inhalations twice a day Method and route of administration: Oral inhalation via Respimat®inhaler Table 4.1.1:4 Test product 4 Substance: BI 1265162 Pharmaceutical formulation: Inhalation solution Source: Boehringer Ingelheim Pharma GmbH & Co. KG Unit strength: 100µg per actuation Posology : 2 inhalations twice a day Method and route of administration: Oral inhalation via Respimat®inhaler Table 4.1.1:5 Test product 5 Substance: Placebo Pharmaceutical formulation: Inhalation solution Source: Boehringer Ingelheim Pharma GmbH & Co. KG Unit strength: Not applicable Posology : 2 inhalations twice a day Method and route of administration: Oral inhalation via Respimat®inhaler
32,page_32,"Boehringer Ingelheim 18 Nov 2019 BI Trial No.: 1399-0003 c23936559-02 Clinical Trial Protocol Page 33of 79 Proprietary confidential information © 2019 Boehringer I ngelheim I nternational GmbH or one or more of its affiliated companies 001-MCS -40-106- RD-03(15.0)/Saved on:30.Nov 20174.1.2 Selection of doses in the trial anddose modifications In this trial, the doses of 20 µg, 50 µg, 100 µg and 200 µg bid of BI 1265162 will be compared to placebo. The medication will be inhaled twice dail y during four weeks, using the Respimat®inhaler. Each dose will consist of two inhalations; therefore the 20 µgdose will consist of two inhalations of 10 µg, the 50 µgdose will consist of two inhalations of 25 µg, the 100 µgdose will consist of two inhalations of 50 µg and the 200 µg dose will consist of two inhalations of 100µg. The doses selected were ba sed on the previous SRD and MRDstudies in healthy volunteers (please refer to the Investigator Brochure for further details). The doses were selected in order to cover the expected therapeutic range (50 µg to 200 µg) anda sub -therapeutic dose (20 µg) whic h is required for a proper modeli ng of the dose response shape. With these selected doses, sufficient information should be gathered to select a safe and effective dose to be assesse d in Phase III pivotal studies. 4.1.3 Method of assigning patient s to treatment groups As described in Section 3.1 , patient randomisation will start with only adult patients to either 200 µg bid of BI 1265162 or placebo in a 1:1 ratio. As soon as 28 patients are allocated to these two treatment arms, the remaining patients will be allocated to the other doses of BI 1265162 as well as the highest dose and placebo in a 1:1:1:1:1 ratio (14 patients per treatment arm). The assignment will occur in a blinded fashion viaInteractive Response Technology (IRT). The IRT will assign the appropriate medication number based on the treatment sequence. The randomisation code will be controlled and documented. All instructions for use of the IRT system will be described in a user guide/manual which will be available in t he ISF. 4.1.4 Drug assignment and administration of doses for each patient 4.1.4.1 Drug assignment and Dispensing of medication Patients who qualify for randomisation will be randomly assigned b y the IRT to one of the treatment groups listed below. Table 4.1.4: 1 Dosage and treatment schedule for the treatment period Total Daily Dose (µg)Visit 2 4 weeks 40 (20 µg bid) 2x10 µg twice a day 100 (50 µg bid) 2x25µg twice a day 200 (100 µg bid) 2x50µg twice a day 400 (200µg bid) 2x100µg tw ice a day Placebo 2 puffs twice a day"
33,page_33,"Boehringer Ingelheim 18 Nov 2019 BI Trial No.: 1399-0003 c23936559-02 Clinical Trial Protocol Page 34of 79 Proprietary confidential information © 2019 Boehringer I ngelheim I nternational GmbH or one or more of its affiliated companies 001-MCS -40-106- RD-03(15.0)/Saved on:30.Nov 2017Dispensation of the appropriate medication kits will occur at Visit 2. The patient will receive one Respimat®medication kits and one reserve Respimat®inhaler .Medication swill be dispensed by the investigator, study coordinator or pha rmacist, depending on the site structure . The reserve kit allows the patient the flexibility of not having to return to the clinic immediately to replace a lost or malfunctioning Respimat®inhaler. In the event that the patient may need additional extra Re spimat®inhalers and cartridges due to rescheduled visits, inhaler loss or malfunction, these will be supplied on an ‘on demand’ basis. Dispensing of these extra Respimat®inhalers will also be managed via the IRT. 4.1.4.2 Training and Priming of the Respimat®inhaler Patients will receive training on the use of the Respimat®inhaler at Visit 1 to familiarize them selves with assembling, priming and using the inhaler . Training will be repeated at V isit 2and3 where observance of the inhalation procedure will occur . Each newl y assembled Respimat®inhaler needs to be primed prior to first time use. The inhaler should be primed by actuating it until an aerosol is visible, plus three additional actuations. All priming actuations s hould be directed to the ground and priming should NOT take place in the same room where the patient is inhaling trial medication or in the room where PK blood samples are taken or being processed. On the PK sampling day s, should priming of a new Respimat® inhaler be required, it should be perf ormed by site personnel, and not by the patient. Gloves must be worn and discarded immediatel y after the priming to avoid contamination of the PK samples to be taken and processed subsequently (see also Section 5.3.2). 4.1.4.3 Study medication administration At Visit 2, the first dose of study medication will be self -administered in the clinic. The clock time of the end of second inhalation will be captured on the source documents and in the eCRF. At all subsequent visits, medication will also be self -administered in the clinic and the clock time of the end of inhalation will be captured. The utmost care should be taken to ensure that during the treatment period, the study medication is not taken prior to coming to the site for a visi t. In case the patient would take the study medication in the morning of the clinic visit, the trial visit should be re -scheduled the day after. Study Medication administration at home: Twice a day ,each morning (other than clinic visit day s) and each evening, medication will be self-administered b y the patient. The patient will inhale two puffs of stud y medication from the assigned Respimat®inhaler. Patients should be encouraged to take their study medication at approximately the same time each morning and each evening after all other (inhaled) CF treatments . If adose is missed for more than 4 hours, the next dose should be taken as planned. If the evening dose is missed on the day prior to a clinic visit, the visit should be rescheduled the day after . A glass of water can be taken after the trial drug inhalation , if needed ."
34,page_34,"Boehringer Ingelheim 18 Nov 2019 BI Trial No.: 1399-0003 c23936559-02 Clinical Trial Protocol Page 35of 79 Proprietary confidential information © 2019 Boehringer I ngelheim I nternational GmbH or one or more of its affiliated companies 001-MCS -40-106- RD-03(15.0)/Saved on:30.Nov 2017The patients will be given a patient specific paper diary in which they will record the date and time he/she took the dose s of trial medication for the 3 day s preceding the clinic visits . Time of administration means the end of the second inhalation . If the current used Respimat®inhaler is locked, lost or malfunctions, the patient must assemble and prime the reserve Respimat®inhaler at home. 4.1.4.4 Respimat®malfunctioning Any Respimat®inhaler that has been reported as malfunctioning by a patient or a patient’s legal representative or investigator will be returned to BI for investigation. See the ISF for specific instructions. 4.1.5 Blinding and procedures for unblinding 4.1.5.1 Blinding Patient s, investigator s and every one involved in trialconduct or analy sisor with an y other interest in this double -blind trialwill remain blinded with regard to the random isedtreatment assignments until a fter database lock. The randomisation code will be kept secret by Clinical Trial Support up to database lock. The randomisation codes will be provided to B ioanaly tics prior or during the study to allow for the exclusion from the anal yses of pharmacokinet ic (PK) samples taken from placebo patients and to anal yse the PK data on an ongoing basis. The project pharmacometrician and trial pharmacokineticist will also be given access to the randomisation code, along with preliminary BI 1265162 concentration data during the study to allow the PK , PK/PD modelling to be started from at least 53 evaluable patients. This will also allow minimizing the time from database lock to obtaining the final PK modelling results. If required, and draft PK data is available, this can be supplied to the DMC upon request. This data, including the randomisation codes, will be kept separate and securely in a manner not to unblind any members of the medical team or team personnel interacting with the stud y sites or investigators. The interim anal ysis to be performed on the primary efficacy endpoint once 28 patients have completed 4 weeks of treatment will be conducted by a Sponsor team independent from the trial team. The randomisation codes will be provided to this team who will keep those separate and securel y in a ma n ner not to unblind any members of the medical team or team personnel interacting with the study sites or investigators. The randomisation codes will also be provided to the independent DMC in case unblinded data review is required by any of the DMC members. This data including the outputs of the unblinded anal ysis will not be communicated to the Sponsor. Please refer to Section 8.7 for further details."
35,page_35,"Boehringer Ingelheim 18 Nov 2019 BI Trial No.: 1399-0003 c23936559-02 Clinical Trial Protocol Page 36of 79 Proprietary confidential information © 2019 Boehringer I ngelheim I nternational GmbH or one or more of its affiliated companies 001-MCS -40-106- RD-03(15.0)/Saved on:30.Nov 20174.1.5.2 Unblinding and breaking the cod e Emergency unblinding will be available to the investigator via IRT . It must only be used in an emergency situation when the identity of the trialdrug must be known to the investigator in order to provide appropriate medical treatment or otherwise assure safety of trial participants. The reason for unblinding must be documented in the source documents and/ or appropriate CRF page. Due to the requirements to report Suspected Unexpected Serious Adverse Reactions (SUSARs), it may be necessary for a represent ative from BI’sPharmacovigilance group to access the randomisation code for individual patients during trialconduct. The access to the code will only be given to authorised P harmacovigilance representatives for processing in the PV database s ystem and not be shared further. 4.1.6 Packaging, labelling , and re -supply The investigational medicinal product s will be provided by BI or a designated CRO . They will be packaged and labelled in accordance with the principles of Good Manufacturing Practice (GMP). Re-supply to thesites will be managed via an IRT system, which will also monitor expiry dates of supplies available at the site s. For details of packaging and the description of the label, refer to the ISF. 4.1.7 Storage conditions Drug supplies willbe kept in their original packaging and in a secure limited access storage area according to the recommended storage conditions on the medication label. A temperature log must be maintained for documentation. If the storage conditions are found to be outside the specified range, the sponsor must be contact edimmediatel y.Please refer to the ISF for further details. 4.1.8 Drug accountability The investigator or designee will receive the investigational drugs delivered by the sponsor when the following requirements are fulfilled: Approval of the clinical trialprotocol by the IRB / ethics committee, Availability of a signed and dated clinical trialcontract between the sponsor and the investigational site , Approval/notification of the regulatory authority , e.g. competent authorit y, Availability of the curriculum vitae of the P rincipal Investigator , Availability of a signed and dated clinical trialprotocol , Availability of the proof of a medical license for the P rincipal Investigator , Availability of FDA Form 1572 (if applicable) . Investigational drugs are not allowed to be used outside the context of this protocol. They must not be forwarded to other investigators or clinics. Patients should be instructed to return unused investigational drug."
