,PageNo,Text38,page_38,"Protocol ALXN 1210- aHUS -312 Alexion Pharmaceuticals, Inc. Amendment 6 (Global) 16 Jul 2019 Page 38 of 96 CONFIDENTIAL Table 2: Schedule of Study Visits and Assessments: Extension Period Day 183 to Day 911 (Continued) Period Extension Period Study Day 183a 211 239 267 295 323 351 379 407 435 463 491 519 547 575 603 631 659 687 715 743 771 799 827 855 883 911 Window (day) ±2 ±5 ±5 ±5 ±5 ±5 ±5 ±5 ±5 ±5 ±5 ±5 ±5 ±5 ±5 ±5 ±5 ±5 ±5 ±5 ±5 ±5 ±5 ±5 ±5 ±5 ±5 Concomitant medicationsm ←Monitor continuously→ Adverse events ←Monitor continuously→ ALXN1210 administration (patients weighing < 20 kg)n Xa Xo X Xo X Xo X Xo X Xo X Xo X Xo X Xo X Xo X Xo X Xo X Xo X Xo X ALXN1210 administration (patients weighing ≥ 20 kg)n Xa X X X X X X X X X X X X X Dose Regimen Decision Day (patients on q4w schedule)p X X X X X X X X X X X X X Dose Regimen Decision Day (patients on q8w schedule)q X X X X X X X X X X X X X X Abbreviations: ADA = antidrug antibody; aHUS = atypical hemolytic uremic syndrome; ECG = electrocardiogram; eCRF = electronic Case Report Form; EOI = end of infusion; ET = early termination; FACIT = functional assessment of chronic illness therapy; PD = pharmacodynamics; PK = pharmacokinetics ; q4w = once every 4 weeks; q8w = once every 8 weeks Note : For patients who terminate the study early, information on the assessments to be conducted on the ET visit day and further follow -up is provided in Table 4 . Patients who discontinue ALXN1210 treatment in the Extension Period, but remain in the study without treatment, should continue attending their scheduled protocol visits until Day 1863 ( Section 8.3.2 ). For patients who discontinue ALXN1210 treatment in the Extension Period, remain in the study, and further receive retreatment should undergo assessments as described in Section 8.3.2.1 . a Extension Period begins at the start of Day 183 dosing. b Predose on dosing days. c Female patients of childbearing potential only. Urine (or serum if required per site policy) pregnancy test at all required time points. A negative pregnancy test result is required prior to administering ALXN1210 at the indicated study visits. d On dosing days, assessment will be performed prior to dosing. Pediatric FACIT -Fatigue only in patients ≥ 5 years of age (patient-reported for patients who were ≥ 8 years of age at the time of enrollment; caregiver-reported or caregiver assistance for patients who were 5 to < 8 years of age at the time of enrollment). e Abbreviated physical examination consists of a body system relevant examination based upon Investigator (or qualified designee) judgment and patient symptoms. At least 1 body system must be checked for an abbreviated exam ination ."
39,page_39,"Protocol ALXN 1210- aHUS -312 Alexion Pharmaceuticals, Inc. Amendment 6 (Global) 16 Jul 2019 Page 39 of 96 CONFIDENTIAL Table 2: Schedule of Study Visits and Assessments: Extension Period Day 183 to Day 911 (Continued) f Vital sign measurements will be taken after the patient has been resting for at least 5 minutes and will include systolic and diastolic BP (millimeters of mercury [mmHg]), pulse oximetry, heart rate (beats/minute), respiratory rate (breaths/minute), and temperature (degrees Celsius [°C] or degrees Fahr enheit [°F]). On dosing days, vital signs will be taken predose. g Assessment for safety as well as the primary and secondary endpoints. h Serum samples for PK/PD analysis will be collected predose (within 0.5 hour prior to the start of infusion) and EOI (within 0 .5 hour after the EOI) on Days 351, 575, 743, and 911; postdose on Day 183. End of infusion samples will be drawn from the patient’s opposite, noninfused arm. In order to minimize needle sticks to the patient, the predose sample may be drawn through the venous access created for the dose infusion, prior to administration of the dose. For patients who discontinue treatment in the Extension Period, but remain in the study, 1 PK/PD sample at any time will be collected as per protocol schedule until approximately 39 weeks after the last dose of ALXN1210. If a supplemental dose is administ ered, PK/PD samples will be collected predose and at EOI. All collection times will be recorded in the eCRF . i Collection will be predose on days of dosing and for days without dosing, at any time that visit day. All collection times will be recorded in th e eCRF. j Collection will be predose on days of dosing and for days without dosing, at any time that visit day. Sample will be combined with urine stabilizing buffer. All collection times will be recorded in the eCRF . k A predose serum sample will be collected on Days 351, 575, 743, and 911. For patients who discontinue treatment in the Extension Period, but remain in the study, ADA sample will be collected at any time during the visits as per protocol schedule until approximately 39 weeks after the last dose of ALXN1210. All collection times will be recorded in the eCRF . l Review the Clinical Trial Participant Safety Information Card with the patient and discuss the importance of carrying the safety card at all times, a nd the risks ALXN1210 treatment, including the risk of meningococcal infection . m Concomitant medications must be collected at all study visits (and at the Follow-up Phone Call 8 weeks [ 56days] ± 5 days after the last dose of ALXN1210 for patients who terminate the study early) and checked against the prohibited medication listed in Section 9.7. n The dose of ALXN1210 is based on the patient’s body weight on the preceding “Dose Regimen Decision Day (patients on q4w schedule) or Dose Regimen Decision Day (patients on q8w schedule)”. For patients who discontinue ALXN1210 treatment in the Extension Period, remain in the study, and further receive retreatment, the dosing and assessment details are provided in Section 8.3.2.1 . o These visits are not applicable for patients on a q8w dosing schedule during the Extension Period. p Dose Regimen Decision Day for patients currently on a q4w schedule : Predose body weight will be measured before dosing on the “Dose Regimen Decision Day (patients on q4w schedule) ”. Should this weight change the dose regimen (dose level [ie, mg] or dose frequency [ie, q4w vs q8w]), the change will occur on the visit 4 weeks later. Patients changing from q4w to q8w will be administered their first q8w dose on the ALXN1210 administrat ion day (“ ALXN1210 administration [patients weighing > 20 kg] ”) following the “ Dose Regimen Decision Day (patients on q4w schedule) ”. q Dose Regimen Decision Day for patients currently on a q8w schedule: Predose body weight will be measured before dosing on the “Dose Regimen Decision Day (patients on q8w schedule) ”. Should this weight change the dose regimen (dose level [ie, mg] or dose frequency [ie, q4w vs q8w]), the change will occur on the visit 8 weeks later. Patients changing from q8w to q4w will be administered their first q4w dose on the ALXN1210 administration day (“ ALXN1210 administration [patients weighing < 20 kg] ”) 8 weeks after the “Dose Regimen Decision Day (patients on q8w schedule)”."
40,page_40,"Protocol ALXN 1210- aHUS -312 Alexion Pharmaceuticals, Inc. Amendment 6 (Global) 16 Jul 2019 Page 40 of 96 CONFIDENTIAL Table 3: Schedule of Study Visits and Assessments: Extension Period Day 939 to Day 1667 Period Extension Period Study Day 939 967 995 1023 1051 1079 1107 1135 1163 1191 1219 1247 1275 1303 1331 1359 1387 1415 1443 1471 1499 1527 1555 1583 1611 1639 1667 Window (day) ±5 ±5 ±5 ±5 ±5 ±5 ±5 ±5 ±5 ±5 ±5 ±5 ±5 ±5 ±5 ±5 ±5 ±5 ±5 ±5 ±5 ±5 ±5 ±5 ±5 ±5 ±5 Head circumference (patients up to 2 years of age) X X X X X X X X X X X X X Height and weighta X X X X X X X X X X X X X X X X X X X X X X X X X X X Pregnancy testb X X X X X X X X X X X X X Pediatric FACIT-Fatigue questionnairec X X X Abbreviated physical examinationd X X X X X X X X X X X X X Assessment of extra-renal signs or symptoms of aHUS X X X Vital signse X X X X X X X X X X X X X Chemistrya X X X X X X X X X X X X X Hematology and coagulationf, a X X X X X X X X X X X X X Urinalysis and urine chemistry X X X X X X X X X X X X X PK/PD samplingg X X X X Exploratory serum and plasma biomarkersh X X X X X X X X X X X X X Exploratory urine biomarkersi X X X X X X X X X X X X X Immunogenicity (ADA)j X X X X Review safety cardk X X X X X X X X X X X X X X X X X X X X X X X X X X X Concomitant medicationsl ←Monitor continuously→"
41,page_41,"Protocol ALXN 1210- aHUS -312 Alexion Pharmaceuticals, Inc. Amendment 6 (Global) 16 Jul 2019 Page 41 of 96 CONFIDENTIAL Table 3: Schedule of Study Visits and Assessments: Extension Period Day 939 to Day 1667 (Continued) Period Extension Period Study Day 939 967 995 1023 1051 1079 1107 1135 1163 1191 1219 1247 1275 1303 1331 1359 1387 1415 1443 1471 1499 1527 1555 1583 1611 1639 1667 Window (day) ±5 ±5 ±5 ±5 ±5 ±5 ±5 ±5 ±5 ±5 ±5 ±5 ±5 ±5 ±5 ±5 ±5 ±5 ±5 ±5 ±5 ±5 ±5 ±5 ±5 ±5 ±5 Adverse events ←Monitor continuously→ ALXN1210 administration (patients weighing < 20 kg)m Xn X Xn X Xn X Xn X Xn X Xn X Xn X Xn X Xn X Xn X Xn X Xn X Xn X Xn ALXN1210 administration (patients weighing ≥ 20 kg)m X X X X X X X X X X X X X Dose Regimen Decision Day (patients on q4w schedule)o X X X X X X X X X X X X X X Dose Regimen Decision Day (patients on q8w schedule)p X X X X X X X X X X X X X Abbreviations: ADA = antidrug antibody; aHUS = atypical hemolytic uremic syndrome; eCRF = electronic Case Report Form; EOI = end of infusion; ET = early termination; FACIT = functional assessment of chronic illness therapy; PD = pharmacodynamics; PK = pharmacokinetics ; q4w = once every 4 weeks; q8w = once every 8 weeks Note: For patients who terminate the study early, information on the assessments to be conducted on the ET visit day and further follow -up is provided in Table 4 . Patients who discontinue ALXN1210 treatment in the Extension Period, but remain in the study without treatment, should continue attending their scheduled protocol visits until Day 1863 ( Section 8.3.2 ). For patients who discontinue ALXN1210 treatment in the Extension Period, remain in the study, and further receive retreatment should undergo assessments as described in Section 8.3.2.1 . a Predose on dosing days. b Female patients of childbearing potential only. U rine (or serum if required per site policy) pregnancy test at all required time points. A negative pregnancy test result is required prior to administering ALXN1210 at the indicated study visits. c On dosing days, assessment will be performed prior to dosing. Pediatric FACIT -Fatigue only in patients ≥ 5 years of age (patient -reported for patients who were ≥ 8 years of age at the time of enrollment; caregiver-reported or caregiver assistance for patients who were 5 to < 8 years of age at the time of enrollment). d Abbreviated physical examination consists of a body system relevant examination based upon Investigator (or qualified designee) judgment and patient symptoms. At least 1 body system must be checked for an abbreviated examination. e Vital sign measurements will be taken after the patient has been resting for at least 5 minutes and will include systolic and diastolic BP (millimeters of mercury [mmHg]), pulse oximetry, heart rate (beats/minute), respiratory rate (breaths/minute), and temperature (degrees Celsius [°C] or degrees Fahr enheit [°F]). On dosing days, vital signs will be taken predose. f Assessment for safety as well as the primary and secondary endpoints."
42,page_42,"Protocol ALXN 1210- aHUS -312 Alexion Pharmaceuticals, Inc. Amendment 6 (Global) 16 Jul 2019 Page 42 of 96 CONFIDENTIAL Table 3: Schedule of Study Visits and Assessments: Extension Period Day 939 to Day 1667 (Continued) g Serum samples for PK/PD analysis will be collected predose (within 0.5 hour prior to the start of infusion) and EOI (within 0 .5 hour after the EOI) on Days 1079, 1247, 1415, and 1639. End of infusion samples will be drawn from the patient’s opposite, noninfused arm. In order to minimize needle sticks to the patient, the predose sample may be drawn through the venous access created for the dose infusion, prior to administration of the dose. For patients who discontinue treatment in the Extension Period, but remain in the study, 1 PK/PD sample at any time will be collected as per protocol schedule until approximately 39 weeks after the last dose of ALXN1210. If a supplemental dose is administered, PK/PD samples will be collected predose and at EOI. All collection times will be recorded in the eCRF . h Collection will be predose on days of dosing and for days without dosing, at any time that visit day. All collection times will be recorded in the eCRF. i Collection will be predose on days of dosing and for days without dosing, at any time that visit day. Sample will be combined with urine stabilizing buffer. All collection time s will be recorded in the eCRF. j A predose serum sample will be collected on Days 1079, 1247, 1415, and 1639. For patients who dis continue treatment in the Extension Period, but remain in the study, ADA sample will be collected at any time during the visits as per protocol schedule, until approximately 39 weeks after the last dose of ALXN1210. All collection times will be recorded in the eCRF . k Review the Clinical Trial Participant Safety Information Card with the patient and discuss the importance of carrying the safety card at all times, and the risks ALXN1210 treatment, including the risk of meningococcal infection . l Concomitant medications must be collected at all study visits (and at the Follow-up Phone Call 8 weeks [ 56 days] ± 5 days after the last dose of ALXN1210 for patients who terminate the study early) and checked against the prohibited medication listed in Section 9.7. m The dose of ALXN1210 is based on the patient’s body weight on the preceding “Dose Regimen Decision Day (patients on q4w schedule) or Dose Regimen Decision Day (patients on q8w schedule)”. For patients who discontinue ALXN1210 treatment in the Extension Period, remain in the study, and further receive retreatment, the dosing and assessment details are provided in Section 8.3.2.1 . n These visits are not applicable for patients on a q8w dosing schedule during the Extension Period. o Dose Regimen Decision Day for patients currently on a q4w schedule: Predose body weight will be measured before dosing on the “Dose Regimen Decision Day (patients on q4w schedule)”. Should this weight change the dose regimen (dose level [ie, mg] or dose frequency [ie, q4w vs q8w]), the change will occur on the visit 4 weeks later. Patients changing from q4w to q8w will be administered their first q8w dose on the ALXN1210 administration day (“ALXN1210 administration [patients weighing > 20 kg]”) following the “Dose Regimen Decision Day (patients on q4w schedule)”. p Dose Regimen Decision Day for patients currently on a q8w schedule: Predose body weight will be measured before dosing on the “Dose Regimen Decision Day (patients on q8w schedule)” . Should this weight change the dose regimen (dose level [ie, mg] or dose frequency [ie, q4w vs q8w]), the change will occur on the visit 8 weeks later. Patients changing from q8w to q4w will be administered their first q4w dose on the ALXN1210 administration day (“ALXN1210 administration [patients weighing < 20 kg]”) 8 weeks after the “Dose Regimen Decision Day (patients on q8w schedule)” ."
43,page_43,"Protocol ALXN 1210- aHUS -312 Alexion Pharmaceuticals, Inc. Amendment 6 (Global) 16 Jul 2019 Page 43 of 96 CONFIDENTIAL Table 4: Schedule of Study Visits and Assessments: Extension Period Day 1695 to Day 1863 Period Extension Period Study Day 1695 1723 1751 1779 1807 1835 1863/ET/ EOS Window (day) ±5 ±5 ±5 ±5 ±5 ±5 ±5 Head circumference (patients up to 2 years of age) X X X X Height and weighta X X X X X X X Pregnancy testb X X X X Pediatric FACIT -Fatigue questionnairec X X Physical examination X Abbreviated physical examinationd X X X Assessment of extra -renal signs or symptoms of aHUS X X Vital signse X X X X Safety 12 lead ECGf X Chemistrya X X X X Hematology and coagulationg, a X X X X Urinalysis and urine chemistry X X X X PK/PD samplingh X X Exploratory serum and plasma biomarkersi X X X X Exploratory urine biomarkersj X X X X Immunogenicity (ADA)k X X Review safety cardl X X X X X X X Concomitant medicationsm ←Monitor continuously→ Adverse events ←Monitor continuously→ ALXN1210 administration (patients weighing < 20 kg)n X Xo X Xo X Xo ALXN1210 administration (patients weighing ≥ 20 kg)n X X X Dose Regimen Decision Day (patients on q4w schedule)p X X X Dose Regimen Decision Day (patients on q8w schedule)q X X X Abbreviations: ADA = antidrug antibody; aHUS = atypical hemolytic uremic syndrome; ECG = electrocardiogram; eCRF = electronic Case Report Forms ; EOI = end of infusion EOS = end of study; ET = early termination; FACIT = functional assessment of chronic illness therapy; PD = pharmacodynamics; PK = pharmacokinetics ; q4w = once every 4 weeks; q8w = once every 8 weeks Note: For patients who complete the study on the q4w regimen and do not initiate commercially available aHUS treatment within 8 weeks of their last ALXN1210 dose, a Follow-up Phone Call will be performed 8 weeks (56 days) ± 5 days after their last dose of ALXN1 210, to collect information on concomitant medications, nonpharmacological therapies and procedures, and adverse events. If a patient terminates from the study early, ET assessments will be conducted as soon as possible. A Follow -up Phone Call will be performed 8 weeks (56 days) ± 5 days following the patient’s last dose of ALXN1210 to collect information on concomitant medications, nonpharmacological therapies and procedures, and adverse events."
44,page_44,"Protocol ALXN 1210- aHUS -312 Alexion Pharmaceuticals, Inc. Amendment 6 (Global) 16 Jul 2019 Page 44 of 96 CONFIDENTIAL Table 4: Schedule of Study Visits and Assessments: Extension Period Day 1695 to Day 1863 (Continued) Patients who discontinue ALXN1210 treatment in the Extension Period, but remain in the study without treatment, should continue attending their scheduled protocol visits until Day 1863 ( Section 8.3.2 ). For patients who discontinue ALXN1210 treatment in the Extension Period, remain in the study, and further receive retreatment should undergo assessments a s described in Section 8.3.2.1 . a Predose on dosing days. b Female patients of childbearing potential only. Serum pregnancy test at Day 1863/ET/EOS only; urine (or serum if required per site policy) pregnancy test at all other required time points. A negative pregnancy test result is required prior to administering ALXN1210 to female patients of childbearing potential at the indicated study visits. c On dosing days, assessment will be performed prior to dosing. Pediatric FACIT -Fatigue only in patients ≥ 5 years of age (patient -reported for patients who were ≥ 8 years of age at the time of enrollment; caregiver-reported or caregiver assistance for patients who were 5 to < 8 years of age at the time of enrollment). d Abbreviated physical examination consists of a body system relevant examination based upon Investigator (or qualified designee) judgment and patient symptoms. At least 1 body system must be checked for an abbreviated examination. e Vital sign measurements will be taken after the patient has been resting for at least 5 minutes and will include systolic and diastolic BP (millimeters of mercury [mmHg]), pulse oximetry, heart rate (beats/minute), respiratory rate (breaths/minute), and temperature (degrees Celsius [°C] or degrees Fahrenheit [°F]). On dosing days, vital s igns will be taken predose. f Single 12- lead ECG will be collected at Day 1863 or ET. Patients must be supine for approximately 5 to 10 minutes before ECG collection and remain supine but awake during ECG collection. g Assessment for safety as well as the primary and secondary endpoints. h Serum samples for PK/PD analysis will be collected predose (within 0.5 hour prior to the start of infusion) and EOI (within 0.5 hour after the EOI) on Day 1807 and at any time on Day 1863 or ET. End of infusion samples will be drawn from the patient’s opposite, noninfused arm. In order to minimize needle sticks to the patient, the predose sample may be drawn through the venous access created for the dose infusion, prior to administration of the dose. For patients who discontinue treatment in the Extension Period, but remain in the study, 1 PK/PD sa mple at any time will be collected as per protocol schedule until approximately 39 weeks after the last dose of ALXN1210. If a supplemental dose is administered, PK/PD samples will be collected predose and at EOI. All collection times will be recorded in the eCRF . i Collection will be predose on days of dosing and for days without dosing, at any time that visit day. All collection times will be recorded in the eCRF. j Collection will be predose on days of dosing and for days without dosing, at any time that visit day. Sample will be combined with urine stabilizing buffer. All collection times will be recorded in the eCRF. k A predose serum sample will be collected on Day 1807. A serum sample will also be collected at any time on Day 1863 or ET. For patients who discontinue treatment in the Extension Period, but remain in the study, ADA sample will be collected at any time during the visits as per protocol schedule , approximately 39 weeks after the last dose of ALXN1210 . All collection times will be recorded in the eCRF . l Review the Clinical Trial Participant Safety Information Card with the patient and discuss the importance of carrying the safety card at all times, and the risks ALXN1210 treatment, including the risk of meningococcal infection . m Concomi tant medications must be collected at all study visits (and at the Follow-up Phone Call 8 weeks [ 56 days] ± 5 days after the last dose of ALXN1210 for patients who terminate the study early) and checked against the prohibited medication listed in Section 9.7. n The dose of ALXN1210 is based on the patient’s body weight on the preceding “Dose Regimen Decision Day (patients on q4w schedule) or Dose Regim en Decision Day (patients on q8w schedule)”. For patients who discontinue ALXN1210 treatment in the Extension Period, remain in the study, and further receive retreatment, the dosing and assessment details are provided in Section 8.3.2.1 . o These visits are not applicable for patients on a q8w dosing schedule during the Extension Period. p Dose Regimen Decision Day for patients currently on a q4w schedule: Predose body weight will be measured before dosing on the “Dose Regimen Decision Day (patients on q4w schedule)”. Should this weight change the dose regimen (dose level [ie, mg] or dose frequency [ie, q4w vs q8w]), the change will occur on the vi sit 4 weeks later. Patients changing from q4w to q8w will be administered their first q8w dose on the ALXN1210 administration day (“ALXN1210 administration [patients weighing > 20 kg]”) following the “Dose Regimen Decision Day (patients on q4w schedule)”."
45,page_45,"Protocol ALXN 1210- aHUS -312 Alexion Pharmaceuticals, Inc. Amendment 6 (Global) 16 Jul 2019 Page 45 of 96 CONFIDENTIAL Table 4: Schedule of Study Visits and Assessments: Extension Period Day 1695 to Day 1863 (Continued) q Dose Regimen Decision Day for patients currently on a q8w schedule: Predose body weight will be measured before dosing on the “Dose Regimen Decision Da y (patients on q8w schedule)”. Should this weight change the dose regimen (dose level [ie, mg] or dose frequency [ie, q4w vs q8w]), the change will occur on the visit 8 weeks later. Patients changing from q8w to q4w will be administered their first q4w dose on the ALXN1210 administration day (“ALXN1210 administration [patients weighing < 20 kg]”) 8 weeks after the “Dose Regimen Decision Day (patients on q8w schedule)”."
