,PageNo,Text86,page_86,"Protocol CONFIDENTIALDate: 17 January 2018 Novo Nordisk Trial ID: NN9536-4375 Version: 1.0 Status: Final Page: 85 of 95 Technical complaints: Definition and procedures for Appendix 6 recording, evaluation, follow-up and reporting Technical complaint definition A technical complaint is any written, electronic or oral communication that alleges product (medicine or device) defects. The technical complaint may be associated with an AE, but does not concern the AE itself. Examples of technical complaints: !Problems with the physical or chemical appear ance of trial products (e.g. discoloration, particles or contamination). !Problems with packaging material including labelling. !Problems related to medical devices (e.g. to the injection mechanism, dose setting mechanism, dose button or interface between the pen-injector and the needle). Time period for detecting technical complaints All technical complaints , which occur from the time of receipt of the product at trial site until the time of the last usage of the product, must be collected for products predefined on the technical complaint form. Reporting of technical complaints to Novo Nordisk Contact details (fax, e-mail and address) for Customer Complaint Center – refer to Attachment I Technical complaints must be reported on a separate technical complaint form: 1. One technical complaint form must be completed for each affected DUN 2. If DUN is not available, a technical complaint form for each batch, code or lot number must be completed Timelines for reporting of technical complaints to Novo Nordisk The investigator must complete the technical complaint form in the CRF within the timelines specified in 9.4. If the CRF is unavailable or when reporting a technical complaint that is not subject related, the information must be provided on a paper form by fax, e-mail or courier to Customer Complaint Center, Novo Nordisk, within the same timelines as stated above. When the CRF becomes available again, the investigator must enter the information on the technical complaint form in the CRF. Follow-up of technical complaints The investigator is responsible for ensuring that new or updated information will be recorded on the originally completed form. Collection, storage and shipment of technical complaint samples The investigator must collect the technical complaint sample and all associated parts that were packed in the same DUN and notify the monitor within 5 calendar days of obtaining the sample at trial site. The sample and all associated parts must be sent as soon as possible to Customer Complaint Center, Novo Nordisk, together with a copy of the completed technical complaint form. The technical complaint sample should contain the batch, code or lot number and, if available, the DUN. If the technical complaint sample is unobtainable, the reason must be stated on the technical complaint form. If several samples are shipped in one shipment, the sample and the corresponding technical  CONFIDENTIAL"
87,page_87,"Protocol CONFIDENTIALDate: 17 January 2018 Novo Nordisk Trial ID: NN9536-4375 Version: 1.0 Status: Final Page: 86 of 95 complaint form should be kept together. Storage of the technical complaint sample must be done in accordance with the conditions prescribed for the product. Reporting of technical complaints for Novo Nordisk products not included in technical complaint form Technical complaints on Novo Nordisk products not included in the technical complaint form should be reported to local Novo Nordisk affiliate with a reference to trial ID. All technical comp laints are ha ndled by Customer Complaint Center, Novo Nordisk. Technical complaints related to adverse events will be included in the CTR.  CONFIDENTIAL"
88,page_88,"Protocol CONFIDENTIALDate: 17 January 2018 Novo Nordisk Trial ID: NN9536-4375 Version: 1.0 Status: Final Page: 87 of 95 Monitoring of calcitonin Appendix 7 Background Treatment with GLP-1 RAs has been shown to be associated with thyroid C-cell changes in rodents but not in non-human primates. The human relevance of this finding is unknown. However, based on the findings in rodents, monitoring of serum calcitonin (a sensitive biomarker for C- cell activation) is currently being performed in clinical trials with semaglutide. While there is general agreement on the clinical in terpretation of substantially elevated calcitonin levels (> 100 ng/L) as likely ind icative of C-cell neoplasia, the interpretation of values between upper normal range (5.0 and 8.4 ng/L for women and men, respectively) and 100 ng/L is less clear with regards to indication of disease. There are several known confounding factors affecting calcitonin levels, e.g.: !renal dysfunction !tobacco use !autoimmune thyroiditis !several drug classes (e.g. proton pump inhibitors, beta-blockers, H 2-blockers and glucocorticoids) Physiology of C-cell activation in various clinical c onditions and in different patient po pulations (i.e. with various comorbidities) is poorly unde rstood. There may be various clinical conditions not identified so far which mildly or moderately affect calcitonin secretion by C-cells. Calcitonin monitoring A blood sample will be drawn at pre-specified trial visits for measurement of calcitonin. In case a subject has a calcitonin value ≥ 10 ng/L, the algorithm outlined in Figure 10-2 and described below should be followed. The al gorithm app lies for all calcitonin values in the trial. CONFIDENTIAL"
89,page_89,"Protocol CONFIDENTIALDate: 17 January 2018 Novo Nordisk Trial ID: NN9536-4375 Version: 1.0 Status: Final Page: 88 of 95 Evaluation of calcitonin results Calcitonin < 10 ng/L Calcitonin ≥ 10 ng/L and < 50 ng/L Calcitonin ≥ 50 ng/L and < 100 ng/L Calcitonin ≥ 100 ng/L Calcitonin ≥ 10 ng/L and last measurement in the trial No action !Investigate potential confounding factors !Continue sampling of calcitonin according to protocol !Discontinue trial product !Refer to thyroid specialist!Refer to thyroid specialist !Refer to thyroid specialist Figure 10-2 Flow of calcitonin monitoring Calcitonin ≥ 100 ng/L Action: The subject (even if a screen failure) must immediately be referred to a thyroid specialist for further evaluation and the trial product must be discontinued (Section 8.1). The subject should remain in the trial; however, all medications suspect ed to relate to this condition must be discontinued until diagnosis has been established. Background: These values were found in 9 (0.15%) of a population of 5817 patients with thyroid nodular disease90. All of these patients were diagnosed with MTC, resulting in a positive predictive value of 100%. Diagnostic evaluation should include: !thyroid ultrasound examination !fine needle aspiration of any nodules > 1 cm !potentially, surgery with neck dissection In case a subject is diagnosed with MTC, it is common clinical practice to explore the family history of MTC or MEN2 and perform a genetic test for RET proto-oncogene mutation. Calcitonin ≥ 50 and < 100 ng/L Action: The subject (even if a screen failure) shoul d be referred to a thyroid specialist for further evaluation. The subject should remain in th e trial and can conti nue on trial product.  CONFIDENTIAL"
90,page_90,"Protocol CONFIDENTIALDate: 17 January 2018 Novo Nordisk Trial ID: NN9536-4375 Version: 1.0 Status: Final Page: 89 of 95 Background: These values were found in 8 (0.14%) of the population of 5817 patients with thyroid nodular disease90. Two of these subjects were diagnosed with MTC and two were diagnosed with C cell hyperplasia, resulting in a positive predictive value of a C-cell anomaly of 50%. Diagnostic evaluation should include: !thyroid ultrasound examination !if available, and if there are no contraindications, a pentagastrin stimulation test should be done. For subjects with positive pentagastrin stimulation test, surgery should be considered. !if pentagastrin stimulation test is not available, thyroid ultrasound and fine needle aspiration biopsy may add important clinical information about the need for surgery. Calcitonin ≥ 10 and < 50 ng/L Action: The subject can continue in the trial on trial product. Continue sampling of calcitonin according to the protocol. If the subject is a screen failure or if the value is from the last sample taken in the trial, the subject should be referred to a thyroid specialist for further evaluation. Background: Calcitonin values from 20–50 ng/L were found in up to 1% of subjects of the population of 5817 patients with thyroid nodular disease90. The predictive value of a C-cell anomaly for this calcitonin level was 8.3%. However, the likelihood of having a medullary carcinoma >1 cm with calcitonin in this range is extremely low. For calcitonin values between 10-20 ng/L Costante et al. 90identified 216 (3.7%) patients. One patient out of the 216 had a subsequent basal (unstimulated) calcitonin value of 33 ng/L, and had C- cell hyperplasia at surgery. Two other studies used a cut-off of calcitonin > 10 ng/L to screen for C-cell disease, but they do not provide sufficient information on patients with basal CT > 10 and < 20 ng/L to allow conclusions 91, 92. CONFIDENTIAL"
91,page_91,"Protocol CONFIDENTIALDate: 17 January 2018 Novo Nordisk Trial ID: NN9536-4375 Version: 1.0 Status: Final Page: 90 of 95 11 References 1. Tsai AG, Wadden TA. The evolution of very-low-calorie diets: an update and meta-analysis. Obesity (Silver Spring). 2006;14(8):1283-93. 2. Wadden TA, Berkowitz RI, Sarwer DB, Prus-Wisniewski R, Steinberg C. Benefits of lifestyle modification in the pharmacologic tre atment of obesity: a randomized trial. Arch Intern Med. 2001;161(2):218-27. 3. Look ARG, Wing RR. Long-term effects of a lifestyle intervention on weight and cardiovascular risk factors in individuals with type 2 diabetes mellitus: four -year results of the Look AHEAD trial. Arch Intern Med. 2010;170(17):1566-75. 4. Kidney Disease: Improving Global Outcomes (KDIGO) CKD Work Group. KDIGO 2012 Clinical Practice Guideline for the Evaluation and Management of Chronic Kidney Disease. Kidney Int Suppl. 2013;3(1):1-150. 5. Kelly T, Yang W, Chen CS, Reynolds K, He J. Global burden of obesity in 2005 and projections to 2030. Int J Obes (Lond). 2008;32(9):1431-7. 6. Ogden CL, Carroll MD, Kit BK, Flegal KM. Prevalence of childhood and adult obesity in the United States, 2011-2012. JAMA. 2014;311(8):806-14. 7. Stevens GA, Singh GM, Lu Y, Danaei G, Lin JK, Finucane MM, et al. National, regional, and global trends in adult overweight and obesity prevalences. Popul Health Metr. 2012;10(1):22. 8. NCD Risk Factor Collaboration. Trends in adult body-mass index in 200 countries from 1975 to 2014: a pooled analysis of 1698 population-based measurement studies with 19·2 million pa rticipants. Lancet. 2016;387(10026):1377-96. 9. Finkelstein EA, DiBonaventura M, Burgess SM, Hale BC. The costs of obesity in the workplace. J Occup E nviron Med. 2010;52(10):971-6. 10. Van Nuys K, Globe D, Ng-Mak D, Cheung H, Sullivan J, Goldman D. The association between employee obesity and employer costs: evidence from a panel of U.S. employers. Am J Health Promot. 2014;28(5):277-85. 11. Wang YC, Pamplin J, Long MW, Ward ZJ, Gortmaker SL, Andreyeva T. Severe Obesity In Adults Cost State Medicaid Programs Nearly $8 Billion In 2013. Health Aff (Millwood). 2015;34(11):1923-31. 12. Cusi K. Role of obesity and lipotoxicity in the development of nonalcoholic steatohepatitis: pathophysiology and clinical implicatio ns. Gastroenterology. 2012;142(4):711 -25.e6. 13. Guh DP, Zhang W, Bansback N, Amarsi Z, Birmingham CL, Anis AH. The incidence of co- morbidities related to obesity and overweight: a systematic review and meta-analysis. BMC Public Health. 2009;9:88. 14. Pischon T, Boeing H, Hoffmann K, Bergmann M, Schulze MB, Overvad K, et al. General and abdominal adiposity and risk of death in Europe. N Engl J Med. 2008;359(20):2105-20. 15. Berghofer A, Pischon T, Reinhold T, Apovian CM, Sharma AM, Willich SN. Obesity prevalence from a European perspective: a systematic review. BMC Public Health. 2008;8:200. 16. Masters RK, Reither EN, Powers DA, Yang YC, Burger AE, Link BG. The impact of obesity on US mortality levels: the importance of age and cohort factors in population estimates. Am J Public Health. 2013;103(10):1895-901. CONFIDENTIAL"
92,page_92,"Protocol CONFIDENTIALDate: 17 January 2018 Novo Nordisk Trial ID: NN9536-4375 Version: 1.0 Status: Final Page: 91 of 95 17. Arnold M, Pandeya N, Byrnes G, Renehan AG, Stevens GA, Ezzati M, et al. Global burden of cancer attributable to high body-mass index in 2012: a population-based study. Lancet Oncol. 2015;16(1):36-46. 18. World Health Organization. Obesity: Preventing and Managing the Global Epidemic. Report of a WHO Consultation. World Health Organisation Geneva, Swi tzerla nd. 2000. 19. Thomsen M, Nordestgaard BG. Myocardial Infarction and Ischemic Heart Disease in Overweight and Obesity With and Without Metabolic Syndrome. JAMA internal medicine. 2013;174(1):15-22. 20. Eckel RH, Kahn SE, Ferrannini E, Goldfine AB, Nathan DM, Schwartz MW, et al. Obesity and type 2 diabetes: what can be unified and what needs to be individualized? Journal of clinical endocrinology and metabolism. 2011;96(6):1654-63. 21. Khaodhiar L, Cummings S, Apovian CM. Treating diabetes and prediabetes by focusing on obesity management. Curr Diab Rep. 2009;9(5):348-54. 22. Wheaton AG, Perry GS, Chapman DP, Croft JB. Sleep disordered breathing and depression among U.S. adults: National Health and Nutrition Examination Survey, 2005 -2008. Sleep. 2012;35(4):461-7. 23. Prospective Studies Collaboration, Whitlock G, Lewington S, Sherliker P, Clarke R, Emberson J, et al. Body-mass index and cause-specific mortality in 900 000 adults: collaborative analyses of 57 prospective studies. Lancet. 2009;373(9669):1083-96. 24. Must A, Spadano J, Coakley EH, Field AE, Colditz G, Dietz WH. The disease burden associated with overweight and obesity. JAMA. 1999;282(16):1523 -9. 25. Church TS, Kuk JL, Ross R, Priest EL, Biltoft E, Biltoff E, et al. Association of cardiorespiratory fitness, body mass index, and waist circumference to nonalcoholic fatty liver disease. Gastroenterology. 2006;130(7):2023-30. 26. Blagojevic M, Jinks C, Jeffery A, Jordan KP. Risk factors for onset of osteoarthritis of the knee in older adults: a systematic review a nd meta-analysis. Osteoarthritis Cartilage. 2010;18(1):24-33. 27. Garner RE, Feeny DH, Thompson A, Bernier J, McFarland BH, Huguet N, et al. Bodyweight, gender, and quality of life: a population-based longitudinal study. Qual Life Res. 2012;21(5):813-25. 28. Kearns B, Ara R, Young T, Relton C. Association between body mass index and health- related quality of life, and the impact of self -reported long-term conditions - cross-sectional study from the south Yorkshire cohort dataset. BMC Public Health. 2013;13:1009. 29. Wei M, Kampert JB, Barlow CE, Nichaman MZ, Gibbons LW, Paffenbarger RS, et al. Relationship between low cardiorespiratory fitness and mortality in normal-weight, overweight, and obese men. JAMA. 1999;282(16):1547-53. 30. Tuomilehto J, Lindstrom J, Eriksson JG, Valle TT, Hamalainen H, Ilanne-Parikka P, et al. Prevention of type 2 diabetes mellitus by changes in lifestyle among subjects with impaired glucose tolerance. N Engl J Med. 2001;344(18):1343-50. 31. Knowler WC, Barrett-Connor E, Fowler SE, Hamman RF, Lachin JM, Walker EA, et al. Reduction in the incidence of type 2 diabetes with lifestyle intervention or metformin. N Engl J Med. 2002;346(6):393-403. 32. Li G, Zhang P, Wang J, Gregg EW, Yang W, Gong Q, et al. The long-term effect of lifestyle interventions to prevent diabetes in the China Da Qing Diabetes Prevention Study: a 20-year follow-up study. Lancet. 2008;371(9626):1783-9. CONFIDENTIAL"
93,page_93,"Protocol CONFIDENTIALDate: 17 January 2018 Novo Nordisk Trial ID: NN9536-4375 Version: 1.0 Status: Final Page: 92 of 95 33. Diabetes Prevention Program Research Group, Knowler WC, Fowler SE, Hamman RF, Christophi CA, Hoffman HJ, et al. 10-year follow-up of diabetes incidence and weight loss in the Diabetes Prevention Progra m Outcomes Study. Lancet. 2009;374(9702):1677-86. 34. Foster GD, Borradaile KE, Sanders MH, Millman R, Zammit G, Newman AB, et al. A Randomized Study on the Effect of Weight Loss on Obstructive Sleep Apnea Among Obese Patients With Type 2 Diabetes The Sleep AHEAD Study. Archives of Internal Medicine. 2009;169(17):1619-26. 35. Felson DT, Zhang Y, Anthony JM, Naimark A, Anderson JJ. Weight loss reduces the risk for symptomatic knee osteoarthritis in women. The Framingham Study. Ann Intern Med. 1992;116(7):535-9. 36. Dengo AL, Dennis EA, Orr JS, Marinik EL, Ehrlich E, Davy BM, et al. Arterial destiffening with weight loss in overweight and obese middle-aged and older adults. Hypertension. 2010;55(4):855-61. 37. Dattilo AM, Kris-Etherton PM. Effects of weight reduction on blood lipids and lipoproteins: a meta-analysis. Am J Clin Nutr. 1992;56(2):320-8. 38. Anderson JW, Konz EC. Obesity and disease management: effects of weight loss on comorbid conditions. Obes Res. 2001;9 Suppl 4:326S-34S. 39. Garber AJ, Abrahamson MJ, Barzilay JI, Blonde L, Bloomgarden ZT, Bush MA, et al. American Association of Clinical Endocrinologists' Comprehensive Diabetes Management Algorithm 2013 Consensus Statement - Executive Summary. Endocrine Practice. 2013;19(3):536-47. 40. Mertens IL, Van Gaal LF. Overweight, obesi ty, and blood pressure: the effects of modest weight reduction. Obes Res. 2000;8(3):270-8. 41. Deitel M, Stone E, Kassam HA, Wilk EJ, Sutherland DJ. Gynecologic-obstetric changes after loss of massive excess weight follo wing bariatric surgery. J Am Coll Nutr. 1988;7(2):147-53. 42. Sjöström L. Review of the key results from the Swedish Obese Subjects (SOS) trial - a prospective controlled intervention study of bariatric surgery. J Intern Med. 2013;273(3):219-34. 43. Gregg EW, Jakicic JM, Blackburn G, Bloomquist P, Bray GA, Clark JM, et al. Association of the magnitude of weight loss and changes in physical fitness with long -term cardiovascular disease outcomes in overweight or obese people with type 2 diabetes: a post- hoc analysis of the Look AHEAD randomised clinical trial. Lancet Diabetes Endocrinol. 2016;4(11):913-21. 44. Afshin A, Forouzanfar MH, Reitsma MB, Sur P, Estep K, Lee A, et al. Health Effects of Overweight and Obesity in 195 Countries over 25 Years. N Engl J Med. 2017;377(1):13-27. 45. The American Society for Metabolic and Bariatric Surgery, The Obesity Society, The American Society of Bariatric Physicians and the American Association o f Clinical Endocrinologists. Obesity is a Disease: Leading Obesity Groups Agree (Joint Press Release). 19 June 2013. 46. Mechanick JI, Garber AJ, Handelsman Y, Garvey WT. American Association of Clinical Endocrinologists' position statement on obesity and obesity medicine. Endocr Pract. 2012;18(5):642-8. 47. Toplak H, Woodward E, Yumuk V, Oppert JM, Halford JC, Frühbeck G. 2014 EASO Position Statement on the Use of Anti-Obe sity Drugs. Obes Facts. 2015;8(3):166-74. CONFIDENTIAL"
94,page_94,"Protocol CONFIDENTIALDate: 17 January 2018 Novo Nordisk Trial ID: NN9536-4375 Version: 1.0 Status: Final Page: 93 of 95  Fruhbeck G, Toplak H, Woodward E, Yumuk V, Maislos M, Oppert JM, et al. Obesity: the  gateway to ill health - an EASO position s tatement on a rising pub lic health, clinical and  scientific challenge in Europe. Obes Facts. 2013;6(2):117-20.   Apovian CM, Aronne LJ, Bessesen DH, McDonnell ME, Murad MH, Pagotto U, et al.  Pharmacological management of obesity: an endocrine Society clinical practice guideline. J  Clin Endocrinol Metab. 2015;100(2):342-62.  Ferguson C, David S, Divine L, Kahan S, Gallagher C, Gooding M, et al. Obesity Drug  Outcome Measures. A Consensus Report of Considerations Regarding Pharmacologic  Intervention. Avaliable from: https://publichealth.gwu.edu/pdf/obesitydrugmeasures.pdf.  2012.  Sumithran P, Prendergast LA, Delbridge E, Purcell K, Shulkes A, Kriketos A, et al. Long- term persistence of hormonal adaptations to weight loss. N Engl J Med. 2011;365(17):1597-604.  Schwartz A, Doucet E. Relative changes in resting energy expenditure during weight loss: a  systematic review. Obes Rev. 2010;11(7):531-47.  Pasman WJ, Saris WH, Westerterp-Plantenga MS. Predictors of weight maintenance. Obes  Res. 1999;7(1):43-50.  Dombrowski SU, Knittle K, Avenell A, Araujo-Soares V, Sniehotta FF. Long term  maintenance of weight loss with non-surgical interventions in obese adults: systematic  review and meta-analyses of randomised controlled trials. BMJ. 2014;348:g2646.  Brethauer SA, Chand B, Schauer PR. Risks and benefits of bariatric surgery: current  evidence. Cleve Clin J Med. 2006;73(11):993-1007.  Schauer PR, Ikramuddin S, Gourash W, Ramanathan R, Luketich J. Outcomes after  laparoscopic Roux-en-Y gastric bypass for morbid obesity. A nn Surg. 2000;232(4):515-29.  Yumuk V, Tsigos C, Fried M, Schindler K, Busetto L, Micic D, et al. European Guidelines  for Obesity Management in Adults. Obes Facts. 2015;8(6):402-24.  Haslam D. Weight management in obesity - past and present. Int J Clin Pract. 2016;70(3):206-17.   Lau J, Bloch P, Schäffer L, Pettersson I, Spetzler J, Kofoed J, et al. Discovery of the Once- Weekly Glucagon-Like Peptide-1 (GLP-1) Analogue Semaglutide. J Med Chem.2015;58(18):7370-80.  Gutzwiller JP, Drewe J, Goke B, Schmidt H, Rohrer B, Lareida J, et al. Glucagon-like  peptide-1 promotes satiety and reduces food intak e in patients with diabetes mellitus type 2.  Am J Physiol. 1999;276(5 Pt 2):R1541-4.  Novo Nordisk A/S. Investigator's Brochure, Semaglutide s.c. 2.4 mg, project NN9536, (edition 1). 28 Nov 2017.  Sorli C, Harashima SI, Tsoukas GM, Unger J, Karsbøl JD, Hansen T, et al. Efficacy and  safety of once-weekly semaglutide monothera py versus placebo in patients with type 2  diabetes (SUSTAIN 1): a double-blind, ra ndomised, placebo-cont rolled, pa rallel-group,  multinational, multicentre phase 3a trial. Lancet Diabetes Endocrinol. 2017;5(4):251-60.  Aroda VR, Bain SC, Cariou B, Pileti č M, Rose L, Axelsen M, et al. Efficacy and safety of  once-weekly semaglutide versus once-daily insulin glargine as add-on to metformin (with or  without sulfonylureas) in insulin-naive pat ients with type 2 diabetes (SUSTAIN 4 ): a  randomised, open-label, parallel-group, multicen tre, multinational, phase 3a trial. Lancet  Diabetes Endocrinol. 2017;5(5):355-66. CONFIDENTIAL"
