,PageNo,Text39,page_39,"Allian ce A221701 40 NCI version date 8/14/2020 Update #03 • Fill out the daily mouth pain form • Fill out the weekly questionnaires (including PRO -CTCAE) and a mouthwash use questionnaire (as shown in Appendix V ). The nurse or research coordinator will also collect information on: • Everolimus dose (and reasons for any dose reductions) • Study mouthwash use frequency • If and when the patient obtained the prescription mouthwash • CTCAEs; and • Normalcy of Diet Scale data (See Section 11.6) Items about frequency of use of study and prescription mouthwashes ( Appendix V) were adapted from multiple previous Alliance symptom control clinical trials, as was the nurse telep hone assessment form ( Appendix V I). CTCAE assessments will be performed during these calls to collect mouth symptoms and to assess for toxicities of dexamethasone (i.e., thrush, hyperglycemia, irritability, fatigue, and insomnia) weekly during the study period (during the nurse phone calls if a p atient is not scheduled to be seen in the clinic that week). 11.6 Normalcy of Diet Scale (Appendix VII ) The Normalcy of Diet Scale is part of the Performance Status Scale for Head and Neck Cancer Patients33, and was chosen for use here primarily because this was used in the SWISH study12 and will allow us to assess the same composite endpoint that was the primary endpoint in that study. This measure will be administered over the phone by a study nurse, who will begin by asking the patient what kinds of foods (s) he has been eating, and then ask what foods are difficult to eat. The nurse will then ask about specific examples of foods, working up from the bottom of the scale (or from the middle if the patient says he/she can eat everything), stopping at the item the patient cannot eat (and giving the patient the score below that item). This allows us to assess how stomatitis related to everolimus reduces a patient’s ability to eat a normal diet on both arms of the study . 12.0 END OF TREATMENT /INTERVENTION 12.1 Duration of Protocol Treatment Protocol treatment is to continue until 8 weeks after start of everolimus treatment . Please see the study calendar (Section 5) and the treatment section (Section 7) for treatment and f ollow up time periods. 12.2 Criteria for Discontinuation of Protocol Treatment/I ntervention Treatment will continue until one of the following criteria applies: • Disease progression • Intercurrent illness that prevents further administration of treatment • Unac ceptable adverse event(s) • Patient decides to withdraw from the study • General or specific changes in the patient's condition render the patient unacceptable for further treatment in the judgment of the investigator • Pregnancy"
40,page_40,"Allian ce A221701 41 NCI version date 8/14/2020 Update #03 o All women of child bearing pote ntial should be instructed to contact the investigator immediately if they suspect they might be pregnant (e.g., missed or late menstrual period) at any time during study participation. • Termination of the study The reason(s) for protocol therapy discontinuation, the reason(s) for study removal, and the corresponding dates must be documented in the Case Report Form (CRF). 12.3 Follow -up 12.3.1 Duration of Follow -up There will be no follow up after the eight week treatment period. 12.3.2 Follow -up for Patients w ho Stop Study Treatment Early When patients stop protocol treatment early, they should be encouraged to complete QOL submissions but can stop if they prefer. 12.4 Extraordinary Medical Circumstances If, at any time the constraints of this protocol are detrimental to the patient's health and/or the patient no longer wishes to continue protocol therapy, protocol therapy shall be discontinued. In this event: • Document the reason(s) for discontinuation of therapy on data forms. • Follow t he patient for protocol endpoints as required by the Study Calendar. 12.5 Managing ineligible patients and registered patients who never receive protocol intervention Definition of ineligible patient A study participant who is registered to the trial but does not meet all of the eligibility criteria is deemed to be ineligible. Follow -up for ineligible patients who continue with protocol treatment Patients who are deemed ineligible after registering may continue protocol treatment, provided the treating ph ysician, study chair, and executive officer agree there are no safety concerns if the patient continues protocol treatment. All scans, tests, and data submission are to continue as if the patient were eligible. Notification of the local IRB may be necessar y per local IRB policies. Follow -up for ineligible patients who discontinue protocol treatment For patients who are deemed ineligible after registering to the trial, who start treatment, but then discontinue study treatment, the same data submission requir ements are to be followed as for those patients who are eligible and who discontinue study treatment. Follow -up for patients who are registered, but who never start study treatment For all study participants who are registered to the trial but who never receive study intervention (regardless of eligibility), baseline and off -treatment notice data submission is required. See the Data Submission Schedule accompanying the All Forms Packet."
41,page_41,"Allian ce A221701 42 NCI version date 8/14/2020 Update #03 13.0 STATISTICAL CONSIDERATIONS 13.1 Study Design This trial is designed as a multi -center, randomized, double -blind, placebo -controlled phase III study where patients will be randomly assigned to receive either dexamethasone mouth rinse or placebo mouth rinse. The respective research hypotheses for the co -primary obj ectives 2.1.1 and 2.1.2 are: 1) Pain will be less common in patients who take dexamethasone preventatively (dexamethasone group) compared with those who initiate dexamethasone at the onset of mouth pain (placebo group) . The research hypothesis for this fi rst co-primary objective is: Dexamethasone taken preventively will substantially decrease the number of patients who develop mIAS. 2) The research hypothesis for this second co-primary objective is: The average severity of mIAS -associated pain over the eig ht week treatment period will be greater in those who initiate dexamethasone at the onset of mouth pain (placebo group) compared to those who take dexamethasone preventatively (dexamethasone group) . 13.2 Sample Size, Accrual time and Study Duration To acco unt for 10% ineligible patients and cancelations, the targeted sample size is 279 patients (evaluable patients for data analysis are 254) . Under a constant accrual rate of 10 -15 patients per month, the study will last 28 months from initiation until the fi nal patient is accrued, and another 2 months until the final patient completes treatment . 13.3 Primary objectives and endpoint s There are two co -primary endpoints in this study. Patient -reported mouth pain is measured by a simple 11 -item response scale [ 0, 1, 2, …, 10] with zero indicating “no pain” and ten indicating “pain as bad as can be” (Appendix II) , and obtained at baseline (within seven days prior to the start of treatment) and then daily for 8 -weeks. 13.3.1 First co -primary endpoint The objective is to compare the incidence rate of mIAS -associated mouth pain between the two arms using a Chi -square test . The first co -primary endpoint is the binary outcome mouth pain (yes; no) defined as a patient reporting at least one serially measured mouth pain score greater than zero during the eight -week study period. 13.3.2 Second co -primary endpoint The objective is to compare the average AUC of the serially measured mIAS -associated mouth pain scores between the two arms using a two -sample t -test. The second co -primary endpoint is the area under the curve (AUC) summary measure calculated for each patient based on t he patient’s serially measured patient -reported mouth pain scores; the AUC calculated for each patient is scaled according to the number of assessable patient -reported mouth pain scores to obtain a transformed AUC score on a scale of 0 -100. 13.4 Secondar y objectives and endpoints 13.4.1 (Objective 2.2.1) Using the same measurement method that was reported in the SWISH trial, we will generate a n endpoint that consists of a co mbination of a patient reported pain scale, data from a normalcy of diet questionn aire, and CTCAE grading of stomatitis /mucositis to determine the incidence of ≥ grade 2 mIAS. Grade ≥ 2 mIAS is defined as having at least one of the following criteria:"
42,page_42,"Allian ce A221701 43 NCI version date 8/14/2020 Update #03 1) Oral intake assessed at <50 on the Normalcy of Diet Scale 2) Patient’s reported or al pain (using visual analog ue scale 0 -10) that meets one of the following: • rating of 7 on two consecutive days • rating of 8, 9, or 10 on any one day Our hypothesis is that dexamethasone will substantially decrease the number of patients who develop grade ≥ 2 mIAS. 13.4.2 (Objective 2.2.2 ) We will determine if the initiation of dexamethasone at the start of everolimus increases time to development of mo uth pain. Our hypothesis is that daily numerical analog ue scale data will reveal longer time to the development of at least mild, at least moderate, and severe mouth pain in the upfront dexamethasone arm compared to the placebo arm. 13.4.3 . (Objective 2.2. 3) We will assess if quality of life and adverse related domains are better, as we hypothesize that it will be, when dexamethasone mouth rinse use starts at the same time as everolimus use versus at the time when mouth pain begin s by comparing numerical analogue scale scores ( Appendix II I) and PRO -CTCAE mout h/throat and sleep items regarding level of interference with daily activities (Appendix IV ). 13.4.4 . (Objective 2.2 .4) We will investigate if starting dexamethasone mouth rinse concurrent with starting everolimus improves patients’ ability to adhere to everolimus therapy by comparing mean daily dose of everolimus between the arms, as well as the number of patients who stopped everolimus early and the number who reduced the dose of everolimus per arm between the groups. 13.4.5 . (Objective 2.2.5 ) We will compare dexamethasone prescription fill rates and time to these fills between patients who received placebo versus stud y drug at the initiation of everolimus . 13.5 Analysis Plan and Sample Size Justification The primary analyses will be based on the intent -to-treat (ITT) population, defined as all patients randomized who completed the numerical analogue mouth pain scale at least once during the study. For the co -primary endpoints, a fixed -sequence statistical strategy will be used to control the Type I error rate at 0.05. The first co -primary endpoint will be tested, followed by the second co-primary endpoint, both at the same significance level of 0.05, such that the second co -primary endpoint is only tested if statistical significance was achieved on the first co -primary endpoint. Although both co -primary endpoints are clinically relevant, the testing sequence was ordered largely by the likelihood of success. 13.5.1 First co -primary endpoint The sample siz e was determined based on the between arm comparison of the incidence rate of mIAS -associated mouth pain using a Chi -square test. The incidence rate for each arm is defined as the proportion of patients reporting any pain score greater than zero during the eight week study period, based on the single item numerical analogue mouth pain scale ( Appendix II ). Based on prior studies (Section 13.7 ), we assumed that the incidence r ate of mIAS -associated mouth pain in the placebo group is 50%, and hypothesized that the incidence rate of mIAS -associated mouth pain in the dexamethasone group will be 32%. To detect this difference in the incidence rate of mIAS -associated mouth pain wit h 80% power, 127 patients are needed per group or 254 patients total. The"
43,page_43,"Allian ce A221701 44 NCI version date 8/14/2020 Update #03 sample size calculation was based on a Chi -square test with a 5% Type I error rate under two-sided alternative . 13.5.2 Second co -primary endpoint: With 127 patients per group (254 total), the study is adequately powered to detect a moderate effect size for the second co -primary endpoint. Specifically, 127 patients per group will provide 97% power to detect a moderate effect size of 0.5 (equivalent to 10 points on the transformed AU C score scaled from 0 -100 divided by an assumed standard deviation of 20 points). We assumed that the place bo group would have a higher transformed mean area under the curve ( AUC , equivalent to increased mIAS -associated mouth pain) than dexamethasone group . This power calculation was based on a two -sample t-test with a two -sided 5% Type I error rate. 13.5.3 Secondary endpoints: The SWISH trial approach incidence rate of grade 2 or higher stomatitis for each treatment group will also be compared by a Chi-square test. The planned tests for the other secondary endpoints are detailed in the table below: Study item Measurement method Statistical test Time to develop at least mild mouth sores per study arm. PRO -CTCAE Mouth/throat sore items (Appendix IV ) Kaplan -Meier and cumulative incidence curves Time to develop at least moderate mouth sores per study arm. PRO -CTCAE Mouth/thr oat sore items (Appendix IV ) Kaplan -Meier and cumulative incidence curves Time to develop at least severe mouth sores per study arm. PRO -CTCAE Mouth/throat sore items (Appendix IV ) Kaplan -Meier and cumulative incidence curves Mean and median degrees of patient -reported mouth sores per study arm. Numerical analog ue mouth pain scale (Appendix II) Independent s amples T -tests Incidence and time to develop at least mild mouth pain (pain scores of 1-3/10) per study arm. Numerical analog ue mouth pain scale (Appendix II) Chi-squared tests and cumulative incidence curves, respectively Incidence and time to develop at least moderate mouth pain (pain scores of 4 -6/10) per study arm. Numerical analog ue mouth pain scale (Appendix II) Chi-squared tests and cumulative incidence curves, respectively Incidence and time to develop at least severe mouth pain (pain scores of 7-10/10) per study arm. Numerical analog ue mouth pain scale (Appendix II) Chi-squared tests and cumulative incidence curves, respectively Quality of life over time per study arm. Linear Anal ogue Self - Assessment (Appendix III) Independent samples t -tests"
44,page_44,"Allian ce A221701 45 NCI version date 8/14/2020 Update #03 Study item Measurement method Statistical test Level of activity interference with daily activities PRO -CTCAE Mouth/throat sore items (Appendix IV ) and P RO- CTCAE Sleep Items (Appendix IV ) Independent samples t -tests Mean daily dose of everolimus over 8 weeks Appendix V I Independent samples t -tests Number of patients who stopped everolimus per arm Appendix V I Chi-square tests Number of patients who reduced the dose of everolimus per arm Appendix VI Chi-square tests Proportion of patients who experience grade 2 stomatitis Clinician -reported stomatitis performed at 1 and 2 months Chi-squared tests Number of patients who chose to fill their dexamethasone prescription per study arm and mean time until this happened This information will be collected by p atient questionnaire (Appendix V) and also will be nurse delineated (Appendix VI) . Conflicts will be adjudicated by an investigator who is blinded to study arm. Chi-squared tests and cumulative incidence curves respectiv ely 13.6 Interim data analysis and stopping rule No interim data analysis was planned for this trial. Note: The statement regarding the interim analysis in previous Section 13.8 of the protocol was inadvertently carried over from another protocol. It was not meant to be included. 13.7 Primary Endpoint Justification: CTCAE items One option for our primary analysis would be to use the identical endpoint measurement criterion that was developed and used de novo in the SWISH trial. This composite endpoint required that grade 2 or higher stomatitis needed to be confirmed by the investigator or treating physician and at least one of the following: 1) an oral pain score of greater than 8/10 on 1 occasion or 7/10 for 2 days, or 2) that patients could only eat soft chewable foods (or less, like liquids alone) as determined by a Normalcy of Diet Scale score less than or equa l to 50/100. With this rule, a patient with classic CTCAE determination of grade 2 stomatitis could have been downgraded to grade 1 stomatitis if they did not meet the pain or diet criteria to keep them at grade 2 stomatitis (noting that this only happene d for 2 patients in the SWISH trial — unpublished data provided to us). The main reason to consider choosing this measurement method is that it was used in the previously published SWISH trial. However, the downsides of utilizing this novel measurement is that this composite CTCAE clinician -determined measurement is not well validated psychometrically by itself, or by adding the 2 criteria noted above."
45,page_45,"Allian ce A221701 46 NCI version date 8/14/2020 Update #03 Additionally, data that can be collected daily by patient questionnaires will allow us to more accurately see daily changes on the days before and after patient actually took prescription dexamethasone (which they would have started because they developed mouth pain); we may not be able to collect CTCAE data at that exact time, if we used the SWISH measuremen t method. Further supporting the use of a PRO measure of mouth sore related pain is that the definition of grade 2 or 3 CTCAE -determined mucositis is primarily based on pain, as is illustrated in the table below (thus the mouth pain that patients developed would have been the predominant factor to determine their CTCAE score). Grade: 1 2 3 4 5 Mucositis oral Asymptomatic or mild symptoms; intervention not indicated Moderate pain or ulcer that does not interfere with oral intake; modified diet indicated Severe pain; interfering with oral intake Life-threatening consequences; urgent intervention indicated Death Thus, we propose to use the PRO pain score as our primary measurement tool, while using the SWISH trial method as a secondary endpoint for both concurrent validation of the SWISH approach and comparison of the two results . This primary measurement tool will be used both to determine if initial dexamethasone is superior in prevent ing the development of any mouth sores -related pain compared to initial placebo, and to determine if the average severity of mIAS - associated pain over the eight week study period is greater in those who initiate dexamethasone at the onset of mouth pain compared to those who take dexamethasone preventatively , corresponding to the first and second co -primary objectives, respectively. 13.8 Sample Size and Power Considerations 13.8.1 Co-primary endpoint original consideration The effect size estimates from the preliminary trials are profound, exceeding one standard deviation for multiple primary and secondary endpoints. For example, b y 8 weeks, the incidence of grade 2 or worse stomatitis was two (2%) of 85 patients (95% CI 0·29 –8·24), versus 159 (33%) of 482 patients (95% CI 28·8 –37·4) for the duration of the BOLERO -2 study. This represents an effect size in excess of 5 standard deviations and would require only 29 patients per group, an impractically small sample size. Hence, we will use established norms for reasonable clinically meaningful effect sizes established by our group over fifteen years ago and used in numerous clinical trials by ourselves and others for the purposes of power c alculations35, 36. Our clinical colleagues’ expert opinions as to what constitutes a clinically significant effect size were used as a confirmatory check on our effect size estimates. For the first co -primary endpoint, a Chi -square test with 77 patients p er group will have 99% power to detect a difference in the rate of mIAS pain (>50% in the placebo versus <15% in the dexamethasone treatment group) with a two -sided alternative and a 5% Type I error rate. These estimates are based on the SWISH and Bolero t rial data. For the second co -primary endpoint, the independent samples t -test using the simple summary AUC measure will have 87% power to detect a difference in the first co -primary endpoint of AUC for the 8 -week period for the severity of mIAS -associated pain as assessed by the single item measure of 50% times the standard deviation (a moderate effect size equivalent to 10 points on the transformed AUC score scaled from 0 -100, assuming a"
46,page_46,"Allian ce A221701 47 NCI version date 8/14/2020 Update #03 standard deviation of 20 points in the AUC) among the two arms of 77 patients each, 154 patients total (type I error rate set at 5% and a two -tailed alternative). This effect size is considered clinically non -ignorable 37 and is a conservative estimate of efficacy given the profound results of the pilot test results. 13.8.2 Re-design co-primary endpoint consideration as a result of NCI CIRB review Questions were raised regarding the sample size by the NCI CIRB regarding: 1) Calculation of initial effect size 2) Potential for patients to use the treatment more because they have r eady access to what they believe is a pain ameliorating intervention. Consideration of effect size: As indicated above in the introduction (section 1.2), the multiple phase II trials that have used this treatment have indicated effect sizes of more than f ive standard deviations in assessing reduction of the incidence of pain reported by patients or assessed by clinicians. The table below illustrates this point in using incidence rates for any stomatitis and grade 2+ stomatitis from the two pilot studies and historical control data from the Bolero study. More specifically, the effect sizes are all well above one standard deviation and require as few as 22 patients per group for a chi -square test for equality of proportions to achieve 80% power with a 5% Type I error rate. The sample size could be as large as 71 per group if we consider the San Antonio study and grade 2+ stomatitis. This is still less than the 77 patients per group required to detect a moderate effect size as described above as a non -ignorable clinically meaningful effec t 38 Source Clinician -reported stomatitis incidence Effect Size Sample size to detect effect size (per group) with 80% power and 5% type I error Historical Control (Bolero) 67% (any), SWISH 21% (any) 46% 22 San Antonio study 29%, 27.5% (any) 38%, 39.5% 31, 29 Historical Control (Bolero) 33% (gr 2+) Bolero -2 2% (gr 2+) 31% 29 San Antonio study 12%, 8% (gr 2+) 21%, 25% 71, 48 We consider the possibility that some patients fill the dexamethasone prescription when they really do not actually have pain, because they think it will prevent them from getting pain. One could assert that the likelihood of doing this should be equivale nt between the treatment and placebo preparations and dismiss potential effect size confounder. However, in case that is not the case, in the extreme case that 1 out of every 6 patients in the treatment arm reports pain in the absence of pain, in order to gain permission to fill the dexamethasone script, compared to none in the placebo group (personal communication, CIRB), this would reduce our initially estimated effect size by 16.7%."
