,PageNo,Text13,page_13,"14 separating animals from their caregiver or social group, whereas stimulation of these brain areas elicits greater distress vocalizations. Similar observations have been made in human subject studies. Increased activity of the dACC and anterior insula is observed among individuals following social rejection during a virtual ball-tossing game (Eisenberger et al., 2003); and bereaved individuals viewing pictures of the deceased exhibit increased activation in the dACC and anterior insula (O’Conner et al., 2008) Thus, the literature supports the assertion that there are shared pathways involved in emotional/social and physical pain processing. In turn, it is possible that emotional pain, such as social rejection or weight stigma, could potentiate or exacerbate the experience of physical pain. Thus, methods for alleviating physical pain may be useful in addressing emotional pain such as social rejection or weight stigma. Pain Management Given the prevalence of chronic pain and its association with several negative physical and psychological health outcomes, identifying and disseminating effective pain management methods is of utmost importance. The goal of pain management is to modulate the experience of pain or response to pain using one or more approaches (e.g., pharmacological, behavioral) in order to reduce the pain as much as possible, or to improve self-efficacy in pain management (Takai, Yamamoto-Mitani, & Suzuki, 2015). Several psychological strategies have been identified that are effective for pain management in a variety of conditions. Biofeedback and mindfulness-based stress reduction are two examples of strategies that may be delivered on their own to aid in pain management, but also are commonly delivered in conjunction with other forms of pain management. Broadly, these approaches help the patient react to, and cope with, physical pain and any accompanying"
14,page_14,"15 emotional pain in a more adaptive manner (Hylands-White, Duarte, & Raphael, 2017). Cognitive behavioral therapy (CBT) is a psychological approach to pain management that encourages patients to re-conceptualize their experience of pain symptoms in order to develop more realistic perceptions, adaptive behaviors, and positive functioning. Patients are encouraged to exert control over pain symptoms by employing cognitive and behavioral skills. Although CBT does not usually reduce pain per se, it is associated with improved self-efficacy and quality of life, and reduced distress (Hylands-White, Duarte, & Raphael, 2017). Many researchers have studied the effectiveness of pharmacological therapies for chronic pain. This approach is an effective pain management strategy for many individuals with chronic pain, but adverse side-effects of long-term pharmacological therapy use have been reported (Finnerup, Sindrup, & Jensen, 2010; Planton & Edlund, 2010). Despite these risks, pharmacological therapy is still often used as a stand-alone treatment for chronic pain or in conjunction with other pain management methods. In treating pain with pharmacology, physicians may follow a system that matches, or is similar to, the World Health Organization (WHO) analgesic ladder (Ventadridda, Saita, Ripamonti, & De Conno, 1985). This system was initially developed for treatment of cancer pain, but can be applied to most pain conditions, and suggests that analgesic medications should be administered with increasing potency until the individual achieves pain relief (World Health Organization, 2015). It is suggested that pain relief efforts begin with administration of non-steroidal anti-inflammatory drugs, which share similarities with acetaminophen in that they produce pain relief via reductions in inflammation and products of inflammation (e.g., prostaglandins). Should this not achieve pain relief, weak opioids may be considered, with strong opioids serving as a last resort. Additionally, corticosteroids such as prednisone and dexamethasone may be used as adjuvant analgesics due to"
15,page_15,"16 their anti-inflammatory properties. Corticosteroids have been found to provide pain relief in a variety of conditions such as neuropathic and bone pains (Vyvey, 2010). One of the most popular analgesics for acute and chronic pain in the United States is acetaminophen, the active ingredient in Tylenol. An estimated 23% of adults in the U.S. consume a drug that contains acetaminophen on a weekly basis (Kaufman, Kelly, Rosenberg, Anderson, & Mitchell, 2002). The effectiveness of acetaminophen in treating pain has been documented in several randomized controlled trials among patients with chronic or acute pain (e.g., arthritic, postoperative), as well as among adults with experimentally-induced pain (e.g., cold pressor; Mischkowski, Crocker, & Way, 2016). The mechanism through which acetaminophen provides pain reduction is uncertain, but it is widely accepted that pain reduction occurs via mechanisms in the central nervous system such as the dACC and anterior insula (DeWall et al., 2010) which are known to play a role in emotional, and particularly social, pain. Due to the association of pain with obesity, several pain management approaches have been tested for their effectiveness in individuals with obesity. Weight reduction via diet and exercise have been associated with improved quality of life and reduced bodily pain in patients with obesity suffering from fibromyalgia (Senna, Sallam, Ashour, & Elarman, 2012), and weight reduction has been associated with diminished pain and improved physical performance among patients with obesity suffering from knee osteoarthritis (Messier et al., 2004). Physical rehabilitation via physical exercise (including aquatic therapy) has facilitated reductions in pain (Narouze & Souzdalnitski, 2015). Other strategies noted to reduce pain among individuals with obesity include acupuncture, CBT, and patient education regarding adaptive lifestyle changes to facilitate weight loss and better pain management (Narouze & Souzdalnitski, 2015). Pharmacotherapy also may be utilized to help patients with obesity manage pain. Medications"
16,page_16,"17 such as gabapentin or pregabalin may help patients with obesity and pain maintain activity levels to help prevent significant weight gain (Cabrera et al., 2012). Duloxetine also may help patients with obesity cope with pain from fibromyalgia, chronic musculoskeletal pain, and peripheral neuropathic pain from diabetes (Narouze & Souzdalnitski, 2015). Long-term opioid use is not recommended for patients with obesity due to lack of efficacy and safety concerns. Additionally, while adjuvant corticosteroids may assist with pain relief, common and problematic side-effects include increased appetite and weight gain (Vyvey, 2010). Acetaminophen and Emotional Pain Research on pain medications such as acetaminophen has traditionally examined physical pain, but recent studies documenting the overlap in physical and emotional pain processing have led to examining the effects of acetaminophen on emotional pain. An early study provided evidence that acetaminophen reduces social pain among healthy undergraduate students (DeWall et al., 2010) who were randomly assigned to receive 1,000mg of acetaminophen daily (500mg pill upon waking and 500mg pill one hour before bedtime) for three weeks, or placebo pills to be taken for the same amount of time in the first of two experiments. At the end of each day during the three-week period, participants rated total social pain experienced during that day. Results indicated that social pain decreased over the three-week span for those taking acetaminophen, but ratings did not change in the placebo group. In the second experiment conducted by DeWall and collages (2010), participants were randomly assigned to receive 2,000mg of either acetaminophen or placebo in pill form for three weeks, after which they completed a social exclusion task while undergoing an fMRI scan. Results indicated that participants who were randomly assigned to the acetaminophen condition exhibited less activity in the dACC and"
17,page_17,"18 anterior insula in response to social exclusion relative to participants assigned to the placebo condition (DeWall et al., 2010). Whereas DeWall and colleagues studied only social pain, a more recent study examined the influence of acetaminophen on both positive and negative affect among undergraduate students (Durso, Luttrell, & Way, 2015) who were randomized to receive either an acute dose of acetaminophen (1,000mg) or placebo via liquid vehicle. After waiting 60 minutes, participants provided their emotional reactions to a series of pleasant and unpleasant images. Participants in the acetaminophen condition rated unpleasant images less negatively, but also rated positive images less positively, compared to those in the placebo condition. Those in the acetaminophen condition also rated images less emotionally stimulating than those in the placebo condition. Thus, the results suggest that acetaminophen may exert a blunting effect on processing of emotionally-provocative stimuli. Other Psychological Outcomes More recent research has sought to examine effects of acetaminophen on other psychological variables and processes. Roberts and colleagues (2017) investigated the impact of a 1000mg dose of acetaminophen versus a placebo on distrust, a common feature of borderline personality disorder (BPD) that can contribute to the interpersonal difficulties often observed among individuals with the disorder. Results revealed that distrust remained high among individuals with elevated BPD features who were administered a placebo, but increased trust was observed among those who were administered acetaminophen. Empathy also has been a focus of acetaminophen research, based on functional magnetic resonance imaging data suggesting that the brain areas (e.g., ACC, anterior insula) activated when experiencing pain are also activated when observing others experiencing pain (Lamm, Decety, & Singer, 2011). Mischkowski,"
18,page_18,"19 Crocker, and Way (2016) found that 1,000mg of acetaminophen reduced empathy for another’s pain. Participants were administered acetaminophen or a placebo, after which they read a passage about someone experiencing social or physical pain, observed an individual being ostracized, or observed someone receiving a painful noise blast. Those administered acetaminophen reported less empathy in response to pain observed in another or pain they read about another receiving. When participants were exposed to a painful noise blast themselves, acetaminophen was associated with lower ratings of unpleasantness compared to the placebo condition. Thus, acetaminophen has been associated with decreased social pain and reduced negative affect (DeWall et al., 2010; Durso et al., 2015). Such findings may be particularly relevant for individuals with overweight or obesity who are more likely to experience the social pain of weight stigma. However, no study has explored the effects of acetaminophen on the emotional pain of weight stigma among individuals with overweight or obesity. Although previous research has demonstrated that the relationship between BMI and physical pain is mediated by perceived weight stigma among women with overweight (Olson et al., 2018), the sample was relatively small (total n = 61; overweight n = 26). Therefore, it is important to replicate this finding, as well as to further investigate in a larger sample the relevance of internalized weight stigma as a mediator in the BMI-bodily pain relationship. Additionally, the possible role of an analgesic such as acetaminophen in moderating the relationship among BMI, weight stigma, and bodily pain has not been explored. Current Studies Two studies are proposed. Study one will evaluate the influence of a weight stigma induction on inflammation, pain, and distress among women with overweight and obesity, and"
19,page_19,"20 whether that effect is moderated by consuming acetaminophen. This study also will evaluate the relationship between BMI and pain, the degree to which the relationship is mediated by weight stigma, and the degree to which acetaminophen moderates the weight stigma-pain relationship. Study two will evaluate whether inflammation, pain, and distress are equivalent among three groups exposed to a weight stigma induction: women with overweight and obesity following an acute dose of acetaminophen, women with overweight and obesity following an acute dose of a placebo solution, and women with normal weight following an acute dose of a placebo solution. Aims and hypotheses for both studies are described below, with hypotheses identified as ‘primary’ or ‘secondary’. Primary hypotheses reflect essential research questions while secondary hypotheses are exploratory analyses considered to be less central to the objectives of the two studies. Study One Aim #1: Evaluate the interrelationship of variables including BMI, inflammatory markers, distress, pain, affect, weight stigma, exposure to weight-based stigmatizing experiences, impact of weight on quality of life, and health-related quality of life. Primary Hypotheses: 1a) At baseline, BMI will be positively associated with prostaglandins, CRP, internalized weight stigma, perceived weight stigma, exposure to weight-based stigmatizing experiences, impact of weight on quality of life, pain, and negative affect; and negatively associated with health-related quality of life and positive affect. 1b) At baseline, levels of inflammatory markers (prostaglandins, CRP) will be positively associated with pain, negative affect, internalized weight stigma,"
20,page_20,"21 perceived weight stigma, impact of weight on quality of life, and exposure to weight-based stigmatizing experiences; and negatively associated with health-related quality of life and positive affect. Secondary Hypotheses: 1c) The relationship between BMI and baseline pain will be mediated by experienced weight stigma (see Figure 1). 1d) The relationship between BMI and baseline pain will be mediated by perceived weight stigma (see Figure 2). 1e) The relationship between BMI and baseline pain will be mediated by internalized weight stigma (see Figure 3). 1f) Effects of the weight stigma induction on the relationship between BMI and post-induction pain will be mediated by internalized weight stigma (see Figure 4). i. In this mediation model, the relationship between internalized weight stigma and post-induction pain will be moderated by acute acetaminophen ingestion (see Figure 5). Due to the cross-sectional design of the study, exploratory analyses will be used to evaluate the three types of weight stigma (experienced, perceived, and internalized) as moderators in the relationship between BMI and baseline pain. Additionally, exploratory analyses will evaluate internalized weight stigma as a moderator in the relationship between BMI and post-induction pain, as well as the moderating effect of acute acetaminophen ingestion in this relationship (i.e., moderated moderation)."
21,page_21,"22 Aim #2: Evaluate differences in affect, physical pain, distress, and inflammatory markers among four groups: those exposed to the weight stigma induction with either (1) acetaminophen or (2) a placebo solution, and those exposed to the control induction with either (3) acetaminophen or (4) a placebo solution. Primary Hypotheses: 2) Participants randomized to receive the weight stigma induction and placebo conditions will report greater physical pain, distress, and negative affect; lower positive affect; and higher levels of prostaglandins following completion of the induction compared to the other three groups. No differences are expected on these dimensions among the other three conditions. Study Two Aim #3: Evaluate differences in affect, physical pain, distress, and inflammatory markers among three groups exposed to a weight stigma induction: participants with overweight or obesity randomized to acetaminophen or a placebo solution, and a sample of adults with normal weight given a placebo solution. Primary Hypotheses: 3a) Among the three groups post-induction, those with overweight or obesity randomized to the placebo condition will report greater pain, distress, negative affect, and prostaglandins; and lower positive affect than individuals with overweight or obesity randomized to acetaminophen or individuals with normal weight. No differences are expected in pain, distress, positive and negative affect, and prostaglandins between the overweight or obese/acetaminophen group versus the normal weight group."
22,page_22,"23 Secondary Hypotheses: 3b) Individuals in the overweight or obese groups will report greater baseline pain, distress, internalized weight stigma, perceived weight stigma, exposure to weight-based stigmatizing experiences, impact of weight on quality of life, and negative affect; and worse health-related quality of life and positive affect compared to participants with normal weight. The overweight or obese group also will demonstrate higher levels of prostaglandins and CRP at baseline compared to the normal weight group."
23,page_23,"24 Chapter 2: Methods Participants and Recruitment 160 women who are categorized as overweight (BMI 25-29.9) or obese (BMI ³ 30) will be recruited for study one and study two, and an additional 40 females with normal weight (BMI 18.5-24.9) will be recruited for comparison in study two. Women will be the focus of study because women report more weight-related stigmatization than men and are more likely to internalize weight stigma (Boswell & White, 2015). Participants will be recruited from multiple sources: the NIH-funded ResearchMatch database, an internet site designed to help research investigators identify potentially eligible participants; StudySearch, an internet site coordinated by the Ohio State University Center for Clinical and Translational Science that allows community-residing individuals to identify research studies for which they may be eligible; and MyChart for Recruitment, another recruitment service coordinated by the Ohio State University Center for Clinical and Translational Science that uses an Honest Broker to identify potentially eligible participants among those enrolled in OSU’s medical MyChart system and sends those individuals a study advertisement. The Psychology 1100 Research Experience Program at Ohio State University will serve as another source of participants for both studies. Flyers advertising both studies will be placed in various locations on Ohio State University’s Columbus campus and in the surrounding Columbus community. An additional source of participants with overweight or obesity for study one will be women enrolled in the “Living Well” program, a behavioral weight management program offered at The Ohio State University Center for Wellness and Prevention. All eligible participants for both studies will be women who are at least 18 years of age. Overweight or obese participants will be stratified by age (18-40 years vs. over 40 years) and BMI (BMI = 25-29.9 vs. BMI ³ 30) for randomization into one of four study"
24,page_24,"25 conditions. Following recruitment of overweight or obese participants for studies one and two, a cohort of participants with normal weight will be recruited for study two. Procedures – Study One (Participants with Overweight or Obesity Only) Individuals who express interest in the study will be contacted via telephone to complete a brief, ten-minute prescreening assessment to evaluate eligibility for the study. Information concerning age and sex will be collected to determine eligibility. Information regarding pregnancy status also will be collected; those endorsing current pregnancy will be excluded due to possible harm of acetaminophen use. Additionally, information regarding vision deficits and reading level will be obtained; those reporting vision deficits that prevent reading (e.g., blindness) or reporting less than a ninth-grade reading level will be excluded due to the impact these factors would have on the individual’s ability to read study vignettes and questionnaires. The Patient Health Questionnaire – 9 will be administered to assess for depressive symptoms; individuals scoring 15 or greater (i.e., moderate/severe depressive symptoms) will be ruled ineligible due to the potential influence of these symptoms on their reaction to study vignettes and responses to questionnaire items. Other exclusionary criteria are risk factors associated with acetaminophen use such as currently taking a drug containing acetaminophen, history of liver disorder and/or alcohol abuse, and allergic reaction to acetaminophen (Mischkowski et al., 2016). Individuals also will be asked for estimated height and weight measurements to ensure they are eligible for study one (i.e., BMI in the overweight or obese categories). Individuals reporting weights exceeding 400 pounds will be excluded due to limitations of the laboratory weight scale. Eligible women will be asked to refrain from consuming food for three hours prior to their participation in the study to facilitate drug absorption (Roberts et al., 2017)."
25,page_25,"26 Participants will have their height and weight measured by study personnel upon arrival to confirm the BMI estimate calculated in the prescreening. This information also will be used to confirm the participant’s stratification group for randomization. Following completion of physical measurements, participants will read and sign a study consent form. Participants will be given a copy of the consent form to keep for their own records. Following completion of study consent, study personnel will collect blood and saliva samples from participants for CRP and prostaglandin measurements, respectively. Next, participants will be led by study personnel to a room where they will complete the remainder of the experiment. Upon arrival at the room, participants will be randomized to receive either 10mL of acetaminophen (100 mg/mL) in liquid suspension, or 10mL of placebo (microcrystalline powder) in the same solution. The acetaminophen or placebo solution will be given to participants in plain cups and they will be instructed to ingest the solution as quickly as they can. Consistent with prior studies evaluating the effect of an acute dose of acetaminophen on psychological outcomes, participants will be required to wait 60 minutes after administration of the acetaminophen or placebo solution to allow sufficient time for absorption (Durso et al., 2015; Randles et al., 2013). Immediately following administration of the solution, participants will be given a packet of self-report measures that will require approximately 25 minutes to complete and that they may work on while waiting the required 60 minutes for drug absorption. After completion of self-report measures, participants will be asked to remain seated quietly until 60 minutes following administration of the solution. After 60 minutes has elapsed, participants will then be randomized to a weight stigma induction or a control induction. The internalized weight stigma induction for the current study was created by Pearl and Puhl (2016) and is referenced in the introduction portion of this proposal (see pages 10-11). The"
26,page_26,"27 weight stigma induction consists of two parts. First, participants will read a vignette describing a scenario in which an employee has been denied a promotion at their place of employment due to being overweight. After reading the vignette, the piece of paper on which it is typed will be taken from the participant who will then answer two factual questions to ensure they read the vignette. Participants answering one or both factual questions incorrectly will be excluded from study analyses. Participants also will be asked to rate on a seven-point scale how qualified and deserving the employee was of the promotion they were denied, with higher scores reflecting greater perceived qualification and deservedness. Next, participants will be given another piece of paper expressing that the employee felt stigmatized due to their weight. Participants will then be instructed to write 2-3 sentences describing a time when they may have had similar thoughts and feelings about themselves due to their weight, if there has been such a time. The goal of the control induction for the current study will be to mirror the procedures of the weight stigma induction but with material that is not likely to evoke positive or negative emotion. The control vignette only describes the procedures involved in a company’s promotion process. After reading the vignette, the paper on which it is typed will be taken from the participant. Next, participants will answer two factual questions about the vignette to ensure they read it. Participants answering one or both factual questions incorrectly will be excluded from study analyses. Additionally, participants will rate on a seven-point scale how qualified and deserving the employee was of the promotion, with higher rating reflecting greater perceived qualification and deservedness. Following completion of these items, participants will be given another piece of paper and instructed to write 2-3 sentences describing whether they believe the promotion process described in the vignette is reasonable and how they would change it, if at all."
