,PageNo,Text57,page_57,"Emicizumab F. Hoffmann -La Roche Ltd 57/Protocol BO39182, Version 3 medications should be reported to the investigator and recorded on the Concomitant Medications eCRF page. Medic ations given to treat a bleed (e.g., rFVIIa or aPCC) will be reported only via the electronic, handheld device, except for FVIII taken in the week prior to starting emicizumab by patients without inhibitors to FVIII who will continue their prior FVIII prophylaxis until the second loading dose of emicizumab. For these patients only, FVIII treatments taken in the week prior to the first dose of emicizumab will be recorded on the Concomitant Medication eCRF page. 4.4.1 Permitted Therapy Concomitant use of the following drugs and therapies will be permitted: • For patients in the expansion cohort who are on FVIII prophylaxis, they may continue their regular FVIII prophylaxis until the second emicizumab loading dose in order to avoid bleeds before adequate emicizumab level is reached. Concomitant routine FVIII prophylaxis is not otherwise permissible during the study. • Drugs intended to control bleeds, including FVIII concentrates (non-inhibitor patients) or rFVIIa (inhibitor patients), should be used at the lowest dose expected to achieve hemostasis. Given that circulating emicizumab may increase patients’ coagulation potential, the doses required to achieve hemostasis may be lower than the FVIII or bypassing agent doses used prior to starting the study . Caution should be taken for patients who are using rFVIIa (e.g., consideration of using no more than 90 µg/kg rFVIIa as an initial dose). Use of aPCC in combination with emicizumab should be avoided completely in patients who have the option of using other bypassing agents to treat bleeds. In the event that aPCC is the only available bypassing agent, the lowest dose expected to achieve hemostasis should be prescribed with no more than 50 units/kg of aPCC to be administered as an initial dose. For patients receiving aPCC prior to study entry, a washout period of 72 hours prior to first emicizumab dosing is required. Other bypassing agents (e.g., Byclot) should be avoided. In cases where such agents are the only available bypassing agent, the lowest dose expected to achieve hemostasis should be prescribed, with no more than the lowest dose described in the prescribing information to be administered as an initial dose (e.g., no more than 60 µg/kg of Byclot). For patients receiving Byclot prior to study entry, a washout period of 72 hours prior to first emicizumab dosing is required. Exact dose and schedule of FVIII or bypassing agents should be discussed with patients at the beginning and throughout the study. Repeated dosing of FVIII, rFVIIa, aPCC, or other bypassing agents should be performed only under medical supervision and consideration should be given to verifying bleeds prior to repeated dosing. For rFVIIa, aPCC, and other bypassing agents, laboratory"
58,page_58,"Emicizumab F. Hoffmann -La Roche Ltd 58/Protocol BO39182, Version 3 monitoring by additional local and central laboratory assessments should be performed as per the schedule of assessments (see Appendix 1). • Caution should be taken if anti -fibrinolytics are used in conjunction with rFVIIa in patients receiving emicizumab. • Drugs and therapies to treat adverse events and use of topical antiseptics, anesthetics, eye drops , and so on, that are not considered to result in systemic exposure • Drugs to treat an existing medical condition ongoing at study entry that do not violate the eligibility criteria (e.g., anti -retroviral therapy for HIV infections) 4.4.2 Prohibited Therapy Use of the following therapies is prohibited for at least 4 weeks prior to initiation of study treatment, during the study, and until last observation (except for aPCC and Byclot that require a washout period of 72 hours prior to study treatment and can be used for the treatment of breakthrough bleeds during the study as per guidance in Section 4.4.1): • Drugs that would affect hemostasis (e.g., aspirin, non-steroidal anti -inflammatory drugs that are not selective or preferential COX- 2 inhibitors , or anticoagulants [other than to flush, dwell, or de-clot a venous access device]) but excluding drugs intended to control bleeding episodes or used in the context of minor surgery (e.g., tooth extraction) or injuries (e.g., concussion) to prevent deterioration • Systemic immunomodulators (e.g., rituximab, interferon) other than anti -retroviral therapy • Elective surgery (excluding minor procedures such as tooth extraction or incision and drainage as well as emergency surgeries) • Use of other investigational drugs • Use of aPCC for short-term prophylaxis Use of concomitant prophylactic regimen with FVIII or rFVIIa (short-term prophylaxis [e.g., around the time of surgery], however, is permitted) • Use of anti -fibrinolytic s in conjunction with aPCC or Byclot If prohibited therapy is administered for any reason, it should be recorded on the eCRF. If prohibited treatment is prescribed or considered medically necessary, the Medical Monitor should be consulted to discuss any changes in the benefit/risk and determine whether the patient should continue on the study. 4.5 STUDY ASSESSMENTS See Appendix 1 for the schedule of assessments performed during the study. The Sponsor may consider providing MN support. If the Sponsor decides to provide MN support, at applicable sites and for patients in the expansion cohort only, certain study"
59,page_59,"Emicizumab F. Hoffmann -La Roche Ltd 59/Protocol BO39182, Version 3 assessments during the study may be performed by an MN professional at the patient's home or another suitable location, such as his or her school or office, to improve access and convenience for patients participating in the study. The Sponsor may select a healthcare company that will be responsible for providing MN services for participating sites (the MN vendor). The MN vendor will be responsible for ensuring that all MN professional s are licensed, qualified, and in good standing, as per applicable regulations, and that appropriate background checks have been performed. If the investigator at a participating site determines that MN services are appropriate for a patient and the patient gives written informed consent to participate in MN visits, the MN network will communicate with the patient and the patient’s site. MN visits will be scheduled on specified visit days, to allow for relevant assessments to be performed by the MN professional. 4.5.1 Informed Consent Forms and Screening Log Written informed consent for participation in the study must be obtained before performing any study -related procedures. Informed Consent Forms for enrolled patients and for patients who are not subsequently enrolled will be maintained at the study site. For adolescents (i.e., 12 −17 years of age), an Informed Assent Form will be completed instead. Parents or legally authorized representatives of adolescents will also complete an Informed Consent Form. All screening evaluations must be completed within 4 weeks prior to the first dose and reviewed to confirm that patients meet all eligibility criteria before enrollment. The investigator will maintain a screening log to record details of all patients screened and to confirm eligibility or record reasons for screening failure, as applicable. 4.5.2 Medical History and Demographic Data Medical history includes clinically significant diseases, procedures, use of alcohol and drugs of abuse within the past year, and medication allergies. In particular, sites should record whether the patient has any history of prior ITI, anaphylaxis, or known thrombophilia. It should also include all medication taken in the 4 weeks prior to enrollment (including prescription, over -the-counter, and herbal/homeopathic remedies and therapies). Finally, all bleed information (i.e., start date, cause, type, location), number of school/work days missed, and number of days hospitalized during the 24 weeks prior to study entry should be documented. Demographic data will include age, sex, and self-reported race and ethnicity. 4.5.3 Physical Examinations A complete physical examination should include but not necessarily be limited to the evaluation of head, eye, ear, nose, and throat and include cardiovascular, dermatological, musculoskeletal, respiratory, gastrointestinal , and neurological systems , height, and weight. Any abnormality identified during screening should be recorded on"
60,page_60,"Emicizumab F. Hoffmann -La Roche Ltd 60/Protocol BO39182, Version 3 the General Medical History and Baseline Conditions eCRF. Subsequently, a targeted (i.e., musculoskeletal, dermatological) and/or symptom-driven examination should be conducted as noted in the schedule of assessments or as clinically indicated. New or worsened abnormalities from screening should be recorded as adverse events, if appropriate. 4.5.4 Vital Signs Vital signs will include measurement of heart and respiratory rate, temperature, and systolic and diastolic blood pressure and should be recorded before study drug administration. Frequency of vital sign assessments should follow the schedule of assessments but may also be taken anytime as unscheduled assessments as judged by the investigator. 4.5.5 Laboratory, Biomarker, and Other Biological Samples Local laboratory assessments will be performed as indicated on the schedule of assessments. On days of study drug administration, laboratory samples should be drawn before the administration of study drug. In the PK run-in, no deviation from defined drug administration visits is allowed until Week 25. Deviations from the schedule of assessments of ± 2 days are acceptable after Week 25 in the PK run-in cohort. For the expansion cohort, deviations from the schedule of assessments of ± 2 days are acceptable; however, predose PK and PD sample collection and drug administration should coincide. Samples for the following laboratory tests will be sent to the study site's local laboratory for analysis: • Hematology (hemoglobin, hematocrit, platelet count, RBC count, WBC count, absolute differential count [neutrophils, eosinophils, lymphocytes, monocytes, basophils, other cells] , mean corpuscular volume, mean corpuscular hemoglobin, mean corpuscular hemoglobin concentration, and RBC distribution width ) • Serum chemistries (sodium, potassium, glucose, blood urea nitrogen, creatinine, calcium, phosphorus, magnesium, total and direct bilirubin, albumin, alanine aminotransferase, aspartate aminotransferase, and alkaline phosphatase) • Pregnancy test: All women of childbearing potential (including those who have had a tubal ligation) will have a serum pregnancy test at screening and within 7 days prior to initiation of study medication, if applicable Urine pregnancy tests will be performed at specified subsequent visits. If a urine pregnancy test result is positive, it must be confirmed by a serum pregnancy test. In the event of use of a bypassing agent , the following local laboratory tests will be performed within 24− 48 hours of initial bypassing agent administ ration so the investigator may monitor for potential thromboembolic events and thrombotic microangiopathy: platelet count, serum creatinine, LDH, and schistocytes. A plasma"
61,page_61,"Emicizumab F. Hoffmann -La Roche Ltd 61/Protocol BO39182, Version 3 sample should also be provided for local and central laboratory monitoring of prothrombin fragment 1+2, fibrinogen and D -dimer. If the test for prothrombin fragment 1+2 is not available at the site, the sample should be sent to the local reference laboratory, if available. For patients who require multiple doses of bypassing agents, laboratory monitoring should be performed every 24− 48 hours thereafter until 24−48 hours following the last dose of bypassing agents. If applicable, laboratory results should be recorded in the Following Treatment with Bypassing Agents eCRF form . The following samples will be sent to the Sponsor or a designee for centralized analysis: • Plasma samples for PK analysis • Plasma samples for immunogenicity assessment (anti -drug antibody [ADA]) • Plasma samples for anti -FVIII antibody measurement (inhibitor titer) will be sent to the Sponsor throughout the study, with the exception of the test needed at screening for patients who do not have a documented inhibitor test result within 4 weeks prior to enrollment, per inclusion criteria (see Section 4.1.1). • Plasma for PD and exploratory PD biomarker assessments (aPTT, PT, FVIII activity, thrombin generation, FIX:Ag, FX:Ag, and others as listed in Appendix 2 ). • Plasma aliquot for central lab assessment of fibrinogen, D dimer, and prothrombin fragment 1.2, collected after administration of bypassing agents (as listed in Appendix 1, Schedule of Assessments, in the foo tnotes ). This sample is addition to the local laboratory monitoring after bypassing agent use as described above. In certain instances, blood draws may be performed by an MN professional (see Section 4.5). For sampling procedures, storage conditions, and shipment instructions, see the Sample Handling Manual. 4.5.5.1 Pharmacokinetic Samples Blood samples for determination of plasma concentrations of emicizumab will be collected as specified in the schedule of assessments (see Appendix 1) and will be sent to the Sponsor or a designee for centralized analysis. Emicizumab plasma concentrations will be measured by a specific and validated enzyme-linked immunosorbent assay (ELISA) method. For blood draws, when the PK assessment is scheduled for the same nominal time as another scheduled assessment, the PK sample will take precedence. Details on sampling procedures, sample storage, and shipment are given in the Sample Handling Manual."
62,page_62,"Emicizumab F. Hoffmann -La Roche Ltd 62/Protocol BO39182, Version 3 4.5.6 Electrocardiograms Single ECG recordings will be obtained at specified timepoints, as outlined in the schedule of assessments (see Appendix 1). All ECG recordings must be performed using a standard high -quality, high-fidelity digital electrocardiograph machine equipped with computer -based interval measurements. Lead placement should be as consistent as possible. The following parameters will be obtained (and reported by the instrument): QT, RR, HR, QTcB, QTcF, PR and QRS and T- and U -wave morphology. ECG recordings must be performed after the patient has been resting in a supine position for at least 10 minutes. All ECGs are to be obtained prior to other procedures scheduled at that same time (e.g., vital sign measurements, blood draws) and should not be obtained within 3 hours after any meal. Circumstances that may induce changes in heart rate, including environmental distractions (e.g., television, radio, conversation) should be avoided during the pre-ECG resting period and during ECG recording. Any ECG changes that are associated with symptoms or lead to a change in study treatment or concomitant treatment, or discontinuation from study treatment must be reported as an adverse event on the adverse event eCRF. The investigator or designee must review, sign, and date all ECG tracings. The ECG may be repeated if investigator deems it appropriate. Paper copies will be kept as part of the patient’s permanent study file at the site. During the study, the Sponsor may request copies of ECGs to be submitted to the Sponsor or a Central Vendor. Centralized ECG reading and interpretations will not be performed unless safety concerns arise. 4.5.7 Patient-Reported Outcomes A data collection modality via an electronic, handheld device will be employed. To capture PRO data during study treatment, patients will complete the HRQoL, health status, preference questionnaires, and questions related to the number of missed days of school or work electronically at study sites during the specified visits. The instructions for completing the PRO questionnaires electronically will be provided by the investigator staff. The data will be transmitted via a pre-specified transmission method (e.g., Web or wireless) automatically after entry to a centralized database at the electronic, handheld device vendor. The data can be accessed securely by appropriate study personnel via the Internet. In case the device is not available, paper questionnaires might be used. HRQoL The Haem -A-QoL and the Haemo- QoL-SF will be used to measure HRQoL in adults and adolescents, respectively (see Appendix 5 and Appendix 6). The Haem -A-QoL was designed for adult patients with hemophilia. It consists of 46 items comprising 10 dimensions (physical health, feelings, view, sport and leisure time, work and school, dealing, treatment, future, family planning, and relationships/partners) and a scale"
63,page_63,"Emicizumab F. Hoffmann -La Roche Ltd 63/Protocol BO39182, Version 3 representing total score. Items are rated along 5 response options, although for some items there is also a ‘not applicable’ option ( von Mackensen and Gringeri 2005; 2010 ). The Haemo- QoL has been developed in a series of age-related questionnaires to measure health-related quality of life in children and adolescents with hemophilia (Bullinger et al. 2002; von Mackensen and Bullinger 2004; Pollak et al. 2006). These versions include a 77-item long form, a 35-item as well as a 16-item short form, and an 8-item index form. The short version for older children (8− 17 years) containing 35 items was selected for adolescents in this study. This version covers nine dimensions considered relevant for the children’s HRQoL (physical health, feelings, view of yourself, family, friends, other people, sports and school, dealing with hemophilia and treatment). Items are rated with five respective response options: never, seldom, sometimes, often, and always. Higher scores for both HRQoL measures are indicative of poorer HRQoL. Health Status The EQ -5D-5L (see Appendix 7), is a self-reported health status questionnaire that consists of six questions used to calculate a health utility score for use in health economic analysis (EuroQol Group 1990; Brooks 1996; Herdman et al. 2011; Janssen et al. 2013). There are two components to the EQ -5D-5L: a five-item health state profile that assesses mobility, self-care, usual activities, pain/discomfort, and anxiety/depression, as well as a visual analogue scale (VAS) that measures health state. Published weighting systems allow for creation of a single summary score. Overall scores range from 0 to 1, with low scores representing a higher level of dysfunction. The EQ-5D -5L will be utilized in this study for economic modeling. Missed Days of School or Work Patients will also be asked to document the number of days of school or work missed in the previous 4 weeks at the timepoints outlined in the schedule of assessments (see Appendix 1). Patient Preference Patient preference will be assessed through the Preference Survey, which asks patients to report which treatment they would prefer to continue to receive after having been treated with IV FVIII or bypassing agents (episodic or prophylaxis) prior to study entry and SC emicizumab during the study. Patients who express a preference are then asked to identify which reasons may have influenced their decision and indicate the top three reasons for their choice. Patients will complete this questionnaire at Week 17 on emicizumab."
64,page_64,"Emicizumab F. Hoffmann -La Roche Ltd 64/Protocol BO39182, Version 3 4.5.8 Bleed Definitions Definition of a Bleed For the purpose of the efficacy analyses, a standardized definition of bleed, adapted from criteria defined by the Subcommittee on Standards and Criteria, FVIII/FIX subcommittee of the International Society of Thrombosis and Hemostasis, and similar to that used in a recent clinical study, will be utilized in this study ( Blanchette et al. 2014; Mahlangu et al. 2014). • An event is considered a bleed if coagulation factors are administered to treat signs or symptoms of bleeding (e.g., pain, swelling, etc.). An additional definition of all reported bleeds (irrespective of treatment with coagulation factors) will be applied for a separate analysis. • Bleeds starting from the first sign of bleed and ending 72 hours after the last treatment for the bleed, within which any symptoms of bleeding at the same location or injections are ≤ 72 hours apart, are considered the same bleed. • Any injection to treat the bleed, taken > 72 hours after the preceding injection, is considered the first injection to treat a new bleed at the same location. • Any bleed at a different location is considered a separate bleed regardless of time from last injection. Definitions of Bleed Sites • Target joints: defined as a major joint (e.g., hip, elbow, wrist, shoulder, knee, and ankle) into which repeated bleeds occur (frequency of ≥ 3 bleeds into the same joint over the last 24 weeks prior to study entry) • Joint bleeds are defined as bleeds with bleed type “joint bleed” reported via the bleed /medication questionnaire with at least one of the following symptoms : Increasing swelling or warmth of the skin over the j oint Increasing pain Progressive loss of range of motion or difficulty in using the limb as compared with baseline • Muscle bleeds (sites as per the bleed/medication questionnaire) • Other (sites as per the bleed/medication questionnaire) Definitions of Bleed Types In addition, the assessment of a bleed will be separated into spontaneous bleeds, traumatic bleeds and bleeds related to procedure/surgery. Both spontaneous bleeds (i.e., the occurrence of hemorrhage where neither the patient nor a caregiver can id entify a reason) and traumatic bleeds (i.e., hemorrhage occurring secondary to an event such as trauma, “strenuous” activity, or “overuse”) will be collected. • Spontaneous bleeds: Bleeds should be classified as spontaneous if a patient records a bleed when there is no known contributing factor such as definite trauma, antecedent “strenuous” activity or “overuse.” The determination of what constitutes “strenuous” or “overuse” will be at the discretion of the patient. For"
65,page_65,"Emicizumab F. Hoffmann -La Roche Ltd 65/Protocol BO39182, Version 3 example, light jogging may be considered “non-strenuous” while sprinting may be considered “strenuous,” lifting of weights for a short period of time may be considered “moderate use” while repetitive weightlifting may be considered “overuse.” • Traumatic bleeds: Bleeds should be classified as traumatic if a patient records a bleed when there is a known or believed reason for the bleed. For example, if a patient were to exercise “strenuously” and then have a bleed in the absence of any obvious injury, the bleed would be recorded as a traumatic bleed because, although no injury occurred, there was antecedent “strenuous” activity. Bleeds subsequent to injuries would certainly be classified as traumatic. • Bleeds related to procedure/surgery: such as hematomas resulting from any surgeries or i nvasive procedures (e.g., tooth extractions, venipuncture, or SC drug administrations) or invasive diagnostic procedures (e.g., lumbar puncture, arterial blood gas determination, or any endoscopy with biopsy, etc.) would not be counted as bleeds. Bleeds related to procedure/surgery are not associated with any trauma except procedure/surgery -induced trauma. Patients (or their legally authorized representative) will complete a bleed/medication questionnaire weekly and whenever a bleed occurs via an electronic, handheld device. For each bleeding episode, they will provide information on the above topics as well as on the medication used to treat the bleed. Hemophilia medications that were taken will also be collected through the bleed/medication questionnaire. If the electronic, handheld device is not available, a paper questionnaire might be used. Investigators will review the bleed and bleed medication data as per the schedule of assessments (see Appendix 1) and have the option to correct or complete these in agreement with the patient via a Data Request Form process or via a Web-based portal, once implemented. The Sponsor will have view -access only but will do a review of the bleed and bleed medi cation data as per the Medical Data Review Plan. 4.6 PATIENT, TREATMENT, STUDY, AND SITE DISCONTINUATION 4.6.1 Patient Discontinuation Patients have the right to voluntarily withdraw from the study at any time for any reason. In addition, the investigator has the right to withdraw a patient from the study at any time. Reasons for withdrawal from the study may include, but are not limited to the following: • Patient withdrawal of consent at any time • Any medical condition that the investigator or Sponsor determines may jeopardize the patient’s safety if he or she continues in the study • Investigator or Sponsor determines it is in the best interest of the patient • Patient’s inability or unwillingness to comply with protocol requirements (non-compliance despite appropriate education measures taken by the clinical site)"
