,PageNo,Text40,page_40,"41 post-induction pain will be mediated by internalized weight stigma), the PROCESS (Hayes, 2013) macro will be employed with 10,000 bootstrap samples and 95% confidence intervals. For hypotheses 1c-1e, PROCESS will be used to test SSI, SIS, and WBIS, respectively, as mediators in the relationship between BMI and baseline MPQ total score. PROCESS will be used again to test three identical models, with the exception that baseline SF-36 bodily pain subscale score will serve as the dependent variable. For hypothesis 1f, PROCESS will be used to test WBIS as a mediator in the relationship between BMI and post-induction VAS-Pain, controlling for baseline VAS-Pain, and again between BMI and post-induction MPQ total score, controlling for baseline MPQ total score. Hypothesis 1fi will be evaluated using PROCESS to test moderated mediation models in which the mediating relationships tested in hypothesis 1f are moderated by acetaminophen condition (acetaminophen or placebo). Also, ratings of the employee’s deservedness of the promotion will be entered as a covariate in all analyses for hypotheses 1f and 1fi. The PROCESS macro also will be utilized to conduct exploratory moderation analyses. Specifically, eight simple moderation models will be used to assess potential conditional effects of experienced, perceived, and internalized weight stigma on the relationship between BMI and baseline pain outcome variables (baseline MPQ total score and SF-36 bodily pain subscale score), as well as post-induction pain outcome variables (post-induction MPQ total score and post-induction VAS-Pain). Additionally, two moderated mediation models will be used to assess the potential conditional effects of drug condition (acetaminophen or placebo) and internalized weight stigma on the relationship between BMI and post-induction pain outcome variables (post-induction MPQ total score and post-induction VAS-Pain). Ratings of the employee’s deservedness of the promotion and baseline pain scores will be entered as covariates in"
41,page_41,"42 exploratory analyses involving post-induction pain outcomes. All moderation and moderated-moderation analyses will be conducted utilizing 10,000 bootstrap samples. To evaluate hypothesis 2 (participants randomized to receive the weight stigma induction and placebo conditions will report greater physical pain, distress, and negative affect; lower positive affect; and higher levels of prostaglandins following completion of the induction compared to the other three groups), a series of analyses of covariance (ANCOVAs) will be conducted using post-induction measures (prostaglandins, positive and negative affect subscales of the PANAS, VAS-Pain, and VAS-Distress) as dependent variables, controlling for the relevant baseline measure and ratings of the employee’s deservedness of the promotion. Stigma condition (with two levels) and drug condition (with two levels) will be entered as class variables. Scheffe tests will be utilized to identify group differences in the presence of a significant interaction. For study 2, a series of ANCOVAs will be conducted matching the format of hypothesis 2 to test the hypotheses that, among the three groups exposed to the weight stigma induction (two overweight or obese from study 1 and one normal weight from study 2) those with overweight or obesity randomized to the placebo condition will report greater physical pain, distress, negative affect, and prostaglandins, and lower positive affect post-induction than individuals with overweight or obesity randomized to acetaminophen or individuals with normal weight. No differences are expected in physical pain, distress, positive and negative affect, and prostaglandins between the overweight or obese/acetaminophen group versus the normal weight group (hypothesis 3a). Having a relationship with someone with overweight or obesity also will be controlled for due to its potential impact on perceptions of weight stigma. The class variable will represent three conditions: the two overweight and obese groups exposed to the weight"
42,page_42,"43 stigma induction in study 1, and the normal weight group exposed to the weight stigma induction with placebo solution in study 2. Scheffe tests will be utilized to identify group differences in the presence of a significant main effect. To evaluate hypothesis 3b (those in the overweight or obese groups will report greater baseline bodily pain, internalized weight stigma, perceived weight stigma, exposure to weight-based stigmatizing experiences, impact of weight on quality of life, prostaglandins, and CRP; and worse health-related quality of life compared to participants with normal weight), data from the two overweight or obese groups exposed to the weight stigma induction will be combined into one group. Next, a series of ANOVAs will be used to compare the overweight/obese group and normal weight group on baseline variables (prostaglandins, CRP, MPQ total score, VAS-Pain and VAS-Distress scores, IWQOL total score, SF-36 component scores and bodily pain subscale, and PANAS subscales). Three ANCOVAs will be used to compare the same groups on baseline WBIS total score, baseline SIS total score, and baseline mean SSI score. Having a relationship with someone with overweight or obesity will be controlled for in these two analyses given its potential impact on these weight stigma-related outcomes. Implications Results of this study will further explicate possible shared pathways by which physical and social pain are processed. Past research has documented change in prostaglandins in relation to inflammation, and the effect of analgesics on both. However, this study will contribute to understanding how prostaglandins such as PGE! change in response to the social pain of weight stigma. Additionally, results will contribute to knowledge on stigma, obesity, and pharmacological intervention by determining the degree to which acetaminophen may blunt the acute, negative effects of weight stigma among individuals with overweight or obesity. If an"
43,page_43,"44 effect is detected, results also will illustrate how prostaglandins change in response to acetaminophen in such a situation. If the evidence suggests that those with overweight or obesity administered acetaminophen have the same inflammatory, physical, and psychological responses to a weight stigma induction as individuals with normal weight, then this may provide rationale for further investigation into the mechanisms by which pharmacological interventions affect social pain, including weight stigma. An additional, potential implication of the current study is further understanding weight stigma as a mediator in the relationship between BMI and pain. Specifically, should perceived weight stigma mediate the relationship between BMI and bodily pain (hypothesis 1d), the model described by Olson and colleagues (2018) will be corroborated. Although the model was only evident in the subsample of overweight participants, the proposed study is more adequately powered to test the model with a larger sample. Thus, this study may provide further evidence of internalized weight stigma mediating the BMI-bodily pain relationship (hypothesis 1d), as well as test the model in the context of experimental changes in pain (hypothesis 1e). Should this model be supported, further investigation will be needed of the relationship between weight stigma and bodily pain among individuals with overweight or obesity. It also would provide further rationale to investigate effects of interventions aimed at reducing weight stigma among individuals with overweight or obesity and bodily pain. In addition to interventions that directly target weight stigma, interventions may provide benefit by modulating the relationship between weight stigma and bodily pain. If drug condition (i.e., acetaminophen or placebo) moderates the influence of internalized weight stigma on bodily pain (hypothesis 1fi), results will enhance understanding of the mechanisms by which obesity is associated with bodily pain, and possibly contribute to future research into the mechanisms of these relationships."
44,page_44,"45 References Adam, T. C., & Epel, E. S. (2007). Stress, eating and the reward system. Physiology & Behavior, 91(4), 449-458. Athey, A., & Overholser, J. (2016). Learning from physical pain to help with the management of emotional pain. Journal of Contemporary Psychotherapy, 46(3), 119-127. Barcellos de Souza, J., Grossman, E., Perissinotti, D. M. N., Oswaldo de Oliviera, J. Jr., Barreiros da Fonseca, P. R., & de Paula Posso, I. (2017). Prevalence of Chronic Pain, Treatments, Perception, and Interference on Life Activities: Brazilian Population-Based Survey. Pain Research and Management. Article ID: 4643830. Benedetti, F., Durando, J., & Vighetti, S. (2014). Nocebo and placebo modulation of hypobaric hypoxia headache involves the cyclooxegenase-prostaglandins pathway. Pain, 155, 921-928. Bigal, M. E., & Lipton, R. B. (2006). Modifiable risk factors for migraine progression. Headache, 46, 1334-1343. Bigal, M. E., & Rapaport, A. M. (2012). Obesity and chronic daily headache. Current Pain and Headache Reports, 16, 101-109. Bjelland, I., Dahl, A. A., Haug, T. T., & Nickelmann, D. (2002). The validity of the Hospital Anxiety and Depression Scale: An updated literature review. Journal of Psychosomatic Research, 52(2), 69-77. Bookwala, J., & Boyar, J. (2008). Gender, excessive body weight, and psychological well-being in adulthood. Psychology of Women Quarterly, 32, 188-195. Boswell, R. G., & White, M. A. (2015). Gender differences in weight bias internalization and eating pathology in overweight individuals. Advances in Eating Disorders, 3(3), 259-268. Briggs, M. S., Givens, D. L., Schmitt, L. C., & Taylor, C. A. (2013). Relations of C-reactive protein and obesity to the prevalence and the odds of reporting low back pain. Archives of Physical Medicine and Rehabilitation, 94, 745-752. Buckley, K. E., Winkel, R. E., & Leary, M. R. (2004). Reactions to acceptance and rejection: Effects of level and sequence of relational evaluation. Journal of Experimental Social Psychology, 40, 14–28"
45,page_45,"46 Buysse, D. J., Reynolds, C. F., Monk, T. H., Berman, S. R., Kupfer, D. (1989). Pittsburgh Sleep Quality Index: A new instrument for psychiatric practice and research. Psychiatry Research, 28, 193-213. Cabrera, J., Emir, B., Dills, D., Murphy, T. K., Whalen, E., & Clair, A. (2012). Characterizing and understanding body weight patterns in patients treated with pregabalin. Current Medical Research and Opinion, 28, 1027-1037. Callegari, A., Michelini, I., Sguazzin, C., Catona, A., & Klersy, C. (2005). Efficacy of the SF-36 questionnaire in identifying obese patients with psychological discomfort. Obesity Surgery, 15, 254-260. Carels, R. A., Young, K. M., Wott, C. B., Harper, J., Gumble, A., Oehlof, M. W., & Clayton, A. M. (2009). Weight bias and weight loss treatment outcomes in treatment-seeking adults. Annals of Behavioral Medicine, 37(3), 350-355. Chai, N. C., Scher, A. I., Moghekar, A., Bond, D. S., & Peterlin, B. L. (2014). Obesity and headache: Part I – A systematic review of the epidemiology of obesity and headache. Headache, 54(2), 219-234. Cimonlin, V., Vismara, L., Galli, M., Zaina, F., Negrini, S., & Capodaglio, P. (2011). Effects of obesity and chronic low back pain on gait. Journal of NeuroEngineering and Rehabilitation, 8, 55. Considine, R. V. (2005). Human leptin: An adipocyte hormone with weight-regulatory and endocrine functions. Seminars in Vascular Medicine, 5(1), 15-24. Cotter, E. W., & Kelly, N. R., (2017). Binge Eating Scale (BES). In Encyclopedia of Feeding and Eating Disorders (pp. 52-55). Singapore, Singapore: Springer Verlag. Craig, C. L., Marshall, A. L., Sjöström, M., Bauman, A. E., Booth, M. L., Ainsworth B. E., … & Oja, P. (2003). International physical activity questionnaire: 12-country reliability and validity. Medicine & Science in Sports & Exercise, 35(8), 1381-1395. Curtis-Prior, P. B. (1975). Prostaglandins and obesity. Lancet, 1(7912), 897-899. Dahlhamer, J., Lucas, J., Zelaya, C., Nahin, R., Mackey, S., DeBar, L., … & Helmick, C. (2018). Prevalence of chronic pain and high-impact chronic pain among adults – United States, 2016. Morbidity and Mortality Weekly Report, 67(36), 1001-1006."
46,page_46,"47 DeWall, C. N., MacDonald, G., Webster, G. D., Masten, C. L., Baumeister, R. F., Powell, C., … & Eisenberger, N. I. (2010). Acetaminophen reduces social pain: Behavioral and neural evidence. Psychological Science, 21(7), 931-937. Ding, C., Cicuttini, F., Scott, F., Cooley, H., & Jones, G. (2005). Knee structural alteration and BMI: A cross-sectional study. Obesity Research, 13(2), 350-361. Durso, L. E., & Latner, J. D. (2008). Understanding self-directed stigma: Development of the Weight Bias Internalization Scale. Obesity, 16(52), S80-S86. Durso, L. E., Latner, J. D., & Ciao, A. C. (2016). Weight bias internalization in treatment-seeking overweight adults: Psychometric validation and associations with self-esteem, body image, and mood symptoms. Eating Behaviors, 21, 104-108. Durso, G. R. O., Luttrell, A., & Way, B. M. (2015). Over-the-counter relief from pain and pleasures alike: Acetaminophen blunts evaluation sensitivity to both negative and positive stimuli. Psychological Science, 26(6), 750-758. Eisenberger, N. L., & Lieberman, M. D. (2004). Why rejection hurts: A common neural alarm system for physical and social pain. Trends in Cognitive Sciences, 8(7), 294-300. Eisenberger, N. L., Lieberman, M. D., & Williams, K. D. (2003). Does rejection hurt? An fMRI study of social exclusion. Science, 302(5643), 290-292. Emery, C. F., Olson, K. L., Lee, V. S., Habash, D. L., Nasar, J. L., & Bodine, A. (2015). Home environment and psychosocial predictors of obesity status among community-residing men and women. International Journal of Obesity, 39, 1401-1407. Fabris de Souza, S. A., Faintuch, J., Valezi, A. C., Sant’Anna, A. F., Gama-Rodrigues, J. J., de Batista Fonseca, I. C., & de Melo, R. D. (2005). Postural changes in morbidly obese patients. Obesity Surgery, 15(7), 1013-1016. Ferguson, S., Al-Rehany, L., Tang, C., Gougeon, L., Warwick, K., & Madill, J. (2013). Self-reported causes of weight gain: Among prebariatric surgery patients. Canadian Journal of Dietetic Practice and Research, 74(4), 189-192. Fife, B. L., & Wright, E. R. (2000). The dimensionality of stigma: A comparison of its impact on the self of persons with HIV/AIDS and cancer. Journal of Health and Social Behavior, 41, 50-67."
47,page_47,"48 Finkelstein, E. A., Trogdon, J. G., Cohen, W. C., & Dietz, W. (2009). Annual medical spending attributable to obesity: payer-and-service-specific estimates. Health Affairs, 28(5), W822-W831. Finnerup, N. B., Sindrup, S. H. & Jensen, T. S. (2010). The evidence for pharmacological treatment of neuropathic pain. Pain, 150, 573–581. Garrow, J. (1981). Obesity and Related Diseases. London: Churchill Livingstone. Goffman, E. (1963). Stigma. Notes on the management of spoiled identity. New York: Simon and Shuster. Gormally, J., Black, S., Daston, S., & Rardin, D. (1982). The assessment of binge eating severity among obese persons. Addictive Behaviors, 7(1), 47-55. Haukka, E., Ojajarvi, A., Takala, E. P., Viikari-Juntura, E., & Leino-Arjas, P. (2012). Physical workload, leisure-time physical activity, obesity and smoking as predictors of multisite musculoskeletal pain. A 2-year prospective study of kitchen workers. Occupational & Environmental Medicine, 69(7), 485-492. Hawker, G. A., Mian, S., Kendzerska, T., & French, M. (2011). Measures of adult pain: Visual Analog Scale for Pain (VAS Pain), Numeric Rating Scale for Pain (NRS pain), McGill Pain Questionnaire (MPQ), Short-Form McGill Pain Questionnaire (SF-MPQ), Chronic Pain Grade Scale (CPGS), Short Form-36 Bodily Pain Scale (SF-36 BPS), and Measure of Intermittent and Constant Osteoarthritis Pain (ICOAP). Arthritis Care & Research, 63(S11), S240-S252. Hayes, A. F. (2013). Introduction to Mediation, Moderation, and Conditional Process Analysis: A Regression-Based Approach. New York, NY: The Guilford Press. Heuch, I., Heuch, I., Hagen, K., & Zwart, J. A. (2013). Body mass index as a risk factor for developing chronic low back pain: A follow-up in the Nord-Trondelag Health Study. Spine, 38(2), 133-139. Hitt, H. C., McMillen, R. C., Thornton-Neaves, T., Koch, K., & Cosby, A. G. (2007). Comorbidity of obesity and pain in a general population: Results from the Southern Pain Prevalence Study. Journal of Pain, 8(5), 430-436. Hylands-White, N., Duarte, R. V., & Raphael, J. H. (2017). An overview of treatment approaches for chronic pain management. Rheumatology International, 37, 29-42."
48,page_48,"49 Jackson, T., Wang, Y., Wang, Y., & Fan, H. (2014). Self-efficacy and chronic pain outcomes: A meta-analytic review. Journal of Pain, 15(8), 800-814. Katz, J., & Melzack, R. (2011). The McGill Pain Questionnaire: Development, psychometric properties, and usefulness of the long form, short form, and short form-2. In: Turk, D. C., Melzack, R. (Eds.) Handbook of Pain Assessment, 3rd Edition, 45-66. New York, NY: Guilford Press. Kaufman, D. W., Kelly, J. P., Rosenberg, L., Anderson, T. E., & Mitchell, A. A. (2002). Recent patterns of medication use in the ambulatory adult population of the United States: The Slone Survey. Journal of the American Medical Association, 287(3), 337-344. Kawabata, A. (2011). Prostaglandin e2 and pain – An update. Biological and Pharmaceutical Bulletin, 34(8), 1170-1173. Kolotkin, R. L., & Crosby, R. D. (2002). Psychometric evaluation of the impact of weight on quality of life questionnaire (IWQOL-lite) in a community sample. Quality of Life Research, 11(2), 157-171. Kolotkin, R. L., Crosby, R. D., Kosloski, K. D., & Williams, G. R. (2001). Development of a brief measure to assess quality of life in obesity. Obesity Research, 9(2), 102- 111. Lamm, C., Decety, J., & Singer, T. (2011). Meta-analytic evidence for common and distinct neural networks associated with directly experienced pain and empathy for pain. Neuroimage, 54(3), 2492-2502. Latner, J. D., Barile, J. P., Durso, L. E., & O’Brien, K. S. (2014). Weight and health-related quality of life: The moderating role of weight discrimination and internalized weight bias. Eating Behaviors, 15(4), 586-590. Lee, M. S., & Dedrick, R. F. (2016). Weigh bias internalization scale: Psychometric properties using alternative weight status classification approaches. Body Image, 17, 25-29. Lee, M. S., Gonzalez, B. D., Small, B. J., & Thompson, J. K. (2019). Internalized weight bias and psychological wellbeing: An exploratory investigation of a preliminary model. PLOS One, 14(5). e0216324. Linton, S. J., Nicholas, M. K., MacDonald, S., Boersma, K., Bergbom, S., Maher, C., & Refshauge, K. (2011). The role of depression and catastrophizing in musculoskeletal pain. European Journal of Pain, 15(4), 416-422."
49,page_49,"50 Linton, S. J., & Shaw, W. S. (2011). Impact of psychological factors in the experience of pain. Physical Therapy, 91(5), 700-711. Major, B., Eliezer, D., & Rieck, H. (2012). The psychological weight of weight stigma. Social Psychological and Personality Science, 3, 651-658. Masheb, R. M., Lutes, L. D., Kim, H. M., Holleman, R. G., Goodrich, D. E., Janney, C. A., … & Damschroder, L. J. (2015). Weight loss outcomes in patients with pain. Obesity, 23(9), 1778-1784. McVinnie, D. S. (2013). Obesity and pain. British Journal of Pain, 7(4), 163-170. Mee, S., Bunney, B. G., Bunney, W. E., Hetrick, W., Potkin, S. G., & Reist, C. (2011). Assessment of psychological pain in major depressive episodes. Journal of Psychiatric Research, 45(11), 1504-1510. Meerwijk, E., & Weiss, S. (2011). Toward a unifying definition of psychological pain. Journal of Loss and Trauma, 16(5), 402-412. Melzack, R. (1975). The McGill Pain Questionnaire: Major properties and scoring methods. Pain, 1, 277-299. Merskey, H., & Bogduk, N. (1994). Classification of chronic pain: Descriptions of chronic pain syndromes and definitions of pain terms. Pain. Seattle: IASP Press. Messier, S. P., Loeser, R. F., Miller, G. D., Morgan, T. F., Rejeski, W. J., Sevick, M. A., … & Williamson, J. D. (2004). Exercise and dietary weight loss in overweight and obese older adults with knee osteoarthritis: The Arthritis, Diet, and Activity Promotion Trial. Arthritis and Rheumatism, 50(5), 1501-1510. Mischkowski, D., Crocker, J., & Way, B. M. (2016). From painkiller to empathy killer: Acetaminophen (paracetamol) reduces empathy for pain. Social and Cognitive Affective Neuroscience, 11(9), 1345-1353. Mork, P. J., Holtermann, A., & Nilsen, T. I. (2013). Physical exercise, body mass index and risk of chronic arm pain: Longitudinal data on an adult population in Norway. European Journal of Pain, 17(8), 1252-1258. Myers, A., & Rosen, J. C. (1999). Obesity stigmatization and coping: Relation to mental health symptoms, body image, and self-esteem. International Journal of Obesity, 23, 221-230. Nahin, R. L. (2015) Estimates of pain prevalence and severity in adults: United States, 2012. Journal of Pain, 16(8), 769-780."
50,page_50,"51 Narouze, S., & Souzdalnitski, D. (2015). Obesity and chronic pain. Systematic review of prevalence and implications for pain practice. Regional Anesthesia and Pain Medicine, 40(2), 91-111. Novack, V., Fuchs, L., Lantsberg, L., Kama, S., Lahoud, U., Horev, A., … & Ifergane, G. (2011). Changes in headache frequency in premenopausal obese women with migraine after bariatric surgery: A case series. Cephalalgia, 31(13), 1336-1342. O’Connor, M. F., Wellisch, D. K., Stanton, A. L., Eisenberger, N. I., Irwin, M. R., & Lieberman, M. D. (2008). Craving love? Enduring grief activates brain’s reward center. NeuroImage, 42, 969– 972. Ogden, C. L., Carroll, M. D., Kit, B. K., & Flegal, K. M. (2014). Prevalence of childhood and adult obesity in the United States, 2011-2012. Journal of the American Medical Association, 311(8), 806-814. Okifuji, A., Bradshaw, D. H., & Olson, C., (2009). Evaluating obesity in fibromyalgia: Neuroendocrine biomarkers, symptoms, and functions. Clinical Rheumotology, 28(4), 475-478. Okifuji, A., Donaldson, G. W., Barck, L., & Fine, P. G., (2010). Relationship between fibromyalgia and obesity in pain, function, mood, and sleep. Journal of Pain, 11(12), 1329-1337. Okifuji, A., & Hare, B. D. (2015). The association between chronic pain and obesity. Journal of Pain Research, 8, 399-408. Olson, K. L., Landers, J. D., Thaxton, T. T., & Emery, C. F. (2018). The pain of weight-related stigma among women with overweight or obesity. Stigma and Health, advance online publication. Pearl, R. L., Hopkins, C. H., Berkowitz, R. I., & Wadden, T. A. (2016). Group cognitive behavioral treatment for internalized weight stigma: a pilot study. Eating and Weight Disorders, 23(3), 357-362. Pearl, R. L., & Puhl, R. M. (2016). The distinct effects of internalizing weight bias: An experimental study. Body Image, 17, 38-42. Pearl, R. L., Wadden, T. A., Chao, A. M., Walsh, O., Alamuddin, N., Berkowitz, R. I., & Tronieri, J. S. (2018). Weight bias internalization and long-term weight loss in patients"
51,page_51,"52 with obesity. Annals of Behavioral Medicine, epub ahead of print. doi: 10.1093/abm/kay084. Penninx, B. W., Abbas, H., Ambrosius, W., Nicklas, B. J., Davis, C., Messier, S. P., & Pahor, M. (2004). Inflammatory markers and physical function among older adults with knee osteoarthritis. Journal of Rheumatology, 31(10), 2027-2031. Planton, J., & Edlund, B. J. (2010). Regulatory components for treating persistent pain in long-term care. Journal of Gerontological Nursing, 36, 49–56. Puhl, R. M., Himmelstein, M. S., & Quinn, D. M. (2018). Internalizing Weight Stigma: Prevalence and Sociodemographic Considerations in US Adults. Obesity, 26(1), 167-175. Puhl, R. M., & Heuer, C. A. (2009). The stigma of obesity: A review and update. Obesity, 17(5), 941-964. Randles, R. J., Heine, S. J., & Santos, N. (2013). The common pain of surrealism and death: Acetaminophen reduces compensatory affirmation following meaning threats. Psychological Science, 24, 966-973. Ricciotti, E., & FitzGerald, G. A. (2011). Prostaglandins and inflammation. Arteriosclerosis, Thrombosis, and Vascular Biology, 31(5), 986-1000. Roberts, I. D., Krajbich, I., Cheavens, J. S., Campo, J. V., & Way, B. M. (2017). Acetaminophen reduces distrust in individuals with borderline personality disorder features. Clinical Psychological Science, 6(1), 145-154. Ronti, T., Lupattelli, G., & Mannarino, E. (2006). The endocrine function of adipose tissue: An update. Clinical Endocrinology, 64(4), 355-365. Rosenberg, M. (1965). Society and the adolescent self-image. Princeton, Princeton University Press, 1965. Ryff, C. D. (1989). Happiness is everything, or is it? Explorations on the meaning of psychological well-being. Journal of Personality and Social Psychology, 57, 1069-1081. Schvey, N. A., Puhl, R. M., & Brownell, K. D. (2011). The impact of weight stigma on caloric consumption. Obesity, 19(10), 1957-1962. Schvey, N. A., Puhl, R. M., & Brownell, K. D. (2014). The stress of stigma. Exploring the effect of weight stigma on cortisol reactivity. Psychosomatic Medicine, 76(2), 156-162."
