,PageNo,Text41,page_41,"Version date: 27 January 2019 Protocol CHR#15 -17825 Phase I – Study drug(s) Page 41 of 61 Clinical supervision specifically related to psilocybin, and SEGT, will happen in the form of debriefing sessions after every study visit. Dr. Anderson will be an in- the-room observer of the group therapy sessions to take notes and later discuss with the group therapists their adherence to the SEGT method and its current adaptation to the psilocybin trial. Dr. Anderson and Dr. Danforth will review video of treatment sessions and discuss the technique observed with the individual session guides on an as needed basis . Video segments of group therapy sessions and psilocybin treatment sessions will be us ed for discussion in a periodic supervision workshop to be held after the completion of each group therapy cohort and which all study clinicians will be highly encouraged to attend. The number of supervision sessions a study clinician is required to attend to maintain eligibility to work on the study will be up to the discretion of the clinical supervisors."
42,page_42,"Version date: 27 January 2019 Protocol CHR#15 -17825 Phase I – Study drug(s) Page 42 of 61 7 Reporting and Documentation of Results 7.1 Evaluation of Safety and Feasibility The assessment of safety and feasibility will be informed by surveillance of adverse events in all patients who enroll in the study. The study will use the NIH Division of AIDS Table of Grading of Severity of Adult and Pediatric Adverse Events V2.0 for reporting of adverse events. Analyses of feasibility and acceptability will also be informed by rates of patient recruitment and retention, therapist protocol adherence, self -report measures (CrEQ and CSS), and spontaneous feedback from subjects, caregivers/i mportant others, and study therapists. 7.2 Evaluation of Efficacy We will evaluate for trends in changes of group mean measures of demoralization, complicated grief, depression, anxiety, and other constructs mentioned above. These evaluations will consist of self-report measures (e.g., DS -II) and observations from caregivers/important others and clinical raters (e.g., CORF and CGI). 7.3 Definitions of Adverse Events 7.3.1 Adverse Event An adverse event (also known as an adverse experience) is defined as any untoward medical occurrence associated with the use of a drug in humans, whether or not considered drug related. More specifically, an adverse event (can be any unfavorable and unintended sign (e.g., an abnormal laboratory finding), symptom, or disease tem porally associated with the use of a drug, without any judgment about causality. An adverse event can arise from any use of the drug (e.g., off -label use, use in combination with another drug) and from any route of administration, formulation, or dose, inc luding an overdose. 7.3.2 Adverse reaction An adverse reaction is defined as any adverse event caused by the use of a drug. Adverse reactions are a subset of all suspected adverse reactions for which there is reason to conclude that the drug caused the event. 7.3.2.1 Suspected A suspected adverse reaction is defined as any adverse event for which there is a reasonable possibility that the drug caused the adverse event. For the purposes of IND safety reporting, “reasonable possibility” indicates that there is evidence to suggest a causal relationship between the drug and the adverse event. A suspected adverse reaction implies a lesser degree of certainty about causality than an adverse reaction. 7.3.2.2 Unexpected An adverse event or suspected adverse reaction is considered unexpected if it is not listed in the investigator brochure or package insert(s), or is not listed at the specificity or severity that has been observed, or, if an investigator brochure is not required or available, is not consistent with the risk information described in the general investigational plan or elsewhere in the current application. “Unexpected,” as used in this definition, also refers to adverse events or suspected adverse reactions that are mentioned in the investigator brochure as occu rring with a class of drugs o r"
43,page_43,"Version date: 27 January 2019 Protocol CHR#15 -17825 Phase I – Study drug(s) Page 43 of 61 as anticipated from the pharmacological properties of the drug, but are not specifically mentioned as occurring with the particular drug under investigation. Adverse events that would be anticipated to occur as part of the disease process are considered unexpected for the purposes of reporting because they would not be listed in the investigator brochure. 7.3.2.3 Serious An adverse event or suspected adverse reaction i s considered serious if, in the view of either the investigator or sponsor, it results in any of the following outcomes: • Death • Life-threatening adverse event • Inpatient hospitalization or prolongation of existing hospitalization • A persistent or significant incapacity or substantial disruption of the ability to conduct normal life function • Congenital anomaly/birth defect Important medical events that may not result in death, are life -threatening, or require hospitalization may be considered serious when, based upon appropriate medical judgment, they may jeopardize the patient or subject and may require medical or surgical intervention to prevent one of the outcomes listed in this definition. Examples of such medical events include allergic bronchos pasm requiring intensive treatment in an emergency room or at home, blood dyscrasias or convulsions that do not result in inpatient hospitalization, or the development of drug dependency or drug abuse. 7.3.2.4 Life-threatening An adverse event or suspected adverse reaction is considered life-threatening if, in the view of either the investigator or sponsor, its occurrence places the patient or subject at immediate risk of death. It does not include an adverse event or suspected adverse reaction that, had it occurred in a more severe form, might have caused death. 7.4 Recording of an Adverse Event All adverse events will be entered into UCSF REDCap, whether or not the event is believed to be associated with use of the study drug. Data about these events and their severity will be recorded using the NIH Division of AIDS Table of Grading of Severity of Adult and Pediatric Adverse Events V2.0. The Investigator will assign attribution of the possible association of the event with use of the investigational drug, and this information will be entered into UCSF REDCap using the classification system listed below:"
44,page_44,"Phase I – Study drug(s) Page 44 of 61 Version date: 27 January 2019 Protocol CHR#15 -17825 Relationship Attribution Description Unrelated to investigational drug/intervention Unrelated The AE is clearly NOT related to the intervention Unlikely The AE is doubtfully related to the intervention Possible The AE may be related to the intervention Related to investigational drug/intervention Probable The AE is likely related to the intervention The AE is clearly related to the intervention Definite Signs or symptoms reported as adverse events will be graded and recorded by the Investigator. When specific adverse events are not listed in the above NIH DAIDS Table of Grading of Severity, they will be graded by the Investigator as none, mild, moderate or severe according to the following grades and definitions: Grade 0 No AE (or within normal limits) Grade 1 Mild: Mild symptoms causing no or minimal interference with usual social & functional activities with intervention not indicated Grade 2 Moderate: Moderate symptoms causing greater than minimal interference with usual social & functional activities with intervention indicated Grade 3 Severe: Severe symptoms causing inability to perform usual social & functional activities with intervention or hospitalization indicated Grade 4 Potentially life -threatening: Potentially life- threatening symptoms causing inability to perform basic self -care functions with intervention indicated to prevent permanent impairment, persistent disability, or death Grade 5 Death related to AE 7.5 Follow -up of Adverse Events All adverse events will be followed with appropriate medical management until resolved. Patients removed from study for unacceptable adverse events will be followed until resolution or stabilization of the adverse event. 7.6 Adverse Events Monitoring All adverse events, whether or not unexpected, and whether or not considered to be associated with the use of the study drug, will be entered into UCSF REDCap, as noted above. The Investigator will assess all adverse events and determine reportability requirements to the Data and Safety Monitor (DSM) and UCSF’s Institutional Review Board, the Committee on Human Research (CHR); and, when the study is conducted under an Investigational New Drug Application (IND), to the Food and Drug Administration (FDA) if i t meets the FDA reporting criteria. In addition, all adverse events and suspected adverse reactions considered “serious,” entered into UCSF REDCap will be reviewed and monitored by the Data and Safety Monitor on an"
45,page_45,"Phase I – Study drug(s) Version date: 27 January 2019 Page 45 of 61 Protocol CHR#15 -17825 ongoing basis, discussed at DSM meetings which take place after each therapy group completes the 8 -week intervention. 7.7 Expedited Reporting Reporting to the Data and Safety Monitor If a death occurs during the treatment phase of the study or within 30 days after the last administration of the study drug(s) and it is determined to be related either to the study drug(s) or to a study procedure, the Investigator or his/her designee must notify the DSM within 1 business day o f knowledge of the event. The contact may be by phone or e- mail. Reporting to UCSF Committee on Human Research (Institutional Review Board) The Principal Investigator must report events meeting the UCSF CHR definition of “Unanticipated Problem” (UP) within 10 business days of his/her awareness of the event. Expedited Reporting to the Food and Drug Administration If the study is being conducted under an IND, the Sponsor -Investigator is responsible for determining whether or not the suspected adverse reaction meets the criteria for expedited reporting in accordance with Federal Regulations (21 CFR §312.32). The Investigator must report in an IND safety report any suspected adverse reaction that is both serious and unexpected. The Sponsor -Investigator needs to ensure that the event meets all three definitions: • Suspected adverse reaction (as defined in 7.3.2.1) • Unexpected (as defined in 7.3.2.2) • Serious (as defined in 7.2.3.3) If the adverse event does not meet all three of the definitions, it should not be submitted as an expedited IND safety report. The timeline for submitting an IND safety report to FDA is no later than 15 calendar days after the Investigator determines that the suspected adverse reaction qualifies for reporting (21 CFR 312.32(c)(1)). Any unexpected fatal or life -threatening suspected adverse reaction will be reported to FDA no later than 7 calendar days after the Investigator’s initial receipt of the information (21 CFR 312.32(c)(2)). Any relevant addit ional information that pertains to a previously submitted IND safety report will be submitted to FDA as a Follow -up IND Safety Report without delay, as soon as the information is available (21 CFR 312.32(d)(2)). Reporting to Pharmaceutical Companies providing Study Drug Serious adverse reactions will be reported to the Heffter Research Institute and the Usona Institute, which are consultants for this study."
46,page_46,"Phase I – Study drug(s) Version date: 27 January 2019 Page 46 of 61 Protocol CHR#15 -17825 8 Statistical Considerations and Evaluation of Results 8.1 Study Design This open -label single -arm mixed- methods pilot study will use descriptive statistics and qualitative methods to evaluate safety and feasibility in terms of rates of adverse events, patient recruitment and retention, and feedback on the intervention’s utility, content and duration. Given the small sample size of this study, small -to-medium effect sizes will likely be undetectable; and so descriptive statistics will be used to report changes in mean measur es at baseline compared to the endpoint, and again at the 3- month follow -up. Exploratory ANOVAs will also be done to model changes in therapeutic process values (e.g., group cohesion) over time. Qualitative thematic analysis will also be used to evaluate v erbal and written reports of patient and caregiver/important other experiences with the study in order to optimize implementation of the intervention in larger, future trials. 8.1.1 Randomization No randomization procedures will be used. 8.1.2 Stratification Factors No stratification procedures will be used. 8.2 Determination of Sample Size and Accrual Rate 8.2.1 Sample Size and Power Estimate This pilot study of the safety and feasibility of psilocybin- assisted group therapy aims to enroll at least 18 subjects, and will have a maximum total sample size of 36. We estimate needing to enroll 18 subjects given attrition rates of up to 45% reported in trials of other group therapies for existential distress in palliative care patients [118] . For comparison, four different safety and feasibility pilot studies of psilocybin -assisted psychotherapy have been conducted over the last two decades, and have included 9, 10, 12 and 15 patients each [18, 111, 112, 114] . Four recently published feasibility pilot studies of meaning- focused group psychotherapies for palliative care patients have included 5, 11, 11, and 16 patients each [40, 185- 187]. Group therapy studies should include at least 2 groups of at least 4 -6 members [138] , so we plan to have at least 8 subjects complete the intervention. We expect to be able to enroll at least 6 subjects every 6 months. Because the proposed study is a pilot focused on investigating safety and feasibility, power calculations for efficacy measures are not indicated. Pilot studies are often used to estimate values that are then utilized in power calculations for full -scale trials. Indeed, we will estimate effect size (ES) and the intraclass correlation coefficient (ICC) [135] for the intervention based on our preliminary efficacy results. Group psychotherapy trials generally require large sample sizes to demonstrate statistical significance in change in efficacy measures given the likely interdependence of clinical outcomes when interventions are delivered in groups [135, 136] . Thus, future full -scale trials can utilize our estimates to derive adequate, and likely large, sample sizes."
47,page_47,"Phase I – Study drug(s) Version date: 27 January 2019 Page 47 of 61 Protocol CHR#15 -17825 8.2.2 Replacement Policy Study subjects who have been assigned to a group and drop out prior to the first group session can be replaced by a new subject who will be assigned to the same group. Subjects who drop out after the first group therapy session will not be replaced. 8.2.3 Accrual estimates The annual number of eligible patients is high given the size of the population of HIV - seropositive people in the San Francisco Bay Area. In 2014, San Francisco reported 15,979 people living with HIV, of whom 9,202 were at least 50 years old [8]. If accrual falls short o f expectations, advertising and recruitment efforts will be expanded. 8.3 Interim Analyses and Stopping Rules After the occurrence of one Adverse Event judged to be Severe and potentially related to the drug/intervention, enrollment will be stopped until a Safety Review has been completed and the appropriate protocol amendments implemented. 8.4 Analyses Plans The study’s biostatistician is Matthew Boden, Ph.D. Alongside the PI, Dr. Boden will be co- responsible for assuring that clinical data are correctly coll ected, stored and analyzed. He will work directly with the PI to assure that interpretations of these data are coherent and justified. Dr. Boden’s professional interests are rooted in the research, evaluation and implementation of evidence- based treatments for complex and severe mental disorders. As a Health Science Specialist at the Center for Innovation to Implementation (Ci2i), Veterans Affairs (VA) Palo Alto Health Care System, Dr. Boden investigates the clinical effects and implementation of evidence- based psychosocial treatments for psychotic, anxiety, and substance use disorders. His research utilizes a variety of assessment (e.g., structured clinical interviews, biological assays) and statistical (e.g., linear mixed models, exploratory structural eq uation modeling) techniques. As a Senior Evaluator at the Program Evaluation and Resource Center (PERC), VA Office of Mental Health Operations (OMHO), Dr. Boden supports OMHO’s nationwide program evaluation and quality improvement efforts. 8.4.1 Analysis Popul ation All patients who enroll in the study will be included in analyses of safety and tolerability. All patients who make any contact at all with the study (including those who are screened out over the phone) will be included in analyses of feasibility. All patients who enroll in the trial will be included in analyses of efficacy. Repeated efficacy measures will be gathered and trended, regardless of missing data or protocol non- adherence. All patients who participate in at least one group therapy sessi on will be included in analyses of psychotherapeutic process. 8.5 Primary Analysis Safety analyses will be performed for all patients who enroll in the study. The study will use the NIH Division of AIDS Table of Grading of Severity of Adult and Pediatric Adverse Events V2.0 to"
48,page_48,"Phase I – Study drug(s) Version date: 27 January 2019 Page 48 of 61 Protocol CHR#15 -17825 classify adverse events. Descriptive statistics (percentages) will be reported for the incidence of any Adverse Events reported, including suicidality as measured by the C -SSRS. Median scores will also be calculated for total scores of the feasibility measures: CSS, CrEQ, and PEQ -S. The differences of mean pre - and post -treatment scores on the CORF will be calculated. Differences in individual pre- and post -treatment MoCA scores will be assessed for each indiv idual. Therapist protocol adherence will be reported as a rate of discussion topic deviations from the protocol. 8.5.1 Exploratory Analyses Change in efficacy measures from pre- treatment to post -treatment to 3 -month follow -up will be analyzed with descriptive st atistics to represent trends in mean levels. Recognizing that the calculations will likely be underpowered, we will also perform ANOVAs of the secondary outcome measures. To assist in gauging the clinical relevance of these data relative to measurement err or, and to overcome some of the limitations of the study’s small sample size, Reliable Change Indices (RCI) will be calculated [188] . Data from efficacy measures will also be used to estimate effect sizes and intraclass correlation coefficients for use in larger, future studies. Change in process measures (e.g., the HIM, QPIRS and GQ) over time will be analyzed with ANOVAs to assess the slopes of individual participants and of the whole sample. Qualitative thematic analyses will be c onducted according to the methods outlined in Section 6.3. Iterative inductive analyses will be performed with the aid of NVivo analytical software. 8.6 Study Results Study results will be reported following the guidelines of the TREND Statement for reporting of results from non- randomized interventions [189] . The study biostatistician will oversee or review the interpretation of all the above analyses and descriptive statistics."
49,page_49,"Phase I – Study drug(s) Version date: 27 January 2019 Page 49 of 61 Protocol CHR#15 -17825 9 Study Management 9.1 Pre-study Documentation This study will be conducted in accordance with the ethical principles that have their origin in the Declaration of Helsinki as stated in 21 CFR §312.120(c)(4); consistent with GCP and all applicable regulatory requirements. Before initiating this trial, the Investigator will have written and dated approval from the Institutional Review Board for the protocol, written informed consent form, subject recruitment materials, and any other written information to be provided to subjects before any protocol related procedures are performed on any subj ects. The clinical investigation will not begin until either FDA has determined that the study under the Investigational Drug Application (IND) is allowed to proceed or the Investigator has received a letter from FDA stating that the study is exempt from I ND requirements. The Investigator must comply with the applicable regulations in Title 21 of the Code of Federal Regulations (21 CFR §50, §54, and §312), GCP/ICH guidelines, and all applicable regulatory requirements. The IRB must comply with the regulations in 21 CFR §56 and applicable regulatory requirements. 9.2 Institutional Review Board Approval The protocol, the proposed informed consent form, and all forms of participant information related to the study (e.g. advertisements used to recruit participants) will be reviewed and approved by the UCSF CHR (UCSF Institutional Review Board). The initial protocol and all protocol amendments must be approved by the IRB prior to implementation. 9.3 Informed Consent All participants must be provided a consent form describing the study with sufficient information for each participant to make an informed decision regarding their participation. Participants must sign the CHR -approved informed consent form prior to participation in any study specific procedure. The part icipant must receive a copy of the signed and dated consent document. The original signed copy of the consent document must be retained in the medical record or research file. During enrollment, patients will be consented for participation in the study, including having the various aspects of their participation video- recorded. They will also sign a Release of Information for study staff to speak to the patients’ primary caregivers and primary physicians. Primary caregivers/important others will also be consented during enrollment. 9.4 Changes in the Protocol Once the protocol has been approved by the UCSF CHR, any changes to the protocol must be documented in the form of an amendment. The amendment must be signed by the Investigator and approved by the CHR prior to implementation. If it becomes necessary to alter the protocol to eliminate an immediate hazard to patients, an amendment may be implemented prior to CHR approval. In this circumstance, however, the Investigator must then notify the CHR in writing within five (5) working days after implementation. The Study Chair and the UCSF study team will be responsible for updating any participating sites."
