,PageNo,Text128,page_128,"Version 6.0 Date: 21-Sep-2021 Statistical Analysis Plan Protocol Number: GBR 830-204 Ichnos Sciences Confidential Page 23 of 68 Abbreviation Term or Definition NIH National Institutes of Health NRS Numeric Rating Scale PD Pharmacodynamic(s) PGA Patient Global Assessment PK Pharmacokinetic(s) PKAS Pharmacokinetics Analysis Set POEM Patient-Oriented Eczema Measure PPS Per-Protocol Set PT Preferred Term q2w Every two weeks q4w Every four weeks QCD Quantitative Clinical Development QoL Quality of Life QTc Corrected QT SAE Serious Adverse Event SAS Safety Analysis Set SAP Statistical Analysis Plan SBP Systolic Blood Pressure SC Subcutaneous(ly) SCORAD SCORing Atopic Dermatitis SD Standard Deviation SDTM Study Data Tabulation Model SNOT Sino-nasal Outcome Test SOC System Organ Class TCI Topical Calcineurin Inhibitor TCS Topical Corticosteroid TEAE Treatment-Emergent Adverse Event TLFs Tables, Listings and Figures TLR Topline Results TSR Technical Summary Report UN Unstructured VAS Visual Analogue Scale"
129,page_129,Version 6.0 Date: 21-Sep-2021 Statistical Analysis Plan Protocol Number: GBR 830-204 Ichnos Sciences Confidential Page 24 of 68 Abbreviation Term or Definition WHODD World Health Organization Drug Dictionary
130,page_130,"Version 6.0 Date: 21-Sep-2021 Statistical Analysis Plan Protocol Number: GBR 830-204 Ichnos Sciences Confidential Page 25 of 68 2. INTRODUCTION The purpose of this statistical analysis plan (SAP) is to provide details of the planned statistical methodology for the analysis of the study data. The SAP also outlines the statistical programming specifications for the tables, listings and figures. This SAP is based on study protocol GBR 830-204 Version 10.0, Amendment 9. It describes the study endpoints, derived variables, anticipated data transformations and manipulations, and other details of the analyses not provided in the study protocol. This SAP therefore outlines in detail all other aspects pertaining to the planned analyses and presentations for this study. Details of efficacy, safety and pharmacokinetic (PK) analyses will be specified in this SAP and included in the Clinical Study Report (CSR). Detailed statistical methods, including methods for the handling of missing data for analyzing the primary, secondary and exploratory endpoints will be described in this SAP. This SAP was developed in accordance with ICH E9 guideline. All decisions regarding final analysis, as defined in this SAP document, will be made prior to Database Lock (unblinding) of the study data. The reader of this SAP should also read the clinical protocol, and other relevant documents for details on the planned conduct of this study. Operational aspects including the protocol Schedule of Assessments (Table 2 and Table 3 in the protocol) related to collection and timing of planned clinical assessments are not repeated in this SAP unless relevant to the planned analyses. Population pharmacokinetic and exposure-response modeling will be described in a Modeling Plan and data will be published in a separate report. Biomarker analyses will not be part of the CSR and will be described separately. 3. STUDY OBJECTIVES AND PURPOSE 3.1. Study Objectives 3.1.1. Primary Objective  To cha racterize the efficacy of ISB 830 monotherapy in adults with moderate- to-severe atopic dermatitis (AD) compared to placebo as measured by percentage change from baseline in Eczema Area and Severity Index (EASI) score at Week 16. 3.1.2. Secondary Objectives  To eva luate safety, tolerability, PK and immunogenicity of ISB 830 in adults with moderate-to-severe AD.  To measure the effect of ISB 830 on disease activity in adult subjects with moderate-to-severe AD, as measured by validated tools (such as Investigator’s Global Assessment (IGA), EASI response, SCORing Atopic Dermatitis (SCORAD)). 3.1.3. Exploratory Objectives  To eva luate pharmacodynamics (PD) of ISB 830 in adults with moderate-to- severe AD."
131,page_131,"Version 6.0 Date: 21-Sep-2021 Statistical Analysis Plan Protocol Number: GBR 830-204 Ichnos Sciences Confidential Page 26 of 68 3.2. Study Endpoints 3.2.1. Primary Endpoint  Per cent change from baseline in EASI score at Week 16. 3.2.2. Secondary Endpoints Effi cacy endpoints are:  Proportion of subjects with EASI-75 (≥75% improvement from baseline) at Week 16 (key sec ondary endpoint).  Proportion of subjects with both IGA 0 or 1 (on a 5-point scale) plus an IGA reduction from baseline of ≥2 points at Week 16 (key secondary endpoint).  Proport ion of subjects with improvement (reduction) of Pruritus Numerical Rating Scale (NRS) ≥4 from baseline to Week 16.  Proport ion of subjects who achieve an EASI-50 (≥50% improvement from baseline) respon se from baseline through Week 16.  Change in SCORAD from baseline through Week 16.  Change in the Dermatology Life Quality Index (DLQI) from baseline through Week 16.  Change in Global Individual Signs Score (GISS) (erythema, infiltration/papulation, excoriations, lichenification) from baseline through Week 16.  Change in Hospital Anxiety Depression Scale (HADS) from baseline through Week 16.  Change in Patient Oriented Eczema Measure (POEM) from baseline through Week 16.  Absolute and percent change in Patient Global Assessment of Disease from baseline through Week 16.  Absolute and percent change in Patient Global Assessment of Treatment from baseline through Week 16.  Assessment of sick leave and/or missed school days through Week 16. Safety endpoints are:  Incidence of treatment-emergent adverse events (TEAEs) from baseline through Week 16 and Week 54.  Incidence of skin infection TEAEs requiring systemic treatment from baseline through Week 16 and Week 54.  Incidence of conjunctivitis TEAEs requiring systemic treatment from baseline through Week 16 and Week 54.  Incidence of treatment-emergent serious adverse events (SAEs) from baseline through Week 16 and Week 54.  Incidence of TEAEs leading to treatment discontinuation from baseline through Week 16 and Week 54."
132,page_132,"Version 6.0 Date: 21-Sep-2021 Statistical Analysis Plan Protocol Number: GBR 830-204 Ichnos Sciences Confidential Page 27 of 68  Overall number of TEAEs and SAEs through Week 16 and Week 54.  Vital signs, clinical laboratory values, and electrocardiogram (ECG) results monitored from baseline through Week 16 and Week 54.  Formation of anti-drug antibodies (ADA) to ISB 830 to evaluate immunogenicity. Pharmacokinetics endpoints are:  Cmax, tmax, AUC 0-tau, AUC 0-t, and other related parameters will be estimated using data from the rich PK group from the blinded treatment phase. Ctrough values will be estimated using data from both rich and sparse PK groups from the blinded treatment phase. 3.2.3. Exploratory Endpoints Explorat ory efficacy endpoints are:  Proportion of subjects with both IGA 0 or 1 (on a 5-point scale) and an IGA reduction from baseline of ≥2 points through Week 54.  Proport ion of subjects with EASI-75 (≥75% improvement from baseline) through Week 54.  Proportion of subjects who achieve an EASI-50 (≥50% improvement from baseline) thr ough Week 54.  Change in the European Quality of Life Status (EQ-5D) through Week 16.  Change in Juniper Asthma Control Questionnaire (ACQ-5) from baseline through Week 16.  Change in the Sino-nasal Outcome Test (SNOT-22) from baseline through Week 16.  To assess qualitative changes in photographs of skin lesions taken at time points specified in the Schedule of Assessment (Table 2 and Table 3 in the protocol). 4. OVERALL STUDY DESIGN 4.1. Summary of Study Design This is a multicenter, double-blind, placebo-controlled study. The study will be conducted in 4 phases: a screening phase, a blinded treatment phase, an open-label treatment phase, and a follow-up phase. Subjects will participate in a 54-week treatment period (including 52 weeks of study drug administration) with 12 weeks follow-up from the end-of-treatment (EOT) visit (Week 54 to Week 66). The study will be conducted in 2 Parts, with dosing Groups 1-4 comprising Part 1, and dosing Groups 5-6 comprising Part 2. The blinded treatment phase consists of a randomized, placebo-controlled treatment with ISB 830 for 16 weeks at different dose levels (see below). The open-label treatment phase consists of a 38-week treatment phase where ISB830 will be administered every other week (q2w) subcutaneously (SC). The primary endpoint of the study will be assessed at the end of the blinded treatment period at Week 16."
133,page_133,
134,page_134,
135,page_135,
136,page_136,"Version 6.0 Date: 21-Sep-2021 Statistical Analysis Plan Protocol Number: GBR 830-204 Ichnos Sciences Confidential Page 31 of 68 4.2. Definition of Study Drugs Table 4 in the protocol provides a description of the study drug (double-blind ISB 830 and placebo) to be used in the study. 4.3. Sample Size Considerations 4.3.1. Sample Size Justifications 4.3.2. Sample Size Re-estimation No sampl e size re-estimation is planned for this study. 4.3.3. Enrollment of Additional Subjects Special considerations have been added to the protocol based on the issues arising from the SARS-CoV-2/COVID-19 pandemic. During the blinded dosing period for Part 2 (ie, prior to completion of the Week 16 visit), any randomized subject who terminates study participation or who misses 2 or more consecutive doses of study drug (even if continuing with study participation) or misses any part of the primary endpoint assessments at Week 16, as a result of pandemic-related reasons, may not be counted against the total number of subjects targeted (N=156 for Part 2 of the study). For each of these cases, a new subject may be screened and randomized, to allow an evaluable number of subjects for the Week 16 primary endpoint. The new subjects in screening will receive new subject numbers and new treatment assignments as per the current randomization schedule in the protocol. Additional subjects will only be added in response to the number of subjects who meet the above criteria, as a result of pandemic-related issues. Randomized subjects who discontinue study participation or miss consecutive doses or the Week 16 primary endpoint assessments for non- pandemic related reasons, or who have study drug or study visit issues after completing their Week 16 visit, will not trigger the screening of additional subjects."
137,page_137,"Version 6.0 Date: 21-Sep-2021 Statistical Analysis Plan Protocol Number: GBR 830-204 Ichnos Sciences Confidential Page 32 of 68 4.4. Randomization Randomization numbers will be issued centrally using interactive voice response system (IVRS)/interactive web response system (IWRS). Subjects who meet all eligibility criteria will be randomized on Day 1 using the IVRS/IWRS system and allocated a randomization number prior to receiving the first dose of study drug. Randomized subjects will be stratified by the IVRS/IWRS based on disease severity (moderate/severe), geographic region (North America (NAm)/European Union (EU)) as prognostic factors, and subjects consenting to rich PK sampling (Yes/No) to ensure balance of treatment groups within each stratum. Randomized subjects who terminate their study participation for any reason, regardless of whether study drug has been taken or not, will retain their randomization number. The randomization scheme will be stored within the IVRS/IWRS database until unblinding of this study is requested. The randomization scheme and identification for each subject will be included in the final clinical study report for this study. 4.5. Clinical Assessments 4.5.1. Efficacy Assessments  The Eczema Area and Severity Index (EASI) is a validated measure used in clinical practice a nd clinical studies to assess the severity and extent of AD. Four AD disease characteristics will be assessed for severity by the Investigator or designee on a scale of “0” (absent) through “3” (severe). In addition, the area of AD involvement will be assessed as a percentage by body area of head/neck, trunk(including genital area), upper limbs, and lower limbs (including buttocks) and converted to a score of 0 to 6 ( Hanifin et al, 2001). The EASI will be collected in the electronic Case Report Forms (eCRF) and EASI score will be calculated in the eCRF as follows: Body Region EASI Score Head/Neck (H) (E + I + Ex + L) x Area x 0.1 Upper limbs (UL) (E + I + Ex + L) x Area x 0.2 Trunk (T) (E + I + Ex + L) x Area x 0.3 Lower limbs (LL) (E + I + Ex + L) x Area x 0.4 EASI score Sum of the above 4 body region scores The degree of severity of each sign (E = erythema, I = induration/papulation, Ex = excoriation, L = lichenification) in each of the 4 body regions is evaluated based on a scale ranging from 0 to 3 (0: none; 1: mild; 2: moderate; 3: severe), with half points allowed. Area (the affected body area) is defined as follows: 0= 0%; 1=1-9%; 2=10-29%; 3=30-49%; 4=50-69%; 5=70-89%; 6=90-100%. Among the 4 zones, trunk includes the genital area, and lower limbs include the buttocks.  The IGA is an assessment scale used in clinical studies to determine severity of AD and clinical response to treatment based on a 5-point scale ranging from 0 (clear) to 4 (severe). The IGA will be collected in the eCRF. IGA Score Definition 0 = Clear No inflammatory sign of atopic dermatitis"
138,page_138,"Version 6.0 Date: 21-Sep-2021 Statistical Analysis Plan Protocol Number: GBR 830-204 Ichnos Sciences Confidential Page 33 of 68 1 = Almost clear Just perceptible erythema and just perceptible papulation/infiltration; Barely perceptible erythema and/or minimal lesion elevation (papulation/infiltration) 2 = Mild disease Mild erythema and mild papulation/infiltration; Visible detectible, light pink erythema and very slight elevation (papulation/infiltration) 3 = Moderate disease Moderate erythema and moderate papulation/infiltration; Dull red, clearly distinguishable erythema; clearly perceptible elevation (papulation/infiltration), but not extensive 4 = Severe disease Severe erythema and severe papulation/infiltration; Deep/dark red erythema; marked and extensive elevation (papulation/infiltration)  The SCORAD is a validated tool used in clinical research and clinical practice that was developed to standardize the evaluation of the extent and intensity of AD. The extent of AD is assessed as a percentage of each defined body area and reported as the sum of all areas, with a maximum score of 100% (assigned as “A” in the overall SCORAD calculation). The intensity of 6 specific symptoms of AD is assessed using the following scale: none (0), mild (1), moderate (2), or severe (3), (for a maximum of 18 total points, assigned as “B” in the overall SCORAD calculation). Subjective assessment of itch and sleeplessness is recorded for each symptom by the subject or relative on a visual analogue scale (VAS), where 0 is no pruritis (or sleep-loss) and 10 is the worst imaginable pruritis (or sleep-loss). This parameter is assigned as “C” in the overall SCORAD calculation. The SCORAD is calculated as: A/5 + 7B/2 + C ( Kunz et al, 1997) and the maximum of SCORAD score is 103. The SCORAD will be collected in the eCRF. If SCORAD uses a non-10cm VAS scale line, the measurement will be converted to 10cm VAS scale line using a standard ratio.  For Pruritus NRS subjects will respond to the following question, “On a scale of 0 – 10, with 0 being no itch and 10 being the worst itch imaginable, how would you rate your worst degree of itch during the previous 24 hours?”. The Pruritis NRS will be assessed and recorded by the subject once per day in the morning, ideally at the same time; and reviewed by study staff at each clinic visit. Baseline Pruritus NRS average score for maximum itch intensity will be determined based on the average of daily Pruritus NRS scores for maximum itch intensity (the daily score ranges from 0 to 10) during the 7 days immediately preceding) randomization. A minimum of 3 daily scores out of the 7 days is required to calculate the baseline average score. For subjects who do not have at least 4 daily scores reported during the 7 days immediately preceding the planned randomization date, randomization should be postponed until this requirement is met, but without exceeding the 28-day maximum duration for screening).  The DLQI is a subject-administered, 10-question, validated, quality-of-life questionnaire that covers 6 domains including symptoms and feelings, daily activities, leisure, work, and school personal relationships and treatment. Response categories include “a little,” “a lot,” and “very much” with corresponding scores of 1, 2, and 3, respectively; “a little ,” “not relevant” responses are scored as “0.” Totals range from 0 to 30 (i.e., from less to more impairment), and a 5point change from baseline is considered clinically relevant ( Finlay and Khan, 1994; Basra et al, 2008).  For GISS individual components of the AD lesions (erythema, infiltration/papulation, excoriations, and lichenification) will be rated globally (i.e., each assessed for the whole"
139,page_139,"Version 6.0 Date: 21-Sep-2021 Statistical Analysis Plan Protocol Number: GBR 830-204 Ichnos Sciences Confidential Page 34 of 68 body, not by anatomical region) on a 4-point scale (from 0=none to 3=severe) using the EASI severity grading criteria. The GISS will be collected in the eCRF.  Body Surface Area (BSA) affected by AD will be assessed for each section of the body (the possibl e highest score for each region is: head and neck [9%], anterior trunk [18%], back [18%], upper limbs [18%], lower limbs [36%], and genitals [1%]), and will be reported as a percentage of all major body sections combined. The BSA will be collected in the eCRF.  The HADS is an instrument for screening anxiety and depression in non-psychiatric populations; repeated administration also provides information about changes to a patient’s emotional state ( Zigmond and Snaith, 1983 ; Hermann, 1997). The HADS consists of 14 item s, 7 each for anxiety and depression symptoms; possible scores range from 0 to 21 for each subscale. The following cut-off scores are recommended for both subscales: 7 to 8 for possible presence, 10 to 11 for probable presence, and 14 to 15 for severe anxiety or depression. At a given visit, there must be responses to at least 6 out of 7 questions within each sub-scale of anxiety and depression. If fewer than 6 responses, then the sub-scale will be set to missing  The POEM is a 7-item, validated questionnaire used in clinical practice and clinical trials to asse ss disease symptoms in children and adults ( Charman et al, 2004 ). The format is a response to 7 items (dryness, itching, flaking, cracking, sleep loss, bleeding, and weeping) based on frequency during the past week (i.e., 0 = no days, 1 = 1 to 2 days, 2 = 3 to 4 days, 3 = 5 to 6 days, and 4 = all days) with a scoring system of 0 to 28; the total score reflects disease-related morbidity.  The EQ-5D is a standardized measure of health status developed by the EuroQoL Group in order to provide a simple, generic measure of health for clinical and economic appraisal. The EQ-5D consists of 2 parts: the descriptive system and the EQ visual analogue scale (EQVAS). The EQ-5D descriptive system comprises the following 5 dimensions: mobility, self-care, usual activities, pain/discomfort, and anxiety/depression. Each dimension has 3 levels of perceived problems: “no problem” (level 1), “some problems” (level 2), “extreme problems” (level 3). The VAS scale is a 100-point scale with endpoints ranging from 100 – “best imaginable health state” to 0-“worst imaginable health state”.  The ACQ-5 is a 5-question version of the Juniper ACQ that is a validated questionnaire to evaluate asthma control. The questionnaire will be administered only to the subset of subjects with a medical history of asthma. The ACQ-5 will be collected in the eCRF.  The SNOT-22 is a validated questionnaire to assess the impact of chronic rhinosinusitis on quali ty of life (QoL). The questionnaire will be administered only to a subset of subjects with chronic inflammatory conditions of the nasal mucosa and/or paranasal sinuses (eg, with chronic rhinitis/ rhinosinusitis, nasal polyps, allergic rhinitis).  For Patient Global Assessment (PGA) of Disease subjects will rate their overall wellbeing based on a 5-point Likert scale from poor to excellent. Subjects will be asked: “Considering all the ways in which your eczema affects you, indicate how well you are doing.” Response choices are: “Poor=1”; “Fair=2”; “Good=3”; “Very Good=4”; “Excellent=5.”  For Patient Global Assessment (PGA) of Treatment subjects will rate their satisfaction with the st udy treatment based on a 5-point Likert scale from poor to excellent. Subjects will be"
140,page_140,"Version 6.0 Date: 21-Sep-2021 Statistical Analysis Plan Protocol Number: GBR 830-204 Ichnos Sciences Confidential Page 35 of 68 asked: “How would you rate the way your eczema responded to the study medication?” Response choices are: “Poor=1”; “Fair=2”; “Good=3”; “Very Good=4”; “Excellent=5.”  For assessment of Sick Leave and/or Missed School Days subjects who are employed or enrol led in school will be asked to report the number of sick leave and/or missed work/school days due to AD (e.g. vs due to an accident) in the last 4 weeks. 4.5.2. Pharmacokinetic Assessments Blood sa mples (3.5 mL each) will be collected from both rich and sparse PK groups at appropriate time points defined in Table 2 and 3, and Table 8 in the protocol. Serum concentrations of ISB830 in these samples will be quantified using a validated enzyme-linked immunosorbent assay (ELISA) method. Serum concentration data from both rich PK and sparse PK group from the blinded treatment will be used to derive PK parameters, as appropriate. In the blinded phase of the study, only the serum sample from subjects, belonging to treatment arms that received ISB830 will be analyzed. In open-label phase of the study, PK samples from all subjects will be analyzed. 4.5.3. Immunogenicity Assessments Blood sa mples (5 mL) will be collected from all subjects at appropriate time points defined in Table 2, Table 3 and Table 8 in the protocol, to detect the presence of ADA to ISB830, as per procedures similar to collection of PK samples. Antibodies generated against ISB830 will be detected and confirmed using a validated ECLIA method. Details of sample collection, processing and storage and shipment to the bioanalytical laboratory will be outlined in a separate laboratory manual. 4.5.4. Safety Assessments Saf ety and tolerability of ISB 830 will be assessed, including adverse event (AE); SAEs; TEAE; anaphylactic events and injection site reactions (ISR); vital signs; physical examinations; electrocardiograms (ECGs); and clinical laboratory parameters, as detailed in the Schedule of Assessments (Table 2 and Table 3) of the protocol. Guidance will be given to the investigator for the criteria to be used to assess anaphylaxis (Sampson et al, 2006 ). Injection site reactions will be assessed according to the Common Terminology Criteria for Adverse Events (CTCAE) v4.03, 2010). Stopping/discontinuation/withdrawal criteria are listed in Section 8.3 of the protocol. In case of premature discontinuation, the reason and their cause must be documented. All appropriate assessments should be conducted at the EOT visits. If the withdrawal is due to an adverse event (AE), the AE should be monitored until it is resolved, stabilizes or has returned to a status that was prior to the AE. 4.6. Changes in the SAP Compared to the Study Protocol  For the efficacy endpoints (EASI-75 and IGA) stated below, “secondary efficacy endpoints” have been changed to “key secondary efficacy endpoints” - Proportion of subjects with EASI-7 5 (≥75% improvement from baselin e) at Week 16"
