,PageNo,Text55,page_55,"2016N280566_ 02 CONFIDENTIA L 201000 56investigation. The sponsor will comply with country -specific regulatory requirements relating to safet y reporting to the regulatory authority, IRB/IEC, and investigators. Investigator safety reports must be prepared for su spected unexpected serious adverse reactions (SUSAR) according to local regulatory requirements and sponsor policy and forwarded to investigators as necessary. An investigator who receives an investigator safety report describing a SAE or other specific sa fety information (e.g., summary or listing of SAE) from the sponsor will review and then file it along with the IBand will notify the IRB/IEC, if appropriate according to local requirements. 9.2.5. Cardiovascular and Death Events For an y cardiovascular (CV) even ts detailed in Appendix 5and all deaths, whether or not they are considered SAEs, specific CV and Death sections of the e CRF will be required to be completed. These sections include questions regarding CV(including sudden cardiac death) and non -CVdeath. The CV e CRFs are presented as queries in response to reporting of certain CV MedDRA terms. The CV information should be recorded in the specific CVsection of the eCRF within one week of receipt of a CV Event data query prompting its completion. The Death eCRF is provided immediately after the occurrence or outcome of death is reported. Initial and follow -up reports regarding death must be completed within one week of when the death is reported. 9.2.6. Pregnancy Details of all pregnancie s in female participants will be collected after the start of study treatment and until the end of the Follow -up Period. If a pregnancy is reported, the investigator should inform GSK within 24 hours of learning of the pregnancy and should follow the proce dures outlined in Appendix 2. Abnormal pregnancy outcomes (e .g., spontaneous abortion, fetal death, stillbirth, congenital anomalies, ectopic pregnancy ) are considered SAE. Any female participant who becomes pregnant while participat ing in the study will discontinue study treatment immediately but will remain in the study and continue to undergo study assessments (see Section 8.1). 9.3. Treatment of Overdose For this study , any dose of GSK233067 2 greater than 360 mg within a 20-hour time period will be considered an overdose. GSK does not recommend specific treatment for an overdose as there is no specific antidote for GSK2330672. I n the event of a suspected overdose ,it is recommended that 2020N437913_00"
56,page_56,"2016N280566_ 02 CONFIDENTIA L 201000 57the appropriate supportive clinical care should be instituted, as dictated by the participant’s clinical status. In the event of an overdose, the investigator should: 1.Contact the Medical Monitor immediately . 2.Closely monitor the participant for AE/SAE and labor atory abnormalities until any associated s ymptoms have resolved, and for at least 5 days. 3.Obtain a plasma sample for PK anal ysis within 24 - 72 hours from the date of the last dose of study treatment, if requested b y the Medical Monitor (determined on a case-by-case basis). 4.Document the quantit y of the excess dose as well as the duration of the overdosing in the eCRF. Decisions regarding dose interruptions or modifications will be made by the investigator in consultation with the Medical Monitor based on th e clinical evaluation of the participant. 9.4. Safet y Assessments Planned time points for all safety assessments are provided in the SoA (see Section 2). All safet y assessments should be performed b y the investigator or a suitabl y qualified designee. 9.4.1. Physical Examinations A complete ph ysical examination (Screening Visit only ) will include, at a minimum, assessments of the s kin, CV, respiratory , gastrointestinal and neurological sy stems. Height and weight will also be measured (wearin g indoor clothing without shoes) and recorded. A brief ph ysical examination will include, at a minimum, assessments of the skin, lungs, CVsystem, and abdomen (liver and spleen). Weight will also be measured (wearing indoor clothing without shoes) and reco rded. Investigators should pay special attention to clinical signs related to previous serious illnesses. 9.4.2. Vital Signs Vital signs (pulse rate and blood pressure) will be assessed as outlined in the SoA (Table 1). Blood pressure and pulse measurements will be assessed in the sitting position with a completely automated device. Manual techniques will be used only if an automated device is not available. 2020N437913_00"
57,page_57,"2016N280566_ 02 CONFIDENTIA L 201000 58Blood pressure and pulse measurements should be preceded b y at least 5 minutes of rest for the participant in a quiet setting without distractions (e .g., television, cell phones). Vital signs ( should not be performed immediatel y after blood collection for laboratory tests or PK ) will consist of three readings of blood pressure and puls e. The first reading should be rejected. The second and third readings should be averaged to give the measurement to be recorded in the eCRF. 9.4.3. Electrocardiograms A single 12-lead ECG will be obtained as outlined in the SoA (Table 1) using preferabl y an ECG machine that automatically calculates the heart rate and measures PR, QRS, QT, and QTc intervals. If an automated reading is not available the ECG should be manually over -read b y the investigator or an adequatel y trained phy sician. Refer to Section 8.1.2 for QTc withdrawal criteria and additional QTc readings that may be necessary . ECGs will be reviewed locally by the investigator or a n adequatel y trained physician and an y clinicall y sig nificant abnormalities reported in the eCRF. 9.4.4. Clinical Safety Laboratory Assessments Refer to Appendix 6for the list of clinical laboratory tests to be performed and to the SoA (Section 2) for the timing and frequency . The investigator must review the laboratory report, document this review, and record any clinically relevant changes occurring during the study in the AE section of the eCRF. The laboratory reports must be fi led with the source documents. Clinically significant abnormal laboratory findings are those which are not associated with the underly ing disease, unless judged by the investigator to be more severe than expected for the participant's condition. All labora tory tests with values considered clinically significantl y abnormal during participation in the study should be repeated until the values return to normal or baseline or are no longer considered significantly abnormal by the investigator or Medical M onitor . If such values do not return to normal/baseline within a period of time judged reasonable b y the investigator, the etiology should be identified and the sponsor notified. All protocol -required laboratory assessments, as defined in Appendix 6, must be conducted in accordance with the laboratory manual and the SoA (Table 1). 9.5. Pharmacokinetics Samples of whole blood of will be collected for measurement of plasma concentrations of GSK2330672 and /orUDCA as follows : 2020N437913_00"
58,page_58,"2016N280566_ 02 CONFIDENTIA L 201000 59Visit 3 [Week 4] in participants on UDCA only : A 2 mL sample for anal ysis of UDCA will be collected between 1 and 3 hours following the morning dose of study treatment. Visits 4 and 5 [Weeks 8 and 12 respectivel y] in all participant s on study treatment: The first sample (3 mL) will be collected between 1 and 3 hours following the morning dose of study treatment . The second sample (2 mL) will be collected between 5 and 8 hours after the morning dose of study treatment. The first sample will be used for analy sis of both GSK2330672 and UDCA, and the second sample for analy sis of GSK2330672. If samples are not collected at Visit 5 [Week 12] they may alternatively be collected at Visit 6 [Week 16]. The actual date and time (24- hour cloc k time) of each sample collection will be recorded. Participants will record the time of their morning dose of study treatment taken at home on a paper diary , as well as the date and time of their last dose of UDCA (if applicable). Participants should b ring this information with them to the study visit for entry into the eCRF . Participants taking UDCA will be required to not administer a morning dose of UDCA (if applicable), before each of the PK sampling visits and to record the time of their last UDC A dose. If more convenient, participants may take their morning dose of study treatment at the clinic visit, provided they comply with other protocol requirements such as fasting, eDiary completion and the sampling time does not interfere with PRO completi on (see Section 2). Note: PK sample collection is not required for participants who have prematurel y discontinued study treatment and have not taken study treatment on 3 or more day s prior to the Visit. During the study , the ti ming of PK samples may be altered and/or PK samples may be obtained at additional time points. Sample collection, processing, storage and shipping procedures are provided in the Laboratory Manual. Plasma analy sis for GSK2330672 and UDCA will be performed u nder the control of Bioanal ytical Science and Toxicokinetics, DMPK, GlaxoSmithKline . Concentrations of GSK2330672 and UDCA will be determined in plasma samples using currentl y approved bioanaly tical methodology . Raw data will be archived at the bioanaly tical site. Samples collected for analy ses of GSK2330672 and/or UDCA plasma concentration s may also be used to evaluate safety or efficacy aspects related to concerns arising during or after the study . Once the plasma has been anal yzed for GSK2330672 and/or UDCA any remaining plasma may be analy zed for other GSK2330672- related or UDCA -related metabolites and the results reported under a separate protocol. 2020N437913_00"
59,page_59,"2016N280566_ 02 CONFIDENTIA L 201000 60Drug concentration information that may unblind the study will not be reported to investigative sites or blinded study personnel until the end of the study and the study has been unblinded. 9.6. Pharmacody namics See Section 9.8. 9.7. Genetics A 6 mL blood sample for DNA (deox yribonucleic acid) isolation will be collected from participants who have consented to participate in the genetics anal ysis component of the study . Participation is optional. Participants who do not wish to participate in the genetic research may still participate in the study . In the event of DNA extraction failure, a replacement genetic blood sample may be requested from the participant. Signed informed consent will be required to obtain a replacement sample unless it was included in the original consent. See Appendix 7 for information regarding genetic research. Details on processes for collection and shipment of these samples can be found in the L aboratory Manual. 9.8. Biomarkers The effects of GSK2330672 on markers of PBC disease progression, as well as biomarkers of PBC, bile acid ph ysiology and li pids will be evaluated. Markers of PBC disease progression :The effects of GSK2330672 on markers of PBC will be evaluated among participants at high risk of PBC progression (i.e., serum ALP ≥1.67x ULN and/or total serum bilirubin >ULN) and inall study participants. PBC markers to be assessed include serum ALP, ALT, AST, gamma -glutamy l transferase (GGT ), total bilirubin andalbumin concentrations , and prothrombin time/international norma lised ratio (PT/INR ). Biomarkers of PBC and bile acid physiology :The effects of IBAT inhibition by GSK2330672 on circulating bile acids and bile acid sy nthesis will be evaluated in all study participants. Biomarkers include total serum bile acid and seru m C4as a marker of bile acid sy nthesis. A dditional exploratory biomarkers include serum autotaxin, fibroblast growth factor -19 (FGF-19), and enhanced liver fibrosis (ELF) test, and serum bile acid species. Samples may be tested for other biomarkers as n ew data emerge. Lipids: The effect of GSK2330672 on fasting lipids, including direct low density lipoprotein (L DL) cholesterol will also be assessed. Fasting blood samples for biomarkers and will be collected as outlined in the SoA (Table 1). Full details of sample collection and processing are provided in the Laboratory Manual. 2020N437913_00"
60,page_60,"2016N280566_ 02 CONFIDENTIA L 201000 61In addition, with the participant’s consent, serum samples will be stored and anal ysis may be performed on biomarker variants thought to play a role in PBC disease and circulating bile acids, to evaluate their association with observed clinical responses to GSK2330672. Due to the potential for unblinding, results of biomarkers of PBC and bile acid physiology will not be provided to investigators or blind ed study staff until the study has completed and has been unblinded. 9.9. Medical Resource Utilization and Health Economics The effect of stud y treatment on healthcare resource utilization parameters such as emergency room visits , details of hospitalisations including intensive care unit stay , will be ev aluated . 10. STATISTICA L CONSIDER ATIONS 10.1. Sample Size Determination Approximately 118 participants will be randomized to ensure that approximately 100 eligible participants have an evaluable Week 16 assessment of itch . Sample size calculations were made using simulation to assess the precision of the estimated difference in response between each dose of GSK2330672 and placebo from the Emax dose -response model (see Figure 2). 2020N437913_00"
61,page_61,"2016N280566_ 02 CONFIDENTIA L 201000 62Figure 2 Simulated Emax Dose -Response Curve A sample size of approximately 100 eligible participants allows sufficient precision to provide a minimally detectable effect of at least 2 points on the Mean Worst Daily Itch Score (assuming a between -participant SD of 2 points). Participants will be stratified based on region (Europe, North America, Japan to manage drug suppl y) and participant risk of PBC progression according to serum ALP and total bilirubin concentrations at Visit 2 [Day 1] (see Table 6). To optimise the dose response assessment, participants with AL P <1.67x ULN and total bilirubin ULN will be randomized in a 1:1:1:1:1 ratio (Placebo: 20 mg once dail y: 90mgonce dail y: 180 mg once dail y: 90mgtwice daily ). Participants with AL P ≥1.67x ULN and/or total bilirubin >ULN will be randomized in a ratio of 3:1:1:2:1, respectivel y to increase the precision for the comparison of higher doses of GSK2330672 to placebo in participants at higher risk of disease progres sion. 2020N437913_00"
62,page_62,"2016N280566_ 02 CONFIDENTIA L 201000 63Table 6 Distribution of Participants to Treatment A rms Strata PlaceboGSK2330672 Once Daily Twice Daily 20 mg 90 mg 180 mg 90 mg ALP <1.67x ULN and total bilirubin ULN Ratio: 1 1 1 1 1 Participants 14 14 14 14 14 ALP ≥1.67x ULN and/or total bilirubin >ULN Ratio: 3 1 1 2 1 Participants: 18 6 6 12 6 ALP = Alkaline phosphatase; ULN = Upper Limit of Normal. Participant numbers are approximate based on expected recruitment to rates to each strata. 10.2. Populations for A nalyses For purposes of analy sis, the following populations are defined: Population Description Enrolled All participants who sign the ICF Randomized All participants who were randomized to receive study treatment, regardless of whether they took st udy treatment, will be used i n the summaries of participant disposition ITT (Intent to Treat) PopulationThis population will comprise all randomized participants who receive at least one dose of study treatment, have a baseline and at least one on -treatment assessment. Participants in the ITT Population will be classified according to the treatment as randomized. The ITT population will be the primary population for the statistical assessment of efficacy. Per Protocol Population The Per Protocol (PP) P opulation is a subset of the ITT population who adhere to the major protocol requirements. Protocol violator criteria will be defined in the Reporting Analysis Plan (RAP), and participants to be excluded from the PP population will be identified prior to the unblinding of the data at the end of the study. The PP population will be used for analysis of the primary endpoint to assess the sensitivity of the ITT results. The PP population may not be analysed if it comprises 80% of the ITT population and is balanced across dose levels. Safety All randomized participants who take at least 1 dose of study treatment. Participants will be analyzed according to the treatment they actually received. 2020N437913_00"
63,page_63,"2016N280566_ 02 CONFIDENTIA L 201000 6410.3. Statistical A nalyses 10.3.1. Efficacy Analyses Endpoint Statistical Analy sis Methods Primary The primary objective is to estimate the relationship between doses of GSK2330672 and itch response. The primary analysis will be a model -based dose -response analysis of the change from Baseline to Week 16 in the Mean Worst Daily Itch Score on the 0 -10 NRS. The primary null hypothesis (H0) assumes that there is no effect of the test drug at any dose level and therefore no evidence of dose response. The alternate hypothesis (H1) assumes that there is a monotonic Emax dose response with GSK2330672 on participant experience of itch. A four parameter Emax dose-response model, once fitted, will be used to estimate the minimally effective dose and 95% confidence interval of each dose level of GSK2330672 relative to placebo. If problems are e ncountered fitting a four parameter Emax model, the model selection approach described by Kirby et al ( Kirby, 2011) will be taken (fitting a 3- parameter Emax model and a power model and selecting the one that best fits the data (i.e. smallest Akaike’s Information Criterion statistic (AIC)). If both of these models poorly fit, then additional models will be investigated sequentially until an appropriate model can be chosen (i.e. linear, quadratic, log- transformed dose). Further details of the Emax model will be defined in the RAP. Secondary Analyses of the following secondary endpoints will be analyzed as the change from Baseline to Week 16 using similar methodology as for the primary endpoint (with an appropriate link -function for bina ry endpoints): Mean change from Baseline in PBC -40. Mean change from Baseline in markers of PBC disease progression including ALP, ALT, AST, GGT, total bilirubin, albumin and PT/INR. Proportion of participants responding to treatment defined as ALP reducti on to <1.6 7x ULN and total bilirubin ≤ULN at the end of treatment (in participants with ALP ≥ 1.67x ULN and /or total bilirubin >ULN at Day 1). Proportion of participants who are responders using 3 separate definitions (Mean Worst Daily Itch Score <4, 30% reduction in Mean Worst Daily Itch Score, 2-point reduction in Mean Worst Daily Itch Score). Mean number of responder days using 3 separate definitions (Worst Daily Itch Score <4, 30% reduction in Worst Daily Itch Score, 2-point reduction in Worst Daily Itch Sc ore). Change from Baseline in Mean Daily Sleep Score. 2020N437913_00"
64,page_64,"2016N280566_ 02 CONFIDENTIA L 201000 65Endpoint Statistical Analy sis Methods Change from Baseline in Mean Daily Fatigue Score. Change from Baseline in the 5 -D Itch questionnaire. Change from Baseline in total serum bile acids and C4. Further details of the analysis methodology, any sensitivity analyses and control of the overall Type I error rate will be defined in the RAP. Exploratory Will be described in the reporting and analysis plan 10.3.2. Safety Analyses All safet y anal yses will be perf ormed on the Safety Population. Endpoint Statistical Analysis Methods Primary Overall safety evaluations will be descriptive using the Safety Population (as described in Section 10.2). Graphical and tabular displays will be presented to facilitate safety data review. AEs and SAEs will be summarised, sorted by system organ class and preferred term assigned by MedDRA, and presenting as number and percent by treatment group. Additional summaries of AEs leading to discontinuation of study treatment and study treatment re lated AEs will also be generated. Secondary Change from baseline in GSRS score. Change from baseline and percentage change from baseline for laboratory values will be summarised by visit and treatment group. In addition, the number and percentage of part icipants with values outside the potential clinical importance range will also be summarized. All vital sign data and change from baseline will be summarized by visit and treatment group. For systolic and diastolic blood pressure and heart rate, the numb er and percentage of participants with values of potential clinical importance and separately, those meeting the pre -specified withdrawal criteria will be summarized by treatment group. Criteria for potential clinical importance will be specified in the R AP. Exploratory Will be described in the reporting and analysis plan 10.3.3. Other A nalyses Pharmacokinetic , PDand biomarker exploratory analy ses will be described in the RAP . Any other population analy ses (e.g., dose-response) conducted based on emerging da ta will be described in the CSR or a separate report as appropriate. 2020N437913_00"
65,page_65,"2016N280566_ 02 CONFIDENTIA L 201000 6610.3.4. Interim A nalyses An interim anal ysis of efficacy and safety will be performed in order to determine whether the initial doses of GSK2330672 need to be modified. Once a participant is assigned to a treatment arm, their individual treatment assignment will not change as a result of the outcome of the interim anal ysis and their data will still contribute to the final dose response anal ysis. An interim analysis will allow for potential discon tinuation for futility , elimination of less informative doses (e .g.,those which are ineffective or poorl y tolerated), and/or addition of lower or higher doses to more fully describe the dose -response characteristics of GSK2330672. In order to minimise bias, a firewalled analy tical group will perform the interim anal yses to maintain the integrit y of the study blind within the study team. T he unblinded data will be reviewed b y limited members of the trial leadership, who will review the results and may then decide to: 1.Continue as planned. 2.Stop for futility : Proposed futility rule to be based on a low posterior predicted probability that at least one dose will achieve a clinically relevant treatment difference to placebo (based on dose- response model). 3.Amen d dose levels: Proposed if dose -response and/or tolerability profile dramaticall y different to pre -study assumptions. Allocation post -interim would be focused on most informative doses chosen from a set of possible dose levels that includes those used pre- interim (e.g., if larger responses are seen on the lower doses then the ED50 may be smaller than was assumed during design and hence lower dose levels could be included and higher levels dropped). 4. Amend sample size: Proposed if an additional dose is added , or if the observed variability is dramatically different to the assumptions from the initial sample size calculations. The results of the interim anal ysis could lead to changes to the randomization ratio and/or a change in the total number of participant s to be randomized in the study . The decision to adapt the study will be determined by posterior probability decision rules which will be pre-defined and documented prior to unblinding in the RAP. Based on the overall panned sample size, an interim analy sis will be ideally performed after approximately 40 participants have reached their Visit 5 [ Week 12] . However, should enrolment fail to occur as anticipated, the timing of the planned interim may be revised. Additional interim analy ses may be conducted based on the initial data . Details of the analy ses to support the interim and the decision rules will be documented in a separate Interim Analy sis Plan. The final timings of the interim anal yses will be documented in the clinical study report. 2020N437913_00"
66,page_66,"2016N280566_ 02 CONFIDENTIA L 201000 6711. REFERENCE S Elman S., Hy nan L.S., Gabriel V., May o M.J. The 5 -D itch scale: a new measure of pruritus. Br J Dermatol. 2010; 162:587 -593. GlaxoSmithKline Document Number 2010N111289_03: GSK2330672 I nvestigator's Brochure. 29- JUL-2016. Jacoby A., Rannard A., Buck D. e t al. Development, validation, and evaluation of the PBC -40, a disease specific health related qualit y of life measure for primary biliary cirrhosis. Gut. 2005; 54:1622 -1629. Kirby , S.,Brain, P .,Jones, B.Fitting Emax models to clinical trial dose -respon se data. Pharmaceut .Statist .2011; 10: 143-149. Svedlund J., Sjodin I ., Dotevall G. GSRS --a clinical rating scale for gastrointestinal symptoms in patients with irritable bowel s yndrome and peptic ulcer disease. Dig Dis Sci. 1988; 33:129-134. 2020N437913_00"
