,PageNo,Text25,page_25,"- PROSPER - Prediction and Outcome Study on PTSD and Personality disorders - Version 8, 22 June 2020 26 of 59 4.3 Exclusion criteria A patient who meets any of following criteria will be excluded from participation in this study: - Current psychosis - Comorbidity interfering with treatment or randomisation (severe outward aggression, antisocial PD, treatment interfering addiction or eating disorders, somatic problems) - Primary diagnosis of paranoid, schizoid, schizotypal, narcis sistic, histrionic or antisocial PD - Mental retardation For the healthy controls, current psychiatric diagnosis is an exclusion criterion. For the subgroup of patients and controls that also undergo MRI examination more exclusion criteria are: Pregnancy; Metal implants (such as pacemakers, etc.); Somatic disorders interfering with brain functioning; Claustrophobia; Other psychopharmaca than at -least -3months stabile dose SSRI or low -dose benzodiazepines 4.4 Sample size calculation A power calculation w as made based on Twisk (2007). We assume that PTSD treatment (EMDR or ImRs) have a small effect size (< 0.5) in the complex patient group with PTSD and comorbid CPD/BPD, while the integrated treatment will show double effect sizes (1.0) (Harned et al., 20 14). With a minimal clinical relevant difference of a 0.5SD on the CAPS -5, and the assumptions of a SD of 20.0, an intra -person correlation coefficient of 0.7, 5 follow -up measurements, the needed number to include is 50 persons per condition to reach fo r 80% power. Expecting a drop -out rate of 25%, we will include 63 persons per arm, or for 4 arms in total 252 persons. In 2016, approximately 950 new patients were referred to the SC (Amstelveen). From these patients, ca. 450 had PTSD. From these PT SD patients, 168 had a comorbid PD and 188 more were not assessed for personality traits (“Uitgestelde diagnose”). We expect that introducing the assessment of axis II assessments with this study will result in an estimated 300 patients with PTSD and PD pe r year, and after 33% refusals or exclusions, in an estimated 2o0 patients possible to include per year. To be sure to include enough patients, we will need to include more patients from another site of the"
26,page_26,"- PROSPER - Prediction and Outcome Study on PTSD and Personality disorders - Version 8, 22 June 2020 27 of 59 Sinai Center, i.e. Amersfoort (400 patients, fro m which 216 PTSD patients, from which an estimated 100 PTSD + PD patients), and extend the inclusion period. From these 252 patients, 80 will be asked for additional MRI, next to 40 healthy controls (Total sample size = 292). An estimated 40 patie nts will be available for a second MRI after 6 months (total of 160 scan sessions). 5. METHODS 5.1 Study parameters/endpoints 5.1.1 Primary outcome parameters o Severity of PTSD (DSM -5) as measured with: • CAPS -5 (Clinician Administered PTSD Scale, Weathers et al., 2014, Boeschoten et al., 2014). The first psychometric evaluation of the CAPS -5 showed good reliability, convergent and divergent validity (Weathers et al., 2017). Severity of PTSD is measured on a continuous scale on the CAPS -5. All 20 symptoms of PTSD from the DSM -5 are assigned a severity score of 0 -4. These 20 scores are then summed to calculate total PTSD symptom severity. 5.1.2 Secondary outcome parameters o Presence of PTSD (DSM -5) as measured with: CAPS -5 (Clinician Ad ministered PTSD Scale, Weathers et al., 2014, Boeschoten et al., 2014) o PCL-5 (PTSD Checklist for DSM -5; Weathers et al., 2013; Boeschoten et al., 2014; Bovin et al., 2016). o Presence and severity of personality disorders as measured with the SCID -5-PD (S tructured Interview for DSM -5 Personality Disorders; First et al 2016) to assess presence and severity (dimensional score) of the DSM - 5 personality disorders o Demographic questionnaire"
27,page_27,"- PROSPER - Prediction and Outcome Study on PTSD and Personality disorders - Version 8, 22 June 2020 28 of 59 o Outcome Questionnaire -45 (OQ -45), with 25 items on psychiatric sympto ms and 20 on interpersonal, occupational and social functioning (de Jong et al., 2008) o BDI (Beck Depression Inventory, Beck et al., 1988) o AUDIT (Alcohol Use Disorders Identification Test, Babor et al., 2001) to assess alcohol and drug abuse o SCID -5-S (American Psychiatric Association, 2017). o WHODAS 2.0 (World Health Organization Disability Assessment Schedule, Ustun et al 2010) o EQ-5D-5L (http://www.euroqol.org/eq -5d- products/eq -5d-5l.html) to measure quality -adjusted life year (QALY) o Tic-P (Trimbos/iMTA questionnaire for costs associated with psychiatric illness) for health care co nsumption (Hakkaart -van Roijen et al., 2002) o NSSI screening; Screeningsvragenlijst opzettelijk zelfverwondend gedrag (Baetens & Claes, 2014) to assess selfinjury. o SMI -118 (Schema Mode Inventory 118 items, Young, Arntz, Atkinson, Lobbestael, Weishaar, Va n Vreeswijk & Klokman, 2008). o YSQ -75 (Young Schema Questionnaire 75 items, Young & Brown, 1998). o The ITQ (International Trauma Questionnaire) assesses PTSD and complex PTSD (CPTSD) symptoms according to the diagnostic formulat ion published in the ICD-11 (Karatzias et al., 2016 ; Cloitre et al., 2018 ). Since the CAPS -5 will be used to assess PTSD in the current study, patients will be asked to only complete the CPTSD items of the ITQ. The ITQ measures CPTSD th rough six five-point Likert scale (0-4) items related to three symptom clusters of difficulties in emotion -regulation (C1-2), negative self -concept (C3-4) and distur bed relationships (C5-6). Additionally, three five -point Likert scale items assess functionail impairment (social, occupational and other im portant areas of life) associated with CPTSD symptoms (C7-9). A diagnosis of CPTSD requires that criteria for a PTSD are met (as measured by the CAPS -5), as well as a"
28,page_28,"- PROSPER - Prediction and Outcome Study on PTSD and Personality disorders - Version 8, 22 June 2020 29 of 59 score of ≥2 in each of the three C PTSD symptoms clusters, plus functional impairment asso ciated with these symptoms . A patient can only receive a PTSD or a CPTSD diagnosis, not both. The ITQ has demonstrated adequate internal reliability and validity (Cloitre et al., 2018; Hyland et al., 2017). 5.1.3 Biological predictors (see table 2): o Biological parameters • Body measures: Weight, height, blood pressure • HPA axis (cortisol): Hair sample • Biomarkers: Fasting blood sample (BDNF, FKBP -5) & Full blood o MRI session in subsample (60 min) • 3 Tesla -MRI (GE, VUmc): functional MRI with a face recognition , Structural MRI, Resting state MRI, DTI. In between scans a visual analogue scale (VAS) will be applied to assess distress during the scan session. 5.1.4 Psychological predictors o Trauma exposure as measured with: • CTQ (Child Trauma Question naire, Bernstein et al., 2003), 28 -item questionnaire to check self -reported child trauma experiences, with 5 subscales: physical, emotional and sexual abuse, physical and emotional neglect (5 -point Likert scale), and 3 -item scale to detect under -reporting • LEC-5 (Life Events Questionnaire, Weathers et al., 2013). o Cognitive factors • DERS (Difficulties in Emotion Regulation Scale; Gratz & Roemer, 2004; Lavender et al., 2015) a 36 -item self -report measure that assesses state levels of emotion dysregulation across six domains: non - acceptance of negative emotions, difficulties engaging in goal -"
29,page_29,"- PROSPER - Prediction and Outcome Study on PTSD and Personality disorders - Version 8, 22 June 2020 30 of 59 directed behaviors when distressed, difficulties controlling impulsive behaviors when distressed, limited access to effective emotion regulation strategies, lack of emo tional awareness, lack of emotional clarity (5 -point Likert scale). • • PAI-BOR (Personality Assessment Inventory - Borderline features scale, Distel, de Moor & Boomsma, 2009) to measure severity of borderline personality disorder symptoms. The PAI -BOR consists of 24 items rated on a 4 -points Likert scale. It measures four domains of BPS, affective instability, identity problems, negative relations and self harm. • Stop/signal task as a measure for interference/working memory. o Affective factors ( Hyper -arousal: anger, sleep; hypo -arousal: dissociation) • STAS (State -Trait Anger Scale, Spielberger et al., 1994) on trait and state anger with 10 items per scale using a 4 -points scale. • PSQI (Pittsburg Sleep Quality Index, Buysse et al., 1989) with 4 items on sleep time and 6 associated items (4 -points scale). • DES -II (Dissociative Experiences Scale; Bernstein & Putnam 1986), 28items to asses dissociative symptoms. o Relational factors (therapeutic alliance, attachment, social support) as measured with: • WAI ( Working Alliance Inventory, Horvath & Greenberg, 1992; in Dutch: Werk Alliantie Vragenlijst, WAV, Vertommen & Vervaeke, 1990), 12 -items • RSQ (Relationship Scale Questionnaire, Griffin & Bartholomew, 1994) contains 30 statements on attachment rated on a 5 -point scale • CPI (Close Person Inventory, Stansfeld & Marmot 1992) to assess social support. • Therapists will be asked to rate to which extent they believe in the effectiveness of the protocol, on a scale of 1 to 10."
30,page_30,"- PROSPER - Prediction and Outcome Study on PTSD and Personality disorders - Version 8, 22 June 2020 31 of 59 Table 1: Overview of measuremen ts: interviews and questionnaires MEASUREMENTS T0 T1 T2 T3 T4 FU TIME POINTS (months) 0 3 6& 9 12 18 SCREENING ROM Questionnaires Items Psychiatric symptoms OQ-45.2 (1996) 45 SR X* X X X X X PTSD sy mptoms PCL-5 1.1 (2014) 22 SR X* X X X X X PD symptoms SCID -5-PD screener 119 SR X Axis I disorders SCID -5-S screener ?? X* INTERVIEWS DAY 1 Semi -structured interviews Duration Type PTSD CAPS -5 1.2 (2015) 45 min INT X X X Axis I -disorders SCID -5-S 45 min INT X*# X Personality disorders SCID -5-PD 120 min INT X# X QUESTIONAIRES DAY1 Additional questionnaires Items Demographics Demographic questionnaire PROSPER (2017) 30 INT X* Life events LEC-5 1.1 (2014) 17 SR X* Child trauma CTQ (NESDA 2004) 25 SR X Emotion regulation DERS NL (2004) 36 SR X X X Complex PTSD ITQ (2018) 9 SR X X X Anger STAS NL (ZAV 1982) 10 SR X X X Sleep PSQI NL (1989) 10 SR X X X Dissociation DES -II (1986) 28 SR X X X Depression severity BDI-II (2002) 21 SR X X X Alcohol / drugs AUDIT (MATE -nl 2.1 2010) 10 SR X X X Self harm behaviour NSSI screening (NL versie 2014) 7 SR X X X X X X Borderline personality symptoms PAI-BOR (2009) 24 SR X X X"
31,page_31,"- PROSPER - Prediction and Outcome Study on PTSD and Personality disorders - Version 8, 22 June 2020 32 of 59 DAY2 Addi tional Questionnaires Therapeutic alliance WAV (1990) 12 SR X X X Attachment RSQ (1994) 30 SR X X X Social support CPI (NESDA 2004) 4 SR X X X General functioning WHODAS 2.0 (2014) 12 SR X X X X Quality of live EQ-5D-5L 2 (2010) 9 SR X X X X Health care consumption Tic-P (2012) 32 SR X X X X AUDIT = Alcohol Use Disorders Identification Test; BDI = Beck Depression Inventory;; CPI = Clos e Person Inventory; CTQ = Child Trauma Questionnaire; DES -II = Dissociative Experiences Scale; INT = interview; LEC -5 = Life Events Checklist; SCID -5-S; OQ -45 = Outcome Questionnaire 45; PCL -5 = PTSD Checklist for DSM -5; PSQI = Pittsburg Sleep Quality In dex; ROM = Routine Outcome Measurement; RSQ = Relationship Scale Questionnaire; DERS = Difficulties in Emotion Regulation Scale; ITQ = International Trauma Questionnaire ; SR = self-report questionna ire; SCID -5-PD = Structured Clinical Interview for DSM -5 Personality disorders; STAS = State Trait Anger Scale; Tic - P = Trimbos/iMTA questionnaire for costs associated with psychiatric illness; WAI = Working Alliance Inventory, WHODAS = Worl d Health Organization Disability Assessment Schedule 2.0.; NSSI = Non Su icidal Self -Injury screener; PAI -BOR: Personality Assessment Inventory - Borderline features scale. * Healthy controls will only fill out these questionnaires and interviews & Timing of the T2 measurement will be directly after trauma treatment, around 6 mo nths # The SCID -5-P at T0 is part of the regular intake procedure at the Sinai Centre Table 2: Overview of add -on cognitive task, biological measurements, including MRI MEASUREMENTS DURATION T0 T1 T2 T3 T4 FU in months 0 3 6& 9* 12 18 COGNITIVE TASKS AT DAY 2 10 min Working memory N-back 10 X* Interference Stop/Signal task 15 X* PHYSICAL EXAMINATION AT DAY 2 30 min Body measures Weight, height 10 X Blood pr essure Systolic and diastolic 5 X HPA axis (Hair) Hair sample (cortisol) 5 X X Biomarkers Fasting blood sample (5HTTLPR, BDNF, FKBP5, oxytocin/OXTR) & Full blood 10 X X MRI SESSION IN SUBSAMPLE WITHIN 2 WEEKS 60 min"
32,page_32,"- PROSPER - Prediction and Outcome Study on PTSD and Personality disorders - Version 8, 22 June 2020 33 of 59 Functional MRI Face recognition task 15 X X Structural MRI 7 X X Resting state MRI 10 X X DTI 10 X X DTI = Diffusion Tensor Imaging, MRI = Magnetic Resonance Imaging. & Timing of the T2 measurement will be directly after trauma treatment, around 6 months * Timing of the T3 measurement will be 3 months after T2, around 9 months Table 3: Overview of duration of measurements (in minutes) T0 T1 T2 T3 T4 Follow -up Interviews 45 - 45 - 195 - Questionnaires 91 15 88 15 88 27 n-back 10 - - - - - TOTAL 141 (ca. 2.5 hrs) 15 128 (ca. 2 hrs) 15 278 (ca. 4,5 hrs) 27 Blood/hair 30 - 30 - - - MRI 90 - 90 - - - TOTAL for subgroup with MRI/blood/hair 261 (ca. 4 hrs) 15 218 (ca. 3,5 hrs) 15 278 (ca. 4,5 hrs) 27 5.2 Randomisation, blinding and treatment allocation 5.2.1 Randomization An independent central research assistant will randomize partic ipants to condition after checking all in - and exclusion criteria. Randomization will be based on block randomization (n=4 per block) per site, to guarantee a balance between conditions per site and over time. For both RCTs there will be a separate random ization procedure depending on comorbid PD diagnosis: A1. If PTSD + BPD: EMDR vs. integrated DBT - EMDR A2. If PTSD + CPD: ImRs vs. integrated SFT - ImRs."
33,page_33,"- PROSPER - Prediction and Outcome Study on PTSD and Personality disorders - Version 8, 22 June 2020 34 of 59 5.2.2 Unblinding Procedure Blinding of participants and therapists to condition is not possible as it will be clear to both therapists and patients which treatment is given. 5.3 Study procedures The study will lead to separate although integrated research projects for 3 PhDs. A1: Is EMDR treatment more effective compared to integrated DBT -EMDR i n patients with PTSD with comorbid BPD? 1. Systematic review and meta -analysis: do personality or dissociative symptoms predict effectiveness of PTSD treatment? 2. Do patients in the present study show higher response rate and effect sizes in integrated DBT -EMDR-treatment compared to EMDR -treatment alone after 12 months? 3. Is DBT -EMDR -treatment more effective as compared to EMDR -treatment alone in terms of PD symptoms, general psychiatric symptoms, disability, quality of life and health costs? 4. Do psychological (cognitive, affective, relational) factors predict (integrated DBT -) EMDRtreatment outcome? A2: Is ImRs more effective compared to integrated SFT - ImRs in patients with PTSD with comorbid CPD? 1. Systematic review and meta -analysis: do personality or diss ociative symptoms predict effectiveness of PTSD treatment? 2. Do patients in the present study show higher response rate and effect sizes in integrated SFT - ImRs -treatment compared to ImRs -treatment alone after 6 -12-18 months? 3. Is SFT - ImRs -treatment mo re effective as compared to ImRs -treatment alone in terms of PD symptoms, general psychiatric symptoms, disability, quality of life and health costs?"
34,page_34,"- PROSPER - Prediction and Outcome Study on PTSD and Personality disorders - Version 8, 22 June 2020 35 of 59 4. Do psychological (cognitive, affective, relational) factors predict (integrated SFT -) ImRs treatment ou tcome? B: Predictors of PTSD -treatment 1. Literature review: what is known on working mechanisms of PTSD treatment and do neurobiological findings predict PTSD treatment outcome? 2. Are PTSD treatments in this PTSD + PD population mainly working on increas ing extinction of fear responses? Is this associated with decreasing salience, negative affect and cognitive control network activity and connectivity? 3. Do biomarkers (ACC volume, amygdala and ventral ACC and dorsal ACC activity, and/or hormonal/epigenetic factors (5 -HTTLPR, BDNF, cortisol/FKBP5 -methylation, oxytocin/OXTR) individually predict treatment outcome of PTSD treatment? Timing of assessments Baseline (T0) visit All patients coming to the Sinai Center are asked to fill in the ROM questionn aires before the intake as part of standard care (OQ -45, LEC -5/PCL -5, SCID -5-PD screener, see Table 1). As part of the standard intake procedure at the Sinai Centre, patients who score positively on the SCID -5PD screener will be interviewed with the M.I.N. I.-plus and the SCID -5-PD. Patients with potential eligibility based on the in - and exclusion criteria described earlier receive the study information folder from the psychologist who performed the intake with them . If a patient is interested and gives th eir consent, the intaker informs the researchers to contact the patient. One of the researchers will explain the study to the possible participant and provide the information folders. After a consideration period of at least one week, they will be asked wh ether they want to take part in the research. At T0/Day 1, the study - intaker will explain the study information once more. If informed consent is obtained, in - and exclusion criteria will again be checked to assess the patient’s potential eligibility fo r participation (Dutch language, , LEC -5/PCL -5, SCID -5-PD screener ) and if the patient is included, the CAPS -5 will be performed."
35,page_35,"- PROSPER - Prediction and Outcome Study on PTSD and Personality disorders - Version 8, 22 June 2020 36 of 59 After the interview, the patients receive an online code to fill in additional questionnaires online at the center or at ho me, if the patient has access to the internet (see Table 1). Total duration of the measurements of To/Day 1 will be ca. two hours (see Table 3). At T0/Day 2, patients are invited for the physical examination (weight and height to calculate Body Mass Index (BMI), blood pressure, hair sample by a research assistant and fasting blood sample as well as questions on cigarette smoking, alcohol and coffee consumption, medication and drug use) and they will be asked to perform a working memory task (N -back -task) o utside the scanner and to fill in the last set of questionnaires (see Table 1) either at the Sinai Center or online at home. Total duration of the measurements of To/Day 2 will be ca. 40 minutes (see Table 3). Blood samples will be collected in 3 x 6ml tu bes and the frozen samples will be stored at -80°C for intended future assaying of inflammatory markers (see Coelho et al., 2014), neuropeptides (such as oxytocin, 5HT), and epigenetics (such as FKBP5 -methylation, OXTR - & 5HTTLPRgenes). The tubes will be s tored without personal data linked to it, and they will only be marked with a subject number as described in section 9.1. below. Cortisol level (HPA -indicator) will be assessed in hair. This sample can be collected non - invasively by cutting a 1 -cm distal t o the scalp (1 month’s exposure) sample of hair (Russell et al., 2012). All samples will be stored for 15 years (according to Archiefwet 1995). In a subgroup: MRI session Exclusion criteria for MRI research will be checked (metal implants, pregnancy , somatic disorders interfering with brain functioning, other (psycho -)pharmaca than at -least -3- months stabile dose SSRI or low -dose benzodiazepines, claustrophobia). A separate visit for MR scanning will be planned within 2 weeks of T0, before the start of treatment, without causing a delay in treatment start. MRI sessions take at maximum 60 minutes (30 -min functional MRI with a face recognition, and a suppression vs. reappraisal task, 5 -min structural MRI, 8 -min resting state MRI; and 8 -min DTI) plus 30 min preparation. Next to patients, 40 healthy control persons, matched for age, gender, and education, will be asked to participate in one MRI session (no repeat MRI). These healthy control persons will be recruited via advertisements in local papers."
36,page_36,"- PROSPER - Prediction and Outcome Study on PTSD and Personality disorders - Version 8, 22 June 2020 37 of 59 T1 , T3 and FU Patients do not have to come to the study center for T1, T3 and FU and can fill in the questionnaires via a login code at home if they have access to the internet (see Table 1.). Child trauma and life events questionnaires are only done at b aseline (CTQ, LEC -5). Total duration of these measurements (T1, T3 and FU) will be between 15 and 30 minutes (see Table 3). T2 visit From all participants whose blood and hair was collected at baseline, blood and hair will be collected at T2 as well (duration 30 minutes). All participants who participated in the fMRI study at baseline will have their second MRI at T2. (duration 90 minutes). At T2, the CAPS -5 will also be conducted and participants will fill out the same questionnaires as at T0, excep t for the CTQ and LEC -5. Total duration of these measurements of will be ca. 2 hours (see Table 3). Extra contact moment For participants in the trauma -treatment only group, there will be an extra moment of contact 3 months after T3, with a short remi nder about the following measurements and attention for the wellbeing of the client. T4 visit This is the same as T0, except for the informed consent procedure and except for the N-back task and physical examination and trauma questionnaires that will be done at T0 only (CTQ, LEC -5). Total duration of these measurements will be 4,5 hours (see Table 3). Treatment visits These will be scheduled as usual. For durations of specific treatments see 3."
37,page_37,"- PROSPER - Prediction and Outcome Study on PTSD and Personality disorders - Version 8, 22 June 2020 38 of 59 5.4 Withdrawal of individual subjects Subjects ca n leave the study at any time for any reason if they wish to do so, without any consequences. The principal investigators can decide to withdraw a subject from the study for urgent medical reasons. Reasons to terminate a patient’s participation include : - The patient withdraws her/his consent - The nature of the patient’s treatment is changed to coercive treatment (based on judicial ruling) - The investigator considers a patient’s continued participation in the study to be unjustifiable on medical or psych iatric grounds (i.e., because of side effects or unusual risks of the treatments). If an individual patient is discontinued due to one of the above -mentioned reasons, this patient will be treated as usual in normal daily practice. The treating physician remains the primary caregiver during the study and will be contacted at the baseline visit and updated throughout the study. The treating physician will contact the study team in cases of important changes and will be responsible to apply for legal custody if appropriate. All patients leaving the study early, regardless of the reason, will be requested to return to the site for an “early termination” visit to finalize participation. If the patient is not willing to complete all measures, priority will be g iven to the PCL -5 and OQ -45. There are no consequences if a patient also refuses this. 5.5 Replacement of individual subjects after withdrawal Not applicable. 5.6 Follow -up of subjects withdrawn from treatment Patients who drop -out out of (part of) the treatment remain in the study and will still be asked to complete the follow -up measures. Priority will be given to the online assessment with the PCL-5 and OQ -45."
