,PageNo,Text19,page_19,"Protocol VX16- 661-114 Version 3.1 US Page 20 of 56 Vertex Pharmaceuticals Incorporated 4. Any of the following abnormal laboratory values at Screening:  Abnormal liver function defined as any 2 or more of the following: ≥3 × upper limit of normal (ULN) aspartate transferase (AST), ≥3 × ULN alanine transferase (ALT), ≥3 × ULN gamma- glutamyl transpeptidase, ≥3 × ULN alkaline phosphatase (ALP), or ≥2 × ULN total bilirubin.  Abnormal liver function defined as any increase of ≥5 × ULN AST or ALT.  Abnormal renal function defined as glomerular filtration rate ≤50 mL/min/1.73 m2 (calculated by the Modification of Diet in Renal Disease Study Equation) for subjects ≥18 years of age and ≤45 mL/min/1.73 m2 (calculated by the Counahan-Barratt equation) for subjects aged 12 to 17 years (inclusive). 5. Child-Pugh Class B or C hepatic impairment 6. An acute upper or lower respiratory infection, pulmonary exacerbation, or change in therapy (including antibiotics) for pulmonary disease within 28 days before Day 1 (first dose of study drug) 7. Documentation of colonization with organisms associated with a more rapid decline in pulmonary status (e.g. Burkholderia cenocepacia , Burkholderia dolo sa, and Mycobacterium abscessus ) 8. History of lung transplantation since most recent initiation of Orkambi 9. History of alcohol or drug abuse in the past year as deemed by the investigator, including but not limited to cannabis, cocaine, and opiates 10. Participation in an investigational drug study or use of a CFTR modulator (including Orkambi) within 28 days or 5 terminal half-lives before screening of the previous investigational study drug or CFTR modulator, whichever is longer  Ongoing participation in a noninterventional study (including observational studies and studies requiring assessments without administration of study drug) is permitted. 11. Use of restricted medications or foods within the specified window before the first dose of study drug, or an anticipated need or use of restricted medication or foods after the first dose of study drug, as defined in Table 9-1 12. Pregnant or nursing females: Females of child-bearing potential must have a negative pregnancy test at Screening and Day 1 13. The subject or a close relative of the subject is the investigator or a sub-investigator, research assistant, pharmacist, study coordinator, or other staff directly involved with the conduct of the study. An adult (aged 18 years or older) who is a relative of a study staff member may be randomized in the study provided that  the adult lives independently of and does not reside with the study staff member, or  the adult participates in the study at a site other than the site at which the family member is employed."
20,page_20,"Protocol VX16- 661-114 Version 3.1 US Page 21 of 56 Vertex Pharmaceuticals Incorporated 9 STUDY IMPLEMENTATION 9.1 Study Design Study VX16-661-114 (Study 114) is a Phase 3b, randomized, double-blind, placebo-controlled, parallel group, mul ticenter study in subjects aged 12 years and older with CF who are homozygous for F508del and who discontinued treatment with Orkambi due to respiratory symptoms considered related to treatment. This study is designed to evaluate the safety and efficacy of TEZ/IVA. This study includes a Screening Period (up to 28 days), Treatment Period (approximately 56 days), and Safety Follow-up Period (approximately 28 days). Approximately 90 subjects will be stratified by age a t the Screening Visit (<18 versus ≥18 years of age) , sex (male versus female), and ppFEV 1 (determined during the Screening Visit; <40% versus ≥40% predicted) and then randomized 1:1 between the 2 study arms. Subjects who complete the Day 56 Visit will be offered the opportunity to receive TEZ/IVA through the Expanded Access Program if they meet eligibility requirements for that program. Figure 9-1 Study VX16-661-114 Design Screening 9.1 .1 Screening Visit assessments are listed in Table 3-1. Screening will occur within 28 days before administration of first dose of study drug. The investigator (or an appro priate authorized designee at the study site) will obtain informed consent/assent from each subject. 9.1.1.1 Repetition of Screening Assessment(s) Repetition of individual screening assessment(s) that did not meet eligibility criteria is not permitted with the following exceptions:  If there is clear evidence of a laboratory error (e.g., hemolyzed sample) or equipment malfunction, collection o f a repeat sample for the appropriate laboratory test or assessment may be permitted with the approval of the medical monitor. Note: Clinical visits are on Days -28, 1, 15, 28, and 56. A telephone contact on Day 3 collects AEs. The Safety Follow -up may be a clinic visit or telephone call."
21,page_21,"Protocol VX16- 661-114 Version 3.1 US Page 22 of 56 Vertex Pharmaceuticals Incorporated  Exclusionary liver function test (LFT) levels, which may be retested within 14 days of the original screening date If screening spirometry measurements fail to meet acceptability or repeatability criteria as specified by ATS/ERS guidelines6, repeat spirometry evaluation may be performed once. If repeat values of the individual assessment(s) are within the eligibility criteria and completed within the screening window, then the subject is eligible for the study. 9.1.1.2 Rescreeni ng Subjects may only be rescreened with the approval of the medical monitor. If a subject is rescreened, all screening assessments will be repeated except for CFTR genotyping, follicle-stimulating hormone (FSH) level (if serum FSH level was ≥ 40 mIU/mL during prior screening), and ophthalmologic examination. If a subject is rescreened, the screening window will begin after the first rescreening assessment has been initiated. 9.1.1.3 Extension of Screening Period Window A subject may have the Screening Period window extended by 4 weeks for the following reasons:  Repetition of the Screening Period assessments (Section 9.1.1.1)  Unexpected operational or logistic delays, or to meet the eligibility criteria  Scheduling of ophthalmologic examination (Section 11.4.7)  Repetition of spirometry assessment if results are of poor quality Treatment Period 9.1.2 The Treatment Period will last approximately 56 days. Subjects will be randomized to 1 of 2 treatment arms: TEZ/IVA or placebo. The dosing regimen for each treatment arm is shown in Figure 9-1 and is as follows:  TEZ/IVA: TEZ 100-mg/ IVA 150-mg fixed-dose combination (light yellow) film-coated tablet for oral administration (morning dose); IVA 150-mg (light blue) film-coated tablet for oral administration (evening dose)  Placebo: 0 mg film-coated matching placebo tablets for oral administration (1 light yellow for the morning dose and 1 light blue for the evening dose) The first dose of study drug will be administered after randomization on Day 1. Dosing details are given in Section 9.5. Study visits during the Treatment Period will occur as shown in Table 3-2. Subjects will be outpatients during the Treatment Period unless hospitalized for illness. All visits should occur within the windows specified. Safety Follow-up Contact 9.1.3 A Safety Follow-up Contact will be performed for the purpose of coll ecting information on AEs 28 days (±7 days) after the last dose of study drug. The assessments performed at the Safety Follow-up Contact are listed in Table 3-2. The Safety Follow-up Contact may be a telephone"
22,page_22,"Protocol VX16- 661-114 Version 3.1 US Page 23 of 56 Vertex Pharmaceuticals Incorporated interview; however, if deemed necessary by the investigator, a Safety Follow-up Visit may be required with necessary assessments to be determined by the investigator. Subjects who prematurely discontinue treatment may not be required to have a Safety Follow-up Contact; refer to Section 9.1.4 for details. Early Termi nation of Treatment 9.1.4 If a subject prematurely discontinues study treatment, an Early Termination of Treatment (ETT) Visit should be scheduled as soon as possible after the subject decides to terminate study treatment. These subjects will also be required to complete a Safety Follow-up Contact 28 days (± 7 days) after their last dose of study drug. If the ETT Visit occ urs 3 weeks or later following the last dose of study drug, then the ETT Visit will replace the Sa fety Follow-up Contact, and a separate Safety Follow-up Contact will not be required. If a subject withdraws consent for the study, no further visits will be required (including an ETT or Safety Follow-up Contact), no further evaluations will be performed, and no additional data will be collec ted. Vertex may retain and continue to use any data collected before such withdrawal of consent. Independent Data Monitoring Committee 9.1.5 An IDMC will be formed for this study. The safety and tolerability data will be reviewed by an IDMC to ensure the safety of the subjects in the study. Procedural details of the IDMC's structure and function, frequency of meetings, and data planned for review will be included in the IDMC charter. The IDMC charter will be finalized before the first subject is screened. 9.2 Rationale for Study Design and Study Drug Regimens Study Design 9.2.1 A randomized, double-blind study design will avoid observer bias and reduce symptoms or outcomes arising from the subjects' knowledge of treatment. Subjects will be r andomized to receive TEZ in combination with IVA, or a matched placebo regimen. All subjects enrolled in the study will continue their normal, stable treatment for CF symptoms throughout the study. Orkambi is the onl y therapy approved for subjects homozygous for the F508del-CFTR mutation that targets the underlying cause of CF. TEZ, an experimental CFTR corrector, in combination with IVA, is currently being evaluated in several Phase 3 studies in subjects who are both homozygous for F508del and heterozygous for F508del with other CFTR mutations. Scheduled IDMC reviews of each of the TEZ/IVA Phase 3 studies are completed and did not reveal any safety signals. Since subjects entering this study are not taking corrector/potentiator therapy, the use of placebo in this study is deemed ethical and necessary to adequately assess the benefit of treatment with TEZ in combination with IVA. Study 114 is designed to compare active treatment with TEZ 100 mg daily (qd)/IVA 150 mg every 12 hours (q12h) with a matched placebo treatment for 8 weeks. The 8-week duration was selected to all ow ad equate exposure to TEZ/IVA to assess both the safety and efficacy of the treatment. This is appropriate because patients who have respiratory AEs with Orkambi typically do so within the first wee k of exposure, and a significant response in ppFEV 1 is expected after"
23,page_23,"Protocol VX16- 661-114 Version 3.1 US Page 24 of 56 Vertex Pharmaceuticals Incorporated 14 to 28 days of treatment with TEZ/IVA. In addition, the 8-week duration was selected to allow a robust assessment of the durability of response that will be less affected by short-term variability in ppFEV 1, and to facilitate the demonstration of significant changes in secondary endpoints, including CFQ-R. Study Drug Dose 9.2.2 The dose regimen of TEZ chosen for continued development in Phase 3 was evaluated in Study 101, a Phase 2 study in 2 CF populations: one that was homozygous for F508del and one that was heterozygous for F508del and G551D . The dose regimen of TEZ 100 mg qd in combination with IVA 150 mg q12h provided clinically meaningful and statistically significant improvements in pp FEV 1 in both populations. Pivotal Phase 3 studies are ongoing; therefore, results are not known. Rationale for Study Assessments 9.2.3 Safety assessments are standard parameters for clinical studies in drug development. The efficacy assessments are widely accepted and generally recognized as reliable, accurate, and relevant to the study of patients with CF. Spirometry: Since lung disease is the major cause of morbidity and mortality for patients with CF, CF lung disease is the desired primary target of TEZ/IVA cotherapy. Spirometry is the most widely implemented standardized assessment to evaluate lung function. Predose and postdose spirometry assessments must be performed in all subjects according to the Schedule of Assessments (Table 3-1 and Table 3-2). CFQ- R: The CFQ-R is a frequently used CF-specific instrument that measures the health-related quality of life of patients with CF.7-9As both IVA alone and TEZ/IVA are systemic therapies, they have the potential to improve not only respiratory symptoms but other extrapulmonary manifestations of CF as well. These improvements can be captured by the non-respiratory symptoms domains of the CFQ-R. The adolescent/adult version, the parent/caregiver version, and the child version measure quality-of-life domains, including respiratory symptoms, digestive symptoms, emotion, and health perception. Linguistically validated versions of the CFQ-R10, 11 are available, thereby allowing consistent interpretation of the results in this global study. The CFQ-R will be used to capture and evaluate the impact of TEZ/IVA on patient reports of respiratory symptoms and other aspects of health-related quality of life. 9.3 Study Restrictions Prohibited medications and certain foods are not allowed in this study (Screening Period through the Safety Follow-up Contact) (Table 9-1). Both TEZ and IVA are metabolized predominantly via the hepatic enzymatic pathway using CYP3A4. Therefore, the use of known moderate and strong inducers and inhibitors of CYP3A, which have the potential to significantly alter the exposure of TEZ and IVA, will be restricted in this study. A non-exhaustive list of study prohibitions and cautions for food and medication will be provided in the Study Reference Manual."
24,page_24,"Protocol VX16- 661-114 Version 3.1 US Page 25 of 56 Vertex Pharmaceuticals Incorporated Table 9-1 Study Restrictions Restricted Medication/Food Study Period Screening Period Treatment Period Certain fruits and fruit juices (Grapefruit, grapefruit juice, Seville oranges, marmalade) None allowed within 14 days before the first dose of study drug None allowed through the Safety Follow -up Contact Moderate and strong CYP3A inducers None allowed within 14 days before the first dose of study drug None allowed through the Safety Follow -up Contact Moderate and strong CYP3A inhibitors (except ciprofloxacin) None allowed within 14 days before the first dose of study drug None allowed through the Safety Follow -up Contact Commercially available CFTR modulators (e.g., Kalydeco, Orkambi, or others) None allowed within 28 days or 5 terminal half -lives before screening, whichever is longer None allowed through the Safety Follow -up Contact CFTR: cystic fibrosis conductance regulator; CYP: cytochrome P450 Note: The use of restricted medication by subjects with medical needs will be addressed on a case -by-case basis with the medical monitor. 9.4 Prior and Concomitant Medications Information regarding all prior and concomitant medications, including the subject's CF medications, other medications, and herbal and naturopathic remedies administered from 28 days before the Screening Visit through the Safety Follow-up Contact, if applicable, will be recorded in each subject's source documents. For subjects who are screened but are not subsequently randomized in the study, details of prior medication will only be documented in the subjects' source documents.  Subjects must remain on a stable medication regimen for their CF from screening through the Safety Follow -up Contact; this includes supplements and inhaled antibiotics. A stable medication regimen is defined as the current medication regimen for CF that subjects have been following for at least 28 days before Day 1. Any potential exceptions to this must be discussed and approved by the Vertex medical monitor. Guidelines for a stable inhaled antibiotic regimen for CF are as follows: • Subjects who are taking daily inhaled tobramycin or other chronically inhaled antibiotics should remain on that drug at the current regimen throughout the study. • Subjects who are on inhaled cycling antibiotics should continue on their current schedule. The timing of the first dose of study drug should be synchronized as closely as possible to the first day of inhaled cycling antibiotics. • Subjects who alternate 2 different antibiotics monthly should remain on the same schedule during the study. The timing of the first dose of study drug should be synchronized as closely as possible to the first day of either of the inhaled antibiotics.  There are no restrictions on the concomitant use of corticosteroids.  Information about bronchodilator use during the study will be collected and documented. Subjects who are using a bronchodilator must have their spirometry assessments performed according to the guidelines provided in Section 11.3.1."
25,page_25,"Protocol VX16- 661-114 Version 3.1 US Page 26 of 56 Vertex Pharmaceuticals Incorporated 9.5 Administration Study drug tablets will be administered orally. Subjects will swallow the study drug whole, and will not chew the drug before swallowing. Study drug tablets will be administered orally. Subjects wi ll receive the same number of tablets each day to maintain the blind. Refer to Table 9-2. Table 9-2 Study Drug Administration - Treatment Period Treatment Arm Time Drug(s) and Dose(s) Administered Route of Administration TEZ/IVA AM TEZ 100 -mg/IVA 150 -mg fixed -dose tablet oral PM IVA 150 -mg tablet oral Placebo AM TEZ/IVA -matching placebo tablet oral PM IVA-matching placebo tablet oral AM: morning; IVA: ivacaftor; TEZ: tezacaftor; PM: evening. Study drug administration guidelines: 1. Study drug should be administered within 30 minutes after starting a fat-containing meal, such as a sta ndard CF high-fat, high-calorie meal or snack. It is recommended that study drug be administered after the start of and before the end of a meal, and that the duration of each meal associated with study drug intake (i.e., breakfast and dinner/snack, as applicable) should not exceed 30 minutes. 2. On days with no scheduled clinic visits, study drug should be administered q12h (± 2 hours). F or each subject, all doses (morning [TEZ/IVA] and evening [IVA], or matching placebo) of study dru gs will be taken at approximately the same time each day. For example, if the morning dose is taken at 08:00 every morning, the evening dose should be taken at 20:00 every evening (but it could be taken between 18:00 and 22:00). 3. On days of scheduled visits, the morning dose of study drug will be administered at the site after predose assessments have been completed. The meal or snack will be provided by the site for the morning dose of study drug. 4. If a subject's scheduled visit is to occur in the afternoon, the following guidelines must be used:  If the dose in the clinic will be within 6 hours of the subject's scheduled morning dose, the subject should wit hhold their morning dose of study drug and the morning dose will be administered in the clinic.  If the dose in the clinic will be more than 6 hours after the subject's scheduled morning dose, the subject shou ld take the morning dose at home and the evening dose will b e administered in the clinic. In this event, all assessments will be collected relative to the evening dose. 5. For visits after the Day 1 Visit, subjects will be instructed to bring all used and unused materials assoc iated with study drug to the site; study drug will be dispensed at each visit, as appropria te."
26,page_26,"Protocol VX16-661-114 Version 3.1 US Page 27 of 56 Vertex Pharmaceuticals Incorpor ated 9.6 Dose Modificat ion for Toxicity Dosages of TEZ or IVA cannot be changed, but the investigator can interr upt or stop treatment. 9.7 Study Drug interruption If study drug dosing must be interrupted for more than 72 hours, the medical monitor must be notified. In these instances, study drug dosing may only resume after approval by the medical monitor. Specific instructions for interruption due to elevated LFT levels are provided in Section 11.4.6. It is recommended that study drug should not be interrupted during a pulmonary exacerbation unless, in the opinion of the inve stigator, it would be in the be st interest of the subject. 9.8 Missed Doses If a subject misses a dose and recalls the missed dose within 6 hours, the subject should take his/her dose with food. If more than 6 hours have elapsed after his/her usual dosing time, the subject should skip that dose and resume hi s/her normal schedule for the following dose. For example,  if the morning dose of study drug should have been taken at approximately 08:00, and the subject remembers at 12:00 that he/she forgot to take his/her dose, he/she should take the dose with food as soon as possible.  if the morning dose of study drug should have been taken at approximately 08:00, and more than 6 hours have elapsed beyond the scheduled dosing time (i.e., the time is past 14:00), the subject would resume dosi ng with the evening dose at approximately 20:00. 9.9 Removal of Subjects Subjects may withdraw from the study at any time at their own request. Subjects may be withdrawn from study drug treatment at any time at the discretion of the in vestigator or Vertex for safety, behavior, noncompliance with study proce dures, or administrative reasons. If a subject has been withdrawn from study drug treatment, the subject should continue to be followed, provided the subject has not withdrawn consent. If a subject does not return for a scheduled visit, reasonable effort will be made to contact the subject. In any circumstance, reasonable effort will be made to document the subject’s outcome. The investigator will inquire about the reason for withdrawal, request that the subject return all unused investigational product(s), request that the s ubject return for an ETT and/or Safety Follow-up Contact, if applicable (Section 9.1.3, Section 9.1.4), a nd follow up with the subject regarding any unresolved AEs. If the subject withdraws consent, no further visi ts will be required (including an ETT or Safety Follow-up Contact), no further evaluations will be performed, and no additional data will be collected. Vertex may retain and continue to use any data collect ed before such withdrawal of consent."
27,page_27,"Protocol VX16-661-114 Version 3.1 US Page 28 of 56 Vertex Pharmaceuticals Incorpor ated The investigator should i nquire about the reason for withdrawal of consent. Subjects must return all unused study drug. A subject will be withdrawn from study drug treatment for any of the following reasons:  A female subject or a female partner of a male subject has a confirmed pregnancy.  Treatment unblinding by the investigator.  Development of a life-threaten ing AE or a serious AE (SAE) that places him/her at immediate risk, and discontinua tion of study drug treatment and withdrawal from the study are deemed necessary.  Following randomization, the screening CFTR genotype results does not confirm study eligibility. The subject will undergo ETT and/or Safety Follow-up Contact per Section 9.1.3 and Section 9.1.4, and will then be discontinued from the study. After discontinuation of study drug treatment, the subject will not underg o any further assessments other than those performed at the ETT and/or Safety Follow-up Contact. A subject may be withdrawn from study drug treatment after a discussion between the investigator and the medical monitor for any of the following reasons:  Development of a medical condition that re quires prolonged concomitant therapy with a prohibited medication or prolonged interruption of the study drug.  Noncompliance with study requirements.  An increase in liver function studies according to evaluations and management described in Section 11.4.6.  Development of a catar act or lens opacity. 9.10 Replacement of Subjects Subjects who withdraw or are withdrawn during the study drug tr eatment period(s) will not be replaced. 10 STUDY DRUG INFORMATION AND MANAGEMENT 10.1 Preparation and Dispensing Study drug may be dispensed only under the supervis ion of the investigator or an authorized designee and only for administra tion to the study subjects. 10.2 Method of Assigning Subj ects to Treatment Groups An interactive web response system (IWRS) will be used to assign subjects to treatment. Randomization may occur on Day -1. Detailed instructions for randomization will be provided separately."
