,PageNo,Text50,page_50,"- PROSPER - Prediction and Outcome Study on PTSD and Personality disorders - Version 8, 22 June 2020 51 of 59 Beck AT, Stee r RA, Garbin MG J (1988). ""Psychometric properties of the Beck Depression Inventory Twenty -five years of evaluation"". Clin. Psych. Review. 8: 77 –100. doi:10.1016/0272 -7358(88)90050 -5. Bernstein DP, Stein JA, Newcomb MD, Walker E, Pogge D, Ahluvalia T, Stokes J, Handelsman L, Medrano M, Desmond D, Zule W (200 3). Development and validation of a brief screenin g version of the Childhood Trauma Questionnaire. Child Abuse & Neglect, 27: 169–190. Bernstein EM & Putnam FW (1986). Development, reliability, and validity of a dissociation scale. Journal of Nervous & Mental Disease, 174: 727 -735. Bisson J, Andrew M. Psychological treatment of post -traumatic stress disorder (PTSD). Cochrane Database of Systematic Reviews 2007, Issue 3. Art. No.: CD003388. DOI: 10.1002/14651858.CD003388.pub3. Bisson JI, Roberts NP, Andrew M, Cooper R, Lewis C. Psychological thera pies for chronic post -traumatic stress disorder (PTSD) in adults. Cochrane Database of Systematic Reviews 2013, Issue 12. Art. No.: CD003388. DOI: 10.1002/14651858.CD003388.pub4. Bohus M, Dyer AS, Priebe K, Kruger A, Kleindienst N, Schmahl C, Niedtfeld I, Steil R (2013). Dialectical behaviour therapy for posttraumatic stress disorder after childhood sexual abuse in patients with and without borderline personality disorder: A ra ndomised controlled trial. Psychotherapy and Psychosomatics, 82(4): . Böttche M , Kuwert P , Pietrzak RH , Knaevelsrud C (2016). Predictors of outcome of an Internet -based cognitive -behavioural therapy for post -traumatic stress disorder in older adults. Psychol Psychother; 89(1): 82 -96. doi: 10.1111/papt.12069. Bovin MJ, Marx BP, Weathers FW, Gallagher MW, Rodriguez P, Schnurr PP, Keane TM. (2016). Psychometric properties of the PTSD Checklist for Diagnostic and Statistical Manual of Mental Disorders -Fifth Edition (PCL -5) in veterans. Psychol Assess.;28(11):1379 -1391. Bradley R, Greene J, Russ E, Dutra L, Westen D (2005). A multidimensional meta -analysis of psychotherapy for PTSD. Am J Psychiatry. 2005; 162(2): 214 –227. Breslau N, Kessler RC, Chilcoat HD, Schult z LR, Davis GC, & Andreski P (1998). Trauma and posttraumatic stress disorder in the community: The 1996 Detroit Area Survey of Trauma. Archives of General Psychiatry, 55(7), 626_632. Brewin, C.R., Andrews, B., Valentine, J.D & Kendall, P.C. (2000). Met a-Analysis of Risk Factors for Posttraumatic Stress Disorder in Trauma Exposed Adults. Journal of Consulting and Clinical Psychology, 68, 5. 748 -766. Bryant RA, Felmingham K, Kemp A, Das P, Hughes G, Peduto A, Williams LM (2008a). Amygdala and ventral a nterior cingulated activation predicts treatment response to cognitive behaviour therapy for post -traumatic stress disorder. Psychol Med. 38:555 -561 Bryant RA, Felmingham K, Whitford TJ, Kemp, A, Dip GH, Peduto A, Williams LM (2008b). Rostral anterior c ingulate volume predicts treatment response to cognitive -behavioural therapy for posttraumatic stress disorder. J Psychiatry Neurosci.; 33(2):142 -6."
51,page_51,"- PROSPER - Prediction and Outcome Study on PTSD and Personality disorders - Version 8, 22 June 2020 52 of 59 Bullmore, E, & Sporns, O (2009). Complex brain networks: graph theoretical analysis of structural and fu nctional systems. Nature reviews. Neuroscience, 10(3), 186 -198. Buysse DJ, Reynolds CF, Monk TH, Berman SR, Kupfer DJ (1989). The Pittsburgh sleep quality index: A new instrument for psychi atric practice and research . Psychiatry Researc h, 28 (2 ), 193 –213. http://dx.doi.org/10.1016/0165 -1781(89)90047 -4 Chard KM (2005). An evaluation of cognitive processing therapy for the treatment of posttraumatic stress disorder related to childhood sexual abuse. Journal of Consulting and Clinical Psychology, 73, 965-971. Clarke SB, Rizvi SL, Resick PA (2008). Borderline personality characteristics and treatment outcome in cognitive -behavioral treatments for PTSD in female rape victims. Behav Ther. 39(1):72 –8. Cloitre M, Stovall -McClough CK, Miranda R, Chemtob, CM (2004). Therapeutic Alliance, Negative Mood Regulation, and Treatment Outcome in Child Abuse -Related Posttraumatic Stress Disorder. Journa l of Consulting and Clinical Psychology 72(3), 411 -416. http://dx.doi.org/10.1037/0022 -006X.72.3.411 Cloitre, M., Stovall -McClough, K. C., Nooner, K., Zorbas, P., Cherry, S., Jackson, C. L., et al. (2010). Treatment for PTSD related to childhood abuse: A randomized controlled trial. American Journal of Psychiatry, 167, 915 -924. Cloitre M, Petkova E, Wang J & Lu Lassell F (2012). An examination of the influence of a sequential treatment on the course a nd impact of d issociation among women with PTSD related to childhood abuse. Depression and Anxiety, 29, 709 -717. doi: 10.1002/da.21920 Cloitre, M., Shevlin, M., Brewin, C. R., Bisson, J. I., Roberts, N. P., Maercker, A., ... & Hyland, P. (2018). The Internatio nal Tra uma Questionnaire: development of a self ‐report measure of ICD ‐11 PTSD and complex PTSD. Acta Psychiatrica Scandinavica , 138(6), 536 -546. Coelho R, Viola TW, Walss -Bass C, Brietzke E, Grassi -Oliveira R (2014). Childhood maltreatment and inflammatory marke rs: a systematic review. Acta Psychiatrica Scandinavia 1 29: 180 -192. Dickie EW, Brunet A, Akerib V, Armony JL. 2011. Neural correlates of recovery from post -traumatic stress disorder: A longitudinal fMRI investigation of memory encoding. Neuropsychologi a. 49(7);1711 -1778 Distel MA , Moor MHM de , Boomsma DI (2009). Nederlandse vertaling van de Personality Assessment Inventory - Borderline kenmerken schaal (PAI -BOR): normgegevens, factorstructuur en betrouwbaarheid. Psychologie en gezondheid, 37(1): 38 -46. Doehrmann O , Ghosh SS , Polli FE , Reynolds GO , Horn F , Keshavan A , Triantafyllou C , Saygin ZM , Whitfield -Gabrieli S , Hofmann SG , Pollack M , Gabrieli JD (2013). Predicting treatment response in social anx iety disorder from functional magnetic resonance imaging. JAMA Psychiatry 70(1):87 -97. doi: 10.1001/2013.jamapsychiatry.5. Dorrepaal E, Thomaes K, Smit JH, van Balkom AJ, Veltman DJ, Hoogendoorn AW, Draijer N (2012) . Stabilizing group treatment for complex posttraumatic stress disorder related to child abuse based on psychoeducation and cognitive behavioral therapy: a mul tisite randomized controlled trial. Psychotherapy and Psychosomatics, 81(4) : 217 -25. doi: 10.1159/000335044."
52,page_52,"- PROSPER - Prediction and Outcome Study on PTSD and Personality disorders - Version 8, 22 June 2020 53 of 59 Dorrepaal E/Thomaes K, Van Balkom AJLM, Veltman DJ, Hoogendoorn AW, Draijer N (2014). Evidence based treatment for adult women with child abuse related Complex PTSD: a quantitative review. European Journal of Psychotrau matology, 5: 23613 http://dx.doi.org/10.3402/ejpt.v5.23613 Ehlers, A., Clark, D.M., Hackmann, A., McManus, F., & Fennell, M.J.V. (2005) . Cognitive therapy for post -traumatic stress disorder: Development and evaluation. Behaviour Research and Therapy, 43, 413 -431. Ehring T, Welboren R, Morina N, Wicherts JM, Freitag J & Emmelkamp PMG (2014). Meta -analysis of psychological treatments fo r posttraumatic stress disorder in adult survivors of childhood abuse. Clinical Psychology Review, 34(8), 645 -657. Falconer E. Allen A, Felmingham KL, Williams LM, Bryant RA (2013). Inhibitory neural activity predicts response to cognitive -behavioral therapy for posttraumatic stress disorder. J Clin Psychiatry. 74;895 -901 Fassbinder E, Schweiger U, Martius D, Brand -de Wilde O and Arntz A (2016). Emotion regulation in schema therapy and dialectical behavior therapy. Front Psychol 7:1373. Doi: 10.3389/ fpsyg.2016.01373 Feeny NC, Zoellner LA, Foa EB (2002). Treatment outcome for chronic PTSD among female assault victims with borderline persona lity characteristics: a preliminary examination. J Personal Disord. 16(1):30 –40 Forbes D, Creamer M, Allen N , Elliott P, McHugh T, Debenham P, Hopwood M (2002) . The MMPI -2 as a predictor of symptom change following treatment for posttraumatic stress disorder. J Pers Assess 79(2): 321 -36. Forbes D, Creamer M, Hawthorne G, Allen N, McHugh T (2003) . Comorbidity as a predictor of symptom change after treatment in combat -related posttraumatic stress disorder. J Nerv Ment Dis, 191(2):93 -9. Forbes D, Parslow R, Fletcher S, McHugh T, Creamer M (2010) . Attachme nt style in the prediction of recovery following group treatment of combat veterans with post -traumatic stress disorder. J Nerv Ment Dis 198(12): 881 -4. doi: 10.1097/NMD.0b013e3181fe73fa. Ford JD & Kidd P (1998). Early childhood trauma and disorders of extreme stress as pred ictors of treatment outcome with chronic posttraumatic stress disorder. J Trauma Stress 11(4):743 -61. Frías A & Palma P (2015). Comorbidity between Post -Traumatic Stress Disorder and Borderline Personality Disorder: A Review Psychopathology; 48: 1 –10 D OI: 10.1159/000363145 . Galatzer -Levy IR, Ma S, Statnikov A, Yehuda R, Shalev AY (2017). Utilization of machine learning for prediction of post -traumatic stress: a re-examination of cortisol in the prediction and pathways to non -remitting PTSD. Transla tional Psychiatry 7, e1070; doi:10.1038/tp.2017.38; published online 21 March 2017. Giesen -Bloo, J., van Duyck, R., Spinhoven, Ph., e.a. (2006). Outpatient psychotherapy for borderline personality disorder: randomize d trial of schema -focused vs transfer ence -focused psychotherapy. Archives of General Psychiatry, 63, 649 -658."
53,page_53,"- PROSPER - Prediction and Outcome Study on PTSD and Personality disorders - Version 8, 22 June 2020 54 of 59 Gratz KL & Roemer L (2004). Multidimensional assessment of emotion regulation and dysregulation: Development, factor structur e, and initial validation of the difficulties in emotio n regulation scale. Journal of Psychopathology and Behavioral Assessment. 26: 41 –54. (Erratum published December 2008, Journal of Psychopathology and Behavioral Assessment, 30, 315). Griffin DW & Bartholomew K (1994). The metaphysics of measurement: Th e case of adult attachment. Advances in Personal Relationships, 5: 17 -52. Gunderson JG, Stout RL, McGlashan TH, Shea MT, Morey LC, Grilo CM, Zanarini MC, Yen S, Markowitz JC, Sanislow C, Ansell E, Pi nto A, Skodol AE (2011). Ten -year course of borderline personality disorder. Archives of General Psychiatry, 68(8): 827 -837. Guy W, editor (1976). ECDEU Assessment Manual for Psychopharmacology. Rockville, MD: US Department of Heath, Education, and Welfare Public Health Service Alcohol, Drug Abuse, and M ental Health Administration. Hagenaars MA , van Minnen A , Hoogduin KA (2010). The impact of dissociation and depression on the efficacy of prolonged exposure treatment for PTSD. Behav Res Ther. 48(1):19 -27. doi: 10.1016/j.brat.2009.09.001. Hakkaart -van Roijen L van, van Straten A, Ti emens B, & Donker MCH (2002). Handleiding Trimbos / iMTA questionnaire for costs associated with psychiatric illness (Tic -P). Retrieved from http://hdl.han dle.net/1765/133 7 Harned MS, Korslund KE, Linehan MM (2014) . A pilot randomize d controlled trial of Dialectical Behavior Therapy with and without the Dialectical Behavior Therapy Prolonged Exposure protocol for suicidal and self -injuring women with borderline personality disorder and PTSD. Behav Res Ther. 55: 7 –17. doi: 10.1016/j.brat.2014.01.008 Hembree EA, Cahill SP, Foa EB (2004). Impact of personality disorders on treatment outcome for female assault survivors with chronic posttraumatic stress disorder. J Personal Disord. 18(1):117 – 27. Heuvel OA van den, van Wingen G, Soriano -Mas C, Alonso P, Chamberlain SR, Nakamae T, Denys D, Goudriaan AE, Veltman DJ (2016). Brain circuitry of compulsivity. Eur Neuropsychopharmacol; 26(5):810 -27. doi: 10.1016/j.euroneuro.2015.12. 005. Horvath, A.O., & Greenberg, L.S. (1989). Development and validation of the Working Alliance Inventory. Journal of Counseling Psychology, 36, 223 -233. Hyland, P., Shevlin, M., Brewin, C. R., Cloitre, M., Downes, A. J., Jumbe, S., ... & Roberts, N . P. (2017). Validation of post ‐traumatic stress disorder (PTSD) and complex PTSD using the International Trauma Questionnaire. Acta Psychiatrica Scandinavica , 136(3), 313 -322. Jacobson NS, Truax P (1991). Clinical significance: a statistical approach to defining meaningful change in psychotherapy. J Consult Clin Psychol 59: 12 –19. John OP, Gross JJ (2004) . Healthy and unhealthy emotion regulation: personality processes, individual differenc es, and life span development. J Pers; 72(6):1301 -33. Review."
54,page_54,"- PROSPER - Prediction and Outcome Study on PTSD and Personality disorders - Version 8, 22 June 2020 55 of 59 Jong K De, Nugter A, Pollak M, Wagenborg H, Spinhoven P, & Heiser W (2008). De Nederlandse versie van de outcome questionnair e: een cross -culturele validatie. Psychologie en gezondheid, 36, 35 -45. Jongh A de & Ten Broeke E (2003). Handboek EMDR: een g eprotocolleerde behandelmethode voor de gevolgen van psychotrauma. Pearson, Amsterdam. Karatzias A , Power K , McGoldrick T , Brown K , Buchanan R , Sharp D , Swanson V (2007). Predicting treatment outcome on three measures for post -traumatic stress disorder. Eur Arch Psychiatry Cl in Neurosci 257(1): 40 -6. Karatzias, T., Shevlin, M., Fyvie, C., Hyland, P., Efthymiadou, E., Wilson, D., ... & Cloitre, M. (2016). An initial psychome tric assessment of an ICD-11 based measure of PTSD and complex PTSD (ICD -TQ): Evidence of construct va lidity. Journal of Anxiety Disorders , 44, 73-79. Kennis M , van Rooij SJ , Tromp do PM , Fox AS , Rademaker AR , Kahn RS , Kalin NH , Geuze E (2015). Treatment Outcome -Related White Matter Differences in Veterans with Posttraumatic Stress Disorder. Neuropsychopharmacology 40(10): 2434 -42. doi: 10.1038/npp.2015.94. Kleindienst N , Priebe K , Görg N , Dyer A , Steil R , Lysse nko L , Winter D , Schmahl C , Bohus M (2016). State dissociation moderates response to dialectical behavior therapy for posttraumatic stress disorder in women with and without borderline personality d isorder. Eur J Psychotraumatol. 7:30375. doi: 10.3402/ejpt.v7.30375. Kliem S , Kröger C , Kosfelder J (2010). Dialectical behavior therapy for borderline personality disorder: a meta -analysis using mixedeffects modeling. J Consult Clin Psychol. 2010 Dec; 78(6):936 -51. doi: 10.1037/a0021015. Kredlow MA , Szuhany KL , Lo S , Xie H , Gottlieb JD , Rosenberg SD , Mueser KT (2017). Cognitive behavioral therapy for posttraumatic stress disorder in individuals with severe mental illness and borderline personality disorder. Psychiatry Res; 249: 86 -93. doi: 10.1016/j.psychres.2016.12.045. [Epub ahead of print] Landelijke Stuurgroep Multidisciplinaire Richtlijnontwikkeling (2008). M ultidisciplinaire Richtlijn Persoonlijkheidsstoornissen, Trimbos Instituut, Utrecht. Lanius RA, Vermetten E, Loewenstein RJ, Brand B, Schmahl C, Bremner JD, Spiegel D (2010) . Emotion modulati on in PTSD: Clinical and neurobiological evidence for a dissociative subtype. American Journal of Psychiatry, 167(6): 640 -7. Leichsenring F & Leibing E (2003). The effectiveness of psychodynamic therapy and cognitive behavior therapy in the treatment of personality disorders: a meta -analysis. American Journal of Psych iatry, 160: 1223 -1232. Lenha rd, F , Sauer, S, Andersson, E, Månsson, K N, Mataix ‐Cols, D, R ück, C, & Serlachius, E (2017). Prediction of outcome in internetdelivered cognitive behaviour therapy for paediatric obsessive‐compulsive disorder: A machine learning approach. International Journal of Methods in Psychiatric Research."
55,page_55,"- PROSPER - Prediction and Outcome Study on PTSD and Personality disorders - Version 8, 22 June 2020 56 of 59 Linehan M (1993). Cognitive -Behavioral Treatment of Borderline Personality Disorder. The Guilford Press, New York, USA. Lloyd D, Nixon RD, Varker T, Elliott P, Perry D, Bryant RA, Creamer M, Forbes D (2014) . Comorbidity in the prediction of Cognitive Processing Therapy treatment outcomes for combat -related posttraumatic stress disorder. J Anxiety Disord 28(2): 237 -40. doi: 10.1016/j.janxdis.2013.12.002. Månsson KN , Frick A , Boraxbekk CJ , Marquand AF , Williams SC , Carlbring P , Andersson G, Furmark T (2015). Predicting long -term outcome of Internet -delivered cognitive behavior therapy for social anxiet y disorder using fMRI and support vector machine learning. Transl Psychiatry 5:e530. doi: 10.1038/tp.2015.22. McDonagh A, Friedman M, McHugo G, Ford J, Sengupta A, Mueser K, et al (2005). Randomized trial of cognitive -behavioral therapy for chronic po sttraumatic stress disorder in adult female survivors of childhood sexual abuse. J Consult Clin Psychol 73: 515 -24. Minnen A van, Arntz A, Keijsers GP (2002) . Prolonged exposure in patients with chronic PTSD: predictors of treatment outcome and dropout. Behav Res Ther 40(4): 439 -57. Minnen A van, van der Vleugel BM, van den Berg DP, de Bont PA, de Roos C, van der Gaag M, de Jongh A (2016) . Effectiveness of trauma -focused treatment for patients with psychosis with and without the dissociative subtype of po st-traumatic stress disorder. Br J Psychiatry 209(4): 347 -348. Munro ML, Brown SL, Pournajafi -Nazarloo H, Carter CS, Lopez WD, Seng JS (2013). In search of an adult attachment stress provocation to measure effct on the oxytocin system: A pilot validati on study. Journal of the American Psychiatric Nurses Association, 19: 180 -191. Nijdam MJ. de Vries G -J, Gersons BP (2015). Response to psychotherapy for posttraumatic stress disorder: the role of pre -treatment verbal memory performance. J Clin Psychia try 76(8):e770 –e775. Pedersen SH, Poulsen S, Lunn S (2014) . Affect regulation: holding, containing and mirroring. Int J Psychoanal 95(5): 843 -64. doi: 10.1111/1745 -8315.12205. Penninx BWJH, Nolen WA, Lamers F, Zitman FG, Smit JH, Spinhoven P, Cuijpers P, de Jong PJ, Marwijk HWJ van, Meer K van der, Verhaak P, La urant MGH, de Graaf R, Hoogendijk WJ, Wee N van der, Ormel J,Dyck R van, Beekman ATF (2011). Two -year course of depressive and anxiety disorders: Results from the Netherlands Study of Depression and Anxiety (NESDA). Journal of Affective Disorders 133: 76 –85. First MB, Williams JBW, Smith Benjamin L, Spitzer RL (2016). Structured Interview for DSM -5 Personality Disorders (SCID -5-PD), Washington DC: American Psychiatric Press Incorporated. Price M, Kearns M, Houry D, Rothbaum BO (2014). Emergency Department Predictors of Posttraumatic Stress Reduction for TraumaExposed Individuals With and Without an Early Intervention. J Consult Clin Psychol. 2014 April ; 82(2): 336 –341. doi:10.1037/a0035537."
56,page_56,"- PROSPER - Prediction and Outcome Study on PTSD and Personality disorders - Version 8, 22 June 2020 57 of 59 Raabe S, Ehring T, Marquenie L, Olff M, Kindt M (2015). Imagery Rescripting as stand -alone treatment for posttraumatic stress disorder related to childhood abuse. J. Behav. Ther. & Exp. Psychiat. 48:170 -176. Redlich, R, Opel, N, Grotegerd, D, Dohm, K, Zaremba, D, Bürger, C, ... & Arolt, V.(2016). Prediction of individual response to electroconvulsive therapy via machine learning on structural magnetic resonance imaging data. JAMA psychiatry, 73(6), 557 -564. Resick PA, Suvak MK, Johnides BD, Mitchell KS & Iverson KM (2012). The impact of dissociation on PTSD treatment with cognitive processing therapy. Depression and Anxiety, 29, 718 -730. doi: 10.1002/da.21938 Rizvi SL, Vogt DS, Resick PA (2009) . Cognitive and affective predictors of treatment outcome in Cognitive Processing Therapy and Prolonged Exposure for posttraumatic stress disorder. Behav Res Ther 47(9):737 -43. doi: 10.1016/j.brat.2009.06.003. Roberts BW , Luo J , Briley DA, Chow PI , Su R , Hill PL (2017). A Systematic Review of Personality Trait Change Through Intervention. Psychol Bull. 2017 Jan 5. doi: 10.1037/bul0000088. [Epub ahead of print]. Ronconi, J. M., Shiner, B., & Watts, B. V. (2015). A Meta -Analysis of Depressive Symptom Outcomes in Randomized, Controlled Trials for PTSD. The Journal of nervous and mental disease, 203(7), 522 -529. Rooij SJ van, Kennis M , Sjouwerman R , van den Heuvel MP , Kahn RS , Geuze E . (2015a). Smaller hippocampal volume as a vulnerability factor for the persistence of post -traumatic stress disorder. Psychol Med. 45(13):2737 -46. doi: 10.1017/S0033 291715000707. Rooij SJ van, Geuze E , Kennis M , Rademaker AR , Vink M . (2015b). Neural correlates of inhibition and contextual cue processing related to treatment response in PTSD. Neuropsychopharmacology; 40(3): 667 -75. doi: 10.1038/npp.2014.220. Rooij SJ van, Kennis M , Vink M , Geuze E (2016). Predicting Treatment Outcome in PTSD: A Longitudinal Functional MRI Study on Trauma -Unrelated Emotional Processing. Neuropsychopharmacology 41(4): 1156 -65. doi: 10.1038/npp.2015.257. Rubinov, M, & Sporns, O (2010). Complex network measures of brain connectivity: uses and interpretations. Neuroimage, 52(3), 10591069. Russell E, Koren G, Rieder M, Van Uum S (2012). Hair cortisol as a biological marker of chronic stress: Current status, future directions and unanswered questions. Psychoneuroendocrinology, 37: 589 -601. Schmidt U, Kaltwasser SF, Wotjak CT (2013). Biomarkers in Posttraumatic stress disorder: Overview and implications for future research. Disease markers 35: 43 -54. Seng J, Miller F and J, Sperlich M, van de Ven CJM, Brown S, Carter CS, Liberzon I (2013). Exploring dissociation and oxytocin a s pathways between trauma exposure and trauma -related hyperemesis gravidarum: A test -of-concept pilot. Journal of Trauma and Dissoc iation, 14: 40 -55. Serra -Blasco M , de Diego -Adeliño J , Vives -Gilabert Y , Trujols J , Puigdemont D , Carceller -Sindreu M , Pérez V , Álvarez E , Portella MJ (2016). Naturalistic course of major depressive disorder predicted by clinical and structural neuroimaging data: a 5 -year follow -up. Depress Anxiety: doi: 10.1 002/da.22522. [Epub ahead of print]."
57,page_57,"- PROSPER - Prediction and Outcome Study on PTSD and Personality disorders - Version 8, 22 June 2020 58 of 59 X Siegle GJ, Ghinassi F, Thase ME (2007). Neurobehavioral therapies in the 21st century: summary of an emerging field and an extended example of cognitive control training for depression. Cogn Ther Res. 31(2):235 –62. Spielberger CD, Sydeman SJ (1994). State -Trait Anxiety Inventory and State -Trait Anger Expression Inventory. In M.E. Maruish (Ed.), The use of psychological testing for treatment planning and outcome assessment, pp 292-321. Hillsdale, NJ: Lawrence Erl baum Associates. Stansfeld S, Marmot M (1992). Deriving a survey measure of social support: the reliability and validity of the Close Persons Questionnaire. Social Science and Medicine, 35:1027 -1035. Steil R, Dyer A, Priebe K, Kleindienst N, Bohus M (2011). Dialectical behavior therapy for posttraumatic stress disorder related to childhood sexual abuse: a pilot study of an intensive residential treatment program. J Traumatic Stress 24,102 – 106.doi:10.1002/jts.20617. Stoffers JM, Völlm BA, R ücker G, Timmer A, Huband N, Lieb K (2012). Psychological therapies for people with borderline personality disorder. Cochrane Database of Systematic Reviews 2012, Issue 8. Art. No.: CD005652. DOI: 10.1002/14651858.CD005652.pub2. Svartberg M, Stiles TC & Seltzer MH (2004). Randomized, controlled trial of the effectiveness of short -term dynamic psychotherapy and cognitive therapy for cluster C personality disorders. American Journal of Psychiatry, 161, 810 -817. Tarrier N, Sommerfi eld C, Pilgrim H (2000). Relatives' expressed emotion (EE) and PTSD treatment outcome . Psychological Medicine , 29 (4): 801 -811. Taylor S (2003). Outcome Predictors for Three PTSD Treatments: Exposure Therapy, EMDR, and Relaxation Training . Journa l of Cognitive Psychotherapy, Volume 17, Number 2, 2003, pp. 149 -162(14) Thomaes K, Dorrepaal E, Draijer N, Jansma EP, Veltman DJ, van Balkom AJ. (2014) . Can pharmacological and psychological treatment change brain structure and function in PTSD? A systematic review. Journal of Psychiatry Research, 50:1 -15. Thornback K, Muller RT & Rose nkranz SE (2014). The relationship between personality disorder features and symptom improvement at an inpatient treatment program for posttraumatic stress disorder. Journal of Aggression, Maltreatment & Trauma 23:6, 589 -610. DOI: 10.1080/10926771.2014.92 0455 Twisk JWR (2007). Applied Longitudinal Data Analysis for Epidemiology: A Practical Guide. Cambridge University Press, UK. Üstün TB, Kostanjsek N, Chatterji S, Rehm J, editors. , editors (2010). Measuring health and disability: manual for WHO d isability assessment schedule WHODAS 2.0. Malta: World Health Organization. Vertommen H & Vervaeke, GAC (1990). Werkalliantievragenlijst (WAV). Vertaling voor experimenteel gebruik van de WAI (Horvath & Greenberg 1986). Niet -gepubliceerde vragenlijst, D epartement Psychologie, k u Leuven. Walter KH, Bolte TA, Owens GP, Chard KM (2012) The Impact of Personality Disorders on Treatment Outcome for Veterans in a"
