,PageNo,Text34,page_34,"Version date: 27 January 2019 Protocol CHR#15 -17825 Phase I – Study drug(s) Page 34 of 61 therapy sessions and document the number of minutes in which particular target discussion topics are handled in the session. Structured Clinical Interview for DSM -5 (SCID- 5)—The gold standard structured clinical interview for DSM -5 criteria for ma jor psychopathology. We will use portions of the SCID to screen for lifetime Depressive, Psychotic, Bipolar and Hallucinogen- related disorders. Structured Clinical Interview for DSM -5 Personality Disorders (SCID -5-PD)—A self -report questionnaire based on DSM -5 criteria for personality disorders. We will use this to screen for Cluster B personality disorders. 6.3 Qualitative Analyses Qualitative analyses be grounded in Interpretive Phenomenological Analysis (IPA) [184] . Data for qualitative analysis will include transcripts from a convenience sample of group therapy sessions and psilocybin drug sessions, therapist process notes, patients’ written accounts of their psilocybin experiences, verbal feedback elicited from patients throughout the study, transcripts from focus groups conducted after the study endpoint, and transcripts from 30- to- 60-minute semi -structured interviews conducted with selected patients after the 3 -month follow - up. IPA is wi dely used in studies of psychological interventions to better understand a patient’s experience of their treatment, and is typically used to elicit convergent and divergent themes in studies with small sample sizes [184] . Two investigators with experience in qualitative analysis will at first independently code the same transcripts for prominent themes, followed by comparison of their codes until a c onsensus is reached on an appropriate coding scheme. A code book will be established which will be used to code further sources. Consensus will be re- established on an iterative basis according to the criteria of the coders and the PI. 6.4 Schedule of Procedures and Observations The study -specific assessments are detailed in this section and outlined in Section 6 Schedule of Study Procedures and Assessments . Screening assessments will be performed on enrollment. Any results falling outside of the reference ranges may be repeated at the discretion of the investigator. All on- study visit procedures are allowed a window of ± 7 days unless otherwise noted. Treatment or visit delays for public holidays or weather conditions do not constitute a protocol violation. A written, signed, informed consent form (ICF) and a Health Insurance Portability and Accountability Act (HIPAA) authorization must be obtained before any study -specific assessments are initiated. A copy of the signed ICF will be given to the subject and a copy will be filed in the medical record. The original will be kept on file with the study records. 6.4.1 Phone Screening Potential subjects will be screened over the phone to assure that they understand the time requirements of the study, they are at least 50 years old, they were diagnosed with HIV prior to the clinical availability of combination antiretroviral therapy (~ 1996) , they report experiencing moderate- to-severe symptoms of demoralization on t he DS -II, and that they do not meet any major exclusion criteria (e.g., history of psychosis or bipolar disorder; recent active suicidal ideation). They will also be screened for complicated grief on the ICG to better characterize their clinical appropriat eness for the study. A brief orientation to the study protocol, including psychoeducation on psilocybin, will be provided to patients who are not excluded. The patient will then be scheduled for an in- person screening and enrollment visit."
35,page_35,"Version date: 27 January 2019 Protocol CHR#15 -17825 Phase I – Study drug(s) Page 35 of 61 6.4.2 In-person Screening and Enrollment Screening procedures and assessments to be completed on day of Enrollment (prior laboratory results may be considered instead of performing labs at enrollment if the results are less than 1 month old): • Informed Consent Form and HIPPA form. Participants will be provided with a printed version of the study brochure. • Demographics questionnaire (Age, ethnicity/race, civil status, years of education, income) • Vital signs; Physical examination; Mental Status Exam; Complete medical and psychiatric history, including current medication list; Performance status (PPSv2) ; Cognitive Status (Montreal Cognitive Assessment) • Complete blood count (WBC, Hgb, Hct, Plt) • Comprehensive metabolic panel (Na, K, Cl, CO2, BUN, Cr, Gluc, Tbili, Ast, Alt, AlkPhos, TProt, Alb) • TSH, FT4 • CRP • Urinalysis • Urine beta -hCG, when applicable (must be completed on day of Enrollment) • Urine toxicology (must be completed on day of Enrollment) • HIV viral load, CD4 count, CD8 count • RPR or Treponemal Antibody • Electrocardiogram (ECG) • Selected screening portions of Structured Clinical Interview for DSM -5 Clinical Trials Version (SCID -5); sections on current Depressive disorders; lifetime Psychotic disorders, Bipolar disorders and Hallucinogen- related disorders), Structured Clinical Interview for DSM -5 Personality Disorders (SCID- 5-PD) section on Cluster B disorders . • Columbia Suicide Severity Rating Scale (C -SSRS): Baseline/Screening (last 12 months) • ART Medication Adherence Scale (AMAS), Centers for Epidemiologic Studies Depression Scale—Revised (CESD -R), Demoralization Scale—II (DS -II), Inventory of Complicated Grief (ICG), McGill Quality of Life Questionnaire- Revised-Short (MQoL- RS), Life Event Checklist —5 (LEC5), PTSD Checklist -5 (PCL -5), Schedule of Attitudes towards Hastened Death (SAHD), State- Trait Anxiety Inventory (STAI). • Clinical interview of about 45 minutes duration to discuss details about the subject’s personal life, such as past and current relationships, family dynamics, and concerns about their disease. • Eligible subjects will be placed on the waitlist until 6 subjects are available to start a group. • Subjects who score high on the SCID -5-PD dimensional scale for Borderline Personality Disorder and are enrolled in the study will be monitored closely during the trial and study clinicians will consider offering them an individual therapy visit around the time that the subacute beneficial effects of psilocybin are expected to wear off (about 10 days post exposure) if the subjects appear unusually distressed at that time. 6.4.3 Baseline Assessments (Week 0)"
36,page_36,"Version date: 27 January 2019 Protocol CHR#15 -17825 Phase I – Study drug(s) Page 36 of 61 6.4.3.1 Baseline Subject Assessments Baseline assessments will be filled out during an individual therapy session wherein the subject will meet one or both of the group therapists in the week prior to the first group therapy session. Separately, the subject’s caregiver/important other will be invited to meet with study staff for a brief inte rview on their relationship with the subject [see Appendix C for interview guides]. The individual session for the study subject is meant to build trust and rapport with the group therapists, to learn more about the subject’s life history and struggles wit h his /her health, to elicit the subject’s preferences and intentions for the treatment sessions, and to orient the subject further to the intervention protocol. If screening/enrollment measures were completed within 1 week of the baseline assessment, those measures will not need to be repeated. • AMAS, AUDIT, CESD -R, CTC, DS -II, DUDIT, DUFSS -5, ECR- M16, ICG, IPIP -OE-20, MAIA -R, MQoL - RS, NR-6, PCL-5, PTGI -SF, SAHD, SCS-R, and STAI. A clinical rater will perform a CGI and C-SSRS(Interval) for each subject. 6.4.3.2 Baseline Caregiver/Important Other Assessments • CORF 6.4.4 Treatment Period 6.4.4.1 Group Therapy Sessions #1-4 (Weeks 1-2) Patients will undergo four 90-minute group therapy preparatory sessions (2 per week) that will be audio and video recorded. Video footage of a random sampling of sessions will be analyzed with the HIM, SEGT -TG and the GPIRS. Patients will fill out the GQ after the sessions in Week 2 and 4. Women of child -bearing potential will provide a urine sample for a urine beta- hCG at Group Ther apy visit # 4. A clinical rater will administer the C - SSRS(Interval) to each subject at each weekly study visit. 6.4.4.2 Individual Drug Sessions (Week 3) Patients will undergo individual drug sessions in which they are administered psilocybin 0.30mg/kg (or 0.36mg/kg) po, with a maximum dose not to exceed that calculated for a BMI of 35 at their height . The drug will be administered following the safety guidelines outlined by Johnson et al [24]. The day prior to the session, patients will be screened over the phone for contraindicated medications and reminded about procedures for the medication visit. Specifically, participants will be reminded that they cannot drive an automobile for the rest of the day after their medication visit, and they will be advised that if they will take the BART, they should not drive their car to the BART station. On the day of the medication visit, patients will arrive at the Langley Porter Psychiatric Institute around 08:00 and be oriented to the drug session room, which will contain a couch for the patient to lie on and aesthetically pleasing décor. Before the medication session starts, participant s will complete a urine drug screen and the CrEQ. Patients will also undergo a blood draw at the Clinical Research Service for the following tests: CBC, CMP, and CRP. Participants will then return to the study room and hand over their shoes, keys, wallet and phones to the study therapists for safe keeping; these will all be returned to the patient upon completion of the treatment session. The entire session will be audio and video recorded for subsequent behavioral analysis and"
37,page_37,"Version date: 27 January 2019 Protocol CHR#15 -17825 Phase I – Study drug(s) Page 37 of 61 rating of therapist adherence to the therapy protocol. Participants have the option of requesting that AV recording be turned off momentarily if they will to discuss material they feel is too personal to be recorded. During the drug session, vital signs (heart rate and blood pressure ) will be recorded at 10 minutes prior to drug ingestion (“Minute - 10”), and then 30, 60, 90, 120, 180, 240, 300, and 360 minutes after drug ingestion. If at 360 minutes blood pressure is elevated compared to Minute -10, blood pressure will continue to be repeatedly assessed until it has returned to its Minute -10 measurement. If the Minute -10 assessment (the mean of at least two readings separated by at least 2 minutes) of baseline blood pressure exceeds either 140 systolic or 90 diastolic, periodic blood pressure readings will be obtained (e.g. at 5 minute intervals) to determine if the elevation may be temporary (e.g. due to anticipatory anxiety). If blood pressure decreases to (or below) 140 systolic and 90 diastolic within 20 minutes, capsule administr ation will proceed. If baseline blood pressure continues to exceed either 140 systolic or 90 diastolic, periodic blood pressure readings will be continued and the study physician will be contacted. The study physician can authorize drug administration if t he study physician believes that it is safe to proceed and if the last two blood pressure readings do not exceed 155 systolic or 95 diastolic. The patient will ingest the psilocybin capsules with about 4 ounces of water and then be instructed to lie down on the couch wearing eyeshades and listening to a preselected music soundtrack via headphones. The subject will be instructed to focus their attention internally and to attempt to interact minimally with the two therapists who will be present in the room throughout the drug session, but will be as non- directive as possible in their interactions with the patient. In the event of a psychologically challenging experience such as significant anxiety or confusion, the therapists will provide verbal reassurance. Patients will have been instructed in the preparatory therapy session to notify the study therapists if during the treatment they feel anxiety or fear. In the event of a psychiatric emergency, verbal de- escalation and physical and/or chemical restraint wil l be used to maintain the safety of the subject and the therapists, according to the clinical judgment of the on- call study physician. All possible efforts will be made to avoid using restraints of any kind. Subjects will not be allowed to leave the premis es until the drug effects have worn off. In the event of a medical emergency, subjects will be evaluated by the on- call study physician who will be on- site for all drug administrations. At least one ACLS -certified study clinician will be on-site for all dr ug administrations. While expected to be rare, the most likely serious adverse event to occur would be a hypertensive crisis. If a subject’s blood pressure becomes grossly elevated (SBP >180mmHg, DBP >110mmHG) or unsafe (BP elevations with associated sympt oms such as chest pain or shortness of breath), blood pressure will be rechecked immediately in both arms and the on -call physician will be notified if s/he is not already in the treatment room. If the subject is clinically suspected of being in hypertensi ve emergency (with signs of end- organ damage), then the subject will be transported to the UCSF Emergency Department for further evaluation and treatment. The Emergency Department’s door is less than a 1 minute walk from the Langley Porter Psychiatric Inst itute. If the patient if determined to be in hypertensive urgency (without clinical signs of end -organ damage), then blood pressure will be re -assessed with greater frequency while the study physician continues to her/his evaluation for signs of clinical instability, and the study physician may attempt to calm the subject with verbal de- escalation or an anxiolytic (e.g. lorazepam) as transient hypertension is most likely to be due to a challenging psychological experience. If after 20 minutes the hypertensi ve urgency has not improved, the study physician will evaluate the need for transporting the subject to the Emergency Department for further evaluation and treatment. In the case of acute chest pain, the on -call study physician will have available sublingual nitroglycerin to administer to the subject and an electrocardiogram machine. A crash cart is located in the building, but the goal will be to transport a decompensating patient to the Emergency Department prior to the crash cart becoming imminently necessary. In the event of a suspected hypoglycemic episode in a"
38,page_38,"Version date: 27 January 2019 Protocol CHR#15 -17825 Phase I – Study drug(s) Page 38 of 61 subject with diabetes mellitus, a finger stick blood glucose will be checked on an as needed basis, and fruit or oral glucose tablets will be available. As the drug effects begin to wear off at t he 5-6 hour mark, the therapists will engage the patient in a therapeutic interview to explore the experience (see Appendix C for interview guide); this discussion will also be videotaped. A clinical rater will administer the C -SSRS(Interval). Only once patients are deemed to be free of the acute effects of the drug, and after at least 7 hours have passed since ingestion of the drug, will the participant be allowed to leave the premise in the company of a caregiver who has been instructed on how best to support the patient over the coming days. The patient and caregiver will be given a study clinician’s pager or work cell phone number in case of any clinical event off -site that needs further assessment. Patients must agree not to drive themselves home, nor to drive later that same day after they arrive home. Patients will be instructed to write a detailed account of their experience during the drug session at some point over the next week. In the event that a participant did not arrange a friend/family member to accompany them home , the participant will be required to stay with the study clinicians longer, will be encouraged to eat, and then the participant will be escorted to the curb by study staff and seen into a taxi/Lyft/Uber that will be instructed to take them home. The participant will also be instructed to call the study MD when they arrive home. All efforts will be made to avoid this situation. In the weeks prior to the medication session, participants will be regularly reminded to arrange for someone to accompany them home. The following day patients will return to the study site to meet with a study therapist and engage in a therapeutic discussion of their experience for 90 minutes. Before the session patients will present to the Clinical Research Service for a blood draw for these studies: CBC, CMP, CRP. Patients will complete the MEQ -30, ChEQ, STAI, SAHD, MQoL, and the C -SSRS(Interval) at this v isit. Patients may again meet with study staff in person prior to the next group therapy session if they request this or if study clinicians deem it clinically warranted. 6.4.4.3 Group Therapy Sessions #5-10 (Weeks 4 -6) Patients will undergo six group therapy sessions each 90-minutes long. Video footage of a random sampling of sessions will be analyzed with the HIM, SEGT- TG, IGMIPS and the GPIRS. Prior to each session, patients will be screened for adverse events and eval uated with the CSSR -S. Prior to sessions 5, 7 and 9, participants will fill out the CTC. After sessions 6, 8 and 10, participants will fill out the GQ. At the end of session 5, participants will fill out these questionnaires: CESD -R, DS -II, ICG, PCL -5, HARSI. After session 7 participants will fill out the DS - II and ICG. 6.4.5 Endpoint Assessments 6.4.5.1 Endpoint (Week 6) Study Measures for Subjects Immediately after the last group therapy session (Week 8 ), patients will complete the AMAS, CESD -R, DS -II, DUFSS -5, ECR- M16, ICG, MQoL -RS, NR-6, PCL-5 SAHD, SCS-R, STAI, PTGI -SF, IPIP -OE-20, MAIA -R, HARSI, CTC, and CSS. A clinical rater will perform a MoCA and CGI for each subject. 6.4.5.2 Endpoint (Week 6) Study Measures for Caregivers/Important Others Patients’ primary caregivers/important others will complete the CORF and CSS. 6.4.6 Post -treatment/Follow Up Assessments"
39,page_39,"Version date: 27 January 2019 Protocol CHR#15 -17825 Phase I – Study drug(s) Page 39 of 61 6.4.6.1 Focus Group (Week 8) Two weeks after the last group therapy session, subjects and their caregivers/important others will be invited to participate in a focus group wherein they will be asked to give feedback regarding their experiences in the study. Effort will be made to get both responders and non- responders to attend the focus groups. A clinical rater will administer the C -SSRS(Interval) to each subject. Prior to the focus group each participant will fill out the DS -II and ICG. This will be audio- recorded for subsequent qualitative analysis. See Appendix C for focus group guide. 6.4.6.2 3-Month Follow -up for Subjects At 3 Months, patients will be emailed a link to the following measures to be completed in REDCap : AMAS, AUDIT, CESD -R, DS -II, DUDIT, DUFSS -5, ECR- M16, HARSI, ICG, MQoL - RS, NR-6, PCL-5, SAHD, SCS-R, STAI, PTGI -SF, IPIP -OE-20, MAIA -R, CTC, and the CSS. They will be called and encouraged to complete the measures. If they have difficulty with email or filling out the forms electronically, paper -and-pen measures will be sent to them with a self - addressed envelope for returning the measures. 6.4.6.3 3-Month Patients for Caregivers/Important Others At 3 Months, primary caregivers/important others will be e mailed a link with the following measures to be completed in REDCap: CORF and CSS. They will be called and encouraged to complete the packet. 6.4.6.4 3-Month Qualita tive Interviews Between the Focus Group and the 3 -month follow -up, subjects and caregivers/important others will be invited to participate in a semi -structured interview of their experience in the study. These interviews will be analyzed to detect potential mechanisms of the intervention as well as outcomes not addressed by the study measures. See Appendix C for interview guide. 6.5 Discontinuation of Therapy The Investigator will withdraw a patient whenever continued participation is no longer in the patient’s best interest. Reasons for withdrawing a patient include, but are not limited to, disease progression, the occurrence of an adverse event or a concurrent illness, a patient’s request to end participation, a patient’s non- compliance or simply significant uncertainty on the part of the Investigator that continued participation is prudent. There may also be administrative reasons to terminate participation, such as concern about a patient’s compliance with the prescribed treatment regimen. 6.6 Dietary Restriction s No dietary restrictions are included in the protocol. 6.7 Prohibited Medications Patients are prohibited from using medications from the following classes while enrolled in the study: • Serotonin Reuptake Inhibitors (SSRIs and SNRIs) • Tricyclic Antidepressants (TCAs) • Monoamine Oxidase Inhibitors (MAOIs) • Atypical antidepressants (e.g., mirtazapine, nefazodone, buspar ) • Antipsychotics/Neuroleptics (typical and atypical) • Anti-epileptics or mood stabilizers (e.g., lithium, valproate)"
40,page_40,"Version date: 27 January 2019 Protocol CHR#15 -17825 Phase I – Study drug(s) Page 40 of 61 • Efavirenz (Sustiva, in Atripla) • OTC supplements intended to affect mood or anxiety (e.g., 5HT -P or St. John’ s Wort) . Conditional medication restrictions • Trazodone o Trazodone ≤ 50mg/24hr for insomnia is allowed, but not within 48hr of psilocybin session • Benzodiazepines o PRNs are not allowed 24hr prior to the psilocybin session o “z-drugs” (e.g., zolpidem) are not allowed 24hr prior to the psilocybin session Individuals who at screening would be excluded for taking contraindicated antidepressants, anxiolytics, stimulants or herbal supplements can be considered for the study if —under the guidance of their usual physician—they successfully taper off these medications and demonstrate a period of psychiatric stabi lity lasting at least 2 weeks. One exception to the required 2 -week period is for individuals taking low dose TCAs (≤50mg imipramine equivalent) for reasons other than depression or anxiety (e.g., peripheral neuropathy or insomnia). These individuals may, under the guidance of their usual physician, taper off these medications and then be enrolled in the study once they are no longer taking the TCA. 6.8 Study Clinicians Study clinicians (group therapists and treatment session guides) will be approved by a panel consisting of: Dr. Josh Woolley (PI), Dr. Alicia Danforth (UCLA psilocybin team, and lead clinical supervisor for UCSF the team), Dr. Brian Anderson (UCSF psilocybin team), and Robert Jesse (Johns Hopkins psilocybin team). Group therapists and treatment session guides will all be licensed clinicians (MD, RN, NP, MFT, LCSW, PhD, PsyD, Chaplain, etc) in the state of California; an exception will be made if the person is unlicensed but currently enrolled in a clinical training program and has had sufficient clinical exposure, according to the judgment of the above- mentioned panel. The selection of therapists/guides will give preference to those who have: 1) prior clinic al experience working with the study population; 2) have demographic similarities to the study population (age, gender, sexual orientation); 3) prior experience conducting group therapy; 4) prior experience working with individuals under the influence of psychedelics either in research settings or harm -reduction settings (such as the Zendo Project); 5) have completed the CIIS certificate program in Psychedelic -assisted Psychotherapy and research. Group therapist pairs will consist of one lead and one secondary therapist. The lead must have had significant experience as a group therapy leader; the secondary must have some experience as a group therapy leader. Group therapists will undergo at least 16 hours of training in Supportive- Expressive Group Therapy ( SEGT) by studying SEGT training videos, the SEGT adherence rating scales that will be used in the study, and the 3 following SEGT manuals: the original manual for metastatic breast cancer patients [75] , the manual for brief SEGT in newly diagnosed breast cancer patients [76], and the adaptation by Maldonado et al for patients with AIDS [78]. All group therapists will undergo at least one 'dry run' session of the SEGT method prior to starting a group. Each subject will have 2 guides working with them in their drug treatment day (not necessarily one male and one female). At least one of the treatment session guides will be one of the subject's group therapy co- therapists. Treatment session guides will undergo instruction by Dr. Alicia Danforth and/or Dr. Anderson. Overall clinical supervision will be a responsibility shared by Dr. Josh Woolley ( Co-PI), Dr. Brian Anderson ( Pl) and Dr. Danforth (lead psychotherapy supervisor). Clinical consultation will be available from others involved in the study, such as Dr. Jim Dilley, Co -Investigator of this study and founder and of the UCSF Alliance Health Project, as well as Dr . Rob Daroff, a study clinician who is a staff psychiatrist at the SFVA with many years experiencing running psychotherapy groups for gay men in San Francisco."
