,PageNo,Text27,page_27,"28 Immediately following completion of the weight stigma induction or control induction, participants will complete a second packet of self-report measures. Following completion of self-report measures, participants will be taken to the room where they began their visit for collection of a second saliva sample. Study personnel will then provide participants with study payment, inform them of the nature of the experiment, and debrief the participant. During debriefing, study personnel will ask the participant which solution (acetaminophen or placebo) they believed they consumed earlier in the session, and will record their answer. The visit will then be concluded. Table 1 illustrates the study conditions and participant groups included in study 1, and a flow diagram of the experimental sessions is shown in Figure 6. Procedures – Study Two (Participants with Normal Weight Only) Prescreening procedures for study two will be identical to study one but with one addition. Individuals recruited for the normal weight group will be screened for history of overweight or obesity. Those endorsing a history of overweight or obesity will be excluded from the study due to their weight history potentially affecting their perceptions of weight stigma. BMI will be calculated using participant height and weight estimates to ensure that these individuals are in the normal weight range (i.e., BMI 18.5-24.9). Procedures prior to the induction will be the same in study two as in study one, with one important exception. Rather than randomization to acetaminophen or placebo solutions, all participants with normal weight will receive the 1,000mg placebo solution. Participants will still wait 60 minutes before proceeding to the induction task, during which they will complete the same self-report measures as those completed by participants in study one at baseline. Participants in study two will not be randomized to a weight stigma induction or control induction; instead, all participants will be exposed to the weight stigma induction. All other"
28,page_28,"29 procedures during and after the induction will be the same for study two as in study one. Table 2 illustrates the study conditions and participant groups included in study 2. Measures All participants in both studies will complete a demographic and medical history questionnaire which will include information regarding age, gender, marital status, race, level of education, current employment, health history, personal weight history, and relationships with individuals with overweight or obesity. The following objective and self-report measures will be completed by participants in both studies: Objective Measures: Body Mass Index (BMI): Height and weight of each participant will be recorded. An individual’s body mass index is a ratio of weight (in kilograms) divided by the square of height (in meters). It is a commonly used indicator of percentage of body fat. Height and weight will be measured with a portable stadiometer and a digital high-capacity scale. Prostaglandins: Prostaglandin level (PGE!) will be utilized as an objective marker of inflammation. Study personnel will first provide the participant with a small medicine cup of water which the participant will consume 10 minutes prior to saliva collection. During saliva collection, participants will be asked to provide saliva through a small straw which will funnel into a small test tube. The total amount of saliva needed is approximately half a teaspoon. Participants struggling to produce saliva may be encouraged to think about their favorite food or imagine tasting a lemon to increase saliva production. For saliva analysis, an assay similar to that used by Benedetti and colleagues (2014) will be used to measure prostaglandins per milliliter."
29,page_29,"30 Prostaglandins will be measured twice: once upon arrival (baseline) and a second time at completion of the visit (post-induction). Salivary levels of prostaglandins will be measured using an ELISA kit from Cayman Chemical (Product No. 514010) and read on a Fisher Scientific Multiskan FC microplate reader. C-Reactive Protein (CRP): CRP is found in blood plasma and will serve as another objective marker of inflammation. Study personnel will begin by cleaning a finger on the participant’s non-dominant hand with an isopropyl alcohol wipe. Participants will then be asked to wave their hand to increase circulation to the area. Next, study personnel will use a contact-activated disposable lancet on the participant’s finger in order to collect a blood sample. The lancet is designed to deliver a controlled, uniform puncture that provides a combination of sufficient capillary blood flow and minimal injury. Five blood drops from the finger will be applied to a blood spot card. Study personnel will facilitate the production of these blood drops by rubbing down on the participant’s finger. Following collection of blood spots, the participant’s finger will again be cleaned with an isopropyl alcohol wipe, and a bandage will be applied to the finger. CRP will be measured at baseline only. CRP (in milligrams per deciliter) will be measured in dried blood spots using the Meso QuickPlex SQ 120 (Meso Scale Discovery, 1601 Research Boulevard, Rockville, MD) with V-Plex kits purchased from Meso Scale Discovery. The average intra-assay coefficient of variation is 2.9% and the average inter-assay (run-to-run) coefficient of variation is 7.9%. Primary Self-Report Measures The following self-report measures will be completed using Qualtrics Survey Software at baseline and post-induction, unless otherwise noted. Participants may request to complete hard copy forms of the self-report measures if they prefer. Of note, weight stigma-related measures"
30,page_30,"31 will appear first in the order of measures to minimize the influence of those measures on the induction to which the participant is randomized. Additionally, all post-induction measures will be administered in random order: Pain McGill Pain Questionnaire (MPQ; Melzack, 1975): The MPQ is a measure designed to assess present aspects of pain (Pain Rating Index) and pain intensity (Present Pain Intensity scale) among adults. The Pain Rating Index contains 78 pain descriptor items that are grouped into four major pain subscales: sensory, affective, evaluative, and miscellaneous. Each descriptor has a value score assigned to it, with higher scores representing more severe pain. The Present Pain Intensity scale measures magnitude of overall pain intensity experienced by an individual, and includes six levels: none (0), mild (1), discomforting (2), distressing (3), horrible (4), and excruciating (5). Total Pain Rating Index scores range from 0-78 and Present Pain Intensity scores range from 0-5; in both scales, higher scores reflect greater pain severity. The MPQ has demonstrated good validity, reliability, consistency, and usefulness in assessing aspects of pain and pain intensity (Katz & Melzack, 2011). Visual Analog Scale for Pain (VAS-Pain): The VAS-Pain is a unidimensional measure of physical pain intensity that has been used in a variety of adult populations. The continuous scale consists of a line 100 millimeters in length, anchored by two descriptors representing the extremes of pain (i.e., “no pain,” versus “my pain is as bad as it could possibly be”). Participants are asked to place a mark on the line to indicate their current level of pain. VAS-Pain scores are determined by using a ruler to measure the distance in millimeters between the “no pain” anchor and the participant’s mark. Scores range from 0-100, with higher scores indicating greater pain"
31,page_31,"32 intensity. The VAS-Pain demonstrates good test-retest reliability and construct validity. It is also sensitive to changes in pain assessed in intervals as short as one hour (Hawker et al., 2011). Stigma Stigma Situations Inventory (SSI; Myers & Rosen, 1999): The SSI is a 50-item questionnaire examining lifetime frequency of obesity-related experiences across eleven different categories: comments from children, from strangers, from family and from doctors; social exclusion; being stared at; loved ones being embarrassed by your size; negative assumptions that people make; physical barriers or obstacles; job discrimination; and physical violence. Respondents report frequency of each item on a scale of 0 (never) to 9 (daily). The mean of all items is typically used to measure overall frequency of weight stigma experiences, with greater values suggesting greater experience of weight stigma. The SSI has been utilized successfully as a measure of weight-based stigmatization, as well as consequences of those experiences (Vartanian, 2015). SSI will be measured once, prior to the induction task (baseline). Weight Bias Internalization Scale (WBIS; Durso & Latner, 2008): The WBIS is an 11-item scale measuring the degree to which individuals believe that anti-fat attitudes are relevant to the self. Items are answered on a 7-point likert scale ranging from 1=strongly disagree to 7=strongly agree, with total scores ranging from 11 to 77. The WBIS has demonstrated high internal consistency and strong correlation with measures of drive for thinness, body image concern, and self-esteem (Durso & Latner, 2008). WBIS will be measured once, prior to the induction task (baseline). Stigma Impact Scale (SIS; Fife & Wright, 2000): The SIS is a 24-item questionnaire that was originally developed to evaluate various facets of stigma and assess the impact of perceived"
32,page_32,"33 stigma among individuals with chronic illnesses. Each item is rated on a 5-point likert scale ranging from 0=not applicable to 4=strongly agree. The questionnaire includes four subscales representing social rejection, financial insecurity, internalized shame, and social isolation. Total scores range from 0 to 96. Subscale scores range from 0 to 36 for 32 social rejection, from 0 to 12 for financial insecurity, from 0 to 20 for internalized shame, and from 0 to 28 for social isolation. The term ‘illness’ will be changed to ‘condition’ to increase applicability of item content for participants in this study. Previously published data from our lab has demonstrated high reliability when following this procedure (Cronbach’s alpha = 0.93; Olson et al., 2018). Quality of Life Medical Outcomes Survey, Short Form-36 (SF-36; Ware & Sherbourne, 1992): The SF-36 is a 36-item measure of health-related quality of life. Two composite scores can be generated: the mental component score (MCS) and the physical component score (PCS). T-scores are generated for component scores. The physical component score is heavily weighted by four subscales assessing physical functioning, physical role functioning, general health, and bodily pain, the latter of which will be utilized as another measure of baseline pain in analyses. The mental component score is heavily weighted by four subscales assessing vitality, social role functioning, emotional role functioning, and mental health. Each component score is transformed into a 0-100 scale with higher scores indicating better health-related quality of life. The SF-36 is an internationally-validated instrument for measuring health-related quality of life and has been utilized in a variety of sample types, including individuals with obesity (Callegari, Michelini, Sguazzin, Catona, & Klersy, 2005; Emery et al., 2015). SF-36 will be measured once, prior to the induction task (baseline)."
33,page_33,"34 Impact of Weight on Quality of Life-Lite (IWQOL-L; Kolotkin, Crosby, Kosloski, & Williams, 2001): The IWQOL-Lite is a 31-item measure of obesity-related quality of life. Each item is rated on a five-point Likert scale. Total scores range from 31 to 155 with higher scores reflecting greater impact of weight on quality of life. Also, five subscales can be scored for the IWQOL-Lite: physical function, self-esteem, sexual life, public distress, and work. The IWQOL-Lite has been tested in various samples, such as community-dwelling individuals with overweight or obesity, and has demonstrated good psychometric properties including high internal consistency, test-retest reliability, convergent validity, and discriminant validity (Kolotkin & Crosby, 2002). IWQOL will be measured once, prior to the induction task (baseline). Positive and Negative Affect Schedule (PANAS; Watson, Clark, & Tellegen, 1988): The PANAS is a 20-item measure of positive and negative affect. Each item is a single word reflecting an emotion (e.g., proud, excited, ashamed, upset) and respondents use a five-point Likert scale to indicate the degree to which they are experiencing each emotion during the present moment. Total scores for the negative affect and positive affect subscales range from 10-50. The PANAS subscales have demonstrated strong internal consistency and discriminant validity (Watson, Clark, & Tellegen, 1988). Visual Analog Scale for Distress (VAS-Distress): The VAS-Distress will be used to measure distress and will match the construction and scoring formats of the VAS-Pain. Instead of pain-related anchors, the VAS-Distress will be anchored with “no distress” and “as distressed as I could possibly be” descriptors. Secondary Self-Report Measures The following self-report measures serve multiple purposes, including distraction to participants"
34,page_34,"35 following completion of the weight stigma-related measures at baseline, helping characterize the sample, helping identify relevant variables that may need to be included as control variables in study analyses, and/or serving as manipulation checks. Timing of administration is specified in the description of each measure. International Physical Activity Questionnaire – Short Form (IPAQ-SF; Craig et al., 2003): The IPAQ-SF measures physical activity and inactivity performed during the previous seven days. Respondents report the number of days, hours per day, and minutes per day in the last seven days they engaged in vigorous exercise, moderate exercise, walking, and sitting. The IPAQ-SF has demonstrated acceptable reliability and validity across diverse samples. IPAQ-SF will be measured once, prior to the induction task (baseline). Pittsburgh Sleep Quality Index (PSQI; Buysse et al., 1989): The PSQI is used to assess sleep behavioral (quality and disturbances) over a one-month interval. It has demonstrated strong internal consistency, and has shown good sensitivity and specificity in distinguishing good and poor sleepers. The PSQI yields a total score as well as the following seven subscales: subjective sleep quality, sleep latency, sleep duration, habitual sleep efficiency, sleep disturbances, use of sleep medications, and daytime dysfunction. PSQI will be measured once, prior to the induction task (baseline). Rosenberg Self-Esteem Scale (RSES; Rosenberg, 1965): The RSES is a 10-item measure used to assess overall self-esteem. Both positive and negative feelings about the self are measured. Items are answered on a Likert scale ranging from 0 (strongly agree) to 3 (strongly disagree), with higher scores indicating higher self-esteem. The scale has demonstrated good internal consistency. RSES will be measured once, prior to the induction task (baseline)."
35,page_35,"36 Hospital Anxiety and Depression Scale (HADS; Zigmond & Snaith, 1983): The HADS is a 14-item measure developed to assess depression and anxiety among non-psychiatric medical patients. Respondents are asked to rate each item on a scale ranging from 0 (not at all) to 3 (most of the time). The HADS consists of a total distress score ranging from 0-42, and two subscales consisting of seven items each: anxiety (HADS-A; range 0-21) and depression (HADS-D; range 0-21). Six items are reverse scored. In each subscale a score above 10 indicates clinically significant distress. The HADS is a validated measure with strong internal consistency in both overall and subscale measures (Bjelland, Dahl, Haug, & Neckelmann, 2002), and has been used in several studies involving overweight or obesity. HADS will be measured once, prior to the induction task (baseline). Binge Eating Scale (BES; Gormally, Black, Daston, & Rardin, 1982): The BES is a 16-item questionnaire designed to assess the behavioral (e.g., large amount of food consumed), as well as the cognitive and emotional (e.g., feeling out of control while eating), features of binge eating in adults with overweight or obesity. Respondents select one of three or four response options coded 0 to 2 or 3, respectively. Scores are summed and range from 0 to 46, with higher scores reflecting more severe binge eating problems. Scores greater than 17 reflect moderate binge eating severity, while scores greater than 26 reflect severe binge eating problems. The BES has demonstrated good internal consistency in a variety of samples with overweight or obesity (Cotter & Kelly, 2017). BES will be measured once, prior to the induction task (baseline). Need Threat Scale (NTS; van Beest & Williams, 2006): The NTS is a 12-item measure designed to assess one’s need for belonging, self-esteem, control, and meaningful existence, each of which represent a subscale of the measure. Respondents indicate how they are feeling right now using a five-point Likert scale ranging from “not at all” to “very much so.” The NTS has been used in"
36,page_36,"37 several studies on Cyberball-induced ostracism (e.g., Eisenberger et al., 2003) showing that such an induction threatens these needs. In addition to four subscale scores, a composite score is calculated by averaging responses across the 12 items. The NTS will be measured once, after the induction task (post-induction). Buckley Scale (BS; Buckley, Winkel, & Leary, 2004): The BS is a 12-item measure designed to assess feelings of happiness, anxiety, anger, sadness, and hurt feelings in the present moment. The scale is composed of five subscales for these five domains of emotion. Respondents indicate the degree to which they endorse a particular feeling using a seven-point Likert scale ranging from “not at all” to “extremely.” The BS will be measured twice, both before and after the induction task. Vividness of Recall: A single-item measure will be administered to assess vividness of participants’ recall of the instance when they themselves experienced weight stigmatization that they write about in the weight stigma induction. This single item is adapted from research by Valenti and colleagues (2011) and will be administered once, after the induction task (post-induction). Sample Size Calculation Sample size for this study was determined using G-Power 3.1. No reported studies on effects of acetaminophen on weight stigma among individuals with normal weight, overweight, or obesity are available; therefore, studies comparing the effects of acetaminophen versus placebo on other emotional outcomes (i.e., affect, empathy for pain) were utilized to help determine sample size for the current study. Data from Durso and colleagues (2015) revealed a medium effect size (Cohen’s d = .55) for undergraduate students administered acetaminophen"
37,page_37,"38 (versus placebo) evaluating positive and negative images (as determined by the International Affective Picture System). Data from Mischkowski and colleagues (2016) also revealed a medium effect size (Hedge’s g = .45) in a study of empathic concern for others’ pain among undergraduate students administered acetaminophen versus placebo. Effect sizes from Durso et al. and Mischkowski et al. were transformed to Cohen’s F in order to complete a priori power analyses for an analysis of covariance with fixed effects, main effects, and interactions. These effect sizes were used to calculate power with an alpha of .05, one numerator degree of freedom, four groups, and two covariates, indicating a total sample size of 106 to 156 would result in power of .80. This sample size recommendation is consistent with the acetaminophen studies that informed the sample size calculations for Durso et al. and Mischkowski et al.; those studies recruited 30 to 50 participants per condition. Analyses also were conducted to estimate the effect size of the weight stigma induction. Because Pearl and Puhl (2016) compared WBIS scores after exposure to one of two weight stigma inductions, the effect size for the difference between the two inductions could not be utilized to determine sample size for the current study. Instead, the WBIS mean score after exposure to the internalizing weight stigma induction condition in their study was compared to baseline WBIS mean scores in other studies among participants with overweight and obesity (Durso, Latner, & Ciao, 2016; Lee & Dedrick, 2016; Pearl et al., 2018; Latner, Barile, Durso, & O’Brien, 2014) as well as similar, unpublished data from our lab. A range of effect sizes (f = .216 to .582) was revealed after calculating mean differences between baseline WBIS scores and the mean WBIS score from Pearl and Puhl (2016), with most indicating effect sizes at the higher end of the range. To obtain the most conservative estimate of sample size needed for the proposed study, one a priori power analysis was conducted for an analysis of covariance with"
38,page_38,"39 fixed effects, main effects, and interactions using an effect size of .216 with an alpha of .05, one numerator degree of freedom, four groups, and two covariates. The required total sample size was 171 in order to achieve a power of .80. Study 2 introduces individuals with normal weight. Therefore, additional analyses were conducted to estimate the effect of body weight category on emotional and psychological outcomes. Vieira and colleagues (2012) evaluated differences in several emotional and psychological variables among women with normal weight, overweight, class I obesity (BMI 30-34.9), and class II obesity (BMI 35-39.9). Analyses revealed medium to strong effect sizes for greater weight-related quality of life (as measured by the IWQOL-Lite; f = .510), higher self-esteem (as measured by the Rosenberg Self-Concept/Self-Esteem Scale (Rosenberg, 1965); f = .324), and lower body image dissatisfaction (as measured by the Body Image Assessment Questionnaire (Williamson, Davis, Bennett, Goreczny, & Gleaves, 1989); f = .813) among individuals with normal weight compared to those with overweight. Effect sizes were larger when comparing the normal weight category to class I and II obesity categories. In another study, experience and internalization of weight stigma were assessed among individuals with underweight or normal weight and among individuals with overweight or obesity (Lee, Gonzalez, Small, & Thompson, 2019). Medium effect sizes were detected for greater stigma internalization (as measured by the WBIS; f = .339) and stigmatizing experiences related to weight (as measured by the SSI; f = .339) among individuals with overweight or obesity compared to those with underweight or normal weight. A third study revealed a medium effect size for greater psychological well-being (as measured by Ryff’s assessment of psychological well-being (Ryff, 1989)) among women with normal weight compared to women with severe obesity (f = .286; Bookwala & Boyar, 2008). The aforementioned effect sizes were used in"
39,page_39,"40 conducting a priori power analyses for an analysis of covariance with fixed effects, main effects, and interactions with an alpha of .05, one numerator degree of freedom, three groups, and three covariates. The required total sample to achieve a power of .80 for study 2 ranged from 15 to 98. Therefore, the proposed sample size of 200 participants (40 per cell; 160 overweight and obese, 40 normal weight) should result in sufficient power for studies 1 and 2. Data Analysis Statistical Analysis Software (SAS 9.3) will be used to complete all analyses. For study 1, Pearson correlations and analysis of variance (ANOVA) will be used to evaluate the interrelationship of baseline variables (baseline prostaglandins and CRP, MPQ total score, total WBIS score, total SIS score, mean SSI score, total IWQOL score, SF-36 component scores and bodily pain subscale score, and the PANAS subscale scores) with demographic variables (age, race, BMI, and education). These analyses also will evaluate hypotheses 1a (BMI will be positively associated with prostaglandins, CRP, internalized weight stigma, perceived weight stigma, exposure to weight-based stigmatizing experiences, impact of weight on quality of life, pain, and negative affect; and negatively associated with health-related quality of life and positive affect) and 1b (prostaglandins and CRP will be positively associated with pain, internalized weight stigma, perceived weight stigma, exposure to weight-based stigmatizing experiences, impact of weight on quality of life, and negative affect; and negatively associated with health-related quality of life and positive affect). To evaluate hypotheses 1c (the relationship between BMI and baseline pain will be mediated by experienced weight stigma), 1d (the relationship between BMI and baseline pain will be mediated by perceived weight stigma), 1e (the relationship between BMI and baseline pain will be mediated by internalized weight stigma), and 1f (the relationship between BMI and"
