,PageNo,Text
55,page_56,"['considers the event to be reasonably related to the study treatment or study participation, the', 'investigator must promptly notify Merkk.', '7.2.1 Definition of an Overdose for This Protocol and Reporting of Overdose to the', 'Principal Investigator and to Merck', 'For purposes of this study, an overdose of pembrolizumab will be defined as any dose of', '1,000 mg or greater (>5 times the indicated dose). No specific information is available on', 'the treatment of overdose of pembrolizumab. In the event of overdose, the participant should', 'be observed closely for signs of toxicity. Appropriate supportive treatment should be', 'provided if clinically indicated.', 'Due to the high plasma protein binding, lenvatinib is not expected to be dialyzable. Death', 'due to multiorgan dysfunction occurred in a patient who received a single dose of lenvatinib', '120mg orally.', 'If an adverse event(s) is associated with (""results from"") the overdose of a Merk product,', 'the adverse event(s) is reported as a serious adverse event, even if no other seriousness', 'criteria are met.', ""If a dose of Merck's product meeting the protocol definition of overdose is taken without any"", 'associated clinical symptoms or abnormal laboratory results, the overdose is reported as a', 'non-serious Event of Clinical Interest (ECI), using the terminology ""accidental or intentional', 'overdose without adverse effect.""', 'All reports of overdose with and without an adverse event must be reported within 24 hours', 'to the principal investigator (PI) and within 2 working days hours to Merk Global Safety.', '(Attn: Worldwide Product Safety; FAX 215-661-6229)', '7.2.2 Reporting of Pregnancy and Lactation to the Principal Investigator and to', 'Merk', 'Although pregnancy and infant exposure during breast feeding are not considered adverse', 'events, it is the responsibility of investigators or their designees to report any pregnancy or', 'lactation in a participant (spontaneously reported to them) that occurs during the study.', 'Pregnancies and infant exposures during breastfeeding that occur after the consent form is', 'signed but before treatment allocation/randomization must be reported by the investigator if', 'they cause the participant to be excluded from the trial, or are the result of a protocol-', 'specified intervention, including but not limited to washout or discontinuation of usual', 'therapy, diet, placebo treatment or a procedure.', 'Pregnancies and infant exposures during breastfeeding that occur from the time of treatment', ""allocation/randomization through 120 days following cessation of Supporter's product, or 30"", 'days following cessation of treatment if the participant initiates new anticancer therapy,', 'whichever is earlier, must be reported by the investigator. All reported pregnancies must be', 'followed to the completion/termination of the pregnancy. Pregnancy outcomes of', 'spontaneous abortion, missed abortion, benign hydatidiform mole, blighted ovum, fetal', '56']"
56,page_57,"['death, intrauterine death, miscarriage and stillbirth must be reported as serious events', '(Important Medical Events). If the pregnancy continues to term, the outcome (health of', 'infant) must also be reported.', 'Such events must be reported within 24 hours to the PI and within 2 working days to Merk', 'Global Safety. (Attn: Worldwide Product Safety; FAX 215-661-6229)', '7.2.3 Immediate Reporting of Adverse Events to the Principal Investigator and to', 'Merck', '7.2.3.1 Serious Adverse Events', 'An adverse event (AE) or suspected adverse reaction is considered ""serious"" if, in the view of', 'either the investigator or sponsor, it results in any of the following outcomes:', 'Death', 'Life-threatening adverse event', 'Inpatient hospitalization or prolongation of existing hospitalization', 'A persistent or significant incapacity or substantial disruption of the ability to conduct', 'normal life functions, or a congenital anomaly/birth defect.', 'Important medical events that may not result in death, be life-threatening, or require', 'hospitalization may be considered serious when, based upon appropriate medical judgment,', 'they may jeopardize the participant and may require medical or surgical intervention to', 'prevent one of the outcomes listed in this definition. (Examples of such medical events', 'include allergic bronchospasm requiring intensive treatment in an emergency room or at', 'home, blood dyscrasias or convulsions that do not result in inpatient hospitalization, or the', 'development of drug dependency or drug abuse).', 'For the time period beginning when the consent form is signed until treatment', 'allocation/randomization, any serious adverse event, or follow up to a serious adverse event,', 'including death due to any cause that occurs to any participant must be:', 'submitted on a Winship SAE form and assessed by PI in order to determine', 'reporting criteria to regulatory authorities', 'reported within 2 working days to Merk Global Safety if it causes the participant to', 'be excluded from the trial, or is the result of a protocol-specified intervention,', 'including but not limited to washout or discontinuation of usual therapy, diet,', 'placebo treatment or a procedure.', 'For the time period beginning at treatment allocation through 90 days following cessation of', 'treatment, or 30 days following cessation of treatment if the subject initiates new anticancer', 'therapy, whichever is earlier, any serious adverse event, or follow up to a serious adverse', 'event, including death due to any cause whether or not related to the study drug, must be:', 'submitted on a Winship SAE form and assessed by PI in order to determine', 'reporting criteria to regulatory authorities,', 'reported within 2 working days to Merk Global Safety', '57']"
57,page_58,"['Both lenvatinib and pembrolizumab are Merk products. All SAEs will be followed until', 'satisfactory resolution or until the site investigator deems the event to be chronic or the', 'adherence to be stable. Other supporting documentation of the event may be requested by the', 'study sponsor and should be provided as soon as possible. The study sponsor-Investigator', 'will be responsible for notifying FDA and Merk of any unexpected fatal or life-threatening', 'suspected adverse reaction as soon as possible but in no case later than 7 calendar days after', ""the PI's initial receipt of the information"", 'All subjects with serious adverse events must be followed up for outcome.', 'Any additional information for the SAE including complications, progression of the initial', 'SAE, and recurrent episodes must be submitted on a new Winship SAE form and assessed', 'by PI in order to determine reporting criteria to regulatory authorities, (IRB, DSMC, FDA)', 'and submitted to Merk as follow-up to the original episode.', 'An SAE occurring at a different time interval or otherwise considered completely unrelated', 'to a previously reported one should be reported separately as a new event.', 'Any SAEs experienced after the reporting period described above should only be reported to', 'FDA/IRB and Merk if the investigator suspects a causal relationship to the study treatment.', 'Information about all SAEs is collected and recorded on the Serious Adverse Event Report', 'Form; all applicable sections of the form must be completed in order to provide a clinically', 'thorough report. The investigator must assess and record the relationship of each SAE to', 'each specific study treatment (Pembrolizumab and/or Lenvatinib), complete the SAE Report', 'Form, and submit the completed form.', 'Each reoccurence, complication, or progression of the original event should be reported as a', 'follow-up to that event regardless of when it occurs. The follow-up information should', 'describe whether the event has resolved or continues, if and how it was treated, whether the', 'blind was broken or not, and whether the patient continued or withdrew from study', 'participation.', 'All SAE must be recorded on a MedWatch 3500 Form. SAE reports and any other relevant', 'safety information are to be forwarded to the following', 'MedWatch 3500 Reporting Guidelines:', 'Note: MedWatch 3500 forms and other information related to MedWatch reporting are', 'available at http://www.fda.gov/medwatch/index.html.', 'A copy of all 15 Day Reports and Annual Progress Reports is submitted as required by FDA.', 'Investigators will cross reference this submission according to local regulations to the', 'Investigational Compound Number (IND, CSA, etc.) at the time of submission.', 'An investigator who is a qualified physician will evaluate all adverse events according to the', 'NCI Common Terminology for Adverse Events (CTCAE), version 4.0. Any adverse event', 'which changes CTCAE grade over the course of a given episode will have each change of', 'grade recorded on the adverse event case report forms/worksheets. All adverse events', 'regardless of CTCAE grade must also be evaluated for seriousness.', 'Reporting Requirements for IND holder', 'For Investigator-sponsored IND studies, reporting requirements for the FDA apply in', 'accordance with the guidance set forth in 21 CFR, Part 312.32. Events meeting the following', 'criteria need to be submitted to the FDA as Expedited IND Safety Reports.', '58']"
58,page_59,"['7 Calendar-Day Telephone or Fax Report', 'The Sponsor-Investigator is required to notify the FDA of a fatal or life-threatening adverse', 'event that is unexpected and assessed by the investigator to be possibly related to the use of', 'investigational agents. An unexpected adverse event is one that is not already described in', ""the most recent Guidance for Investigator section of the Investigator's Brochure. Such"", 'reports are to be telephoned or faxed to the FDA, within 7 calendar days of the first learning', 'of the event.', '15 Calendar-Day Written Report', 'The Sponsor-Investigator is also required to notify the FDA and all participating', 'investigators, in a written IND Safety Report, of any serious unexpected adverse event that is', 'considered reasonably or possibly related to the use of investigational agent.', 'Written IND Safety Reports with analysis of similar events are to be submitted to the FDA,', 'within 15 calendar days of first learning of the event. The FDA prefers these reports on a', 'MedWatch 3500 Form but alternative formats (e.g., summary letter) are acceptable.', 'FDA Fax number of IND Safety Reports: 1-(800)-FDA-1078.', 'The IND sponsor will also make an assessment of whether the event constitutes an', 'unanticipated problem posing risks to subjects or others (UP). This assessment will be', 'provided to the Emory University IRB, which, in turn will make a final determination. If the', 'Emory IRB determines an event is a UP it will notify the appropriate regulatory agencies and', 'institutional officials.', 'All Adverse Events will be reported to regulatory authorities, IRB/IECs and investigators in', 'accordance with all applicable global laws and regulations.', 'Additionally, any serious adverse event, considered by an investigator who is a qualified', 'physician to be related to Merk product that is brought to the attention of the investigator at', 'any time following consent through the end of the specified safety follow-up period specified', 'in the paragraph above, or at any time outside of the time period specified in the previous', 'paragraph must be reported immediately to Merk Global Safety.', 'All participants with serious adverse events must be followed up for outcome.', 'SAE reports and any other relevant safety information are to be forwarded to the Merck', 'Global Safety facsimile number: +1-215-661-6229', 'A copy of all 15 Day Reports and Annual Progress Reports is submitted as required by FDA,', 'European Union (EU), Pharmaceutical and Medical Devices agency (PMDA) or other local', 'regulators. Investigators will cross reference this submission according to local regulations to', 'the Merk Investigational Compound Number (IND, CSA, etc.) at the time of submission.', 'Additionally, investigators will submit a copy of these reports to Merk & Co., Inc. (Attn:', 'Worldwide Product Safety; FAX 215-661-6229) at the time of submission to FDA.', '7.2.3.2 Events of Clinical Interest', 'Both lenvatinib and pembrolizumab are Merk products. Selected non-serious and serious', 'adverse events are also known as Events of Clinical Interest (ECI) and must be reported', '59']"
59,page_60,"['within 2 working days to Merk Global Safety. (Attn: Worldwide Product Safety; FAX 215-', '661-6229).', 'For the time period beginning when the consent form is signed until treatment allocation, any', 'ECI, or follow up to an ECI, that occurs to any participant must be reported within 2 working', 'days to Merk Global Safety if it causes the participant to be excluded from the trial, or is the', 'result of a protocol-specified intervention, including but not limited to washout or', 'discontinuation of usual therapy, diet, placebo treatment or a procedure.', 'For the time period beginning at treatment allocation through 90 days following cessation of', 'treatment, or 30 days following cessation of treatment if the participant initiates new', 'anticancer therapy, whichever is earlier, any ECI, or follow up to an ECI, whether or not', 'related to Merk product, must be reported within 2 working days to Merk Global Safety.', 'Events of clinical interest for this trial include:', '1. an overdose of Merk product, as defined in Section 7.2.1 - Definition of an Overdose for', 'This Protocol and Reporting of Overdose to the Supporter, that is not associated with clinical', 'symptoms or abnormal laboratory results.', '2. an elevated AST or ALT lab value that is greater than or equal to 3X the upper limit of', 'normal and an elevated total bilirubin lab value that is greater than or equal to 2X the upper', 'limit of normal and, at the same time, an alkaline phosphatase lab value that is less than 2X', 'the upper limit of normal, as determined by way of protocol-specified laboratory testing or', 'unscheduled laboratory testing.*', '*Note: These criteria are based upon available regulatory guidance documents. The', 'purpose of the criteria is to specify a threshold of abnormal hepatic tests that may require', 'an additional evaluation for an underlying etiology.', '7.2.4 Evaluating Adverse Events', 'An investigator who is a qualified physician will evaluate all adverse events according to the', 'NCI Common Terminology for Adverse Events (CTCAE), version 4.0. Any adverse event', 'which changes CTCAE grade over the course of a given episode will have each change of', 'grade recorded on the adverse event case report forms/worksheets.', 'All adverse events regardless of CTCAE grade must also be evaluated for seriousness.', '60']"
60,page_61,"['Table 10. Evaluating Adverse Events', 'An investigator who is a qualified physician, will evaluate all adverse events as to:', 'V4.0 CTCAE', 'Grade 1', 'Mild; asymptomatic or mid symptoms; clinical or diagnostic observations only; intervention not indicated.', 'Grading', 'Grade 2', 'Moderate; minimal, local or noninvasive intervention indicated; limiting age-appropriate instrumental ADL.', 'Grade 3', 'Severe or medically significant but not immediately life-threatening; hospitalization or prolongation or hospitalization indicated;', 'disabling; limiting self-care ADL.', 'Grade 4', 'Life threatening consequences; urgent intervention indicated.', 'Grade 5', 'Death related to AE', 'Seriousness', 'A serious adverse event is any adverse event occurring at any dose or during any use of Merk product that:', 'Results in death; or', '+Is life threatening; or places the participant, in the view of the investigator, at immediate risk of death from the event as it occurred (Note: This does not include an', 'adverse event that, had it occurred in a more severe form, might have caused death.);', 'or', ""*Results in a persistent or significant disability/incapacity (substantial disruption of one's ability to conduct normal life functions); or"", 'Results in or prolongs an existing inpatient hospitalization (hospitalization is defined as an inpatient admission, regardless of length of stay, even if the', 'hospitalization', 'is', 'a', 'precautionary measure for continued observation. (Note: Hospitalization for an elective procedure to treat a pre-existing condition that has not', 'worsened is not a serious adverse event. A pre-existing condition is a clinical condition that is diagnosed prior to the use of a Merk product and is documented in', ""the patient's medical history.); or"", '+Is a congenital anomaly/birth defect (in offspring of participant taking the product regardless of time to diagnosis);or', 'Is a new cancer (that is not a condition of the study) (although not serious per ICH definition, is reportable to the Sponsor within 24 hours and to Merk within 2', 'working days to meet certain local requirements); or', '61']"
61,page_62,"['Is an overdose (whether accidental or intentional). Any adverse event associated with an overdose is considered a serious adverse event for collection purposes. An', 'overdose that is not associated with an adverse event is considered a non-serious event of clinical interest and must be reported within 24 hours to the Sponsor', 'and', 'to', 'Merk within 2 working days.', 'Other important medical events that may not result in death, not be life threatening, or not require hospitalization may be considered a serious adverse event when,', 'based upon appropriate medical judgment, the event may jeopardize the participant and may require medical or surgical intervention to prevent one of the outcomes', 'listed previously (designated above by a +).', 'Duration', 'Record the start and stop dates of the adverse event. If less than 1 day, indicate the appropriate length of time and units', 'Action taken', 'Did the adverse event cause Merk product to be discontinued?', 'Relationship to', 'Did', 'Merk', 'product cause the adverse event? The determination of the likelihood that Merk product caused the adverse event will be provided by an investigator', 'Merck Product', ""who is a qualified physician. The investigator's signed/dated initials on the source document or worksheet that supports the causality noted on the AE form, ensures"", 'that a medically qualified assessment of causality was done. This initialed document must be retained for the required regulatory time frame.', 'The', 'criteria', 'below', 'are', 'intended as reference guidelines to assist the investigator in assessing the likelihood of a relationship between the test drug and the adverse event', 'based', 'upon', 'the', 'available information.', 'The', 'following', 'components are to be used to assess the relationship between Merck product and the AE; the greater the correlation with the components and', 'their respective elements (in number and/or intensity), the more likely Merk product caused the adverse event (AE):', 'Exposure', 'Is there evidence that the participant was actually exposed to Merk product such as: reliable history, acceptable compliance assessment (pill', 'count, diary, etc.), expected pharmacologic effect, or measurement of drug/metabolite in bodily specimen?', 'Time Course', 'Did the AE follow in a reasonable temporal sequence from administration of Merk product?', 'Is the time of onset of the AE compatible with a drug-induced effect (applies to trials with investigational medicinal product)?', 'Likely Cause', 'Is the AE not reasonably explained by another etiology such as underlying disease, other drug(s)/vaccine(s), or other host or environmental factors', '62']"
62,page_63,"['Relationship', 'The following components are to be used to assess the relationship between the test drug and the AE: (continued)', 'to Merck', 'Dechallenge', 'Was Merk product discontinued or dose/exposure/frequency reduced?', 'Product', 'If yes, did the AE resolve or improve?', '(continued)', 'If yes, this is a positive dechallenge. If no, this is a negative dechallenge.', '(Note: This criterion is not applicable if: (1) the AE resulted in death or permanent disability; (2) the AE resolved/improved despite continuation', 'of', ""the Supporter's product; or (3) the trial is a single-dose drug trial); or (4) Supporter's product(s) is/are only used one time.)"", 'Rechallenge', 'Was the participant re-exposed to Merk product in this study?', 'If yes, did the AE recur or worsen?', 'If yes, this is a positive rechallenge. If no, this is a negative rechallenge.', '(Note: This criterion is not applicable if: (1) the initial AE resulted in death or permanent disability, or (2) the trial is a single-dose drug trial); or', ""(3) Supporter's product(s) is/are used only one time)."", 'NOTE: IF A RECHALLENGE IS PLANNED FOR AN ADVERSE EVENT WHICH WAS SERIOUS AND WHICH MAY HAVE BEEN', 'CAUSED BY MERCK PRODUCT, OR IF REEXPOSURE TO MERCK PRODUCT POSES ADDITIONAL POTENTIAL SIGNIFICANT RISK', 'TO THE PARTICIPANT, THEN THE RECHALLENGE MUST BE INFORMED IN ADVANCE BY THE SUPPORTER AS PER DOSE', 'MODIFICATION GUIDELINES IN THE PROTOCOL.', 'Consistency', 'Is the clinical/pathological presentation of the AE consistent with previous knowledge regarding Merk product or drug class pharmacology or', 'with Trial', 'toxicology?', 'Treatment', 'Profile', 'The assessment of relationship will be reported on the case report forms /worksheets by an investigator who is a qualified physician according to his/her best clinical judgment, including', 'consideration of the above elements.', 'Record one of the following', 'Use the following scale of criteria as guidance (not all criteria must be present to be indicative of Merck product relationship).', '63']"
63,page_64,"['Yes, there is a reasonable', 'There is evidence of exposure to Merk product. The temporal sequence of the AE onset relative to the administration of Merk product is', 'possibility of Merck product', 'reasonable. The AE is more likely explained by Merk product than by another cause.', 'relationship.', 'No, there is not a reasonable', 'Participant did not receive the Merk product OR temporal sequence of the AE onset relative to administration of Merk product is not reasonable', 'possibility of Merck product', 'OR the AE is more likely explained by another cause than the Merk product. (Also entered for a participant with overdose without an associated', 'relationship', 'AE.)', '64']"
64,page_65,"['8.0 STATISTICAL ANALYSIS PLAN', '8.1 Statistical Analysis Plan Summary', 'The primary outcome is objective response rate (complete and partial responses) at week 12', ""after the administration of lenvatinib and pembrolizumab. The Simon's two-stage design will"", 'be adopted for a possible early termination for futility. The null hypothesis that the true', 'response is 5% will be tested against a one-sided alternative. In the first stage, 9 patients will', 'be accrued, and if there is no responses among them, the study will be stopped for futility.', 'Otherwise, additional 8 patients will be accrued for a total of 17 patients (This does not', 'include screen failures and in-evaluable patients). The null hypothesis will be rejected if there', 'are 3 or more responses in 17 patients. The design yields a type I error rate of 0.05 and power', 'of 80% when the true response rate is 25%. The final response rate will be estimated with', '95% confidence interval by binomial test. The power calculation was from web-base', 'calculation developed by UNC Lineberger Comprehensive Cancer Center [36].', 'For the secondary objectives, the safety profile of the treatment will be documented and', 'summarized by summary statistics as frequency and percentage for each AE. Disease free', 'survival (DFS), which was defined as the interval between time of surgery and the first tumor', 'recurrence, or death. For overall survival, death from any cause will be defined as the event.', 'Patients will be censored at time of last follow-up. OS and DFS will be estimated with the', 'Kaplan-Meier method. The DFS and OS of each patient group at specific time points such as', '6 months, 1 year, 3 years, etc. and will be also estimated alone with 95% CI.', 'For the exploratory endpoint, paired t-test or Wilcoxon singed-rank test will be used to', 'compare the biomarkers change before, during, and after treatment. Summary statistics will', 'be applied to all items in the measurements for quality of life, frailty, and degree of', 'sarcopenia.', '9.0 LABELING, PACKAGING, STORAGE AND RETURN OF CLINICAL', 'SUPPLIES', '9.1', 'Investigational Product', 'The investigator shall take responsibility for and shall take all steps to maintain appropriate', 'records and ensure appropriate supply, storage, handling, distribution and usage of', 'investigational product in accordance with the protocol and any applicable laws and', 'regulations.', 'Pembrolizumab and lenvatinib will be provided by Merk as summarized in Table 11.', 'Table 11. Product Descriptions', '65']"
